pathway	pval	padj	ES	NES	nMoreExtreme	size	leadingEdge
GO_REGULATION_OF_INTERFERON_BETA_PRODUCTION	0.114111575762968	0.67116199722541	0.420847511320713	1.34114451340586	5129	20	REL RIPK2 IFNAR1 RELB PPM1B IRF1 TRAF3
GO_DNA_TEMPLATED_TRANSCRIPTION_ELONGATION	0.903221205277547	0.971695030217519	0.18290422881334	0.754206218697463	37993	57	CCNK CCNT1 POLR2B ADRM1 CDC73 TCEA1 PAF1 POLR2D POLR1C TCEB3 TAF3 POLR2A LEO1 POLR2K RTF1 UBTF
GO_RESPONSE_TO_NITROGEN_COMPOUND	0.832935838520156	0.952425469756396	0.168417774999064	0.881731188591034	28637	242	SRRT HSP90B1 CTNNB1 NR4A2 UBR1 DDX21 RIPK2 PTGER4 HMGCS1 BTG2 KLF6 NFKBIA PIK3CG ADSS PPP1R15A RAB8A UFL1 EIF4EBP1 CALM2 CRY1 MUL1 ARHGEF2 SIN3A SIRT2 NFKB1 DIAPH1 GFPT1 CDKN1A BIRC2 PHIP NR4A3 MTOR PTK2B DHX36 APRT LPIN1 PER1 CREM CDKN1B EZR PIK3C3 AKAP7 ATP6V0D1 BRAF JUND XBP1 FYN ATP2B4 LDHA GNB1 ATP6V0C
GO_NEGATIVE_REGULATION_OF_TRANSMEMBRANE_TRANSPORT	0.785636856368564	0.937841251438535	-0.24315101694947	-0.784374824735988	43484	24	SLC9A3R1 CAMK2D FKBP1A CALM3 OAZ1 GRK6 IRS2 CRBN
GO_REGULATION_OF_DNA_RECOMBINATION	0.358755827505828	0.798400995526206	-0.353150756320263	-1.07250791449836	19699	19	KPNA1 IL7R TBX21
GO_REGULATION_OF_LEUKOCYTE_PROLIFERATION	0.729247882779944	0.917880464508981	-0.206069325101191	-0.865773965172238	43398	81	CARD11 PYCARD AIF1 RASAL3 CEBPB FLT3LG HLA-DPB1 PTPRC PTPN6 CD81 CD55 TNFRSF14 TMIGD2 CCL5 IRS2 HLA-DPA1 CD59 SYK DHPS CD38 CORO1A GLMN PELI1 PRKCQ C10orf54 SPN TICAM1 HLA-DRB1 VAV3
GO_RESPONSE_TO_ETHANOL	0.938557121988137	0.98178115867226	-0.18710884773908	-0.678604088607018	53325	39	CAT G6PD GSN UROD PEMT CCL5 ADCY7 CTSB RPS6KB1 ATP5G3 EEF2 DNMT1 USP46 SDF4
GO_SULFUR_COMPOUND_METABOLIC_PROCESS	0.00166913946587537	0.136591246290801	-0.402575202721414	-1.68332729909508	98	79	ACSL5 AKR1A1 HEXA ETHE1 THEM4 EIF2B1 ACSS1 OGDH TXNL1 MPST CLIC1 G6PD ACOT7 AMD1 ENOPH1 GPX1 GSTK1 AHCY CLIC3 B4GALT4 PEMT ST3GAL1 ELOVL5 MAT2B SUCLA2 ISCA1 PAPSS1 B3GAT3 CHST11 STAT5A DNMT1 PPT1
GO_POSITIVE_REGULATION_OF_DNA_REPLICATION	0.120315757586557	0.67116199722541	-0.379987568929561	-1.30630596014852	6751	31	AREG ATR SHC1 STOML2 ACD CCT5
GO_NEGATIVE_REGULATION_OF_NEURON_APOPTOTIC_PROCESS	0.347628657921292	0.796082189130783	0.290962629792162	1.06573477965584	15157	34	MECP2 HYOU1 NR4A2 KRAS BTG2 NR4A3 PTK2B BRAF FYN OXR1 AMBRA1 ROCK1 HIF1A
GO_NUCLEOTIDE_PHOSPHORYLATION	0.226159581856062	0.759901998372426	-0.400833555918002	-1.19907008969463	12374	18	HK1 OGDH PFKFB3 NME3
GO_POSITIVE_REGULATION_OF_GENE_EXPRESSION_EPIGENETIC	0.548435612879703	0.869608683585634	0.263179326609941	0.941694574309983	24066	31	ATAD2 CTNNB1 DDX21 SMARCD1 POLR1C H3F3A
GO_REGULATION_OF_MRNA_METABOLIC_PROCESS	0.118852860501567	0.67116199722541	0.280210311271337	1.22999440159171	4852	78	DAZAP1 RBM8A SRSF2 CCNT1 RBM25 JMJD6 BTG2 SFSWAP YTHDC1 THRAP3 C1QBP SRSF4 CDC73 SRSF7 ZC3H12A PAF1 SF3A1 PABPC1 GTPBP1
GO_POSITIVE_REGULATION_OF_PROTEIN_BINDING	0.197837779496681	0.744925994883976	-0.369413905255377	-1.21599765221262	10997	26	TMEM173 MFNG KRIT1 FKBP1A PARK7 RAN GSK3B FLOT1 CRBN MAPRE1 PACS1 TICAM1
GO_SENSORY_PERCEPTION	0.361289651946432	0.798400995526206	-0.270410789321228	-1.05570346224893	20853	55	SLC9A3R1 FAM65B P2RX4 ARRB2 WDR1 DRAM2 HPS1 PDE6G TRPV2 UNC119 PLCB2 GPX1
GO_HEPATICOBILIARY_SYSTEM_DEVELOPMENT	0.617011938202247	0.890228612804042	-0.244735573729671	-0.906624157866889	35144	43	SP3 IGF2R CEBPB UCP2 MPST DDX39B
GO_FATTY_ACID_CATABOLIC_PROCESS	0.811367181492629	0.94802168638716	0.251588060371092	0.752027906377011	36930	16	LPIN2 CPT1A LPIN1 ECH1
GO_MITOCHONDRIAL_RESPIRATORY_CHAIN_COMPLEX_I_BIOGENESIS	0.0733101610882721	0.627095628821283	-0.383478451096726	-1.37468646699125	4154	37	TAZ NDUFB5 NDUFS7 NDUFB3 OXA1L NDUFS3 NDUFB10 NDUFB7 NDUFS2 NDUFAF4 NDUFA13 NDUFS4 NDUFS8 NDUFA10 TMEM126B NDUFA3 NDUFA11 NDUFS6 NDUFV1 NDUFA5
GO_CARBOHYDRATE_TRANSPORT	0.862853572019335	0.959377499686353	-0.24723269788779	-0.702677347503458	46946	15	HK1 FABP5
GO_REGULATION_OF_CELLULAR_RESPONSE_TO_GROWTH_FACTOR_STIMULUS	0.330392734992334	0.786222381464543	0.26710268069746	1.06915449567549	14006	50	UBC CTNNB1 ITGA5 STRAP SMAD7 TGFBR3 HSPA5 CTDSPL2 TGFB1 GATA3 SDCBP UBB RBPJ RPS27A ADAM17 THBS1 LEMD3 HIF1A
GO_EMBRYO_DEVELOPMENT_ENDING_IN_BIRTH_OR_EGG_HATCHING	0.453199504728786	0.844161444695881	0.206597130682085	0.999016989515662	17202	137	RIC8A CTNNB1 ZEB2 DNAJB6 EPN1 STK4 PRDM1 NCOA1 PSMC3 CNOT2 LUZP1 RARA ANKRD11 TAF8 SIN3A SOX4 EIF4A3 UBE2B TCF7 ADD1 GATA3 MED21 SENP2 UBE2A RPL7L1 RBPJ SYF2 PRPF19 AMBRA1 AXIN1 RTF1 ZNF335 KDM6A RRN3 CUL3 RCN1 HIF1A ZFAND5 VASP CHD8 SMARCB1 SKIL GAB1 SEC24B MAFF GNAS ECE1 NIPBL
GO_ANTIGEN_PROCESSING_AND_PRESENTATION_OF_PEPTIDE_OR_POLYSACCHARIDE_ANTIGEN_VIA_MHC_CLASS_II	0.011621819704743	0.335732526558495	-0.421065928995412	-1.59062404895934	665	47	AP1M1 KIFAP3 DYNC1H1 HLA-DPB1 AP1S2 HLA-DQB1 AP2B1 KIF22 SEC31A CTSD KIF2A AP2S1 CLTA HLA-DMA ACTR1B AP2A1 HLA-DPA1 DCTN2 DCTN1 CANX AP1B1 RAB7A FCER1G HLA-DRB1 DYNLL1
GO_RESPONSE_TO_IONIZING_RADIATION	0.884738192033221	0.968538279533792	-0.197348445827659	-0.742433484575272	50706	46	ITGB1 ATR KAT5 ERCC1 TMEM109 BAX
GO_EPITHELIUM_DEVELOPMENT	0.466369953931444	0.845761401946154	-0.207671288368552	-0.995315348087344	29863	192	SLC9A3R1 GRSF1 AREG HDAC1 TXNIP RBM15 CAT KLF2 CEBPB TBC1D20 FABP5 RAP2C ORAI1 EPHA4 MAP2K2 S1PR1 NUP133 NF2 ID2 CREB1 BAX CXCR4 MAP2K1 NUMB JAG1 SHARPIN ARID1A IQGAP1 LATS1 GPX1 HPS4 GSTK1 PRKACB PPP1CA SMAD5 JAK2 RGS19
GO_INTRINSIC_APOPTOTIC_SIGNALING_PATHWAY_IN_RESPONSE_TO_DNA_DAMAGE_BY_P53_CLASS_MEDIATOR	0.622428191245297	0.892038067429775	-0.304652310762736	-0.881972002636955	33912	16	PYCARD TMEM109 SHISA5 IFI16 PMAIP1
GO_REGULATION_OF_AUTOPHAGY	0.771424877165762	0.933547019659872	0.185220100465047	0.874253300287714	29830	118	TAB2 U2AF1 MAPK8 KDM4A SREBF2 RIPK2 WBP11 HERC1 BNIP3L WDR75 SQSTM1 SIRT2 ZC3H12A UVRAG MTOR RAB3GAP1 SVIP UBQLN1 EXOC7 ATP6V0D1 VMP1 XBP1 ATP6V0C PIP4K2A AMBRA1 FOXO1 NRBF2 CTSA PLEKHF1 ITPR1 HIF1A ATP6V1E1 ATG14
GO_PHOSPHOLIPID_METABOLIC_PROCESS	0.254407611875747	0.769493765572321	0.23769165750822	1.09944564603813	9999	104	MECP2 MTMR6 GNPAT SACM1L LPIN2 PNPLA8 IDI1 ABHD3 PIGT DPM1 PAFAH1B1 VAV1 PIK3CG MPPE1 AGPAT6 PLAA LPIN1 PIK3C3 FAR1 TMEM55B SMPD4 MVD FYN
GO_AMMONIUM_ION_METABOLIC_PROCESS	0.0300416281221092	0.500669746207104	0.399154555170355	1.50204507065515	1298	38	MECP2 SAT1 LPIN2 PNPLA8 NR4A2 ABHD3 PAFAH1B1 AZIN1 CPT1A SRM AGPAT6 LPIN1
GO_REGULATION_OF_FAT_CELL_DIFFERENTIATION	0.200311927849732	0.749547361095186	0.348040909444348	1.20279782366883	8861	27	ARNTL INSIG1 METRNL STK4 TAF8 SIRT2 ZC3H12A MTOR TGFB1 GATA3 XBP1 AXIN1 FOXO1
GO_REGULATION_OF_RNA_STABILITY	0.113842824429402	0.67116199722541	0.268675832827494	1.22287124324943	4523	95	EXOSC7 UBC PSMD1 EXOSC9 HNRNPA0 TARDBP PSMD11 ANP32A PSMC1 DCP2 THRAP3 DIS3 CNOT6L ZC3H12A PSMA7 MTOR EIF4G1 PABPC1 PSMD7 ANGEL2 PSMB3 UBB PSMA6 PSMA3 RPS27A PSMD13 TNFRSF1B SERBP1 PSMD5 HNRNPC PSME4
GO_NEGATIVE_REGULATION_OF_CELL_DEVELOPMENT	0.469974399609899	0.845761401946154	0.228717555454803	0.990699856237448	19275	73	MECP2 CTNNB1 VIM STRAP SMAD7 DYNLT1 ZNF706 PAFAH1B1 C3orf17 ARHGEF2 SIRT2 ATF5 STAP1 B2M TGFB1
GO_CELLULAR_PROTEIN_COMPLEX_DISASSEMBLY	0.543930419389978	0.868626304421155	-0.233529256517248	-0.953543505287441	31956	69	MRPL18 VPS4A MRPL55 MRPL51 MRPL11 MRPL41 MRPL28 MRPL48 MRPL40 MRPL54 MRPL42 MRPL44 MRPL9 HSPA8 MRPL52 AURKAIP1 MRPS34 MRPS30
GO_BODY_MORPHOGENESIS	0.321506250411934	0.783811166595132	0.368769251729574	1.10229701642182	14633	16	TIPARP ANKRD11 CSRNP1 RAB3GAP1 TGFB1 BRAF
GO_SOMATIC_STEM_CELL_POPULATION_MAINTENANCE	0.194607798787659	0.742081541480148	-0.388178466148203	-1.22552580705975	10754	22	ZFP36L2 POLR2F POLR2J RAF1 POLR2G POLR2L POLR2H
GO_CYTOPLASMIC_MICROTUBULE_ORGANIZATION	0.343830050348909	0.796082189130783	0.349265247546183	1.0812616048202	15569	18	SLK CRIPT PAFAH1B1 EZR SLAIN2 AXIN1 RAB11A KATNA1
GO_NEGATIVE_REGULATION_OF_PEPTIDYL_TYROSINE_PHOSPHORYLATION	0.109314490226668	0.67116199722541	-0.471072648025535	-1.36376082533687	5955	16	SEMA4D ZGPAT PTPN6 NF2 SH3BP5 PPP2R1A SOCS1 IBTK
GO_NUCLEOSIDE_DIPHOSPHATE_METABOLIC_PROCESS	0.0397539129648059	0.519126895364886	-0.479699980960252	-1.51447016663828	2196	22	CARD11 HK1 OGDH NUDT5 PFKFB3 NME3
GO_RESPONSE_TO_AMMONIUM_ION	0.442794390633902	0.841676245010142	-0.355895772432692	-1.0115162739283	24091	15	RGS10 AIF1 GNAI2 GSK3B CCL5
GO_NEGATIVE_REGULATION_OF_PROTEOLYSIS	0.586930045546306	0.884909173082436	-0.218983791617024	-0.935645031166599	35179	89	SERPINB1 IGBP1 PSMF1 CST3 GLG1 ARRB2 BAG5 RAF1 CD55 GPX1 PARK7 TAF9 PICALM WAC ZNF207 TRIM21 IFI16 APLP2 TIMP1 RPS6KA3 CD59
GO_METENCEPHALON_DEVELOPMENT	0.240574184142649	0.769493765572321	0.352373506891171	1.16650912798075	10725	23	MECP2 GNPAT NCOA1 NR2C2 HERC1 HSPA5
GO_NEGATIVE_REGULATION_OF_PROTEIN_MODIFICATION_BY_SMALL_PROTEIN_CONJUGATION_OR_REMOVAL	0.355540024461473	0.797167808005967	0.232362683951201	1.04540154280507	14243	89	TRIP12 UBC CTNNB1 PSMC3 SMAD7 PSMD11 PSMC1 UFL1 CRY1 SOX4 CDC27 PSMA7 MTOR SENP2 PSMD7 PSMB3 UBB PSMA6 PSMA3 FYN RPS27A PSMD13 PSMD5 DNAJA1 UBR5 BUB3
GO_AMINO_ACID_ACTIVATION	0.379432304166591	0.807897924309611	-0.330490749861231	-1.0558182447564	21026	23	PPA1 NARS HARS IARS2 QARS TARSL2 EPRS RARS LARS LRRC47 GARS
GO_REGULATION_OF_PROTEASOMAL_UBIQUITIN_DEPENDENT_PROTEIN_CATABOLIC_PROCESS	0.914318290109591	0.971858153865664	-0.18154481969673	-0.74478932346398	53728	71	TRIB2 RNF138 ANAPC10 BAG5 NSMCE2 GOLGA2 STUB1 PARK7 CHFR TAF9 WAC RNF125 GSK3B ANKIB1 ZNF207
GO_NEGATIVE_REGULATION_OF_NEURON_DIFFERENTIATION	0.152208146696529	0.69845046755136	-0.333401219346961	-1.24164927527929	8698	44	LGALS1 ITGB1 SEMA4D EPHA4 BAG5 ID2 EIF4E JAG1 ARHGEF1 CTDSP1 GSK3B DGUOK RHOA RNF6 EIF2AK4 MBP GAK IFRD1 YWHAH CERS2 PLK2 RAP1GAP2
GO_MUSCLE_TISSUE_DEVELOPMENT	0.252990801201087	0.769493765572321	0.27122375730014	1.12239956022901	10615	58	MEF2D LMNA ATF3 NDUFV2 EMD SMAD7 KDM6B RARA TIPARP BTG2 TGFBR3
GO_POSITIVE_REGULATION_OF_ADAPTIVE_IMMUNE_RESPONSE	0.108044574037657	0.67116199722541	0.385294766722369	1.33154377634666	4779	27	SASH3 IL27RA RIPK2 IL6ST B2M TGFB1 GATA3 HLA-B MALT1 HLA-A XCL1 NCR3 ANXA1 TNF
GO_REGULATION_OF_OSTEOCLAST_DIFFERENTIATION	0.864168150274316	0.959535417875824	-0.232367934298108	-0.715295093389904	47568	20	CEBPB CCL3 CREB1 NF1 CCL5
GO_REGULATION_OF_PROTEIN_BINDING	0.233511371467953	0.763451464256652	-0.290145022554231	-1.14594850559302	13552	58	TMEM173 ANXA2 MFNG KRIT1 FKBP1A BAX GOLGA2 STUB1 PARK7 TFIP11 PPP1CA RAN AES BTBD1 GSK3B FLOT1 ITGA4
GO_CARDIAC_SEPTUM_DEVELOPMENT	0.272701174807879	0.769493765572321	0.370310927184186	1.14641519653822	12348	18	PRDM1 SMAD7 RARA DHRS3 NOTCH2 SOX4 GATA3
GO_REGULATION_OF_HISTONE_METHYLATION	0.119322762698199	0.67116199722541	0.394246207626379	1.32175840942998	5327	24	MECP2 CTNNB1 KDM4A PAF1 GATA3 XBP1 RTF1 ZNF335 SMARCB1 CHTOP SUPT6H SNW1 MTF2
GO_COGNITION	0.224775154581225	0.759901998372426	0.291301077268414	1.15105295674918	9596	47	MECP2 RIC8A ITGA5 KRAS BTG2 PAFAH1B1 HTT PRNP EIF4A3 MTOR MAGT1 BRAF UBA6 FYN
GO_AXIS_SPECIFICATION	0.39293312569912	0.818261454913316	0.356080119586894	1.04472079700461	17914	15	CTNNB1 SENP2 AXIN1 KDM6A
GO_PHOSPHATIDYLINOSITOL_METABOLIC_PROCESS	0.601643435675269	0.885860566492316	0.23095613585219	0.920554197820232	25552	49	MTMR6 SACM1L PIGT DPM1 VAV1 PIK3CG MPPE1
GO_CELL_PART_MORPHOGENESIS	0.268604726870239	0.769493765572321	-0.24485348614425	-1.09894860705295	16501	120	DBNL BBIP1 DICER1 ITGB1 EVL IFT43 FEZ2 TMEM216 SNAP29 EPHA4 OFD1 CREB1 FOPNL CPNE1 BAX NUMB NCAM1 GSN PANK2 IQGAP1 DNM1L PACSIN1 AFG3L2 GSK3B FLOT1 SPTBN1 SEPT2 E2F4 ACTR3 PTPN11 PTPRA SCLT1 TROVE2 AHI1 KIF20B NDEL1 EIF2AK4 SPTAN1 MAPK8IP3 ANKRD27
GO_RESPONSE_TO_ORGANOPHOSPHORUS	0.399332388312223	0.820456919836156	0.283447985535478	1.03066754361456	17465	33	HSP90B1 PIK3CG BIRC2 PTK2B PER1 CREM EZR AKAP7 BRAF JUND LDHA RAP1A FOS PDE4D
GO_AXO_DENDRITIC_TRANSPORT	0.25343802776742	0.769493765572321	0.399481586209065	1.17205847273131	11554	15	OPA1 PAFAH1B1 AP3M1 RAB21
GO_SINGLE_ORGANISM_MEMBRANE_FUSION	0.780723314606742	0.935420076798219	-0.219358560326226	-0.812614884693191	44469	43	VPS4A STOML2 NSF SNAP29 VAMP8 BAX VTI1A VAMP5 VCPIP1 STX4 AFG3L2 VAMP2
GO_REGULATION_OF_PROTEIN_UBIQUITINATION_INVOLVED_IN_UBIQUITIN_DEPENDENT_PROTEIN_CATABOLIC_PROCESS	0.48239521535716	0.849972566856721	0.231650263152294	0.983934467897907	20002	66	UBC PSMD1 PSMC3 RNF139 PSMD11 PSMC1 UBE3A CDC27 PSMA7 PTK2B PSMD7 PSMB3 UBB PSMA6 PSMA3 RPS27A PSMD13 PSMD5 BUB3 AXIN1 PSME4
GO_REGULATION_OF_TYROSINE_PHOSPHORYLATION_OF_STAT_PROTEIN	0.679031905594406	0.897581167929844	-0.280005372953793	-0.850367649567392	37286	19	NF2 JAK2 HCLS1 CCL5 PPP2R1A SOCS1 SOCS3 PIBF1
GO_ORGAN_REGENERATION	0.213163117524004	0.753975842513492	-0.356348494372555	-1.19529243854827	11921	28	IGF2R ATIC SHC1 CEBPB UCP2
GO_GLAND_MORPHOGENESIS	0.0947001822545428	0.67116199722541	-0.429246608641623	-1.37131342131038	5247	23	SLC9A3R1 AREG CAPN1 CEBPB
GO_RIBOSOME_BIOGENESIS	0.0845359680284192	0.668043684602367	0.237992591589475	1.20423059181873	3045	186	EXOSC7 NOL9 DDX21 NOP58 EXOSC10 EXOSC9 NOL8 WBP11 TSR1 WDR75 NOC2L RPL34 FBL DIS3 RPL10 C1QBP EIF4A3 DHX30 NOLC1 RPP38 ABT1 TRMT112 RPP30 RPS4X RPS8 TSR2 RPL7A IMP4 LSM6 RPL7L1 LTV1 DCAF13 RPS27A RIOK1 BMS1 RBFA RPL12 EIF2A FASTKD2 MPHOSPH10 ABCF1 ERI3 RPF1 SKIV2L2 RPS6 RRN3 RPS3A RPL5 RPS5 NAF1 RPL4 RPL35 GNL3 RPS14 RPL37A MTERFD2 RPS23 DDX3X WBSCR22 WDR43 RPL32 RPL11 RIOK3 RPL21 NPM1 RPS15A RPL9 DKC1 MRPL10 NHP2L1 RPLP1 RPS9 RPS10 GNL2 RPL23A RPL23 RPL3 RPL6 RPS28 RPS16
GO_IRE1_MEDIATED_UNFOLDED_PROTEIN_RESPONSE	0.268163051164488	0.769493765572321	0.313050549883029	1.12923596329877	11755	32	LMNA HYOU1 HSPA5 GFPT1 ADD1 ATP6V0D1 SEC61B XBP1 SEC61G DNAJB11 TSPYL2 HDGF
GO_SINGLE_ORGANISM_BEHAVIOR	0.371517771373679	0.803992407643754	0.246721947790082	1.04160929331697	15469	64	MECP2 RIC8A ITGA5 NR4A2 KRAS BTG2 PAFAH1B1 HTT PRNP NR4A3 EIF4A3 MTOR EIF4G1 APRT BRAF UBA6 FYN OXR1 NCOA2 THBS1 FOS MBD5 HIF1A HPRT1
GO_POSITIVE_REGULATION_OF_ENDOCYTOSIS	0.215321496781495	0.753975842513492	-0.332063325674032	-1.18232026004525	12175	36	ITGB1 PYCARD ARRB2 TBC1D5 FLOT1 ACTN4 PLCG2 AHI1 CBLL1 CD63 SYK CD47 PPT1 DOCK2 FCER1G VPS28 NCKAP1L SERPINE1
GO_MRNA_SPLICE_SITE_SELECTION	0.52231070379927	0.865592788704611	0.298331269256102	0.950713344328943	23480	20	CELF1 SFSWAP YTHDC1 SETX SF3A1 SLU7 SF3A2 SRSF6
GO_LYSOSOMAL_TRANSPORT	0.114633761905834	0.67116199722541	0.386703354382379	1.32422401969139	5090	26	GCC2 MGRN1 HMGXB4 GNPTAB DENND3 LAMP1
GO_POSITIVE_REGULATION_OF_DNA_BIOSYNTHETIC_PROCESS	0.541704661266964	0.868626304421155	-0.281269436836035	-0.943456297287885	30296	28	ATR ARRB2 ACD CCT5 DDX39B
GO_REGULATION_OF_CALCIUM_MEDIATED_SIGNALING	0.638403185021789	0.892719872915756	-0.265950182012793	-0.883614269426517	35597	27	P2RX4 CAMK2D CCL3 FKBP1A CALM3 CCL4
GO_REGULATION_OF_ALPHA_BETA_T_CELL_ACTIVATION	0.462298230371759	0.844862093710877	0.272660602731906	0.991442691424543	20219	33	SASH3 RIPK2 RARA IRF1 CD83 GATA3 CD300A HLA-A XCL1
GO_MUSCLE_ORGAN_DEVELOPMENT	0.650547014995756	0.892719872915756	0.221927838315769	0.896776804873856	27590	52	MEF2D LMNA ATF3 EMD SMAD7 BTG2 TGFBR3
GO_POSITIVE_REGULATION_OF_HEMOPOIESIS	0.349435758686234	0.796082189130783	-0.263185208223099	-1.06220464935221	20405	65	LGALS1 PDCD2 IL7R SMAP1 AP3B1 FLT3LG AP3D1 ID2 ACIN1 CREB1 JAG1 ZBTB1 HAX1
GO_LEUKOCYTE_DEGRANULATION	0.270392384795912	0.769493765572321	0.393339126019286	1.15403680976265	12327	15	LAT2 LAT PIK3CG RASGRP1 NR4A3
GO_MYELOID_CELL_HOMEOSTASIS	0.181429551571873	0.722675371902946	-0.330234575716563	-1.21037954756258	10312	41	SP3 KLF2 G6PD ID2 ACIN1 BAX DNASE2 SMAD5 JAK2 HCLS1 PRDX1 ATPIF1 SLC25A38 IKZF1
GO_REGULATION_OF_BLOOD_PRESSURE	0.00202348690153568	0.14730428521557	-0.571290207370571	-1.84291088682882	111	24	SOD2 P2RX4 RNPEP LNPEP PRCP SCPEP1 ID2 WNK1 ADH5
GO_REGULATION_OF_CYTOKINE_PRODUCTION	0.311121257954967	0.7793700762235	0.202895520232094	1.05020214344363	10901	220	REL NFKB2 UBC CTNNB1 SASH3 CRTAM CYLD IL27RA LSM14A RIPK2 PTGER4 RARA IFNAR1 SRGN RELB IRF8 PPM1B LITAF BCL3 MUL1 IL6ST IRF1 ARHGEF2 PCBP2 CD83 NFKB1 C1QBP RASGRP1 CD46 PRNP TRAF3 RIPK1 BIRC2 NR4A3 ZC3H12A MAP2K3 B2M DHX36 OTUD5 TGFB1 POLR1C PER1 GATA3 HLA-B EZR
GO_REGULATION_OF_ERBB_SIGNALING_PATHWAY	0.852554172675961	0.955589264384171	-0.216406636063388	-0.749128117881978	47881	32	SHC1 ZGPAT PDE6G AP2B1 SHKBP1 AP2S1 CLTA FBXW7
GO_CHEMICAL_HOMEOSTASIS	0.361818833465788	0.798400995526206	-0.216787211977134	-1.03999925752816	23218	193	SLC9A3R1 SOD2 CCDC109B LGALS1 HK1 ITGB1 RAP1GDS1 ABCA2 EIF2AK1 CAMK2D PRKCB ABCG1 STOML2 UCP2 TBC1D20 PRCP CD52 TRPM7 ANXA6 CCL3 PTPRC S1PR1 LAMTOR1 RAF1 CD55 BAX CXCR4 SLC9A8 TCIRG1 PRKACB STIM2 JAK2 FBXW7 PICALM ATP1A1 RASA3 USF1 SLC39A6 ATOX1 MT2A CCL5 ADCY7 IRS2 PTPN11 SLC30A5 S1PR4 CYB5R4 SLC39A8 PLCG2 IBTK
GO_REGULATION_OF_MICROTUBULE_BASED_PROCESS	0.57739672382476	0.879084075117497	-0.219546527823255	-0.94106205783584	34648	91	IGBP1 HDAC3 XPO1 CHMP2A TBCD PDCD6IP NCOR1 DYNC1H1 CLASP1 OFD1 MYH9 GOLGA2 KIF2A CHD4 RAN BECN1 GSK3B ZNF207 RHOA DCTN2 PPP2R1A
GO_NEGATIVE_REGULATION_OF_TRANSPORTER_ACTIVITY	0.401697209115183	0.820456919836156	-0.353545927144916	-1.04116449969644	21963	17	SLC9A3R1 CAMK2D FKBP1A CALM3 GRK6
GO_ENDOSOME_ORGANIZATION	0.312318466116645	0.7793700762235	-0.320357496618585	-1.10131209920894	17526	31	SNF8 CHMP2A VPS4A PDCD6IP VPS36 LAMTOR1
GO_REGULATION_OF_WOUND_HEALING	0.917781856412267	0.973750377720849	-0.200428055962288	-0.689023498379368	51504	31	ANXA2 CLASP1 GSN USF1 SYK TGFBR2 PRKCQ FCER1G SERPINE1 UBASH3B PLEK HOPX CLASP2 HMGB1
GO_REGULATION_OF_MAPK_CASCADE	0.0848017101809208	0.668043684602367	-0.259683518757906	-1.23273056229515	5394	178	SLC9A3R1 TRIB2 DBNL IGBP1 HDAC3 SNF8 ITGB1 PYCARD LAMTOR2 TAOK1 MAPKAPK3 SHC1 CAMK2D COPS5 NCOR1 ARRB2 CCL3 GPS1 EPHA4 MAP2K2 MBIP PTPN6 NF2 PDE6G LAMTOR1 RAF1 CDK5RAP3 CD81 MAP4K1 CXCR4 MAP2K1 CCL4 MADD TNFRSF14 IRAK3 GNAI2 JAK2 FBXW7 PRDX1 EIF2AK2 GSK3B PHB2 PHB ZNF622 ERP29 NF1 CCL5
GO_MYELOID_LEUKOCYTE_MIGRATION	0.931091204920524	0.979765011861285	-0.197803135163028	-0.66348699521745	52074	28	PREX1 CKLF CCL3
GO_POSITIVE_REGULATION_OF_NEURON_DEATH	0.691011134895936	0.903318602859171	-0.258021580638964	-0.849328170417061	38413	26	CCL3 BAX IKBKB FBXW7 PICALM GSK3B NF1 PMAIP1
GO_RESPONSE_TO_ESTRADIOL	0.690243168829967	0.902795407286931	0.227872357074491	0.868529758857473	29832	40	MECP2 CTNNB1 AHR NCOA1 RARA NRIP1 TGFB1 CDKN1B BID CALR ANXA1 HIF1A PRDM2 H2AFZ
GO_CARTILAGE_DEVELOPMENT	0.249131912716108	0.769493765572321	-0.392312467941412	-1.17357975443319	13631	18	SNX19 RUNX2 EIF2AK3
GO_REGULATION_OF_TUMOR_NECROSIS_FACTOR_SUPERFAMILY_CYTOKINE_PRODUCTION	0.461719997223572	0.844862093710877	0.260086437015944	0.991312914491482	19955	40	SASH3 RIPK2 PTGER4 RARA BCL3 ARHGEF2 RASGRP1 RIPK1 ZC3H12A
GO_REGULATION_OF_PHOSPHATIDYLINOSITOL_3_KINASE_SIGNALING	0.185183871768502	0.729737408012317	-0.345962468620409	-1.21541328787219	10443	34	SLC9A3R1 SEMA4D CAT PTPN6 FGR HAX1 JAK2 HCLS1 BECN1 CCL5 IRS2 PTPN11
GO_CELLULAR_RESPONSE_TO_INTERLEUKIN_1	0.337896422082711	0.79289826192131	-0.330181094332126	-1.08685523149244	18783	26	PYCARD KLF2 CEBPB CCL3 IKBKB CCL4 IRAK3
GO_CIRCULATORY_SYSTEM_PROCESS	0.00325200454248254	0.169865829994235	-0.426080318378362	-1.68880670721989	188	59	FLI1 SOD2 P2RX4 RNPEP TAZ SHC1 CAMK2D ATG5 LNPEP PRCP SCPEP1 ID2 CXCR4 WNK1 ADH5 GPX1 DNM1L SMAD5 ATP1A1
GO_CELL_CHEMOTAXIS	0.523332162921348	0.865592788704611	-0.258983685222954	-0.959406358210432	29808	43	PREX1 CKLF ARRB2 CCL3 CXCR4 CCL4 NR4A1 CCL5 ITGB2 BIN2 SYK SBDS CORO1A PRKCQ ADAM8 FCER1G VAV3 NCKAP1L
GO_DNA_TEMPLATED_TRANSCRIPTION_TERMINATION	0.842774408005209	0.954004782951153	-0.196927302989526	-0.792626795348384	49185	64	SRSF9 PCF11 POLR2F LSM10 PABPN1 THOC7 DDX39B TBP SNRPD3 POLR2L XRN2 POLR2H TTF1 DDX39A
GO_PROTEIN_HOMOTETRAMERIZATION	0.169232158988257	0.713857302948746	-0.388814605263823	-1.2542673754146	9366	24	HM13 SOD2 CAT EVL GOLGA2 DNM1L GBP5 ATPIF1 DCXR DECR1 DHPS
GO_VESICLE_LOCALIZATION	0.708859813084112	0.91161723716529	0.197977274568793	0.887142593866715	28442	87	CTNNB1 NDE1 TRAPPC3 YKT6 TFG TRAPPC6A PAFAH1B1 PIK3CG STX11 HTT SYTL2 PPP6C RASGRP1 SEC23A SEC13 TMED9 GBF1 ANKRD28 IKBKG SEC16A SNAP23 NAPA DTNBP1 RAB11A SYTL3
GO_POSITIVE_REGULATION_OF_TYPE_I_INTERFERON_PRODUCTION	0.856645436730123	0.955824033730623	-0.204754220367136	-0.762543489874453	48958	44	TMEM173 POLR3GL POLR2F ZBTB20 POLR2L POLR2H CRCP FLOT1 IFI16 IRF7 PLCG2 DHX9 SYK MB21D1 TICAM1 RELA POLR2E XRCC5 PRKDC TBK1
GO_REGULATION_OF_STRESS_ACTIVATED_PROTEIN_KINASE_SIGNALING_CASCADE	0.470860566448802	0.845761401946154	-0.242706730584025	-0.991016843411449	27663	69	DBNL IGBP1 HDAC3 PYCARD TAOK1 COPS5 NCOR1 EPHA4 MAP2K2 MAP4K1 MAP2K1
GO_MYELOID_CELL_DEVELOPMENT	0.0503490624657334	0.549466203911694	-0.4992098706418	-1.49335706936013	2754	18	FLI1 ANXA2 KLF2 G6PD PTPN6
GO_NEGATIVE_REGULATION_OF_KINASE_ACTIVITY	0.0471393430278284	0.54570539674056	-0.32180213982926	-1.36342004777718	2816	85	TRIB2 PYCARD PRKRIP1 PPP2R5A ANAPC10 ZGPAT H2AFY GMFG GPS1 PTPRC MBIP PTPN6 NF2 CDK5RAP3 HSPB1 WNK1 LATS1 IRAK3 SH3BP5 PARK7
GO_INTRACELLULAR_PROTEIN_TRANSPORT	0.958046836073742	0.990106117701964	0.152706456712237	0.847724028219204	28841	412	ATG3 HSP90B1 ARNTL CTNNB1 LMNA VPS25 SNX1 NUP155 TIMM17A GCC2 NOP58 KRAS SRP9 SNX9 EHD1 COG3 GNPTAB DYNLT1 ZFAND6 NUPL1 NFKBIA RAE1 KPNA6 RPL34 SAR1A STX11 RAB8A LONP2 SYNRG SYTL2 BCL3 RAB8B DSCR3 PDIA3 ARHGEF2 EIF5A RPL10 CHMP4A AP3M1 EIF2D SNX2 RAB21 RAB2B TOMM5 KPNA4 COPA SEC23A RHOG AUP1 SLU7 TGFB1 PPP1R10 RBM22 SEC13 STX17 STX12 TMED9 RPS4X SYS1 RPS8 RPL7A COPB2 SDCBP SEC61B SEC61G MYADM RPS27A RAB14 CD74 RAB37 DERL1 RPL12 PTTG1IP BID RPAIN SEL1L RAB7L1 KPNA5 HSPA9 NAPA CTSA RPS6 RAP1A RHOF RAB9A RAB11A FBXO7 RPS3A SYTL3 UFD1L RPL5 CALR VAMP4 TIMM13 PIK3R1 TNPO1 NXT1 RPS5 TOMM7 TNF AP1G1 IPO8 VPS39 SPCS2 TIMM10 RPL4 VPS29 RPL35 RAB1A ARFIP1 RPS14 RPL37A AKT2 TBC1D15 MTERFD2 RAB2A NUP98 RPS23 YWHAQ STX16
GO_REGULATION_OF_PHOSPHATASE_ACTIVITY	0.52569094385538	0.865592788704611	-0.251757454567983	-0.960089250657491	30242	49	IGBP1 PPP2R5A SEMA4D CNST CDK5RAP3 FKBP1A IKBKB WNK1 CALM3 PPP2R5E JAK2 EIF2AK2
GO_CELL_DIVISION	0.347227061096507	0.796082189130783	-0.222954152732934	-1.04933324917685	21925	167	ZFP36L2 CCND3 ANAPC5 CHMP2A VPS4A ANAPC10 ZNF830 PDCD6IP CLASP1 CDC25B REEP4 AATF SEPT6 STAG1 NSMCE2 NEK9 DIAPH2 SEPT11 MYH9 NUMB GOLGA2 SEPT9 RASA1 KIF2A LATS1 GNAI2 CHFR PPP1CA RAN CDC123 JTB STRA13 BECN1 RAB11FIP4 MAU2 CDC16 SPTBN1 ZNF207 SEPT2 ACTR3 RHOA ANAPC11
GO_REGULATION_OF_MRNA_CATABOLIC_PROCESS	0.480701110397357	0.849437588877098	-0.33895101587376	-0.981267155064612	26190	16	ZFP36L2 ZFP36 POLR2G
GO_REGULATION_OF_INTERLEUKIN_10_PRODUCTION	0.479985962757441	0.849437588877098	0.333559829011833	0.978647420188036	21883	15	SASH3 PTGER4 BCL3 CD83
GO_NEGATIVE_REGULATION_OF_CELL_DIVISION	0.793692220037126	0.940940747076807	-0.267290360588182	-0.759684633933781	43183	15	TXNIP ZNF207 AURKAIP1 ATRX
GO_CELLULAR_RESPONSE_TO_UV	0.717344801963478	0.915033988086709	0.243963576691272	0.835427012781883	31857	26	NOC2L PPP1R15A CDKN1A YY1 MYC TRIAP1 BAK1 XPC PIK3R1 CRIP1
GO_REGULATION_OF_NUCLEAR_DIVISION	0.698835390231184	0.907266463785064	-0.226693009327415	-0.864504774358836	40203	49	ANAPC10 PDCD6IP H2AFY NSMCE2 GOLGA2 BECN1 PHB2 CDC16 ZNF207 AURKAIP1 ANAPC11 RANBP1 KIF20B ATRX CHMP2B
GO_RESPONSE_TO_ACID_CHEMICAL	0.650299430956937	0.892719872915756	0.204463017838073	0.911941536292262	26169	85	GNPAT UBR1 NCOA1 PTGER4 CDKN2D PDK3 RARA SMARCD1 UFL1 YES1 TGFBR3 GDAP2 SETX CPT1A ZC3H12A MTOR PTK2B CDKN1B PIK3C3
GO_RESPONSE_TO_STEROID_HORMONE	0.477817121433035	0.849437588877098	0.206609483380492	0.988698778321496	18351	128	MECP2 CTNNB1 NR4A2 AHR NCOA1 KRAS PTGER4 NR2C2 RARA NR3C1 PIAS2 THRAP3 CALM2 UBE3A NRIP1 ATP2B1 CDKN1A NR4A3 FBXO32 TGFB1 GATA3 CDKN1B DDX54 NR1H2 LDHA BID DNAJA1 MED30 UBR5 FOXO1 MED13 THBS1 CALM1 CALR SERPINB9 FOS MED17 ANXA1 HIF1A PRDM2 TNF
GO_POSITIVE_REGULATION_OF_RNA_SPLICING	0.164636836995852	0.708952361061087	0.418280712220393	1.27206548202143	7461	17	DAZAP1 THRAP3 SETX RBM22 POLR2A PRPF19 PIK3R1
GO_RESPONSE_TO_INTERLEUKIN_4	0.417777973065009	0.828469243840546	0.342941562066621	1.02509484969286	19015	16	HSPA5 TCF7 GATA3 XBP1 XCL1
GO_CARDIAC_CHAMBER_MORPHOGENESIS	0.158481157885447	0.708690787994121	0.421067437667311	1.28054040602659	7182	17	SMAD7 RARA DHRS3 TGFBR3 NOTCH2 SOX4 GATA3 RBPJ
GO_REGULATION_OF_DEFENSE_RESPONSE_TO_VIRUS	0.890817507317405	0.968966318327085	-0.186373566538778	-0.764599302617751	52347	71	TMEM173 AP1M1 AP1S2 ACIN1 AP2B1 C8orf59 ELMO1 AP2S1 LSM4 EIF2AK2 MDH1 AP2A1 TRIM38 HERC5 EIF2AK4 MB21D1 ATP1B1 AP1B1 TSPAN32 SPN DOCK2 SNRPD1 LCK PACS1
GO_RESPONSE_TO_PEPTIDE	0.982290111031751	0.996085180744713	-0.155019318343163	-0.701524452058552	60512	127	AREG EIF2B1 CAT SHC1 KLF2 UCP2 CREB1 APEX1 JAG1 TCIRG1 EIF4EBP2 SLC25A33 PRKACB MAX JAK2 NR4A1 USF1 GSK3B VAMP2 CCL5 ADCY7 CTSB IRS2 TIMP1 PTPRA SOCS1 RPS6KB1 EIF2B5 AKR1B1 ATP6V0E2 SOCS3 STAT5A PRKCQ PTPN1 GNG5 RELA ATP6V1D SRSF5 ATP6V0B
GO_DNA_DEPENDENT_DNA_REPLICATION	0.93020670251628	0.979765011861285	0.194126784916946	0.676504969755997	40996	28	BAZ1A POLB POLD4 PRIM2 MCM5 RPAIN MCM7
GO_POSITIVE_REGULATION_OF_CELLULAR_PROTEIN_CATABOLIC_PROCESS	0.768993760751791	0.932286263034887	0.186780714310949	0.872922809034177	29949	111	UBC PSMD1 RFWD2 PSMC3 RNF139 SMAD7 PSMD11 PSMC1 FBXL5 NUB1 SIRT2 CDC27 PSMA7 PTK2B ARIH1 EZR PSMD7 UBQLN1 PSMB3 XBP1 UBB PSMA6 PSMA3 RPS27A PSMD13 PTTG1IP PSMD5 BUB3 AXIN1 PSME4
GO_REGULATION_OF_LEUKOCYTE_APOPTOTIC_PROCESS	0.938218064574724	0.98178115867226	0.189656980963712	0.667590118001378	41320	29	NFKBID NOC2L NR4A3 SLC39A10 CD74 ADAM17 HSH2D ANXA1 HIF1A
