pathway	pval	padj	ES	NES	nMoreExtreme	size	leadingEdge
"reactome_ABC transporter disorders"	0.146621063804694	0.687631354215126	0.306915206677735	1.22851546137175	6215	50	UBC PSMD1 PSMC3 PSMD11 PSMC1 PSMA7 PSMD7 PSMB3 UBB PSMA6 PSMA3 RPS27A DERL1 PSMD13 ERLEC1 SEL1L PSMD5 PSME4
"reactome_ABC-family proteins mediated transport"	0.410419253175437	0.82074953160706	0.245807443408506	1.02105828179204	17189	59	UBC PSMD1 PSMC3 PSMD11 PSMC1 PSMA7 PSMD7 PSMB3 UBB PSMA6 PSMA3 RPS27A DERL1 PSMD13 ERLEC1 SEL1L PSMD5 ABCF1 PSME4
"reactome_APC-Cdc20 mediated degradation of Nek2A"	0.823338050690143	0.9489647485654	-0.258956055043153	-0.735997121061506	44796	15	ANAPC5 ANAPC10 ANAPC15 CDC16 ANAPC11
"reactome_APC/C-mediated degradation of cell cycle proteins"	0.601973213860159	0.885860566492316	0.223352323362304	0.924294213801339	25259	58	UBC PSMD1 PSMC3 PSMD11 PSMC1 CDC27 PSMA7 PSMD7 PSMB3 CDC14A UBB PSMA6 PSMA3 RPS27A PSMD13 PSMD5 BUB3 PSME4
"reactome_APC/C:Cdc20 mediated degradation of Securin"	0.715297450424929	0.914895241270694	0.212950395099269	0.864152875872804	30299	53	UBC PSMD1 PSMC3 PSMD11 PSMC1 CDC27 PSMA7 PSMD7 PSMB3 UBB PSMA6 PSMA3 RPS27A PSMD13 PSMD5 PSME4
"reactome_APC/C:Cdc20 mediated degradation of mitotic proteins"	0.628777691273268	0.892044689386689	0.222957434056019	0.909026923695138	26651	54	UBC PSMD1 PSMC3 PSMD11 PSMC1 CDC27 PSMA7 PSMD7 PSMB3 UBB PSMA6 PSMA3 RPS27A PSMD13 PSMD5 BUB3 PSME4
"reactome_APC/C:Cdh1 mediated degradation of Cdc20 and other APC/C:Cdh1 targeted proteins in late mitosis/early G1"	0.743482671573832	0.92046386611707	0.208468398116805	0.849953209365335	31513	54	UBC PSMD1 PSMC3 PSMD11 PSMC1 CDC27 PSMA7 PSMD7 PSMB3 UBB PSMA6 PSMA3 RPS27A PSMD13 PSMD5 PSME4
"reactome_APC:Cdc20 mediated degradation of cell cycle proteins prior to satisfation of the cell cycle checkpoint"	0.628777691273268	0.892044689386689	0.222957434056019	0.909026923695138	26651	54	UBC PSMD1 PSMC3 PSMD11 PSMC1 CDC27 PSMA7 PSMD7 PSMB3 UBB PSMA6 PSMA3 RPS27A PSMD13 PSMD5 BUB3 PSME4
"reactome_AUF1 (hnRNP D0) binds and destabilizes mRNA"	0.261523327712198	0.769493765572321	0.283526970891366	1.12033419588741	11165	47	UBC PSMD1 PSMC3 PSMD11 PSMC1 PSMA7 PABPC1 PSMD7 PSMB3 UBB PSMA6 PSMA3 RPS27A PSMD13 PSMD5 PSME4
"reactome_AURKA Activation by TPX2"	0.912110763543296	0.971858153865664	-0.20000616631225	-0.69762345761346	51318	33	DYNC1H1 SSNA1 CLASP1 OFD1 DCTN2 PPP2R1A DCTN1 CEP57 CNTRL TUBB MAPRE1
"reactome_Abortive elongation of HIV-1 transcript in the absence of Tat"	0.376248955419104	0.805310536664255	-0.344086298140438	-1.05919623336151	20710	20	POLR2F POLR2J POLR2G POLR2L POLR2H GTF2F1 NCBP2 POLR2C NELFE SUPT4H1 POLR2E POLR2I
"reactome_Activation of APC/C and APC/C:Cdc20 mediated degradation of mitotic proteins"	0.628777691273268	0.892044689386689	0.222957434056019	0.909026923695138	26651	54	UBC PSMD1 PSMC3 PSMD11 PSMC1 CDC27 PSMA7 PSMD7 PSMB3 UBB PSMA6 PSMA3 RPS27A PSMD13 PSMD5 BUB3 PSME4
"reactome_Activation of BH3-only proteins"	0.359140540896808	0.798400995526206	0.358187320573076	1.07066631216142	16346	16	MAPK8 PPP3R1 BID TFDP2 AKT2 YWHAQ BAD YWHAE TP53BP2 PPP3CC YWHAZ
"reactome_Activation of HOX genes during differentiation"	0.595715443430464	0.884951778840545	-0.253709681089427	-0.914993608245019	33813	38	HDAC3 POLR2F NCOR1 HIST2H2AC POLR2J POLR2G POLR2L POLR2H
"reactome_Activation of NF-kappaB in B cells"	0.149268988470225	0.692732262182234	0.2954345236105	1.21822527762524	6278	57	REL UBC PSMD1 PSMC3 NFKBIA PSMD11 PSMC1 NFKB1 PSMA7 PSMD7 MALT1 PSMB3 UBB PSMA6 PSMA3 RPS27A IKBKG PSMD13 PSMD5 PSME4
"reactome_Activation of NMDA receptors and postsynaptic events"	0.975929688190089	0.992094155075225	0.181976947705294	0.563367491894793	44193	18	NRAS KRAS PRKX CALM1 PRKAR1A ARHGEF7 PRKAA1
"reactome_Activation of anterior HOX genes in hindbrain development during early embryogenesis"	0.595715443430464	0.884951778840545	-0.253709681089427	-0.914993608245019	33813	38	HDAC3 POLR2F NCOR1 HIST2H2AC POLR2J POLR2G POLR2L POLR2H
"reactome_Activation of gene expression by SREBF (SREBP)"	0.00253952831021995	0.156595756074282	0.606209673686441	1.87671475828999	114	18	IDI1 SREBF2 TGS1 NCOA1 HMGCS1 MVD CYP51A1 NCOA2 MTF1
"reactome_Activation of the mRNA upon binding of the cap-binding complex and eIFs, and subsequent binding to 43S"	0.409913416849506	0.82074953160706	0.250563030356807	1.02157858804453	17374	54	EIF3J EIF4EBP1 EIF3L EIF3D EIF4G1 PABPC1 RPS4X RPS8 RPS27A EIF4A1 EIF3F RPS6 EIF3G RPS3A RPS5 RPS14 RPS23 RPS15A RPS9 RPS10 RPS28 RPS16
"reactome_Adaptive Immune System"	0.467426067907996	0.845761401946154	-0.194143482390507	-0.996365219175907	32006	351	ITK UBA5 ANAPC5 CARD11 THEM4 ITGB1 PSMF1 AP1M1 PPP2R5A EVL RNF138 KIFAP3 ANAPC10 PRKCB PSMC5 LNPEP UBA3 DYNC1H1 RNF213 UBE2L3 SIPA1 HLA-DPB1 AP1S2 ORAI1 PTPRC UBE2E3 KLRF1 PTPN6 UNKL RBCK1 UBE2G1 HUWE1 RAF1 CD81 FKBP1A SELL VAMP8 HLA-DQB1 NCR1 AP2B1 FBXW2 KIF22 PSME3 SEC31A IKBKB YWHAB CTSD STUB1 PSMB4 KIF2A TNFRSF14 PPP2R5E CD8A KLRG1 AP2S1 PRKACB CLTA PSMB6 UBE2J2 CAPZA2 KLHL20 PSMD4 FYB FBXW7 STX4 BTBD1 HLA-DMA ACTR1B UBE2D2 ITGB7 CD99 CD226 MIB2 UBE2L6 WWP1 CDC16 UBE2J1 ITGA4 TRIM21 AP2A1 NFATC3 CTSB HLA-DPA1 RNF6 KLRC1 ANAPC11 DCTN2 PSMD2 PPP2R1A PTPN11 SOCS1 ITGB2 UBA7 PLCG2 HERC5
"reactome_Amplification  of signal from unattached  kinetochores via a MAD2  inhibitory signal"	0.131343817012152	0.67116199722541	-0.382747328547316	-1.29396530401057	7349	29	XPO1 TAOK1 PPP2R5A DYNC1H1 CLASP1 NUP133 KIF2A PPP2R5E
"reactome_Amplification of signal from the kinetochores"	0.131343817012152	0.67116199722541	-0.382747328547316	-1.29396530401057	7349	29	XPO1 TAOK1 PPP2R5A DYNC1H1 CLASP1 NUP133 KIF2A PPP2R5E
"reactome_Amyloid fiber formation"	0.579783197831978	0.880796875419249	-0.284606840960854	-0.918106137486255	32090	24	GGA3 CST3 TSPAN14 HIST2H2AC
"reactome_Anchoring of the basal body to the plasma membrane"	0.845856130042398	0.954004782951153	-0.209300442018247	-0.767130376233306	48080	41	TMEM216 DYNC1H1 SSNA1 CLASP1 OFD1 SEPT2 DCTN2 PPP2R1A SCLT1 AHI1 DCTN1 CEP57 CNTRL TUBB MAPRE1
"reactome_Antigen Presentation: Folding, assembly and peptide loading of class I MHC"	0.0438012863162564	0.532337415378264	0.482316337194784	1.51533744461731	1974	19	HSPA5 PDIA3 TAPBP SEC23A SEC13 HLA-B HLA-C HLA-A CALR HLA-F
"reactome_Antigen activates B Cell Receptor (BCR) leading to generation of second messengers"	0.968039772727273	0.991429315563942	-0.189839994280371	-0.576538185775194	53156	19	ORAI1 PTPN6
"reactome_Antigen processing-Cross presentation"	0.0609656103795881	0.582375772303069	0.315807351627716	1.34139169217251	2527	66	UBC PSMD1 PSMC3 PSMD11 PSMC1 PDIA3 TAPBP PSMA7 HLA-B HLA-C PSMD7 PSMB3 SEC61B UBB PSMA6 SEC61G PSMA3 HLA-A RPS27A CTSS IKBKG PSMD13 PSMD5 PSME4 SNAP23 CALR HLA-F PSMB1 PSMB7
"reactome_Antigen processing: Ubiquitination & Proteasome degradation"	0.331979369872531	0.786222381464543	0.21345030203641	1.04917677480553	12422	152	TRIP12 UBC UBE2F UBR1 PSMD1 NPEPPS HECTD1 PSMC3 MGRN1 HERC1 PSMD11 PSMC1 FBXL5 UFL1 UBE2K MYLIP UBE3A FBXO21 RNF41 ASB8 LTN1 CDC27 FBXO32 UBE2B PSMA7 RNF115 RLIM RNF126 PSMD7 TRIM11 PSMB3 UBA6 UBE2A UBB PSMA6 PSMA3 WSB1 RPS27A PSMD13 FBXO6 PSMD5
"reactome_Antiviral mechanism by IFN-stimulated genes"	0.38204977002005	0.809259866608474	0.258917531816482	1.03639110782397	16196	50	UBC NUP155 JAK1 RAE1 PPM1B EIF4A3 KPNA4 EIF4G1 ARIH1 SEC13 FLNB UBB RPS27A KPNA5 EIF4A1
reactome_Apoptosis	0.120235347822779	0.67116199722541	0.263082921095528	1.21038455167911	4740	101	OPA1 UBC CTNNB1 LMNA MAPK8 CYCS VIM PSMD1 PSMC3 PSMD11 PSMC1 SATB1 PPP3R1 LMNB1 RIPK1 BIRC2 PSMA7 ADD1 PSMD7 PSMB3 UBB PSMA6 PSMA3 RPS27A TNFSF10 PSMD13 BID PSMD5 PSME4 BAK1 ROCK1 TFDP2 PSMB1 PSMB7 DIABLO AKT2 YWHAQ PSMD6 BAD PSME1 PSMD8 APC CASP3 FNTA YWHAE
"reactome_Apoptotic cleavage of cellular proteins"	0.12896387244943	0.67116199722541	0.427289767409609	1.32281130996713	5839	18	CTNNB1 LMNA VIM SATB1 LMNB1 BIRC2 ADD1
"reactome_Apoptotic execution phase"	0.646391356434077	0.892719872915756	0.254742700733889	0.880367674384657	28596	27	CTNNB1 LMNA VIM SATB1 LMNB1 BIRC2 ADD1
"reactome_Asparagine N-linked glycosylation"	0.452430846605197	0.843455872606558	-0.218268583381206	-1.00047027139141	28066	138	MLEC AREG TRAPPC9 ST6GALNAC6 COG5 TBC1D20 DYNC1H1 NSF KDELR1 ALG5 MCFD2 MIA3 GMDS DAD1 RPN2 CD55 GOLGA2 SEC31A DERL2 DPM3 ARF5 CAPZA2 TRAPPC2L COPZ1 ARCN1 B4GALT4 SPTBN1 MGAT1 ALG13 ST3GAL1 DCTN2 ARF3 BET1L STT3A UGGT1 CD59 CNIH1 GANAB DCTN1 CANX SPTAN1 CTSC
"reactome_Assembly of the pre-replicative complex"	0.130566161486028	0.67116199722541	0.320985907319221	1.25586193732967	5573	45	UBC PSMD1 PSMC3 PSMD11 PSMC1 PSMA7 MCM5 PSMD7 PSMB3 UBB PSMA6 PSMA3 RPS27A PSMD13 PSMD5 PSME4 MCM7 PSMB1 PSMB7 PSMD6 PSME1 PSMD8 PSMC4 PSMC2 PSMB2 PSMD14 PSMB10
"reactome_Association of TriC/CCT with target proteins during biosynthesis"	0.105511753805908	0.67116199722541	-0.440883970759906	-1.357167209802	5807	20	HDAC3 NOP56 CCT5 FBXW2 XRN2 DCAF7 FBXW7 CCT4
"reactome_Asymmetric localization of PCP proteins"	0.211467868593467	0.752396546952117	0.301457964843122	1.16855839598198	9101	43	UBC PSMD1 PSMC3 PSMD11 PSMC1 PSMA7 PSMD7 PSMB3 UBB PSMA6 PSMA3 RPS27A PSMD13 PSMD5 PSME4 PSMB1 PSMB7 PSMD6 PSME1 PSMD8 PSMC4 PSMC2 PSMB2 PSMD14 PSMB10
"reactome_Autodegradation of Cdh1 by Cdh1:APC/C"	0.722733711048159	0.916900082835816	0.212093203797643	0.860674392876198	30614	53	UBC PSMD1 PSMC3 PSMD11 PSMC1 CDC27 PSMA7 PSMD7 PSMB3 UBB PSMA6 PSMA3 RPS27A PSMD13 PSMD5
"reactome_Autodegradation of the E3 ubiquitin ligase COP1"	0.119953325554259	0.67116199722541	0.326312972211676	1.27105189589392	5139	44	UBC PSMD1 RFWD2 PSMC3 PSMD11 PSMC1 PSMA7 PSMD7 PSMB3 UBB PSMA6 PSMA3 RPS27A PSMD13 PSMD5 PSME4 PSMB1 PSMB7 PSMD6 PSME1 PSMD8 PSMC4 PSMC2 PSMB2 PSMD14 PSMB10
"reactome_Axon guidance"	0.994753858354176	1	-0.145097945246038	-0.715037309547879	65227	240	ITGB1 PSMF1 SEMA4D EVL SHC1 PSMC5 CAP1 CLASP1 ARPC1B EPHA4 ARPC4 PTPRC MAP2K2 CREB1 AP2B1 RPS15 MYH9 CXCR4 MAP2K1 NUMB PSME3 NCAM1 LYPLA2 ARPC3 RASA1 ARPC1A PSMB4 ARPC2 AP2S1 PRKACB CLTA PSMB6 PSMD4 GSK3B HSPA8 SPTBN1 AP2A1 UPF3A ACTR3 RHOA IRS2 PSMD2 PTPN11 PTPRA RPS6KA3 RPL36 RPL22 SPTAN1 ACTB RPL27A TLN1 ADAM10 PSMD12 ST8SIA4 RPL8 RPS6KA1 NCBP2 ARPC5 FRS2 RPL15 PRKCQ RPL14 MYL12A
"reactome_B-WICH complex positively regulates rRNA expression"	0.610836286449245	0.890228612804042	-0.273261968146034	-0.899494867349047	33956	26	POLR2F HIST2H2AC TBP SMARCA5 POLR2L POLR2H GSK3B H2AFJ DEK TAF1D H2AFV POLR2E
"reactome_Beta-catenin independent WNT signaling"	0.475908189011097	0.847862557345604	0.226176746348395	0.987101653866783	19427	76	UBC CTNNB1 PSMD1 PSMC3 AGO2 PSMD11 PSMC1 PPP3R1 TNRC6A PSMA7 TCF7 PSMD7 PSMB3 MYC UBB PSMA6 PSMA3 RPS27A GNB1 PSMD13 PSMD5 PSME4 CALM1 PSMB1 ITPR1 PSMB7
"reactome_Biological oxidations"	0.596029432674534	0.884951778840545	-0.261772339565167	-0.913064471971891	33534	33	AKR1A1 COMT ACSS1 AKR7A2 ADH5 GSTK1 AHCY MAT2B UGP2 PAPSS1 AIP
"reactome_Biosynthesis of the N-glycan precursor (dolichol lipid-linked oligosaccharide, LLO) and transfer to a nascent protein"	0.644683419291123	0.892719872915756	-0.294678926251498	-0.867805886775121	35249	17	ST6GALNAC6 ALG5 GMDS DPM3 ALG13 ST3GAL1
"reactome_Budding and maturation of HIV virion"	0.0475686170682199	0.54570539674056	0.495485594489869	1.50685915743905	2155	17	VPS37B UBC UBAP1 CHMP4A VPS37A VTA1 UBB RPS27A
"reactome_C-type lectin receptors (CLRs)"	0.0923899527480726	0.67116199722541	0.283622716593411	1.26171188863459	3714	84	TAB2 NFKB2 UBC PSMD1 NRAS PSMC3 KRAS RELB NFKBIA PSMD11 PSMC1 PPP3R1 NFKB1 PSMA7 PSMD7 MALT1 PSMB3 UBB PSMA6 PSMA3 FYN RPS27A IKBKG PSMD13 PSMD5 PSME4 NFATC2 CALM1 PSMB1 ITPR1 PSMB7
"reactome_CD28 co-stimulation"	0.0976745212249581	0.67116199722541	0.454236123611025	1.38141223501683	4426	17	RICTOR VAV1 YES1 MTOR MLST8 FYN PIK3R1 MAPKAP1 AKT2 MAP3K8
"reactome_CDK-mediated phosphorylation and removal of Cdc6"	0.743482671573832	0.92046386611707	0.208468398116805	0.849953209365335	31513	54	UBC PSMD1 PSMC3 PSMD11 PSMC1 CDC27 PSMA7 PSMD7 PSMB3 UBB PSMA6 PSMA3 RPS27A PSMD13 PSMD5 PSME4
"reactome_CDT1 association with the CDC6:ORC:origin complex"	0.211467868593467	0.752396546952117	0.301457964843122	1.16855839598198	9101	43	UBC PSMD1 PSMC3 PSMD11 PSMC1 PSMA7 PSMD7 PSMB3 UBB PSMA6 PSMA3 RPS27A PSMD13 PSMD5 PSME4 PSMB1 PSMB7 PSMD6 PSME1 PSMD8 PSMC4 PSMC2 PSMB2 PSMD14 PSMB10
"reactome_CLEC7A (Dectin-1) signaling"	0.122412744740362	0.67116199722541	0.285162383912953	1.23214995260445	5032	72	TAB2 NFKB2 UBC PSMD1 PSMC3 RELB NFKBIA PSMD11 PSMC1 PPP3R1 NFKB1 PSMA7 PSMD7 MALT1 PSMB3 UBB PSMA6 PSMA3 RPS27A IKBKG PSMD13 PSMD5 PSME4 NFATC2 CALM1 PSMB1 ITPR1 PSMB7
"reactome_COPI-dependent Golgi-to-ER retrograde traffic"	0.81962226780788	0.94889586517699	-0.21906285180679	-0.779979081967952	46347	36	KIFAP3 NSF KDELR1 KIF22 ARF5 KIF2A COPZ1
"reactome_COPI-independent Golgi-to-ER retrograde traffic"	0.805144787995495	0.946986726916263	-0.247943680323987	-0.763241703329232	44319	20	RAB3GAP2 DYNC1H1 CAPZA2 RAB18 DCTN2 DCTN1
"reactome_COPI-mediated anterograde transport"	0.613328241359557	0.890228612804042	-0.238004100673953	-0.91194168398461	35331	50	COG5 DYNC1H1 NSF KDELR1 CD55 GOLGA2 ARF5 CAPZA2 COPZ1 ARCN1 SPTBN1 DCTN2 ARF3 BET1L CD59 DCTN1 SPTAN1
"reactome_COPII-mediated vesicle transport"	0.531724659872925	0.867747381372024	-0.262722992071161	-0.952840545729695	30210	39	AREG TRAPPC9 TBC1D20 NSF MCFD2 GOLGA2 SEC31A
"reactome_Ca2+ pathway"	0.239300649523979	0.768956930080325	0.368544776119305	1.17446768993753	10757	20	CTNNB1 AGO2 PPP3R1 TNRC6A TCF7 MYC GNB1 CALM1 ITPR1
"reactome_Calnexin/calreticulin cycle"	0.264729264199276	0.769493765572321	0.372726700568642	1.15389399102153	11987	18	UBC RNF139 PDIA3 UBB RPS27A SEL1L CALR
"reactome_Cap-dependent Translation Initiation"	0.773344912137311	0.933898169114702	0.186825100288425	0.868360123673558	30277	107	EIF3J RPL34 EIF4EBP1 EIF3L RPL10 EIF3D EIF4G1 PABPC1 RPS4X RPS8 RPL7A RPS27A RPL12 EIF4A1 EIF3F RPS6 EIF3G RPS3A RPL5 RPS5 RPL4 RPL35 RPS14 RPL37A RPS23 RPL32 RPL11 RPL21 RPS15A RPL9 RPLP1 RPS9 RPS10 RPL23A RPL23 RPL3 RPL6 RPS28 RPS16 RPLP2 RPL13 EIF5 RPL10A RPL17 RPL7 RPS27 RPS3 RPL29 RPL37
"reactome_Cardiac conduction"	0.648730152962976	0.892719872915756	-0.282676503317581	-0.870159286178786	35709	20	CAMK2D ORAI1 FXYD7 ATP1A1 ATP1B1 HIPK1 RANGRF CAMK2G ITPR2 ATP1B3 ASPH
"reactome_Cargo concentration in the ER"	0.259258578543991	0.769493765572321	-0.411838945050952	-1.1705162787099	14105	15	MCFD2 MIA3 CD59 CNIH1 CTSC
"reactome_Cargo recognition for clathrin-mediated endocytosis"	0.166245005496135	0.708952361061087	-0.324757474730839	-1.2217518237607	9527	46	AREG IGF2R IL7R NEDD8 COPS5 ARRB2 GPS1 VAMP8 AP2B1 COPS7B AP2S1 CLTA M6PR PICALM VAMP2 AP2A1 COPS8
"reactome_Cargo trafficking to the periciliary membrane"	0.357474534275489	0.797922806369498	-0.372625736399515	-1.07875586482027	19476	16	BBIP1 EXOC2 EXOC4 CCT5
"reactome_Cdc20:Phospho-APC/C mediated degradation of Cyclin A"	0.628777691273268	0.892044689386689	0.222957434056019	0.909026923695138	26651	54	UBC PSMD1 PSMC3 PSMD11 PSMC1 CDC27 PSMA7 PSMD7 PSMB3 UBB PSMA6 PSMA3 RPS27A PSMD13 PSMD5 BUB3 PSME4
"reactome_Cell Cycle"	0.7755080472265	0.934074425479011	-0.178551789633839	-0.88842457284977	51364	261	CCND3 HDAC1 XPO1 ANAPC5 TMPO CDK11B ATR PSMF1 TAOK1 PPP2R5A PHLDA1 ANAPC10 PRKCB PSMC5 KAT5 ACD DYNC1H1 HIST2H2AC SSNA1 CLASP1 CDC25B OFD1 MDC1 STAG1 NUP133 NEK9 NUP54 SMARCA5 GOLGA2 PSME3 YWHAB REC8 PSMB4 KIF2A ANAPC15 PPP2R5E DIDO1 MAX PSMB6 JAK2 PSMD4 BANF1 STRA13 MAU2 GSK3B CDC16 NHP2 RBL2 E2F4 NUP50 ANAPC11 DCTN2 PSMD2 PPP2R1A H2AFJ MZT2A ESCO1 NDEL1 DCTN1 CEP57 UBE2N CNTRL NUMA1 PSMD12 OPTN TUBB
"reactome_Cell Cycle Checkpoints"	0.596230061249222	0.884951778840545	-0.210768626069611	-0.93534633409111	36406	112	XPO1 ANAPC5 ATR PSMF1 TAOK1 PPP2R5A ANAPC10 PSMC5 KAT5 DYNC1H1 CLASP1 MDC1 NUP133 PSME3 YWHAB PSMB4 KIF2A ANAPC15 PPP2R5E PSMB6 PSMD4
"reactome_Cell Cycle, Mitotic"	0.906998657948088	0.971858153865664	0.162677098296066	0.843195745183155	31763	222	UBC LMNA NDE1 LPIN2 NUP155 PSMD1 CEP135 PSMC3 MZT1 CDKN2D EMD CCND2 RAE1 PAFAH1B1 PSMD11 PSMC1 DBF4 RAB8A HIST1H2AC SFI1 SMC3 RAD21 LMNB1 CDKN1A POLD4 DYNC1LI2 PRIM2 CDC27 PSMA7 LPIN1 H3F3A SEC13 MCM5 CDKN1B PSMD7 POLE3 PSMB3 CDC14A STAG2 MYC UBB PSMA6 PSMA3 ACTR1A RPS27A CSNK2A1 CDK5RAP2 PSMD13 PSMD5
"reactome_Cell death signalling via NRAGE, NRIF and NADE"	0.258425442462874	0.769493765572321	0.331098742887961	1.14424723231797	11432	27	UBC MAPK8 SQSTM1 VAV1 ARHGEF2 UBB PSENEN RPS27A SOS2 ARHGEF7 BAD ARHGEF3 CASP3 YWHAE GNA13 RAC1
"reactome_Cell surface interactions at the vascular wall"	0.234847424412094	0.765671217704769	-0.310546002033176	-1.15653211803074	13421	44	ITGB1 GLG1 SHC1 ITGAX PTPN6 SELL SELPLG CD2 CD99 ITGA4 ITGAM PTPN11 ITGB2 CD47 ATP1B1 SPN LCK FCER1G CD48
"reactome_Cell-Cell communication"	0.172504425253446	0.718927907148687	-0.370539089533393	-1.24289166055176	9647	28	ITGB1 RSU1 CD151 PTPN6 IQGAP1 FYB SPTBN1 ACTN4 ARHGEF6 PTPN11 SPTAN1 CD47
"reactome_Cellular Senescence"	0.803914968104624	0.946636526357586	-0.197199400079502	-0.826510362369264	47762	80	ANAPC5 HIST1H1C MAPKAPK3 CEBPB ANAPC10 KAT5 HIST2H2AC RING1 HIST1H1E ANAPC15 HIST1H1D TNRC6B CDC16 CABIN1 RNF2 ANAPC11 AGO3 H2AFJ RPS6KA3 MAPKAPK5 RPS6KA1 RBBP4 CDK6 RELA RB1 H2AFV TNIK CDC26 ANAPC16 SUZ12 TINF2 TERF2IP ETS1
"reactome_Cellular response to heat stress"	0.671575336532631	0.897581167929844	-0.226343305379443	-0.883660787891447	38763	55	MRPL18 ATR CAMK2D BAG1 NUP133 BAG5 NUP54 ST13 GSK3B HSPA8 NUP50 CCAR2
"reactome_Cellular response to hypoxia"	0.374194918253238	0.804420774353502	0.25572223913601	1.04261336405511	15860	54	UBC PSMD1 PSMC3 PSMD11 PSMC1 PSMA7 PSMD7 PSMB3 UBB PSMA6 PSMA3 RPS27A PSMD13 PSMD5 PSME4 PSMB1 HIF1A PSMB7 PSMD6 PSME1 PSMD8 PSMC4 PSMC2 PSMB2 PSMD14 PSMB10 RBX1
"reactome_Cellular responses to external stimuli"	0.537421469543841	0.867747381372024	-0.195793777763911	-0.970177481651622	35414	252	SOD2 ANAPC5 MRPL18 ATR PSMF1 LAMTOR2 CHMP2A CAT HIST1H1C MAPKAPK3 CAMK2D CEBPB ANAPC10 PSMC5 KAT5 ATG5 CSRP1 ACD DYNC1H1 HIST2H2AC BAG1 RING1 NUP133 HIST1H1E BAG5 LAMTOR1 NUP54 PSME3 ST13 PSMB4 DNAJA2 PRDX2 ANAPC15 GPX1 PSMB6 CAPZA2 PSMD4 HIST1H1D PRDX1 ACTR10 BECN1 TNRC6B UBE2D2 ATOX1 GSK3B CDC16 HSPA8 MT2A CABIN1 RNF2 NUP50 ANAPC11 DCTN2 PSMD2 CCAR2 AGO3 H2AFJ RPS6KA3
"reactome_Cellular responses to stress"	0.524983025739152	0.865592788704611	-0.200479358863127	-0.973998603556296	34020	214	SOD2 ANAPC5 MRPL18 ATR PSMF1 CAT HIST1H1C MAPKAPK3 CAMK2D CEBPB ANAPC10 PSMC5 KAT5 ACD DYNC1H1 HIST2H2AC BAG1 RING1 NUP133 HIST1H1E BAG5 NUP54 PSME3 ST13 PSMB4 DNAJA2 PRDX2 ANAPC15 GPX1 PSMB6 CAPZA2 PSMD4 HIST1H1D PRDX1 ACTR10 TNRC6B UBE2D2 ATOX1 GSK3B CDC16 HSPA8 CABIN1 RNF2 NUP50 ANAPC11 DCTN2 PSMD2 CCAR2 AGO3 H2AFJ RPS6KA3
"reactome_Centrosome maturation"	0.852309751501383	0.955589264384171	-0.208645437354567	-0.760723703388622	48394	40	CDK11B DYNC1H1 SSNA1 CLASP1 OFD1
"reactome_Chaperonin-mediated protein folding"	0.137880629083672	0.681080371026993	-0.346773494336523	-1.26434021368222	7828	40	HDAC3 VBP1 PFDN4 NOP56 CCT5 FBXW2 GNAI2 XRN2 DCAF7 FBXW7 CCT4
"reactome_Chromatin modifying enzymes"	0.59014647828797	0.884951778840545	0.199652790845476	0.946478066672906	22722	121	NFKB2 JADE2 KDM4A PRMT1 YEATS4 NCOA1 ATF7IP SMARCE1 ARID4B JMJD6 KDM6B SMARCD1 HIST1H2AC SMARCA4 NFKB1 PHF20 DPY30
"reactome_Chromatin organization"	0.59014647828797	0.884951778840545	0.199652790845476	0.946478066672906	22722	121	NFKB2 JADE2 KDM4A PRMT1 YEATS4 NCOA1 ATF7IP SMARCE1 ARID4B JMJD6 KDM6B SMARCD1 HIST1H2AC SMARCA4 NFKB1 PHF20 DPY30
"reactome_Chromosome Maintenance"	0.94274253026569	0.982774060213278	-0.195426506612765	-0.643284321029976	52407	26	HIST2H2AC SMARCA5 STRA13 NHP2 H2AFJ RPA1 RBBP4 H2AFV TINF2 TERF2IP
"reactome_Cilium Assembly"	0.348082949466582	0.796082189130783	-0.263362450540705	-1.06291999203843	20326	65	BBIP1 IFT43 KIFAP3 EXOC2 TMEM216 DYNC1H1 SSNA1 EXOC4 CLASP1 OFD1 CCT5
"reactome_Circadian Clock"	0.00566604995374653	0.224357300587867	0.451140017975256	1.69766981585818	244	38	MEF2D UBC TGS1 NCOA1 CRTC3 NR3C1 CRY1 NRIP1 CPT1A PER1 CREM CRTC2 UBB RPS27A NCOA2
"reactome_Citric acid cycle (TCA cycle)"	0.121593099018078	0.67116199722541	-0.463012238742758	-1.34042584619489	6624	16	OGDH ME2 SDHC MDH2 SUCLA2 SDHB IDH2 SUCLG1 CS
"reactome_Class A/1 (Rhodopsin-like receptors)"	0.761632369604152	0.928853648122024	-0.264234423336622	-0.790441790645558	41674	18	PTGER2 S1PR1 CXCR4 CCL5 PTGDR S1PR4
"reactome_Class I MHC mediated antigen processing & presentation"	0.0933115190505241	0.67116199722541	0.236059934757593	1.19377860763177	3364	185	TRIP12 UBC UBE2F UBR1 PSMD1 NPEPPS HECTD1 PSMC3 MGRN1 HERC1 PSMD11 PSMC1 FBXL5 UFL1 UBE2K HSPA5 PDIA3 MYLIP UBE3A FBXO21 RNF41 TAPBP ASB8 LTN1 CDC27 FBXO32 UBE2B PSMA7 SEC23A B2M RNF115 SEC13 HLA-B RLIM HLA-C RNF126 PSMD7 TRIM11 PSMB3 UBA6 UBE2A SEC61B UBB PSMA6 SEC61G PSMA3 HLA-A WSB1 RPS27A CTSS IKBKG PSMD13 FBXO6 PSMD5
"reactome_Clathrin derived vesicle budding"	0.0111841990473366	0.335732526558495	-0.424286133231005	-1.59618299009433	640	46	HIP1R AP1G2 IGF2R AP1M1 CHMP2A AP3B1 AP1S2 CPD VAMP8 SNX5 BLOC1S6 DNASE2 CLTA M6PR BLOC1S4 STX4 PICALM HSPA8 VAMP2
"reactome_Clathrin-mediated endocytosis"	0.0386540032679739	0.517927889791114	-0.345485918959939	-1.410683436866	2270	69	HIP1R AREG IGF2R IL7R NEDD8 COPS5 ARRB2 GPS1 ARPC4 VAMP8 AP2B1 COPS7B ARPC3 ARPC1A ARPC2 AP2S1 CLTA M6PR PACSIN1 PICALM BIN1 HSPA8 VAMP2 AP2A1 COPS8 ACTR3
"reactome_Cleavage of Growing Transcript in the Termination Region"	0.519673974142777	0.865535689634001	0.243392845625895	0.961747403189784	22187	47	U2AF1 RBM8A CASC3 SRSF2 CPSF7 SRSF4 EIF4A3 SRSF7 SLU7 SNRPB DHX38
"reactome_Complex I biogenesis"	0.720880319476453	0.916900082835816	-0.231055244362614	-0.846866326842817	40976	41	NDUFB5 NDUFS7 NDUFB3 NDUFS3 NDUFB10 NDUFB7 NDUFS2 NDUFAF4 NDUFA13 NDUFS4 NDUFS8 NDUFA10 TMEM126B NDUFA3 NDUFA11 NDUFS6 NDUFV1 NDUFA5
"reactome_Constitutive Signaling by NOTCH1 HD+PEST Domain Mutants"	0.505319244041553	0.86039650219679	-0.288173034666736	-0.966612893754903	28261	28	HDAC3 HDAC1 NCOR1 HDAC7 JAG1 FBXW7 MIB2
"reactome_Constitutive Signaling by NOTCH1 PEST Domain Mutants"	0.505319244041553	0.86039650219679	-0.288173034666736	-0.966612893754903	28261	28	HDAC3 HDAC1 NCOR1 HDAC7 JAG1 FBXW7 MIB2
"reactome_Cooperation of PDCL (PhLP1) and TRiC/CCT in G-protein beta folding"	0.599486097090943	0.885860566492316	-0.310321803526313	-0.898385250493532	32662	16	CCT5 GNAI2 CCT4 GNG5 GNG10 CCT8 PDCL
"reactome_Cooperation of Prefoldin and TriC/CCT  in actin and tubulin folding"	0.430772323549837	0.831649002756007	-0.340555494071067	-1.01875180057362	23570	18	VBP1 PFDN4 CCT5
"reactome_Costimulation by the CD28 family"	0.733589843611476	0.917922052021495	-0.236958105153321	-0.832466107727884	41372	34	THEM4 PPP2R5A HLA-DPB1 PTPN6 HLA-DQB1 TNFRSF14 PPP2R5E HLA-DPA1 PPP2R1A PTPN11
"reactome_Cross-presentation of soluble exogenous antigens (endosomes)"	0.470070626374899	0.845761401946154	0.260721942566468	0.987309236049694	20299	39	PSMD1 PSMC3 PSMD11 PSMC1 PSMA7 PSMD7 PSMB3 PSMA6 PSMA3 PSMD13 PSMD5 PSME4 PSMB1 PSMB7 PSMD6 PSME1 PSMD8 PSMC4 PSMC2 PSMB2 PSMD14 PSMB10
"reactome_Cyclin A:Cdk2-associated events at S phase entry"	0.464521058160634	0.845761401946154	0.238843052985496	0.992128936038952	19455	59	UBC PSMD1 PSMC3 PSMD11 PSMC1 CDKN1A PSMA7 CDKN1B PSMD7 PSMB3 MYC UBB PSMA6 PSMA3 RPS27A PSMD13 PSMD5
"reactome_Cyclin D associated events in G1"	0.534421750425513	0.867747381372024	0.282098286357115	0.94576884968203	23862	24	UBC CDKN2D CCND2 CDKN1A CDKN1B UBB RPS27A
"reactome_Cyclin E associated events during G1/S transition"	0.333317484844883	0.786821562782873	0.258620765381529	1.06642361852719	14020	57	UBC PSMD1 PSMC3 PSMD11 PSMC1 CDKN1A PSMA7 CDKN1B PSMD7 PSMB3 MYC UBB PSMA6 PSMA3 RPS27A PSMD13 PSMD5
"reactome_Cytokine Signaling in Immune system"	0.0937969982505141	0.67116199722541	0.215049622422746	1.15816112792739	3055	308	TAB2 HSP90B1 NFKB2 IL21R UBC MAPK8 STAT4 VIM NUP155 PSMD1 IL27RA TNFSF14 PDCD4 PSMC3 RIPK2 PTPN7 DUSP4 IFNAR1 MCL1 JAK1 RELB IFITM3 SQSTM1 NFKBIA RAE1 IRF8 VAV1 PSMD11 PSMC1 PPM1B SNRPA1 YES1 IFNAR2 SMARCA4 IL6ST IRF1 NFKB1 LMNB1 PTPN4 CDKN1A TRAF3 BIRC2 EIF4A3 IFNGR1 KPNA4 PSMA7 MAP2K3 EIF4G1 PTK2B B2M ARIH1 TGFB1 IL18RAP SEC13 GATA3 HLA-B HLA-C PSMD7 TNFSF9 PSMB3 FLNB MYC UBB PSMA6 PSMA3 BRWD1 FYN HLA-A CEBPD RPS27A IKBKG PSMD13 TNFRSF1B PSMD5 SOS2 KPNA5 EIF4A1 HSPA9 ADAM17 PSME4 FOXO1 IL18R1 SUMO1 GBP4 ICAM1 FOS HLA-F PIK3R1 ANXA1 PSMB1 HIF1A IP6K2 TNF MEF2A EGR1 PSMB7
"reactome_Cytosolic sensors of pathogen-associated DNA"	0.686075419967936	0.900221889909825	0.226066678971246	0.871359274755707	29527	42	NFKB2 UBC CTNNB1 NFKBIA NFKB1 RIPK1 DHX36 POLR1C UBB RPS27A IKBKG POLR2K XRCC6
"reactome_Cytosolic tRNA aminoacylation"	0.255985233378413	0.769493765572321	-0.389942419743182	-1.16648989415659	14006	18	AIMP1 PPA1 NARS HARS QARS EPRS RARS LARS
"reactome_DAP12 interactions"	0.357366840385125	0.797922806369498	0.345679758890256	1.07016158486284	16182	18	NRAS KRAS LAT HLA-B HLA-C FYN PIK3R1
"reactome_DAP12 signaling"	0.544038491113211	0.868626304421155	0.312866352787444	0.935196320189076	24762	16	NRAS KRAS LAT FYN PIK3R1
"reactome_DDX58/IFIH1-mediated induction of interferon-alpha/beta"	0.0694205659588309	0.611664630591026	0.353427937190761	1.37001251101055	2987	43	NFKB2 UBC CYLD TANK NFKBIA UBE2K PCBP2 NFKB1 TRAF3 RIPK1 OTUD5 UBB RPS27A IKBKG IFIH1
"reactome_DNA Damage Bypass"	0.351809549404282	0.796082189130783	0.319153198513158	1.06999995401608	15708	24	UBC POLD4 UBE2B USP1 POLE3 UBB RPS27A UFD1L POLE4
"reactome_DNA Damage Recognition in GG-NER"	0.701984233628953	0.908055825089802	0.251370014737416	0.842748577996687	31344	24	UBC INO80D COPS4 YY1 UBB RPS27A COPS2 XPC
"reactome_DNA Damage/Telomere Stress Induced Senescence"	0.484472273850984	0.851613756198196	-0.307010757687392	-0.98080675310562	26847	23	HIST1H1C KAT5 HIST2H2AC HIST1H1E HIST1H1D CABIN1 H2AFJ RB1 H2AFV TINF2 TERF2IP
