pathway	pval	padj	ES	NES	nMoreExtreme	size	leadingEdge
GO_POST_GOLGI_VESICLE_MEDIATED_TRANSPORT	0.703557657076056	0.908329670716893	-0.228784080416388	-0.860695716789281	40322	46	SCAMP2 EXOC2 NSF VPS13A VAMP8 VTI1A VAMP5 KLHL20 STX4 SPTBN1 VAMP2 AP2A1
GO_REGULATION_OF_HEMOPOIESIS	0.537504838085408	0.867747381372024	0.205131930226085	0.965760209615952	20830	116	CTNNB1 SASH3 CYLD PRMT1 PRDM1 RIPK2 NFKBID RARA NFKBIA IRF1 CD83 RASGRP1 CD46 RIPK1 RNF41 CDC73 PAF1 MTOR PTK2B TGFB1 GATA3 HLA-B RASSF2 TNFSF9 XBP1 MYC CLPTM1 CD74
GO_ION_TRANSMEMBRANE_TRANSPORT	0.000128340873359643	0.0350085382331027	-0.379264753826048	-1.75116240425596	7	145	COX7A2L CCDC109B P2RX4 ATP5G1 ARHGEF9 STOML2 SLC1A5 UQCRC1 ATP5D SLC1A4 TRPM7 ANXA6 CCL3 CLIC1 UQCR10 SLC41A3 ORAI1 PTPRC RAF1 FKBP1A NDUFA4 BAX TRPV2 COX6B1 SLC9A8 TSC22D3 CALM3 FXYD7 TCIRG1 SLC38A2 ATP5C1 STIM2 COX7C KCNAB2 COX6C ATP1A1 RASA3 ATP5E ATP5J CLIC3 ATP11B SLC39A6 ATOX1 WWP1 ATP8A1 ATP5H SLC30A5 ATP5F1 SLC39A8 PLCG2 ATP5J2 IBTK ATP5S ATP5G3 ATP5G2 UQCRH ATP6V0E2 ATP5A1 ATP1B1
GO_POSITIVE_REGULATION_OF_CALCIUM_MEDIATED_SIGNALING	0.175167477287327	0.719050555888587	-0.436862841149898	-1.26472303434034	9543	16	P2RX4 CCL3 CALM3 CCL4 CD8A HINT1 SYK
GO_REGULATION_OF_GLYCOPROTEIN_METABOLIC_PROCESS	0.424263558777645	0.829791398493621	-0.353393527484242	-1.02307839508545	23115	16	CST3 AATF GOLGA2 ITM2A
GO_PYRIMIDINE_NUCLEOTIDE_METABOLIC_PROCESS	0.803966255582716	0.946636526357586	-0.26441233765704	-0.75150480360961	43742	15	NME3 NT5C DCK DCTD ERH AK3
GO_PALATE_DEVELOPMENT	0.233544623078104	0.763451464256652	0.406730653647699	1.19332686457755	10647	15	INSIG1 TIPARP DHRS3 TGFBR3 CSRNP1
GO_INNATE_IMMUNE_RESPONSE_ACTIVATING_CELL_SURFACE_RECEPTOR_SIGNALING_PATHWAY	0.0967938559063757	0.67116199722541	0.292716170500102	1.26791258963999	3969	73	TAB2 UBC PSMD1 NRAS PSMC3 KRAS RELB NFKBIA PSMD11 PSMC1 NFKB1 PSMD7 MALT1 PSMB3 UBB PSMA6 PSMA3 FYN RPS27A IKBKG PSMD13 PSMD5 PSME4
GO_REGULATION_OF_HOMEOSTATIC_PROCESS	0.84424985219156	0.954004782951153	-0.179619612373969	-0.83493027805923	52833	152	COMT P2RX4 ATR TEN1 CAMK2D SMAP1 UCP2 ATG5 ERCC1 ACD CCL3 PTPRC AP3D1 PTPN6 S1PR1 CCT5 ID2 FKBP1A BAX TSC22D3 WNK1 CALM3
GO_GOLGI_TO_PLASMA_MEMBRANE_TRANSPORT	0.902614674748937	0.971695030217519	-0.21631636099453	-0.68293660263688	49882	22	EXOC2 NSF VAMP5 SPTBN1 VAMP2
GO_PROTEIN_TARGETING_TO_MEMBRANE	0.913203374138463	0.971858153865664	0.169318616362259	0.793920025442049	35508	113	ATG3 NUP155 SRP9 RPL34 RAB8B RPL10 CHMP4A RPS4X RPS8 RPL7A SDCBP MYADM RPS27A RPL12 RPS6 RPS3A RPL5 RPS5 RPL4 RPL35 RPS14 RPL37A TESC RPL32 RPL11 RPL21 RPS15A RPL9 RPLP1 RPS9 RPS10 RPL23A RPL23 RPL3 RPL6 RPS28 RPS16 NCF1 SRP68 RPLP2 RPL13 SEC61A1 RPL10A RPL17 RPL7 RPS27 RPS3
GO_MITOTIC_CELL_CYCLE	0.539951041928195	0.868094176773882	0.179479068273265	0.977700963915739	17204	341	NSUN2 UBC LMNA NDE1 CCNK DYNLT3 NUP155 PSMD1 CEP135 PRMT1 YEATS4 PSMC3 MAPRE2 SNX9 POGZ CDKN2D EMD WAPAL CNOT2 DYNLT1 BTG2 NUPL1 RAE1 PAFAH1B1 NEDD9 PSMD11 PSMC1 DBF4 EML4 RAB8A HTT EIF4EBP1 SFI1 CALM2 SMARCA4 ARHGEF2 SIRT2 SMC3 CHMP4A PPP6C RAD21 CNOT6L MAP9 CDKN1A BIRC2 SOX4 NOLC1 PRIM2 CDC27 PSMA7 USP16 LPIN1 TGFB1 MCM5 CDKN1B HELLS GTPBP8 PSMD7 PSMB3 BACH1 CDC14A STAG2 UBB PSMA6 PSMA3 SYF2 ACTR1A RPS27A TRIAP1 CSNK2A1 CDK5RAP2 PSMD13 TAOK3
GO_PROTEIN_COMPLEX_BIOGENESIS	0.00103666676133943	0.13285930410916	-0.272790391476404	-1.42703864778332	72	430	CLPP SLC9A3R1 HM13 SOD2 DBNL HDAC3 NUFIP1 AREG HDAC1 EIF2AK3 TRAPPC9 P2RX4 ANXA2 PREX1 TBCA VBP1 AIF1 CHMP2A TAZ CAT FERMT3 NDUFB5 EVL HIST1H1C TBCD CAMK2D KIFAP3 STOML2 KAT5 NCOR1 TSPAN4 EXOC2 H2AFY TBC1D20 NDUFS7 RNF213 TRPM7 ANXA6 NSF CLASP1 UQCR10 GPS1 NDUFB3 SNAP29 ARPC4 OFD1 MCFD2 OXA1L HIST1H1E RAF1 FKBP1A AP2B1 NUP54 NDUFS3 SEPT11 BAX ASL H1FX TRIM22 NDUFB10 SMARCA5 NAP1L4 GOLGA2 KPNA3 SEC31A TLE1 SEPT9 YWHAB ST13 ZBTB1 SHARPIN NDUFB7 GSN LPXN SHKBP1 KIF2A TCIRG1 DNM1L SLC25A33 AP2S1 CHD4 NDUFS2 MAX JAK2 CAPZA2 PSMD4 TRAPPC2L NDUFAF4 HIST1H1D STX4 PICALM HLA-DMA STRA13 NDUFA13 HCLS1 AFG3L2 TSPYL4 GBP5 ANP32B GSK3B VMA21 ADSL FLOT1 SHPRH VAMP2 ATPIF1 ZNF207 TRIM21
GO_REGULATION_OF_MULTICELLULAR_ORGANISM_GROWTH	0.789397368016346	0.939227051467924	0.257116503512325	0.768553108387366	35930	16	CELF1 AGPAT6 EZR TNKS2 MBD5 GNAS NIPBL
GO_MACROMOLECULAR_COMPLEX_DISASSEMBLY	0.676178700956149	0.897581167929844	-0.205487931794938	-0.899392085415927	41016	103	MRPL18 CHMP2A MCTS1 VPS4A MRPL55 MRPL51 SMARCC2 MRPL11 MRPL41 DENR ARID1A MRPL28 MRPL48 MRPL40 TFIP11 PPP1CA MRPL54 MRPL42 MRPL44 MRPL9 GSK3B HSPA8 MRPL52
GO_POSITIVE_REGULATION_OF_CELLULAR_COMPONENT_BIOGENESIS	0.691761432569275	0.903818156975822	-0.197493494458888	-0.898320109103582	42763	131	RAB3GAP2 ATR PYCARD VPS4A EVL PSMC5 PDCD6IP ERCC1 CLASP1 ARPC1B ARPC4 FAM21C NF2 CREB1 BAX CLSTN3 SEPT9 GSN ARPC3 STUB1 ARPC1A ARPC2
GO_BONE_DEVELOPMENT	0.20995425369694	0.752396546952117	-0.338332688721164	-1.18860883156783	11840	34	FLI1 RUNX2 ANXA2 SEMA4D GLG1 PTPRC ASXL1 PTPN6
GO_NCRNA_PROCESSING	0.316383385862224	0.7793700762235	0.205042127581179	1.05002822606272	11242	203	SRRT EXOSC7 NSUN2 NOL9 DDX21 NOP58 EXOSC10 EXOSC9 NOL8 WBP11 TSR1 WDR75 RPL34 FBL DIS3 RPL10 RNF113A EIF4A3 NOLC1 RPP38 INTS6 ABT1 DUS3L CDK5RAP1 TRMT112 INTS4 RPP30 RPS4X RPS8 TSR2 RPL7A IMP4 LSM6 RPL7L1 LTV1 DCAF13 RPS27A RIOK1 BMS1 RBFA RPL12 MPHOSPH10 ERI3 QTRTD1 RPF1 SKIV2L2 RPS6 QTRT1 HSD17B10
GO_NEGATIVE_REGULATION_OF_TRANSPORT	0.362654240641433	0.798400995526206	0.217760355649296	1.03806221553005	13930	125	PPIF INSIG1 CYLD SREBF2 RAB11FIP1 PTGER4 EMD COMMD1 SRGN NFKBIA PPM1B LITAF CALM2 G3BP2 CRY1 PACSIN2 NFKB1 SOX4 ZC3H12A DYRK2 MTOR PTK2B SVIP TGFB1 EZR UBQLN1 CD300A BRAF SDCBP NR1H2
GO_THYMOCYTE_AGGREGATION	0.47505391278921	0.846955233041039	-0.329732071867231	-0.986374167411068	25993	18	ZFP36L2 CARD11 ATG5
GO_AMINE_METABOLIC_PROCESS	0.0222968984151492	0.438911756911934	0.447267686429696	1.57437646663233	981	29	MECP2 SAT1 LPIN2 PNPLA8 ABHD3 PAFAH1B1 AZIN1 SRM AGPAT6 LPIN1
GO_DNA_MODIFICATION	0.998518518518518	1	-0.137480256288085	-0.443494143201692	55267	24	MPG APEX1 APOBEC3C TET2 ATRX DNMT1
GO_PROTEIN_LOCALIZATION_TO_MEMBRANE	0.999194397967404	1	-0.134400637402322	-0.648474311595122	64495	202	RAB3GAP2 SLC9A3R1 BBIP1 ANXA2 RER1 SSR3 TSPAN14 SSNA1 NSF SKAP1 AP3D1 OXA1L NUP54 RPS15 BAX SRPR IKBKB VAMP5 FYB PACSIN1 NDUFA13 ITGB7 FLOT1 SPTBN1 ITGA4 VAMP2 ZFAND2B PMAIP1 SSR2 ITGB2 RPL36 RPL22 HGS RPL27A ATP1B1 OPTN RPL8 TOMM22 RPL15 RPL14 GET4 RPS4Y1 PACS1 RPL28 FCER1G RPS11 SRP19 SRP14 S100A10 RPL38 TNIK GOLGA4
GO_MITOTIC_SPINDLE_ASSEMBLY	0.491129887706207	0.856337978919559	-0.330989430595772	-0.974737420097057	26853	17	CLASP1 OFD1 GOLGA2 KIF2A ZNF207 RHOA
GO_RESPONSE_TO_ALKALOID	0.619148594950017	0.890731679169308	-0.261353044219752	-0.898468969205961	34745	31	AIF1 SHC1 UQCRC1 CREB1 BAX
GO_AUTOPHAGY	0.878110716099543	0.968011588695275	0.16998791879721	0.838177893681901	32850	155	ATG3 VPS37B UBC VPS25 ANXA7 NR2C2 SQSTM1 CRNKL1 LAMP1 S100A9 SIRT2 CHMP4A RNF41 ATG16L2 TOMM5 UVRAG MTOR SNRPB STX17 MLST8 STX12 PIK3C3 VPS37A VTA1 UBQLN1 GABARAPL2 VMP1 XBP1 UBB RPS27A AMBRA1 ATG2A MTSS1 FOXO1 NRBF2 IST1 CTSA
GO_REGULATION_OF_CELL_PROJECTION_ORGANIZATION	0.883270321361059	0.968538279533792	0.171851809837465	0.826156179956785	33641	132	OPA1 ATG3 VIM CYLD ZEB2 PPP1R16B SIPA1L1 PAFAH1B1 HTT MIEN1 RAB8B MUL1 SETX RAB21 STAP1 MTOR PTK2B B2M RHOG GATA3 EZR BRAF FYN TMEM30A SF3A2 CUX1 RAB7L1 IST1 RAP1A RRN3 RAB11A ICAM1
GO_REGULATION_OF_ACTIN_FILAMENT_LENGTH	0.129486518976473	0.67116199722541	-0.313230620157875	-1.2496773982568	7539	61	PREX1 PYCARD EVL TWF1 GMFG WDR1 ARPC1B FAM21C HAX1 GSN ARPC3 RASA1 ARPC1A LATS1 ARPC2 CAPZA2 HCLS1 SPTBN1 ACTR3 SH3BGRL3 SPTAN1 CORO1A ARPC5 ARPC5L CAPG IQGAP2
GO_REGULATION_OF_TRANSPORTER_ACTIVITY	0.863930395968825	0.959535417875824	-0.200650593629588	-0.761334507349037	49548	48	SLC9A3R1 CAMK2D FKBP1A WNK1 CALM3 PARK7 STIM2 GRK6 VAMP2 ACTN4 KLHL24 PLCG2 ATP1B1 WWP2
GO_CELL_JUNCTION_ORGANIZATION	0.73670897718911	0.919473587000761	0.227088606410381	0.837466693351917	32037	35	CTNNB1 GNPAT ITGA5 SMAD7 RAB8B PTK2B TGFB1 VMP1 MYADM
GO_PROTEIN_DESTABILIZATION	0.431189824220475	0.831649002756007	0.327233506542357	1.01305534667643	19525	18	MUL1 MYLIP CDC73 SENP2 XBP1 DERL1
GO_EAR_DEVELOPMENT	0.777348894237319	0.934074425479011	0.228141945112975	0.803056693643015	34235	29	INSIG1 PAFAH1B1 NR4A3 TGFB1 GATA3 CDKN1B DFNB31 RBPJ
GO_POSITIVE_REGULATION_OF_SMOOTH_MUSCLE_CELL_PROLIFERATION	0.108784945263729	0.67116199722541	-0.426181150854933	-1.34550482420562	6011	22	AIF1 SHC1 CAMK2D ID2 DDX39B GSK3B CCL5 RPS6KB1 AKR1B1 TGFBR2
GO_MEMBRANE_BUDDING	0.343442300118157	0.796082189130783	-0.264052771082638	-1.06570609728399	20055	65	AREG TRAPPC9 ANXA2 CHMP2A VPS4A PDCD6IP TBC1D20 NSF MCFD2 AP2B1 GOLGA2 SEC31A AP2S1 TRAPPC2L PICALM
GO_REGULATION_OF_SYNAPTIC_PLASTICITY	0.222985563862509	0.759901998372426	0.349022733220656	1.18294441984569	9931	25	MECP2 KRAS SIPA1L1 RARA RAB8A PTK2B RAB3GAP1 BRAF
GO_NCRNA_TRANSCRIPTION	0.524839214322962	0.865592788704611	-0.251889817990334	-0.960594024981638	30193	49	INTS10 POLR2F TAF11 POLR2J GTF3C1 POLR2G TBP INTS12 POLR2L TAF13 TAF9 POLR2H GTF3C2 GTF2F1 GTF3C5
GO_REGULATION_OF_INTERLEUKIN_1_BETA_PRODUCTION	0.0623378047443255	0.589699526520641	-0.486542757602014	-1.45546414312045	3410	18	PYCARD GSDMD ARRB2 CCL3 HSPB1 JAK2 IFI16
GO_NEGATIVE_REGULATION_OF_INTRINSIC_APOPTOTIC_SIGNALING_PATHWAY	0.268759376803231	0.769493765572321	0.300565174826636	1.12348685781327	11643	37	OPA1 PPIF HYOU1 CDKN2D MCL1 NOC2L ARHGEF2 TPT1 XBP1 TRIAP1 CD74 PTTG1IP
GO_CD4_POSITIVE_ALPHA_BETA_T_CELL_ACTIVATION	0.300459169101654	0.777892138083685	0.375273985680541	1.12174047271092	13675	16	PTGER4 RELB BCL3 SATB1 GATA3 BRAF IL18R1 RC3H2 RORA
GO_LYMPHOCYTE_ACTIVATION	0.0286569855427118	0.491978318233269	-0.296699252597858	-1.36426794533249	1779	141	ITK ZFP36L2 RUNX2 CCND3 IGBP1 LGALS1 CARD11 ITGB1 PREX1 SP3 IL7R TBX21 CEBPB PRKCB STOML2 CD151 MFNG ATG5 ERCC1 FLT3LG PTPRC DOCK8 ID2 FKBP1A NCR1 BAX MYH9
GO_REGULATION_OF_PEPTIDYL_SERINE_PHOSPHORYLATION	0.650084806803132	0.892719872915756	0.23093687388228	0.890131123508075	27978	42	RICTOR STK4 RIPK2 SMAD7 TGFB1 RASSF2 BRAF ATP2B4 AXIN1 DDIT4 BAK1 TNF PDE4D AKT2
GO_NITROGEN_COMPOUND_TRANSPORT	0.917824184947473	0.973750377720849	-0.170051656110391	-0.791876034739752	57486	154	SRSF9 SNX19 SLC9A3R1 XPO1 EIF2AK3 MRPL18 LRPPRC SLC1A5 SLC1A4 PABPN1 THOC7 NUP133 RAF1 DDX39B NUP54 EIF4E SLC25A33 PARK7 SLC38A2 RAN C14orf166 ATP11B SLC25A5 DDX39A FLOT1 VAMP2 NF1 UPF3A SMG1 NUP50 HNRNPA2B1 CYB5R4 RANBP1
GO_DEFENSE_RESPONSE_TO_OTHER_ORGANISM	0.91009612262129	0.971858153865664	-0.173990867801331	-0.785580379273783	56050	125	TMEM173 PLSCR1 PYCARD IFI44L AIMP1 CEBPB MX1 PTPRC FGR ACIN1 TRIM22 ROMO1 C8orf59 TNFRSF14 CD8A CRCP APOBEC3C LSM4 EIF2AK2 BECN1 MDH1 IFI16 PMAIP1 IRF7 HERC5 EIF2AK4 SYK MB21D1 ATP1B1 OPTN IFIT2 TSPAN32 SPN SNRPD1 TICAM1 IFITM2 FCER1G RELA C19orf66 TNIK ADAR SERPINE1
GO_LEUKOCYTE_PROLIFERATION	0.53903265723355	0.867754212136634	-0.284041607042581	-0.943722674653373	30056	27	CCND3 IL7R CD151 PTPRC DOCK8 BAX
GO_CELLULAR_RESPONSE_TO_INTERFERON_GAMMA	0.140973917967229	0.687631354215126	-0.358404235279658	-1.26800166641781	7966	35	AIF1 CAMK2D CCL3 SP100 TRIM22 NCAM1 CCL4 JAK2 GBP5 MT2A TRIM21 CCL5 TRIM38 IRF7
GO_IN_UTERO_EMBRYONIC_DEVELOPMENT	0.295040024318573	0.776556576572928	0.234426522597295	1.0765746698848	11646	100	RIC8A CTNNB1 DNAJB6 EPN1 STK4 PRDM1 NCOA1 PSMC3 CNOT2 ANKRD11 TAF8 SIN3A UBE2B ADD1 GATA3 MED21 SENP2 UBE2A RPL7L1 RBPJ SYF2 PRPF19 RTF1 ZNF335 KDM6A RRN3 CUL3 RCN1 HIF1A ZFAND5
GO_ER_NUCLEUS_SIGNALING_PATHWAY	0.00673527073580072	0.237014060990059	0.571403880081256	1.76896235946134	304	18	HSP90B1 LMNA INSIG1 ATF3 HSPA5 PPP1R15B CCDC47 XBP1 EIF2A CALR
GO_VESICLE_CYTOSKELETAL_TRAFFICKING	0.481159355814574	0.849437588877098	0.306963158350932	0.978221195482746	21630	20	NDE1 PAFAH1B1 HTT AP3M1 RASGRP1
GO_REGULATION_OF_TRANSCRIPTION_FACTOR_IMPORT_INTO_NUCLEUS	0.133863865700394	0.673433996505058	0.347150544741374	1.27153926802087	5836	34	CYLD TNFSF14 NFKBIA PPM1B LITAF BCL3 G3BP2 PPP3R1 CHERP ZC3H12A DYRK2 MTOR
GO_MESENCHYMAL_CELL_DIFFERENTIATION	0.396213926396611	0.820456919836156	0.341661902477793	1.0390541566133	17957	17	CTNNB1 ZEB2 TGFBR3 TGFB1 RBPJ
GO_REGULATION_OF_SMALL_GTPASE_MEDIATED_SIGNAL_TRANSDUCTION	0.556576824842049	0.872340536933445	-0.225852930643131	-0.948892258528314	33122	81	ITGB1 PREX1 RASAL3 ARHGEF9 CAMK2D SIPA1 ARHGAP30 RAF1 ARHGDIB GDI2 ARHGEF1 RASA1 MADD CYTH4 RASA3 FLOT1 NF1 ARHGAP1 ARHGEF6 RHOA ARHGAP9 IQSEC1
GO_RNA_MODIFICATION	0.785800185013876	0.937841251438535	0.21590108305212	0.812450098206047	33977	38	NSUN2 TGS1 NOP58 FBL APOBEC3G DUS3L CDK5RAP1 TRMT112 QTRTD1 QTRT1 HSD17B10 DNAJB11 NAF1
GO_CELLULAR_COMPONENT_ASSEMBLY_INVOLVED_IN_MORPHOGENESIS	0.516381008839991	0.863566332903391	-0.254264413782927	-0.964763017652349	29615	48	BBIP1 DICER1 ITGB1 TBC1D20 TMEM216 WDR1 SNAP29
GO_ORGANELLE_FISSION	0.669576296456938	0.897581167929844	0.185843785307222	0.924711505083718	24699	165	OPA1 NSUN2 NDE1 CCNK DYNLT3 YEATS4 MAPRE2 SNX9 POGZ WAPAL DYNLT1 PAFAH1B1 NEDD9 EML4 SMARCA4 MUL1 ARHGEF2 SIRT2 SMC3 CHMP4A RAD21 MAP9 BIRC2 NOLC1 CDC27 UBE2B USP16 MEI1 HELLS MSH3
GO_MUSCLE_STRUCTURE_DEVELOPMENT	0.489692435577722	0.854438471459352	-0.227919278926889	-0.98207330167722	29454	94	FAM65B LGALS1 ITGB1 TAZ CAMK2D NCOR1 ATG5 FRG1 WDR1 S1PR1 FKBP1A MYH9 CAPN2 JAG1 ARID1A GPX1 VAMP5 FXR1 BIN1 AFG3L2 GSK3B NF1 EPC1 GTF3C5 CTSB
GO_NEGATIVE_REGULATION_OF_CELL_CYCLE_PROCESS	0.136774482707104	0.676978538399073	0.269235360453023	1.20354544249379	5492	86	UBC CCNK PRMT1 ZNF655 WAPAL CNOT2 NUBP1 BTG2 SMARCA4 SMC3 ATF5 CNOT6L CDKN1A CDC73 SOX4 CDKN1B STAG2 UBB SYF2 RPS27A TRIAP1 CSNK2A1 CDK5RAP2 TAOK3 PRPF19 BUB3
GO_RIBOSOMAL_LARGE_SUBUNIT_ASSEMBLY	0.383567652929178	0.810292246472944	0.358689242619064	1.05237583008203	17487	15	RPL10 DHX30 RPL12 FASTKD2 RPL5 RPL11 RPL23A RPL3 RPL6
GO_MAINTENANCE_OF_LOCATION_IN_CELL	0.375403703617649	0.805310536664255	0.270753928276838	1.04360336363668	16156	42	FTH1 SRGN NFKBIA TAF8 G3BP2 HSPA5 PDIA3 UVRAG MORC3 EZR TAF3 FLNB
GO_REGULATION_OF_MICROTUBULE_POLYMERIZATION	0.643698652796412	0.892719872915756	-0.304663607181547	-0.865905752775177	35022	15	TBCD CLASP1
GO_CELLULAR_RESPONSE_TO_OXYGEN_LEVELS	0.00193698949824971	0.14730428521557	0.463448047881698	1.80521943677509	82	44	UBC LMNA HYOU1 NPEPPS PDK3 BNIP3L PPP1R15A EIF4EBP1 SIRT2 MTOR UBQLN1 BACH1 UBB RBPJ RPS27A GNB1 FOXO1 ICAM1 HIF1A EGR1 RORA BAD PRKAA1
GO_CELLULAR_RESPONSE_TO_HORMONE_STIMULUS	0.48495996537546	0.851613756198196	0.199130073959162	0.988805667250576	17927	163	CTNNB1 NR4A2 AHR NCOA1 PTGER4 HMGCS1 NR2C2 RARA ADIPOR1 NR3C1 RAB8A PIAS2 EIF4EBP1 THRAP3 UBE3A NRIP1 ATP2B1 NFKB1 GFPT1 PHIP NR4A3 FBXO32 APRT LPIN1 TGFB1 ATP6V0D1 DDX54 JUND XBP1 NR1H2 FYN GNB1 CTSS ATP6V0C NCOA2 DNAJA1 MED30 UBR5 FOXO1 MED13 CALR SERPINB9 FOS MED17 PIK3R1 ANXA1 PRKAR1A HIF1A ATP6V1E1
GO_DNA_REPAIR	0.635830466061933	0.892719872915756	-0.194696480544301	-0.929081231352902	40654	185	ATR TAOK1 NSMCE1 HMGN1 POLR2F RNF138 ZNF830 COPS5 KAT5 ERCC1 MPG GPS1 TDP2 MDC1 POLR2J HUWE1 NSMCE2 ASTE1 SSRP1 POLR2G APEX1 COPS7B TREX1 SMARCA5 KIF22 ZBTB1 STUB1 REC8 USP10 POLR2L
GO_PROTEIN_POLYMERIZATION	0.173362656224857	0.718927907148687	-0.370252025297061	-1.2419287668775	9695	28	PREX1 AIF1 CHMP2A CLASP1 ARPC4 GOLGA2 GSN DNM1L JAK2 HCLS1 ZNF207
GO_CELLULAR_RESPONSE_TO_CORTICOSTEROID_STIMULUS	0.401706402298598	0.820456919836156	0.353633052012458	1.03754122632356	18314	15	AHR NR3C1 ATP2B1 FBXO32 TGFB1 FOXO1 ANXA1
GO_SIGNAL_TRANSDUCTION_IN_RESPONSE_TO_DNA_DAMAGE	0.139631304021925	0.687631354215126	0.317539619223941	1.24237828603768	5960	45	UBC PRMT1 CNOT2 BTG2 BCL3 CNOT6L CDKN1A SOX4 CDKN1B UBB RPS27A TRIAP1 BID PRPF19
GO_MUSCLE_CONTRACTION	0.449923473426807	0.842827608595738	-0.273357587795305	-1.00191336028502	25574	41	TAZ CAMK2D RCSD1 PABPN1 CXCR4 IKBKB CALM3 SMAD5 ATP1A1 SLMAP RPS6KB1 TLN1 ATP1B1 SRSF1 EEF2 MYL12A UTRN NDUFS6
GO_TRANSITION_METAL_ION_HOMEOSTASIS	0.263615163016142	0.769493765572321	0.311705823725579	1.13341809454978	11529	33	FTH1 COMMD1 NUBP1 FBXL5 S100A9 PRNP B2M SLC39A10 MYC IREB2 HIF1A SFXN1 CUTC S100A8
GO_ENZYME_LINKED_RECEPTOR_PROTEIN_SIGNALING_PATHWAY	0.203460537861178	0.752396546952117	-0.22966521813206	-1.11933307997427	13216	220	ITK RUNX2 PLEKHA1 AREG EIF2AK3 TXNIP ITGB1 IGF2R MAPKAPK3 SHC1 POLR2F NEDD8 ARRB2 LNPEP ARPC1B EPHA4 ARPC4 POLR2J ZYX FGR PDCD6 RAF1 FKBP1A POLR2G CREB1 AP2B1 HSPB1 ARPC3 STUB1 RASA1 ARPC1A ELMO1 IQGAP1 TCIRG1 EIF4EBP2 POLR2L ARPC2 CD8A AP2S1 HNRNPM SMAD5 JAK2 POLR2H
GO_REGULATION_OF_DEFENSE_RESPONSE_TO_VIRUS_BY_VIRUS	0.468553573374996	0.845761401946154	-0.321603003580527	-0.989986209480539	25791	20	AP1M1 AP1S2 AP2B1 ELMO1 AP2S1 EIF2AK2 AP2A1 AP1B1 DOCK2 PACS1
GO_REGULATION_OF_CALCIUM_ION_TRANSMEMBRANE_TRANSPORT	0.81677449168207	0.948806331627534	-0.222502817240105	-0.776091995330999	45954	33	CAMK2D ATG5 PTPN6 FKBP1A BAX CALM3 STIM2
GO_RESPONSE_TO_BACTERIUM	0.31280193236715	0.7793700762235	0.220320164033333	1.05916175836252	11913	132	NFKB2 MAPK8 IL27RA RIPK2 PTGER4 HNRNPA0 RARA IFNAR1 NFKBIA IRF8 S100A9 LITAF BCL3 SIRT2 NFKB1 CDC73 STAP1 ZC3H12A PAF1 B2M OTUD5 TGFB1 HLA-B MALT1 JUND XBP1 RBPJ HLA-A RAB14 TNFRSF1B PRPF8 ADAM17 SPON2 ICAM1 SERPINB9 FOS HIF1A TNFAIP3 TNF PDE4D DUSP10 RAB1A PDE4B ANKRD17 NFKBIB
GO_POSITIVE_REGULATION_OF_LEUKOCYTE_MIGRATION	0.64491526933837	0.892719872915756	-0.257045495809514	-0.883660652771364	36191	31	PYCARD AIF1 CCL3 ZNF580 MIA3 CCL4 TNFRSF14
GO_CALCIUM_ION_IMPORT	0.170578396956386	0.717168815018442	-0.448114978826188	-1.27361893223795	9280	15	CCDC109B CCL3 ORAI1 PTPRC RASA3 PLCG2 IBTK
GO_CELL_MATURATION	0.363589536862851	0.798400995526206	0.316458957621901	1.06096718341193	16234	24	MECP2 CTNNB1 NR4A2 MTCH1 CDKN1A AGPAT6 PTK2B GATA3 XBP1
GO_REGULATION_OF_SECRETION	0.886987601214575	0.968966318327085	-0.17344328270874	-0.817012017240774	56085	168	SLC9A3R1 SNF8 COMT P2RX4 PYCARD CHMP2A GSDMD VPS4A PDCD6IP UCP2 ATG5 NSF CCL3 CLASP1 VPS35 FGR VAMP8 CREB1 WNK1 TNFRSF14 DNM1L RAB27B JAK2 CD2 STX4 SLC25A5 SPTBN1 VAMP2 ERP29 NF1 CCL5 IRS2 PTPN11 PIM3 SOCS1
GO_MODULATION_OF_TRANSCRIPTION_IN_OTHER_ORGANISM_INVOLVED_IN_SYMBIOTIC_INTERACTION	0.480821187671157	0.849437588877098	-0.345810534587164	-0.982852313866458	26160	15	HDAC1 CCL3 TAF11 CCL4
GO_APOPTOTIC_SIGNALING_PATHWAY	0.939935861775582	0.981902864809201	-0.169455734193316	-0.753167360901018	57446	113	SOD2 P2RX4 PYCARD CEBPB ANXA6 PDCD6 RAF1 TMEM109 BAX TNFRSF14 GPX1 SHISA5 DNM1L DIDO1 JAK2 TM2D1 NDUFA13 GSK3B ZMAT3 ZNF622 IFI16 NF1 PMAIP1 GABARAP HINT1 ATF4 IFI6 CD38
GO_NEURAL_NUCLEUS_DEVELOPMENT	0.79834478282036	0.94454768280674	-0.23849325083484	-0.777731298751865	44276	25	G6PD NDUFS3 COX6B1 CALM3 ATP5J RHOA ZNF430 ATP5F1 MBP ACTB
GO_LYMPHOCYTE_MEDIATED_IMMUNITY	0.660656601123596	0.897571641260889	-0.238216340223911	-0.882473624713807	37630	43	ERCC1 MYO1G PTPN6 HLA-DQB1 CD55 JAG1 CD8A PRDX1 VAMP2 IRF7 CTSC CORO1A TUBB FCER1G HLA-DRB1
GO_FC_EPSILON_RECEPTOR_SIGNALING_PATHWAY	0.0388478065354252	0.517927889791114	0.302335685631285	1.36311090513679	1554	90	TAB2 UBC MAPK8 PSMD1 LAT2 NRAS PSMC3 KRAS LAT NFKBIA VAV1 PSMD11 PSMC1 CALM2 PPP3R1 NFKB1 NR4A3 PSMA7 PSMD7 MALT1 PSMB3 UBB PSMA6 PSMA3 RPS27A IKBKG PSMD13 PSMD5 PSME4 NFATC2 CALM1 FOS PIK3R1 PSMB1
GO_HIPPOCAMPUS_DEVELOPMENT	0.104769107571848	0.67116199722541	0.426564852727282	1.35936436941647	4709	20	ZEB2 NCOA1 KDM6B RARA BTG2 PAFAH1B1 NR4A3 UBA6 ATP2B4
GO_RIBONUCLEOSIDE_TRIPHOSPHATE_BIOSYNTHETIC_PROCESS	0.000703196841023422	0.107896765294531	-0.593906563130598	-1.93674127491636	38	25	ATP5G1 STOML2 ATP5D CHCHD10 NME3 TCIRG1 ATP5C1 ATP5E ATP5J ATP5H ATP5F1 ATP5J2 ATP5S ATP5G3 ATP5G2 ATP5A1
GO_REGULATION_OF_CHROMOSOME_SEGREGATION	0.99334678132852	1	-0.149703860837754	-0.529638677018798	56137	35	ANAPC10 H2AFY NSMCE2 GOLGA2 BECN1 ZNF207 ANAPC11 ATRX
GO_PROTEIN_K11_LINKED_UBIQUITINATION	0.207318642136411	0.752396546952117	-0.432206124843206	-1.22840326532137	11279	15	ANAPC5 ANAPC10 UBE2L3 UBE2E3
GO_SPHINGOLIPID_METABOLIC_PROCESS	0.677619013935064	0.897581167929844	-0.243416027304055	-0.866689207900737	38317	36	HEXA ST6GALNAC6 CSNK1G2 CERS4 BAX ST3GAL1 PPP2R1A SAMD8 UGCG ST8SIA4 PPT1
GO_PROTEIN_ACETYLATION	0.646867661361103	0.892719872915756	0.219371564783272	0.900977859373124	27269	56	MECP2 YEATS4 NCOA1 WDR75 PHF20 HAT1 PER1 POLE3 CRTC2 SRCAP NCOA2 MORF4L2 FOXO1 KAT6A NAA50 TRRAP
GO_REGULATION_OF_NUCLEOCYTOPLASMIC_TRANSPORT	0.460346198751248	0.844862093710877	-0.240504395895463	-0.996662879252188	27205	75	TMEM173 SLC9A3R1 HDAC3 XPO1 KPNA1 XPO4 RBCK1 SP100 NUP54 PARK7 JAK2 RGS19 HCLS1 PRDX1 ANP32B GSK3B NF1 RHOA PTPN11 UHMK1 TBC1D10C
GO_FORMATION_OF_TRANSLATION_PREINITIATION_COMPLEX	0.509172397126348	0.86039650219679	0.320759023504588	0.958788491559937	23175	16	EIF3J EIF3L EIF2D EIF3D EIF3F EIF3G
GO_REGULATION_OF_PROTEIN_SECRETION	0.95660669424214	0.990079862716886	0.162038237296321	0.746976942127548	37696	102	ARNTL CRTAM RAB11FIP1 PTGER4 IFNAR1 SRGN TARDBP SLC2A1 RASGRP1 CPT1A SOX4 ZC3H12A TGFB1 GATA3 EZR PIK3C3 XBP1 NR1H2
GO_REGULATION_OF_PEPTIDYL_TYROSINE_PHOSPHORYLATION	0.603663342585929	0.886271719635707	-0.228942204675525	-0.921485864362887	35230	64	ITGB1 SEMA4D SHC1 ZGPAT ARRB2 RAP2C PTPN6 NF2 CD81 UNC119 HAX1 TNFRSF14 SH3BP5 JAK2 FBXW7 HCLS1 CCL5 PPP2R1A SOCS1 ITGB2 IBTK SYK SOCS3
GO_RESPONSE_TO_INSULIN	0.900174771255269	0.971685667298969	-0.186747721088213	-0.751654267629091	52535	64	CAT SHC1 UCP2 TCIRG1 EIF4EBP2 SLC25A33 MAX USF1 GSK3B VAMP2 CCL5 IRS2 PTPRA RPS6KB1 ATP6V0E2 SOCS3 PRKCQ PTPN1 RELA ATP6V1D SRSF5 ATP6V0B
GO_REGULATION_OF_CATABOLIC_PROCESS	0.7932684689253	0.940940747076807	0.166975394813518	0.911284132740326	25029	349	TAB2 ARNTL UBC U2AF1 MAPK8 SNX1 PSMD1 KDM4A SREBF2 RFWD2 PSMC3 RIPK2 CRTC3 WBP11 RNF139 SNX9 COMMD1 SMAD7 HERC1 TIPARP BNIP3L BTG2 ECD WDR75 SQSTM1 AZIN1 PSMD11 PSMC1 FBXL5 PIK3CG NUB1 UFL1 LONP2 UBE2K USP14 MYLIP UBE3A SIRT2 CHMP4A CPT1A ZC3H12A CDC27 PSMA7 UVRAG MTOR PTK2B RAB3GAP1 SVIP PABPC1 ARIH1 CDKN1B EZR GTPBP1 PSMD7 UBQLN1 GABARAPL2 EXOC7 ATP6V0D1 VMP1 PSMB3 SDCBP XBP1 UBB PSMA6 PSMA3 FYN ATP2B4 RPS27A ATP6V0C CSNK2A1 PSMD13 PTTG1IP TNFRSF1B ERLEC1 PSMD5 PIP4K2A AMBRA1 BUB3 AXIN1 PSME4 FOXO1 UBXN2A NRBF2 DDIT4 CTSA SUMO1 PDCL3 PLEKHF1 PSMB1 CUL3 ITPR1 DYNC1LI1 HIF1A TNFAIP3 TNF ATP6V1E1 ATG14 PSMB7
GO_REGULATION_OF_CARBOHYDRATE_METABOLIC_PROCESS	0.188390389113332	0.733835819474625	0.294145274803296	1.18249916606426	7973	51	PTGER4 PDK3 ECD ADIPOR1 NFKB1 GFPT1 DYRK2 MTOR PTK2B TGFB1 SMEK2 NCOA2 FOXO1 DDIT4 HIF1A MIDN AKT2 RORA MLXIP BAD PRKAA1
GO_B_CELL_ACTIVATION	0.0491162563467276	0.549466203911694	-0.376495688272588	-1.41639324596397	2814	46	IGBP1 LGALS1 ITGB1 SP3 IL7R PRKCB MFNG ERCC1 PTPRC BAX ZBTB1
GO_REGULATION_OF_NEURON_DIFFERENTIATION	0.932826559106423	0.979765011861285	0.165628789210301	0.780530768792779	36077	117	OPA1 VIM ZEB2 NCOA1 SIPA1L1 SPAG9 RARA PAFAH1B1 C3orf17 MUL1 SETX RAB21 MTOR EIF4G1 PTK2B B2M CDK5RAP1 GATA3 BRAF FYN TMEM30A SF3A2 CDK5RAP2 CUX1 RAB7L1 PRPF19 IST1 RAP1A RRN3 RAB11A CALR
GO_NEGATIVE_REGULATION_OF_NF_KAPPAB_TRANSCRIPTION_FACTOR_ACTIVITY	0.250765774964264	0.769493765572321	0.330070377157989	1.15024956814768	11051	28	CYLD COMMD1 NFKBID FAM105B NFKBIA UFL1 TRAF3 ZC3H12A USP7
GO_PROTEIN_POLYUBIQUITINATION	0.558226877198551	0.872340536933445	0.197320785235389	0.960793784176714	21105	143	TRIP12 UBC UBE2F PSMD1 NPEPPS PSMC3 RNF139 MGRN1 PSMD11 PSMC1 UBE2K MYLIP UBE3A BIRC2 RNF41 CDC27 UBE2B PSMA7 RNF115 ARIH1 RLIM RNF126 PSMD7 RNF181 PPIL2 PSMB3 UBE2A TNKS2 UBB RNF145 PSMA6 PSMA3 WSB1 RPS27A PSMD13 FBXO6 PSMD5 PRPF19 UBR5 PSME4
GO_RIBONUCLEOPROTEIN_COMPLEX_LOCALIZATION	0.31185851113343	0.7793700762235	0.245796651871742	1.07272867566934	12730	76	U2AF1 NUP155 RBM8A CASC3 TGS1 SRSF2 NOP58 NUPL1 RAE1 EIF5A SMG5 SRSF4 EIF4A3 SRSF7 SHFM1 POLR2D SLU7 DHX38
GO_REGULATION_OF_MRNA_3_END_PROCESSING	0.328107057680417	0.786222381464543	0.353719777811845	1.09505201934786	14857	18	CCNT1 BTG2 CDC73 PAF1 PABPC1 LEO1
GO_REGULATION_OF_PEPTIDE_TRANSPORT	0.0390730067243036	0.517927889791114	0.333078080502158	1.40618711532875	1626	64	ARNTL CYLD TNFSF14 PTGER4 NFKBIA TARDBP PPM1B S100A9 LITAF BCL3 RAB8B SLC2A1 CPT1A SOX4 ZC3H12A CD74 IL18R1 RAP1A CDK16 ITPR1 HIF1A TNF MIDN HMGCR NFKBIB ARL2BP ARHGEF7 BAD S100A8 GNAS
GO_POSITIVE_REGULATION_OF_ION_TRANSPORT	0.252107838034766	0.769493765572321	-0.292779429841676	-1.1347242037027	14531	53	P2RX4 ARRB2 CCL3 ORAI1 VAMP8 BAX TRPV2 WNK1 CALM3 CCL4 PARK7 STIM2 ATP8A1 ACTN4 CCL5
GO_ATP_BIOSYNTHETIC_PROCESS	0.00142728093947606	0.13285930410916	-0.583175711684901	-1.88125203991308	78	24	ATP5G1 STOML2 ATP5D CHCHD10 TCIRG1 ATP5C1 ATP5E ATP5J ATP5H ATP5F1 ATP5J2 ATP5S ATP5G3 ATP5G2 ATP5A1
GO_CANONICAL_WNT_SIGNALING_PATHWAY	0.0223478491299355	0.438911756911934	0.52447472281304	1.6236782344097	1011	18	CTNNB1 NR4A2 FAM105B SOX4 UBE2B TCF7 MYC AXIN1 SCYL2 KDM6A CHD8 APC CSNK1A1
GO_HUMORAL_IMMUNE_RESPONSE	0.128161659998644	0.67116199722541	0.376008432788197	1.29945104832881	5669	27	BCL3 CD83 C1QBP CD46 B2M GATA3 RBPJ HLA-A SPON2 TNF GPR183 YTHDF2
GO_CHROMATIN_MODIFICATION	0.51499239620097	0.86183117428315	0.188459584681654	0.980591002497636	17947	229	ATAD2 MECP2 BRD2 CTNNB1 BAZ1A KDM4A PRMT1 YEATS4 NCOA1 SMARCE1 ARID4B JMJD6 KDM6B SMARCD1 WDR75 NR3C1 CHD1 FBL SMARCA4 SATB1 SIN3A SIRT2 PHF20 CDC73 DPY30 UBE2B PAF1 HAT1 BRD9 USP16 PER1 GATA3 ARID2 HELLS POLE3 UBE2A USP15 CRTC2 MYC SRCAP TDG NCOA2 LEO1 PBRM1 MORF4L2 HNRNPC PSME4 RTF1 KAT6A NAA50 ZNF335 VRK1 KDM6A MTA2
GO_MYELOID_LEUKOCYTE_ACTIVATION	0.51739770792102	0.864536454207268	0.258251270758658	0.959525277721859	22482	36	LAT2 CRTC3 JMJD6 RELB LAT PIK3CG RASGRP1 NR4A3 TGFB1 TNFSF9 RBPJ
GO_ANTERIOR_POSTERIOR_PATTERN_SPECIFICATION	0.694175086458263	0.905654352760987	0.246484391063047	0.851827705002521	30710	27	CTNNB1 ZEB2 BTG2 RBPJ AXIN1 KDM6A
GO_POSITIVE_REGULATION_OF_CELL_DIVISION	0.0727635768379774	0.626788003990296	-0.426966500107938	-1.40544320156486	4044	26	CAT ANAPC10 H2AFY CDC25B NSMCE2 GOLGA2 BECN1 PHB2 RHOA ANAPC11 RANBP1 KIF20B
