pathway	pval	padj	ES	NES	nMoreExtreme	size	leadingEdge
GO_LIPID_BIOSYNTHETIC_PROCESS	0.696585947443891	0.906263116573796	-0.195482780974296	-0.897889850081026	43234	140	PLSCR1 RNPEP ST6GALNAC6 ACSS1 PLA2G16 TAZ FABP5 LPGAT1 G6PD CSNK1G2 ALG5 ACOT7 CERS4 CPNE1 DDHD2 CDIPT DGKE DPM3 PIGC AGPAT5 STARD3 HINT2 MSMO1 PTDSS1 PEMT IRS2 ELOVL5 C14orf1 PTPN11 SAMD8 ARF3 PLCG2 AKR1B1 UGCG SYK LBR PRKAG1 ST8SIA4 PTPLAD2 PIGH INPP4B AGPAT2 PIGS FRS2
GO_CELLULAR_RESPONSE_TO_CALCIUM_ION	0.720038666871718	0.916854215337172	0.273554570030706	0.817688527335587	32773	16	PPIF FUS BRAF JUND FOS MEF2A CPNE3
GO_DNA_METHYLATION_OR_DEMETHYLATION	0.997697284257466	1	-0.147903887289919	-0.442445810188576	54591	18	APEX1 APOBEC3C TET2 ATRX DNMT1
GO_POSITIVE_REGULATION_OF_CANONICAL_WNT_SIGNALING_PATHWAY	0.027691721080978	0.483200027282371	0.352296144939628	1.45789971382573	1161	58	ARNTL UBC PSMD1 PSMC3 PSMD11 PSMC1 NFKB1 SOX4 PSMA7 PSMD7 PSMB3 TNKS2 UBB PSMA6 PSMA3 RBPJ RPS27A PSMD13 PSMD5 UBR5 AXIN1 PSME4
GO_REGULATION_OF_NEURON_PROJECTION_DEVELOPMENT	0.974006230529595	0.992094155075225	0.156371732362656	0.700706808686947	39081	87	OPA1 VIM ZEB2 SIPA1L1 PAFAH1B1 MUL1 SETX RAB21 MTOR PTK2B B2M GATA3 BRAF FYN TMEM30A SF3A2 CUX1 RAB7L1 IST1 RAP1A RRN3 RAB11A
GO_MICROTUBULE_ORGANIZING_CENTER_ORGANIZATION	0.0886281955651997	0.669233144694375	0.395724864218955	1.36758924752296	3920	27	CTNNB1 NDE1 CEP135 GCC2 PAFAH1B1 UVRAG
GO_VACUOLE_ORGANIZATION	0.8364489146263	0.954004782951153	-0.194419938308738	-0.803949947820337	49398	74	SNF8 CHMP2A VPS4A PDCD6IP ATG5 VPS36 SNAP29 HPS1 LAMTOR1 VAMP8
GO_CARDIOCYTE_DIFFERENTIATION	0.478984557109557	0.849437588877098	-0.323558008170079	-0.982635654465467	26301	19	ITGB1 CAMK2D ATG5 JAG1 ARID1A
GO_RESPONSE_TO_GROWTH_FACTOR	0.814789742597876	0.948806331627534	-0.184410022971284	-0.844492888369335	50551	137	RUNX2 ITGB1 CAT SHC1 POLR2F NEDD8 TGIF1 ARRB2 ACAP2 POLR2J ZYX RAF1 FKBP1A POLR2G CREB1 HSPB1 PDCD5 IQGAP1 POLR2L HNRNPM SMAD5 POLR2H BECN1 NR4A1 GSK3B GTF2F1 CCL5 RHOA PTPN11 RPS6KB1 DUSP6 CEP57 BPTF CORO1A TGFBR2 NCBP2 EEF2 FRS2 DNMT1 POLR2C C10orf54 TIAL1
GO_REGULATION_OF_LEUKOCYTE_MEDIATED_IMMUNITY	0.400818730249928	0.820456919836156	0.245400077959833	1.02591377042412	16742	61	SASH3 CRTAM IL27RA SNX4 VAV1 LAMP1 RASGRP1 STAP1 B2M TGFB1 GATA3 HLA-B CD300A MALT1 HLA-A XCL1 NCR3 ICAM1 SERPINB9 WAS TNF AP1G1
GO_RETROGRADE_VESICLE_MEDIATED_TRANSPORT_GOLGI_TO_ER	0.565400398020465	0.877054343753871	-0.256472751688674	-0.935102650489893	32103	40	RER1 KIFAP3 NSF KDELR1 KIF22 ARF5 KIF2A SCYL1 COPZ1 ARCN1
GO_NEGATIVE_REGULATION_OF_CELL_CYCLE_PHASE_TRANSITION	0.166546085949935	0.708952361061087	0.280035405072475	1.1894503530152	6905	66	UBC PRMT1 ZNF655 CNOT2 BTG2 SMARCA4 ATF5 CNOT6L CDKN1A CDC73 SOX4 CDKN1B UBB SYF2 RPS27A TRIAP1 CSNK2A1 TAOK3 PRPF19 BUB3 FBXO7 TFDP2
GO_MITOCHONDRION_ORGANIZATION	0.232109483330319	0.762823088037055	-0.220291839157338	-1.0972726567839	15399	263	SOD2 MRPL18 THEM4 TAZ NDUFB5 MRPL55 STOML2 MRPL51 ATG5 NDUFS7 SLC1A4 UQCR10 NDUFB3 OXA1L TOMM70A MRPL11 MRPL41 CHCHD10 ACIN1 NDUFS3 BAX TBC1D5 NDUFB10 MAP2K1 YWHAB C8orf59 HAX1 SHARPIN NDUFB7 MRPL28 MRPL48 MRP63 MRPL40 PANK2 DNM1L SLC25A33 HARS PARK7 NDUFS2 MTX1 MRPL54 TFB2M NDUFAF4 JTB MRPL42 NDUFA13 LSM4 AFG3L2 BECN1 MDH1 MRPL44 MRPL9 TUFM SLC25A5 GSK3B PHB2 PHB NOA1 ATPIF1 MRPL52 ZNF593 PMAIP1 AURKAIP1 NDUFS4 MRPS34 SNRPF
GO_REGULATION_OF_STEM_CELL_PROLIFERATION	0.369872470297569	0.802791056284913	-0.345656443144223	-1.06402958965273	20359	20	PHF14 PDCD2 PTPRC NF2 EIF2AK2 NF1 IRS2
GO_REGULATION_OF_CHROMATIN_ORGANIZATION	0.0353592763682976	0.504518449708653	0.329658856294545	1.40896541751349	1461	68	ATAD2 MECP2 TRIP12 CTNNB1 MAPK8 KDM4A NOC2L C6orf89 SIN3A MIER1 UBE2B PAF1 TGFB1 GATA3
GO_REGULATION_OF_MITOCHONDRIAL_MEMBRANE_POTENTIAL	0.176395459696713	0.719050555888587	-0.376821956911939	-1.24038269374381	9805	26	STOML2 UCP2 CLIC1 PANK2 SLC25A33 PARK7 GSK3B ATPIF1 PMAIP1
GO_CELL_FATE_COMMITMENT	0.467807211184695	0.845761401946154	0.2680110337207	0.988382102210319	20343	35	CTNNB1 PRDM1 KDM6B RARA MCL1 NOTCH2 CDC73 PAF1 GATA3 RBPJ LEO1 AXIN1 RTF1
GO_POSITIVE_REGULATION_OF_PEPTIDYL_TYROSINE_PHOSPHORYLATION	0.355391066032653	0.797167808005967	0.269570814883492	1.05469965536661	15171	45	RICTOR ITGA5 RIPK2 PTGER4 YES1 IL6ST ARHGEF2 STAP1 MTOR PTK2B TGFB1 MLST8 FYN CD74 ADAM17
GO_NEGATIVE_REGULATION_OF_HYDROLASE_ACTIVITY	0.704094241700305	0.908329670716893	-0.202147806650181	-0.886102473446355	42734	104	SERPINB1 IGBP1 PSMF1 SEMA4D CST3 ARRB2 CNST GPS1 OXA1L RAF1 FKBP1A IKBKB WNK1 IQGAP1 GPX1 PARK7
GO_MULTI_ORGANISM_REPRODUCTIVE_PROCESS	0.236578732662497	0.766607497051267	0.218930700869416	1.09201779653131	8698	168	BRD2 ARNTL NSUN2 CTNNB1 LMNA ANKRD49 DAZAP1 EPN1 PRDM1 CCT2 NCOA1 PTGER4 ARID4B NR2C2 SPAG9 CELF1 RARA SPAG1 KPNA6 PAFAH1B1 ZNF148 SMARCA4 UBE3A NRIP1 SETX CD46 UBE2B MTOR PTK2B TGFB1 CREM MEI1 RGS2 YY1 PRDX4 VMP1 UBE2A
GO_DETECTION_OF_STIMULUS	0.131174838112858	0.67116199722541	0.336662444702035	1.26688311329326	5671	38	UBC CRTAM CALM2 POLD4 SOX4 UBE2B USP1 HLA-B UBB FYN HLA-A RPS27A GNB1 DNAJA1
GO_ESTABLISHMENT_OF_PROTEIN_LOCALIZATION_TO_VACUOLE	0.447242861305361	0.842656350348935	-0.330862703883312	-1.00481978921595	24558	19	SNF8 AP3B1 VPS36 VPS13A VTI1A GNPTG BECN1
GO_REGULATION_OF_LEUKOCYTE_CHEMOTAXIS	0.844790848940226	0.954004782951153	0.224930755100859	0.744618349159236	37664	23	TNFSF14 C1QBP STAP1 PTK2B CD74 XCL1 ADAM17 THBS1 CALR
GO_NUCLEAR_TRANSCRIBED_MRNA_POLY_A_TAIL_SHORTENING	0.881585914747154	0.968538279533792	0.228914404423508	0.696169112505495	39956	17	CNOT2 CNOT6L EIF4A3 EIF4G1 EIF4A1 CNOT4 CNOT1 CNOT8
GO_CELLULAR_RESPONSE_TO_AMINO_ACID_STIMULUS	0.398534303154355	0.820456919836156	-0.348458136892329	-1.04239209339994	21806	18	LAMTOR2 CEBPB LAMTOR1 CAPN2 CCL5 SOCS1
GO_DNA_GEOMETRIC_CHANGE	0.628736295441431	0.892044689386689	0.240499447526047	0.898966318246002	27239	37	UBC CHD1 SETX MCM5 UBB RPS27A XRCC6 XPC ANXA1 CHD8 DDX3X ASCC3 TOP2B
GO_NUCLEOTIDE_EXCISION_REPAIR_DNA_INCISION	0.618603733029193	0.890716812074293	0.300890722298814	0.882797937655146	28203	15	UBC POLD4 UBB RPS27A
GO_CERAMIDE_METABOLIC_PROCESS	0.866322608585813	0.960904924634407	-0.224965006723663	-0.718695329991301	48008	23	ST6GALNAC6 CERS4 ST3GAL1 PPP2R1A SAMD8 UGCG ST8SIA4
GO_REGULATION_OF_B_CELL_PROLIFERATION	0.620139154713922	0.890837697380152	0.261268246460574	0.894684992061466	27540	26	SASH3 AHR PRDM1 CDKN1A SLC39A10 CD300A CD74 NFATC2
GO_GLYCOSYL_COMPOUND_METABOLIC_PROCESS	4.79623974803754e-05	0.022449614104393	-0.381039553311095	-1.76936602634678	2	151	COX7A2L CARD11 HK1 ATP5G1 OGDH ATIC TAZ NDUFB5 STOML2 UQCRC1 ATP5D NDUFS7 UQCR10 NDUFB3 GMPS PFKFB3 AKR7A2 CHCHD10 ACOT7 SDHC NDUFS3 NME3 NDUFA4 NDUFB10 COX6B1 AMD1 NDUFB7 PANK2 NT5C DCK TCIRG1 NDUFS2 ATP5C1 COX7C AHCY COX6C NDUFA13 APOBEC3C DCTD ATP5E ATP5J ADSL HSPA8 PEMT TPI1 DGUOK PTGDR NDUFS4 ATP5H OLA1 ATP5F1 MAT2B NDUFS8 AMPD2 ATP5J2 AKR1B1 ATP5S ATP5G3 ATP5G2 NDUFA10 PAPSS1 UQCRH ATP5A1 ERH ATP1B1 PGM1
GO_REGULATION_OF_TUMOR_NECROSIS_FACTOR_MEDIATED_SIGNALING_PATHWAY	0.266983405012272	0.769493765572321	0.332556041677152	1.13880237471879	11856	26	UBC TRAF1 CYLD FAM105B RIPK1 BIRC2 UBB RPS27A IKBKG TNFAIP3 TNF BIRC3 TAX1BP1
GO_PEPTIDYL_TYROSINE_MODIFICATION	0.35203040817394	0.796082189130783	-0.280845410845462	-1.06562008434416	20189	48	ITK TWF1 ZMYM2 MAP2K2 PTPN6 FGR MAP2K1 JAK2 SCYL1 TYK2 EIF2AK2
GO_LEUKOCYTE_CELL_CELL_ADHESION	0.0930365857652877	0.67116199722541	-0.28304403111514	-1.25608920941809	5680	112	ITK ZFP36L2 RUNX2 CCND3 CARD11 ITGB1 PREX1 SP3 IL7R SEMA4D FERMT3 TBX21 CEBPB STOML2 CD151 ATG5 PTPRC DOCK8 FKBP1A BAX MYH9
GO_PROTEIN_LOCALIZATION_TO_ORGANELLE	0.83093146956952	0.95230564549435	0.165520890492867	0.895132735763275	26868	319	ARNTL CTNNB1 LMNA VPS25 NUP155 TIMM17A GCC2 DNAJB6 NOP58 NRAS SRP9 WAPAL EHD1 COG3 GNPTAB ZFAND6 SRGN NUPL1 NFKBIA RAE1 KPNA6 CRIPT LAMP1 RPL34 PPP1R15A TAF8 SNX10 LONP2 BCL3 RAB8B HSPA5 PDIA3 PACSIN2 RPL10 CHMP4A DIAPH1 RAD21 AP3M1 TOMM5 KPNA4 PAF1 RAB3GAP1 MORC3 TGFB1 PPP1R10 RBM22 RPS4X SYS1 GBF1 TAF3 RPS8 RPL7A TNKS2 SEC61B SEC61G TMEM30A RPS27A RPL12 PTTG1IP BID RPAIN DNAJA1 KPNA5
GO_CELLULAR_RESPONSE_TO_RADIATION	0.947125955397341	0.983584695643177	-0.179915868769883	-0.679652491327332	54275	47	ITGB1 ATR PDE6G TMEM109 BAX ZBTB1
GO_CELLULAR_RESPONSE_TO_KETONE	0.557317483458562	0.872340536933445	0.281519766637659	0.931952519322807	24847	23	PTGER4 KLF6 ATP2B1 DCPS FBXO32 TGFB1 GNB1 FOXO1
GO_NEGATIVE_REGULATION_OF_APOPTOTIC_SIGNALING_PATHWAY	0.1648	0.708952361061087	0.276238522641386	1.18721108150475	6797	70	OPA1 CTNNB1 LMNA PPIF HYOU1 NR4A2 CDKN2D MCL1 NOC2L HTT ARHGEF2 RIPK1 PHIP TPT1 XBP1 FYN TRIAP1 TNFSF10 CD74 PTTG1IP THBS1 RRN3 ICAM1 HIF1A TNFAIP3 TNF
GO_MULTICELLULAR_ORGANISMAL_HOMEOSTASIS	0.759897297109746	0.928334904422106	-0.215170154012115	-0.83393420707191	43801	53	P2RX4 ITGB1 ZNF830 PRCP FLT3LG DRAM2 HSPB1 BAX GPX1 PRKACB PRDX1 ADCY7 GIGYF2 PTPN11 AMPD2 AKR1B1 ACTB CORO1A
GO_NEGATIVE_REGULATION_OF_CELL_CYCLE_G1_S_PHASE_TRANSITION	0.04975495915986	0.549466203911694	0.36421180249684	1.41867514163749	2131	44	UBC PRMT1 ZNF655 CNOT2 BTG2 SMARCA4 CNOT6L CDKN1A CDC73 SOX4 CDKN1B UBB RPS27A TRIAP1 FBXO7 TFDP2
GO_REGULATION_OF_MITOCHONDRIAL_OUTER_MEMBRANE_PERMEABILIZATION_INVOLVED_IN_APOPTOTIC_SIGNALING_PATHWAY	0.923240270916691	0.975515510027965	0.203819601500858	0.666757410776058	41302	22	MAPK8 MUL1 PPP3R1 BID BAK1 YWHAQ BAD YWHAE TP53BP2 SIVA1 PPP3CC YWHAZ
GO_REGULATION_OF_SIGNAL_TRANSDUCTION_BY_P53_CLASS_MEDIATOR	0.739842005838915	0.92046386611707	-0.213063837283354	-0.850047998834438	43080	61	HDAC1 ATR KAT5 TAF11 CDK5RAP3 SSRP1 SMYD2 BRD7 CHD4 TAF13 TAF9
GO_POSITIVE_REGULATION_OF_CYTOKINE_PRODUCTION	0.737390568383189	0.919473587000761	0.184246361268845	0.897131837647557	27879	143	NFKB2 CTNNB1 SASH3 CRTAM IL27RA LSM14A RIPK2 PTGER4 RARA IFNAR1 IRF8 BCL3 IL6ST IRF1 ARHGEF2 CD83 NFKB1 RASGRP1 CD46 RIPK1 NR4A3 B2M DHX36 TGFB1 POLR1C GATA3 TNFSF9 MALT1 XBP1 HLA-A CD74 XCL1 IFIH1 POLR2K XRCC6 ADAM17 SPON2 IL18R1
GO_GAMETE_GENERATION	0.202115006722515	0.749547361095186	0.239546317837387	1.12886939833686	7816	117	BRD2 ARNTL NSUN2 CTNNB1 LMNA ANKRD49 DAZAP1 PRDM1 ARID4B NR2C2 SPAG9 CELF1 RARA PAFAH1B1 ZNF148 SMARCA4 NRIP1 SETX UBE2B MTOR PTK2B TGFB1 CREM MEI1 RGS2 YY1 PRDX4
GO_REGULATION_OF_CELLULAR_AMIDE_METABOLIC_PROCESS	0.0978363123236124	0.67116199722541	0.235862353482183	1.18995384607848	3535	182	EIF3J SRRT ETF1 RBM8A NSMAF CASC3 LSM14A SRP9 RNF139 CNOT2 CELF1 RARA BTG2 ZNF706 S100A9 PPP1R15A EIF4EBP1 BCL3 EIF3L EIF5A CNOT6L C1QBP SOX4 EIF3D EIF4A3 ZC3H12A TNRC6A MTOR EIF4G1 PTK2B POLR2D PABPC1 EIF1 USP16 TGFB1 PER1 RGS2 PPP1R15B RPS4X SELT
GO_CELLULAR_COMPONENT_MORPHOGENESIS	0.313534047028537	0.7793700762235	-0.223740642347027	-1.06376687540183	19973	180	SLC9A3R1 DBNL BBIP1 DICER1 ITGB1 IL7R FERMT3 EVL KLF2 IFT43 FEZ2 TBC1D20 TMEM216 CAP1 WDR1 SNAP29 EPHA4 OFD1 PTPN6 ID2 CREB1 FOPNL CPNE1 BAX MYH9 NUMB NCAM1 GSN PANK2 IQGAP1 LATS1 DNM1L PACSIN1 AFG3L2 ITGB7 GSK3B FLOT1 SPTBN1 ITGA4 SEPT2 E2F4 ACTR3 PTPN11 PTPRA SCLT1 TROVE2 AHI1 KIF20B NDEL1 EIF2AK4 SPTAN1 MAPK8IP3 ANKRD27
GO_CELL_AGING	0.51496381004243	0.86183117428315	0.275158635793592	0.958889751691324	22695	28	OPA1 ARNTL PDCD4 CDKN1A MTOR MORC3 KAT6A HSD17B10 ICAM1 CALR
GO_POSITIVE_REGULATION_OF_PROTEIN_MODIFICATION_PROCESS	0.640587756525783	0.892719872915756	-0.182986470097482	-0.942051156452252	44074	362	RAB3GAP2 CCND3 DBNL HDAC3 ANAPC5 ANXA2 ITGB1 PSMF1 PYCARD LAMTOR2 TAOK1 AIF1 PPP2R5A SEMA4D MAPKAPK3 SHC1 CAMK2D ANAPC10 PSMC5 KAT5 ARRB2 RAP2C FLT3LG CCL3 UBE2L3 CDC25B EPHA4 PTPRC MAP2K2 DDRGK1 PDE6G LAMTOR1 RAF1 CDK5RAP3 CD81 FKBP1A MAP4K1 FAM129A BAX CXCR4 UNC119 MAP2K1 GOLGA2 PSME3 HAX1 BRD7 STUB1 PSMB4 CALM3 CCL4 MADD TNFRSF14 IQGAP1 LATS1 GNAI2 PARK7 PRKACB CHFR PSMB6 JAK2 PSMD4 FBXW7 JTB PIM1 STRA13 HCLS1 EIF2AK2 GSK3B PHB2 PHB CDC16 FLOT1 ZNF622
GO_DEPHOSPHORYLATION	0.446602425238415	0.842648166157693	0.224082220902862	1.00170027910796	17935	86	MTMR6 SACM1L CYCS LPIN2 PTPRE PTPN7 DUSP4 PPM1B PPP1R15A PPP3R1 PPP6C UBLCP1 PTPN4 CTDSPL2 POLB LPIN1 PPP1R15B CDC14A TMEM55B SMEK2
GO_MATERNAL_PROCESS_INVOLVED_IN_FEMALE_PREGNANCY	0.352903538963904	0.796082189130783	0.352931789328491	1.07332787192032	15994	17	DAZAP1 PRDM1 KPNA6 MTOR UBE2A
GO_POSITIVE_REGULATION_OF_CELL_CELL_ADHESION	0.765742947953913	0.930513481720369	-0.197297741055537	-0.854965808697114	46256	97	LGALS1 CARD11 PYCARD IL7R AIF1 RASAL3 KIFAP3 AP3B1 HLA-DPB1 PTPRC AP3D1 PTPN6 HLA-DQB1 CD55
GO_POSITIVE_REGULATION_OF_CATION_TRANSMEMBRANE_TRANSPORT	0.842340815081034	0.954004782951153	0.218010476669492	0.753424438792873	37265	27	HTT CALM2 AKAP7 CTSS XCL1 SUMO1 CALM1 TESC CXCR3 GSTO1 ARF1 AKAP9
GO_MORPHOGENESIS_OF_A_BRANCHING_STRUCTURE	0.487032877271799	0.851613756198196	0.280135885345187	0.976234777308527	21464	28	CTNNB1 STK4 PRDM1 KRAS
GO_INTRACELLULAR_RECEPTOR_SIGNALING_PATHWAY	7.31439717176643e-05	0.022449614104393	0.434027865023244	1.88001022757759	2	73	TAB2 UBC CTNNB1 NR4A2 CYLD AHR NCOA1 LSM14A RIPK2 PDK3 RARA FAM105B NFKBIA NR3C1 PIAS2 THRAP3 CRY1 UBE3A NOTCH2 NRIP1 NR4A3 CREM DDX54 NR1H2 UBB RPS27A IKBKG NCOA2 DNAJA1 IFIH1 MED30 UBR5 MED13
GO_HISTONE_MRNA_METABOLIC_PROCESS	0.512123487324441	0.860549734005136	0.308643605509112	0.955504398318776	23190	18	EXOSC10 DCP2 ZCCHC6 SNRPB PAPD4
GO_REGULATION_OF_ESTABLISHMENT_OF_PROTEIN_LOCALIZATION_TO_PLASMA_MEMBRANE	0.0666338869463869	0.605634389713847	-0.47409948687844	-1.43982546500797	3658	19	ITGB1 RER1 PPP2R5A CNST
GO_POSITIVE_REGULATION_OF_PRODUCTION_OF_MOLECULAR_MEDIATOR_OF_IMMUNE_RESPONSE	0.0338839285714286	0.504518449708653	0.478495503085491	1.54459117138142	1517	21	SASH3 NR4A3 B2M TGFB1 GATA3 MALT1 XBP1 HLA-A CD74 XCL1 SPON2
GO_NEGATIVE_REGULATION_OF_DEVELOPMENTAL_PROCESS	0.427378267769147	0.830790893587973	0.19880643746349	1.00879473682363	15350	190	MECP2 ARNTL CTNNB1 LMNA INSIG1 VIM CYLD STRAP PRMT1 MED28 STK4 PDCD4 KRAS PTGER4 SMAD7 NFKBID RARA DYNLT1 SRGN ZNF706 NFKBIA PAFAH1B1 C3orf17 MUL1 IRF1 ARHGEF2 SIRT2 ATF5 CDC73 STAP1 PAF1 PTK2B B2M TGFB1 GATA3 CDKN1B IQCB1 TRIM11 XBP1 MYC NR1H2 RBPJ CD74 CDK5RAP2 RAB7L1 SRSF6 PRPF19 LEO1
GO_REGULATION_OF_HOMOTYPIC_CELL_CELL_ADHESION	0.241169748597548	0.769493765572321	0.232579883910512	1.10257291139498	9285	121	RICTOR CTNNB1 CD247 SASH3 CYLD TNFSF14 RIPK2 NFKBID RARA LAT VAV1 YES1 IL6ST IRF1 CD83 RASGRP1 CD46 PRNP NR4A3 MTOR TGFB1 GATA3 MLST8 TNFSF9 CD300A MALT1 XBP1 FYN HLA-A CLPTM1 CD74
GO_ORGANIC_HYDROXY_COMPOUND_BIOSYNTHETIC_PROCESS	0.165318936954054	0.708952361061087	0.31812093032257	1.21968753854341	7134	41	INSIG1 LPIN2 NR4A2 IDI1 ABHD3 HMGCS1 AGPAT6 LPIN1 GATA3 MVD CYP51A1
GO_REGULATION_OF_TYPE_I_INTERFERON_MEDIATED_SIGNALING_PATHWAY	0.0558472658567129	0.568900571278963	0.498025294447136	1.48865935431691	2541	16	LSM14A IFNAR1 JAK1 UBE2K IFNAR2 MUL1
GO_RHYTHMIC_PROCESS	0.353129736848644	0.796082189130783	0.234967884194211	1.04799868238818	14210	85	NFKB2 ARNTL MAPK8 AHR NCOA1 RELB THRAP3 CRY1 UBE3A NRIP1 SIN3A SETX ATF5 GFPT1 CPT1A
GO_STEROID_HORMONE_MEDIATED_SIGNALING_PATHWAY	0.0777596266044341	0.644932038222587	0.346277330697672	1.34881691863248	3331	44	CTNNB1 NR4A2 NCOA1 NR2C2 RARA NR3C1 PIAS2 THRAP3 UBE3A NRIP1 NR4A3 DDX54 NR1H2 DNAJA1 MED30 UBR5 MED13 CALR MED17
GO_REGULATION_OF_RESPONSE_TO_BIOTIC_STIMULUS	0.62638843820982	0.892044689386689	0.205517595173549	0.924625277237439	25094	89	CD247 CRTAM PRDM1 RIPK2 CRNKL1 PPM1B MUL1 PCBP2 SIN3A SIRT2 C1QBP TRAF3 APOBEC3G BIRC2 ZC3H12A B2M SNRPB
GO_PEPTIDYL_PROLINE_MODIFICATION	0.784808521430383	0.937569304190555	-0.249878164909507	-0.779367950067441	43322	21	PPIL4 FKBP1A CRTAP FKBP3
GO_PHOSPHOLIPID_TRANSPORT	0.213545012388731	0.753975842513492	-0.420625045123047	-1.21771442493785	11634	16	ABCA2 ABCG1 ATP11B ATP8A1 PITPNC1 PITPNB ATP8B4 PRELID1 SCP2
GO_REGULATION_OF_DNA_BIOSYNTHETIC_PROCESS	0.652199919075348	0.892719872915756	-0.241774017502746	-0.886152896868466	37072	41	ATR TEN1 ARRB2 ACD CCT5 DDX39B HNRNPU CCT4 GSK3B
GO_FIBROBLAST_GROWTH_FACTOR_RECEPTOR_SIGNALING_PATHWAY	0.811893036314263	0.94802168638716	0.213362781836043	0.79274336925939	35279	36	UBC GALNT3 POLR2B SETX POLR2D UBB SHOC2 RAB14 POLR2A POLR2K
GO_REGULATION_OF_CELL_CYCLE_ARREST	0.0926487747957993	0.67116199722541	0.338449333051213	1.31832535961739	3969	44	UBC CCNK PRMT1 CNOT2 BTG2 CNOT6L CDKN1A SOX4 TGFB1 CDKN1B UBB RPS27A TRIAP1 TFDP2 CRLF3 AKT2 CNOT4 CNOT1 CNOT8 NPM1 MIF
GO_REGULATION_OF_MRNA_SPLICING_VIA_SPLICEOSOME	0.046977829638273	0.54570539674056	0.366653673692086	1.42818670040639	2012	44	DAZAP1 RBM8A SRSF2 RBM25 JMJD6 SFSWAP YTHDC1 THRAP3 C1QBP SRSF4 SRSF7 SF3A1
GO_REGULATION_OF_ANATOMICAL_STRUCTURE_MORPHOGENESIS	0.843901557369642	0.954004782951153	0.165951202809449	0.884107774659965	28014	281	OPA1 ATG3 UBC CTNNB1 WIPF1 ITGA5 PSMD1 CYLD STRAP ZEB2 ANXA7 TNFSF14 PSMC3 PTGER4 PPP1R16B SIPA1L1 SMAD7 EHD1 JAK1 MKLN1 PAFAH1B1 PSMD11 PSMC1 PPP1R15A HTT MUL1 DIAPH1 C1QBP POFUT2 PHIP RAB21 ZC3H12A PSMA7 PTK2B TGFB1 GATA3 EZR PSMD7 PRPF40A BRAF PSMB3 SDCBP XBP1 MYC NACA UBB PSMA6 PSMA3 BRWD1 RBPJ FYN MYADM RPS27A PSMD13 CUX1 PSMD5 SRSF6 PSME4 IST1 RAP1A VRK1 NFATC2 CDC42SE2 ROCK1 DDHD1 THBS1 RAB11A ICAM1 CALR PDCL3 ANXA1 PSMB1 HIF1A TNFAIP3 TNF
GO_FEMALE_GAMETE_GENERATION	0.328374575094119	0.786222381464543	-0.367453183649051	-1.09921466247396	17967	18	ZNF830 ERCC1 CDC25B DIAPH2 DDX20 REC8
GO_EXTRACELLULAR_MATRIX_DISASSEMBLY	0.176231990456089	0.719050555888587	-0.436423330755979	-1.26345064660977	9601	16	CAPN1 CAPN2 GSN FLOT1 TIMP1 ADAM10 CAPG ADAM8 FURIN LCP1
GO_PROTEIN_HOMOOLIGOMERIZATION	0.0298396498994644	0.500669746207104	-0.342239350419527	-1.42478542059652	1765	77	CLPP HM13 SOD2 EIF2AK3 P2RX4 CHMP2A CAT EVL RNF213 ANXA6 NUP54 BAX GOLGA2 ST13 ZBTB1 SHARPIN SHKBP1 DNM1L
GO_REGULATION_OF_OXIDATIVE_STRESS_INDUCED_CELL_DEATH	0.1669142422376	0.708952361061087	-0.404813894027436	-1.2626112203971	9213	21	SOD2 BAG5 HSPB1 GPX1 PARK7 FBXW7
GO_TRANSCRIPTION_FROM_RNA_POLYMERASE_I_PROMOTER	0.289385127473573	0.776556576572928	-0.385835019016315	-1.13625329468109	15822	17	POLR2F TBP POLR2L POLR2H TTF1 CCNH TAF1D ERCC3 POLR2E
GO_BODY_FLUID_SECRETION	0.451781874322263	0.843455872606558	-0.353466674088756	-1.00461236358099	24580	15	ANXA2 NCOR1 VAMP8 CREB1
GO_POSITIVE_REGULATION_OF_CHROMOSOME_ORGANIZATION	0.941650580784991	0.982379993401653	-0.174279103229392	-0.720665159994794	55611	74	ATR ANAPC10 H2AFY ERCC1 ACD CCT5 NSMCE2 GOLGA2 BRD7 CCT4 BECN1 ANAPC11 WBP2 UBE2N ATRX MAPKAPK5 AKAP8 DNMT1 PRKCQ
GO_RESPONSE_TO_VITAMIN	0.512622480466283	0.860693472699393	-0.30098477199229	-0.961555546703621	28407	23	ITGB1 CAT GSN PIM1 EIF2AK2 BECN1 PEMT CCL5 EEF2 DNMT1 RELA
GO_REGULATION_OF_ATPASE_ACTIVITY	0.93266877708179	0.979765011861285	0.196027526999546	0.664397035288988	41541	25	PPIF DNAJB6 GABARAPL2 DNAJC9
GO_NEGATIVE_REGULATION_OF_STRESS_ACTIVATED_PROTEIN_KINASE_SIGNALING_CASCADE	0.339460111928015	0.793690071222168	-0.370662173675612	-1.09157047778174	18560	17	IGBP1 HDAC3 NCOR1
GO_POSITIVE_REGULATION_OF_CYTOKINE_BIOSYNTHETIC_PROCESS	0.788315850815851	0.939227051467924	-0.254850145396966	-0.77397200220472	43287	19	CARD11 HSPB1 SYK GLMN PRKCQ SPN TICAM1 RELA
GO_REGULATION_OF_CYSTEINE_TYPE_ENDOPEPTIDASE_ACTIVITY	0.867769834524821	0.961794557001551	-0.185700694402105	-0.795985613383399	52073	91	IGBP1 EIF2AK3 PDCD2 PYCARD FAM162A ARRB2 PDCD6 RAF1 BAX PDCD5 GSN GPX1 PARK7 JAK2 NDUFA13 ANP32B IFI16 PMAIP1
GO_REGULATION_OF_CELLULAR_RESPONSE_TO_STRESS	0.654415596358397	0.893046297420715	0.175720124952462	0.945179605813935	21348	305	OPA1 TRIP12 ARNTL U2AF1 MAPK8 HYOU1 NUP155 ZEB2 PPP4R2 SREBF2 PRMT1 DNAJB6 PDCD4 RIPK2 WBP11 CDKN2D SPAG9 BNIP3L MCL1 NUPL1 WDR75 SQSTM1 RAE1 PAFAH1B1 PPP1R15A CRY1 USP14 MUL1 HSPA5 ARHGEF2 CHMP4A RASGRP1 RIPK1 NR4A3 ZC3H12A MTOR PTK2B RAB3GAP1 SVIP USP1 PER1 SENP2 EZR MLST8 RASSF2 PPP1R15B UBQLN1 TPT1 EXOC7 ATP6V0D1 BRAF SDCBP IER3 XBP1 MYC TRIAP1 CD74 ATP6V0C TAOK3 PTTG1IP ERLEC1 NSMCE4A DNAJA1 PIP4K2A RSL1D1 AMBRA1 UBR5 AXIN1 FOXO1 HIPK3 MAP3K11 BAK1 DTNBP1
GO_POSITIVE_REGULATION_OF_EPITHELIAL_CELL_MIGRATION	0.223256397840785	0.759901998372426	-0.357100371455259	-1.186458988098	12448	27	AAMP CLASP1 ZNF580 PDCD6 HSPB1 HDAC7
GO_HOMOTYPIC_CELL_CELL_ADHESION	0.100160256410256	0.67116199722541	-0.45070008894604	-1.36876221785967	5499	19	FERMT3 CSRP1 CLIC1 PTPN6 HSPB1 MYH9
GO_POSITIVE_REGULATION_OF_IMMUNE_EFFECTOR_PROCESS	0.0105094321555109	0.33507345378934	0.374860962142636	1.56713488542376	438	61	SASH3 CRTAM RIPK2 RARA SNX4 VAV1 LAMP1 RASGRP1 CD46 STAP1 NR4A3 B2M TGFB1 GATA3 HLA-B CD300A MALT1 XBP1 HLA-A CD74 XCL1 NCR3 SPON2 ANXA1 TNF AP1G1 ANKRD17 ZC3HAV1 HLA-DMB
GO_UROGENITAL_SYSTEM_DEVELOPMENT	0.806704438149197	0.947135052920268	0.200660310033124	0.814279700715371	34171	53	CTNNB1 SMAD7 JMJD6 RARA TIPARP UBE3A SOX4 TGFB1 GATA3 MYC MTSS1 PRKX ANXA1 CRIP1 EGR1 C1GALT1
GO_NEGATIVE_REGULATION_OF_CELL_ACTIVATION	0.362613515744781	0.798400995526206	0.261947324204756	1.0485187141229	15372	50	CYLD SAMSN1 PRDM1 NFKBID IRF1 PRNP ZC3H12A TGFB1 CD300A CD74 XCL1 FBXO7 ANXA1 PRKAR1A TNFAIP3
GO_CELLULAR_RESPONSE_TO_ALCOHOL	0.471598743247214	0.845761401946154	0.285480426372601	0.986594466981528	20863	27	CTNNB1 HMGCS1 KLF6 NRIP1 ATP2B1 FBXO32 TGFB1
GO_PEPTIDYL_TYROSINE_AUTOPHOSPHORYLATION	0.72645199020432	0.917747473622032	-0.272405785631425	-0.814885942027339	39749	18	ITK FGR JAK2 TYK2
GO_CELL_JUNCTION_ASSEMBLY	0.310779842533978	0.7793700762235	0.315494301480746	1.09945396238203	13696	28	CTNNB1 GNPAT WHAMM ITGA5 SMAD7
GO_MACROMOLECULE_CATABOLIC_PROCESS	0.0973066298342541	0.67116199722541	0.200861092600623	1.12768212704597	2817	467	EXOSC7 TRIP12 HSP90B1 ARNTL UBC CTNNB1 VPS25 CLPX UBAP1 ETF1 UBR1 PSMD1 CYLD RBM8A CASC3 RNF11 EXOSC10 HECTD1 EXOSC9 PSMC3 RNF139 MGEA5 YME1L1 CNOT2 BNIP3L DENND3 SQSTM1 PSMD11 PSMC1 FBXL5 RPL34 NUB1 LONP2 DCP2 THRAP3 UBE2K CALM2 USP14 DIS3 HSPA5 MYLIP UBE3A FBXO21 PCBP2 RPL10 SIRT2 SMG5 ZCCHC6 CNOT6L RNF44 RIPK1 DCPS BIRC2 RNF41 PATL1 EIF4A3 KCTD10 ZC3H12A CDC27 FBXO32 UBE2B PSMA7 UVRAG MTOR EIF4G1 POLR2D AUP1 PABPC1 RNF115 USP16 USP1 ARIH1 TGFB1 USP7 RLIM RNF126 VPS37A PSMD7 RNF181 UBQLN1 RPS4X RPS8 RPL7A LSM6 PSMB3 UBA6 UBE2A USP15 SEC61B KIAA0368 CCDC47 XBP1 UBB RNF145 PSMA6 PSMA3 PAPD4 RPS27A CTSS DERL1 RPL12 PSMD13 ERLEC1 SEL1L FBXO6 PSMD5 PRPF19 EIF4A1 UBR5 BUB3 AXIN1 PSME4 RNF7 JKAMP SKIV2L2 UBXN2A CTSA RPS6
GO_INTERACTION_WITH_SYMBIONT	0.745647641618703	0.921604761905919	-0.238847189927782	-0.821099249763152	41844	31	HDAC1 TBC1D20 CCL3 TAF11 CCL4 GPX1 CCL5 EIF2AK4 PPIB DDB1
GO_REGULATION_OF_POLYSACCHARIDE_METABOLIC_PROCESS	0.151328075224641	0.697017682319877	0.433082893156805	1.29453846477459	6887	16	PTGER4 NFKB1 GFPT1 DYRK2 MTOR TGFB1
GO_EYE_DEVELOPMENT	0.672737163264824	0.897581167929844	0.216895960552711	0.887760395127872	28443	55	CTNNB1 VIM PRDM1 JMJD6 RARA SMARCA4 ATP2B1 RAB3GAP1 TGFB1 GATA3 NINJ1 ATP2B4 GNB1 AXIN1 AGTPBP1 BAK1 RCN1 HIF1A MTERFD2 PFDN5 SKIL ATF6 NIPBL FZR1 KDM5B
GO_DEVELOPMENTAL_PROCESS_INVOLVED_IN_REPRODUCTION	0.343311432325887	0.796082189130783	0.216629573314553	1.04386003932001	13062	134	NSUN2 CTNNB1 DAZAP1 AHR IRF2BPL DNAJB6 STK4 PRDM1 NCOA1 ARID4B HMGCS1 CELF1 RARA TIPARP PAFAH1B1 SMARCA4 UBE3A NRIP1 BIRC2 UBE2B MTOR PTK2B TCF7 TGFB1 GATA3 MEI1 SENP2 PRDX4 RBPJ TBPL1 NCOA2 PSME4 KIAA0430 BAK1 RPS6 HSD17B10 ICAM1 KIAA0196 ANXA1 CRIP1 HIF1A
GO_PROTEIN_DEPHOSPHORYLATION	0.391080617495712	0.816414044176847	0.241879168031024	1.0302415769124	16187	67	MTMR6 CYCS PTPRE PTPN7 DUSP4 PPM1B PPP1R15A PPP3R1 PPP6C UBLCP1 PTPN4 CTDSPL2
GO_REGULATION_OF_CELLULAR_PROTEIN_CATABOLIC_PROCESS	0.715727906417755	0.914895241270694	0.184284689329076	0.906949520718607	26798	153	UBC PSMD1 RFWD2 PSMC3 RNF139 COMMD1 SMAD7 PSMD11 PSMC1 FBXL5 NUB1 UFL1 UBE2K USP14 MYLIP UBE3A SIRT2 CDC27 PSMA7 PTK2B SVIP ARIH1 EZR PSMD7 UBQLN1 GABARAPL2 PSMB3 SDCBP XBP1 UBB PSMA6 PSMA3 RPS27A CSNK2A1 PSMD13 PTTG1IP PSMD5 BUB3 AXIN1 PSME4 SUMO1 PDCL3 PSMB1 CUL3 DYNC1LI1 TNFAIP3 PSMB7
GO_REGULATION_OF_NEURON_DEATH	0.310933633846983	0.7793700762235	0.245139113972476	1.07307551881473	12691	77	MECP2 REL CTNNB1 HYOU1 NR4A2 KRAS BTG2 MCL1 PSMC1 CHMP4A NR4A3 MTOR PTK2B GATA3 BRAF UBB FYN OXR1 IKBKG AMBRA1 DDIT4 MAP3K11 ROCK1
GO_RESPONSE_TO_GAMMA_RADIATION	0.716255099067599	0.914895241270694	-0.271645862691691	-0.824980075685762	39330	19	ATR TMEM109 BAX GPX1
GO_REGULATION_OF_CYCLIN_DEPENDENT_PROTEIN_KINASE_ACTIVITY	0.595112072536475	0.884951778840545	0.246717577218038	0.916672166233926	25859	36	CCNK BCCIP CCNT1 CDKN2D CCND2 SERTAD1 CDKN1A CDK5RAP1 CDKN1B
GO_POSITIVE_REGULATION_OF_PROTEIN_IMPORT	0.22760536296138	0.759901998372426	-0.339573456109797	-1.17549086611049	12782	32	TMEM173 HDAC3 KPNA1 RBCK1 PDCD5 HNRNPM JAK2 HCLS1
GO_MULTI_ORGANISM_METABOLIC_PROCESS	0.871227364185111	0.964320639799119	0.175031573181409	0.822672149828505	33773	115	NUP155 NUPL1 RAE1 RPL34 EIF3L PCBP2 RPL10 EIF3D ATG16L2 MAP2K3 RPS8 RPL7A RPS27A RPL12 EIF3F RPS6 EIF3G RPS3A RPL5 RPS5 RPL4 RPL35 RPS14 RPL37A SMARCB1 NUP98 RPS23 RPL32 RPL11 RPL21 RPS15A RPL9 RPLP1 RPS9 RPS10 RPL23A RPL23 RPL3 RPL6 RPS28 RPS16 RPLP2 RPL13 RPL10A TPR RPL17 RPL7 RPS27 RPS3 RPL29 POM121C RPL37
GO_MONOVALENT_INORGANIC_CATION_HOMEOSTASIS	0.425368678186918	0.829791398493621	-0.32326954590093	-1.02060058887146	23507	22	CAMK2D SLC9A8 TCIRG1 ATP1A1 ATP6V0E2 ATP1B1 PPT1 RAB7A ATP6V1D ATP6V0B ATP6V0E1 ATP1B3 ATP6V1H ATP6V1F
GO_REGULATION_OF_BMP_SIGNALING_PATHWAY	0.733182725418376	0.917880464508981	0.274910751309287	0.806574036051699	33427	15	SMAD7 CTDSPL2 RBPJ LEMD3
GO_HEART_PROCESS	0.0802738927738928	0.652557638277837	-0.463682997973167	-1.40819091066468	4407	19	TAZ CAMK2D ATG5 CXCR4 GPX1 DNM1L SMAD5 ATP1A1
GO_MUSCLE_SYSTEM_PROCESS	0.521494743416259	0.865592788704611	-0.248641057011457	-0.963657267785828	30059	53	P2RX4 TAZ CAMK2D RCSD1 PABPN1 CXCR4 IKBKB GSN CALM3 SMAD5 ATP1A1 SLMAP RPS6KB1 TLN1 ATP1B1 SRSF1 EEF2 MYL12A UTRN NDUFS6
GO_MESENCHYME_DEVELOPMENT	0.743030167096557	0.92046386611707	0.246703952133163	0.816697074111026	33127	23	CTNNB1 ZEB2 TGFBR3 TGFB1 RBPJ
