pathway	pval	padj	ES	NES	nMoreExtreme	size	leadingEdge
GO_REGULATION_OF_CALCIUM_ION_TRANSMEMBRANE_TRANSPORT	0.987560958371616	1	0.162750372946006	0.579972005549405	69864	46	CAMK2D ATP1B1 F2R ABL1 PTK2B EFCAB4B CORO1A ASPH AHNAK PLCG2 PIK3CG DIAPH1
GO_RESPONSE_TO_BACTERIUM	0.00761556621734826	0.200170134951659	-0.249619538307511	-1.33328191806348	99	222	JUNB JUN PAF1 FOS TICAM1 SOCS3 TNFRSF9 BAIAP2 ACP5 CCR7 B2M LITAF HLA-A ZC3H12A FAS PDE4D NLRP6 KLRK1 CTR9 FOXP1 EIF2AK2 ISG15 PTGER4 TNIP2 BCL3 CD160 LY96 HNRNPA0 PRKCD NCL LGALS9 RELA CD27 PDE4B JUND NFKBIA IL18BP IFNG HLA-E PELI1 RNF5 TNFAIP3 CMPK2 MYD88 GNLY MAPK8 TNFRSF14 TNFRSF18 TNFRSF25 IL23A LYZ PLAC8 PPARD CASP9 CX3CR1 HIST2H2BE PPBP MAVS TNFRSF1B
GO_POSITIVE_REGULATION_OF_LEUKOCYTE_MIGRATION	0.644246523547452	0.931070351684678	0.246802486501693	0.894004246631134	46004	50	C3AR1 MIA3 HMGB1 NCKAP1L DAPK2 CREB3 PDGFD CCL3 PTK2B PYCARD IL6R IL12A ZNF580
GO_CALCIUM_ION_IMPORT	0.626530522035097	0.929779408047485	0.273012427877273	0.893682814404212	42521	31	TPCN2 F2R CCL3 ITPR1 MICU1 ITPR3 ORAI1 PLCG2 MCOLN1 ATP2B4 CCR5 CASK ITPR2 BBC3 IBTK
GO_CELL_MATURATION	0.616887080366226	0.924494066967044	-0.225889985614439	-0.915763086867692	18191	45	NR4A2 SCLT1 CDKN1A CLN5
GO_REGULATION_OF_SECRETION	0.471524848809444	0.856122716388238	0.217644129471353	1.00210738908511	42258	286	CD40 MAPK9 SYK GLUL SRI NLRP3 PINK1 ARHGEF7 CD274 HMGB1 RAB27B CLASP1 AACS FER DNAJC1 ZNF384 HMGCR C2CD2L LILRB1 NOTCH1 RAB9A GLMN PLCB1 SERGEF CACNA2D2 WNK1 RAB11FIP5 STK39 SYTL3 ARNTL RLTPR PNKD F2R SNX4 SOCS1 ABL1 CCL3 STXBP5 ARL2 RALB HLA-DRB1 BCR HADH CD14 CD300A PDCD6IP HLA-DRB5 RHBDF2 ITPR1 GAB2 PYCARD TCF7L2 ABAT BTN2A2 ADRBK1 ITPR3 PPP3CA UNC13D TMF1 FGR ANXA4 PANX1 COMT SNF8 TRIM16 PPIA PER2 STXBP4 CD58 BANK1 CRY1 ATP13A2 APOA1 NF1 KCNQ1 RHBDD3 TC2N SYTL2 IL17RA VPS4B SLC25A6 SIDT2
GO_MODULATION_OF_TRANSCRIPTION_IN_OTHER_ORGANISM_INVOLVED_IN_SYMBIOTIC_INTERACTION	0.84898324522391	0.979197194380947	-0.231194708992972	-0.727904826074637	30351	17	REST CHD1 ZNF639 LEF1 SP1 CCL5
GO_APOPTOTIC_SIGNALING_PATHWAY	0.163114931734451	0.638716278197813	-0.209107223758475	-1.10915888699049	2257	210	JUN BNIP3 MCL1 TICAM1 TNFRSF9 PPP1R15A CDKN1A DDX3X SRGN SELK CYCS RNF41 IFI27 FAS CD28 CUL2 IFI6 CD5 PIK3R1 STK25 IKBKE BLOC1S2 SOD2 HRAS BCL3 PML LY96 ERO1L PRKCD RPS27L CD27 TMBIM6 ATM IFNG NGFRAP1 PPP2R5C TRADD FIS1 BAD TNFRSF14 TNFRSF18 TNFRSF25 PPARD CASP9 CD70 TNFRSF1B TIMM50 BRCA2 SHISA5 C22orf29 RELT BAK1
GO_NEURAL_NUCLEUS_DEVELOPMENT	0.549636191078773	0.898263723825693	-0.25051802548043	-0.943509137436968	17373	33	HSPA5 CALM2 CALM1 HOXB2 ACTB BCL2 CNP COX6B1 RHOA LDHA CDC42 YWHAE MBP SUDS3
GO_LYMPHOCYTE_MEDIATED_IMMUNITY	0.211421064832702	0.695234033076829	-0.257406513531953	-1.13768234929255	5471	67	HLA-DQB1 FAS INPP5D HSPD1 VAMP7 BCL3 PRKCD IRF7 IL4R CD27 SLAMF1 TUBB4B
GO_FC_EPSILON_RECEPTOR_SIGNALING_PATHWAY	0.79903536977492	0.96705327313321	-0.179791845931831	-0.874643039024153	16400	115	UBC JUN FOS SKP1 UBE2D1 PSME1 PAK2 PIK3R1 NR4A3 HRAS RELA PSMB9 CALM2 PSMA1 PSMD13 NFKBIA CALM1 MAPK8 SHC1 PIK3CB PSMD10 PSMC4 MAP2K4
GO_HIPPOCAMPUS_DEVELOPMENT	0.0365707054729516	0.370281728689834	-0.390804621111655	-1.47186107771811	1155	33	BTG2 TSC1 AKAP5 OGDH HNRNPK NR4A3
GO_REGULATION_OF_PROTEIN_LOCALIZATION_TO_CELL_SURFACE	0.0929790976015937	0.530107790250725	0.489530186697275	1.38648645523577	5973	17	ASTN2 STX3 KCNAB2 RANGRF LEPROT NEDD4L
GO_RIBONUCLEOSIDE_TRIPHOSPHATE_BIOSYNTHETIC_PROCESS	0.0561362980075079	0.445490193926565	0.413483936386978	1.41496371232841	3887	38	NME2 ATP5A1 CTPS2 UCK2 NME1 ATP5E ATP6V0A2 ATP5I UCK1 ATP5G3 ATP5F1
GO_REGULATION_OF_CHROMOSOME_SEGREGATION	0.598228330159781	0.91730756533776	0.249040622020075	0.921811212148026	43355	56	APC ANAPC4 PCID2 BUB3 PTEN SMC5 ZW10 FBXO5 CTCF CENPF KLHL22 RCC2
GO_PROTEIN_K11_LINKED_UBIQUITINATION	0.603397105155016	0.920276956051331	0.298060729962079	0.901539731243428	39644	22	CDC16 ANAPC4 ANAPC13 ANAPC5 UBE2L3 ANAPC1 UBE2E3 ANAPC7 FZR1
GO_SPHINGOLIPID_METABOLIC_PROCESS	0.35934719677051	0.813951853837473	0.271345319180211	1.06013642990818	27060	76	GBA2 CERS4 ARV1 ST3GAL3 CLN8 ST3GAL5 CSNK1G2 ORMDL3 PPT1 SPTSSA UGCG ARSK GALC ALDH5A1 SMPD1 ST6GALNAC4 SGPL1 HEXA CERS6
GO_PROTEIN_ACETYLATION	0.705791446122938	0.947745542493562	0.216060799487489	0.876941654315401	54803	97	ASL LDB1 NCOA1 TAF10 TADA2A BRD1 DR1 MDH2 MSL2 MBD3 TADA3 RUVBL2 KAT8 BRPF1 TAF5L USP22 FOXO1 BRPF3 TRIM16 POLE3 YEATS4
GO_REGULATION_OF_NUCLEOCYTOPLASMIC_TRANSPORT	0.131065135721467	0.609024504096551	-0.233803204111477	-1.16198927878672	2476	133	G3BP2 AKAP5 MX2 HSP90AB1 CDKN1A LITAF CDKN2A ZC3H3 MAPK7 IFI27 ZC3H12A CYLD HSP90AA1 AXIN1 PIK3R1 PTPN11 MED1 BCL3 SIRT1 PRKCD LGALS9 CD27 ZNF259 RANGAP1 PPP1CC CHERP DDX58 NFKBIA MXI1 NUP62 EMD IL23A PARP10
GO_CELLULAR_HORMONE_METABOLIC_PROCESS	0.355991928880571	0.810316930937496	0.323238740272858	1.07331811341071	24346	33	AKR1B1 SULT1A1 FDX1L SCPEP1 DGAT1 RDH11 SCP2 SGPL1 DHRS3 HSD17B12 RDH13 COMT STARD3
GO_PTERIDINE_CONTAINING_COMPOUND_METABOLIC_PROCESS	0.758167559875254	0.960160409186866	0.260856373171962	0.798033549267276	50079	23	SHMT1 GART MTHFR
GO_FORMATION_OF_TRANSLATION_PREINITIATION_COMPLEX	0.738483937920139	0.955238017381301	0.280390266375829	0.806318714618636	47677	18	EIF4H EIF4B EIF3K EIF3L EIF2D EIF3F EIF3G DENR
GO_CHEMOKINE_MEDIATED_SIGNALING_PATHWAY	0.783182844243792	0.964499014193666	-0.244264910587372	-0.781877878307955	27755	18	XCL1 CCR7 CX3CR1 PPBP CCR6 CXCR4 CXCR3 CCL5 CCR4
GO_POSITIVE_REGULATION_OF_INTERFERON_BETA_PRODUCTION	0.0796721596339309	0.510001005915037	-0.419153870182533	-1.40067699673262	2750	21	IRF1 TICAM1 DDX3X POLR3D POLR3B IRF7 DDX58 FLOT1 MAVS
GO_REGULATION_OF_PROTEIN_SECRETION	0.460239309765306	0.856122716388238	0.227942266015776	1.0041533555342	38886	182	CD40 SYK GLUL SRI NLRP3 CD274 HMGB1 AACS DNAJC1 ZNF384 HMGCR C2CD2L LILRB1 GLMN SERGEF CACNA2D2 RAB11FIP5 ARNTL RLTPR F2R SOCS1 ABL1 CCL3 STXBP5 ARL2 HLA-DRB1 HADH CD14 HLA-DRB5 RHBDF2 ITPR1 PYCARD TCF7L2 ABAT BTN2A2 ITPR3 PPP3CA FGR ANXA4 PANX1 TRIM16 PER2 STXBP4 CD58 BANK1 ATP13A2 APOA1
GO_REGULATION_OF_PEPTIDYL_TYROSINE_PHOSPHORYLATION	0.481277680848208	0.859865631932548	-0.208752743295185	-0.98701544879245	10757	97	PPP2CA SOCS3 MVP RAP2C TMEM102 CLCF1 PAK2 EHD4 STAT3 MLST8 PTGER4 PDCL3 PRKCD VEGFB RAP2B SOCS4 PPP2R5B SHC1 TNFRSF14 TNFRSF18 IL23A OSM ZGPAT CD74 ABI1
GO_REGULATION_OF_NATURAL_KILLER_CELL_ACTIVATION	0.662295810645627	0.937108191965858	-0.27723849035456	-0.856580591408587	23839	16	TICAM1 FLT3LG ZBTB1 IL23A RASGRP1
GO_RESPONSE_TO_INSULIN	0.862179807884731	0.980628414546013	0.190736909556532	0.798438355401987	68932	120	ATP6V1A SLC27A1 HDAC9 FER EIF4EBP1 FOXO4 TRIB3 PRKDC GSK3B DENND4C ATP6V0A2 CAT ATP6V1H HDAC5 RHOQ ERRFI1 HADH AKT1 AP3S1 PPAT SLC2A8 GSK3A FOXO1 GCNT1 PIK3R3 STXBP4 EGR1 CRY1 APRT
GO_REGULATION_OF_MUSCLE_CELL_APOPTOTIC_PROCESS	0.675354966617103	0.94100273810193	-0.254331574685653	-0.860893324142479	23163	22	BNIP3 CDKN2A ZC3H12A SIRT1 IFNG
GO_POSITIVE_REGULATION_OF_NIK_NF_KAPPAB_SIGNALING	0.0959312093350032	0.537538666524371	0.459612386714719	1.3742760708733	6280	21	HMGB1 ZFP91 NOD1 RPS3 RC3H1 IRAK1 COPS8 ACTN4 MALT1
GO_REGULATION_OF_CARBOHYDRATE_METABOLIC_PROCESS	0.423118026760142	0.843859574831127	-0.218302002640896	-1.01165861413147	9897	87	POMC SIK1 PASK PPP1CB IGFBP4 TINF2 STAT3 PTGER4 SIRT1 ADIPOR1
GO_NEGATIVE_REGULATION_OF_SYNAPTIC_TRANSMISSION	0.348871811390794	0.805792757829599	0.368626674125874	1.08887983022105	22743	20	PICK1 ADNP PNKD PTEN ABHD6 PTK2B
GO_B_CELL_ACTIVATION	0.898149372108394	0.987774868209814	0.191385021853266	0.752349999068858	67944	79	CD40 NOTCH2 HDAC9 TPD52 PRKDC ITFG2 ABL1 HDAC5 PRKCB PTK2B CD79A LGALS1 PLCL2 IL7R MALT1 CASP8 PLCG2 BANK1 LRRC8A MS4A1 NBN IGBP1 MFNG MEF2C VPRBP MSH6
GO_REGULATION_OF_NEURON_DIFFERENTIATION	0.495446097727089	0.870717954721783	0.220479779197413	0.989857170696036	42919	217	NEDD4 ULK4 FIG4 KIF13B EOMES SSH2 FBXW8 STK11 FEZ1 CYB5D2 CIB1 SNX3 NCOA1 RAPGEF2 NOTCH1 SYNGAP1 RAPGEF1 PSEN1 DBN1 NME1 MARK2 SSH1 DISC1 ADNP ZMYND8 TMEM30A ILK GSK3B ABL1 FGFR1 CDK5RAP3 STK24 PTEN INPP5F PDLIM5 AKT1 RAP1GAP2 ARHGEF1 PTK2B
GO_NEGATIVE_REGULATION_OF_NF_KAPPAB_TRANSCRIPTION_FACTOR_ACTIVITY	0.680443617827375	0.941537757454481	-0.216687173050126	-0.886708531443233	19755	47	CDKN2A ZC3H12A CYLD SIRT1 DNAJA3 PIAS4 NFKBIA PELI1 TRAF3 TNFAIP3 PARP10 PSMD10 BRMS1 AIM2 RBCK1 PRMT2 TRIM21
GO_PROTEIN_POLYUBIQUITINATION	0.871217093269161	0.980628414546013	-0.16487653962246	-0.874761965359313	11946	211	UBC RLIM SKP1 UBE2D1 TPP2 CDKN2A RNF41 TRIM69 PSME1 UBE2D3 PPIL2 RNF114 RNF14 TRIM56 UBE2B PSMB9 UBE2G1 PSMA1 HERC6 PSMD13 WSB1 PELI1 RNF5 TNFAIP3 MKRN1 HLTF ANAPC11 RNF168 RNF216 AMFR CDC23 PSMD10 UBOX5 CDC26 RNF139 ZNF738 PSMC4 RNF146 UBE2R2 DTX3L CHFR ARIH2 TRIM38 UBB UBE2F RNF213 RBCK1 BCL2 RNF138 CDC34 TNKS2 ARIH1 PSMB8 PSMD6 TRIM21
GO_RIBONUCLEOPROTEIN_COMPLEX_LOCALIZATION	0.708682550145965	0.947745542493562	-0.188705880796571	-0.906644363227348	15050	107	SRSF7 TSC1 FYTTD1 ZC3H3 SRSF5 EIF5A SRSF2 SRSF3 SRRM1 NUP214 NOP58 THOC7 RBM8A NUP88 RNPS1 SMG5 NUP62 PABPN1 POLDIP3 NUP35 UPF2 NUPL1 DDX39B MAGOH CHTOP NXT1 NUP188 THOC3 ENY2 TGS1 NXF1 SRSF10 RANBP2
GO_REGULATION_OF_MRNA_3_END_PROCESSING	0.000683344227226811	0.0472178477690289	-0.575856795693288	-1.99441712781899	22	24	BTG2 PAF1 CNOT7 ZC3H14 ZFP36 CTR9
GO_REGULATION_OF_PEPTIDE_TRANSPORT	0.875983952059317	0.980628414546013	0.190142505076241	0.783418013781902	68995	107	GLUL SRI NLRP3 ARHGEF7 AACS HMGCR C2CD2L CACNA2D2 ARNTL PPM1B ARL2 HLA-DRB1 HADH HLA-DRB5 IL18R1 ITPR1 TCF7L2 EDA ABAT
GO_POSITIVE_REGULATION_OF_ION_TRANSPORT	0.291493151043713	0.772955654985847	0.276922536665054	1.10189131855197	22258	85	MAPK9 SRI PINK1 CREB3 WNK1 ATP1B1 STK39 TESC F2R SNX4 ABL1 CCL3 AKT1 AKAP7 DNM2 EFCAB4B FHL1 ABAT TSPO PRELID1 AKAP9 ACTN4 ASPH ORAI1 ATP8A1 AGER FAM115A PARK7 PLCG2 ADRB2 KCNQ1
GO_ATP_BIOSYNTHETIC_PROCESS	0.577718429219384	0.910022287610543	0.289959673772525	0.920920494452537	38720	27	ATP5A1 ATP5E ATP6V0A2 ATP5I ATP5G3 ATP5F1 ATP5D C11orf83 CHCHD10 ATP5B ATP5G2
GO_CANONICAL_WNT_SIGNALING_PATHWAY	0.591546664367221	0.915088783271145	0.265961483748468	0.920066869773635	41160	40	APC DVL3 STK11 RYK PSEN1 DISC1 GSK3B PTEN FZD3 TCF7L2
GO_ACUTE_INFLAMMATORY_RESPONSE	0.209697545902906	0.691608589201982	-0.343563978013729	-1.18989632036428	7057	24	HNRNPK STAT3 B4GALT1 SERPINA1 PLSCR1 ACVR1
GO_NUCLEOBASE_METABOLIC_PROCESS	0.0552904271293282	0.44253542937409	0.450234486045981	1.4418377222531	3718	28	MAPK1 UMPS SHMT1 ADAL UCK2 GART ALDH6A1 UCK1 PPAT
GO_HUMORAL_IMMUNE_RESPONSE	0.640369253114351	0.931070351684678	0.246465422926491	0.896082796241539	45852	51	TFEB NOTCH1 IGLL5 HIST1H2BC CFH SPON2 PDCD1 GPI HLA-DRB1 HLA-DRB5
GO_PHAGOSOME_MATURATION	0.573865127263186	0.909756728517626	-0.272099028075322	-0.921034822613849	19682	22	ATP6V0C TMEM175 ATP6V1G1 ATP6V1F ATP6V0E1 RAB7A
GO_CHROMATIN_MODIFICATION	0.999174351276003	1	0.145279772777794	0.687039041426125	93182	410	IKZF1 SETD1A PHF13 HDAC9 PHB LDB1 PHC1 KDM2B MBD2 PPM1F NCOA1 TAF10 TADA2A SAP30 BRD1 PIH1D1 HIST1H4C KDM5A DR1 CENPK MSL2 RCBTB1 EYA3 HLCS PCGF1 HIST1H1D SMARCE1 MBD3 HIST1H4H HDAC5 CENPO NACC2 TADA3 SETD6 RUVBL2 PRKCB SETDB1 KDM4B ZNHIT1 CABIN1 TRIM37 BAZ2A CTCF KAT8 SMYD2 MAP3K12 HDAC1 PKN1 RYBP BMI1 BRPF1 TAF5L SIN3A USP22 EPC2 ITGB3BP SMARCB1 SETD3 JARID2 BRPF3 WDR82 CARM1 TRIM16 SIRT6 BRCC3 PER2 RBL2 MTA2 RBM14 PRMT6 CBX7 ARID1A NASP CDC73 POLE3 YEATS4 HIRA RNF40 SUZ12 FBL EPC1 TBL1X MTF2 SUV420H2 KDM5D PHF21A PPP5C HIST1H1E SMARCA5 USP34 KDM1A CENPW MIS18A APITD1 MEN1 HOPX HDAC3 CENPM HDAC10 HMGN5 PHF19 SMARCC1 CENPP
GO_MYELOID_LEUKOCYTE_ACTIVATION	0.0478147590914095	0.410666092864779	-0.318656728336009	-1.36558117236856	1302	58	JUN TNFSF9 TICAM1 PIK3CD RHOH CRTC3 FOXP1 NR4A3 VAMP7 PRKCD RELB IRF4 SLAMF1
GO_ANTERIOR_POSTERIOR_PATTERN_SPECIFICATION	0.387435494108232	0.835496886671798	0.282298309889293	1.04491285443951	28078	56	ZBTB16 LDB1 ACVR2A KDM2B NOTCH1 SMAD3 BMPR1A PSEN1 PRKDC TGFBR1
GO_POSITIVE_REGULATION_OF_CELL_DIVISION	0.759202971968929	0.960160409186866	0.229365595294164	0.824332041610155	53951	48	PLCB1 CSPP1 PDGFD SH2B1 CAT PTEN SMC5 FBXO5 ITGB1BP1 ZNF16 PHB2 EREG PKN2
GO_PIGMENT_BIOSYNTHETIC_PROCESS	0.0771435255585449	0.510001005915037	0.415721048820027	1.38040672800537	5275	33	SLC11A2 SHMT1 ADAL PPOX COX10 UROD CPOX ALAS1 PPAT TSPO FECH COX15 APRT SLC25A39 PAICS
GO_ERBB_SIGNALING_PATHWAY	0.509364848987491	0.876758351605979	-0.235538384406105	-0.969284213263739	14739	48	UBC MVP RNF41 HSP90AA1 PIK3R1 HRAS PTPN11
GO_EMBRYONIC_ORGAN_MORPHOGENESIS	0.185006489845686	0.660240281716924	0.29810600618164	1.18430102679456	14110	84	MAPK1 SPEF2 DVL3 KDM2B NOTCH1 SMAD3 PSEN1 WDR19 IFT52 ABR FUZ TGFBR1 ENG FGFR1 PHACTR4 BCR FZD3 IFT57
GO_REPRODUCTIVE_SYSTEM_DEVELOPMENT	0.223720002417941	0.713214244349562	0.261304735629752	1.13037425423701	18504	155	MAPK1 PRDM1 EOMES FBXW8 TFEB ACVR2A PKD1 BCL2L11 NCOA1 NOTCH1 STK3 EIF2B4 WDR19 HMGB2 IDH1 KDM5A MAP3K4 KIF18A CASP2 CEBPB TGFBR1 PLK4 CTNNA1 PATZ1 PTEN ZNF830 BIRC6 BCL2L1 PRDX3 AKT1 EIF2S2
GO_CYTOSOLIC_CALCIUM_ION_TRANSPORT	0.793227828125704	0.966159941332922	0.248813308387014	0.775876877898147	52778	25	TPCN2 F2R CCL3 ITPR1 ITPR3 PLCG2 MCOLN1 ATP2B4 CCR5 ITPR2 BBC3 IBTK
GO_REGULATION_OF_SPINDLE_ORGANIZATION	0.63376259644691	0.930725641639176	-0.288335013532882	-0.874026252541605	23080	15	PARP3 CHMP1B
GO_POSITIVE_REGULATION_OF_CATABOLIC_PROCESS	0.422595389507154	0.843859574831127	-0.183144680922613	-1.00972236858662	4252	293	UBC EZR BTG2 TIPARP BNIP3 GTPBP1 CNOT7 SKP1 TP53INP1 UBE2D1 ZFP36 TRIM22 CDKN1B EIF2AK4 ZC3H12A SUMO2 PTTG1IP PSME1 AXIN1 NSF PLK3 NFE2L2 RNF114 RNF14 STX5 SPTLC1 SIRT1 PRKCD CUL4B CNOT8 DNAJB2 SPTLC2 PSMB9 CALCOCO2 PSMA1 PSMD13 MAD2L1 IFNG CSNK1A1 SOCS4 TRIB2 AKT2 TBC1D5 TNFAIP3 PABPC1 BAD RAB7A GGA3 ANAPC11 BECN1 PIK3CB ABCD2 UBQLN1 CDC23 TNFRSF1B PSMD10 GORASP1 CDC26 RNF139 PSMC4
GO_GLIOGENESIS	0.441597195273715	0.851159944639843	0.261991986212916	1.01197333906006	33000	71	MAPK1 PHGDH PRDM8 NOTCH1 EIF2B4 PICK1 DISC1 ILK ABL1 CCL3 PTEN EIF2B3 AKT1 PTK2B
GO_PEPTIDYL_THREONINE_MODIFICATION	0.0693824029510937	0.493205549488519	0.401612016498749	1.38199590727086	4814	39	MAPK1 ACVR1B CAMK2D WNK1 MARK2 STK39 TGFBR1 GSK3B AKT1 PRKCB MAP3K12 PKN1 ADRBK1
GO_MATURATION_OF_5_8S_RRNA_FROM_TRICISTRONIC_RRNA_TRANSCRIPT_SSU_RRNA_5_8S_RRNA_LSU_RRNA_	0.465860453533797	0.856122716388238	0.352194329485109	0.997512882170671	29931	17	BOP1 EXOSC9 ERI3 RPSA WDR12 RPS21 PES1 EXOSC7 EXOSC2
GO_ANTIGEN_PROCESSING_AND_PRESENTATION	0.102161664941934	0.547018701581533	-0.231373017665596	-1.17706305466189	1776	154	HLA-DQB1 HLA-DQA1 TAPBP DCTN4 KIF22 B2M HLA-DPB1 ARF1 HLA-C HLA-A CALR PSME1 PDIA3 CENPE RAB8B RELB DYNC1I2 PSMB9 DYNLL2 HLA-DPA1 PSMA1 PSMD13 IFNG HLA-E HLA-DOA
GO_CELLULAR_AMINO_ACID_CATABOLIC_PROCESS	0.00119610491950917	0.0677319751877992	0.495288968680186	1.78005147727365	84	48	GLUL ASL ABHD12 SHMT1 ADO ENOSF1 BCKDK ALDH6A1 DBT ALDH5A1 DDAH2 MCCC1 ACAD8 PPAT HSD17B10 ABAT ACADSB GCSH DTD1 AUH HMGCL CARNS1
GO_MAINTENANCE_OF_LOCATION	0.444320950711751	0.853858121927952	-0.216305168304768	-1.00240485267854	10393	87	EZR G3BP2 HSPA5 SRGN FTH1 CALR SOAT1 FLNB PDIA3 BCL3 PML SUPT7L MORC3 HSP90B1 NFKBIA MXI1 DAG1
GO_NEPHRON_EPITHELIUM_DEVELOPMENT	0.197794368204207	0.681967202817004	0.43005870238837	1.23672046324017	12769	18	PKD1 MTSS1 NOTCH1 ILK
GO_NEGATIVE_REGULATION_OF_RECEPTOR_ACTIVITY	0.804049620348092	0.967540746625628	0.269820728325919	0.752698350607324	51463	16	SRI PSEN1 ERRFI1 SOCS5
GO_KERATINOCYTE_DIFFERENTIATION	0.9776184072912	0.999602846595596	-0.168601745474524	-0.590729086689111	32715	25	FLNB MED1 BCL11B PIP5K1A MAP2K1 CSTA
GO_POSITIVE_REGULATION_OF_CALCIUM_ION_TRANSMEMBRANE_TRANSPORT	0.560659330624172	0.904472633324655	0.307793122911958	0.930977151347394	36836	22	SRI ATP1B1 F2R ABL1 EFCAB4B ASPH PLCG2
GO_NEGATIVE_REGULATION_OF_EPITHELIAL_CELL_MIGRATION	0.0170449338668785	0.271005584884097	0.539675301866831	1.61367029008568	1115	21	CORO1C HMGB1 NOTCH1 HDAC5 CD63 ITGB1BP1 STRAP PDCD10 AGER PTPRM
GO_CELL_REDOX_HOMEOSTASIS	0.242311147971525	0.736796327202748	-0.274084475568274	-1.12790853999809	7011	48	TXNDC12 TXNDC11 PDIA3 NFE2L2 TMX1 NNT ERO1L PDIA6 TMX3 TXNL1 ERP44 GLRX5
GO_POSITIVE_REGULATION_OF_PROTEIN_SECRETION	0.28947334757525	0.770383530181002	0.268738709367193	1.09919884872272	22628	102	SYK GLUL SRI NLRP3 CD274 HMGB1 AACS ZNF384 C2CD2L GLMN RLTPR F2R ABL1 CCL3 HLA-DRB1 CD14 HLA-DRB5 PYCARD TCF7L2 ABAT
GO_POSITIVE_REGULATION_OF_CYTOSKELETON_ORGANIZATION	0.960327894207718	0.997034025651953	0.172519904117538	0.699206705137092	74507	96	CLASP1 FER NCKAP1L PPM1F SMAD3 RLTPR TUBGCP3 PLK4 ARL2 RPS3 PTK2B PYCARD ITGB1BP1 GPR65 TUBGCP4 TUBGCP2 PLEK RCC2 ARPC5 APOA1 SLAIN2 FHOD1 VPS4B CFL2 RAC1 WAS DSTN ABI2 PFN1 ACTR3 NF2 TRIM27 ARPC2 DLG1 LIMK1 IQGAP2 TERF1
GO_RESPONSE_TO_KETONE	0.189717477003942	0.668117592270467	-0.251472584630781	-1.14570545117281	4619	79	JUNB DUSP1 FOS SOCS3 CDKN1A CCR7 FAS CALR FOSB HNRNPK PTGER4 KLF6 RELA CALM2 ROCK2 CALM1 HNRNPU KLF2 CASP9 HMBS
GO_NEGATIVE_REGULATION_OF_PROTEIN_KINASE_B_SIGNALING	0.235498060298745	0.727843681274843	0.39874516738924	1.19227844540129	15418	21	CIB1 RAPGEF1 PTPRJ LEMD2 PTEN BANK1 ARRB2 GNB2L1 DLG1
GO_REGULATION_OF_ENDOTHELIAL_CELL_MIGRATION	0.348054231903789	0.805297222154128	0.303011537699642	1.07478411962409	24541	45	HMGB1 HDAC9 CIB1 NOTCH1 FGFR1 RHOB HDAC5 AKT1 PTK2B ITGB1BP1 PDCD10 ETS1 ZNF580 AGER NF1
GO_INNER_MITOCHONDRIAL_MEMBRANE_ORGANIZATION	0.974518013936193	0.999273226529321	0.196823106224593	0.549062439849733	62374	16	LETM1 OMA1 TIMM10 C11orf83 C19orf70 CHCHD3
GO_CILIUM_MORPHOGENESIS	0.00353798915859036	0.128671444094467	0.378307508235562	1.56671822197049	279	111	IFT20 SPEF2 PCM1 TMEM67 C11orf63 TCTN1 NOTCH1 KIF27 WDR19 UNC119B IFT52 KIAA1377 FUZ DISC1 CEP41 OFD1 IFT122 KIAA0586 WDR35 CEP89 C5orf30 FLNA SPAG1 SPAG16 KIF3A HSPB11 IFT57 DNM2 ABCC4 TTLL5
GO_ENERGY_COUPLED_PROTON_TRANSPORT_DOWN_ELECTROCHEMICAL_GRADIENT	0.0605309624856727	0.462602576340502	0.506320095240454	1.45602546642133	3907	18	ATP5A1 ATP5E ATP6V0A2 ATP5I ATP5G3 ATP5F1 ATP5D
GO_CELLULAR_MODIFIED_AMINO_ACID_BIOSYNTHETIC_PROCESS	0.0759366505141236	0.50944648467407	0.42720130307362	1.38867328246692	5139	30	GGCT SLC27A1 SEPHS2 GGT1 GART GGT7 MAT2A HAGH MAT2B GCLM ATIC CNDP2 GSS FPGS PLOD1 AHCY GCLC ALDH18A1 GAMT
GO_PROTEIN_LOCALIZATION_TO_VACUOLE	0.562436957837402	0.904866297446225	0.272427584737592	0.937456529357133	39031	39	NEDD4 PIK3R4 TMEM30A GOSR2 VPS25 AP3B1 SNF8 NAGPA VTI1B
GO_CELLULAR_RESPONSE_TO_HYDROGEN_PEROXIDE	0.24307139401479	0.7376035671239	-0.273957806107826	-1.12738727163402	7033	48	BNIP3 MAPK7 FAS NFE2L2 STK25 SIRT1 PRKCD KLF6 RELA IL18BP TNFAIP3
GO_REGULATION_OF_ORGAN_GROWTH	0.0965475053712103	0.537538666524371	0.427840253370012	1.35883329069169	6470	27	BCL2L11 NOTCH1 STK3 CACNA2D2 FGFR1 LATS2 PTEN GSK3A CARM1 WWC3 SAV1 LATS1 TGFBR2 DUSP6 MEF2C MAPK14 POR PIN1
GO_POSITIVE_REGULATION_OF_CELL_GROWTH	0.834912536443149	0.974948939482157	-0.183709041826589	-0.831645925571467	20618	76	H3F3B RUFY3 DDX3X NDEL1 BMPR2 HNRNPK N6AMT1 NOL8 SDCBP
GO_REGULATION_OF_TRANSMEMBRANE_RECEPTOR_PROTEIN_SERINE_THREONINE_KINASE_SIGNALING_PATHWAY	0.773744060648123	0.963962013898512	0.214070222295411	0.830591225842262	57971	73	ACVR1B ACVR2A STK11 NOTCH1 SMAD3 BMPR1A ILK TGFBR1 ENG ABL1 SMAD7 FAM89B DNM2 UBA52 STRAP SMURF2 SKI
GO_OVULATION_CYCLE_PROCESS	0.551368041602648	0.898765470205201	0.289197904103244	0.940075322533357	37320	30	EIF2B4 CASP2 CEBPB CTNNA1 ZNF830 BCL2L1 SGPL1 NRIP1 EREG NCOA6 PAM MAP2K6 ARRB2
GO_POSITIVE_REGULATION_OF_CELL_ADHESION	0.291809012055448	0.773143464930414	0.24178230248598	1.08279685525285	25197	212	ZBTB16 SYK STX3 LILRB2 NLRP3 CCL28 ARHGEF7 CD274 IL15 HMGB1 LDB1 NCKAP1L ITGAV VAV3 PPM1F CIB1 LILRB1 SMAD3 BTLA ROCK1 RLTPR PTPRJ DISC1 ILK GSK3B SMAD7 PDCD1 CCDC88B FLNA ARL2 HLA-DRB1 SART1 TRIOBP HLA-DMB CYTH3 AKT1 PTK2B CD63 HLA-DRB5 DNM2 RREB1 PYCARD ITGB1BP1 HSD17B12 CORO1A IL12A LGALS1 ETS1 SOCS5 CARD11 UNC13D
GO_CEREBRAL_CORTEX_DEVELOPMENT	0.520270077368887	0.879769763164914	0.274413131484228	0.964156023694814	36446	43	EOMES NCOA1 PLCB1 PSEN1 GART DISC1 GSK3B TACC1 FGFR1
GO_REGULATION_OF_INTERLEUKIN_8_PRODUCTION	0.688929027710472	0.945139682788527	0.259405623140809	0.855135014587143	46913	32	OTUD7B F2R HSPA1A PYCARD IL6R ZNF580 ANXA4 CD58 PARK7
GO_RNA_PHOSPHODIESTER_BOND_HYDROLYSIS	0.583546763225294	0.91202111526809	-0.202164258217806	-0.947888980180304	13214	93	RNASET2 ISG20L2 CNOT7 ZC3H12A TOE1 PPP1R8 RPP14 PAN2 RPP21 WDR33 UTP20 CNOT8 CSTF2T PARN DICER1
GO_ORGANIC_ACID_METABOLIC_PROCESS	0.0080834694630342	0.201967849444405	0.274234069886629	1.31056117754314	766	488	PRKAB2 SYK GLUL ASL LIPT1 PHGDH GBA2 SUCLG2 ABHD12 B4GALT4 GLCE SLC27A1 SEPHS2 SUCLA2 AACS ARV1 ST3GAL3 SHMT1 ECHDC2 CTPS2 ADO ALDH9A1 TMLHE ICMT TBXAS1 MECR SULT1A1 AARS EIF2B4 B4GALT5 ACOT8 ENOSF1 IDH3B SLC25A15 AARS2 TARSL2 ELOVL6 PET112 GGT1 PTGDS ACPL2 IDH1 CMAS UROD ALOX5 GART MAPKAPK2 PNKD DSE BCKDK XYLT2 SCPEP1 ALDH6A1 SLC7A5 MDH2 QARS APIP GGT7 GLO1 UEVLD GAPDH MTHFR ACSM3 BDH2 SUCLG1 DBT PDDC1 POLG2 HLCS GPI SRR MDH1 PCCB AHCYL2 ALDH5A1 HK1 CBR4 DDAH2 PEPD HADH THEM4 B3GNT1 SCLY MCCC1 IDH3G ACAD8 ETFA HAGH SCP2 SGPL1 CHST12 ADIPOR2 PPAT HSD17B10 CARS2 ABAT HSD17B12 ACADSB HEXA BPGM DLAT FARSB QPRT NPC1 NDUFAB1 SLC22A5 MPST ABHD5 ECH1 ACACA PYCR2 LRRC47 HPGD MSRA BSG PTGES2 IMPAD1 ACOT7 RNPEPL1 SLC23A2 SLC6A6 ENO1 YARS MRPS36 SLC35B2 ALOX5AP EIF2B1 GRHPR GCSH DTD1 PCCA PER2 GCLM AUH ACSS1 ASNS
GO_POSITIVE_REGULATION_OF_PHOSPHOLIPID_METABOLIC_PROCESS	0.724650813986189	0.949977803388459	0.291238434884427	0.812445696559588	46381	16	VAV3 PIK3R4 PTK2B ATG14 FGR RAC1 CD81
GO_REGULATION_OF_SYMBIOSIS_ENCOMPASSING_MUTUALISM_THROUGH_PARASITISM	0.00743913435527502	0.200170134951659	-0.278721153049087	-1.41063630414893	131	149	IFITM1 JUN DDX3X EXOC2 REST MX1 IFITM3 IFITM2 EIF2AK4 ZC3H12A CD28 CHD1 EIF2AK2 CCNK RSAD2 STAT1 ISG15 PML LGALS9 CHMP3 STOM ADAR PLSCR1 IFNG POLR2A OAS1 PABPC1 BAD VAPB ZNF639 OASL RAB7A PARP10 PPIB GSN VPS37B MAVS TBC1D20 ISG20 CTDP1 SP100 TRIM38 DDX5 LEF1 C19orf66 BCL2 MDFIC SP1 CD36 BST2 TRIM21 TIRAP POLR2F
GO_RESPONSE_TO_GROWTH_HORMONE	0.515137694037715	0.879769763164914	0.351035211344206	0.962406260734251	32753	15	MAPK1 AKT1 TRIM16 SOCS2
GO_G1_DNA_DAMAGE_CHECKPOINT	0.0744147755744864	0.506140735426962	-0.311066985655753	-1.31275549860284	2078	54	UBC BTG2 CNOT7 CDKN1A TRIAP1 CDKN1B PLK3 PML CNOT8 RPS27L CNOT4 ATM PPP2R5C
GO_RESPONSE_TO_OXYGEN_LEVELS	0.260423540704301	0.754618429742473	-0.208617466222272	-1.07168908695303	4340	165	UBC NR4A2 BNIP3 TSC1 SOCS3 ECE1 PPP1R15A CDKN1A UBE2D1 APOLD1 CDKN1B DNMT3A FAS UBE2D3 CUL2 PLK3 DPP4 TBL2 SIRT1 PML ERO1L
GO_POSITIVE_REGULATION_OF_CALCIUM_ION_TRANSMEMBRANE_TRANSPORTER_ACTIVITY	0.939559316169416	0.993474131534202	0.223274148291958	0.612133573020934	59739	15	ATP1B1 EFCAB4B ASPH PLCG2 GSTO1 SLC9A1
GO_REGULATION_OF_RECEPTOR_MEDIATED_ENDOCYTOSIS	0.349243918474688	0.805792757829599	-0.268210843966591	-1.05873193424047	10623	40	B2M ARF1 HNRNPK RAB21 SMAP1 SDCBP CD2AP AHI1 SCYL2 TBC1D5 FLOT1 PIK3CB
GO_POSITIVE_REGULATION_OF_LYMPHOCYTE_MEDIATED_IMMUNITY	0.091910607491344	0.528415495310864	-0.309650444222654	-1.28625571226693	2627	50	XCL1 B2M HLA-A CD28 CLCF1 HSPD1 RSAD2 ZBTB1 IFNG HLA-E LAG3 IL23A RASGRP1 UNG
GO_RESPONSE_TO_TRANSFORMING_GROWTH_FACTOR_BETA	0.43977205737866	0.849997840876526	-0.225670354723552	-1.00495706614792	11189	70	UBC JUN FOS XCL1 MAPK7 ID1 USP15 SMAD2 PML
GO_TRANSCRIPTION_ELONGATION_FROM_RNA_POLYMERASE_II_PROMOTER	0.939160642193221	0.993474131534202	0.182751077107758	0.704162592472546	70020	70	GTF2H2 POLR2L TAF3 TAF10 CCNH TCEA1 TCEB2 POLR2B POLR2J POLR2H GTF2F2 MNAT1 SUPT16H TAF2 POLR2K CDC73 TAF11
GO_OXIDATIVE_PHOSPHORYLATION	0.00880892637873045	0.211843611873777	0.402618850748504	1.56215881501222	659	73	NDUFC2 NDUFS8 NDUFS2 NDUFB7 CYC1 UQCRB COX10 NDUFS7 NDUFB6 COQ9 NDUFB9 NDUFB10 COX6C NDUFA3 AK2 NDUFA1 COX4I1 UQCRQ NDUFB1 NDUFAB1 COX7C UQCRH NDUFB3 ATP5D COX15 NDUFS6 NDUFS3 PMPCB C11orf83 NDUFV3 NDUFV1 NDUFA11 NDUFA2
GO_APOPTOTIC_NUCLEAR_CHANGES	0.2200745482283	0.70631034162416	0.443484106219692	1.21586629081336	13992	15	HMGB1 HMGB2 CDK5RAP3 KPNA1 DFFB
GO_REGULATION_OF_DNA_BINDING	0.953174949142691	0.996269658137461	-0.167452669239405	-0.712259652307517	26238	56	JUN ID1 BCL3 IRF4 CALM2 PLAUR NFKBIA CALM1 CSNK2B
GO_IMMUNOGLOBULIN_PRODUCTION	0.543363109230528	0.892076731174051	-0.25296540455974	-0.9459794060643	17335	32	HLA-DQB1 FAS HSPD1 PMS2
GO_TISSUE_MIGRATION	0.171599290449071	0.643102387921644	-0.327694899797061	-1.21631735250598	5513	31	NR4A1 CORO1B ID1 ARSB ACTA2 DPP4 STAT1 PTPN11
GO_RESPONSE_TO_ISCHEMIA	0.019688409518918	0.293656143762076	0.567720709909468	1.60794389403625	1264	17	RNLS EIF4EBP1 CIB1 CPEB4 FAM175B PANX1 PER2 PPIF
GO_ENSHEATHMENT_OF_NEURONS	0.421005917159763	0.843527980933562	-0.257425694071392	-1.01615877634443	12806	40	NAB1 TSC1 NAB2 SOD1 MAL DICER1 AKT2 DAG1 ADAM22 PPARD SERINC5 CXCR4 QKI SBF2 EIF2B2
GO_POSITIVE_REGULATION_OF_PHOSPHORUS_METABOLIC_PROCESS	0.674419098368487	0.94100273810193	0.196641193716948	0.935857147540747	63534	455	MAPK1 CD40 TEC MAPK9 SYK MAP2K3 ACVR1B PINK1 DOCK7 IL15 SLC27A1 HMGB1 PHB DVL3 NCKAP1L ACVR2A PKD1 STK11 VAV3 MOB1B HMGCR IGFBP3 CCND3 CIB1 RAPGEF2 ZFP91 STK3 PIK3R4 LCP2 GLMN PLCB1 RYK SMAD3 FAM129A RAPGEF1 BMPR1A PSEN1 CAMK2D OSBPL8 MARK2 PIH1D1 CCNH ADORA2A MAPKAPK2 ADNP MAP4K5 F2R MAP3K4 MAP4K1 ILK TGFBR1 GSK3B ENG ABL1 FGFR1 CAP1 PDGFD CCL3 STRADA NOD1 PTEN SMPD1 RALB ALS2 RPS3 CD300A AKT1 PPP2R4 FNIP2 PTK2B VCP ATG14 ERN1 PIK3R5 PYCARD ITGB1BP1 IL6R MAP3K12 UBA52 IRAK1 PKN1 PDCD10 AKTIP
GO_RESPONSE_TO_CAMP	0.0130172786896161	0.24348444801728	-0.393871280150785	-1.5731288539481	390	42	JUNB EZR JUN DUSP1 FOS CREM PDE4D FOSB STAT1 RELA JUND
GO_MYOBLAST_DIFFERENTIATION	0.262460091533901	0.754836667031397	0.427345632681159	1.17162067820743	16687	15	HMGCR NOTCH1 TCF7L2 CAST MBNL1 LGALS1
