pathway	pval	padj	ES	NES	nMoreExtreme	size	leadingEdge
GO_POSITIVE_REGULATION_OF_IMMUNE_EFFECTOR_PROCESS	0.450340996341629	0.85422038901615	-0.21094720651373	-1.0011635448812	9970	99	XCL1 B2M HLA-A CD28 CLCF1 KLRK1 HSPD1 RSAD2 NR4A3 VAMP7 LGALS9 IL4R ZBTB1 IFNG HLA-E LAG3 DDX60 TNFRSF14 STXBP2 IL23A CD74 CD84 RASGRP1 UNG
GO_UROGENITAL_SYSTEM_DEVELOPMENT	0.468247083651618	0.856122716388238	0.247570321211157	0.997308746371911	36165	92	ZBTB16 IFT20 PKD1 MTSS1 BCL2L11 AKR1B1 ALDH9A1 NOTCH1 RRM2B SMAD3 ILK TGFBR1 FGFR1 SMAD7 CAT PTEN SMAD5 SGPL1 PPAT MPST CENPF GCNT1
GO_NEGATIVE_REGULATION_OF_CELL_ACTIVATION	0.381380020597322	0.833349018192056	-0.225871102340443	-1.03145777651938	9257	80	IRF1 XCL1 CDKN2A ZC3H12A CYLD FAS INPP5D C10orf54 CTLA4 TIGIT PRKCD LGALS9 IL4R JAK3 ATM PELI1 LAG3 BCL6 TNFAIP3 TNFRSF14 PAG1 LGALS3 CD74 CD84
GO_CELLULAR_RESPONSE_TO_ALCOHOL	0.447019587977035	0.85422038901615	0.280464446290458	1.00797955034696	31766	48	KLF9 IL15 AACS CTNNA1 ERRFI1 BLM RUVBL2 FBXO32 FECH FOXO1 MSN HNRNPD NRIP1
GO_PEPTIDYL_TYROSINE_AUTOPHOSPHORYLATION	0.0544185478205089	0.43810209221282	0.489854251381878	1.46470155145649	3562	21	TEC SYK FER MATK ABL1 ITK PTK2B
GO_CELL_JUNCTION_ASSEMBLY	0.27758750313257	0.765704957028462	0.307712133661565	1.12337361787006	19937	52	APC ARHGEF7 RHOC ILK TLN1 CTNNA1 SMAD7 FLNA ARL2 PLEC PTK2B TBCD ACTN4 RCC2 PKN2 MTDH
GO_INTERACTION_WITH_SYMBIONT	0.117453838058488	0.58345475769605	-0.33750883515606	-1.28014888500083	3682	34	JUN REST EIF2AK4 ZC3H12A CHD1 CCNK STOM VAPB ZNF639 PPIB TBC1D20
GO_REGULATION_OF_POLYSACCHARIDE_METABOLIC_PROCESS	0.749683467985048	0.955485260524165	0.260794742387078	0.806025948393884	49736	24	HMGB1 PPP1R3E GSK3B AKT1 PPP1R3D GSK3A CLTC PPP1R3B
GO_SMOOTHENED_SIGNALING_PATHWAY	0.0362606736242884	0.369565622467537	0.46437693174552	1.49835678668009	2445	29	IFT20 WDR19 IFT52 IFT122 KIAA0586 HSPB11 IFT57 FKBP8 HHAT TTC21B HIPK2 TGFBR2 IFT80 DYRK2 SSNA1 ARL13B HIPK1 IFT172 BBS7 TROVE2
GO_EYE_DEVELOPMENT	0.935950754829766	0.993379359282917	0.178709809044488	0.7352172153699	73590	106	PRDM1 HMGB1 KDM2B CLN8 SMAD3 PSEN1 WDR19 CASP2 TGFBR1 LPCAT1 IFT122 GNB1 SLC25A25 PHACTR4 SIPA1L3 HDAC1 ARHGAP35 RDH13 SKI
GO_DEVELOPMENTAL_PROCESS_INVOLVED_IN_REPRODUCTION	0.106416958694778	0.55574695463064	0.267172902490743	1.20392227990132	9261	225	MAPK1 ZBTB16 PRDM1 EOMES ACVR1B FBXW8 TFEB PABPC1L CCNB1IP1 ACVR2A PKD1 BCL2L11 STK11 CIB1 NCOA1 NOTCH1 STK3 EIF2B4 DIAPH2 BMPR1A WDR19 HMGB2 IDH1 PRKDC KDM5A MAP3K4 KIF18A CASP2 CEBPB TGFBR1 PLK4 CTNNA1 PATZ1 PTEN ZNF830 BIRC6 BCL2L1 PRDX3 AKT1 SPAG16 FBXO5 EIF2S2 PTK2B SMAD5 SGPL1 SLIRP HSD17B10 TTLL5
GO_PROTEIN_DEPHOSPHORYLATION	0.896236505646485	0.987774868209814	0.184707049215085	0.7767331465503	72060	124	SSH2 PPM1F PTPRN2 PPP3R1 PPP1R3E PTP4A2 UBLCP1 STYXL1 SSH1 LHPP PTPRJ PPM1B CDC14B PTPN12 EYA3 PTEN PPP4R1 PPP1R3D PPTC7 SSU72 PPP2R5D ACP1 MTMR1 PPP3CA PTPN18 DUSP23 DUSP22 PPP1R3B RPAP2 PTPMT1 PPP3CC
GO_REGULATION_OF_CELLULAR_PROTEIN_CATABOLIC_PROCESS	0.954719764011799	0.996906826537455	-0.155270039743474	-0.825287161515127	12945	214	UBC EZR USP19 DUSP1 HSP90AB1 SKP1 UBE2D1 CDKN2A SUMO2 PTTG1IP PSME1 AXIN1 PLK3 NFE2L2 RNF114 RNF14 SDCBP PDCL3 PML DNAJB2 PSMB9 TRIM39 PSMA1 PSMD13 MAD2L1 ATM CSNK1A1 SOCS4 TRIB2
GO_REGULATION_OF_PROTEIN_AUTOPHOSPHORYLATION	0.148169190125842	0.625042000265703	-0.393445410745535	-1.2797360050783	5215	19	JUN MVP RAP2C CALM2 RAP2B CALM1 PPP2R5B EEF2K
GO_REGULATION_OF_NEURON_DEATH	0.384576650045442	0.834873676284485	0.244310592686162	1.04199519544136	31312	138	SET PINK1 NAIP BCL2L11 KDM2B RRAS2 CPEB4 AARS SYNGAP1 PSEN1 ROCK1 ADNP PPT1 F2R ILK CASP2 ZNF746 CEBPB GSK3B ABL1 AGAP2 CCL3 GPI FAM134B BCL2L1 RASA1 AKT1 PTK2B NONO TP53BP2 MAP3K12 CORO1A
GO_RESPONSE_TO_GAMMA_RADIATION	0.16310923052813	0.638716278197813	-0.327324460216774	-1.22404958498211	5203	32	SOCS3 GTF2H5 XRCC6 PML ATM BRCA2 BAK1 H2AFX IL1B BCL2 MYC
GO_REGULATION_OF_CYCLIN_DEPENDENT_PROTEIN_KINASE_ACTIVITY	0.4133810794022	0.840185347857639	-0.238608429095433	-1.01863857288746	11312	57	CDKN2D CDKN1A HEXIM1 CDKN2A GTPBP4 CDKN1B CCNT2 CCNK
GO_POSITIVE_REGULATION_OF_PROTEIN_IMPORT	0.194837664624269	0.67666594335726	-0.279115510591505	-1.16432321569909	5532	51	AKAP5 HSP90AB1 ZC3H12A HSP90AA1 PIK3R1 MED1 PRKCD LGALS9 CD27 ZNF259 CHERP DDX58
GO_MULTI_ORGANISM_METABOLIC_PROCESS	0.149784841497848	0.628947296190115	0.281288620263086	1.19373150314286	12147	133	NUP37 MAP2K3 NUP210 NUP85 NUPL2 RPL8 RPL37A RPL35 RPS3 UBA52 RPL3 RPSA NUP205 RPL24 MON1B EIF3L SMARCB1 RPL31 RPS19 RPS21 RPS27A RPL13A FURIN NUP107 RPS23 RPS2 RPS15 RPL4 RPL7A RPS26 RPL23 USF2 EIF3F MAP2K7 RPL14 RAE1 NUP155 RPL29 MAP2K6 RPL10A MAP2K2 RPL18A RPL26 RPL27 RPL7 EIF3G RPS9 RPL21 RPL30 RPL27A NUP93 RPLP2 RPLP0 RPL23A RPS12 RPS3A POM121 RPL19 RPL36 RPS14 RPL26L1 RPL6 RPL22 RPL34 RPL9 RPS18 RPS11 RPS28 RPL18 RPL36A RPS20 RPS4Y1 RPL11 RPL13 RPL37 RPS27 RPS6 RPS13 RPL32 RPL38 PTBP1 RPS29 RPL5 RPL39 RPL35A NUP133
GO_MONOVALENT_INORGANIC_CATION_HOMEOSTASIS	0.853720757467446	0.980628414546013	0.210887433095917	0.761118045004689	60906	49	ATP6V1A SLC4A4 CAMK2D ATP1B1 PPT1 ATP6V0A2 ATP6V1H SLC9A8 NEDD4L CLN6 SLC26A6 SLC11A1 SLC26A11 FASLG TMEM165 ATP5B PDK2
GO_REGULATION_OF_BMP_SIGNALING_PATHWAY	0.335231530046456	0.799435076292084	0.347542990793957	1.0940294961508	22369	26	ACVR2A NOTCH1 ILK ENG ABL1 SMAD7 SKI FKBP8 HIPK2 WNT1 CTDSPL2 XIAP FBXL15 PPM1A
GO_HEART_PROCESS	0.771065583491461	0.963962013898512	0.247102576028625	0.797300202675702	52012	29	MAP2K3 CAMK2D ATP1B1 GAA SMAD5 ADRBK1 NEDD4L KCNQ1 NUP155 MAP2K6
GO_MUSCLE_SYSTEM_PROCESS	0.857551288490515	0.980628414546013	0.194982355063377	0.791389041497514	66587	97	MAP2K3 IL15 TMOD2 CAMK2D TPCN2 ROCK1 ATP1B1 MYL6B NMUR1 LTB4R TLN1 INPP5F DMPK PDLIM5 GAA SMAD5 CFLAR ADRBK1 PPP3CA NEDD4L
GO_MESENCHYME_DEVELOPMENT	0.0103812117086453	0.227589371824795	0.449922503727544	1.59587838053616	731	45	MAPK1 NEDD4 CORO1C EOMES NOTCH1 SMAD3 BMPR1A TGFBR1 GSK3B ENG FGFR1 PHACTR4
GO_TRANSCRIPTION_FROM_RNA_POLYMERASE_III_PROMOTER	0.53770086526576	0.888375490468	-0.244210191519584	-0.952305114116312	16529	38	IVNS1ABP ZNF345 POLR3D GTF3A POLR3B BRF1 POLR3E ZNF143 GTF3C6 SNAPC5 POLR1C GTF3C4 POLR2F
GO_POSITIVE_REGULATION_OF_PROTEOLYSIS	0.85325553310836	0.980628414546013	0.183633148137303	0.839004505213406	75600	262	MAPK9 FBXO22 CIDEB MYH9 SH3D19 PDCD2 NLRP3 PINK1 SLC11A2 HMGB1 USP5 PHB RNF19B BCL2L11 PPM1F SMAD3 PSEN1 CDC16 CRADD TRIB3 ANAPC4 DISC1 F2R PSMC2 BUB3 GSK3B SMAD7 CDK5RAP3 NOD1 PTEN CASP7 SMC5 RPS3 AKT1 FBXO5 IFT57 PTK2B VCP ANAPC16 HERPUD1 PYCARD UBA52 PSMA6 PSMB2 SOCS5 PRELID1 ANAPC5 APOPT1 CYFIP2 ASPH ANKIB1 SENP1 PSMD2 CASP8 ANAPC1 RPS27A FURIN PIDD
GO_REGULATION_OF_CILIUM_ASSEMBLY	0.051828160209348	0.430741003132914	0.426294654402743	1.4338704033496	3564	35	TBC1D16 IFT20 KCTD17 TBC1D19 TBC1D10B TBC1D9B FUZ
GO_REGULATION_OF_PROTEIN_KINASE_B_SIGNALING	0.0683831443000248	0.490274860743311	0.367120820430142	1.358879068565	4955	56	PINK1 STK11 CIB1 STK3 RAPGEF1 OSBPL8 PTPRJ LEMD2 ILK TGFBR1 CCL3 PTEN INPP5F PIK3R5 TCF7L2 ITGB1BP1 TXN PARK7 BANK1 MTDH PIK3CG ARFGEF1
GO_HOMOLOGOUS_CHROMOSOME_SEGREGATION	0.900853045027029	0.987774868209814	0.238277095008211	0.664703477427226	57659	16	CCNB1IP1 MLH3
GO_REGULATION_OF_DNA_TEMPLATED_TRANSCRIPTION_IN_RESPONSE_TO_STRESS	0.0209772775838735	0.299661688880658	-0.353252326464395	-1.48474662365028	588	53	UBC JUN HSPA5 PPP1R15A UBE2D1 MAPK7 UBE2D3 CUL2 NFE2L2 GCN1L1 TMBIM6 BCLAF1 CHEK1 KLF2 ATF6 TCEB1
GO_ENDODERM_FORMATION	0.0404464210791307	0.388918171896012	-0.489150741045526	-1.54006632174202	1445	17	DUSP2 PAF1 DUSP1 CTR9 SMAD2
GO_ESTABLISHMENT_OF_ENDOTHELIAL_BARRIER	0.632223622978631	0.930222401527584	0.31010318588868	0.878298986750732	40620	17	RAB1B RAPGEF2 RAPGEF1 ENG RDX RAPGEF6 MSN
GO_REGULATION_OF_HUMORAL_IMMUNE_RESPONSE	0.192567195634053	0.672978034114405	0.455277417114003	1.24819910493765	12243	15	C3AR1 PHB CFH
GO_REGULATION_OF_MAP_KINASE_ACTIVITY	0.48561288171121	0.863455368705243	0.226376204980388	0.992187665869323	40773	174	MAPK1 CD40 SYK MAP2K3 DVL3 HMGCR RAPGEF1 PSEN1 TRIB3 RGS14 PTPRJ MAPKAPK2 MAP4K5 F2R MAP3K4 MAP4K1 ILK TGFBR1 GSK3B FGFR1 CDK5RAP3 PDGFD NOD1 SMPD1 RPS3 CD300A PTK2B ERN1 PIK3R5 MAP3K12 UBA52 IRAK1 PKN1 PDCD10
GO_NLS_BEARING_PROTEIN_IMPORT_INTO_NUCLEUS	0.344345652359174	0.802375417001857	-0.330955777241646	-1.07647976735134	12121	19	KPNA2 DAG1 KPNA5 FYB NUP35 KPNA3 RANBP2 TNPO1 TRPS1 NCKIPSD
GO_VACUOLE_FUSION	0.899164009307938	0.987774868209814	-0.210291282368209	-0.693310220837815	31298	20	VPS33B VAMP7 CHMP3 TECPR1 EEA1 VPS41 VPS39 KIAA0226
GO_CELLULAR_RESPONSE_TO_ESTROGEN_STIMULUS	0.240720539285614	0.735335238966884	-0.372998365324647	-1.17436645250396	8605	17	WBP2 FAS SFR1 NCOA3 H2AFZ BCAS3 TRIM24
GO_LYTIC_VACUOLE_ORGANIZATION	0.657060518731989	0.937108191965858	0.259047698570519	0.87680596393457	45371	36	TFEB CLN8 TPCN2 PPT1 GAA FAM160A2 CORO1A HPS1 AKTIP VPS18 NAGPA HOOK1 CLN6 MFSD8
GO_REGULATION_OF_CHEMOTAXIS	0.413817330210773	0.840185347857639	-0.229086876388763	-1.01738349332485	10601	69	SEMA4A XCL1 CCR7 CAMK1D TMEM102 CORO1B CALR KLRK1 BMPR2 MPP1 S1PR1 LGALS9 VEGFB AKT2 HSPB1 SEMA4C IL23A PPBP CD74 IL16
GO_MEIOTIC_CELL_CYCLE_PROCESS	0.0883792048929664	0.518936596744114	0.333854958522953	1.30154483074481	6646	75	MYH9 ERCC4 KLHDC3 CCNB1IP1 BCL2L11 SGOL2 MLH3 RAD51D SMC1A KIF18A TUBGCP3 SMC3 ZW10 FBXO5 RAD21 SLC2A8 PLD6 TOP3A TUBGCP4 TUBGCP2 MASTL
GO_NEGATIVE_REGULATION_OF_ACTIN_FILAMENT_POLYMERIZATION	0.633670248197168	0.930725641639176	-0.264907621123784	-0.885235798981552	21879	21	SPTBN1 MYADM SPTAN1 PRKCD VILL GSN
GO_DEVELOPMENTAL_CELL_GROWTH	0.835225925047438	0.974948939482157	0.232893521485305	0.751453323014251	56340	29	STK11 CAMK2D MEX3C ABL1 PDLIM5 SIRT6 USP9X VCL TGFBR2 RARG SLC9A6 PPP3CB IQGAP1 PLXNA3 IMPACT
GO_REGULATION_OF_BONE_RESORPTION	0.519591422059914	0.879769763164914	-0.312647079690879	-0.947723108900655	18922	15	INPP5D PTGER4 S1PR1 TNFAIP3
GO_SPINDLE_ASSEMBLY	0.418791511876618	0.84278760513954	0.285285637662852	1.02530674591831	29760	48	NEK7 CLASP1 FAM175B OFD1 TUBGCP3 FLNA RPS3 FBXO5 TUBGCP4 HAUS6 TUBGCP2 ZNF207 CSNK1D HDAC3 MAP9 NCOR1 RAB11A XIAP KIF2A
GO_REGULATION_OF_SODIUM_ION_TRANSMEMBRANE_TRANSPORTER_ACTIVITY	0.160937523967297	0.637556186725611	0.431987649955174	1.27604069905196	10491	20	NEDD4 CAMK2D ATP1B1 TESC RANGRF DNM2 NEDD4L ACTN4
GO_NEGATIVE_REGULATION_OF_ANTIGEN_RECEPTOR_MEDIATED_SIGNALING_PATHWAY	0.401987973310635	0.839381581673166	-0.340135607392615	-1.0310487326626	14639	15	EZR GBP1 UBASH3A
GO_SPHINGOLIPID_BIOSYNTHETIC_PROCESS	0.470135954700928	0.856122716388238	0.287670167378133	0.995165866487541	32712	40	CERS4 ST3GAL3 CLN8 ST3GAL5 CSNK1G2 UGCG SMPD1 ST6GALNAC4 SGPL1 CERS6 SPHK2 SGPP1 ST3GAL1 ST8SIA4 ALDH3A2 SAMD8 GBA COL4A3BP
GO_REGULATION_OF_PHOSPHOPROTEIN_PHOSPHATASE_ACTIVITY	0.226021240470087	0.714727114320569	-0.287083097229149	-1.14661496405392	6788	42	TSC1 PPP1R15A EIF2AK2 VRK3 CALM2 ROCK2 HSP90B1 PPP2R2A PPP2R5C CALM1 PPP2R5B PPP2R2D
GO_REGULATION_OF_MULTI_ORGANISM_PROCESS	0.164202797896617	0.638716278197813	-0.198648699868196	-1.09458083717969	1654	292	IFITM1 JUN CD247 DDX3X SNRPD1 EXOC2 B2M REST LENG9 ARF1 MX1 HLA-A IFITM3 IFITM2 EIF2AK4 ZC3H12A CD28 PAK2 CHD1 STAT2 FOXP1 EIF2AK2 CCNK RSAD2 STAT1 HIST1H3B B4GALT1 ISG15 PML LY96 LGALS9 CHMP3 CD8B STOM ADAR PLSCR1 DDX58 SLC35B3 SLC35C1 IFNG POLR2A TRAF3 OAS1 TNFAIP3 PABPC1 SUPT3H HIST1H3A BAD DDX60 VAPB ZNF639 OASL ACIN1 IL23A RAB7A PARP10 AP1M1 PPIB GSN RNF216 VPS37B MAVS TBC1D20 ISG20 MBD5 CTDP1 AIM2 DNAAF2 SP100 TSPAN32 TRIM38 PUM2 DDX5 ZNF681 LEF1
GO_POSITIVE_REGULATION_OF_CELL_CYCLE_ARREST	0.0342372756963047	0.359871542520225	-0.328532297143133	-1.40790223334179	932	58	UBC BTG2 CNOT7 CDKN1A CDKN2A TRIAP1 CDKN1B PLK3 PML CNOT8 CNOT4 ATM PPP2R5C PPP2R5B
GO_CONNECTIVE_TISSUE_DEVELOPMENT	0.337177278215686	0.801405920587364	0.284087946591176	1.07761037456886	24852	64	ZBTB16 AACS PKD1 NOTCH1 BMPR1A MEX3C FGFR1 SLC25A25 ARRDC3 ESRRA SMAD5 RUNX1 IMPAD1 EGR1 SLC39A13 EIF2AK3 GNAS TGFBR2 MEF2C THBS3 MAPK14 CSGALNACT1 FBXW4 IFT80 RARG
GO_CYTOPLASMIC_PATTERN_RECOGNITION_RECEPTOR_SIGNALING_PATHWAY	0.125011670245542	0.603352200474316	-0.344577189997251	-1.27897997720123	4016	31	UBC CYLD RELA IRF7 DDX58 NFKBIA TNFAIP3 MAVS NOD2 TAB2 LSM14A
GO_REGULATION_OF_STEROID_BIOSYNTHETIC_PROCESS	0.0110757629315424	0.231436499473878	-0.494450974423298	-1.69277688640757	375	23	SEC14L2 REST ABCG1 SOD1 DHCR7 SIRT1 IFNG DDX20 SF1 IL1B SREBF1
GO_NUCLEAR_ENVELOPE_ORGANIZATION	0.98559939649482	1	0.161416508984623	0.618638493336312	73163	68	NUP37 NUP210 NUP85 OSBPL8 NUPL2 LEMD2
GO_REGULATION_OF_GLIAL_CELL_DIFFERENTIATION	0.757281553398058	0.960160409186866	-0.239151373520038	-0.809509480595837	25973	22	RELA DICER1 ATF5 EPHA4 WDR1 IL1B CXCR4
GO_CELLULAR_RESPONSE_TO_ENDOGENOUS_STIMULUS	0.850197095217016	0.979197194380947	0.181463660068812	0.867140492561582	80664	487	MAPK1 NEDD4 APC SYK KLF9 SLC38A9 AKAP1 STK16 ATP6V1A SLC27A1 POLR2L HDAC9 AACS PHB FER ACVR2A EIF4EBP1 SHMT1 RRAGC AKR1B1 CIB1 CPEB4 NCOA1 RAPGEF2 NOTCH1 SMAD3 RAPGEF1 BMPR1A ARHGEF18 FOXO4 TRIB3 SSH1 PRKDC ZCCHC18 PPP1R9B CEBPB TGFBR1 ZYX GSK3B ENG POLR2B SOCS1 DENND4C ABL1 CTNNA1 FGFR1 SMAD7 ATP6V0A2 PDGFD POLR2J GNB1 NOD1 ATP6V1H LATS2 HDAC5 RHOQ ERRFI1 BLM IPO5 SLC33A1 TADA3 RUVBL2 BCL2L1 FBXO32 AKT1 MED17 AKAP7 RDX AP3S1 POLR2H DNM2 ESRRA SMAD5 ITGB1BP1 ADIPOR2 PPAT TGFBRAP1 UBA52 MED14 SMURF2 CORO1A GNB2 GTF2F2 CALCOCO1 SLC2A8 NR3C2 NPC1 FECH SKI GSK3A ACACA ITPR3 FBXO18 SIN3A NR2C1 FOXO1 MSN HNRNPD HPGD AKAP9 MCM7 FAM83G
GO_POSITIVE_REGULATION_OF_HISTONE_METHYLATION	0.344087578557155	0.802375417001857	-0.321012827299349	-1.0727212960207	11880	21	PAF1 CTR9 SIRT1 PHF1
GO_NEGATIVE_REGULATION_OF_T_CELL_DIFFERENTIATION	0.0638959884431604	0.474392216419108	-0.474601235073605	-1.46637000548761	2299	16	IRF1 CDKN2A CYLD CTLA4 IL4R JAK3 BCL6 CD74
GO_RNA_POLYADENYLATION	0.71849243218942	0.949119774375309	0.263321436861554	0.828908729355277	47944	26	PABPC1L CPSF3 CPSF1 CSTF3 MTPAP
GO_ASPARTATE_FAMILY_AMINO_ACID_METABOLIC_PROCESS	0.842755897390561	0.974948939482157	0.22872022748036	0.748696087555781	57196	31	PHGDH EIF2B4 APIP MTHFR AHCYL2 MSRA EIF2B1 ASNS ADSS MTAP
GO_POSITIVE_REGULATION_OF_MUSCLE_TISSUE_DEVELOPMENT	0.169358673477214	0.639281048637582	0.428330591230356	1.2652381777943	11040	20	HMGCR NOTCH1 MKL2 ARNTL FGFR1 ADRB2 NACA MEF2C MAPK14 PIN1 TGFB1 RPS6KB1 MTOR RBPJ
GO_PROTEIN_TRANSMEMBRANE_TRANSPORT	0.41495488897027	0.840261722850506	-0.254923995945834	-1.01817094516923	12463	42	MCL1 HSP90AA1 TIMM44 HSPA8 RAB8B TIMM22 PEX10 AKT2 PAM16 TIMM50 PEX6 TIMM17A PEX7 TOMM22 TIMM9 PEX14 SAMM50 TOMM20
GO_INTRINSIC_APOPTOTIC_SIGNALING_PATHWAY_BY_P53_CLASS_MEDIATOR	0.884067442164423	0.983569184185575	-0.19295814967876	-0.757165904026284	27055	39	CDKN1A BCL3 SIRT1 PML RPS27L PPP2R5C BRCA2 SHISA5 DDX5 AEN
GO_RESPONSE_TO_RETINOIC_ACID	0.828973208526254	0.97418202240106	0.22151042957202	0.770463335485655	57829	41	GDAP1 NCOA1 TESC ADNP2 TMEM161A PTK2B MICB
GO_ODONTOGENESIS_OF_DENTIN_CONTAINING_TOOTH	0.432744483299168	0.845253246273508	0.330314711321513	1.02088802107142	28709	24	BCL2L11 BMPR1A CTNNA1 EDA HDAC1 FOXO1 BSG PERP NF2 CSF3R PPARA TRAF6 RUNX2 BAX ITGA6
GO_REGULATION_OF_TRANSLATIONAL_INITIATION	0.593008491389572	0.915388088957871	-0.209460290239697	-0.93829100597994	14944	72	EIF1 PPP1R15A DDX3X EIF2AK4 EIF2AK2 EIF3J EIF2S1 EIF5 EIF3A PPP1R15B EIF4G1 EIF4A2 HSPB1 EIF3C RXRA
GO_MYELOID_CELL_ACTIVATION_INVOLVED_IN_IMMUNE_RESPONSE	0.774401091081594	0.963962013898512	0.2463937547075	0.795013122580964	52237	29	SYK PI4K2A HMGB1 SNAP23 CCL3
GO_POSITIVE_REGULATION_OF_SYNAPTIC_TRANSMISSION	0.0741753421452802	0.506140735426962	0.417446077041234	1.38613470490072	5072	33	MAPK1 STX3 GLUL PINK1 RGS14 GSK3B PTEN PTK2B ABAT ITPR3
GO_CELL_RECOGNITION	0.141397440560828	0.622540920482247	-0.310432378966789	-1.23264859495292	4275	41	CCR7 CD5 B4GALT1 TIGIT MFGE8 ST6GALNAC6 DYNLL2 TCP1 EPHA4 VCAN CCT2 JMJD6 CXCR4 CD36 APP UBAP2L
GO_PROTEIN_K63_LINKED_UBIQUITINATION	0.746158846472048	0.955485260524165	0.250635576577781	0.814723471874042	50505	30	NEDD4 ZFP91 RNF115
GO_NEGATIVE_REGULATION_OF_PHOSPHORYLATION	0.817204301075269	0.973534585698768	0.188295276363488	0.854634264947022	71819	243	CORO1C APC GNAQ PINK1 PHB HMGCR IGFBP3 PPM1F CIB1 SMAD3 FAM129A RAPGEF1 PSEN1 WNK1 PIK3IP1 TRIB3 STK39 TESC RGS14 PTPRJ PRKDC LEMD2 SH3BP5 ILK GSK3B ENG SOCS1 ABL1 CAMK2N1 SMAD7 CDK5RAP3 LATS2 ADARB1 PTEN SMPD1 ERRFI1 INPP5F C3orf33 CD300A PRDX3 AKT1 ATG14 PYCARD ITGB1BP1 MICAL1 STRAP PKN1
GO_NEGATIVE_REGULATION_OF_NUCLEAR_DIVISION	0.960062940206804	0.997034025651953	0.192846734686659	0.607061634307723	64064	26	BUB3 ZW10 FBXO5 CENPF KLHL22 ZNF207
GO_REGULATION_OF_GENERATION_OF_PRECURSOR_METABOLITES_AND_ENERGY	0.649474412171508	0.934091266063283	0.241788023238057	0.892106025388117	46956	55	PINK1 HMGB1 SLC25A23 PPP1R3E GSK3B AKT1 PPP1R3D NOA1 VCP GSK3A PRELID1 PPP1R3B SIRT6 PPIF CISD1 PARK7
GO_LIPID_CATABOLIC_PROCESS	0.215949144008056	0.699925535644069	0.275962871098457	1.14721262404652	17154	114	GBA2 ABHD12 PRDX6 TRERF1 ACOT8 PLCB1 PLA2G16 FABP5 PPT1 BDH2 PCCB GALC SMPD1 INPP5F ABHD6 HADH PNPLA6 ACAD8 ETFA SCP2 SGPL1 ACADSB PLD6 ECH1 NAPEPLD PAFAH2 PCCA GM2A PLCG2 APOA1 PAFAH1B1 DDHD1 C2orf43 PEX2 SNX17
GO_POSITIVE_REGULATION_OF_LIPID_METABOLIC_PROCESS	0.54905543172434	0.897892411840929	-0.223116763214946	-0.952503405391611	15025	57	CCR7 LDLR ABCG1 NR1H2 NR4A3 SPTLC1 PRKCD SPTLC2 IFNG AKT2 ABCD2 MID1IP1 CREBL2 IRS2 SMPD2 NOD2 IL1B SREBF1 LDLRAP1
GO_RESPIRATORY_SYSTEM_DEVELOPMENT	0.309006459879344	0.785496681055521	0.282002729855289	1.09416896273476	23151	73	MAPK1 CTSZ SPEF2 HMGB1 PKD1 EIF4EBP1 NOTCH1 BMPR1A FGFR1 ERRFI1 HSPB11 NUMB EDA EIF4E SKI
GO_ION_HOMEOSTASIS	0.842757419103403	0.974948939482157	0.18586524308705	0.838978368941073	73522	229	CD40 RAP1GDS1 SRI CCL28 C3AR1 SLC11A2 ATP6V1A KCTD17 HMGB1 PKD1 SLC4A4 PSEN1 CAMK2D TPCN2 ATP1B1 DISC1 PPT1 F2R SLC30A4 BDH2 ABL1 SLC31A2 ATP6V0A2 CCL3 GNB1 ATP6V1H DMPK DGAT1 POLD1 PRKCB PTK2B SLC9A8 HERPUD1 ITPR1 ATP2A3 SLC31A1 ATP2C1 MICU1 ITPR3 ATP13A3 NEDD4L TMC8 GTF2I SLC39A13 AGER PLCG2 SLC25A37 ATP13A2 APOA1 MCOLN1 ATP2B4 EIF2AK1 ABCB7 CNNM2 PIK3CG ACO1 CLN6 SLC26A6 IREB2 CCR5 SLC11A1 ANXA6 SLC39A10 SLC26A11 SLC30A5 FASLG TMEM165 CCDC22 HMOX1 SLC39A6 ITPR2 ATP5B BBC3 IBTK MTL5
GO_NEUROEPITHELIAL_CELL_DIFFERENTIATION	0.579940128906131	0.91044922132136	0.306694483087306	0.917039882646496	37970	21	HPS6 NOTCH1 FGFR1 USP13 PAFAH1B1 RAC1 RAB27A MEF2C
GO_NUCLEOSIDE_MONOPHOSPHATE_METABOLIC_PROCESS	0.00149743297204792	0.0746125329402832	0.353296006784545	1.55081641059482	125	176	TK2 AMPD3 UMPS NDUFC2 NDUFS8 ATP6V1A NDUFS2 ATP5A1 NDUFB7 CYC1 SHMT1 UQCRB COX10 UCK2 NDUFS7 NDUFB6 ATP1B1 LHPP GART COQ9 NDUFB9 NDUFB10 GAPDH COX6C ATP5E ATP6V0A2 NDUFA3 GPI ATP5I UPP1 SLC25A25 AK2 HK1 NDUFA1 HSPA1A DCK VCP COX4I1 UCK1 ATP5G3 NADK PPAT ATP5F1 UQCRQ BPGM NDUFB1 DUT NDUFAB1 COX7C UQCRH CARD11 NDUFB3 ENO1 ATP5D COX15 NDUFS6 NDUFS3 APRT PMPCB PAICS PFAS C11orf83 NDUFV3 ADSS TPI1 OLA1 NDUFV1
GO_REGULATION_OF_GLUCOSE_TRANSPORT	0.699664841003842	0.946417511221499	0.229908138102829	0.867013985309912	51353	62	NUP37 NUP210 NUP85 OSBPL8 NUPL2 TRIB3 RHOQ AKT1 PRKCB ADIPOR2 GSK3A NUP205 SIRT6 PIK3R3 NUP107
GO_NEGATIVE_REGULATION_OF_TRANSFORMING_GROWTH_FACTOR_BETA_RECEPTOR_SIGNALING_PATHWAY	0.610453806167682	0.921706466858659	-0.240256784371918	-0.911278232125043	19141	34	UBC HSPA5 SMAD2 ZNF451 SIRT1
GO_ADHERENS_JUNCTION_ORGANIZATION	0.647066010935639	0.932634832845543	0.291312640633771	0.871047001207994	42365	21	ARHGEF7 CTNNA1 SMAD7 PTK2B NUMB TBCD RCC2 TESK2 VCL
GO_POSITIVE_REGULATION_OF_OSTEOBLAST_DIFFERENTIATION	0.56396334281364	0.90543081611743	-0.28061092018515	-0.925147333033147	19630	20	IFITM1 BMPR2 PTGER4 JUND ACVR1 LMNA
GO_MYD88_INDEPENDENT_TOLL_LIKE_RECEPTOR_SIGNALING_PATHWAY	0.00279514306323636	0.11117348778896	-0.520093026795046	-1.84354478798029	92	26	UBC TICAM1 UBE2D1 UBE2D3 IKBKE LY96 IRF7 TRAF3
GO_NEGATIVE_REGULATION_OF_SIGNAL_TRANSDUCTION_BY_P53_CLASS_MEDIATOR	0.606169928699259	0.920691225792765	-0.276296515831703	-0.898692905624466	21338	19	TRIAP1 PTTG1IP SIRT1 PSMD10 CD74
GO_POSITIVE_REGULATION_OF_LIPASE_ACTIVITY	0.679559418552375	0.941537757454481	0.271462558496479	0.854536140744044	45346	26	GNAQ RHOC NMUR1 FGFR1 ITK ABHD5 ARL1 APOA1 LMF1
GO_POSITIVE_REGULATION_OF_ERK1_AND_ERK2_CASCADE	0.527511649324408	0.88297415851345	0.258045433072492	0.9614761727377	38376	58	HMGB1 PHB HMGCR CIB1 RAPGEF2 CAMK2D F2R ABL1 PDGFD CCL3 NOD1 PTEN PTK2B PYCARD
GO_MITOCHONDRIAL_ATP_SYNTHESIS_COUPLED_PROTON_TRANSPORT	0.169530981470487	0.639281048637582	0.456331854131322	1.2729942434939	10850	16	ATP5A1 ATP5E ATP5I ATP5G3 ATP5F1 ATP5B ATP5G2 STOML2 ATP5O ATP5G1
GO_PURINE_NUCLEOSIDE_MONOPHOSPHATE_BIOSYNTHETIC_PROCESS	0.224467365573216	0.714233779409633	0.327207783481083	1.17131785699352	15929	47	AMPD3 ATP5A1 LHPP GART ATP5E ATP6V0A2 ATP5I AK2 ATP5G3 PPAT ATP5F1 ATP5D APRT PAICS PFAS C11orf83 ADSS
GO_POSITIVE_REGULATION_OF_PEPTIDE_SECRETION	0.0726345691601719	0.502426698890547	0.414968670378111	1.38734542388509	4985	34	GLUL SRI ARHGEF7 AACS C2CD2L HLA-DRB1 HLA-DRB5 TCF7L2 ABAT
GO_STEROL_TRANSPORT	0.496624436209026	0.871898182540387	-0.293714595497549	-0.968348895752801	17286	20	LDLR ABCG1 NPC2 SOAT1 APOM STX12
GO_REGULATION_OF_CHROMOSOME_ORGANIZATION	0.716874344940026	0.949119774375309	0.200463320597898	0.893843791393151	61557	203	MAPK1 APC ERCC4 SET UHRF2 NEK7 PIF1 TADA2A CAMK2D PIH1D1 ANAPC4 USP7 KDM5A PCID2 MAP3K4 BUB3 MTHFR WRAP53 TEN1 AUTS2 HDAC5 PTEN SMC5 ZW10 TADA3 RUVBL2 FBXO5 SETDB1 ZNHIT1 HIST1H1B CTCF IWS1 SKI SIN3A CCT3 CENPF KLHL22 SMARCB1 JARID2 NAP1L2 ZNF207 OBFC1 RNF40 MTF2 PINX1 WAPAL KDM1A MRE11A MAP2K7 TP53 NBN PARP1 TERF2IP RAB1A PHF19 TAF7
GO_REGULATION_OF_CELL_MATRIX_ADHESION	0.0793878931349341	0.510001005915037	0.377401836465559	1.35099937297126	5633	47	CORO1C CCL28 CLASP1 LDB1 PPM1F CIB1 SMAD3 ROCK1 PTPRJ DISC1 ILK GSK3B PTEN RASA1 PTK2B ITGB1BP1
GO_VISUAL_BEHAVIOR	0.303639103237295	0.785184399315637	0.372000563892924	1.12518441606547	19949	22	IFT20 HMGCR SYNGAP1 RGS14
GO_LIPOSACCHARIDE_METABOLIC_PROCESS	0.695127853512947	0.946417511221499	0.227078252438888	0.872661063927479	51704	69	GBA2 PIGX ST3GAL3 PIGM ST3GAL5 GPAA1 UGCG ARSK GALC ALDH5A1 SMPD1 ST6GALNAC4 PIGG HEXA PIGN DPM2 PIGV MPPE1
GO_REGULATION_OF_CELL_ADHESION	0.0161365219410262	0.267805989757286	-0.220574956585597	-1.23370660361528	138	338	HLA-DQB1 TNFSF9 IRF1 TSC1 PDE3B HLA-DQA1 PPP1CB PPP2CA CYTH1 CD247 XCL1 VPS33B ACP5 CCR7 HLA-DPB1 TMEM102 CDKN2A ADK MAPK7 HLA-A MYADM ARHGDIA GTPBP4 LMO7 CYLD CALR CD28 KLRK1 PAK2 HSPD1 CD5 PIK3R1 DPP4 ICOS NR4A3 SOD1 FAM21C MLST8 PTGER4 C10orf54 GBP1 PTPN11 CTLA4 PML TIGIT PRKCD S1PR1 LGALS9 ZEB1 DNAJA3 IRF4 IL4R MINK1 JAK3 SLAMF1 ZBTB1 FXYD5 ROCK2 HLA-DPA1 IFNG HLA-E PELI1 HLA-DOA LAG3 BCL6 BAD UTRN TNFRSF14 TNFRSF18 NINJ1 IL23A MAP3K8 FLOT1 PAG1 ADAM22 ITPKB PIK3CB LGALS3 GSN ABL2
GO_NEGATIVE_REGULATION_OF_TELOMERE_MAINTENANCE	0.906137402731099	0.990318960590318	0.220254809231883	0.673821862265312	59853	23	ERCC4 PIF1 PINX1 NBN PARP1 TERF2IP SMG6 TERF1 XRCC5 ACD TERF2
GO_REGULATION_OF_ACTIN_FILAMENT_DEPOLYMERIZATION	0.903035692752924	0.988869960500662	0.219621542343261	0.678773890664619	59910	24	TMOD2 RLTPR TRIOBP RDX CAPZA2 PLEK CFL2 DSTN LIMA1
GO_ENDOCRINE_SYSTEM_DEVELOPMENT	0.0911328979189898	0.526773377071531	0.397936953407498	1.3469082950477	6292	36	MAPK1 SMAD3 BMPR1A TGFBR1 AKT1 IL6R TSPO ETS1 FOXO1 APOA1 NF1 KDM1A SIDT2 EIF2AK3 MEN1 MAP2K2
GO_REGULATION_OF_MYELOID_LEUKOCYTE_DIFFERENTIATION	0.533499386325897	0.887450558676238	-0.226565505421339	-0.959998881610666	14778	55	JUN FOS INPP5D FOXP1 PIK3R1 IRF7 TOB2 IFNG ACIN1 IL23A CAMK4
GO_RESPONSE_TO_DSRNA	0.0845748487411359	0.515772954801371	-0.340390276707601	-1.32736229920249	2599	38	TICAM1 DDX21 PRKRA SRRT SLC3A2 EIF2AK2 SMAD2 ADAR DDX58 NFKBIA PELI1 DICER1 FLOT1 MAVS
GO_REGULATION_OF_INTRINSIC_APOPTOTIC_SIGNALING_PATHWAY_BY_P53_CLASS_MEDIATOR	0.181361377303056	0.658617784314685	-0.4116601644968	-1.24786021124267	6604	15	TRIAP1 PTTG1IP HNRNPK SIRT1
GO_POSITIVE_REGULATION_OF_ACTIN_FILAMENT_POLYMERIZATION	0.823108450979117	0.97392286983641	-0.204986633111994	-0.799351647952749	25303	38	BAIAP2 CCR7 FAM21C MLST8 ACTR3C
GO_REGULATION_OF_STEROID_METABOLIC_PROCESS	0.262560987430935	0.754836667031397	-0.291969549056198	-1.12283958644518	8125	36	SEC14L2 REST ABCG1 SOD1 DHCR7 SIRT1 IFNG DDX20 SF1 IL1B SREBF1 LDLRAP1
GO_STEROL_BIOSYNTHETIC_PROCESS	0.951197623321161	0.995832631397525	-0.179915369218844	-0.66218457395167	30736	30	IDI1 CYB5R1 HMGCS1 CYP51A1 EBP
GO__DE_NOVO_PROTEIN_FOLDING	0.0877178260747951	0.518936596744114	-0.443152188907141	-1.39524221119114	3135	17	DNAJB1 HSPD1 HSPA8 HSPE1 ERO1L DNAJC2 CD74 CCT2
GO_REGULATION_OF_PHAGOCYTOSIS	0.0883582875190081	0.518936596744114	0.409370021218739	1.35931806469268	6042	33	SYK HMGB1 NCKAP1L ITGAV SNX3 ABR PTEN BCR CD300A DNM2 PYCARD FGR AGER LMAN2 DOCK2 SLC11A1 CD47 RAB27A GNB2L1 RAP1A
GO_DNA_INTEGRITY_CHECKPOINT	0.723373198982955	0.949977803388459	-0.187438831400687	-0.900556777679618	15362	107	UBC BTG2 CNOT7 CDKN1A TRIAP1 CDKN1B PLK3 PTPN11 TIPIN PML CNOT8 RPS27L CNOT4 ATM PPP2R5C CHEK1
GO_MEMBRANE_PROTEIN_PROTEOLYSIS	0.71337751927499	0.947745542493562	0.266732144952906	0.831753354363332	47465	25	MYH9 PSEN1 APH1B ADAM19
GO_TUBE_MORPHOGENESIS	0.396192868155369	0.839126593720686	0.246176283813428	1.03626558885628	31864	125	CTSZ TCTN1 DVL3 PKD1 MTSS1 BCL2L11 KDM2B NOTCH1 STK3 GLMN SMAD3 PSEN1 IFT52 FUZ ILK IFT122 ENG RHOB PHACTR4 FZD3 IFT57 EDA ITGB1BP1 MICAL2 ARHGAP35 SKI
GO_REGULATION_OF_EMBRYONIC_DEVELOPMENT	0.145715715000357	0.625042000265703	0.359833992648664	1.25795255627749	10194	42	CLASP1 DVL3 NOTCH1 STK3 PLCB1 RBM19 BMPR1A FUZ FGFR1 FZD3
GO_SENSORY_ORGAN_DEVELOPMENT	0.733232580531146	0.95320235469049	0.204085829280458	0.876691287207928	60160	146	MAPK1 PRDM1 HMGB1 DVL3 BCL2L11 KDM2B CLN8 NOTCH1 SMAD3 PSEN1 WDR19 ABR MAPKAPK2 CASP2 TGFBR1 LPCAT1 IFT122 FGFR1 GNB1 SLC25A25 PHACTR4 BCR FZD3 SIPA1L3 HDAC1 ARHGAP35 RDH13 SKI
