pathway	pval	padj	ES	NES	nMoreExtreme	size	leadingEdge
GO_DNA_MODIFICATION	0.318955625364459	0.998775096932903	-0.331184463919906	-1.09883686405631	16955	26	ATRX BAZ2A GATAD2B APOBEC3C EHMT1
GO_PROTEIN_LOCALIZATION_TO_MEMBRANE	2.35599010484156e-05	0.000929728054544046	0.414502474276384	2.08747315750266	0	201	RPS26 RPL8 VAMP2 RAPGEF6 RPS3 RPS19 RPL10 FAU RPL13A RPSA RAB3GAP2 RPL19 RPL11 SEC63 RPL36A RPL9 RPLP0 RPL21 RPS27 RPS15A RPL18 RPS27A RPL27A RPS23 RPL26 RPS2 TNIK PMAIP1 RPS4Y1 RPS16 RPS14 RPL10A RPS18 RPL31 BRAF RPL3 PEX26 RPL14 RPL24 RPLP1 RPS7 RPL36 SRP72 RPS25 RPL34 RPL30 RPL32 RPL39 RPL28 RPS13 RPL29 RPS12 RPL38 RPL23A RPL41 RPL7A RPS28 RPS15 RPL18A RPS4X RPL37 RPL5 RPL7 RPS29 RPS11 RPS21 RPL12 RPL22 RPS3A SYS1 RPS9 RPL35A GPHN IKBKB SSR2 TRAM1 UBA52 RPLP2 RPS6 ASNA1 BAD RPL13 RPL15 RPS24 TOMM7 RAB11A VAMP7 GOLGA4 TSPAN14 SSR3 RPL6 SH3GLB1
GO_MITOTIC_SPINDLE_ASSEMBLY	0.51658586861091	0.998775096932903	-0.333454422563614	-0.954282895086421	27065	15	KPNB1 GOLGA2 ZNF207 BIRC2 PIBF1 TUBGCP3 KIF2A OFD1 CDC14A
GO_RESPONSE_TO_ALKALOID	0.48640270235601	0.998775096932903	0.284440469913507	0.976115165100476	22750	27	TMED10 MDM2 CCL5 SMPD1 HDAC2 BAD CASP3 NFKB1 PRKAA1 DHX15 BCL2
GO_AUTOPHAGY	0.766883844752697	0.998775096932903	-0.184259830441409	-0.880319420725667	43785	170	CHMP4B ZNF593 RAB1A ACBD5 OPTN IST1 WIPI2 PRKAG2 PTPN22 VPS28 LGALS8 IFI16 ATG2A GABARAPL1 CDC37 VPS36 PDK1 ATG13 BECN1 ATP1B1 ATG3 SNRPD1 UBC COX8A TP53INP1 ATPIF1 HSPA8 DYNLL2 PRKAG1 TOLLIP PIK3CB PIK3C3 FIS1 ATG14 ATG4D LAMTOR3 CHMP3 S100A8 ATG16L1
GO_REGULATION_OF_CELL_PROJECTION_ORGANIZATION	0.169885141628152	0.939543928042672	0.244314168339133	1.15275189888944	7424	128	TBC1D10A CYLD CERS2 TBC1D5 GATA3 MAP2K1 SEPT9 PPP3CA TNIK BRAF WDR36 ARPC2 NDEL1 KATNA1 VIM PREX1 CIB1 TBC1D14 CAPZB HDAC2 IKBKB CAMK1D GAK SNX3 APBB1 TBC1D15 SGSM3 ODF2 RAPGEF1 RAB11A VAMP7 GOLGA4 SEPT7 IFRD1 RNF6 RHOG
GO_REGULATION_OF_ACTIN_FILAMENT_LENGTH	0.135633823421842	0.896048982393232	-0.308674404393557	-1.2388358154271	7416	60	ARFGEF1 TMOD3 RAC1 CORO1B PYCARD FAM21C ADD1 ARF6 CAPZA1 GRB2 CCR7 WIPF1 MTPN GMFB SPTBN1 VASP ARPC5L WDR1 ARPC1A RDX
GO_REGULATION_OF_TRANSPORTER_ACTIVITY	0.252034926742637	0.992110199310288	-0.299657164222136	-1.13832555088695	13623	46	GSTO1 OXSR1 GNB5 MYO5A YWHAH UTRN CAMK2D GLRX ANO9 ATP1B1 SUMO1
GO_CELL_JUNCTION_ORGANIZATION	0.628074172284364	0.998775096932903	-0.249580258289288	-0.896113269428867	33633	36	RAC1 CDC42 TBCD CSK CCM2 RAB8B LIMS1 MTDH VASP
GO_PROTEIN_DESTABILIZATION	0.792660318530378	0.998775096932903	0.257458042106894	0.765429227558287	37625	16	MDM2 TRIM21 CTSH PEX2 TMEM147 XBP1 MYLIP
GO_EAR_DEVELOPMENT	0.780454052436698	0.998775096932903	-0.232338533513824	-0.798908867175275	41733	30	RAC1 ZEB1 SLC4A7 PRKRA CCM2
GO_POSITIVE_REGULATION_OF_SMOOTH_MUSCLE_CELL_PROLIFERATION	0.628136896532131	0.998775096932903	-0.282030998482849	-0.884646179730137	33164	21	DDX39B CAMK2D STAT1 FOXP1 TGFBR2 TRAF6 IRAK4
GO_MEMBRANE_BUDDING	0.276507503410641	0.998775096932903	-0.267393740649877	-1.10575324284144	15200	70	CHMP4B RAB1A NSF PICALM VPS28 SEC24C PPP6C SEC13 VAPB GOLGA2
GO_REGULATION_OF_SYNAPTIC_PLASTICITY	0.0608012202614241	0.674386246854581	0.452685657529163	1.45386813161629	2869	21	VAMP2 BRAF STX4 PAIP2 KRAS RAB11A YWHAG RGS14 SIPA1L1 MECP2 RAB3GAP1
GO_NCRNA_TRANSCRIPTION	0.274810430922878	0.998775096932903	-0.289189615725396	-1.1173719755451	14858	50	TBP GTF2E2 POLR2G CDK7 GTF2F2 RPRD1A TAF9 GTF3C2 POLR2J GTF3C5 TAF11 RNASEK POLR2K POLR2E
GO_REGULATION_OF_INTERLEUKIN_1_BETA_PRODUCTION	0.00218141811146098	0.0595455229546052	-0.608100735331179	-1.85846563554702	114	19	JAK2 CARD8 CASP1 PYCARD IFI16 NLRP1 ACP5 IFNAR1 PML CCR7
GO_NEGATIVE_REGULATION_OF_INTRINSIC_APOPTOTIC_SIGNALING_PATHWAY	0.827235392943812	0.998775096932903	-0.214091310086977	-0.778075323754808	44314	38	USP47 NDUFS3 RRN3 TAF9 GPX1 TXNDC12 GRINA DDX3X NFE2L2 SOD2 BAG5 CREB3
GO_CD4_POSITIVE_ALPHA_BETA_T_CELL_ACTIVATION	0.637770897832817	0.998775096932903	-0.290529384553368	-0.874709649029766	33577	18	BCL3 RC3H2 PTGER4 RC3H1 FOXP1 RELB STAT6
GO_LYMPHOCYTE_ACTIVATION	0.32530399536769	0.998775096932903	0.217654330437312	1.05310017623392	14044	152	ANXA1 IL21R ZFP36L2 CEBPG VAMP2 GATA3 TNFSF8 RUNX2 IKZF1 PPP3CA ITK IMPDH1 DOCK2 BRAF IL7R TUSC2 ITPKB MYH9 CD79B RPL22 PREX1 TNFRSF4 CDK6 MFNG SATB1 STAT5B ERCC1 POU2F2 BAK1 UNC13D RPS6 HELLS IL2RB MALT1 TGFB1 VAMP7
GO_REGULATION_OF_PEPTIDYL_SERINE_PHOSPHORYLATION	0.246381805651275	0.988698216223644	0.306516609918292	1.14366936929835	11439	38	ARAF DDIT4 BRAF PDE4D GNB2L1 PDCD10 ATP2B4 ARRB2 BAK1 PLCL1 TGFB1 LATS1 HCLS1 NCK2 PRKAA1 BAG4 BCL2 RAF1 RICTOR
GO_NITROGEN_COMPOUND_TRANSPORT	0.552453691510842	0.998775096932903	-0.203284110943264	-0.961426792250754	31464	158	RAB1A RFTN1 PRKAG2 THOC3 UPF3B SLC17A5 DDX39B SLC44A2 SRSF11 MYO5A SEC13 TAPBP CAMK2G NUP88 POLDIP3 SRSF10 SLC3A2 TSC1 SLC38A1 NUPL1 SIDT1 SLC38A2 SMG1 TAP1 THOC5 HNRNPA2B1 SHFM1 IWS1 CHTOP CD320 SNAP23 SERINC3 SERINC1 SRSF1 SLC35B1 SMG5 RNPS1 NUP62 PABPN1
GO_DEFENSE_RESPONSE_TO_OTHER_ORGANISM	0.00415217545602953	0.105244937069157	-0.331238081682577	-1.52654367409074	233	133	IRF7 RAB1A IFITM3 HIST1H2BK OPTN IST1 IFIT5 ISG15 MX1 HERC5 PYCARD LGALS8 IFI16 POLR3E BCL3 TRIM11 APOBEC3C CRCP JAGN1 NLRP1 ACP5 OAS2 OAS1 FAM111A BECN1 ATP1B1 IFNAR1 PML C19orf66 SNRPD1 STAT1 HLA-E COX8A IL27RA RELA SERINC3 HLA-A TRIM22 EIF2AK2 BST2 S100A8 B2M IL17RA PTPRC IRF9 MB21D1 IFITM1 CALCOCO2 MRPS10
GO_LEUKOCYTE_PROLIFERATION	0.502971736434771	0.998775096932903	0.281276383039027	0.965256959224167	23525	27	IMPDH1 DOCK2 IL7R TNFRSF4 SATB1 RPS6 HELLS MALT1 TGFB1 CCND3 SLAMF1 BTN3A1 HSPD1 AZI2 BCL2
GO_CELLULAR_RESPONSE_TO_INTERFERON_GAMMA	0.00143788164553416	0.0425202143750817	-0.510610380031629	-1.83333706035394	76	36	IRF7 GBP5 JAK2 GBP2 TRIM8 TRIM26 IFNGR2 TRIM38 CAMK2G CAMK2D OAS2 OAS1 MT2A PML SP100 STAT1
GO_IN_UTERO_EMBRYONIC_DEVELOPMENT	0.902591664111674	0.998775096932903	-0.177581329552889	-0.779607737884076	50045	98	NBN ZNF335 NASP ZNF830 FUT8 ADD1 KDM6A KLF2 SP3 CHD8 RRN3 CCM2 GRB2 KIDINS220
GO_ER_NUCLEUS_SIGNALING_PATHWAY	0.0475817215007521	0.603811778680294	0.465677402965012	1.49559307772205	2245	21	HERPUD1 ATF6B EIF2A INSIG2 EIF2S1 ATF4
GO_VESICLE_CYTOSKELETAL_TRAFFICKING	0.130930510047539	0.889163667360956	-0.41805249313797	-1.31130458343449	6912	21	RAB1A FYCO1 KIFAP3 MYO5A
GO_REGULATION_OF_TRANSCRIPTION_FACTOR_IMPORT_INTO_NUCLEUS	0.094335966932897	0.777523492637458	0.360682431199553	1.32889935894973	4381	36	NFKBIA CYLD SPPL3 LITAF TMEM173 PPP3CA DMAP1
GO_MESENCHYMAL_CELL_DIFFERENTIATION	0.500453787543004	0.998775096932903	0.318686935786384	0.964522442712305	23710	17	ADAM15 PHACTR4 TGFBR3 TGFB1 RTN4 RBPJ BCL2
GO_REGULATION_OF_SMALL_GTPASE_MEDIATED_SIGNAL_TRANSDUCTION	0.489309390252786	0.998775096932903	-0.23226722393387	-0.98192765064915	26866	79	ARFGEF1 ARHGEF18 RAC1 CDC42 OGT CYTH4 ARHGAP12 ARHGAP1 ARF6 TAGAP CAMK2D SPATA13
GO_RNA_MODIFICATION	0.223482786403327	0.98427525075508	0.295248675472234	1.1545988841293	10262	47	KIAA1429 QTRT1 NOP56 GAR1 NSUN2 FTSJ1 EMG1 DUS4L PUS7L DIMT1 UBA5 OSGEP NHP2 CDKAL1
GO_CELLULAR_COMPONENT_ASSEMBLY_INVOLVED_IN_MORPHOGENESIS	0.304739529376942	0.998775096932903	-0.288864395558471	-1.09732641653769	16472	46	RAB1A TMOD3 ATP6V0D1 TMEM138 ATXN10 TTN DICER1 TBPL1 RAB8B WDR1 RAB8A IFT57 NEK1 PCM1 PIBF1
GO_ORGANELLE_FISSION	0.351661399312043	0.998775096932903	-0.216385806917256	-1.04280255660494	20139	181	CHMP4B CSNK1A1 RAB1A DIS3L2 RRS1 ZNF830 CKS2 KPNB1 AKAP8L TERF1 GOLGA2 NEDD9 NUP88 SMC5 CDK11B BRE STAG1 YEATS4 DNM1L BECN1 ARPP19 SMC3 SKA2 CLIP1 STRA13 PSMD13 DYNLT1 MAU2 CHMP5 RCC1 MLH1 ZNF207 TTN UBE2S MIS18BP1 TOP2B BIRC2 FIS1 EML4 SUGT1 NUP62 CHMP3 USP16 CEP57 RAD21
GO_MUSCLE_STRUCTURE_DEVELOPMENT	0.817367770996803	0.998775096932903	-0.193310234058103	-0.823208793697542	45000	82	REST TMOD3 ID3 MEF2D FAM65B UTRN TSC1 CAMK2D IGSF8 GTF3C5 GPX1 ATP2A2 TTN MTPN PDLIM5
GO_NEGATIVE_REGULATION_OF_CELL_CYCLE_PROCESS	0.679827891672994	0.998775096932903	-0.206621562343456	-0.896004561343205	37603	91	PRMT2 NBN ATRX ZNF830 DDX39B GADD45A CSNK2A1 USP47 TERF1 CNOT8 THOC5 PML SMC3 UBC BRD7 ZNF207 CDK4 PLK3 FBXW7 CDC73 RBM38 PSMG2 CDKN1B MDM4 APC BAX
GO_RIBOSOMAL_LARGE_SUBUNIT_ASSEMBLY	0.00272272525802571	0.0719494632014453	0.622464732889973	1.8839216084833	128	17	RPL10 RPL11 RPL3 RPL24 MRPL20 RPL38 RPL23A RPL5 RPL12 RPL6 FASTKD2
GO_MAINTENANCE_OF_LOCATION_IN_CELL	0.413985983545902	0.998775096932903	0.262542094624071	1.02217163238586	19020	46	TOPORS NFKBIA FLNB GPAA1 OS9 KDELR1 GOPC LATS1 NFKBIB PDIA3 GOLPH3 SUN2 HK1 ARL2BP POLR2M HSPA5
GO_CELLULAR_RESPONSE_TO_OXYGEN_LEVELS	0.342573005037838	0.998775096932903	0.269671822923187	1.064673959163	15707	49	CREBBP NDRG1 MDM2 RPS27A GNB1 PMAIP1 TCEB2 ADAM8 P4HB BNIP3 TCEB1 UBA52 BAD FOXO1
GO_CELLULAR_RESPONSE_TO_HORMONE_STIMULUS	0.0897175299642532	0.758021579697976	-0.256552437873026	-1.22288867679537	5119	167	JAK2 HNRNPD REST TBC1D4 KDM3A ATP6V0D1 AKT2 RANGAP1 CDK7 FBXO32 NR2C1 MYO5A OGT UBE2L3 YWHAH CSK DENND4C MED16 PTGER4 STAT5A NR4A1 MED13 GRB2 UBE3A CBX3 DDX54 SERPINB9 EIF4EBP2 NR1D2 CALCOCO1 ADIPOR2 NR4A2 STAT3 MED30 RELA
GO_DNA_REPAIR	0.478053765675882	0.998775096932903	-0.200993575608637	-0.990612620378161	27598	215	PARP9 REV1 NBN ATRX NSMCE4A TREX1 ISG15 UBE2L6 ZNF830 ZBTB1 POLR2G CDK7 XRCC5 GADD45A USP47 TDP1 REV3L SMC5 KIN RAD23A BRE SHPRH SMC6 RECQL SMARCA5 SMG1 POLR2J INO80E SUMO1 RCHY1 SMC3 UIMC1 BACH1 UBC STRA13 RNF111 SHFM1 CSNK1E XAB2 MLH1 POLR2K
GO_PROTEIN_POLYMERIZATION	0.358414834077675	0.998775096932903	-0.328088847202726	-1.06677321686107	19019	24	JAK2 RAC1 GOLGA2 DNM1L ZNF207 UBE2S CHMP3
GO_CELLULAR_RESPONSE_TO_CORTICOSTEROID_STIMULUS	0.491287079794006	0.998775096932903	-0.327769351291821	-0.971578500786396	25852	17	REST FBXO32 UBE2L3 CBX3 HNRNPU AIFM1
GO_SIGNAL_TRANSDUCTION_IN_RESPONSE_TO_DNA_DAMAGE	0.597207743857037	0.998775096932903	-0.243892833502178	-0.916295952898795	32081	44	NBN ATRX GADD45A BCL3 CNOT8 GRB2 PML SP100 UBC PLK3 RBM38 CDKN1B MDM4 BAX
GO_MUSCLE_CONTRACTION	0.718190650977005	0.998775096932903	0.225553350958812	0.851891366424552	33262	40	CALM2 HSBP1 PDE4D EEF2 VIM CALM1 PXN IKBKB CXCR4 ATP1A1 RCSD1
GO_TRANSITION_METAL_ION_HOMEOSTASIS	0.975883100928899	0.998775096932903	0.167115825250618	0.619828970620715	45279	37	PRNP EIF2AK1 FXN SLC30A7 ATP2C1 XIAP LCK BTBD9 NDFIP1 SRI SLC30A5 TMC8 MYC SOD1 ATOX1
GO_ENZYME_LINKED_RECEPTOR_PROTEIN_SIGNALING_PATHWAY	0.710851371535598	0.998775096932903	0.180386694381735	0.916932756323343	29982	216	POLR2L KLF10 FIBP NRAS DDIT4 TOB1 RUNX2 RPS27A AP2M1 ITK POLR2A IRS2 CSRNP1 ATP6V0B PILRB EPHB6 ARPC2 TGFBR3 ZFAND5 JAK1 AP2A2 ATP6V1D HNRNPA1 SH2D2A ATP6V0C SMAD2 DGKD VIM ARPC3 PXN ARID5B MAPKAPK2 ARRB2 STAT5B KRAS USP9X UBA52 ARPC1B APH1A ACTG1 TCIRG1 PTPN1 RAPGEF1 TGFB1 FOXO1 RGS14 TXNIP ARPC4 CASP3 TRAT1 ADAM10 AP2B1 XBP1 NAMPT HSP90AA1 IQGAP1 ROCK1 CAMLG SIPA1L1 NCK2 JUN MAPKAPK3 AP3S1 CYBA
GO_REGULATION_OF_DEFENSE_RESPONSE_TO_VIRUS_BY_VIRUS	0.684565410913499	0.998775096932903	-0.26756149793685	-0.849313800699725	36142	22	CD247 RAC1 AP1G1 AP2A1 CD28 HLA-A EIF2AK2 B2M AP2S1
GO_REGULATION_OF_CALCIUM_ION_TRANSMEMBRANE_TRANSPORT	0.442248440670324	0.998775096932903	-0.300427610098816	-1.00659630965436	23539	27	GSTO1 GNB5 MYO5A CAMK2D ATP1B1 SUMO1 PLCG1 CALM3 BAX DIAPH1
GO_RESPONSE_TO_BACTERIUM	0.610377140418571	0.998775096932903	-0.203354895141052	-0.934822814061203	34326	131	JAK2 RAB1A RPS6KA3 HIST1H2BK OPTN ISG15 CASP1 PTPN22 PYCARD BCL3 OGT PTGER4 NLRP1 ACP5 DUSP10 IFNAR1 COMT SERPINB9 CCR7 PRDX3 GPX1 HLA-E RNF5 IL27RA RELA FOXP1 HLA-A TNFRSF1B EIF2AK2 ERBB2IP TRAF6 MTDH S100A8 B2M
GO_POSITIVE_REGULATION_OF_LEUKOCYTE_MIGRATION	0.715858330997103	0.998775096932903	-0.242471229662647	-0.840694451520924	38301	31	ZNF580 RAC1 PYCARD PTGER4 CCR7
GO_CALCIUM_ION_IMPORT	0.0716284381840678	0.714558395378411	-0.495318002787392	-1.44386143905866	3762	16	ERO1L DDIT3 CHERP CCR7 CASK ATP2A2 PTPRC ITPR2
GO_CELL_MATURATION	0.0831109498089281	0.742713728902743	0.406514977953131	1.38106250017661	3892	26	CDKN1A GATA3 RUNX2 G6PD TUSC2 DLD POU2F2 RB1 XBP1 AGPAT6 MECP2
GO_REGULATION_OF_SECRETION	0.846318748901775	0.998775096932903	-0.177452246380955	-0.841968697925876	48163	162	JAK2 REST NSF CARD8 B4GALT1 PAM CASP1 PTPN22 PYCARD GLUD1 RALA EZR AP1G1 PTGER4 NLRP1 DNM1L ZAP70 IFNAR1 COMT PML CCR7 HLA-E RAB27A OXCT1 CD58 ATP2A2 FOXP1 PIK3C3 SPTBN1 TRAF6 RAB8B CHMP3 S100A8 IL17RA VAMP3 MIDN SOCS1 ITPR2 CRY1 SLC9A3R1 IRF3 ARNTL EP300 NR1D1 ACSL4 DNAJC1
GO_APOPTOTIC_SIGNALING_PATHWAY	0.894962878355226	0.998775096932903	0.171581630877647	0.81211929061395	39176	130	CDKN1A CASP4 TOPORS SIVA1 TNFRSF18 DDIT4 TNFRSF25 PMAIP1 AEN ATF4 RHOT2 NGFRAP1 PDCD10 ERN1 TNFRSF4 CIB1 UBE2K BNIP3 GABARAP BAK1 TRADD PERP BAD TGFB1
GO_NEURAL_NUCLEUS_DEVELOPMENT	0.822537010595927	0.998775096932903	-0.228330333534282	-0.765031120282716	43781	27	CDC42 GLUD1 YWHAH NDUFS3 COX6B1
GO_LYMPHOCYTE_MEDIATED_IMMUNITY	0.564242401833913	0.998775096932903	-0.244212962382051	-0.935932952532197	30520	48	IRF7 HLA-DQB1 NBN RFTN1 BCL3 DENND1B
GO_FC_EPSILON_RECEPTOR_SIGNALING_PATHWAY	0.914519958783209	0.998775096932903	0.173347955040619	0.777169831398556	40825	94	NFKBIA NRAS RPS27A PPP3CA ITK CALM2 PSMA5 NFATC1 CALM1 IKBKB PSMC4 KRAS SKP1 UBA52 NFATC2 MALT1 PSMD11
GO_HIPPOCAMPUS_DEVELOPMENT	0.758051232234494	0.998775096932903	0.259093475748168	0.796807602242416	35895	18	UQCRQ CDK6 ATP2B4 CASP3 KDM6B NR4A3 OGDH
GO_RIBONUCLEOSIDE_TRIPHOSPHATE_BIOSYNTHETIC_PROCESS	0.848054870860572	0.998775096932903	0.217259481128315	0.752383576696896	39565	28	NME3 ATP5G2 ATP5S ATP5B TCIRG1 TGFB1 CHCHD10 ATP5A1 ALDOA ATP5F1
GO_REGULATION_OF_CHROMOSOME_SEGREGATION	0.133376890050401	0.893014002385976	-0.347334590123997	-1.27013540165016	7144	39	RAB1A ATRX CDC42 CSNK2A1 SENP6 TERF1 GOLGA2 SMC5 SMC6 BECN1 PUM1
GO_SPHINGOLIPID_METABOLIC_PROCESS	0.623399106478034	0.998775096932903	-0.240217241133793	-0.902486894373805	33488	44	CERS5 ARSA ORMDL3 ST8SIA4 VAPB SPTLC1 GLA ST6GALNAC6 ST3GAL1 SERINC3 SERINC1 ELOVL1
GO_PROTEIN_ACETYLATION	0.382905793896506	0.998775096932903	0.249773145811756	1.03623681533118	17314	62	SRCAP CREBBP EP400 KAT8 ATF2 CRTC2 PHF20 RUVBL1 APBB1 MEAF6 FOXO1 POR NAA20 CCDC101 DR1 MORF4L1 POLE4 BAG6 MECP2 POLE3
GO_REGULATION_OF_NUCLEOCYTOPLASMIC_TRANSPORT	0.520655286465848	0.998775096932903	0.221428239823265	0.967147394591206	23454	81	CDKN1A NFKBIA CYLD SPPL3 LITAF MDM2 TMEM173 PPP3CA
GO_CELLULAR_HORMONE_METABOLIC_PROCESS	0.89953048058938	0.998775096932903	-0.232094766250898	-0.664210910053412	47129	15	STARD3 TIPARP COMT
GO_FORMATION_OF_TRANSLATION_PREINITIATION_COMPLEX	0.0617995314379789	0.674386246854581	0.485177753898062	1.46841548802335	2927	17	EIF2D EIF3F EIF3G EIF3K EIF4B EIF2S3 EIF3J EIF3E MCTS1 EIF3A
GO_REGULATION_OF_PROTEIN_SECRETION	0.707158429577846	0.998775096932903	-0.201768877304252	-0.887087911722932	39247	99	JAK2 REST CARD8 PAM CASP1 PTPN22 PYCARD GLUD1 EZR PTGER4 NLRP1 DNM1L IFNAR1 PML CCR7 HLA-E OXCT1 CD58 FOXP1 PIK3C3 SPTBN1 TRAF6 IL17RA VAMP3 MIDN SOCS1 ITPR2 IRF3 ARNTL EP300 NR1D1 DNAJC1 GNAS PPID SLC16A1 ZC3H12A VPS35 RASGRP1 NR1H2 UCP2
GO_REGULATION_OF_PEPTIDYL_TYROSINE_PHOSPHORYLATION	0.968851407095059	0.998775096932903	-0.168444198787016	-0.664359469558067	52845	55	RAP2C JAK2 EHD4 PTGER4 IFNAR1 IL6ST STAT3 PTPN2 ABI1 FBXW7 SOCS1 MVP PIBF1 ADAM17
GO_RESPONSE_TO_INSULIN	0.960999133314074	0.998775096932903	0.16566929242198	0.70182964510317	43243	69	VAMP2 SOCS3 INSIG2 IRS2 ATP6V0B CCL5 ATP6V1D ATP6V0C HADHA STXBP3 TCIRG1 PTPN1 YWHAG FOXO1 GFPT1
GO_REGULATION_OF_CATABOLIC_PROCESS	0.473899213125733	0.998775096932903	-0.19057482160295	-0.994314910020818	28305	356	CHMP4B CSNK1A1 UBE2E1 PSMD4 RAB1A NSF RNF114 N4BP1 ERLEC1 ATP6V0D1 AKT2 TRIM8 SLIRP PRKAG2 RNF139 CASP1 TNRC6B PSMD5 GGA3 POLR2G PTPN22 PSMB9 VPS28 IFI16 TIPARP CDC42 CSNK2A1 OGT TERF1 CNOT8 GOLGA2 SPTLC1 EZR TRIB2 SMC5 RNF40 RAD23A PPP1CB TSC1 ARIH1 VPS13C TRIM13 UBE3A TAF9 RC3H1 DNM1L SGTA BECN1 WBP11 HERC1 SUMO1 RCHY1 PML UBAC2 GPX1 NRD1 UBC PSMD13 FBXL5 TP53INP1 ATPIF1 RNF5 STAT3 CSNK1E RELA ZNF207 PRKAG1 DDRGK1 PSMA1 PIK3CB TNFRSF1B TRIM22 VCP ATG14 USP33 ATP6V0E2 OAZ1 ATXN3 MTDH AIFM1 NFE2L2 PLK3 ATP6V1B2 ANKIB1 FBXW7 PSMD6 DERL2 PSMG2 CDKN1B STUB1 CALCOCO2 RDX CAPNS1 MDM4 PAFAH1B2 FHIT APC BAX BAG5
GO_REGULATION_OF_CARBOHYDRATE_METABOLIC_PROCESS	0.259311740890688	0.992110199310288	-0.289623068507598	-1.12905487141375	14090	52	ARFGEF1 AKT2 PRKAG2 OGT GOLGA2 PPP1CB PTGER4 PDK1 AP2A1 ARPP19 STAT3 PTPN2 PRKAG1
GO_B_CELL_ACTIVATION	0.336981194751509	0.998775096932903	-0.276253687227384	-1.07203759529909	18259	51	NBN PRKCB ZBTB1 BCL3 AKAP17A SP3 ZAP70 PIK3CD KLF6 MLH1 CD79A PTPN2 IKZF3 BST2 JAK3 PTPRC BAX ADAM17 POLM EP300
GO_REGULATION_OF_NEURON_DIFFERENTIATION	0.426726189127331	0.998775096932903	0.218665099390273	1.01070537389501	18830	112	CERS2 GATA3 MAP2K1 PPP3CA TNIK UBE2V2 BIN1 BRAF WDR36 NDEL1 CCL5 KATNA1 VIM PREX1 CIB1 CDK5RAP3 HDAC2 IKBKB CDK5RAP2 CAMK1D GAK SNX3 APBB1 RAPGEF1 RAB11A VAMP7 YWHAG C3orf17 GOLGA4 IFRD1 RNF6 MMD
GO_NEGATIVE_REGULATION_OF_NF_KAPPAB_TRANSCRIPTION_FACTOR_ACTIVITY	0.0657453576341128	0.689263157666842	0.399375044581007	1.40590399678078	3058	30	SIVA1 NFKBIA CYLD TNFAIP3 COMMD6 TRIM21 RWDD3 CDK5RAP3 ARRB2 TRIM37 USP7 PELI1 UFL1
GO_PROTEIN_POLYUBIQUITINATION	0.540668759479383	0.998775096932903	-0.20587188675111	-0.964251320947853	30656	148	UBE2E1 PSMD4 RNF114 RNF139 PSMD5 HERC5 MARCH5 PSMB9 TRIM38 UBE2L3 RC3H2 KLHL20 ARIH1 UNKL SHPRH UBE4A RNF181 UBE3A UBC RNF111 PSMD13 TPP2 RNF5 UBE2S RNF126 PSMA1 NPEPPS BIRC2 MKRN1 PPIL2 TRAF6 RNF34 RNF213 ANKIB1 FBXW7 PSMD6 UBE2G1 STUB1 RFFL UBE2J2 WSB1 UBR5 PSMD1 TRIP12 LNPEP PSME4
GO_RIBONUCLEOPROTEIN_COMPLEX_LOCALIZATION	0.713944396177237	0.998775096932903	-0.204291321716147	-0.877854311964713	39443	86	PRPF31 RRS1 THOC3 UPF3B DDX39B SRSF11 NUP88 POLDIP3 SRSF10 TSC1 NUPL1 SMG1 THOC5 HNRNPA2B1 SHFM1 CHTOP SRSF1 SMG5 RNPS1 NUP62 PABPN1
GO_REGULATION_OF_MRNA_3_END_PROCESSING	0.611635548633402	0.998775096932903	-0.29621742601173	-0.891834886655414	32201	18	TNRC6B POLR2G RNF40
GO_REGULATION_OF_PEPTIDE_TRANSPORT	0.398133955348217	0.998775096932903	0.244332848224143	1.02873630241589	17921	67	NFKBIA CYLD LITAF PPP3CA GLUL IRS2 STX4 ENY2 CCL5 HLA-DRB5 PHPT1 HMGN3
GO_POSITIVE_REGULATION_OF_ION_TRANSPORT	0.688566726455741	0.998775096932903	-0.228049075210883	-0.870246764693004	37236	47	GSTO1 PRELID1 GLRX ATP1B1 SUMO1 TRPV2 CASK PLCG1 JAK3 B2M CALM3 HBP1 BAX CREB3
GO_ATP_BIOSYNTHETIC_PROCESS	0.964817147370893	0.998775096932903	0.181251682106739	0.615770426250835	45192	26	ATP5G2 ATP5S ATP5B TCIRG1 TGFB1 CHCHD10 ATP5A1 ALDOA ATP5F1
GO_CANONICAL_WNT_SIGNALING_PATHWAY	0.0100666679329142	0.210131118868562	-0.570303894708439	-1.71703912272974	529	18	CSNK1A1 CDC42 KDM6A SCYL2 CHD8 NR4A2
GO_HUMORAL_IMMUNE_RESPONSE	0.442061101549053	0.998775096932903	0.280937230669182	1.00583764623981	20546	32	GPI GATA3 FAU RPL39 C1QBP CD46 HLA-DRB5 POU2F2
GO_PHAGOSOME_MATURATION	0.733763903839254	0.998775096932903	0.267613585295651	0.80994631410111	34764	17	ATP6V0B ATP6V1D ATP6V0C TCIRG1
GO_CHROMATIN_MODIFICATION	0.822824781191007	0.998775096932903	-0.174047458497416	-0.874733277491002	47945	253	JAK2 UBE2E1 REST PRMT2 KDM3A KDM2B ATRX ZNF335 PRKCB NASP ZBTB1 BAZ2A CHD4 KDM6A GATAD2B OGT RBBP4 PKN1 ATAD2 RNF40 CHD8 BRE ASXL1 ARID4A ARID2 YEATS4 SMARCA5 KAT6B TAF9 RSF1 CBX3 EHMT1 SMARCC2 CABIN1 UIMC1 STRA13 SUPT4H1 HNRNPC RPS6KA5 TTF1 TOP1 RBBP7 MIS18BP1
GO_MYELOID_LEUKOCYTE_ACTIVATION	0.104515823669887	0.797355684485105	0.36542320447828	1.31846807423837	4857	33	VAMP2 NDRG1 DOCK2 CCL5 PREX1 STXBP2 SBNO2 CRTC3 TGFB1 VAMP7 HMGB1 ADAM10 LAT SLAMF1 JUN RHOH RBPJ JMJD6
GO_ANTERIOR_POSTERIOR_PATTERN_SPECIFICATION	0.508797515104453	0.998775096932903	-0.306806807899918	-0.962360421315056	26863	21	KDM2B DDIT3 KDM6A
GO_POSITIVE_REGULATION_OF_CELL_DIVISION	0.182596959529121	0.965044356319863	-0.363732391238341	-1.22970482926488	9740	28	RAB1A CDC42 TERF1 GOLGA2 SMC5 PHB2 BECN1 CD28
GO_PIGMENT_BIOSYNTHETIC_PROCESS	0.694315181674866	0.998775096932903	-0.278172877757527	-0.837507368306112	36554	18	SLC25A39 HPRT1 MYO5A ATPIF1 UROD
GO_ERBB_SIGNALING_PATHWAY	0.890603137884074	0.998775096932903	-0.201313245137119	-0.727380371185859	47738	37	CSK CDC37 USP8 GRB2 UBC RPS6KA5 ERBB2IP PLCG1 AREG CBL STUB1 MVP ADAM17 CPNE3 PIK3C2A
GO_EMBRYONIC_ORGAN_MORPHOGENESIS	0.522097362120657	0.998775096932903	0.261671419869694	0.957448359812661	24205	35	GATA3 RUNX2 INSIG2 PHACTR4 SEC24B RPL38 SMAD2
GO_REPRODUCTIVE_SYSTEM_DEVELOPMENT	0.683696234160271	0.998775096932903	0.202691500990932	0.896788813210095	30645	87	ANXA1 GATA3 MAP2K1 ADAM15 SOCS3 CTSB MAP3K4 FNDC3A PRDX4 CSDE1 ARID5B WDR48 ARRB2 STAT5B ERCC1 BAK1 RPS6 MEA1 HSF1 ARID1A
GO_POSITIVE_REGULATION_OF_CATABOLIC_PROCESS	0.141545044966688	0.908521683972231	-0.239379956461084	-1.16433001155226	8136	194	CSNK1A1 UBE2E1 PSMD4 RAB1A NSF RNF114 AKT2 TRIM8 RNF139 TNRC6B PSMD5 GGA3 POLR2G PSMB9 VPS28 TIPARP CSNK2A1 CNOT8 GOLGA2 SPTLC1 EZR TRIB2 SMC5 RNF40 ARIH1 TRIM13 RC3H1 SGTA BECN1 SUMO1 RCHY1 NRD1 UBC PSMD13 FBXL5 TP53INP1 ATPIF1 CSNK1E DDRGK1 PSMA1 PIK3CB TNFRSF1B TRIM22 VCP ATG14 OAZ1 ATXN3 MTDH NFE2L2 PLK3 ANKIB1 FBXW7 PSMD6 CDKN1B STUB1 CALCOCO2 RDX PAFAH1B2 APC BAX
GO_GLIOGENESIS	0.409445770694884	0.998775096932903	0.289560710510415	1.02751500639922	19037	31	ANXA1 MAP2K1 NDRG1 EEF2 VIM CDK6 HEXB TGFB1
GO_PEPTIDYL_THREONINE_MODIFICATION	0.0462915455219201	0.592722675651801	-0.510486775407596	-1.51319204790509	2435	17	PRKCB OXSR1 DYRK1A PKN1 CAMK2D
GO_ANTIGEN_PROCESSING_AND_PRESENTATION	0.201817567447403	0.97259169999057	-0.249181206350398	-1.13837996410507	11347	125	HLA-DQB1 PSMD4 RFTN1 HLA-C PSMD5 KIFAP3 PSMB9 SEC24C SEC13 TAPBP AP1G1 HLA-DPB1 TAP1 AP2A1 DCTN4 HLA-E PSMD13 DCTN5 RAB27A RAB35 DYNLL2 ERAP2 AP3B1 PSMA1 HLA-A DYNC1LI2 KLC1 SAR1B TRAF6 RAB8B B2M HLA-DQA1 PSMD6 RELB AP2S1 HLA-DPA1 DCTN6 PSMD1 LNPEP PSME4
GO_CELLULAR_AMINO_ACID_CATABOLIC_PROCESS	0.62764724876066	0.998775096932903	-0.292656581727768	-0.881114095508378	33044	18	GLUD1 MCCC2 PPM1K
GO_MAINTENANCE_OF_LOCATION	0.426777041942605	0.998775096932903	0.24760644873289	1.01293292024481	19332	58	TOPORS NFKBIA FLNB GPAA1 PLIN2 OS9 KDELR1 SLC30A7 GOPC STAT5B HEXB LATS1 NFKBIB PDIA3 GOLPH3 SUN2 HK1 ARL2BP POLR2M HSPA5
GO_KERATINOCYTE_DIFFERENTIATION	0.0569857588269993	0.64932396755168	0.499063405658582	1.48372804348934	2704	16	ANXA1 FOSL2 MAP2K1 FLNB TSG101 SHARPIN TXNIP LATS1 CASP3
GO_CELL_REDOX_HOMEOSTASIS	0.73160544471378	0.998775096932903	-0.235477538480975	-0.834643938858724	39235	34	ERO1L DDIT3 GLRX GPX1 TXNDC12 TXN2 TMX4 AIFM1 PDIA4 NFE2L2
GO_POSITIVE_REGULATION_OF_PROTEIN_SECRETION	0.400563658657102	0.998775096932903	-0.260207554041431	-1.03030074929098	21887	56	JAK2 CARD8 CASP1 PTPN22 PYCARD GLUD1 EZR PTGER4 NLRP1 DNM1L IFNAR1 HLA-E OXCT1 CD58
GO_POSITIVE_REGULATION_OF_CYTOSKELETON_ORGANIZATION	0.883002449636211	0.998775096932903	-0.191286063636958	-0.762820907300301	48301	58	RAC1 PYCARD FAM21C TERF1 ARF6 GRB2 BECN1 CCR7 CLIP1 WIPF1 RGS2 VASP WDR1 ARPC1A CDKN1B
GO_RESPONSE_TO_KETONE	0.893497571515633	0.998775096932903	-0.193048074321445	-0.743128004592922	48381	49	HNRNPD NASP FBXO32 KLF2 PTGER4 CBX3 CCR7 KLF6 RELA CDK4 HNRNPU AIFM1 CALM3 SOCS1 BAX GNG2 EP300 RPS6KB1
GO_REGULATION_OF_ENDOTHELIAL_CELL_MIGRATION	0.846213277554789	0.998775096932903	-0.227944731246275	-0.741156964923798	44905	24	ZNF580 PDCD6 STAT5A SP100 CCDC23 FOXP1 PLCG1
GO_CILIUM_MORPHOGENESIS	0.691600268076551	0.998775096932903	-0.232428166300151	-0.864424165524131	37149	42	RAB1A ATP6V0D1 TMEM138 C16orf80 ATXN10 RAB8B RAB8A IFT57 NEK1 PCM1 PIBF1 TCTN3
GO_ENERGY_COUPLED_PROTON_TRANSPORT_DOWN_ELECTROCHEMICAL_GRADIENT	0.963698181741389	0.998775096932903	0.191301000769823	0.58832084169551	45633	18	ATP5G2 ATP5S TCIRG1 ATP5A1 ATP5F1 ATP5D ATP5G1 ATP5L ATP5E
GO_CELLULAR_MODIFIED_AMINO_ACID_BIOSYNTHETIC_PROCESS	0.350398114892728	0.998775096932903	-0.364755241141557	-1.08121259338483	18438	17	MAT2B MTHFD2L CNDP2 ATPIF1 MTHFS GSS GCH1 PTDSS1 DHPS ATIC MTHFD2
GO_PROTEIN_LOCALIZATION_TO_VACUOLE	0.0240690791938263	0.406718317805882	-0.458650851588085	-1.56402463513477	1284	29	VPS13A GCC2 GNPTAB VPS28 ARF6 VPS13C VPS36 BECN1 RAB35 HSPA8 AP3B1 TOLLIP VPS13D ACAP2
GO_CELLULAR_RESPONSE_TO_HYDROGEN_PEROXIDE	0.217540916618276	0.983940713162858	0.331987606610652	1.17806814028638	10114	31	ANXA1 RPS3 MDM2 TNFAIP3 FXN PDCD10 HDAC2 BNIP3 ZNF277 FOXO1
GO_POSITIVE_REGULATION_OF_CELL_GROWTH	0.131012037944489	0.889163667360956	-0.330950799825755	-1.26292493207699	7084	47	RPS6KA3 IST1 KDM2B DDX39B CDC42 CSNK2A1 USP47 TAF9 TRPV2 DDX3X CDKN2AIP H3F3B MTPN S100A8 DERL2 ITSN2 ADAM17 EP300 ACSL4 PAFAH1B1 MACF1 ZNF639
GO_REGULATION_OF_TRANSMEMBRANE_RECEPTOR_PROTEIN_SERINE_THREONINE_KINASE_SIGNALING_PATHWAY	0.985031874569263	0.998775096932903	0.159252989338768	0.597882916577902	45736	39	TOB1 RPS27A TGFBR3 STRAP SMAD2 UBA52 TGFB1 PIN1 PPM1A XIAP RBPJ HSPA5 ILK FKBP1A SDCBP
GO_POSITIVE_REGULATION_OF_CELL_ADHESION	0.60659123404706	0.998775096932903	-0.200733491917572	-0.938445607896537	34363	146	HLA-DQB1 JAK2 CD247 RAC1 KIFAP3 CITED2 MAP3K8 ZBTB1 ADK PYCARD CDC42 GRAP2 CSK ICOS UTRN TSC1 PTGER4 HLA-DPB1 GRB2 ZAP70 CD59 CD5 CCR7 IL6ST SKAP1
GO_CEREBRAL_CORTEX_DEVELOPMENT	0.30208981099365	0.998775096932903	-0.342355025877295	-1.11315936331725	16030	24	RAC1 TACC1 TSC1 SLC38A2 MCPH1
GO_REGULATION_OF_INTERLEUKIN_8_PRODUCTION	0.0684681603101306	0.701081339649925	-0.487738609566757	-1.44576161618176	3602	17	ZNF580 DDIT3 PTPN22 PYCARD BCL3 PTGER4
GO_RNA_PHOSPHODIESTER_BOND_HYDROLYSIS	0.00458978772231784	0.111774830414093	0.398901865652546	1.64362566626675	207	60	REXO2 XRN2 RPSA DIS3L RNASEH1 TSEN54 DIS3 RPP30 EXOSC8 SMG6 NOP14 TOE1 ERN1 ABT1 RPS21 CNOT6L POP5
GO_ORGANIC_ACID_METABOLIC_PROCESS	0.984818493209632	0.998775096932903	-0.151323336153238	-0.753883841225372	57214	234	ADI1 ERO1L ADPGK B4GALT1 HS3ST3B1 ALDH9A1 GSTO1 PAM RNPEPL1 PRKAG2 ACO2 MTHFD2L MYO5A GLUD1 MCCC2 PPM1K IDH3A CNDP2 MSMO1 STAT5A PPA1 ACSL5 TARS IDH2 SUCLG2 AASDHPPT SUCLG1 GPX1 ADIPOR2 ATPIF1 ME2 SDHA UROD PFKFB3 ST3GAL1 PRKAG1 HSD17B10 LTA4H ELOVL1 PDXDC1 SCP2 PTPLAD1 MARS PGM1 CYB5R3 PTPLAD2 LYPLA1 LYPLA2 NDUFS6 SLC23A2 PGD
