pathway	pval	padj	ES	NES	nMoreExtreme	size	leadingEdge
GO_REGULATION_OF_PROTEIN_KINASE_B_SIGNALING	0.397065286390937	0.755951218321207	0.271715736647601	1.03119570899983	16262	39	MTDH CPNE1 ILK MTOR GNB2L1 TGFB1
GO_REGULATION_OF_DNA_TEMPLATED_TRANSCRIPTION_IN_RESPONSE_TO_STRESS	0.567718766795329	0.852998801401438	0.244799718699401	0.934422934071155	23238	40	EGR1 NFE2L2 UBA52 RBPJ KLF2 SIRT2 BCLAF1 RPS27A RGS14 HMOX1 UBC CITED2 EP300 VHL BACH1
GO_ESTABLISHMENT_OF_ENDOTHELIAL_BARRIER	0.660711847435256	0.890162685581874	0.290648584468598	0.855307343352095	29032	15	EZR RAB1A ICAM1 RAP2B RAP1B
GO_REGULATION_OF_MAP_KINASE_ACTIVITY	0.32226108856863	0.703971598934954	0.223287333883224	1.05562186459889	11515	118	PTPN1 MAP3K8 DUSP2 ILK DUSP10 MAP4K2 RPS3 UBA52 SNF8 DUSP5 TGFB1 PTPN22 PTPLAD1 CXCR4 MIF TSG101 RPS27A PIK3CG KRAS RAF1 MAP2K1 LAMTOR2 RGS14 GADD45B MAPK8IP3 MAPKAPK5 RGS2 RIPK2 SHC1 SOD1 SPAG9 MAPK1 UBC
GO_VACUOLE_FUSION	0.417548657479756	0.766220007794671	-0.35857466677907	-1.03007968147628	23512	16	TECPR1 VPS39 CHMP3 STX17
GO_LYTIC_VACUOLE_ORGANIZATION	0.268674845135431	0.652286885601277	-0.351711067716148	-1.14551873360152	15483	26	CHMP5 NAGPA VPS11 LAMTOR1 HOOK3 HEXB MBTPS1 BECN1
GO_REGULATION_OF_CHEMOTAXIS	0.954260528893242	0.986119155669659	0.17549569034882	0.673993462428398	38971	41	ADAM17 SEMA7A TGFB1 CXCR4 CAMK1D HSPB1 HMGB1 CD74 PRKD2 LYN VEGFB SEMA4B IL16 PLXNC1 ST6GAL1 CXCR3
GO_NEGATIVE_REGULATION_OF_RESPONSE_TO_STIMULUS	0.86226835082913	0.967205245150664	-0.168184565236437	-0.876862576275565	65465	494	C9orf89 IFI6 BST2 FAS ANXA5 CSNK1E NUP62 PSME2 CREB3 GBA EPHA4 RNF126 TRAFD1 TICAM1 RNF169 C12orf5 NMI STAT1 PHIP PPP1R15B PSMB9 CHAD RELA PPM1B PSMD1 RRM2B PSME1 UBE2J1 HGS RBX1 CR1 MAP2K5 HMGXB4 EIF2AK2 PSMC4 SLC9A3R1 ERLEC1 PSMA4 MNT HELB PIM3 CD3E EZH2 BAX CSNK1A1 IFI16 USP47 NFKBIL1 PSMC3 FOXO1 TXNDC12 RNF213 FEM1A TARBP2 ATP2B4 ZNF451 PPP2CA NT5E UBAC2 BANK1 SMPD1 TNFAIP8L1 DNAJC3 NCK1 HYOU1 TRIM38 CRY2 PSMB10 AES HLA-A SCAI PIH1D1 BAG5 ZC3H12A NFKBIA PSMA6 INPP5K MDM2 PSMB2 ZGPAT IL18BP NR1H2 DUSP22 ADAR PSMD6 APC RNF34 PSMD3 CHD8 SOCS1 MBIP PSME3 CDK6 TRADD NLRC5 G3BP1 THOC1 PTEN ITGB1BP1 PSMB8 FXN PIK3AP1 PRKCD PSMD12 ASXL1 CLOCK MUL1 HTRA2 PSMD8 PSMA3 HSPH1 LGALS9 PSMD4 PSMC1 LEMD3 PARK7 FAF1 GSTO1 SNX6 INPP5F TMBIM6 STUB1 KLHL12 STRAP PLEK RASA3 ZNF675 NFKBID BRAP PSMA7 STAP1 CHST11 UBR2 PSMD10
GO_MEIOTIC_CELL_CYCLE_PROCESS	0.33085225158169	0.709968292599103	0.27323020588143	1.07038283256739	13334	45	CKS2 STAG3 BCL2L11 RAD1
GO_NEGATIVE_REGULATION_OF_ACTIN_FILAMENT_POLYMERIZATION	0.61043717097734	0.870290523932594	0.296282878670749	0.888661184406034	26669	16	MYADM CAPZB MKKS
GO_DEVELOPMENTAL_CELL_GROWTH	0.126336898395722	0.453286616660087	0.421055229591339	1.32724506069061	5480	19	CPNE1 APP SEMA7A ARIH2 SPG11 EIF2AK4
GO_SPINDLE_ASSEMBLY	0.751592033060091	0.924713558708606	-0.230312219258104	-0.825460900271978	44376	39	TUBB OFD1 ZNF207 XIAP RCC1 MLH1 MAP9 TUBGCP5 TUBGCP2 NEK7 GOLGA2 HAUS6 NEK6
GO_SPHINGOLIPID_BIOSYNTHETIC_PROCESS	0.71212226709372	0.912219675625215	-0.258396639429217	-0.833992204165712	40909	25	ACER3 GBA DEGS1 SMPD1 VAPA
GO_REGULATION_OF_PHOSPHOPROTEIN_PHOSPHATASE_ACTIVITY	0.505653867176824	0.825160431601741	-0.276928133655199	-0.968107746029947	29602	35	PPP1R12A PPP1R11 EIF2AK2 PPP2R2A PPP1R2 CRY2 JAK2
GO_REGULATION_OF_MULTI_ORGANISM_PROCESS	0.119000878992089	0.435738834994321	-0.246792740772333	-1.1848110795527	8122	218	YIPF1 MX1 BST2 HERC5 ANXA5 LTA CREB3 MB21D1 IFITM1 TMEM39B TRIM8 C19orf66 STAT1 PPM1B IFITM3 TRIM21 PPP2R3C EIF2AK2 PML ZNF639 APOBEC3G B2M CHMP3 ISG15 SUPT5H IFI16 SMARCB1 NFKBIL1 PAK2 SNRPD1 POLR2B TARBP2 JUN TRAF6 PLSCR1 LCK TRIM38 TRAF3 HLA-A LGALS1 ZC3H12A VAPA SUPT4H1 INPP5K PPIB PPID TRIM13 MRPS10 PKN2 ADAR STAT2 PUM2
GO_POSITIVE_REGULATION_OF_CELL_CYCLE_ARREST	0.764779534518315	0.928363167923458	0.215358501958381	0.83095265052068	31150	42	UBA52 CDKN1A TGFB1 ARID3A BTG2 RPS27A CRLF3 UBC UHRF2 EP300 E2F4 CNOT2
GO_CONNECTIVE_TISSUE_DEVELOPMENT	0.0747170170265386	0.346733657138781	0.397667234270563	1.39083422859265	3141	28	CSGALNACT1 CRIP1 EGR1 ZEB1 OXCT1 SLC25A25 TGFB1 MKKS GNAS
GO_CYTOPLASMIC_PATTERN_RECOGNITION_RECEPTOR_SIGNALING_PATHWAY	0.55297995826831	0.845273448927713	-0.298557619611377	-0.933101231051015	31536	22	IRF7 RELA IFIH1 TRAF6 NFKBIA
GO_NUCLEAR_ENVELOPE_ORGANIZATION	0.269451145958987	0.653577961114675	0.27286340727746	1.10961473884472	10721	53	NUP210 LMNA LPIN1 RANBP2 TOR1AIP1 CTDNEP1 EMD RAE1 NUP205 NEK9
GO_REGULATION_OF_GLIAL_CELL_DIFFERENTIATION	0.442808763563481	0.784294998062946	0.32309817941039	1.00292586266795	19220	18	HES1 MTOR DUSP10 SIRT2 CXCR4 BIN1 RHEB
GO_CELLULAR_RESPONSE_TO_ENDOGENOUS_STIMULUS	0.000357704964944913	0.0106213755003133	0.271503339330209	1.47506538299241	9	336	LPIN1 PTPN1 SERPINB9 KLF3 ATP6V1A DNM2 KLF6 EGR1 JUND CBL UCP2 ATP6V1D YWHAH APEX1 CTSB PPP1R9B MED13 ZEB1 APP POLR2I ACSL1 UBA52 PAWR EIF4EBP1 FBXO32 ADIPOR1 CALCOCO1 NR4A1 IPO5 ARID1A NFKB1 NR1D2 ITPR2 POLR2L TGFB1 KLF2 EZR PTBP1 GNB1 PTPN22 CTSH HNRNPH1 PIAS2 RHOA ATP6V1B2 FOS MKKS SIRT2 POLR2H ATP6V1F PRKCE NR3C1 NCOA3 SIK1 POLR2C ICAM1 CYBA PRKDC GNAS EIF4A3 RPS27A EEF2 GRB2 PIK3CG C10orf54 CASP4 STAT3 ZYX ATP6V1H PDE4B SMYD3 REST LAMTOR2 ATP6V0A2 NR4A2 PDPK1 POLR2K MYO5A FOSB GNB2 NR2C1 HNRNPM UBR1 UROS CTNNA1 RIPK2 SHC1 SMAD2 AKR1B1 NCOA2 CIB1 SOD1 PIK3CA KDM5B ITGB2 MAPK1 PHB UBC JUNB RRAGC H2AFZ MED17 WBP2 BPTF TAF7 NCOA4 RAB8A HMGCS1 LYN CBX3 ATP6V1E1 EP300 DIAPH1 EHD1 EEF1A1 MED4
GO_POSITIVE_REGULATION_OF_HISTONE_METHYLATION	0.670888333927934	0.895202019643959	-0.300028090628753	-0.846926889114129	37609	15	EED PHF1 JARID2 MTF2 CHTOP CTNNB1 DNMT1 WDR61 RTF1
GO_RNA_POLYADENYLATION	0.463294777589764	0.795104608854243	0.30955596207981	0.989086134583554	19986	20	NUDT21 PAPD4 CPSF1 PCF11 CPSF3 PAPOLG SYMPK PAF1
GO_ASPARTATE_FAMILY_AMINO_ACID_METABOLIC_PROCESS	0.0255030743432085	0.188314137346399	-0.498330197833072	-1.57443150537743	1459	23	MRI1 EIF2B2 ASNSD1 MTHFD1 OGDH MTRR GOT2 AASDHPPT EIF2B1 ADSS
GO_MRNA_METABOLIC_PROCESS	0.000161056530842326	0.00568367872011976	0.266858445434474	1.49667233745536	3	462	RPS26 RPS2 LSM4 NUDT21 RPL3 LSM5 LSM7 SLBP RPL7 RPL21 EIF4A1 RPL10A RPS6 PRPF4 RPL6 RPL27A RPL4 DIS3L APP RPS20 RPS3 TFIP11 GTF2H1 RPL11 POLR2I RPS8 ZCCHC11 RPS29 RPS18 SFPQ RPL23 PHRF1 UBA52 RPL12 RPL38 RPS10 EIF4E RPS16 PAPD4 HNRNPL RPL27 SRSF4 RPS4Y1 SF3B1 RPS28 RPL29 POLR2L RPL15 RPL23A CASC3 PTBP1 SMG5 RNPS1 HNRNPH1 RPL8 ACIN1 HNRNPUL1 RPL36A RPS19 KHDRBS1 RPL9 RPS14 TXNL4A RPS11 POLR2H SNW1 CELF1 RPL26 RPL22 RPL24 RPS27 RPLP2 RPL5 POLR2C RPL13 RPL34 DDX20 RPL7A KHSRP RPL37 METTL3 RALY RPS4X RPL31 RPL39 RPS3A NAA38 SRPK2 CCNH RPS7 AKAP17A EIF4A3 RPS27A CPSF1 PCF11 SF3B2 RPS23 RPS25 YBX1 RPS13 RPL19 SART3 RPLP1 RPS21 HSPA8 CPSF7 RNGTT RPLP0 ERCC3 XRN2 RPL37A DDX6 POLR2K RPL10 CPSF3 ZFP36L2 ETF1 RBM8A HNRNPM RPL13A RBM17 RPS12 RPL35 RPL32
GO_PROTEIN_TRANSMEMBRANE_TRANSPORT	0.326833930704898	0.707253940138221	0.304869422798502	1.0841930933461	13677	30	TIMM10 MCL1 HSPA4 HSPA8 SAMM50 LONP2 SEC61G SRP54 TOMM7 PEX2 TOMM22 NDUFA13 RAB8B
GO_INTRINSIC_APOPTOTIC_SIGNALING_PATHWAY_BY_P53_CLASS_MEDIATOR	0.666722368106947	0.892567803130381	0.247317314071477	0.871818751484366	27928	29	DDIT4 PMAIP1 AEN CDKN1A SNW1 ZMAT3 FHIT HINT1 EP300
GO_RESPONSE_TO_RETINOIC_ACID	0.518336647358866	0.834144406014599	-0.291674847176478	-0.958677572609824	29977	27	TESC SETX RARA SCAMP3 ADNP2 RNF2 ASXL1 HTRA2
GO_REGULATION_OF_TRANSLATIONAL_INITIATION	0.322884092889732	0.703971598934954	0.252828100287731	1.06961360549127	12596	64	EIF3M EIF3L EIF2B5 EIF4A1 EIF3K EIF4EBP1 EIF3F KHDRBS1 EIF4G3 METTL3 EIF1 EIF3I EIF3J EIF2AK4 EIF5B HSPB1 PPP1CA RPL13A
GO_MYELOID_CELL_ACTIVATION_INVOLVED_IN_IMMUNE_RESPONSE	0.73605214238175	0.919710772614878	0.264965834578293	0.809134419529603	32071	17	VAMP7 PRKCE PIK3CG DOCK2 HMGB1 PIK3CD LYN SYK
GO_POSITIVE_REGULATION_OF_SYNAPTIC_TRANSMISSION	0.526713541757991	0.835415116957843	-0.303943029114719	-0.949932595944075	30038	22	DTNBP1 BRAF SNAP47 VAMP2 MECP2
GO_CELL_RECOGNITION	0.912369309197328	0.977852110458885	0.201216465223441	0.690066178048832	38657	26	CSGALNACT1 APP CXCR4 RTN4 DOCK2 CCT2
GO_PROTEIN_K63_LINKED_UBIQUITINATION	0.421542669776087	0.771205568412516	-0.328113915882286	-1.02547541487386	24040	22	RNF126 UBE2V2 RNF168 TRAF6 UBE2E2 RNF4 WWP2 STUB1 UBE2V1 PRPF19
GO_NEGATIVE_REGULATION_OF_PHOSPHORYLATION	0.136231710601119	0.466257826423548	0.231666476307422	1.15677395466443	4552	170	DDIT4 PTPN1 MYC MYADM DUSP2 RANBP2 ILK MTOR DUSP10 CORO1C PRDX3 PIK3IP1 WNK1 CDKN1A GNB2L1 PRNP DUSP5 TGFB1 EZR PTPN22 SOCS4 SIRT2 PRKDC TBC1D10C PRKAG2 STAT3 SMYD3 RNF149 PIBF1 RGS14 DNAJC15 PDPK1 HSPB1 CTDSP1 GADD45B RHOH RGS2 CIB1 HDAC3 BAK1 PHB FBXO7 GMFB MIDN TAF7 CALM1 DYNLL1 RASSF2 UBE2B LYN ANKLE2 CUL3
GO_NEGATIVE_REGULATION_OF_NUCLEAR_DIVISION	0.934774115641426	0.983681136598963	-0.21672429260566	-0.622585226950678	52638	16	MAD2L1 ZNF207
GO_REGULATION_OF_GENERATION_OF_PRECURSOR_METABOLITES_AND_ENERGY	0.674677965276256	0.895764146770013	0.232509890366292	0.877300765614783	27706	38	DDIT4 MTOR VCP PRKAG2 STAT3 PPP1R3E DNAJC15 PPP1CA PIK3CA HMGB1
GO_LIPID_CATABOLIC_PROCESS	0.0751833895981928	0.347199726407557	0.315827570014058	1.31398035558684	2961	59	HADHA LPIN1 PRDX6 FABP5 PAFAH1B2 YWHAH LIPA PLD4 NEU1 GPCPD1 SIRT2 HADHB PLD3 DDHD1 CPT1A SMPD4 DECR1 TBL1XR1 PEX2 PPT1 ECI1 ETFB
GO_POSITIVE_REGULATION_OF_LIPID_METABOLIC_PROCESS	0.418054913786814	0.766434008609159	0.271571799715872	1.01761231834403	17189	37	SPTLC1 MTOR GNB2L1 CTDNEP1 TGFB1 PRKCE LDLRAP1
GO_RESPIRATORY_SYSTEM_DEVELOPMENT	0.0447007220127646	0.266113652427884	0.367935225270235	1.42699668189221	1813	43	HES1 SAV1 LIPA SEC24B EIF4EBP1 EIF4E RBPJ KLF2 CTSH CTSZ NUMA1 KRAS MAP2K1 MAPK8IP3 PPP1CA SMAD2 HMGB1 MAPK1 RC3H2 EP300 PHF14
GO_ION_HOMEOSTASIS	0.271894927748201	0.655342778963879	0.219492932876328	1.07665258158	9294	150	SLC25A37 MYC ATP6V1A ATP6V1D SLC39A6 RIC3 APP TPT1 SRI PRNP ITPR2 TGFB1 GNB1 ATP6V1B2 GPCPD1 ATP6V1F SPPL3 PRKCE CXCR4 IMMT CCDC47 FTH1 PIK3CG CD52 ATP6V1H ATP6V0A2 HMOX1 SLC39A10 SOD1 MICU1 BAK1 HMGB1
GO_NUCLEOSIDE_MONOPHOSPHATE_METABOLIC_PROCESS	0.0758382501079292	0.347916005965059	0.25520769351008	1.23639275329408	2634	138	ATP6V1A NDUFS5 COX8A ATP5E NDUFA1 PFKL PMPCB SLC25A25 GAPDH COX6A1 ATP5J TGFB1 PGK1 ATP5O ATP6V1B2 NDUFA3 CHCHD10 VCP ATP5I UQCRC1 PRKAG2 NDUFB6 UCKL1 OLA1 UQCRB ATP5G3 ADPGK HSPA8 SDHAF2 ATP6V0A2 ATP5A1 NDUFV2 NDUFA10 ATP5J2 ADSL CMPK1 GART
GO_REGULATION_OF_GLUCOSE_TRANSPORT	0.384021833519415	0.747818274594293	0.26481340816196	1.03740991965299	15477	45	NUP210 REPIN1 RANBP2 NFE2L2 RAE1 PRKAG2 NUP205
GO_NEGATIVE_REGULATION_OF_TRANSFORMING_GROWTH_FACTOR_BETA_RECEPTOR_SIGNALING_PATHWAY	0.132502222014314	0.458780361974433	0.392861315242934	1.3039500550055	5664	23	DNM2 ADAM17 UBA52 TGFB1 RPS27A PDPK1 SMAD2 UBC GLG1 PIN1 BCL9L TGFBR2 SKI
GO_ADHERENS_JUNCTION_ORGANIZATION	0.11730288976097	0.433080972832975	-0.480862745017935	-1.35739152915801	6575	15	RCC2 JUP PIP5K1A
GO_MYD88_INDEPENDENT_TOLL_LIKE_RECEPTOR_SIGNALING_PATHWAY	0.115873350182533	0.430179812552654	-0.434013356243675	-1.33993099136539	6601	21	IRF7 TICAM1 IKBKE TRAF6 UBE2D1 UBE2D3 TRAF3
GO_POSITIVE_REGULATION_OF_LIPASE_ACTIVITY	0.82991215693414	0.955777950169501	0.249348315237823	0.733770802515039	36467	15	RHOA PRKCE PDPK1 ARF4
GO_POSITIVE_REGULATION_OF_ERK1_AND_ERK2_CASCADE	0.170761670761671	0.521842506270221	0.335825299171146	1.22301743237035	7088	33	SEMA7A FBXW7 PTPN22 GPR183 ICAM1 MIF RIPK2 CIB1 PHB2 HMGB1 PHB CD74 PRKD2
GO_MEMBRANE_ORGANIZATION	4.01945415812533e-05	0.00166290289468282	0.347566439215431	1.94559968735642	0	455	NUP210 RPS26 LMNA TSPAN14 LPIN1 MTCH1 SNX9 RPS2 ALKBH7 TIMM10 BCL2L11 MYADM SNX3 FLOT1 MTSS1 BBIP1 RPL3 SYS1 YWHAH RPL7 RPL21 RANBP2 TSPAN33 RPL10A RPS6 RPL6 RPL27A RPL4 PACS1 PMAIP1 RPS20 RPS3 TRAPPC3 RPS9 SEC24B RPL11 TOR1AIP1 RPS8 RPS29 RPS18 RPL23 SEC61A1 UBA52 SLC25A5 RPL12 RPL38 RPS10 VAMP7 RPS16 RPL27 RPS4Y1 RPS28 RPL29 LRMP TBC1D1 CTDNEP1 RPL15 RPL23A EZR TMED10 BNIP3L RPL8 CTSZ AREG RPL36A RPS19 YWHAZ RILPL2 SSR1 VCPIP1 RAB1A RPL9 SIVA1 RPS14 RPS11 WASL MAPK8 RPL26 SSNA1 RPL22 CHMP1B RPL24 RPS27 RPLP2 CXCR4 IMMT RPL5 GNPAT SH3GLB1 YWHAB MYH9 RPL13 ANKFY1 RPL34 RPL7A RPL37 EMD RPS4X RPL31 RPL39 DNM1L RPS3A RAE1 HSPA4 SEC23A ITGB7 TSG101 RPS7 RPS27A OPTN PPP6R3 AP3D1 NUP205 RPS23 NEK9 RPS25 BCL2A1 STAT3 RPS13 RPL19 RPLP1 RPS21 STX7 TMED9 MBP RPLP0 ATG9A VAMP5 STX10 RPL37A ELMO1 SAMM50 MYO5A VTI1B RPL10 ATG7 DOCK2
GO_MITOCHONDRIAL_ATP_SYNTHESIS_COUPLED_PROTON_TRANSPORT	0.0380178530556191	0.241291179819049	0.518315642789231	1.55461900155599	1660	16	ATP5E ATP5J ATP5O ATP5I ATP5G3 ATP5A1 ATP5J2
GO_PURINE_NUCLEOSIDE_MONOPHOSPHATE_BIOSYNTHETIC_PROCESS	0.216709221251105	0.589281534490542	0.301635998351712	1.16385111357826	8826	42	ATP5E ATP5J TGFB1 ATP5O CHCHD10 ATP5I PRKAG2 ATP5G3 ATP6V0A2 ATP5A1 ADSL GART ATP5D
GO_POSITIVE_REGULATION_OF_PEPTIDE_SECRETION	0.0345581904074841	0.228625403414287	0.470925464555164	1.54482188791638	1484	22	HLA-DRB5 GLUD1 OXCT1 SRI ARHGEF7 PRKCE
GO_REGULATION_OF_CHROMOSOME_ORGANIZATION	0.587593232672367	0.860242801934961	-0.205457562236465	-0.944436608799606	38759	156	ANAPC4 WAPAL LCMT1 MAD2L1 EED NBN TEN1 KAT2A ZNF207 PML AKAP8L MAP1S SMARCB1 TCP1 TINF2 ZNF451 MECP2 GNL3 PHF1 XRCC5 TNKS2 PIH1D1 ASF1A MCRS1 RUVBL2 JARID2 CCT5 APC NEK7 PTEN RNF4 HDAC8 BECN1 PCID2 GOLGA2 MIER1 DYNC1LI1 SUPT6H HDAC5 MTF2 NEK6 TADA3 CCT8 SIN3A CHTOP BRD7 SENP6 BUB3 CAMK2D CCT7 OTUB1 PSMG2 HNRNPC ZNHIT1 TNKS PARP10 RAD50 UBR5 ANAPC10 CTNNB1 CTC1 DNMT1 HNRNPU SMG6 TLK1 CTBP1 TPR
GO_REGULATION_OF_CELL_MATRIX_ADHESION	0.170848102360163	0.521842506270221	-0.379084317761392	-1.24597522578303	9880	27	NINJ1 RCC2 PLEKHA2 MINK1 CDK6 PTEN ITGB1BP1 UTRN LIMS1 PIK3R1 PTK2 CCL28
GO_LIPOSACCHARIDE_METABOLIC_PROCESS	0.113197845249755	0.424968876899713	0.33436040991324	1.28411546704354	4622	41	GLTP PIGT HEXA NEU1 NANS UGCG ASAH1 ST6GALNAC4 PSAP GPAA1 CREM ARSA SMPD4
GO_REGULATION_OF_CELL_ADHESION	0.861861767389184	0.967205245150664	0.167867309794223	0.866870595500344	27395	217	ICOSLG HES1 MYADM DNM2 ARHGDIA MAP3K8 HLA-DRB5 FLOT1 PREX1 PELI1 CCDC88B ILK MTOR ZEB1 CORO1C CYTIP PAWR MAD1L1 PRNP TGFB1 PTPN22 CYTH1 ARHGEF7 PRKCE ICAM1 PNP AP3D1 GRB2 PIK3CG C10orf54 CLPTM1 PRKX RSU1 PDPK1 VAV1 RIPK2 GTPBP4 CIB1 SOD1 PIK3CA HMGB1 EBI3 ZC3H8 CITED2 CLASP1 IL12RB1 CD74 TNFRSF14 ARPC2 ACP5 PRKD2 LYN
GO_NEGATIVE_REGULATION_OF_TELOMERE_MAINTENANCE	0.181532374863118	0.542163170959904	-0.41626019710433	-1.25194261969409	10277	19	NBN PML TINF2 XRCC5 TNKS2 MCRS1
GO_POSITIVE_REGULATION_OF_TRANSCRIPTION_FROM_RNA_POLYMERASE_II_PROMOTER	0.822504922005149	0.954234225920036	0.165172489936636	0.909844385110183	21723	388	LMNA LPIN1 IRF8 NFATC2 MYC INSIG1 HES1 KLF6 EGR1 JUND ARMCX3 MED13 ZEB1 SERTAD1 APP NFE2L2 GTF2H1 NCOA7 RERE UBA52 FOXO3 CALCOCO1 NR4A1 RBPJ NFKB1 TFEB KLF13 KDM6B TGFB1 KLF2 KPNA6 GMEB1 PIAS2 STAT6 FOS SIRT2 MED21 SNW1 ETV6 NFE2L1 TBK1 NR3C1 NCOA3 NUCKS1 ARID3A PRKDC NCL CCNH ABHD14B RPS27A MTF1 YBX1 STAT3 RAF1 SMYD3 ATRX REST NR4A2 CRLF3 TRIM28 ERCC3 ATAD2 C14orf166 ELF1 ARF4 ZNF384 FOSB AHI1 SS18 CREM
GO_REGULATION_OF_ACTIN_FILAMENT_DEPOLYMERIZATION	0.93508260447036	0.983681136598963	-0.211506859155847	-0.627250065779722	52920	18	SPTAN1 CFL2 SPTBN1 PLEK FAM21C GSN TWF1 TMOD3
GO_ENDOCRINE_SYSTEM_DEVELOPMENT	0.181029066114356	0.541870877630094	0.377298196336749	1.23768739607859	7778	22	HES1 TSPO RBPJ RAF1 MAP2K1 PDPK1 SIDT2 BAK1 MAPK1 CITED2
GO_REGULATION_OF_MYELOID_LEUKOCYTE_DIFFERENTIATION	0.692204255319149	0.904686477766272	-0.243816020627381	-0.858337567848772	40666	36	IRF7 TESC CEBPB RARA JUN TRAF6 CREB1 HCLS1 ID2
GO_RESPONSE_TO_DSRNA	0.769714422846172	0.931908361432722	0.22726526151052	0.814721274973323	32073	31	FLOT1 PELI1 PMAIP1 ZCCHC11 NFKB1 METTL3 RIPK2 SMAD2 MAPK1
GO_POSITIVE_REGULATION_OF_ACTIN_FILAMENT_POLYMERIZATION	0.723356555697515	0.919071367902955	0.230004283291462	0.844818733402771	30006	34	ARPC5L MTOR ARPC3 PRKCE ICAM1 GRB2 ACTR3
GO_REGULATION_OF_STEROID_METABOLIC_PROCESS	0.13216854139775	0.458780361974433	0.41802363709797	1.31768891251794	5733	19	INSIG1 TSPO NFKB1 LDLRAP1 DDX20 REST SOD1
GO_STEROL_BIOSYNTHETIC_PROCESS	0.0240053447600617	0.181260696450975	0.520821171067429	1.6166758452237	1041	18	INSIG1 MVD CYB5R3 PRKAG2 IDI1 FDPS CYP51A1 FDFT1 ACAA2 HMGCS1 MSMO1
GO_REGULATION_OF_PHAGOCYTOSIS	0.0308275249099499	0.215148757400251	0.468117779062449	1.55373456248824	1317	23	DNM2 SNX3 GNB2L1 TGFB1 CYBA CAMK1D DOCK2 HMGB1 FGR SYK
GO_DNA_INTEGRITY_CHECKPOINT	0.633908232997071	0.876130665357379	-0.224303166687266	-0.908341907290171	38959	71	RBBP8 CEP63 NBN CNOT4 PML ATF2 FBXO31 BAX CNOT7 RPS27L TOP2B MDM2 CNOT8
GO_MEMBRANE_PROTEIN_PROTEOLYSIS	0.727604285388648	0.919071367902955	-0.262359999699969	-0.819970493525652	41495	22	RELA PSENEN RBMX TRAF6 APH1A NCSTN MBTPS1 APH1B
GO_TUBE_MORPHOGENESIS	0.0113289071556539	0.11299316726516	0.341211079842718	1.50749154768612	429	80	MYC BCL2L11 HES1 MTSS1 RHOB IFT57 ILK ZEB1 SEC24B RBPJ ARID1A TGFB1 CTSH CTSZ RHOA AREG MKKS RPS7 KRAS PRKX AHI1 IPMK PPP1CA SMAD2 KDM5B PHB2 BAK1
GO_REGULATION_OF_EMBRYONIC_DEVELOPMENT	0.0132767840678591	0.12584696387726	0.533853764514796	1.6828072003073	575	19	HES1 MYADM NFE2L2 SEC24B RBM19 GNB2L1
GO_SENSORY_ORGAN_DEVELOPMENT	0.201757422447078	0.568261194139625	0.254216431383127	1.1408051180671	7576	87	BCL2L11 INSIG1 HES1 ZEB1 SEC24B FKBP8 RPL38 SLC25A25 RBPJ ARID1A TGFB1 GNB1 RING1 MPV17 LRP10 STAT3 AHI1 SOD1 PRDM1 KDM5B BAK1 HMGB1 MAPK1 VIM TBC1D20
GO_POSITIVE_REGULATION_OF_MAP_KINASE_ACTIVITY	0.0727042464655863	0.342145159863578	0.305155593323876	1.30603772426601	2812	68	PTPN1 ILK MAP4K2 RPS3 UBA52 DUSP5 TGFB1 PTPLAD1 CXCR4 MIF RPS27A PIK3CG KRAS MAP2K1 MAPK8IP3 MAPKAPK5 RIPK2 SHC1 SOD1 SPAG9 MAPK1 UBC
GO_CELL_PROJECTION_ORGANIZATION	0.658553837250426	0.887702676233177	0.180154474072973	0.938847443914082	20482	234	HES1 DNM2 FLOT1 MTSS1 BBIP1 ATP6V1D WASF2 IFT57 CPNE1 PPP1R9B ILK MTOR APP TSPO IFT27 SEC24B RERE TCHP NRAS DYNLT1 SEMA7A EZR AREG RAB1A MKKS ZNF335 ARHGEF7 SSNA1 MYH9 BTG2 SPG11 GRB2 RTN4 KRAS EIF2AK4 PIBF1 NR4A2 ARF4 SEPT7 AHI1 SDCBP MAPK8IP3 ACTR3 IQCB1 CTNNA1 SHC1 SOD1 MAP4 MTMR2 HMGB1 RAP2B MAPK1 USP33 CALU RAB8A BLOC1S2 MST4 DYNLL1 UBE2B LYN CDK16 ACSL4 CUL3 EHD1 SIAH2 E2F4 SNX10
GO_NEGATIVE_REGULATION_OF_PROTEIN_METABOLIC_PROCESS	0.672824862500828	0.895202019643959	-0.180377484434559	-0.936944191419099	50767	472	IFI6 BST2 ANAPC4 NUP62 PSME2 GBA MAD2L1 PDE4D NMI EIF2AK1 PPP1R15B PSMB9 CHAD RELA PSMD1 TRIM21 PPP1R11 PSME1 UBE2J1 CR1 MAP2K5 EIF2AK2 ZNF207 PSMC4 TESC XIAP SLC9A3R1 ERLEC1 PML PSMA4 SF3B3 FBXO31 ISG15 CARD16 BAX IFI16 USP47 SMARCB1 PSMC3 FOXO1 PAK2 UBE2E1 RARA CHORDC1 TARBP2 TINF2 JUN ATP2B4 PICALM ZNF451 PPP2CA UBAC2 CNOT7 BANK1 UBE2D1 SMPD1 PDCD5 MECP2 DNAJC3 SNIP1 NCK1 PHF1 EIF2AK3 PIAS3 DNAJB6 CRY2 PSMB10 PPP5C PIH1D1 BAG5 TRIB3 ZC3H12A PSMA6 FAM129A INPP5K EIF2S1 MDM2 PSMB2 TRIB2 CNOT8 JARID2 ZGPAT NR1H2 DUSP22 ADAR PSMD6 APC ATG14 LIMK1 RNF139 RNF34 PSMD3 SOCS1 MBIP SENP1 PSME3 HNRNPR PTEN ITGB1BP1 CPEB4 PKN1 RNF4 HDAC8 PSMB8
GO_RETROGRADE_TRANSPORT_ENDOSOME_TO_GOLGI	0.866343922341726	0.96852250289395	0.19499122064489	0.775086048313373	34716	48	ERC1 SNX5 KIAA1432 ANKFY1 TBC1D10C EVI5 AP1S1 TMED9 STX10 VTI1B SPAG9 YKT6
GO_MRNA_CIS_SPLICING_VIA_SPLICEOSOME	0.266553692472351	0.649496827692429	-0.412925722156674	-1.16561718127283	14942	15	DCPS PRPF39 PSIP1 DDX23 SFSWAP NCBP2 SNRPC SART1
GO_CYTOPLASMIC_SEQUESTERING_OF_PROTEIN	0.647978070380957	0.882708729495903	0.260828774196135	0.875189302977754	27656	24	TSPO SRI YWHAB NFKBIE GPAA1 OS9 KDELR2 G3BP2 GET4 FLNA
GO_REGULATION_OF_INFLAMMATORY_RESPONSE	0.437700504586416	0.783523164428501	-0.244353991760131	-1.00853568993929	27150	79	LTA TLR10 GBA RELA CR1 XIAP RICTOR SNX4 MYD88 FEM1A NT5E VAMP2 JAK2 ZC3H12A PSMA6 VAMP3
GO_RESPONSE_TO_INTERFERON_GAMMA	0.000599990000166664	0.0163650333718928	-0.48500629060753	-1.8331198272289	35	50	IRF7 BST2 MT2A IFITM1 TRIM8 C19orf66 STAT1 IFITM3 TRIM21 IRF9 IRF1 PML B2M NUB1 JAK1 TRIM38 TRIM22 JAK2
GO_PROTEIN_LOCALIZATION_TO_MITOCHONDRION	0.336635639957078	0.715528758417982	0.268269725406729	1.06636658132569	13489	48	TIMM10 BCL2L11 SLC25A6 PMAIP1 TSPO DNM1L HSPA4 SAMM50 PMPCA IMMP2L TOMM5 FBXO7 TOMM7 BID TRNT1 TOMM22 NDUFA13
GO_MICROTUBULE_BASED_MOVEMENT	0.546785585399804	0.843248238795958	0.223822719005454	0.955337283275161	21211	67	KIF3B IFT57 AP2A1 HTT APP IFT27 DYNC1LI2 VAMP7 RAB1A SSNA1 SPG11 AP3D1 DYNLRB1 ACTR3 SOD1 MAP4 UXT KIF9 BLOC1S2 DYNLL1
GO_SENSORY_ORGAN_MORPHOGENESIS	0.132374933667808	0.458780361974433	0.342432418579126	1.26688806776706	5487	35	INSIG1 ZEB1 SEC24B RPL38 ARID1A RING1 STAT3 AHI1 SOD1 PRDM1 BAK1 MAPK1 TBC1D20
GO_PROTEIN_DNA_COMPLEX_SUBUNIT_ORGANIZATION	0.736069665237914	0.919710772614878	0.19260741340822	0.882598320346747	27132	98	HIST1H2BK H3F3A DDB1 GTF2H1 HIST1H4C UBA52 ARID1A CUL4A STRA13 CCNH RPS27A SART3 SMYD3 CABIN1 ATRX ERCC3 SET TSPYL1 ARID2 HP1BP3 UBC PSME4 NASP TAF7 TSPYL4
GO_CHROMATIN_SILENCING	0.79767906401598	0.941383012046199	0.225829872023195	0.78983604577001	33543	28	H3F3A HIST1H4C ARID1A MBD2 SIRT2
GO_LOCOMOTORY_BEHAVIOR	0.727640197725668	0.919071367902955	0.224787419206705	0.848162521860634	29881	38	PUM1 OXR1 APP PRKCE NR4A2 MYO5A MTA1 NCOA2 SOD1 GMFB
GO_REGULATION_OF_PROTEIN_LOCALIZATION_TO_NUCLEUS	0.906009409751925	0.977337562862936	0.174372552524405	0.785619718598515	33891	89	LMNA PRDX1 KPNA1 MTOR SRI IPO5 CDKN1A TGFB1 CD27 RHOA SPPL3 EMD TBC1D10C NFKBIE TRIM28 HNRNPM HDAC3 NUTF2 CCT2 LITAF G3BP2
GO_NUCLEUS_ORGANIZATION	0.328866554997208	0.70777802053747	0.236688891680738	1.06004572689775	12368	86	NUP210 LMNA LPIN1 RANBP2 TOR1AIP1 CTDNEP1 RPS19 NUMA1 CHMP1B EMD RAE1 SRPK2 NUP205 RTN4 NEK9 BIN1 RRN3 TBPL1
GO_REGULATION_OF_SEQUENCE_SPECIFIC_DNA_BINDING_TRANSCRIPTION_FACTOR_ACTIVITY	0.298828479748138	0.686227256328843	-0.233390705165805	-1.07504565174549	19742	158	ANXA4 TICAM1 TAF3 TRIM8 TRAF1 TRAPPC9 RELA JUP TRIM21 CD40 RBCK1 MAP2K5 PEX14 EIF2AK2 SUMO1 ATF2 EZH2 SMARCB1 NFKBIL1 TRIM37 BTK JUN TRAF6 PRMT2 RWDD3 TRIM38 TRAF3 TRIM22 JAK2 BUD31 ZC3H12A NFKBIA PSMA6 TRIM13 DDRGK1 ID2 TRADD COMMD1 NLRC5 PTEN RNF2 CLOCK WWP2 NFKB2 HDAC5 LGALS9 TAB2 PARK7 TAX1BP1 ZNF675 NFKBID PSMD10 IKBKB GTF2A2 ZNF431 UBE2V1 BCL10
GO_STEM_CELL_DIFFERENTIATION	0.207787154356867	0.57436924880652	0.314255004710289	1.1775514402785	8543	37	HES1 PUM1 CORO1C SEMA7A RBPJ TGFB1 HNRNPAB RTN4 C10orf54 REST TRIM28
GO_ENDOPLASMIC_RETICULUM_ORGANIZATION	0.505396184375435	0.825160431601741	-0.299206318439993	-0.965708136016347	29033	25	TOR1AIP2 JAGN1 SEC16A EIF2AK3 VAPA TMEM170A
GO_PROTEIN_COMPLEX_LOCALIZATION	0.0514936382076342	0.289939414674751	0.47417390503981	1.49468508913495	2233	19	MZT1 IFT57 IFT27 EXOC8 EXOC3 EZR WASL SSNA1
GO_NEGATIVE_REGULATION_OF_GTPASE_ACTIVITY	0.470787753942321	0.8028166888057	-0.344108940997438	-0.988523900809135	26510	16	RCC2 PDE6D IQGAP2 CDC42SE1 ARFGEF1
GO_POSITIVE_REGULATION_OF_INTRINSIC_APOPTOTIC_SIGNALING_PATHWAY	0.0162706983441325	0.141602722359378	0.449019097161932	1.60968468694106	677	31	BCL2L11 MCL1 PMAIP1 RPS3 SFPQ FBXW7 GNB2L1 BCLAF1 SERINC3 DNM1L
GO_NEGATIVE_REGULATION_OF_MULTI_ORGANISM_PROCESS	0.000586864026865331	0.0161720365341343	-0.446930409985049	-1.79988665319283	35	69	MX1 BST2 LTA IFITM1 TRIM8 C19orf66 STAT1 PPM1B IFITM3 TRIM21 EIF2AK2 PML ZNF639 APOBEC3G CHMP3 ISG15 IFI16 NFKBIL1 TARBP2 JUN PLSCR1 TRIM38 ZC3H12A VAPA INPP5K TRIM13 ADAR
GO_NEURON_DIFFERENTIATION	0.533893350564633	0.838524369894715	0.191206936828027	0.973112071862243	17350	195	MTCH1 DDIT4 HES1 DNM2 FLOT1 CPNE1 PPP1R9B ILK WNK1 APP TSPO SEC24B RERE PIGT NRAS DYNLT1 SEMA7A RBPJ EZR AREG ZNF335 CXCR4 NGRN ITM2C BTG2 SPG11 GRB2 RTN4 STAT3 KRAS EIF2AK4 MAP2K1 NR4A2 ERCC3 ARF4 AHI1 MAPK8IP3 CTNNA1 SHC1 SOD1 PRDM1 MAP4 MTMR2 HMGB1 MAPK1
GO_PROTEASOMAL_PROTEIN_CATABOLIC_PROCESS	0.0958795680939082	0.39127646643514	-0.259565344692778	-1.21929969431484	6419	183	ANAPC4 PSME2 MAD2L1 RNF126 STT3B PSMB9 PSMD1 PSME1 UBE2J1 RBX1 RBCK1 CRBN PSMC4 ERLEC1 PML PSMA4 FBXO31 TBL1X CSNK1A1 PSMC3 UBE2E1 PCNP UBE2D1 FBXW5 UBXN2A RNF7 UBE2D3 TRIM38 CUL1 PSMB10 DNAJB9 PSMA6 PSMB2 TRIM13 MAN1B1 PSMD6 UBE2J2 APC RNF139 RNF34 PSMD3 UBE2K PSME3 NSFL1C RNF6 RNF4 PSMB8 FBXO9 EDEM3 PSMD12 CLOCK WWP2 PSMD8 ANAPC7 PSMA3 PSMD4 PSMC1 FAF1 STUB1 SIAH1 CDC16 PSMA7 UBR2 PSMD10
GO_FERTILIZATION	0.144332043518245	0.479386232052986	-0.393894194207707	-1.28290867117654	8317	26	WDR48 ADCY3 BAX TCP1 TARBP2 FNDC3A HEXB CCT5
GO_POSITIVE_REGULATION_OF_INTERLEUKIN_2_PRODUCTION	0.525820429038216	0.835377593472729	-0.330221977147094	-0.948630733151398	29609	16	PDE4D CD3E TRAF6 SPTBN1 CD86 CD80 IRF4 MAP3K7
GO_ACTIVATION_OF_INNATE_IMMUNE_RESPONSE	0.0110543170341175	0.111502601630929	-0.325303911053175	-1.45984897739571	717	132	IRF7 PSME2 TLR10 MB21D1 TICAM1 ICAM2 PSMB9 RELA PSMD1 PSME1 MAPKAPK3 PSMC4 MAP3K1 IFIH1 PSMA4 IFI16 IKBKE PSMC3 MYD88 PAK2 BTK TRAF6 UBE2D1 IRAK4 PIK3C3 UBE2D3 CUL1 TRAF3 PSMB10 CREBBP NFKBIA PSMA6 PSMB2 PSMD6 HSPD1 PSMD3 RELB PSME3 PSMB8 PIK3AP1 PRKCD PSMD12 PSMD8 PSMA3 LGALS9 PSMD4 PSMC1 TAB2 CD86 PSMA7 PSMD10 IKBKB UBE2V1 BCL10 SIN3A
GO_REGULATION_OF_CELL_PROJECTION_ASSEMBLY	0.131449286461923	0.457348038642704	0.292727368664749	1.22531660672215	5148	61	DNM2 WASF2 BRK1 MTOR CORO1C HTT TCHP TBC1D1 CAPZB SSH2 WASL ICAM1 TBC1D10C EVI5 TBC1D10A TBC1D9B SEPT7 SGSM3 MIEN1 MAP4 TBC1D20 ARPC2 ARAP1
GO_SPERMATID_DIFFERENTIATION	0.96675820205232	0.98873540798024	0.173944948498952	0.633477301478006	40133	33	MKKS CELF1 TBPL1 AFF4 CIB1 PSME4 TBC1D20 NSUN2 CCNB1IP1 UBE2B STRBP SMARCA4
GO_GOLGI_VESICLE_TRANSPORT	0.605337423312883	0.867131260726333	0.187311928265751	0.950363098611267	19733	191	GOLGA3 TMED3 DNM2 CTAGE5 COPB1 SYS1 KIF3B PACS1 AP2A1 HTT DCTN3 SCYL1 TRAPPC3 SEC24B DYNC1LI2 VAMP7 TRAPPC8 TMED10 CUX1 ARF3 COPB2 CTSZ AREG RAB1A VCP ANKFY1 SEC23A OPTN PPP6R3 CCDC93 ARF5 TMED9 VAMP5 STX10 ARF4 MYO5A VTI1B
GO_GLIAL_CELL_DIFFERENTIATION	0.0570609318996416	0.300481645379057	0.402011894728338	1.42965639422461	2387	30	HES1 EIF2B5 ILK DUSP10 TGFB1 SIRT2 STAT3 KRAS MAP2K1 SOD1 MAPK1 VIM LYN
