pathway	pval	padj	ES	NES	nMoreExtreme	size	leadingEdge
GO_GLYCOSYL_COMPOUND_METABOLIC_PROCESS	0.121982417786874	0.855944423114674	0.24130593358543	1.17997441582699	5244	163	GPI UQCRQ NDUFB10 PGK1 QTRT1 PANK2 IMPDH1 NME3 SLC35B3 NDUFB9 NDUFS5 FXN PAPSS1 ATP5G2 NDUFA4 DLD NDUFA3 NT5C NDUFS4 NDUFA8 HSPA1A NDUFB1 ENTPD4 COX4I1 GPHN NDUFS1 COX7A2L NDUFB6 UQCRB ATP5S DUT COX10 ATP5B COX7C TCIRG1 BAD ABHD14B TGFB1 ENO2 PFKP NDUFS7 CHCHD10 NDUFB5 NDUFA5 MAT2A AMD1 ERH CMPK1 NDUFA11 TAZ
GO_REGULATION_OF_TUMOR_NECROSIS_FACTOR_MEDIATED_SIGNALING_PATHWAY	0.413073325610332	0.998775096932903	0.292948849690177	1.02348085149707	19254	29	CYLD RPS27A TNFAIP3 GNB2L1 HSPA1A SHARPIN MADD IKBKB UBA52 TRADD BIRC3
GO_PEPTIDYL_TYROSINE_MODIFICATION	0.0384170244539854	0.53916624581987	-0.404183380453522	-1.46892984341552	2057	38	JAK2 CLK3 DYRK1A TYK2 CUX1 CSK MAP2K3 CDC37 STAT5A ZAP70 TXK TTN EIF2AK2 SCYL1 ABI1 JAK3 CNTRL IL12RB1 NEK1 PIBF1
GO_LEUKOCYTE_CELL_CELL_ADHESION	0.864857487318305	0.998775096932903	0.177026327586599	0.825186078699529	38019	118	ANXA1 ZFP36L2 GATA3 TNFSF8 RUNX2 PPP3CA ITK DOCK2 BRAF IL7R CCL5 ITPKB MYH9 RPL22 PREX1 TNFRSF4 CDK6
GO_PROTEIN_LOCALIZATION_TO_ORGANELLE	2.46226577696797e-05	0.000929728054544046	0.357406818313329	1.90700527660073	0	327	RPS26 TOPORS RERE WAPAL RPL8 NFKBIA RPS3 RPS19 GPAA1 NUP133 RPL10 FAU RPL13A RPSA NRAS DDX1 RAB3GAP2 RPL19 RPL11 TOB1 SEC63 RPL36A MDM2 RPL9 RPLP0 RPL21 RPS27 RPS15A RPL18 RPS27A RPL27A RPS23 PPP3CA RPL26 TNFAIP3 RPS2 PMAIP1 RPS4Y1 RPS16 RPS14 RPL10A RPS18 TIMM17B RPL31 VTI1A RPL3 PEX26 RPL14 RPL24 RPLP1 RPL4 RPS7 RPL36 SRP72 RPS25 SEC61G RPL34 RPL30 SEC61B RPL32 RPL39 RPL28 RPS13 RPL29 RPS12 RPL38 RPL23A RPL41 ATP6V1D OS9 RPL7A RANBP6 RPS15 RPL18A RPS4X KDELR1 RPL37 RPL5 RPL7 LONP2 RPS29 RPS11 RPS21 RPL12 RPL22 RPS3A ANKRD32 SYS1 RPS9 RPL35A TOMM20 KIF20B PEX2 MTX1 TOMM70A BANP GNPTG NUTF2 UBA52 NUP93 RPLP2 EHD1 RPS6 PACSIN2 TRAPPC8 NUP98 ASNA1 BAD CBLB RPL13 RB1 RPL15 TGFB1 RPS24 TOMM7 RAB11A GOLGA4 SPCS2 PIH1D1 TINF2 TXNIP SSR3 ZFAND6 RPL6 SH3GLB1
GO_CELLULAR_RESPONSE_TO_RADIATION	0.270020735566954	0.998775096932903	0.279482895941117	1.11394512751449	12370	51	CDKN1A CREBBP MDM2 INO80 GNB1 EEF1D MGMT EIF2S1 ATF4 H2AFX RDH11 BAK1 HUS1
GO_CELLULAR_RESPONSE_TO_KETONE	0.849473307328472	0.998775096932903	-0.227165709703507	-0.738623994588881	45078	24	FBXO32 KLF2 PTGER4 CBX3 KLF6 HNRNPU AIFM1 GNG2 EP300 GNAS ATP2B1
GO_NEGATIVE_REGULATION_OF_APOPTOTIC_SIGNALING_PATHWAY	0.935547906536269	0.998775096932903	-0.175186150174694	-0.735705253498537	51369	76	IFI6 PRELID1 USP47 NDUFS3 RRN3 TAF9 GPX1 TXNDC12 NR4A2 GRINA DDX3X RELA RNF34 NFE2L2 SOD2 RFFL BAX BAG5 RB1CC1 CREB3 RPS6KB1 PHIP
GO_MULTICELLULAR_ORGANISMAL_HOMEOSTASIS	0.669923916032634	0.998775096932903	-0.224409707566009	-0.885092602510729	36540	55	CHMP4B ZNF675 RAC1 ZNF830 ADD1 ACP5 GPX1 STAT3 SASH3 PRDX1 TRAF6 B2M
GO_NEGATIVE_REGULATION_OF_CELL_CYCLE_G1_S_PHASE_TRANSITION	0.965022266418782	0.998775096932903	0.170926636550555	0.656170838976686	44639	43	CDKN1A MDM2 RPS27A CNOT6L ZC3H12D UBA52 RB1
GO_REGULATION_OF_MITOCHONDRIAL_OUTER_MEMBRANE_PERMEABILIZATION_INVOLVED_IN_APOPTOTIC_SIGNALING_PATHWAY	0.400243725146449	0.998775096932903	0.300907911668992	1.03262653154853	18720	27	SIVA1 PMAIP1 HSPA1A BAK1 BAD YWHAG MAPK8 CASP8 PPP3CC BCL2 BBC3 BID
GO_REGULATION_OF_SIGNAL_TRANSDUCTION_BY_P53_CLASS_MEDIATOR	0.43051820626499	0.998775096932903	-0.243571228826247	-1.01035415363776	23693	71	NBN DYRK1A PRKAG2 TAF2 CHD4 CSNK2A1 RBBP4 RRN3 TAF9 EHMT1 PML UBC TP53INP1 TAF11 BRD7 PRKAG1 RBBP7 RNF34 TOPBP1 PLK3
GO_POSITIVE_REGULATION_OF_CYTOKINE_PRODUCTION	0.0483230518329433	0.606398090800614	-0.283154531794364	-1.30784589749075	2725	135	IRF7 GBP5 ZBP1 JAK2 ZNF580 CARD8 DDIT3 PTPN22 PYCARD XRCC5 IFI16 POLR3E BCL3 PTGER4 HLA-DPB1 CRCP NLRP1 IFNAR1 LY9 CCR7 IL6ST TXK HLA-E CD28 DDX3X IL27RA RELA POLR2K CD58 TIGIT HLA-A SASH3 POLR2E LTB SPTBN1 MAPK13 EIF2AK2 TRAF6
GO_GAMETE_GENERATION	0.9083965995363	0.998775096932903	0.171259590949729	0.796977404483827	39963	117	XRN2 PANK2 MEI1 NSUN2 CTSB FNDC3A PRDX4 CCNI DLD H2AFX CIB1 PAIP2 ATP2B4 WDR48 ERCC1 USP9X RUVBL1 RPS6 MEA1 ODF2 BIRC3 BAD HEXB HSF1 TGFB1 GMCL1
GO_REGULATION_OF_CELLULAR_AMIDE_METABOLIC_PROCESS	0.199116499835519	0.97259169999057	0.222564018679937	1.11268407267816	8473	191	IARS RPS3 RBM8A TMED10 RPL13A EIF3F RBM3 DDX1 MKNK1 TOB1 EIF3G EIF2A EIF3K EIF2AK1 EIF4B RPS14 LRPPRC HNRNPR EIF2S1 UNK C1QBP RPL38 ATF4 CCL5 SECISBP2 GNB2L1 SMAD2 EEF2 RPS4X ZFP36 LSM14A PAIP2 RPS9 FAM129A CNOT6L ZC3H12D
GO_CELLULAR_COMPONENT_MORPHOGENESIS	0.55783598411282	0.998775096932903	-0.200069506113439	-0.960357711969947	31881	176	RAB1A TMOD3 ATP6V0D1 RAC1 ZNF335 SLIRP TMEM138 HPRT1 SNX2 ADD1 C16orf80 KLF2 EZR HNRNPAB CPNE1 GRB2 DNM1L KIDINS220 BCL11B TBCC NR4A2 MAPK8IP3 DYNLT1 ATXN10 RPS6KA5 DBNL TTN TOP2B DICER1 FIS1 SPTBN1 TBPL1 ABI1 USP33 RAB8B SS18 LIMS1 SSBP1 VASP TRIM28 NDUFS6 WDR1 RAB8A VAMP3 IFT57 RILPL2 POLDIP2 BAX ITGB7 NEK1 PCM1 SLC9A3R1 PIBF1 ZNF280D EP300 TCTN3
GO_CELL_AGING	0.705854539202201	0.998775096932903	0.241106273586432	0.848756772070491	32841	30	CDKN1A MAP2K1 H2AFX ERCC1 ROMO1 ID2 BCL2 MNT MAPKAPK5 ILK PDCD4 SOD1 MIF
GO_POSITIVE_REGULATION_OF_PROTEIN_MODIFICATION_PROCESS	0.379229519998661	0.998775096932903	-0.196380193442206	-1.02523955078689	22650	358	RAP2C JAK2 UBE2E1 PSMD4 IKBKG RAB1A MOB2 ARFGEF1 NBN AKT2 RAC1 DYRK1A EHD4 PRKAG2 WDFY2 RNF139 PSMD5 MAP3K8 PTPN22 PYCARD PSMB9 PPP2R5A GADD45A CCNL2 CDC42 AKAP8L VAPB OGT GOLGA2 CCNC UBE2L3 CSK TRAF4 PKN1 RNF40 MAP2K3 PTGER4 CAMK2D PHB2 STK25 UBE3A PPP2R3C KIDINS220 RCHY1 PML CDK10 CCR7 IL6ST UBC STRA13 MAPK8IP3 RNF111 PSMD13 STAT3 CHTOP BRD7 RPS6KA5 PRKAG1 DDRGK1 DBNL TOLLIP UBE2S PSMA1 PIK3CB TNFRSF1B BIRC2 TERF2IP VCP TGFBR2 EIF2AK2 ATG14 ABI1 TRAF6 PTPLAD1 TRAF7 ZNF622 MAP4K1 PLCG1
GO_DEPHOSPHORYLATION	0.545051698670606	0.998775096932903	-0.218655924394237	-0.958619455824303	30257	97	NT5DC1 PPP4C PTPN22 PPP6C CAMK2G PPM1K PPP2R2A PPP1CB RPRD1A IMPA1 ACP5 PPP1CC DUSP10 TMEM55B PPIP5K2 DUSP11 PFKFB3 PTPN2 SSU72
GO_MATERNAL_PROCESS_INVOLVED_IN_FEMALE_PREGNANCY	0.973731694809018	0.998775096932903	-0.186814529525876	-0.562450754530212	51265	18	PAM PRDX3 KPNA6 DEDD JUNB MED1 AKR1B1 UBE2A
GO_POSITIVE_REGULATION_OF_CELL_CELL_ADHESION	0.261363636363636	0.992728116969239	-0.248284325847849	-1.10427019494913	14558	106	HLA-DQB1 CD247 RAC1 KIFAP3 CITED2 MAP3K8 ZBTB1 ADK PYCARD CDC42 GRAP2 CSK ICOS HLA-DPB1 GRB2 ZAP70 CD59 CD5 IL6ST HLA-E CD28 AP3B1 HLA-A SASH3 TGFBR2 TRAF6 JAK3 PTPRC HLA-DQA1 SIRPG FLOT2 IL12RB1
GO_POSITIVE_REGULATION_OF_CATION_TRANSMEMBRANE_TRANSPORT	0.67923634917328	0.998775096932903	-0.271761349441472	-0.852433388084909	35862	21	GSTO1 GLRX ATP1B1 SUMO1 PLCG1 CALM3 BAX
GO_MORPHOGENESIS_OF_A_BRANCHING_STRUCTURE	0.914076196177363	0.998775096932903	0.201738204793345	0.69230556797635	42754	27	RERE SOCS3 CTSH KRAS BAK1 TGFB1 RBM15 PRDM1
GO_INTRACELLULAR_RECEPTOR_SIGNALING_PATHWAY	0.0778743011163926	0.73391401768744	-0.310359006602728	-1.30337216384128	4275	76	IRF7 JAK2 IKBKG KDM3A CDK7 YWHAH MED16 NR4A1 MED13 UBE3A DDX54 NR1D2 PML SP100 CALCOCO1 NR4A2 UBC STAT3 MED30 RELA
GO_HISTONE_MRNA_METABOLIC_PROCESS	0.759645661823286	0.998775096932903	-0.260026347164171	-0.794687462889267	40046	19	LSM1 SNRPD3 ZCCHC11 SNRPE DCP2 XRN1 ZCCHC6 ATM
GO_REGULATION_OF_ESTABLISHMENT_OF_PROTEIN_LOCALIZATION_TO_PLASMA_MEMBRANE	0.578038104501914	0.998775096932903	0.288784760844742	0.915606677138143	27335	20	RANGRF STX4 GNB2L1 CIB1 GOPC
GO_POSITIVE_REGULATION_OF_PRODUCTION_OF_MOLECULAR_MEDIATOR_OF_IMMUNE_RESPONSE	0.917986757982205	0.998775096932903	-0.214064042550111	-0.662823376003551	48387	20	HLA-E CD28 HLA-A SASH3 TRAF6 B2M VAMP3 STAT6
GO_NEGATIVE_REGULATION_OF_DEVELOPMENTAL_PROCESS	0.74050396640224	0.998775096932903	0.18246463010199	0.898572324284973	31737	171	ANXA1 ZFP36L2 NFKBIA CYLD CERS2 TIMP1 GATA3 TOB1 PPP3CA FXN STRAP N4BP2L2 KATNA1 PDCD10 CCDC85B ITPKB ANP32B VIM CIB1 CDK6 HDAC2 CDK5RAP2 GBP1 THOC1 BNIP3 GAK STAT5B KRAS
GO_REGULATION_OF_HOMOTYPIC_CELL_CELL_ADHESION	0.258666950974643	0.992110199310288	-0.238779518922351	-1.09901614946998	14556	132	HLA-DQB1 CD247 RAC1 MAP3K8 ZBTB1 ADK CLPTM1 PTPN22 PYCARD ZEB1 MARCH7 PRELID1 CDC42 GRAP2 CSK ICOS HLA-DPB1 GRB2 RC3H1 ZAP70 CD59 CD5 CCR7 IL6ST HLA-E CD28 PTPN2 AP3B1 TIGIT HLA-A SASH3
GO_ORGANIC_HYDROXY_COMPOUND_BIOSYNTHETIC_PROCESS	0.382960493229273	0.998775096932903	-0.283924429573402	-1.04479303663272	20559	40	ALDH9A1 PRKAG2 SLC44A2 MYO5A SPTLC1 MSMO1 IMPA1 IDI1 NR4A2 SCP2 C14orf1 CYB5R3 MVD
GO_REGULATION_OF_TYPE_I_INTERFERON_MEDIATED_SIGNALING_PATHWAY	0.102920776086502	0.793867066998588	-0.462823242631699	-1.37190713662808	5415	17	IRF7 TYK2 IFNAR2 CDC37 IFNAR1 STAT1 PTPN2
GO_RHYTHMIC_PROCESS	0.326002751230814	0.998775096932903	-0.248770376977135	-1.06898396996961	18010	86	HNRNPD ID3 PAM FBXL3 DYRK1A ZNF830 ADK CSNK2A1 OGT PPP1CB UBE3A PPP1CC CBX3 NR1D2 PML CSNK1E TOP1 CDK4 HNRNPU THRAP3 RELB BAX CRY1 ARNTL EP300 NR1D1 SFPQ SYNCRIP HDAC3
GO_STEROID_HORMONE_MEDIATED_SIGNALING_PATHWAY	0.0097089184413652	0.204380961087722	-0.440310154806283	-1.62963527587466	521	41	JAK2 KDM3A NR2C1 YWHAH MED16 NR4A1 MED13 UBE3A DDX54 NR1D2 CALCOCO1 NR4A2 MED30 THRAP3 MED4 UBR5 NR1D1 NCOA4 TAF7
GO_REGULATION_OF_RESPONSE_TO_BIOTIC_STIMULUS	0.440110358440626	0.998775096932903	0.224512772263854	1.00444276031232	19620	93	AP1S2 GMIP TSPAN32 AP2M1 TMEM173 TNFAIP3 TNIK DOCK2 SLC35B3 SEC14L1 SIGIRR EIF2S1 C1QBP AP2A2
GO_PEPTIDYL_PROLINE_MODIFICATION	0.65148481184827	0.998775096932903	-0.271699244712746	-0.873027181456103	34486	23	CWC27 FKBP8 NKTR FKBP3
GO_REGULATION_OF_DNA_BIOSYNTHETIC_PROCESS	0.501058726934878	0.998775096932903	0.251819584436333	0.972119953522464	23189	44	CDKN1A RFC2 CHTF8 MAP3K4 HNRNPA1 SMG6
GO_FIBROBLAST_GROWTH_FACTOR_RECEPTOR_SIGNALING_PATHWAY	0.720883833675182	0.998775096932903	-0.237338031786289	-0.841238408422933	38660	34	POLR2G GTF2F2 GRB2 POLR2J UBC POLR2K HNRNPH1 POLR2E CEP57 HNRNPF CBL
GO_REGULATION_OF_CELL_CYCLE_ARREST	0.905637943707034	0.998775096932903	0.190790928277902	0.732427935187411	41892	43	CDKN1A MDM2 RPS27A BIN1
GO_REGULATION_OF_MRNA_SPLICING_VIA_SPLICEOSOME	0.987354720759152	0.998775096932903	0.15463966581658	0.602068326855064	45364	46	RBM8A CWC22 C1QBP NSRP1 SRSF7 HNRNPL SF3B4 MAGOH DAZAP1
GO_REGULATION_OF_ANATOMICAL_STRUCTURE_MORPHOGENESIS	0.203353489604664	0.97259169999057	0.210259786496853	1.09665040666709	8440	268	TBC1D10A ANXA1 DDHD2 CYLD TBC1D5 GATA3 MAP2K1 VRK2 RUNX2 SEPT9 RPS27A AP2M1 PPP3CA TNFAIP3 TNIK BTG1 BRAF PSMA5 WDR36 ARPC2 STRAP JAK1 C1QBP SEC24B AP2A2 NDEL1 CCL5 CLTC GNB2L1 PDCD10 SMAD2 MYH9 PREX1 CIB1 CTSH TBC1D14 INF2 CAPZB HDAC2 GBP1 PSMC4 BNIP3 ARRB2 NACA UBA52 UNC13D NFATC2 EHD1 TBC1D15 SGSM3 ODF2 CDC42SE2 MLLT3 HEXB PSMD11 GNG5 TGFB1 RAB11A VAMP7 PSMA3 GOLGA4 SEPT7 POR IFRD1 HMGB1 LST1 RNF6
GO_FEMALE_GAMETE_GENERATION	0.962156568749604	0.998775096932903	0.192272738405269	0.591309291841053	45560	18	ERCC1 USP9X RPS6 HEXB IL4R BCL2 CTNNB1 HPGD
GO_PROTEIN_HOMOOLIGOMERIZATION	0.0562524999090942	0.647038656241059	-0.319290321468955	-1.34460092144123	3093	77	GBP5 CHMP4B PAM EHD4 ZBTB1 HPRT1 OGT TERF1 GOLGA2 CCDC88C KCTD18 NUPL1 DNM1L ATXN10 ATPIF1 HSD17B10 FIS1 VCP IKBKE KCNA3 USP16 VASP ATG16L1 CEP57 RNF213 SOD2 DERL1 BAX ATL3 SHMT2
GO_REGULATION_OF_OXIDATIVE_STRESS_INDUCED_CELL_DEATH	0.987764919790148	0.998775096932903	-0.167307169852416	-0.524792130821043	52152	21	GPX1 NFE2L2 MST4 FBXW7 SOD2 BAG5 SFPQ HSPH1
GO_TRANSCRIPTION_FROM_RNA_POLYMERASE_I_PROMOTER	0.646963031892395	0.998775096932903	0.278892125756589	0.870623344994098	30590	19	POLR2L ZNRD1 ERCC3 POLR1E
GO_BODY_FLUID_SECRETION	0.901935336107188	0.998775096932903	-0.231111556383649	-0.661397151125334	47255	15	PAM STAT5A COPA
GO_POSITIVE_REGULATION_OF_CHROMOSOME_ORGANIZATION	0.293355855855856	0.998775096932903	-0.256120116409085	-1.09068375556063	16150	82	RAB1A NBN ATRX AKAP8L OGT GOLGA2 SMC5 RNF40 ACD BECN1 CCT5 PML CHTOP HMBOX1 BRD7 RPS6KA5
GO_RESPONSE_TO_VITAMIN	0.162495219479029	0.925775516481443	0.380934440156938	1.25342589281314	7647	23	CDKN2D MDM2 MGMT CCL5 EEF2 AQP3 TGFB1
GO_REGULATION_OF_ATPASE_ACTIVITY	0.237796584554934	0.988698216223644	-0.365575875580416	-1.1746726664763	12587	23	TOR1AIP1 OXA1L ATP1B1 ATPIF1 CHTOP HNRNPU DNAJC7 SNRNP70 DNAJC1
GO_NEGATIVE_REGULATION_OF_STRESS_ACTIVATED_PROTEIN_KINASE_SIGNALING_CASCADE	0.212140781401356	0.980106062596461	-0.402449122417781	-1.21167134664731	11168	18	ZNF675 PTPN22 EZR DUSP10
GO_POSITIVE_REGULATION_OF_CYTOKINE_BIOSYNTHETIC_PROCESS	0.829295175113544	0.998775096932903	-0.248719506296141	-0.73725784333139	43639	17	BCL3 CD28 RELA LTB TRAF6
GO_REGULATION_OF_CYSTEINE_TYPE_ENDOPEPTIDASE_ACTIVITY	0.219007966547709	0.983940713162858	-0.257110110137087	-1.1340365267054	12150	101	BCL2L13 JAK2 REST RPS6KA3 CARD8 IFI6 AKT2 CASP1 PYCARD PSMB9 IFI16 CSNK2A1 USP47 PDCD6 MICAL1 NLRP1 SERPINB9 PML PRDX3 GPX1 CYFIP2 DDX3X BIRC2 FIS1 VCP RNF34 AIFM1 S100A8 CDKN1B RFFL IFT57 CD27
GO_REGULATION_OF_CELLULAR_RESPONSE_TO_STRESS	0.819720870804462	0.998775096932903	0.168119656299115	0.89548571505588	33360	322	CEBPG CERS2 CDKN2D RPS3 MAP2K1 HERPUD1 CREBBP NUP133 UBQLN2 RAB3GAP2 MDM2 MLST8 EIF2AK1 TNIK PMAIP1 UBE2V2 ATP6V0B HSBP1 BRAF TPT1 SNX5 MGMT RAB1B MAP3K4 RPL28 NDEL1 NSMCE1 ATF4 RSL1D1 ATP6V1D OS9 GPS2 UBXN1 VPS26B ATP6V0C GNB2L1 PDCD10 ERN1 H2AFX EXOC8 ANKRD32 HSPA1A RWDD3 CDK6 TBC1D14 P4HB SDF2L1 MINK1 THOC1 MAPKAPK2 WAC BNIP3 MDFIC BAK1 NUP93 RUVBL1 APBB1 NUP98 MAP4K4 SDF2 MAP1LC3B PTPN1 ZNF277 HSF1
GO_POSITIVE_REGULATION_OF_EPITHELIAL_CELL_MIGRATION	0.772720479921436	0.998775096932903	0.236179489057612	0.80237790324652	36194	26	GATA3 AAMP CIB1 CTSH CAPN7 TGFB1 RAB11A PFN1 JUN
GO_HOMOTYPIC_CELL_CELL_ADHESION	0.0756875408936449	0.723636395424565	0.473176433484252	1.43209287300075	3585	17	FIBP TSPAN32 MYH9 STXBP3 ACTG1
GO_POSITIVE_REGULATION_OF_IMMUNE_EFFECTOR_PROCESS	0.343621444442	0.998775096932903	0.262354407120989	1.06192886194829	15619	55	ANXA1 VAMP2 GATA3 RPS19 STX4 CD46 TNFRSF4 STXBP2 STAT5B UNC13D ZC3HAV1 MALT1 TGFB1 VAMP7
GO_UROGENITAL_SYSTEM_DEVELOPMENT	0.610218787984025	0.998775096932903	0.235858387938875	0.914199539857018	28113	45	ANXA1 GATA3 TMED10 SEC63 ITGA6 SMAD2 CTSH ARID5B APH1A
GO_NEGATIVE_REGULATION_OF_CELL_ACTIVATION	0.21974613370878	0.983940713162858	0.284599657866154	1.15197070293277	9988	55	ANXA1 MAD1L1 CYLD TSPAN32 PRNP TNFAIP3 HLA-DRB5 THOC1 TGFB1 PELI1 HMGB1 LST1 CASP3 PRDM1 KIAA0922 LGALS9 NDFIP1 ID2 IL4R
GO_CELLULAR_RESPONSE_TO_ALCOHOL	0.366112433688867	0.998775096932903	-0.313396083476705	-1.05952806680743	19530	28	HNRNPD FBXO32 KLF2 CBX3 TP53INP1 KLF6 HNRNPU AIFM1 ITPR2 EP300 ATP2B1 H2AFZ
GO_CELL_JUNCTION_ASSEMBLY	0.999356982102669	0.999356982102669	0.123319031616688	0.427061749391562	46624	28	ITGA6 PLEC PKN2 ACTG1 ACTN4 RHOC BCL2 ILK CTNNB1 LSR FLNA TLN1
GO_MACROMOLECULE_CATABOLIC_PROCESS	2.58257792928902e-05	0.000929728054544046	0.294665852690242	1.63902968888319	0	498	RPS26 GSPT1 TOPORS ZFP36L2 RPL8 CYLD RPS3 XRN2 RBM8A HERPUD1 RPS19 RPL10 FAU RPL13A RPSA UBQLN2 GZMA LDLR RPL19 CTSW RPL11 RNF19A ARIH2 DIS3L RPL36A MDM2 RNASEH1 RPL9 RPLP0 RPL21 UFD1L RPS27 RPS15A CAPN2 RPL18 RPS27A RPL27A RPS23 RPL26 TNFAIP3 BUB3 DIS3 RPS2 EIF4B PMAIP1 RPS4Y1 RPS16 RPS14 RPL10A CALM2 RPS18 RPL31 RPL3 RPL14 AUP1 PPT1 TSG101 NBAS PSMA5 RPL24 RPLP1 EXOSC8 RPL4 RPS7 CTSB RPL36 RPS25 RPL34 RPL30 SEC61B RPL32 RPL39 RPL28 RPS13 RPL29 RPS12 RPL38 UCHL3 RPL23A RPL41 OS9 RPL7A UBXN1 CSDE1 SMG6 RPS28 RPS15 RPL18A RPS4X RPL37 ERN1 RPL5 RNF115 RPL7 ZFP36 TPP1 LONP2 RPS29 RPS11 RPS21 LSM5 RPL12 RPL22 RPS3A CTSH CALM1 UBE2K RPS9 RPL35A CNOT6L SDF2L1 SCPEP1 TTC3 RNF44 PSMC4 BNIP3 RLIM CTBS ARRB2 GLB1 USP9X SKP1 TCEB1 COPS3 UBA52 RPLP2 LSM6 NSFL1C RPS6 CTSA USP3 VPS37A RNF145 TCIRG1 HEXB PSMD11 USP34 RPL13 RPL15 TGFB1 RPS24 CDC27 MAGOH PSMA3 USP7 BFAR CAPN1 PCBP2 RPL6 SH3GLB1 HERC2 HMGB1 PABPC4 CASP3 RNF6 EIF3E
GO_INTERACTION_WITH_SYMBIONT	0.959004255159615	0.998775096932903	-0.185099557467738	-0.625783749800051	51159	28	REST VAPB GPX1 TAF11 SUGT1 VAPA EP300 ZNF639 SNW1 ZC3H12A
GO_EYE_DEVELOPMENT	0.582407508457929	0.998775096932903	0.233806135110724	0.931889603163618	26682	51	TOPORS GATA3 GNB1 IMPDH1 PHACTR4 VIM NINJ1 ATP2B4 HDAC2 BAK1 ARID1A TGFB1 HMGB1 PRDM1 AGTPBP1 PFDN5 JUN RAB3GAP1 NIPBL JMJD6
GO_DEVELOPMENTAL_PROCESS_INVOLVED_IN_REPRODUCTION	0.690248522330496	0.998775096932903	0.192898598328532	0.905841379093425	30245	124	ANXA1 GATA3 MAP2K1 ADAM15 PANK2 SOCS3 MEI1 NSUN2 CTSB MAP3K4 FNDC3A PRDX4 CSDE1 DLD CIB1 ARID5B WDR48 ARRB2 STAT5B ERCC1 BAK1 RPS6 MEA1 ODF2 HEXB HSF1 ARID1A TGFB1
GO_PROTEIN_DEPHOSPHORYLATION	0.651526189262038	0.998775096932903	-0.215604786573305	-0.903173707726955	35773	75	PPP4C PTPN22 PPP6C CAMK2G PPM1K PPP2R2A PPP1CB RPRD1A PPP1CC DUSP10 DUSP11 PTPN2 SSU72 PPM1B DUSP16 PTPRC DUSP22 CDC25B ACP1 CYCS CTDSPL2 MTMR6 MTM1
GO_REGULATION_OF_CELLULAR_PROTEIN_CATABOLIC_PROCESS	0.324877567558045	0.998775096932903	-0.224300009631747	-1.05854425449126	18441	156	CSNK1A1 UBE2E1 PSMD4 RAB1A RNF114 N4BP1 RNF139 PSMD5 PSMB9 CSNK2A1 TERF1 GOLGA2 EZR TRIB2 SMC5 RNF40 RAD23A ARIH1 UBE3A TAF9 SGTA SUMO1 RCHY1 PML GPX1 UBC PSMD13 FBXL5 ATPIF1 CSNK1E ZNF207 DDRGK1 PSMA1 VCP NFE2L2 PLK3 ANKIB1 FBXW7 PSMD6 PSMG2 STUB1 RDX FHIT APC BAG5
GO_REGULATION_OF_NEURON_DEATH	0.289242444414858	0.998775096932903	0.250915350286335	1.0886131108018	13034	78	GPI GATA3 DDIT4 G6PD PMAIP1 UBE2V2 BRAF PPT1 SIGMAR1 EIF2S1 ATF4 ATF2 CCL5 GNB2L1 ADAM8
GO_RESPONSE_TO_GAMMA_RADIATION	0.630404847149546	0.998775096932903	0.275005949407295	0.883223002978378	29756	21	GATA3 SOCS3 H2AFX BAK1 CYBA PRKAA1 BCL2 PRKDC MYC ELK1 C12orf5
GO_REGULATION_OF_CYCLIN_DEPENDENT_PROTEIN_KINASE_ACTIVITY	0.519227179391451	0.998775096932903	-0.262657296841068	-0.960486921560208	27814	39	HERC5 CDK7 GADD45A CKS2 CCNL2 CCNC CDC37 CNPPD1
GO_POSITIVE_REGULATION_OF_PROTEIN_IMPORT	0.921661669866057	0.998775096932903	0.191478602533086	0.700614816955621	42730	35	SPPL3 TMEM173 PPP3CA DMAP1 NUTF2 TGFB1 XBP1 HSP90AA1 HCLS1 LGALS9
GO_MULTI_ORGANISM_METABOLIC_PROCESS	2.27474352266782e-05	0.000929728054544046	0.653700382946533	3.04714255219552	0	118	RPS26 RPL8 RPS3 MAP2K1 RPS19 NUP133 RPL10 FAU RPL13A RPSA EIF3F RPL19 RPL11 RPL36A RPL9 EIF3G RPLP0 RPL21 RPS27 RPS15A RPL18 RPS27A RPL27A RPS23 RPL26 RPS2 RPS4Y1 RPS16 RPS14 RPL10A RPS18 RPL31 RPL3 RPL14 RPL24 RPLP1 RPL4 RPS7 RPL36 RPS25 RPL34 RPL30 RPL32 RPL39 RPL28 RPS13 RPL29 RPS12 RPL38 RPL23A RPL41 RPL7A RPS28 RPS15 RPL18A RPL37 RPL5 RPL7 RPS29 RPS11 RPS21 RPL12 RPL22 RPS3A RPS9 RPL35A USF2 UBA52 NUP93 RPLP2 RPS6 NUP98 RPL13 RPL15 RPS24
GO_MONOVALENT_INORGANIC_CATION_HOMEOSTASIS	0.772028721466081	0.998775096932903	0.232887700174055	0.806505105856271	36018	28	ATP6V0B PPT1 ATP6V1D ATP6V0C ATP1A1 ATP5B TCIRG1
GO_HEART_PROCESS	0.0852859016019611	0.74333396343604	-0.475347594315583	-1.40903199526538	4487	17	CDC42 MAP2K3 CAMK2D DNM1L ATP1B1 GPX1 TTN SRSF1
GO_MUSCLE_SYSTEM_PROCESS	0.793473753137619	0.998775096932903	0.206168647841073	0.82173386652327	36352	51	PPP3CA CALM2 HSBP1 PDE4D EEF2 VIM CALM1 PXN HDAC2 IKBKB CXCR4 ATP1A1 RCSD1 TAZ KDM4A HSP90AA1 ROCK1 CYBA ALDOA
GO_MESENCHYME_DEVELOPMENT	0.178196575022309	0.960195641684727	0.375071201650073	1.23413350497544	8386	23	ADAM15 NUP133 MDM2 PHACTR4 TGFBR3 SMAD2
GO_TRANSCRIPTION_FROM_RNA_POLYMERASE_III_PROMOTER	0.507888406977405	0.998775096932903	-0.30701496156013	-0.96301333656655	26815	21	TBP POLR3E CRCP GTF3C2 GTF3C5 POLR2K POLR2E ZNF143
GO_POSITIVE_REGULATION_OF_PROTEOLYSIS	0.0402341020265549	0.552163035546753	-0.269084546499602	-1.29832662692492	2302	183	ADRM1 BCL2L13 JAK2 CSNK1A1 UBE2E1 PSMD4 REST RAB1A RNF114 CARD8 IST1 PICALM RNF139 CASP1 PSMD5 PYCARD PSMB9 IFI16 PRELID1 OGT GOLGA2 TRIB2 SMC5 RNF40 ARIH1 PDCD6 NLRP1 SGTA SUMO1 RCHY1 PML NRD1 UBC PSMD13 ATPIF1 CYFIP2 STAT3 CSNK1E DDX3X
GO_REGULATION_OF_CILIUM_ASSEMBLY	0.00767701548092378	0.16875846420013	0.563711461472421	1.75974978449902	362	19	TBC1D10A CYLD TBC1D5 SEPT9 TBC1D14 TBC1D15 SGSM3 ODF2 SEPT7
GO_REGULATION_OF_PROTEIN_KINASE_B_SIGNALING	0.919093790788738	0.998775096932903	-0.196561440811781	-0.69670685469708	49290	34	ARFGEF1 DDIT3 CPNE1 PDCD6 CCR7 GPX1 CD28
GO_REGULATION_OF_DNA_TEMPLATED_TRANSCRIPTION_IN_RESPONSE_TO_STRESS	0.593771536871123	0.998775096932903	0.244757569707194	0.918892450550899	27569	39	CREBBP ATF6B RPS27A ATF4 TCEB2 TCEB1 UBA52 RGS14 CHD6 BCLAF1 RPS6KA1 XBP1 NCK2 JUN SIN3A UBE2D2 RBPJ HSPA5
GO_REGULATION_OF_MAP_KINASE_ACTIVITY	0.593150839247494	0.998775096932903	0.206561956666752	0.939745026452329	26326	102	RPS3 MAP2K1 STK38 RPS27A TNIK BRAF TSG101 MAP3K4 GPS2 PDCD10 ERN1 ADAM8 CDK5RAP3 GPS1 SMPD1 MADD MAPKAPK2 MDFIC DUSP4 KRAS UBA52 CXCR4 PTPN1 RAPGEF1 TGFB1
GO_LYTIC_VACUOLE_ORGANIZATION	0.787723622147623	0.998775096932903	0.239318745537946	0.787453904585888	37074	23	PPT1 ATP6V0C TPP1 HEXB HPS4 MFSD8
GO_REGULATION_OF_CHEMOTAXIS	0.382296463394172	0.998775096932903	-0.293478031743349	-1.0471276891548	20505	35	ZNF580 AKT2 RAC1 CORO1B IL16 CCR7
GO_NEGATIVE_REGULATION_OF_RESPONSE_TO_STIMULUS	0.95431549510614	0.998775096932903	0.154610281734102	0.850735877662754	37537	443	ANXA1 NFKBIA CYLD CERS2 CDKN2D GATA3 RPS3 HERPUD1 EPN1 RPS19 STK38 LEPROT DDIT4 LITAF TOB1 PRNP RUNX2 MDM2 RGS16 SOCS3 RPS27A AP2M1 TNFAIP3 CALM2 PHACTR4 IL7R SEC14L1 PSMA5 HMGXB4 ITGA6 TPT1 SIGIRR FXN TGFBR3 STRAP C1QBP CD46 AP2A2 ENY2 ATF4 CCL5 OS9 GPS2 NFATC1 UBXN1 GNB2L1 SMAD2 MAPKAP1 RNF115 NPRL2 RANBP9 C9orf89 CIB1 HSPA1A SHARPIN CDK6 CALM1 CDK5RAP3 GPS1 PHPT1 SMPD1
GO_MEIOTIC_CELL_CYCLE_PROCESS	0.823719445015032	0.998775096932903	-0.216664475677079	-0.777929764953735	44110	36	CKS2 TERF1 GOLGA2 SMC3 STRA13 PSMD13 MLH1 TOP2B
GO_SPINDLE_ASSEMBLY	0.950480607397988	0.998775096932903	-0.187769631131575	-0.645656237166187	50825	30	KPNB1 CHD4 GOLGA2 RCC1 MLH1 ZNF207 BIRC2
GO_SPHINGOLIPID_BIOSYNTHETIC_PROCESS	0.432073001840223	0.998775096932903	-0.328136192931734	-1.01603397094143	22774	20	CERS5 ST8SIA4 VAPB SPTLC1 ST6GALNAC6 ST3GAL1 ELOVL1
GO_REGULATION_OF_PHOSPHOPROTEIN_PHOSPHATASE_ACTIVITY	0.541562558269625	0.998775096932903	-0.266359468914937	-0.944104128663817	29043	34	JAK2 PPP2R5A TIPRL PPP2R2A TSC1 ARPP19 PPP6R1
GO_REGULATION_OF_MULTI_ORGANISM_PROCESS	0.078895669257115	0.736755046746894	-0.251316558356424	-1.22610847473684	4537	199	CHMP4B REST IFITM3 B4GALT1 IST1 CD247 RAC1 TRIM8 ISG15 MX1 HERC5 TRIM26 POLR2G IFI16 GTF2F2 TRIM11 VAPB TRIM38 APOBEC3C AP1G1 RAD23A TRIM13 PPP2R3C RSF1 OAS1 POLR2J FAM111A ATP1B1 TAP1 AP2A1 PML SP100 PUM1 C19orf66 SNRPD1 STAT1 COX8A DYNLT1 TAF11 SUPT4H1 CD28 DDX3X EXOC2 POLR2K FOXP1 HLA-A POLR2E BIRC2 SRPK2 PPM1B EIF2AK2 TRAF6 PTPLAD1 BST2 CHMP3 B2M TRIM28 VAPA MB21D1 IFITM1 DERL1 MRPS10
GO_POSITIVE_REGULATION_OF_CELL_CYCLE_ARREST	0.859154929577465	0.998775096932903	0.20689429629865	0.757020406525027	39832	35	CDKN1A MDM2 RPS27A
GO_CONNECTIVE_TISSUE_DEVELOPMENT	0.791293951879764	0.998775096932903	0.232535331340891	0.78999752407173	37064	26	TIMP1 RUNX2 ATF2 ARID5B TGFB1 XBP1 NAMPT RUNX3 ID2 ACAT1
GO_CYTOPLASMIC_PATTERN_RECOGNITION_RECEPTOR_SIGNALING_PATHWAY	0.334397665517752	0.998775096932903	0.342708651671146	1.08657509788687	15813	20	NFKBIA CYLD RPS27A TNFAIP3 LSM14A IKBKB UBA52
GO_NUCLEAR_ENVELOPE_ORGANIZATION	0.789329584134971	0.998775096932903	-0.213654568286161	-0.811622357754038	42667	46	CHMP4B TOR1AIP1 PRKCB AKAP8L NUP88 NUPL1 SUMO1
GO_REGULATION_OF_GLIAL_CELL_DIFFERENTIATION	0.893149068846381	0.998775096932903	0.228550593796617	0.679486657461257	42395	16	BIN1 HDAC2 RHEB CXCR4 MECP2 ID2 SIRT2 CTNNB1
GO_CELLULAR_RESPONSE_TO_ENDOGENOUS_STIMULUS	0.37248350604637	0.998775096932903	-0.201302665739002	-1.02884805978742	21961	293	JAK2 HNRNPD REST TBC1D4 ARHGEF18 KDM3A ATP6V0D1 AKT2 RANGAP1 CORO1B POLR2G PTPN22 CDK7 FBXO32 FUT8 ZEB1 NR2C1 MYO5A GTF2F2 OGT UBE2L3 YWHAH KLF2 CSK DENND4C MED16 EZR PTGER4 STAT5A NR4A1 MED13 GRB2 UBE3A KIDINS220 POLR2J CBX3 BECN1 DDX54 SERPINB9 EIF4EBP2 NR1D2 PML CALCOCO1 ADIPOR2 NR4A2 UBC KLF6 STAT3 MED30 RELA RAB35 POLR2K PTPN2 HNRNPH1 POLR2E TGFBR2 ATP6V0E2 ACAP2 LAMTOR3 PLCG1 NUP62 LIMS1 HNRNPU AIFM1 JAK3 CEP57 ATP6V1B2 HNRNPF CBL THRAP3 RAB8A RDX SOCS1 BPTF IPO5 APC MED4 DIAPH1 ZYX GNG2 ITPR2 DUSP22 ZNF259 ATP6V1G1 ITGB1BP1
GO_RNA_POLYADENYLATION	0.865709814100851	0.998775096932903	-0.244277745720331	-0.699076271350731	45357	15	NUDT21 SSU72 CDC73 PCF11 PAPD4 CSTF2 CSTF1 CPSF6 PAPOLG GRSF1 WDR33 PAPOLA PAF1 CPSF1 PABPC1
GO_ASPARTATE_FAMILY_AMINO_ACID_METABOLIC_PROCESS	0.526581701456818	0.998775096932903	-0.315433271082334	-0.949688880059069	27723	18	ADI1 MTHFD2L
GO_MRNA_METABOLIC_PROCESS	2.52908447142135e-05	0.000929728054544046	0.337382679798622	1.85144090949543	0	430	RPS26 GSPT1 ZFP36L2 CEBPG RPL8 POLR2L KIAA1429 RPS3 PRPF3 XRN2 RBM8A RPS19 SF3B5 RPL10 FAU RPL13A RPSA DDX1 RPL19 RPL11 HNRNPH2 DIS3L RPL36A RPL9 RPLP0 RPL21 RPS27 RPS15A RALY RPL18 RPS27A RPL27A RPS23 RPL26 TSEN54 DIS3 RPS2 SNRPD2 POLR2A EIF4B RBM27 RPS4Y1 RPS16 RPS14 RPL10A SNRPC RPS18 RPL31 DDX23 RPL3 RPL14 NBAS RPL24 RPLP1 EXOSC8 RPL4 RPS7 HNRNPR RPL36 RPS25 RPL34 RPL30 RPL32 CWC22 RPL39 STRAP ERCC3 C1QBP RPL28 RPS13 RPL29 RPS12 RPL38 RPL23A RPL41 HNRNPA1 RPL7A CSDE1 SMG6 RPS28 RPS15 RPL18A RPS4X RPL37 ERN1 RPL5 RPL7 ZFP36 RPS29 TTF2 RPS11 RPS21 LSM5 RPL12 RPL22 RPS3A NSRP1 SRSF7 THOC7 CPSF7 LSM10 RPL35A CNOT6L
GO_PROTEIN_TRANSMEMBRANE_TRANSPORT	0.327683828370422	0.998775096932903	-0.329084153530584	-1.09186824465179	17419	26	PEX16 SRP54 AKT2 TIMM17A TIMM10 SRP9
GO_INTRINSIC_APOPTOTIC_SIGNALING_PATHWAY_BY_P53_CLASS_MEDIATOR	0.0843933098966656	0.742713728902743	0.415610013312273	1.38300308371441	3960	24	CDKN1A TOPORS DDIT4 PMAIP1 AEN
GO_RESPONSE_TO_RETINOIC_ACID	0.575132936465903	0.998775096932903	0.285368968167164	0.916505397663799	27147	21	CDKN2D CTSH HDAC2 AQP3 OVCA2
GO_ODONTOGENESIS_OF_DENTIN_CONTAINING_TOOTH	0.0986935140040946	0.789374339447092	0.455728455660085	1.37928566849508	4675	17	RUNX2 NFIC ITGA6 ATF2 HDAC2 PERP FOXO1
GO_REGULATION_OF_TRANSLATIONAL_INITIATION	0.0427699023347076	0.571185147308675	0.346152003900064	1.40548218555564	1939	56	RPL13A EIF3F DDX1 EIF3G EIF3K EIF2AK1 EIF4B EIF2S1 ATF4 CCL5
