pathway	pval	padj	ES	NES	nMoreExtreme	size	leadingEdge
"reactome_Transport of the SLBP Dependant Mature mRNA"	0.180288404805173	0.540258863278283	0.357802660553199	1.2270741074269	7638	26	NUP210 SLBP RANBP2 EIF4E RAE1 NUP205
"reactome_Transport of the SLBP independent Mature mRNA"	0.36861399633407	0.733659875056566	0.310872108439594	1.05496598764573	15685	25	NUP210 RANBP2 EIF4E RAE1 NUP205
"reactome_Transport to the Golgi and subsequent modification"	0.563773274917853	0.852998801401438	0.205498814956026	0.952736359148206	20588	105	TMED3 CTAGE5 COPB1 DCTN3 TRAPPC3 SEC24B DYNC1LI2 CAPZB TMED10 ARF3 COPB2 CTSZ AREG RAB1A SEC23A PPP6R3 ARF5 TMED9 ARF4 CNIH1 YKT6 GOLGB1 KDELR2 TBC1D20 NSF DYNLL1 ARFGAP3
"reactome_UCH proteinases"	0.00186250163377336	0.0401489263473887	-0.426800053504237	-1.70970271024632	113	67	PSME2 PSMB9 PSMD1 PSME1 PSMC4 PSMA4 UCHL3 PSMC3 INO80E USP15 BARD1 HCFC1 NFRKB PSMB10 PSMA6 MCRS1 PSMB2 ADRM1 PSMD6 PSMD3 PSME3 PSMB8 PSMD12 ASXL1 PSMD8 PSMA3 PSMD4 PSMC1 PSMA7 PSMD10
"reactome_Ub-specific processing proteases"	0.042690331620738	0.259934524879801	-0.305303510820283	-1.34428389983686	2741	116	MAT2B WDR48 PSME2 PSMB9 PSMD1 TRRAP PSME1 HGS KAT2A PSMC4 IFIH1 PSMA4 POLB USP47 PSMC3 USP24 TRAF6 USP15 USP48 TNKS2 PSMB10 NFKBIA PSMA6 MDM2 USP10 PSMB2 ADRM1 PSMD6 PSMD3 PSME3 PTEN PSMB8 PSMD12 BECN1 MUL1 PSMD8 PSMA3 PSMD4 PSMC1 USP4 VDAC3 PSMA7 PSMD10 TADA3
"reactome_Ubiquitin Mediated Degradation of Phosphorylated Cdc25A"	0.00601370253111547	0.0815970906886886	-0.449116937316593	-1.66122383467898	358	45	PSME2 PSMB9 PSMD1 PSME1 PSMC4 PSMA4 PSMC3 PSMB10 PSMA6 PSMB2 PSMD6 PSMD3 PSME3 PSMB8 PSMD12 PSMD8 PSMA3 PSMD4 PSMC1 PSMA7 PSMD10
"reactome_Ubiquitin-dependent degradation of Cyclin D"	0.00581657724514867	0.0814016281480754	-0.444315520551433	-1.65814510858585	347	47	PSME2 PSMB9 PSMD1 PSME1 PSMC4 PSMA4 PSMC3 PSMB10 PSMA6 PSMB2 PSMD6 PSMD3 PSME3 PSMB8 PSMD12 PSMD8 PSMA3 PSMD4 PSMC1 PSMA7 PSMD10
"reactome_Ubiquitin-dependent degradation of Cyclin D1"	0.00581657724514867	0.0814016281480754	-0.444315520551433	-1.65814510858585	347	47	PSME2 PSMB9 PSMD1 PSME1 PSMC4 PSMA4 PSMC3 PSMB10 PSMA6 PSMB2 PSMD6 PSMD3 PSME3 PSMB8 PSMD12 PSMD8 PSMA3 PSMD4 PSMC1 PSMA7 PSMD10
"reactome_Unfolded Protein Response (UPR)"	0.994252212898034	0.998291647912545	-0.147408603474323	-0.58214453489547	60542	62	CREB3 CXXC1 DDX11 CREBRF DNAJC3 EIF2AK3 HYOU1 DNAJB9 EIF2S1 PREB MBTPS1
"reactome_VEGFA-VEGFR2 Pathway"	0.399074004928683	0.75712739787276	0.259771347715932	1.02745662560409	16031	47	WASF2 BRK1 MTOR NRAS ITPR2 RHOA CYBA KRAS PDPK1 HSPB1 ELMO1 VAV1 CTNNA1 PIK3CA
"reactome_VEGFR2 mediated vascular permeability"	0.520416997968018	0.835377593472729	-0.322113181747553	-0.955266960353247	29452	18	THEM4 JUP RICTOR PAK2 TRIB3
"reactome_Vasopressin regulates renal water homeostasis via Aquaporins"	0.363039600428113	0.729045529483952	-0.381135761739465	-1.0758796762786	20351	15	ADCY3 ADCY7 GNG7 GNG5
"reactome_Vesicle-mediated transport"	0.0461849564871989	0.271921560991812	0.220736923435426	1.20118510510917	1278	343	SNX9 TMED3 DNM2 CTAGE5 COPB1 PUM1 CBL PAFAH1B2 SYS1 YWHAH SNX5 KIF3B AP1B1 NAA30 SH3GL1 AP2A1 APP DCTN3 TRAPPC3 SEC24B DYNC1LI2 UBA52 SNF8 RALGAPB VAMP7 RAB4A EXOC8 TRAPPC8 TBC1D1 EXOC3 ARPC3 CAPZB TMED10 CUX1 ARF3 COPB2 DENND4A CYTH1 CTSZ AREG YWHAZ RAB1A VPS51 WASL CLINT1 HPS1 YWHAB LDLRAP1 MYH9 NAA38 SEC23A TBC1D10C PRKAG2 TSG101 RPS27A OPTN PPP6R3 ACBD3 FTH1 SH3KBP1 GRB2 NECAP1 AP1S1 TBC1D10A FNBP1 HSPA8 ARF5 TMED9 BIN1 STX10 ARF4
"reactome_Vif-mediated degradation of APOBEC3G"	0.0039445753731468	0.0635722930375549	-0.454760798125617	-1.69712593440971	235	47	PSME2 PSMB9 PSMD1 PSME1 RBX1 PSMC4 PSMA4 PSMC3 PSMB10 PSMA6 PSMB2 PSMD6 PSMD3 PSME3 PSMB8 PSMD12 PSMD8 PSMA3 PSMD4 PSMC1 PSMA7 PSMD10
"reactome_Viral Messenger RNA Synthesis"	0.202301124029138	0.568427642590593	0.32059590148177	1.18610008902655	8386	35	NUP210 RANBP2 POLR2I POLR2L POLR2H POLR2C RAE1 NUP205 POLR2K
"reactome_Viral mRNA Translation"	2.65858456957516e-05	0.00163528245787909	0.722485351758145	3.22028373799271	0	84	RPS26 RPS2 RPL3 RPL7 RPL21 RPL10A RPS6 RPL6 RPL27A RPL4 RPS20 RPS3 RPS9 RPL11 RPS8 RPS29 RPS18 RPL23 UBA52 RPL12 RPL38 RPS10 RPS16 RPL27 RPS4Y1 RPS28 RPL29 RPL15 RPL23A RPL8 RPL36A RPS19 RPL9 RPS14 RPS11 RPL26 RPL22 RPL24 RPS27 RPLP2 RPL5 RPL13 RPL34 RPL7A RPL37 RPS4X RPL31 RPL39 RPS3A RPS7 RPS27A RPS23 RPS25 RPS13 RPL19 RPLP1 RPS21 RPLP0 RPL37A RPL10 RPL13A RPS12 RPL35 RPL32
"reactome_Vpr-mediated nuclear import of PICs"	0.263148000187996	0.644137583945124	0.336871888657002	1.14319803893302	11197	25	NUP210 KPNA1 RANBP2 RAE1 NUP205
"reactome_Vpu mediated degradation of CD4"	0.00737803653884762	0.0930017576842554	-0.44126372854368	-1.63962428515805	440	46	PSME2 PSMB9 PSMD1 PSME1 PSMC4 PSMA4 PSMC3 PSMB10 PSMA6 PSMB2 PSMD6 PSMD3 PSME3 PSMB8 PSMD12 PSMD8 PSMA3 PSMD4 PSMC1 PSMA7 PSMD10
"reactome_XBP1(S) activates chaperone genes"	0.434786838201318	0.781129412106795	0.268976509117746	1.00788745116305	17877	37	LMNA ZBTB17 SEC61A1 TLN1 SSR1
"reactome_mRNA 3'-end processing"	0.855478613034674	0.965257210908267	0.195814105190023	0.785866996770895	34219	50	NUDT21 SRSF4 CASC3 RNPS1 EIF4A3 CPSF1 PCF11 CPSF7 CPSF3 RBM8A SRSF9 FYTTD1
"reactome_mRNA Capping"	0.32476382948724	0.705193920568149	0.321031346579845	1.08944206448696	13819	25	GTF2H1 POLR2I POLR2L POLR2H POLR2C RNGTT ERCC3 POLR2K
"reactome_mRNA Splicing"	0.88558902135071	0.971993098724313	-0.175370574885438	-0.817159226302979	58981	172	PRCC CWC27 USP39 RBM5 SF3A2 PCBP1 SRSF3 GPKOW TRA2B SF3B4 CSTF2T SF3B3 U2AF2 SRSF10 PUF60 PRPF6 SNRPD1 POLR2B RBMX PLRG1 ZMAT5 SMNDC1 SNRPG PRPF31 SNRNP40 BUD31 GCFC2 RNPC3 HNRNPA3 FUS U2AF1 PAPOLA SF3A1 HNRNPR SNRNP35 DDX23
"reactome_mRNA Splicing - Major Pathway"	0.957509047044632	0.986237870172995	-0.163557439976698	-0.75724369322328	63501	164	PRCC CWC27 USP39 RBM5 SF3A2 PCBP1 SRSF3 GPKOW TRA2B SF3B4 CSTF2T SF3B3 U2AF2 SRSF10 PUF60 PRPF6 SNRPD1 POLR2B RBMX PLRG1 SMNDC1 SNRPG PRPF31 SNRNP40 BUD31 GCFC2 HNRNPA3 FUS U2AF1 PAPOLA SF3A1 HNRNPR DDX23
"reactome_mRNA Splicing - Minor Pathway"	0.927333050614913	0.981261492275624	0.181121311204191	0.72383947440151	37173	49	POLR2I SF3B1 POLR2L TXNL4A POLR2H POLR2C SF3B2 YBX1 POLR2K ZRSR2 SNRPE SNRNP200 GTF2F1 POLR2D SNRPF
"reactome_mTOR signalling"	0.00354015718297892	0.0604253058262492	0.528040729942684	1.81090075288339	149	26	LAMTOR4 MTOR RPS6 STRADB EIF4EBP1 EIF4E YWHAB PRKAG2 LAMTOR2 CAB39 RHEB RRAGC
"reactome_mTORC1-mediated signalling"	0.0236137028589859	0.180341222120198	0.521745559984544	1.6195452317174	1024	18	LAMTOR4 MTOR RPS6 EIF4EBP1 EIF4E YWHAB LAMTOR2 RHEB RRAGC
"reactome_p53-Dependent G1 DNA Damage Response"	0.0108054027013507	0.110668410941182	-0.419298144748465	-1.59044452227572	647	51	PSME2 PSMB9 PSMD1 PSME1 PSMC4 PSMA4 PSMC3 PSMB10 RFWD2 PSMA6 MDM2 PSMB2 PSMD6 PSMD3 PSME3 PSMB8 PSMD12 PSMD8 PSMA3 PSMD4 PSMC1 PSMA7 PSMD10
"reactome_p53-Dependent G1/S DNA damage checkpoint"	0.0108054027013507	0.110668410941182	-0.419298144748465	-1.59044452227572	647	51	PSME2 PSMB9 PSMD1 PSME1 PSMC4 PSMA4 PSMC3 PSMB10 RFWD2 PSMA6 MDM2 PSMB2 PSMD6 PSMD3 PSME3 PSMB8 PSMD12 PSMD8 PSMA3 PSMD4 PSMC1 PSMA7 PSMD10
"reactome_p53-Independent DNA Damage Response"	0.00601370253111547	0.0815970906886886	-0.449116937316593	-1.66122383467898	358	45	PSME2 PSMB9 PSMD1 PSME1 PSMC4 PSMA4 PSMC3 PSMB10 PSMA6 PSMB2 PSMD6 PSMD3 PSME3 PSMB8 PSMD12 PSMD8 PSMA3 PSMD4 PSMC1 PSMA7 PSMD10
"reactome_p53-Independent G1/S DNA damage checkpoint"	0.00601370253111547	0.0815970906886886	-0.449116937316593	-1.66122383467898	358	45	PSME2 PSMB9 PSMD1 PSME1 PSMC4 PSMA4 PSMC3 PSMB10 PSMA6 PSMB2 PSMD6 PSMD3 PSME3 PSMB8 PSMD12 PSMD8 PSMA3 PSMD4 PSMC1 PSMA7 PSMD10
"reactome_p75 NTR receptor-mediated signalling"	0.13939560302448	0.4746553463496	0.310830852058657	1.23554617494691	5585	48	BCL2L11 ARHGDIA PREX1 ADAM17 ARHGEF3 UBA52 NFKB1 RHOA ARHGEF7 MAPK8 RPS27A RTN4 VAV1 RIPK2 HDAC3 UBC
"reactome_rRNA modification in the nucleus and cytosol"	0.0347184921138728	0.228625403414287	0.388850390611371	1.47573658849727	1421	39	RPS2 RPS6 NOP2 RPS9 FBL NHP2 NOP14 RPS14 RPS7 GAR1 NOP10 NOP56
"reactome_rRNA processing"	2.99643424325053e-05	0.00163528245787909	0.547730745552393	2.73725673380512	0	171	RPS26 MT-CO3 RPS2 NIP7 MT-ND4 MT-ND3 BOP1 RPL3 MT-CO1 RPL7 RPL21 MT-ATP6 RPL10A RPS6 RPL6 RPL27A RPL4 NOP2 RPS20 RPS3 RPS9 RPL11 RPS8 MT-CYB FBL RPS29 RPS18 RPL23 UBA52 NHP2 RPL12 RPL38 RPS10 RPS16 NOP14 RPL27 RPS4Y1 RPS28 RPL29 RPL15 RPL23A RPP30 NOL12 RPL8 RPL36A RPS19 RPL9 RPS14 RPS11 MT-CO2 MT-ATP8 RPL26 RPL22 RPL24 RPS27 RPLP2 RPL5 RPL13 RPL34 RPL7A RPL37 RPS4X RPL31 RPL39 RPS3A NCL RPS7 RPS27A RPS23 RPS25 RPS13 RPL19 RPLP1 RPS21 MT-ND2 RPLP0 XRN2 GAR1 RPL37A
"reactome_rRNA processing in the mitochondrion"	0.000411993591210803	0.0119702051011574	0.686581044262745	2.0593087481889	17	16	MT-CO3 MT-ND4 MT-ND3 MT-CO1 MT-ATP6 MT-CYB MT-CO2 MT-ATP8 MT-ND2
"reactome_rRNA processing in the nucleus and cytosol"	2.93375579416769e-05	0.00163528245787909	0.53177837527307	2.61939259086531	0	154	RPS26 RPS2 NIP7 BOP1 RPL3 RPL7 RPL21 RPL10A RPS6 RPL6 RPL27A RPL4 NOP2 RPS20 RPS3 RPS9 RPL11 RPS8 FBL RPS29 RPS18 RPL23 UBA52 NHP2 RPL12 RPL38 RPS10 RPS16 NOP14 RPL27 RPS4Y1 RPS28 RPL29 RPL15 RPL23A RPP30 NOL12 RPL8 RPL36A RPS19 RPL9 RPS14 RPS11 RPL26 RPL22 RPL24 RPS27 RPLP2 RPL5 RPL13 RPL34 RPL7A RPL37 RPS4X RPL31 RPL39 RPS3A NCL RPS7 RPS27A RPS23 RPS25 RPS13 RPL19 RPLP1 RPS21 RPLP0 XRN2 GAR1 RPL37A RPL10 RPL13A RPS12 RPL35 RPL32
"reactome_snRNP Assembly"	0.891690099873946	0.973277517903713	0.197854969253921	0.736546027241607	36783	36	NUP210 RANBP2 DDX20 RAE1 NUP205
"reactome_tRNA Aminoacylation"	0.904890556167401	0.977337562862936	-0.207405026091432	-0.694475672976025	52584	29	CARS FARSB TARS2 PPA1 IARS AIMP1 SARS FARS2 MARS EPRS DARS PPA2
"reactome_tRNA modification in the nucleus and cytosol"	0.799922286198735	0.943181416413419	-0.253778547540023	-0.76326341514172	45289	19	TYW1 WDR4 TRMT1 PUS1
"reactome_tRNA processing"	0.135466303607897	0.466025005848015	0.275182513453933	1.207578464844	5173	77	NUP210 MT-CO3 MT-ND4 MT-ND3 MT-CO1 MT-ATP6 RANBP2 MT-CYB RPP30 MT-CO2 MT-ATP8 QTRT1 RAE1 CPSF1 NUP205 MT-ND2 POP5
"reactome_tRNA processing in the mitochondrion"	0.000709544518196384	0.0182366586263359	0.671259027172639	2.01335239081897	30	16	MT-CO3 MT-ND4 MT-ND3 MT-CO1 MT-ATP6 MT-CYB MT-CO2 MT-ATP8 MT-ND2 MT-ND5 MT-ND6 TRNT1 MT-ND4L
"reactome_tRNA processing in the nucleus"	0.743953661676038	0.922778718171717	-0.231650094193945	-0.830255971295775	43925	39	POP4 NUP62 ZBTB8OS RTCB NUP160 NUP50 RPP38 TSEN15 RPP14 SEC13 NUP133 NUP54 CSTF2
"reactome_trans-Golgi Network Vesicle Budding"	0.0573502631775888	0.300481645379057	0.343947381213737	1.37456321392712	2298	49	SNX9 DNM2 PUM1 SNX5 AP1B1 APP VAMP7 CTSZ CLINT1 FTH1 NECAP1 AP1S1 HSPA8 TPD52 AP1S2 GOLGB1
GO_POSITIVE_REGULATION_OF_VIRAL_TRANSCRIPTION	0.927398816079295	0.981261492275624	-0.200426510878281	-0.671108789634973	53892	29	ZNF639 SUPT5H SMARCB1 POLR2B JUN
GO_CARDIAC_CHAMBER_DEVELOPMENT	0.348447838357009	0.723584766992022	0.308908239511237	1.0701012655468	14692	27	HES1 DNM2 SAV1 RBPJ ARID1A WHSC1 PRDM1 CITED2 NACA NOTCH2
GO_CIRCADIAN_RHYTHM	0.465799495524012	0.797618226480259	-0.253479704151658	-0.993948993096037	28253	60	FAS CSNK1E RBM4B PML SETX AHR JUN THRAP3 CRY2 CREB1 TIMELESS HNRNPR ID2 PTEN CLOCK
GO_POSITIVE_REGULATION_OF_KINASE_ACTIVITY	0.20673323478838	0.573234374055331	0.220832317066068	1.10803883601388	6852	176	SNX9 PTPN1 MAP3K8 ILK ADAM17 STRADB MAP4K2 RPS3 ACSL1 CCND2 UBA52 FBXW7 CDKN1A DUSP5 TGFB1 ZNF622 RHOA PTPLAD1 CXCR4 MIF CCNH PRKAG2 TNFRSF10A RPS27A PIK3CG TNFRSF10B KRAS RAF1 RPLP1 PIBF1 MAP2K1 LAMTOR2 PDPK1 GADD45B MAPK8IP3 MAPKAPK5 RIPK2 SHC1 CIB1 SOD1 SPAG9 PIK3CA BAK1 CAB39 HMGB1 MAPK1 UBC
GO_NEGATIVE_REGULATION_OF_TRANSCRIPTION_FACTOR_IMPORT_INTO_NUCLEUS	0.793263830384723	0.941383012046199	-0.250141145514386	-0.772261655703943	45196	21	CREB3 PPM1B NFKBIL1 ZC3H12A NFKBIA
GO_POTASSIUM_ION_TRANSPORT	0.643894729364967	0.881429164452045	-0.301976643779019	-0.867490187835338	36258	16	TMEM38B SLC12A6 ATP1B3 KCNA3 KCNN4
GO_REGULATION_OF_T_CELL_RECEPTOR_SIGNALING_PATHWAY	0.23344014648661	0.609379667512066	0.396672319638365	1.18976599313608	10198	16	PAWR PRNP EZR PTPN22
GO_NEGATIVE_REGULATION_OF_EPITHELIAL_CELL_PROLIFERATION	0.576930977814298	0.857009736957059	-0.269424123206197	-0.923660589703108	33701	32	BRCA2 STAT1 EAF2 ATF2 TINF2 MED1 LIMS2 CDK6 PTEN AIMP1 RUNX3 MEF2C
GO_MOVEMENT_IN_ENVIRONMENT_OF_OTHER_ORGANISM_INVOLVED_IN_SYMBIOTIC_INTERACTION	0.50078853046595	0.822114016254132	0.272631516146252	0.969546910021225	20957	30	CTSB DYNLT1 SIVA1 CXCR4 ICAM1 ITGB7
GO_REGULATION_OF_PROTEIN_TARGETING_TO_MITOCHONDRION	0.677650574095213	0.896310992641778	-0.237043964470722	-0.872497363085662	40368	44	KAT2A U2AF2 ATG13 PDCD5 RAC2 VPS11 SNIP1 UBE2D3 USP36 ITGAX UBE2J2 U2AF1 UBE2L3 HTRA2 PSMD8
GO_REGULATION_OF_ESTABLISHMENT_OF_PLANAR_POLARITY	0.141913210102912	0.477493250539957	-0.320611610782209	-1.24069775289848	8590	56	PSME2 PSMB9 PSMD1 PSME1 PSMC4 PSMA4 PSMC3 PSMB10 PSMA6 PSMB2 PSMD6 PSMD3 PSME3 PSMB8 PSMD12 PSMD8 PSMA3 PSMD4 PSMC1 PSMA7 PSMD10
GO_NEGATIVE_REGULATION_OF_RESPONSE_TO_ENDOPLASMIC_RETICULUM_STRESS	0.0444205375579115	0.265114690853262	-0.456304505334959	-1.48617830676238	2559	26	CREB3 PPP1R15B UBE2J1 ERLEC1 TXNDC12 UBAC2 DNAJC3 NCK1 HYOU1
GO_CYTOPLASMIC_TRANSLATION	0.000340475206109098	0.0102257328756137	0.528281652779778	1.97953512841276	13	37	EIF3M RPL7 RPL6 EIF4EBP1 EIF3F RPL29 RPL15 PTBP1 RPL8 RPL36A RPL9 RPL26 RPL22 RPLP2 RPL31 EIF3J RPLP1 RPLP0
GO_MEIOTIC_CHROMOSOME_SEGREGATION	0.654597477833904	0.884971506837503	-0.287080403352134	-0.863421952749004	37061	19	BRCA2 SMC4 RAD51C MLH1 TOP2B
GO_POSITIVE_REGULATION_OF_CALCIUM_ION_TRANSPORT	0.462745745911118	0.795104608854243	0.288894702245341	0.990756212796115	19606	26	ORAI1 HTT TSPO SRI PDPK1 BAK1 STIM1 P2RX5 CALM1
GO_REGULATION_OF_DOUBLE_STRAND_BREAK_REPAIR	0.344899843727802	0.723584766992022	-0.37937746769009	-1.08984001738825	19421	16	SIRT6 RNF169 PML HELB
GO_REGULATION_OF_G_PROTEIN_COUPLED_RECEPTOR_PROTEIN_SIGNALING_PATHWAY	0.383278026258837	0.747818274594293	0.288356131796271	1.0420948160251	15938	32	DNM2 PPP1R9B GIT2 DYNLT1 YWHAB RGS14 RGS2 PHB PDCL USP33 CALM1 UBQLN2
GO_DENDRITE_DEVELOPMENT	0.359332407098011	0.728427258541324	-0.351994756241964	-1.07379345694772	20431	20	FAS KIDINS220 PAK2 MECP2 MINK1 KLF7 PTEN
GO_MEMORY	0.971621810068331	0.98873540798024	0.179828449956151	0.582418581086596	41804	21	MTOR EIF2AK4 RGS14 ATAD1 PAIP2 EP300
GO_NEURON_DEVELOPMENT	0.426062356338775	0.772598241560827	0.204328524563448	1.01038015238091	14457	158	MTCH1 HES1 DNM2 FLOT1 CPNE1 PPP1R9B ILK WNK1 APP TSPO SEC24B RERE NRAS DYNLT1 SEMA7A EZR AREG ZNF335 CXCR4 BTG2 SPG11 GRB2 RTN4 KRAS EIF2AK4 NR4A2 ARF4 AHI1 MAPK8IP3 CTNNA1 SHC1 SOD1 PRDM1 MAP4 MTMR2 HMGB1 MAPK1 USP33 CALU RAB8A BLOC1S2 LYN CDK16 ACSL4 EHD1 SIAH2 PPT1
GO_ENDOTHELIAL_CELL_DEVELOPMENT	0.568299297651886	0.852998801401438	0.288504834377318	0.921824052509636	24516	20	MYADM EZR RAB1A ICAM1
GO_REGULATION_OF_CELL_ACTIVATION	0.832024539877301	0.956628488940359	0.172219000389326	0.873786225816466	27123	191	NFATC2 ICOSLG HES1 MAP3K8 HLA-DRB5 PELI1 CCDC88B MTOR ZEB1 PAWR VAMP7 MAD1L1 CDKN1A PRNP TGFB1 CD27 PTPN22 STAT6 ZNF335 GPR183 MIF PNP TBC1D10C AP3D1 GRB2 C10orf54 CLPTM1 PIBF1 PDPK1 HMOX1 WHSC1 SLC39A10 VAV1 TNFRSF13B RIPK2 SOD1 PRDM1 PIK3CA HMGB1 EBI3 ZC3H8 FBXO7
GO_ATP_DEPENDENT_CHROMATIN_REMODELING	0.835139952787012	0.956628488940359	0.212647790003034	0.77442633050764	34669	33	HIST1H4C ARID1A MBD2 STRA13 ACTB PSME4 CHD4 NASP
GO_ANATOMICAL_STRUCTURE_FORMATION_INVOLVED_IN_MORPHOGENESIS	0.504957231726283	0.825160431601741	0.188490249807174	0.984013634785932	15584	238	BCL2L11 BBIP1 ATP6V1D WASF2 DUSP2 RHOB IFT57 ACTG1 ILK ADAM17 FAM105B SEC24B NR4A1 RBPJ ARID1A KDM6B DUSP5 RAB1A UBP1 MKKS GNPAT MYH9 PRKDC GNAS NCL SRPK2 RPS7 GRB2 PIK3CG PRKX PIBF1 MAP2K1 HMOX1 TBPL1 AHI1 C1GALT1 IPMK IQCB1 SHC1 SMAD2 CIB1 PIK3CA MTMR2 BAK1 ITGB2 MAPK1 JUNB CITED2 STIM1 TBC1D20 RAB8A CCNB1IP1 PRKD2 UBE2B EP300 CUL3 EHD1 E2F4 SNX10 TXNRD1 CNOT2 FLNA POFUT2 RBM15 SYK ADAM8 HERC1 SSBP3 ADAM15 PAF1 PFN1
GO_ION_TRANSPORT	0.0104306516575442	0.110668410941182	0.245793087305607	1.31631721733499	302	295	SLC25A37 ATP6V1A ORAI1 TSC22D3 DNM2 LASP1 UCP2 ATP6V1D COX8A SLC39A6 MCOLN2 SLC25A6 ATP5E WNK1 TSPO SLC38A2 TPT1 SRI SLC25A3 ACSL1 UBA52 PAWR SLC1A5 SLC25A25 OSTM1 COX6A1 ATP5J ITPR2 ATP5O NIPAL2 ATP6V1B2 ATP6V1F SLC25A24 PRKCE NPC2 ATP5I SERINC3 CLIC1 UQCRC1 SLC37A1 PRKAG2 RPS27A ORAI2 FTH1 SLC36A4 CCS SLC5A6 UQCRB NFKBIE RAF1 ATP5G3 SLC16A1 ATP6V1H CA5B REST ATP6V0A2 GAR1 ABCC1 ATP5A1 SLC39A10 SLC25A1 TMCO3 ATP5J2 CPT1A GLS NCOA2 MICU1 SLC25A42 COX7A2 SLC7A6 SLC23A2 BAK1 EFCAB4A PLIN2 UBC ATP11B SLC7A7 SLC38A10 STIM1 ATP5D TAF7 P2RX5 CALM1 NSF NIPA2 COX7B LYN SLC12A9 ACSL4 ATP6V1E1 ITPR1
GO_LIPID_MODIFICATION	0.825359087033515	0.954907848862623	-0.201646854340046	-0.800941838479919	50336	64	ACADM PIP5K1A IP6K2 IMPA1 HADH PI4KB PHYH PIK3C3 LCK INPP5K FRS2 PIP4K2C PTEN HACL1 AGK MTMR3 PIK3R1 INPP5F ETFA CD86 POR PI4K2B EFR3A INPP5B CD80
GO_NEGATIVE_REGULATION_OF_PROTEIN_COMPLEX_ASSEMBLY	0.740007443245255	0.922374191314698	0.216697181522553	0.848913985257313	29825	45	INSIG1 MYADM TFIP11 EIF4EBP1 CAPZB MKKS SIRT2 RAF1 MAPRE1 DNAJC15
GO_SINGLE_FERTILIZATION	0.201963387367244	0.568261194139625	-0.385154959971805	-1.2168640513235	11561	23	WDR48 ADCY3 TCP1 TARBP2 HEXB UBE3A CCT5
GO_LEUKOCYTE_ACTIVATION	0.630361165396148	0.87448927521703	-0.198271687467528	-0.93103819076422	42254	182	BST2 FAS TICAM1 ZNF3 FUT7 BATF NBN CD40 IRF1 BRAF CD79B B2M BLNK CEBPB CD3E BAX MLH1 BTK SNAP23 JUN RNF168 TRAF6 BANK1 VAMP2 LCK NCK1 SP3 HELLS PSMB10 LGALS1 AZI2 JMJD6 DOCK8 MSH6 POLM NCSTN BTN3A1 HSPD1 LCP2 IKZF3 RELB HDAC9 ID2 CDK6
GO_CHROMOSOME_ORGANIZATION	0.0264650283553875	0.193281477579101	-0.24047132005913	-1.25078775169766	2001	480	RCC2 H1FX CHMP5 H2AFJ CHAMP1 WAPAL SMC1A BRCA2 ING3 MAD2L1 UTP3 TTF1 SIRT6 EED MSH3 SFMBT1 NBN GTF2H5 TRRAP CXXC1 HOPX COPS5 RBX1 SMC4 KAT7 VPS72 SKA2 KAT2A ZNF207 ING4 NSL1 PCGF1 CHD9 RAD51C ATF2 SIN3B HELB AKAP8L MSL2 ESCO1 CHMP3 SETX EZH2 SUPT5H TBL1X SRCAP DDX11 SMARCB1 MIS18BP1 MLH1 WRN NUP160 TRIM37 UBE2E1 TINF2 CHAF1A NDE1 KAT6B RNF168 C17orf49 USP15 KIF22 PDCD6IP CHMP7 ARID4B MBD1 PRMT2 MECP2 PHF1 TOP2B XRCC5 HCFC1 MED24 CUL4B HELLS GTF2H3 DPY30 PPP5C BRD3 CREBBP SUPT16H PIH1D1 JMJD6 JAK2 ASF1A ARID1B MCRS1 SUPT4H1 MSH6 POGZ SPIN1 MCM7 RUVBL2 JARID2 CHD6 CCDC101 COPS7B COPS6 SMARCA5 CHD8 MBIP MCM3 HDAC9 SMARCC2 ING5 PBRM1 G3BP1 XPC MAU2 PKN1 SETD2 HDAC8 MEI1 MEAF6 KDM2B PRKCD BECN1 RNF2 RCOR1 SMCHD1 ASXL1 CLOCK SEC13 ASCC3 HIST1H1D PTGES3 VRK1 SIRT7 SUPT6H NUP133
GO_NEGATIVE_REGULATION_OF_MAP_KINASE_ACTIVITY	0.600908004778973	0.865278141041095	0.256145717886847	0.910919224610618	25147	30	PTPN1 DUSP2 DUSP10 DUSP5 PTPN22
GO_SYNAPTIC_VESICLE_LOCALIZATION	0.319558557303997	0.701651626039304	-0.341192492227105	-1.1012212823891	18357	25	DTNBP1 AP3M1 SNAP47 RAB5A SNAP23 VAMP2
GO_REGULATION_OF_ANTIGEN_RECEPTOR_MEDIATED_SIGNALING_PATHWAY	0.183461014240729	0.545496981994947	0.360975741818788	1.22499613070951	7806	25	PAWR PRNP EZR PTPN22 PLCL2 ELF1 SLC39A10 PRKD2 LYN
GO_CARBOHYDRATE_CATABOLIC_PROCESS	0.599114791067131	0.864705095314493	-0.250284217664063	-0.916450860986704	35599	43	FUT7 HK1 PHKB CRYL1 PHKG2 OGDH AGL GALT HEXB DHTKD1 GM2A RBKS TPI1 CTBS
GO_NEUROLOGICAL_SYSTEM_PROCESS	0.834804647454152	0.956628488940359	0.177663096241069	0.852996723263564	29314	130	TIMM10 DRAM2 MTOR HTT APP NIPSNAP1 PNKD PAWR RPL38 PRNP GNB1 FOS MKKS HPS1 ICAM1 BTG2 GNAS PNOC EIF4A3 KRAS EIF2AK4 RGS14 ARF4 MYO5A FBXO11 GLS SOD1 MAPK1 ATAD1 PDCL GMFB
GO_POSITIVE_REGULATION_OF_MITOTIC_NUCLEAR_DIVISION	0.960261507200283	0.986445134694103	-0.197624005971717	-0.586078726903478	54345	18	PHIP SH2B1 PTEN BECN1 GOLGA2
GO_HINDBRAIN_DEVELOPMENT	0.758960876067345	0.925487395315302	0.223165717735227	0.825640241968218	31464	35	HES1 SEC24B RERE GNPAT MAP2K1 AHI1 NCOA2 GART
GO_OLIGOSACCHARIDE_METABOLIC_PROCESS	0.560309949941713	0.852022565874728	-0.27398258900805	-0.932149437331037	32683	31	MAN2A1 MOGS KIAA2018 HEXB MAN1B1 MGAT4A GM2A EDEM3 CTBS
GO_CHROMOSOME_SEGREGATION	0.0425998166078672	0.259934524879801	-0.30273829833173	-1.34053163193398	2740	121	RCC2 CHMP5 CHAMP1 WAPAL SMC1A BRCA2 MAD2L1 CDK5RAP2 SMC4 SKA2 ZNF207 NSL1 RAD51C AKAP8L ESCO1 CHMP3 RCC1 DDX11 MLH1 NUP160 NDE1 KIF22 CHMP7 TOP2B
GO_NEGATIVE_REGULATION_OF_CYCLIN_DEPENDENT_PROTEIN_KINASE_ACTIVITY	0.838262575811631	0.956628488940359	-0.255512376694181	-0.721266804952367	46992	15	FBXO31 DNAJC3 APC PTEN HHEX ANAPC10 TNFAIP3 CDKN1B
GO_HEMATOPOIETIC_PROGENITOR_CELL_DIFFERENTIATION	0.651503352068802	0.884443098059882	-0.245447358655072	-0.884505739370705	38482	40	BATF FLI1 BRAF C12orf29 MED1 ABI1 XRCC5 SP3 ZBTB24 FAM115C ADAR DHTKD1 CDK6
GO_NEGATIVE_REGULATION_OF_ERK1_AND_ERK2_CASCADE	0.282189508604603	0.6710787869218	0.365826924307825	1.13555973703759	12248	18	PTPN1 EZR TBC1D10C RGS14 PHB LYN PIN1 VRK3
GO_STEROID_BIOSYNTHETIC_PROCESS	0.128221742260619	0.454557980189171	0.358160286866265	1.28396572191033	5342	31	INSIG1 TSPO MVD CYB5R3 PRKAG2 ACBD3 IDI1 FDPS CYP51A1 AKR1B1 FDFT1 ACAA2 HMGCS1 MSMO1
GO_REGULATION_OF_PROTEIN_TYROSINE_KINASE_ACTIVITY	0.204085901547901	0.57053021404892	0.373779095591049	1.21057535972229	8780	21	PTPN1 ADAM17 APP FBXW7 SOCS4 SHC1 RAP2B
GO_REGULATION_OF_INTERFERON_BETA_PRODUCTION	0.077271548370364	0.350407725375201	-0.424583711545041	-1.39552274011269	4468	27	IRF7 TICAM1 NMI PPM1B IRF1 IFIH1 TRIM38 TRAF3 RELB ZC3HAV1 RNF135 ZBTB20
GO_DNA_TEMPLATED_TRANSCRIPTION_ELONGATION	0.731485718020786	0.919710772614878	-0.214205576354786	-0.855940988422824	44763	66	TAF3 ZNRD1 GTF2H5 TAF2 ELP2 SUPT5H POLR2B GTF2H3 SUPT16H SUPT4H1 ADRM1 THOC7 SETD2 TAF11 GTF2F2
GO_RESPONSE_TO_NITROGEN_COMPOUND	0.00467624671468068	0.0708554678940973	0.255872689347757	1.36776211165747	136	290	HADHA LPIN1 PTPN1 KLF3 ATP6V1A DNM2 EIF2B5 FLOT1 KLF6 EGR1 JUND UCP2 ATP6V1D PELI1 APEX1 CTSB RGS10 PPP1R9B MTOR ZEB1 PMAIP1 APP TSPO ZCCHC11 EIF4EBP1 NR4A1 IPO5 CDKN1A NFKB1 ITPR2 KLF2 EZR TMED10 GNB1 PTPN22 AREG ATP6V1B2 STAT6 FOS SIRT2 ATP6V1F PRKCE METTL3 ICAM1 CYBA PRKDC BTG2 GNAS UQCRC1 MGST3 EEF2 GRB2 PIK3CG CASP4 STAT3 ATP6V1H PDE4B ATRX CAT LAMTOR2 ATP6V0A2 NR4A2 PDPK1 HMOX1 NLRP1 MYO5A FOSB GNB2 CREM UBR1 UROS CTNNA1 RIPK2 SHC1 SMAD2 AKR1B1 SOD1 PIK3CA
GO_NEGATIVE_REGULATION_OF_TRANSMEMBRANE_TRANSPORT	0.757562724014337	0.925487395315302	0.230711564614009	0.820468916211722	31703	30	MTOR SRI PAWR TGFB1 PRKCE
GO_REGULATION_OF_DNA_RECOMBINATION	0.708443963107882	0.911256510454723	-0.264257928584303	-0.834900253121473	40556	23	SIRT6 MSH3 CD40 HELB MLH1
GO_REGULATION_OF_LEUKOCYTE_PROLIFERATION	0.0826561163387511	0.361068554898684	0.281059976522789	1.26629023013375	3091	89	NFATC2 ICOSLG HES1 HLA-DRB5 PELI1 CCDC88B PAWR MAD1L1 CDKN1A PRNP TGFB1 PTPN22 ZNF335 GPR183 MIF PNP C10orf54 SLC39A10 TNFRSF13B RIPK2 PRDM1 HMGB1 EBI3 IL12RB1 CD74 TNFRSF14 FLT3LG LYN
GO_RESPONSE_TO_ETHANOL	0.0890956457015259	0.374453869434243	0.336531367479455	1.31836594423516	3590	45	TP53INP1 CTSB OXCT1 EIF4EBP1 ITPR2 CD27 PRKCE ICAM1 EEF2 STAT3 ATP5G3 CAT SOD1 BAK1
GO_SULFUR_COMPOUND_METABOLIC_PROCESS	0.928193630895053	0.981261492275624	-0.175266262656414	-0.755072306371206	58788	102	MAT2B GSTK1 MRI1 ACSL5 ACSL3 EIF2B2 THEM4 ISCA2 MTHFD1 OGDH MTRR FAR1 GSTM4 HEXB CNDP2 EIF2B1 CSGALNACT2 TXNL1 SUCLA2 AGK GSTO1 AGPAT6 B4GALT3 CHST11 ISCA1 ELOVL1 PCCB PMVK KEAP1 DLD HSD17B12 PDHB
GO_REGULATION_OF_CELL_CYCLE_CHECKPOINT	0.00916874777024617	0.105184818840635	-0.611501369705124	-1.72616154590079	513	15	LCMT1 MAD2L1 RINT1 CDK5RAP2 RNASEH2B THOC1 PCID2 FEM1B DYNC1LI1
GO_POSITIVE_REGULATION_OF_DNA_REPLICATION	0.995400765969088	0.998291647912545	-0.148218492241442	-0.511738792266204	58218	33	TCP1 JUN TNKS2 NVL CCT5 NEK7 CALR CCT8 ATF1 CCT7 TNKS CTNNB1 CTC1
GO_NEGATIVE_REGULATION_OF_NEURON_APOPTOTIC_PROCESS	0.834749091623294	0.956628488940359	0.203828996481279	0.786466488849467	34000	42	ILK LGMN OXR1 BTG2 KRAS NR4A2 HMOX1 SET PRDX2 SOD1 PIK3CA PPT1 ADAM8 PIN1 VEGFB SOD2
GO_NUCLEOTIDE_PHOSPHORYLATION	0.960138345444382	0.986445134694103	-0.192307218676612	-0.607578158242351	54965	23	HK1 AK2 OGDH DHTKD1 NME3 TPI1
GO_POSITIVE_REGULATION_OF_GENE_EXPRESSION_EPIGENETIC	0.324643109025025	0.705193920568149	0.288236113668507	1.08005551448109	13348	37	H3F3A HIST1H4C SF3B1 ARID1A TAF1D POLR2L ACTB ATAD2 POLR2K SLC50A1 WBP2 EP300
GO_REGULATION_OF_MRNA_METABOLIC_PROCESS	0.152664295555769	0.494371944841082	-0.288258614686566	-1.20564642262852	9528	85	RBM5 NSRP1 SRSF3 TRA2B SF3B4 U2AF2 SRSF10 NBAS GTPBP1 SUPT5H RBMX CDK11B CNOT7 BARD1 THRAP3 JMJD6 ZC3H12A PNPT1 RBM42 CNOT8 PAPOLA SF3A1 YTHDC1 SECISBP2 HNRNPR CDK11A ZC3HAV1
GO_POSITIVE_REGULATION_OF_PROTEIN_BINDING	0.823758099352052	0.954859236586312	0.216949224253836	0.777739402026373	34325	31	FLOT1 PACS1 ARHGEF7 SPPL3 PLCL2 MAPRE1 USP33 EP300 RALB AMFR
GO_SENSORY_PERCEPTION	0.730798714749392	0.919710772614878	-0.213584379051064	-0.857827954304508	44805	68	ADCY3 COCH FAM65B TRPV2 SLC9A3R1 PDE6D TBL1X EML2 COL18A1 DNAJC19 MECP2 PLCB2 HEXB ALOX5 TIMM9 RPGR
GO_HEPATICOBILIARY_SYSTEM_DEVELOPMENT	0.313660599374885	0.699261703193551	-0.292976982929574	-1.09336345165254	18765	47	FAS MAN2A1 ACAT1 PSMB9 RELA CEBPB AK2 RARA JUN MED1 SP3
GO_FATTY_ACID_CATABOLIC_PROCESS	0.382467245351516	0.747320867561844	0.319235176190577	1.04721771212327	16434	22	HADHA LPIN1 HADHB CPT1A DECR1 PEX2 ECI1 ETFB
GO_REGULATION_OF_VESICLE_FUSION	0.584191053988182	0.860242801934961	-0.292188462463648	-0.913195296702263	33316	22	TBC1D14 TBC1D22A RABGAP1L VPS11 TBC1D15 USP6NL TBCK
GO_MITOCHONDRIAL_RESPIRATORY_CHAIN_COMPLEX_I_BIOGENESIS	0.969917327484393	0.98873540798024	-0.173833807938128	-0.632887103272957	57486	42	NDUFS8 NDUFB4 NDUFA8 NDUFB3 NDUFA12 NDUFS1 NDUFAF3
GO_CARBOHYDRATE_TRANSPORT	0.703574834858172	0.90963399451591	-0.276457235471915	-0.831471752566692	39834	19	HK1 SLC2A6 BRAF
