pathway	pval	padj	ES	NES	nMoreExtreme	size	leadingEdge
GO_NEUROLOGICAL_SYSTEM_PROCESS	0.470819802708167	0.736344360432584	-0.209785309518157	-0.994872834593558	30736	191	FAM65B CDKN1B CYP4V2 ABCA7 COMT CLN8 MYO9A CCDC66 NIPSNAP1 EML2 TIMM13 HPS1 DRAM2 DNAJC19 ITGB1 KAT2B THRA C5AR1 COL4A3 BBS4 PRCD PPT1 APP PNKD UBR3 ARRB2 ALOX5 NF1 GPI HEXB PRR4 LRIG2 CNR2 ANK3 PARK2 FYN RGS14 PRKCZ GM2A HERC1 THRB CPEB3 FXN BEST1 CREB1 TRPV2 CRYZ BBS9 MKKS
GO_POSITIVE_REGULATION_OF_MITOTIC_NUCLEAR_DIVISION	0.163833351152928	0.424265847315677	-0.403074354087373	-1.26232721037211	9193	22	FAM178A TERF1 ANAPC11 GORASP1 RB1 ANKRD32 NSMCE2 SMC5 RANBP1
GO_HINDBRAIN_DEVELOPMENT	0.468089201087349	0.734124822332768	0.251222720277685	0.991236075640055	19457	47	HES1 EZH2 MECP2 BCL2 RORA AHI1 PTPN11 KDM2B ATP7A C5orf42 AARS HNRNPD HSPA5 ESR2 CTNNB1 PTBP2 ABAT ATF5 OGDH UQCRQ
GO_OLIGOSACCHARIDE_METABOLIC_PROCESS	0.951374757465335	0.98339651138157	0.179946354073261	0.675744082672896	40206	38	MOGS MAN2A1 MAN2B1 EDEM1 B4GALT1 GNPTAB MAN1B1 ST6GALNAC4 NEU1 ST3GAL1 SLC2A1 MPDU1 MGAT2
GO_CHROMOSOME_SEGREGATION	0.673223924370535	0.855345560199037	-0.196896593281242	-0.913762742099605	43154	162	UVRAG NEK6 DSN1 FAM96A TERF1 STAG3 MLH3 AKAP8 CEP57L1 ITGB3BP NCAPD3 SMC2 SPICE1 ATM AKAP8L RPS3 PPP1CC MRE11A ERCC2 CENPT DDX11 RB1 XPO1 CLIP1 PDS5B STRA13 FANCD2 RGS14 HDAC8 INCENP MAU2 TAOK1
GO_NEGATIVE_REGULATION_OF_CYCLIN_DEPENDENT_PROTEIN_KINASE_ACTIVITY	0.543457519309405	0.783233723963572	0.297940657117358	0.936394903171983	23922	19	TNFAIP3 DNAJC3 CDKN1A
GO_HEMATOPOIETIC_PROGENITOR_CELL_DIFFERENTIATION	0.0905180793157076	0.295672871122922	0.320523050528062	1.29685652226057	3724	53	ADAR PRRC2C PSEN1 TGFB1 SIN3A ZBTB24 C12orf29 BATF BCL2 PLEK EP300 PTPN11 BRAF
GO_ANTEROGRADE_AXONAL_TRANSPORT	0.903142877833297	0.965195551752456	-0.234814244978561	-0.662577517757031	49885	15	AP3B1 SPAST SPG7 AP3M1 KIF3B
GO_NEGATIVE_REGULATION_OF_ERK1_AND_ERK2_CASCADE	0.723897858696897	0.880560229200794	0.247972620618134	0.831554919410078	31608	24	ATF3 PTPN2 LYN SPRY1 TNIP1 RAPGEF1 GBP1 PTEN ITGB1BP1
GO_STEROID_BIOSYNTHETIC_PROCESS	0.796499063535514	0.920805643541392	0.208215491207593	0.817349700320298	33170	46	SQLE INSIG1 CYP2R1 HMGCS1 FDX1L GGPS1 MSMO1 MVD C14orf1 ACAA2 ACBD3 MED1 HMGCR HSD17B12 HSD17B8 STARD5 EBP
GO_REGULATION_OF_PROTEIN_TYROSINE_KINASE_ACTIVITY	0.0412205321446625	0.178003745228177	0.440501365034668	1.49274557612797	1793	25	SHC1 PSEN1 PTPN2 RAP2C MVP SNX6
GO_REGULATION_OF_INTERFERON_BETA_PRODUCTION	0.107670818298219	0.328989915985006	0.359783165508458	1.30847518190442	4624	33	TICAM1 RELB IRF1 REL TRAF3 TIRAP IFNAR1 RNF216 NMI HMGB1 IRF5 RNF135 IRF7
GO_DNA_TEMPLATED_TRANSCRIPTION_ELONGATION	0.860432323031238	0.949942706583584	-0.191311512268748	-0.793812059378282	51865	79	TCEA2 CCNH UBTF TCEB3 IKBKAP GTF2A1 CCNT1 POLR2E POLR2F TCEA1 TAF3 POLR2L ERCC2 TAF1B TAF1 RTF1 TBP POLR1B GTF2E2 ELL2 TAF9
GO_ENDOPLASMIC_RETICULUM_TO_CYTOSOL_TRANSPORT	0.00627690100430416	0.0462607233244367	0.599350029758002	1.79710149253337	279	16	HSP90B1 SEL1L DERL1 AUP1 DERL2 FAF2 UFD1L NPLOC4 SEC61B VCP RHBDD1
GO_REGULATION_OF_LYASE_ACTIVITY	0.838598390042617	0.939697060426333	0.241080450135777	0.734830381423963	37190	17	PARK7 GABBR1 ADCY7 CALM3 CALM2 GNAI3 ADCY3
GO_RESPONSE_TO_NITROGEN_COMPOUND	0.00734044722354381	0.0520218087813336	0.240220479396954	1.31196171872791	215	374	CCR7 TICAM1 HSP90B1 NFKBIA ZEB1 AKT2 ICAM1 KLF10 XBP1 PIK3CA SOCS3 STAT6 RFTN1 SHC1 TMBIM6 IL6 RAP1B TNFAIP3 ADAR INPP5K NFKB1 ZCCHC11 CDKN1A PTPN2 PDE3B ASNS SIN3A PANX1 PAK1 CDC5L ATP6V0D1 RELA RPS6KB1 FAS PRKRA LYN RANGAP1 HMGCS1 PRKAR1A RNF40 STAT1 ATP6V1F PEA15 BCL2 EP300 SESN2 PDE4D DDX21 SLC9A1 ATP6V0E1 KLF3 ATP6V1E1 SLC3A2 CEBPB PMAIP1 NRF1 ITPR3 HPRT1 ADSS TRAF2 PTK2 PRKCD BRAF NR4A1
GO_NEGATIVE_REGULATION_OF_TRANSMEMBRANE_TRANSPORT	0.830981258809404	0.936378222150687	-0.218337499910794	-0.77238814172424	47753	36	FKBP1A TRIM27 CAMK2D OAZ1 GSTM2 FCRL5 CRBN ANK3 SRI
GO_REGULATION_OF_DNA_RECOMBINATION	0.448783354884213	0.726801464983225	0.2693781136028	0.999323558384693	19088	36	CD40 HELB STAT6 TGFB1 UBE2B
GO_REGULATION_OF_LEUKOCYTE_PROLIFERATION	0.000290912937691738	0.00376151625608	0.374062893129092	1.75217382962937	10	115	CD40 TICAM1 IL15 IRF1 CD74 HES1 IL6 TNFAIP3 HLA-DPB1 SASH3 CDKN1A TGFB1 C10orf54 SLAMF1 LYN HLA-A PRKAR1A BCL2 TIRAP PAWR HLA-DRB1 HLA-DPA1 CEBPB HLA-DRB5 TNFRSF14 IL12RB1 TNFSF13B
GO_RESPONSE_TO_ETHANOL	0.692578201849302	0.86755388722692	0.21348788143322	0.883383612973263	28162	59	ICAM1 RARA GK RPS6KB1 EP300 POLB GABBR1 STAT3 ADCY7 BIRC2
GO_SULFUR_COMPOUND_METABOLIC_PROCESS	0.042937569589286	0.181806346848585	-0.284787217444831	-1.31009783470279	2737	152	HSD17B4 ABHD14B CSGALNACT1 SUCLG2 TXN ACOT8 G6PD SUCLG1 MGST3 SLC19A2 GLO1 MUT ACSF3 EIF2B4 SQRDL AMD1 GSTM2 HEXA THEM4 GSTZ1 GAMT MRI1 ACOT2 GCLM PAPSS1 PPT1 MPST HEXB MTHFD1 ST3GAL2 PCCA EXT2 SMS GSS ADI1 B4GALT4 HAGH STAT5A HMGCL MTHFR GSR MCCC1 GNS SUCLA2 B3GAT3 CHST12 VNN2
GO_REGULATION_OF_CELL_CYCLE_CHECKPOINT	0.932031995636959	0.974874866771532	0.204552893843111	0.652273307810195	41014	20	RINT1 DDX39B AKT1 MAD2L1 BRD4 NDRG1 GEN1 THOC1
GO_POSITIVE_REGULATION_OF_DNA_REPLICATION	0.125695588832366	0.361001407779976	0.326116511363502	1.26094585619093	5262	43	CALR CCT7 SHC1 IL6 CCT2 PARM1 ATF1 MAP2K7 CCT5 RAC1 CCT3 TNKS2
GO_NEGATIVE_REGULATION_OF_NEURON_APOPTOTIC_PROCESS	0.351042001433834	0.645210859682331	0.252892218864086	1.05373791606605	14199	61	KRAS PIK3CA HYOU1 MECP2 PSEN1 MAP2K4 BCL2 CEBPB KDM2B ADAM8 HSP90AB1 BRAF PARK7 ILK HIF1A ADNP NAIP HRAS LGMN CPEB4 AARS BTG2
GO_NUCLEOTIDE_PHOSPHORYLATION	0.0528543825750922	0.20889115729678	-0.425709775988391	-1.44245054039747	3008	30	RAD50 NME3 DHTKD1 TPI1 CMPK1 GPI PFKFB2 AK2 DTYMK
GO_POSITIVE_REGULATION_OF_GENE_EXPRESSION_EPIGENETIC	0.40604139653268	0.689314739585663	0.261094851392986	1.02492757529007	16909	46	TWISTNB SLC50A1 MYO1C ATAD2B EP300 DDX21 ZNRD1 HIST1H4H POLR1C ATAD2 HMGA1 H3F3B H3F3A TAF1D ARID1A POLR1A CTNNB1
GO_REGULATION_OF_MRNA_METABOLIC_PROCESS	0.0588929965085233	0.223296822502601	0.288198642118694	1.30279789556182	2293	93	JMJD6 TMBIM6 THRAP3 MAGOH ACIN1 RNF40 UPF1 ZC3H12A MBNL2 SUPT5H RBM15B U2AF2 SRSF2 RNPS1 WTAP SRSF9 RBM25 DAZAP1 DYRK1A PTBP1 SFSWAP PAPOLA RC3H1 AHCYL1 DHX34 SF3B4 IWS1 CNOT8 CDK11A FMR1 SRSF10 BTG2 SRSF4
GO_POSITIVE_REGULATION_OF_PROTEIN_BINDING	0.192207977546797	0.464305179617269	0.310169516021414	1.18567408140486	8080	41	TRAF4 TICAM1 ZNF268 DERL1 B2M EP300 TIRAP GNL3L HSP90AB1 TRAF2 PARK7
GO_SENSORY_PERCEPTION	0.0419613543929569	0.179989181626445	-0.31788877006348	-1.36277048535782	2568	95	FAM65B CDKN1B CYP4V2 CLN8 MYO9A CCDC66 NIPSNAP1 EML2 TIMM13 HPS1 DRAM2 DNAJC19 C5AR1 COL4A3 BBS4 PRCD PPT1 UBR3 ARRB2 ALOX5 HEXB PRR4 LRIG2 CNR2 FYN THRB FXN BEST1 TRPV2 CRYZ BBS9 MKKS
GO_HEPATICOBILIARY_SYSTEM_DEVELOPMENT	0.0402709450940644	0.176227450536978	0.33522949593184	1.39681652537098	1628	61	XBP1 PIK3CA HES1 RB1CC1 CEBPG RARA ASNS RELA FAS CAST HMGCS1 EP300 CEBPB MAN2A1 ARF6
GO_FATTY_ACID_CATABOLIC_PROCESS	0.0384728037077239	0.171706746093279	-0.399028042820331	-1.46134911589359	2232	42	HSD17B4 ECHS1 ACOT8 PEX13 HADHA MUT SCP2 ABCD1 PEX2 ACOX3 ECH1 PCCA
GO_REGULATION_OF_VESICLE_FUSION	0.766716196136701	0.906768793786883	0.229781054487432	0.815122979284456	33023	30	AKT2 ADPRH SLAMF1 TBC1D25 TBC1D15 TBC1D22B RABGAP1 VPS41 TBC1D12
GO_MITOCHONDRIAL_RESPIRATORY_CHAIN_COMPLEX_I_BIOGENESIS	0.603283500580244	0.818444196383043	-0.241892701931273	-0.916114121100472	35349	49	NDUFS7 NDUFS8 NDUFA3 NDUFAF2 NDUFV1 ECSIT TMEM126B NDUFB10 NDUFC1 NDUFA11 NDUFA2 NDUFB6 NDUFB11 NDUFB1 NDUFS5 NDUFS2 AIFM1 OXA1L NDUFB7
GO_REGULATION_OF_LIPID_STORAGE	0.0243375903285916	0.124339363922658	0.501802899062714	1.60013691662278	1070	20	NFKBIA IL6 NFKB1 PTPN2 ZC3H12A OSBPL8 NR1H2 ABHD5 EHD1 FBXW7 SREBF2
GO_CARBOHYDRATE_TRANSPORT	0.0571764429293523	0.218992307997752	0.37903228135376	1.40611233436587	2431	36	AKT2 SLC50A1 SLC37A3 PEA15 SESN2 SLC35A5 SLC2A3 BRAF
GO_REGULATION_OF_CELLULAR_RESPONSE_TO_GROWTH_FACTOR_STIMULUS	0.0317816367164856	0.149711997845874	0.316613771434416	1.39309951088605	1260	80	ZEB1 MYO1C HES1 PMEPA1 SLC9A6 STRAP TGFB1 C10orf54 TGFBR1 PPM1A SKIL SMAD4 PRKD2 NPTN SNX25 SMURF1 SNX6 CASK ILK UBB CHST11 HIF1A
GO_EMBRYO_DEVELOPMENT_ENDING_IN_BIRTH_OR_EGG_HATCHING	0.121718095462859	0.354437679281097	0.224573484065265	1.15306364911198	4125	217	PSMC4 RALA EIF2S2 SOCS3 MTHFD1L HES1 BCL10 SLC39A1 ADAR COPS3 INPP5K RARA PSEN1 SIN3A TGFBR1 FAS TRIM28 XAB2 NASP SKIL EP300 SMAD4 UBE2A TAF8 SENP2 UBE2B NMT1 RBBP8 CEBPB SCO2 ANKRD11 KDM2B ELL MFN2 MAN2A1 KIF20B SF3B14 PSMC3 EIF4E2 RPL7L1 CHST11 COL4A3BP KDM6A HIF1A
GO_ANTIGEN_PROCESSING_AND_PRESENTATION_OF_PEPTIDE_OR_POLYSACCHARIDE_ANTIGEN_VIA_MHC_CLASS_II	0.00829454293354462	0.0557458785309448	0.369645113341023	1.56639028803398	334	66	AP2A2 CD74 RAB7A HLA-DPB1 HLA-DRA CLTC HLA-DMA AP1S3 DYNLL2 SEC24A KIF2A DYNC1LI2 HLA-DRB1 HLA-DPA1 HLA-DRB5 DCTN3 KLC2 FCER1G KIF22 HLA-DQB1
GO_RESPONSE_TO_IONIZING_RADIATION	0.0689361921451397	0.246846178954386	0.281567113303024	1.27986057576738	2674	96	ICAM1 SOCS3 MECP2 CDKN1A CYP2R1 KAT5 TLK2 RNF8 IKBIP BCL2 PMAIP1 POLB C12orf5 RRM1 RAD1 TOPBP1 XRCC4 POLG WRN HIF1A BRE CLK2
GO_PROTEIN_EXPORT_FROM_NUCLEUS	0.0438566357494561	0.183993958175464	0.44404106091794	1.48905362094391	1914	24	CALR EIF5A ADAR NXT1 TGFB1 SMURF1 NUP88 AHCYL1
GO_EPITHELIUM_DEVELOPMENT	0.047838232493175	0.194699127582326	0.22712240936105	1.21126280682526	1506	299	RALA KRAS AKT2 ICAM1 XBP1 SOCS3 MTHFD1L KDM6B TAGLN2 HES1 STAT6 BCL10 TSG101 BASP1 IL6 RAP1B WNT10A CNN3 CDKN1A RARA PSEN1 PPHLN1 PTPRO TGFB1 PAK1 CLIC4 PDCD10 RELA TRIM28 STAT1 RAP2C BCL2 SKIL EP300 PAFAH1B1 PDE4D SMAD4 HNRNPH3 SATB1 RAB1B PRKD2 VDAC1 TDRD7 AHI1 CDC42 CEBPB KDM2B ARID4B C12orf5 MYADM AGPAT6 KIF20B FZR1 S1PR1 RFX3 BTRC RHOA ILK RAPGEF6 RAC1 SETDB2 KDM6A HIF1A
GO_PROTEIN_LOCALIZATION_TO_CYTOSKELETON	0.898796001817356	0.963760711196712	0.219102364157424	0.688614769984643	39564	19	AZI1 CSNK1D KIF20B HOOK3 KIAA0753 DCTN2 GSK3B
GO_NUCLEAR_ENVELOPE_REASSEMBLY	0.024572219988384	0.125082888212457	0.551562424981054	1.62370666228867	1099	15	PPP2R1A CHMP4B CHMP2A EMD LMNA UBXN2B BANF1
GO_INTRINSIC_APOPTOTIC_SIGNALING_PATHWAY_IN_RESPONSE_TO_DNA_DAMAGE_BY_P53_CLASS_MEDIATOR	0.0801328294973091	0.27189778648007	0.41425812541887	1.38917910065619	3498	24	BCL3 PPP2R5C CDKN1A EP300 HIPK1 PMAIP1
GO_REGULATION_OF_AUTOPHAGY	0.0201085404170237	0.10874532528449	0.266160539057412	1.33518520723509	703	182	SQSTM1 U2AF1 TPCN2 XBP1 CHMP4B RB1CC1 MTMR3 RAB7A PIM2 ATP6V0D1 CALCOCO2 CISD2 TLK2 ZC3H12A RAB3GAP2 BCL2 EP300 SUPT5H RPL28 RAB1B TBC1D25 NRBF2 ATP6V0E1 VDAC1 BNIP3L PIP4K2C U2AF2 ATP6V1E1 DAPK3 PHF23 TAB2 C12orf5 DRAM1 PARK7 KDM4A PLEKHF1 SNX6 VPS26A HTRA2 ATP6V0A2 ATP6V0C ATP6V0B HIF1A EXOC1
GO_PHOSPHOLIPID_METABOLIC_PROCESS	0.992478846756503	0.999564224430183	0.146158520844864	0.732753151092826	34836	181	PIK3CA MTMR3 MECP2 INPP5K MTMR14 MTMR6 IP6K1 ABHD3 GPX4 TMEM55B PLEK PAFAH1B1 FAR1 PIP4K2C PTPN11 GGPS1 TMEM55A AGPAT6 GPCPD1 NUS1 PGAP3 SMG1 SERINC5 MVD CDS2 PIGB SAMD8 DDHD1 PLSCR1 SACM1L ABHD5 PIP5K1A LCK PTDSS1 SPTLC2
GO_AMMONIUM_ION_METABOLIC_PROCESS	0.844048419636853	0.942430751421106	-0.199262088266561	-0.791043572604453	50203	62	COMT SLC22A5 SLC44A1 TMLHE AMD1 PARK2 SMS DHPS ACER3 CEPT1 PLBD1 SAT2 CHPT1 SAT1 ACADM PLA2G12A PNPLA6 PEMT BTBD9 SMPD2 AKR7A2 PLA2G6 SGMS1 AZIN1
GO_NCRNA_CATABOLIC_PROCESS	0.184492695349149	0.453924801402531	0.424011585977678	1.24821852587799	8258	15	ZCCHC11 DEDD2 DIS3L2 XRN1 EXOSC4 EXOSC7 NUDT16 EXOSC8 EXOSC9 DIS3
GO_REGULATION_OF_FAT_CELL_DIFFERENTIATION	0.00964614983528073	0.0622345026333718	0.431985900971424	1.63234944095328	406	39	DUSP10 XBP1 HES1 INSIG1 IL6 TGFB1 ZC3H12A RORA TAF8 WDFY2 CEBPB ARNTL
GO_REGULATION_OF_RNA_STABILITY	2.65012985636296e-05	0.000661060486613736	0.447875770372526	2.10699916122294	0	118	PSMC4 PSMD12 PSME2 PSMD3 THRAP3 PSMD10 PSMD11 PSMD2 PSMC6 MAPKAPK2 CNOT6L UPF1 ZC3H12A PSMB6 TIRAP YWHAZ PRKCD YBX1 PSMB3 PSMA1 PSME3 PSMC2 CIRBP UBB PSMD6 DCP1A TNPO1 RC3H1 PSMB5 PSMB7 KHSRP PSMA4 XRN1 PSMC1 AKT1 METTL14 PSMD13 PSMD8 QKI PSMA7 PUM2 PSME4 FMR1 ZFP36L1 CCRN4L ANP32A PSMB10 HNRNPD PSME1 EIF4G1 EXOSC4 ELAVL1 EXOSC3
GO_NEGATIVE_REGULATION_OF_CELL_DEVELOPMENT	0.0978515930541795	0.309644114815115	0.267334227859886	1.23164050999569	3752	104	CALR HES1 MECP2 PSEN1 PTPRO STRAP TGFB1 HMG20A STAT1 CIB1 BCL2 B2M PAFAH1B1 ZNF706 DGUOK MBP C3orf17 PTK2 ARF6 HOOK3 RHOA ARHGEF1 STAT3 SEMA4A TRIM11 CERS2 SEMA7A ARHGDIA CTDP1 MED1 ARHGEF2 GAK RAP1GAP2 GBP1 RCC2 CTNNB1 PTEN GSK3B ITGB1BP1 RNF6
GO_CELLULAR_PROTEIN_COMPLEX_DISASSEMBLY	0.6744705729505	0.85642625775319	0.19845763225363	0.909802480403879	25956	101	MRPL22 GFM2 MRPL21 TRMT112 MRPL14 MRPS28 MRPL32 MRPS18A MRPL13 ETF1 MRPL20 MRPS7 MRPL3 MRPL54 MRPL38 SGK1 MRPL9 MRPL27 MRPS12 MRPL39 MRPL46 MICAL1 MRPL2 NAPA MRPL17 MRPL23 MRPS18C PEX14 MRPS22 MRPL4
GO_BODY_MORPHOGENESIS	0.0299217569730997	0.144414992948509	0.520081102823376	1.58524424084929	1326	17	PLEKHA1 TGFB1 CSRNP1 PTPN11 ANKRD11 BRAF RAB3GAP1 ZNF281 IFT122
GO_SOMATIC_STEM_CELL_POPULATION_MAINTENANCE	0.719812481143679	0.877961094648507	0.235582770025632	0.843555757511869	31015	31	KLF10 HES1 SMAD4 BRAF STAT3
GO_CYTOPLASMIC_MICROTUBULE_ORGANIZATION	0.90062493417126	0.964056077842562	-0.209162881929527	-0.703287296255893	51304	29	TUBGCP4 KATNAL1 SPAST KIAA1377 TUBGCP3 SLAIN2 DLG1 TUBGCP5 TUBGCP2 CRIPT
GO_NEGATIVE_REGULATION_OF_PEPTIDYL_TYROSINE_PHOSPHORYLATION	0.289907546568293	0.584653088137083	0.336910690330229	1.11777259097264	12730	23	PPP2R1A PSEN1 PTPN2 MVP PRKCD SNX6 SAMSN1
GO_NUCLEOSIDE_DIPHOSPHATE_METABOLIC_PROCESS	0.0196585172550438	0.107124810550471	-0.42325754090873	-1.55008412148308	1140	42	NUDT18 NME4 NME3 DHTKD1 NUDT5 TPI1 CMPK1 GPI AK3 PFKFB2 AK2 DTYMK AMPD3 PFKL CARD11 DLG1 NME7 NME6
GO_MICROTUBULE_POLYMERIZATION_OR_DEPOLYMERIZATION	0.926920973475526	0.972983149714759	0.203598428725072	0.666545013934436	40676	22	TUBGCP6 CSNK1D FBXO5 SGK1 CLASP1 BLOC1S2
GO_RESPONSE_TO_AMMONIUM_ION	0.814306202940122	0.929184331619288	-0.253132377865417	-0.751722725809159	45421	18	PPP1R9B GNAI2 PARK2
GO_REGULATION_OF_GLUCOSE_IMPORT	0.0212373888607362	0.113482781973526	0.464763814337618	1.59166428479319	921	26	AKT2 MARCKS NFE2L2 RPS6KB1 PEA15 OSBPL8 PTPN11 ADIPOR2 LMBRD1
GO_NEGATIVE_REGULATION_OF_PROTEOLYSIS	0.608335338305665	0.822103067938236	0.197423739967949	0.940923675591697	22755	128	AKT2 PSMG2 CDKN2D IL6 RFFL PSEN1 APLP2 CAST TLK2 UBXN1 EP300 USP19 HSP90AB1 BIRC3 PARK7 NR1H2 USP47 BIRC2 SERPINB9 GABARAPL2 TRIM21 SENP1 USP14 NAIP IFI6 AKT1 MAD2L1 PML MICAL1 SERPINB1
GO_REGULATION_OF_EPITHELIAL_CELL_APOPTOTIC_PROCESS	0.000272603362108133	0.0035688323489323	0.660982226186293	2.0773948533124	11	19	CD40 ICAM1 XBP1 IL6 TNFAIP3 NFE2L2 CAST BRAF TNIP2 EIF2S1
GO_PHOSPHATIDYLCHOLINE_METABOLIC_PROCESS	0.733183039577356	0.885609695918828	0.24819568430819	0.823441763885463	32196	23	MECP2 ABHD3 AGPAT6
GO_METENCEPHALON_DEVELOPMENT	0.557493828611731	0.788598127140821	0.252789186327195	0.937782902341322	23712	36	EZH2 MECP2 BCL2 RORA PTPN11 ATP7A C5orf42 AARS HNRNPD HSPA5 ESR2 PTBP2 ABAT OGDH UQCRQ
GO_ACTIN_FILAMENT_BUNDLE_ORGANIZATION	0.144025814661637	0.39282040769693	0.403899613278865	1.28794529291152	6337	20	HSP90B1 PDCD10 PAWR CDC42 RHOA PHACTR1
GO_CELLULAR_RESPONSE_TO_VIRUS	0.838481886657102	0.939697060426333	0.24443711204944	0.732924463308966	37402	16	ADAR ZC3H12A LSM14A IRF7 LGALS9
GO_RESPIRATORY_GASEOUS_EXCHANGE	0.326000999863655	0.619002234445999	0.343191285581251	1.09436004962809	14345	20	TRAF4 MECP2 STK40 MAN2A1 CHST11 KDM6A
GO_NEGATIVE_REGULATION_OF_PROTEIN_MODIFICATION_BY_SMALL_PROTEIN_CONJUGATION_OR_REMOVAL	0.000104248110502997	0.00162351125387308	0.402009003587661	1.85942540358625	3	106	PSMC4 PSMD12 PSME2 PSMD3 TNFAIP3 PSMD10 PSEN1 PSMD11 PSMD2 PSMC6 RNF4 GTPBP4 DNAJA1 UBXN1 ANAPC2 PSMB6 SENP2 GNL3L PARK7 UBE2D1 PSMB3 SPOPL FZR1 PSMA1 PSMC3 FBXO5 PSME3 PSMC2 UBB PSMD6 PSMB5 ISG15 TRIM21 PSMB7 CDC27 PSMA4 PSMC1 PSMD13 MAD2L1 PML ANAPC7 PSMD8 PSMA7 TRIP12
GO_AMINO_ACID_ACTIVATION	0.263130151428024	0.551537648957205	0.288586547550576	1.12099493372005	10981	44	GARS CARS IARS YARS MARS WARS TARS FARSA
GO_DENDRITIC_CELL_DIFFERENTIATION	0.0112087517934003	0.0702952058580114	0.574395923123308	1.72227866772071	499	16	CCR7 RELB PSEN1 TGFB1 LYN BATF
GO_REGULATION_OF_PROTEASOMAL_UBIQUITIN_DEPENDENT_PROTEIN_CATABOLIC_PROCESS	0.779963700006482	0.911698640409363	-0.195494711574134	-0.851634959329103	48129	105	RNF19A STUB1 SIRT2 TERF1 DUSP1 MAD2L2 RNF166 ANKIB1 ANAPC11 SMARCC1 PIAS1 ATM LCMT1 UBQLN2 BCAP31 GORASP1 TPR PARK2 RB1 TAF1 CBFA2T3 FHIT UBE2V2 SOCS5 TAF9 NSMCE2 SMC5 RFWD2 HSPBP1 SGTA PCID2 APC ARIH2 MDM2
GO_NEGATIVE_REGULATION_OF_NEURON_DIFFERENTIATION	0.154305476077924	0.409829083547622	0.281538314373105	1.19553580462601	6201	67	CALR HES1 PSEN1 PTPRO HMG20A CIB1 B2M PAFAH1B1 DGUOK MBP C3orf17 PTK2 ARF6 RHOA ARHGEF1 SEMA4A CERS2 SEMA7A ARHGDIA
GO_REGULATION_OF_SKELETAL_MUSCLE_TISSUE_DEVELOPMENT	0.368631550243149	0.65530880330031	0.331941986698079	1.05848855812673	16221	20	NR1D2 TGFB1 RPS6KB1 BCL2 USP19 ARNTL
GO_MUSCLE_TISSUE_DEVELOPMENT	0.304195274636511	0.601762867555002	0.243533729276273	1.07387222869794	12050	81	CALR ATF3 KDM6B MARCKS RARA EMD PRKAR1A NDUFV2 SKIL EP300 SLC9A1 GTF3C5 CDC42 LMNA COL19A1 S1PR1 GPCPD1 BIN3 MYL6 PLAGL1 C3orf58
GO_POSITIVE_REGULATION_OF_ADAPTIVE_IMMUNE_RESPONSE	0.00176354233693191	0.0172082298839754	0.466184138607762	1.79307709727095	73	42	CD40 LTA STAT6 SASH3 TGFB1 IL6ST HLA-B HLA-A B2M TRAF2 IL12RB1 FCER1G
GO_REGULATION_OF_OSTEOCLAST_DIFFERENTIATION	0.667579698876087	0.852511618020987	-0.264274788280287	-0.864162391066586	37776	26	TYROBP MAFB ATP6AP1 SLC9B2 NF1 TOB2 CREB1 GNAS LILRB1 TRAF6 INPP5D ZBTB7A
GO_REGULATION_OF_PROTEIN_BINDING	0.132531045960824	0.372795475746563	0.266234371511353	1.19864854282738	5175	91	TRAF4 TICAM1 ZNF268 TMBIM6 PSEN1 TDG TGFBR1 GTPBP4 DERL1 BCL2 B2M EP300 TIRAP SENP2 GNL3L CDC42 HSP90AB1 TRAF2 PRKCD PARK7 IFIT2
GO_CARDIAC_SEPTUM_DEVELOPMENT	0.211891796943615	0.490614610167162	-0.351951303219737	-1.19253156999793	12062	30	NPRL3 ADAMTS6 TRIP11 CRELD1 CITED2 AP2B1 SAV1 EGLN1 WHSC1 NOTCH2 PRDM1 NPHP3 RBM15
GO_REGULATION_OF_HISTONE_METHYLATION	0.206230163394851	0.482047467398126	0.3181240094	1.18015830176157	8771	36	XBP1 KDM3A MECP2 PHF1 BCOR SMAD4 KDM4A
GO_COGNITION	0.595126165730694	0.81197931300626	0.209972375958718	0.938228475813314	23419	87	KRAS HLA-DRA MECP2 PSEN1 RPS6KB1 EP300 PAFAH1B1 VDAC1 SLC11A2 DOPEY2 NPTN CNTNAP2 CEBPB ITPR3 BRAF
GO_RESPONSE_TO_ZINC_ION	0.458379479118288	0.731869123803319	-0.330648685099974	-0.997137394431881	25660	19	TSPO HVCN1 SLC30A6 D2HGDH LTA4H CREB1
GO_AXIS_SPECIFICATION	0.335440283980305	0.625424857194867	0.322278935819131	1.08073477561597	14646	24	BASP1 BCOR SMAD4 SENP2 AHI1 SETDB2 KDM6A RNF2 ETS2 DDIT3 CTNNB1
GO_PHOSPHATIDYLINOSITOL_METABOLIC_PROCESS	0.973916181246456	0.9922625011101	0.159049156851642	0.720012937472264	37785	94	PIK3CA MTMR3 INPP5K MTMR14 MTMR6 IP6K1 TMEM55B PLEK PIP4K2C PTPN11 TMEM55A PGAP3 EFR3A SMG1 PIGB SACM1L PIP5K1A LCK PIGA PI4K2B DPM2 PIGS PIGX MTMR4 PLCG2 PTEN ARF1 PIGC SYNJ1 PIK3C2A ALG5 MTMR1 ARF3 PIK3C3 SYNJ2
GO_CELL_PART_MORPHOGENESIS	0.883129960905106	0.958656317280621	0.166870908512761	0.859259757740579	29817	222	KRAS OPA3 NDUFS6 SEPT2 PTPRO SLC9A6 PAK1 ATP6V0D1 RAB8B MAP1S BCL2 PAFAH1B1 ABLIM1 SMAD4 RPGR UBE2B AZI1 SLC11A2 AHI1 PTPN11 SIAH1 KLF7 SNX2 DTNBP1 HPRT1 PTK2 CSNK1D KIF20B B3GNT2 LINGO3 RFX3 NUBPL ILK B9D2 RAC1 UBB COL4A3BP NEK1 SEMA4A SGK1 TMEM67 BBIP1 WDPCP ATP7A SEMA7A RAB3IP HRAS PLEKHO1 EHD1 ABCC4 UGT8 DAG1
GO_RESPONSE_TO_ORGANOPHOSPHORUS	0.0601505579357587	0.224991729802564	0.339782463333044	1.36408381708805	2484	51	HSP90B1 RAP1B INPP5K PANX1 RELA STAT1 EP300 PDE4D ITPR3 BRAF PER1 BIRC2 AKAP1 RFC3 FOSB RAPGEF1 RAP1A SREBF1 PTEN JUN CREM
GO_AXO_DENDRITIC_TRANSPORT	0.878727882420091	0.956690252131543	-0.227980692827775	-0.705318163627384	49264	21	AP3B1 SPAST SPG11 APP SPG7 AP3M1 KIF3B
GO_SINGLE_ORGANISM_MEMBRANE_FUSION	0.882947157859643	0.958656317280621	-0.189425129399105	-0.771516519037978	52967	71	UVRAG VPS39 STX10 MFN1 STX16 SNAP23 STX8 RAB34 STX7 EEA1
GO_REGULATION_OF_PROTEIN_UBIQUITINATION_INVOLVED_IN_UBIQUITIN_DEPENDENT_PROTEIN_CATABOLIC_PROCESS	2.53273560772991e-05	0.000661060486613736	0.441970567158219	1.96222935172997	0	84	PSMC4 PSMD12 PSME2 PSMD3 PSMD10 PSEN1 PSMD11 PSMD2 PSMC6 ANAPC2 PSMB6 UBE3A PTK2 UBE2D1 SMURF1 PSMB3 FZR1 SKP1 PSMC3 FBXO5 PSME3 BTRC PSMC2 UBB PSMD6 PSMB5 PSMB7 CDC27 PSMA4 PSMC1 PSMD13 MAD2L1 PML FBXW7 ANAPC7 PSMD8 PSMA7 PSME4 UBE2E1
GO_POLYSACCHARIDE_BIOSYNTHETIC_PROCESS	0.733968061162517	0.885609695918828	-0.269467361641174	-0.812632848638341	41088	19	CSGALNACT1 AGL EXT2 RPS27A PHKG2 ALG1 PGM2 UGP2
GO_REGULATION_OF_TYROSINE_PHOSPHORYLATION_OF_STAT_PROTEIN	4.58032749341578e-05	0.000869799680316782	0.674450727112569	2.2617126787309	1	24	CD40 PPP2R1A IL15 SOCS3 HES1 IL6 PTPN2 IL6ST LYN
GO_ORGAN_REGENERATION	0.00763535937246165	0.0533117758850545	0.472055054154213	1.69029661528744	328	31	SOCS3 SHC1 CDKN1A TGFB1 FAS CAST PRPS1 CEBPB EIF4A1 NRF1
GO_GLAND_MORPHOGENESIS	0.122725388123647	0.35638000876571	0.379932102314939	1.30114337486221	5327	26	STAT6 IL6 TGFB1 BCL2 CDC42 CEBPB POLB BTRC DAG1 PML MED1
GO_NEGATIVE_REGULATION_OF_ADAPTIVE_IMMUNE_RESPONSE	0.925334873813048	0.971725325374531	-0.222664400294032	-0.640132189839862	51257	16	PTPN6 TRIM27
GO_RIBOSOME_BIOGENESIS	0.99965663628418	1	0.132750176245981	0.702995567900119	32024	280	NOC4L ABCF1 PWP2 SENP3 LSM6 RPL26L1 TRMT112 RPP30 RPL12 GTPBP4 RIOK1 KRR1 RRP9 DDX21 RPL28 GNL3L TEX10 WDR43 DHX30 CSNK1D SETD4 MINA NOP14 TBL3 UTP14A MRPL20 MRPS7 RPS24 UTP15 ABT1 RPL7L1 SART1 RPP21 DIS3L2 NUP88 NOP2 DDX27 WDR75 DHX37 RSL24D1 NOB1 GAR1 ISG20 NOP58 EMG1 NOP10 WDR18 GEMIN4 ZNF622 DCAF13 NOC2L RPP14 UTP3 RPL31 XRN2 SRFBP1 EXOSC4 EXOSC3 FTSJ3 EIF2A EBNA1BP2 GNL3 NOL8 RRS1 DDX52 DDX28 HEATR1 SURF6 RRP1 EXOSC7 WDR36 RIOK2 IMP4 C7orf60 MAK16 GNL2 RPP38 GTPBP10 ISG20L2 UBA52 MRPL10 RPL27A SUV39H1 NAT10 RAN
GO_B_CELL_HOMEOSTASIS	0.633926356851338	0.835275495410875	0.287446414342431	0.87615714244451	28113	17	TNFAIP3 LYN BCL2 HIF1A RC3H1
GO_IRE1_MEDIATED_UNFOLDED_PROTEIN_RESPONSE	0.126422705662008	0.36242713612229	0.318803769203073	1.25146387383501	5264	46	XBP1 HYOU1 C19orf10 SRPR SHC1 DNAJC3 DNAJB11 ATP6V0D1
GO_SINGLE_ORGANISM_BEHAVIOR	0.295435618193466	0.590119969716382	-0.242172550175757	-1.08083105290372	18446	123	OXR1 ABCA7 COMT CLN8 TSPO HIPK2 ATXN3 PAX5 ITGB1 STRBP KAT2B THRA BBS4 PPT1 APP UBR3 MTA1 ARRB2 NF1 GPI PARK2 DYNLRB1 C12orf10 FBXL20 ABHD12 FYN RGS14 PRKCZ GM2A CPEB3 FXN CREB1
GO_POSITIVE_REGULATION_OF_ENDOCYTOSIS	0.374017292245775	0.6613181385685	-0.275472490768674	-1.04761900410323	21931	50	ABCA7 BICD1 FLOT1 SYK HIP1 ITGB1 ANO6 PPT1 ARRB2 HNRNPK CBLL1 PICK1
GO_MRNA_SPLICE_SITE_SELECTION	0.481645817741188	0.744017285812593	-0.313835593864412	-0.982853921865893	27028	22	LUC7L3 SF3A3 PSIP1 SRSF1 SRSF5
GO_REGULATION_OF_TRANSLATION_IN_RESPONSE_TO_STRESS	0.309501613481535	0.605419319753025	-0.375980258488891	-1.11654189458122	17263	18	RPS6KA1 EIF2B4 EIF2B3 EIF2AK1 IMPACT EIF2B5
GO_LYSOSOMAL_TRANSPORT	0.78589132970451	0.91505907192355	0.205460175106534	0.831304855337946	32340	53	TSG101 RAB7A LAMP1 SCARB2 MGRN1 CHMP5 HOOK3 SCYL2 AKTIP HMGXB4 GNPTAB AP1G1 SNX16 VPS41 VAMP7 VPS33B FAM160A2
GO_POSITIVE_REGULATION_OF_DNA_BIOSYNTHETIC_PROCESS	0.326708929885794	0.619503166910034	0.283071390329245	1.07599740605302	13759	40	CCT7 CCT2 PRKD2 PARM1 MAP2K7 CCT5 CCT3 TNKS2 DDX39B RFC3 RFC2 POT1 CCT8 CTNNB1 GSK3B
GO_REGULATION_OF_CALCIUM_MEDIATED_SIGNALING	0.669816116535488	0.852739966837319	-0.251330757886625	-0.870456115893365	38210	33	FKBP1A SYK CAMK2D P2RX5 GSTM2
GO_REGULATION_OF_ALPHA_BETA_T_CELL_ACTIVATION	0.0248213525152619	0.125991421006386	0.405223333799155	1.52171613248847	1048	38	IRF1 IL6 CD83 SASH3 RARA C10orf54 HLA-A TNFRSF14 IL12RB1 NKAP AP3D1 IRF4 RC3H1
GO_MUSCLE_ORGAN_DEVELOPMENT	0.526957127225704	0.774777395293945	-0.232812576993823	-0.962310126237639	31784	77	FAM65B UNC45A CD164 FKBP1A FLNB SIN3B PAX5 AEBP1 COPS2 MYL6B EID2B CTSB NF1 PPP3CA RB1 EGLN1 SRI
GO_POSITIVE_REGULATION_OF_HEMOPOIESIS	0.111965855653241	0.338266075444694	0.271979537648261	1.22240628182912	4380	90	IL15 KLF10 XBP1 CD74 IL6 TRIB1 CD83 SASH3 ACIN1 RARA TGFB1 RIPK1
GO_REGULATION_OF_PHOSPHATIDYLINOSITOL_3_KINASE_ACTIVITY	0.00590768675731133	0.044195123313029	0.589477744770823	1.79677014783621	261	17	CCR7 TGFB1 LYN CDC42 PTK2 RAC1
GO_LEUKOCYTE_DEGRANULATION	0.980927209086363	0.994538009341515	-0.179960047913192	-0.549833762611414	54927	20	SNAP23 LAT STXBP2 HCK PI4K2A PIK3CG
GO_MYELOID_CELL_HOMEOSTASIS	0.453396563103474	0.728996078743415	0.24354235717361	0.997095886570285	18547	56	JMJD6 IL6 ADAR ACIN1 CEBPG PTPN2 LYN SLC25A38 SLC11A2 MAEA
GO_REGULATION_OF_BLOOD_PRESSURE	0.412835795110996	0.69538442880488	-0.282727811800183	-1.02416082449735	23896	40	AGTRAP BMPR2 ERAP2 SCPEP1 BBS4 HBB CTSZ WNK1
GO_REGULATION_OF_CYTOKINE_PRODUCTION	3.16605983853095e-05	0.000663184000844283	0.345954102557667	1.84069696470355	0	293	CCR7 CD40 NFKB2 TICAM1 RELB IL15 OTUD5 LTA XBP1 IRF1 BCL3 TLR1 CD74 STAT6 BCL10 IL6 TNFAIP3 HLA-DPB1 LRRFIP1 CD83 NFKB1 SASH3 CEBPG FOXP1 RARA CD2AP TAX1BP1 TGFB1 REL C10orf54 RIPK1 RELA IL6ST MAPKAPK2 SLAMF1 HLA-B LYN KAT5 HLA-A CYLD ZC3H12A TRAF3 B2M EP300 PDE4D TIRAP SMAD4 POLR3E RORA POLR3H PRKD2 HLA-DRB1 CRCP HLA-DPA1 CEBPB CD58 IFNAR1 ADAM8 HLA-DRB5 TRAF2 TNFRSF14 IL12RB1 BIRC3 PARK7 TMF1 FCER1G LTB PER1 HDAC7 SEC14L1 POLR1C IRF4 RAC1 UBB ATF4 BIRC2 TRIM56 HIF1A IL17RA BTN2A2
GO_REGULATION_OF_ERBB_SIGNALING_PATHWAY	0.348992640849318	0.643211027431781	0.267145873707017	1.05874981024349	14463	48	AP2A2 SHC1 RAB7A PSEN1 PTPN2 CDC42 SNX6 UBB SPRY1 AKT1 NUP62 FBXW7 LGMN
GO_NEGATIVE_REGULATION_OF_SMOOTH_MUSCLE_CELL_PROLIFERATION	0.178506009024706	0.447573674295252	0.426719705481947	1.25619077250358	7990	15	IL15 TNFAIP3 TRIB1 MFN2 ILK
