pathway	pval	padj	ES	NES	nMoreExtreme	size	leadingEdge
GO_RESPONSE_TO_VITAMIN	0.00288272241492453	0.025371187192417	0.482339322580171	1.77710601773106	122	35	IL15 TPCN2 CDKN2D RARA PIM1 TGFB1 RELA HMGCS1 PAWR NRF1
GO_REGULATION_OF_ATPASE_ACTIVITY	0.546917501711037	0.783233723963572	-0.273964159954737	-0.942059380385711	31164	32	ABCA7 PXK DNAJC10 AHSA2 SNRNP70 TOR1AIP2 DNAJC24 RAB4A
GO_NEGATIVE_REGULATION_OF_STRESS_ACTIVATED_PROTEIN_KINASE_SIGNALING_CASCADE	0.968767705382436	0.989875814735484	-0.184818246811374	-0.598038486713357	54715	25	TAOK3 HSPH1 MYC GPS2 PARK2
GO_POSITIVE_REGULATION_OF_CYTOKINE_BIOSYNTHETIC_PROCESS	0.000161625490648811	0.00232392029737389	0.618419637589191	2.13762816566375	6	27	TICAM1 IRF1 BCL3 TLR1 BCL10 CEBPG RELA MAPKAPK2 TIRAP LTB IRF4
GO_REGULATION_OF_CYSTEINE_TYPE_ENDOPEPTIDASE_ACTIVITY	0.862032915683262	0.949942706583584	-0.181385454041375	-0.823158055002327	54420	138	TNFRSF10A CDKN1B TBC1D10A RPS6KA1 DNAJA3 IFT57 ARL6IP1 MTCH1 HIP1 MAPK9 PLAUR MYC MAP2K5 COL4A3 TNFAIP8 CASP1 RPS3 PDCD2 BCAP31 ARRB2 CYFIP2 TNFSF10 BAK1
GO_REGULATION_OF_CELLULAR_RESPONSE_TO_STRESS	0.00518360097147207	0.0401154538235597	0.233228482145364	1.29990883843283	142	458	CCR7 HELB TRAF4 DUSP10 SQSTM1 BBC3 RPA3 U2AF1 XBP1 HYOU1 CHMP4B PPP1R15B CD74 CDKN2D TMBIM6 MTMR3 RAB7A RINT1 PSMD10 NFE2L2 DNAJC3 CEBPG PTPN2 NUP155 PAK1 PDCD10 ATP6V0D1 RIPK1 CALCOCO2 CHCHD2 MAPKAPK2 SLAMF1 TRIM28 LYN RNF8 DNAJA1 UBXN1 ZC3H12A UBAC2 RAB3GAP2 SKIL EP300 PAFAH1B1 SUPT5H TIRAP RPL28 SENP2 RAB1B TBC1D25 ATP6V0E1 MAP3K2 VDAC1 BNIP3L PIP4K2C U2AF2 ATP6V1E1 USP19 CDC42 PMAIP1 PHF23 C12orf5 DNAJB1 DTNBP1 HSP90AB1 TRAF2 RAE1 DERL2 PRKCD BRAF PARK7 ARNTL DYRK1A UBE2N SNX6 MAP2K7 PER1 RASSF2 VPS26A HTRA2 USP47 POLH ATP6V0A2 ATF4 CHORDC1 ATP6V0C ATP6V0B HIF1A BRE EXOC1 NUP88 NUP153 PTPLAD1 EDEM1 PPP4C CERS2 PRDX1 WDR75 PDCD4 USP14 DDX39B DNAJC7 SEH1L RAB3GAP1 HRAS USP25 SDF2 AKT1 NCK1 RANBP2 SPTLC2 HMGA1 PML NUP62 FBXW7 SREBF2
GO_POSITIVE_REGULATION_OF_EPITHELIAL_CELL_MIGRATION	0.296829921395871	0.592152135254493	-0.305201564542541	-1.10557035047079	17181	40	BMPR2 HDAC9 ROCK2 CAPN7 ETS1 PLCG1
GO_MISMATCH_REPAIR	0.327498124397128	0.619503166910034	-0.365100665751205	-1.10103424860869	18333	19	PMS1 MSH3 MLH3 LIG1 PMS2 MSH2
GO_REGULATION_OF_ESTABLISHMENT_OR_MAINTENANCE_OF_CELL_POLARITY	0.701134789795827	0.87061825582763	0.281135747894159	0.827616179399703	31386	15	RAP1B RICTOR KIF20B WDPCP
GO_HOMOTYPIC_CELL_CELL_ADHESION	0.173260912011644	0.439733752041601	-0.389503065830041	-1.24726036674032	9760	24	PIK3CB PTPN6 FIBP TLN1 HBB FERMT3 JUP MYH9 GNAS PIK3CG CSRP1
GO_ERROR_PRONE_TRANSLESION_SYNTHESIS	0.836307388809182	0.938840946787724	0.245044006790724	0.734744186994994	37305	16	RPA3 UBB RFC3 RFC2 POLI UBA52 RPA1
GO_NEGATIVE_REGULATION_OF_MITOTIC_NUCLEAR_DIVISION	0.0629974901398351	0.230697102586669	-0.489282155129508	-1.4530125242978	3513	18	ATRX TERF1 TOM1L2 MAD2L2 ATM TPR
GO_HOMEOSTASIS_OF_NUMBER_OF_CELLS_WITHIN_A_TISSUE	0.155140061653934	0.410598227980208	0.437871300549451	1.28901918572784	6944	15	KRAS SASH3 BCL2 PTPN11 RAC1
GO_POSITIVE_REGULATION_OF_IMMUNE_EFFECTOR_PROCESS	0.00205151584226123	0.0195763239875389	0.371709503516594	1.65028930050025	80	84	CD40 LTA XBP1 CD74 STAT6 BCL10 IL6 LAMP1 SASH3 RARA TGFB1 HLA-B LYN HLA-A B2M GAB2 TRAF2 TNFRSF14 IL12RB1 FCER1G SNX6
GO_UROGENITAL_SYSTEM_DEVELOPMENT	0.240888483651192	0.527804473941453	0.250708460610521	1.11307751396236	9510	84	JMJD6 HES1 BASP1 RARA PTPRO TGFB1 TGFBR1 STAT1 BCL2 SMAD4 APH1A AHI1 ODC1 UBE3A
GO_NEGATIVE_REGULATION_OF_CELL_ACTIVATION	0.00172448265520344	0.0169322640707788	0.395747249381846	1.70040436408091	68	71	NFKBID IRF1 CD74 TNFAIP3 PTPN2 TGFB1 C10orf54 FAS LYN PRKAR1A CYLD ZC3H12A PAWR HLA-DRB1 CEBPB HLA-DRB5 TNFRSF14 PRKCD FBXO7 TSPAN32 BTN2A2 RC3H1 SAMSN1 MARCH7
GO_CELLULAR_RESPONSE_TO_ALCOHOL	0.476941951935337	0.740025487891766	0.249866331523607	0.98588424494517	19825	47	IL15 IL6 PIM1 TGFB1 HMGCS1 EP300 RORA PAWR
GO_PEPTIDYL_TYROSINE_AUTOPHOSPHORYLATION	0.933622687815298	0.975234518086375	0.204000839410364	0.650512930021479	41084	20	TYK2 LYN PTK2 LCK MATK
GO_CELL_JUNCTION_ASSEMBLY	0.899182281041606	0.963760711196712	-0.196831392929621	-0.732013941346146	52451	45	MTDH PIP5K1C ITGB1 TLN1 VASP PLEC JUP PTPRK INADL STRN DLG1 CTNNA1 APC MPP5 LIMS2 FLNA CD9 RAB13
GO_INTERACTION_WITH_SYMBIONT	0.167219626168224	0.429815169394832	0.334418810686534	1.22373317556615	7156	34	CHD1 INPP5K STOM ZC3H12A EP300 ZNF639 CCNK TAF11 PPIB
GO_REGULATION_OF_POLYSACCHARIDE_METABOLIC_PROCESS	0.00802114665937472	0.0546690733270181	0.530571953099537	1.73699812953616	351	22	AKT2 CLTC INPP5K NFKB1 TGFB1 PPP1CB
GO_SMOOTHENED_SIGNALING_PATHWAY	0.529882670358734	0.776601856018452	-0.296799191804536	-0.950405532828041	29851	24	HIPK2 IFT57 KIAA0586 HSPB11 IFT80
GO_EYE_DEVELOPMENT	0.087672769929107	0.290577893583601	0.280575774281797	1.25602716623285	3437	88	ZEB1 JMJD6 NINJ1 RARA PSEN1 TGFB1 CLIC4 TGFBR1 SKIL TGIF2 HIPK1 TDRD7 AHI1 SCO2 KDM2B RRM1 MFN2 MAN2A1 FZR1 STAT3 HIF1A NRL ATF6 ATP2B1 WDPCP SLC25A25 CASP2 RAB3GAP1
GO_DEVELOPMENTAL_PROCESS_INVOLVED_IN_REPRODUCTION	0.0103985633182713	0.0662723852860215	0.269797141857293	1.3714514313723	358	200	EIF2S2 ICAM1 TFPT SOCS3 WDR48 HES1 DEDD BASP1 KDM3A PLEKHA1 RARA TGFB1 TGFBR1 AGFG1 RPS6KB1 FAS TRIM28 HMGCS1 NASP RNF8 CIB1 BCL2 RQCD1 PAFAH1B1 SMAD4 IRF2BPL SENP2 UBE2B FANCA DLD PTPN11 WDR81 CEBPB ARID4B RRM1 HSP90AB1 UBE3A PTK2 DAZAP1 PRDX4 TMF1
GO_PROTEIN_DEPHOSPHORYLATION	0.54398587391946	0.783233723963572	0.205923132897872	0.962305401474908	20640	113	PPP2R1A DUSP10 PPP1R15B MTMR3 MTMR14 PTPN2 PTPRO PPP1CB MTMR6 DAPP1 PPTC7 PPM1A BCL2 PTPN7 PTPN11 PPP4R1
GO_REGULATION_OF_CELLULAR_PROTEIN_CATABOLIC_PROCESS	0.0320297087153302	0.150654707759831	0.251517147876672	1.28032883106734	1103	202	PSMC4 PSMG2 PSMD12 PSME2 XBP1 PSMD3 TNFAIP3 PSMD10 TRIB1 NFE2L2 PSEN1 PSMD11 PSMD2 PSMC6 TLK2 RNF40 UBXN1 ANAPC2 PSMB6 ARAF USP19 HSP90AB1 UBE3A PTK2 CSNK1D PARK7 UBE2D1 SMURF1 PSMB3 TMF1 FZR1 PSMA1 SKP1 PSMC3 FBXO5 PSME3 BTRC PSMC2 COMMD1 UBB PSMD6 PSMB5 GABARAPL2 PSMB7 SENP1 CDC27 USP14 PSMA4 PSMC1 AKT1 PSMD13 MAD2L1 PML FBXW7 ANAPC7 RCHY1 PSMD8 PSMA7 PSME4 FMR1
GO_REGULATION_OF_PROTEIN_AUTOPHOSPHORYLATION	0.760267216642755	0.903122720110221	0.26353777008959	0.790196206644299	33913	16	RAP2C MVP RASSF2 CALM3 NBN CALM2
GO_REGULATION_OF_NEURON_DEATH	0.0102976669348351	0.065896679244912	0.300153228953231	1.43505852487701	383	131	KRAS BBC3 PIK3CA HYOU1 CHMP4B TP53BP2 IL6 MECP2 PSEN1 RRAS2 REL BTBD10 MAP2K4 BCL2 PAWR UBE2M CDC42 CEBPB KDM2B PMAIP1 C12orf5 ADAM8 HSP90AB1 TRAF2 BRAF PARK7 MAP2K7 HDAC7 EIF2S1 STAT3 HTRA2 ILK UBB ATF4 HIF1A ADNP CASP2 NAIP PSMC1 HRAS NAE1 AKT1 ZNF746 FBXW7 LGMN
GO_RESPONSE_TO_GAMMA_RADIATION	0.555674543126528	0.788587578366377	0.257827104640181	0.937676912056689	23868	33	SOCS3 TLK2 BCL2 POLB C12orf5 POLG WRN
GO_REGULATION_OF_CYCLIN_DEPENDENT_PROTEIN_KINASE_ACTIVITY	0.11393877699411	0.34290769857806	0.313051039829419	1.26200906481478	4700	52	CCNYL1 CDKN2D TNFAIP3 PSMD10 DNAJC3 CDKN1A PIM1 MNAT1 GTPBP4 CCNK CDC37 CCNT2 FBXO7
GO_POSITIVE_REGULATION_OF_PROTEIN_IMPORT	0.00559477500840417	0.0423585134371226	0.426004868958102	1.67228168258978	232	46	ZNF268 XBP1 IL6 TGFB1 TGFBR1 TRIM28 ZC3H12A EP300 SMAD4 SLC9A1 HSP90AB1 PRKCD CHERP RHOA
GO_MULTI_ORGANISM_METABOLIC_PROCESS	0.962543053960964	0.987046434577464	-0.16423269878203	-0.73979180497751	60362	131	ATG16L2 POM121C MAP2K2 MAP2K1 RPL21 RPS3 PCBP1 RPS21 TPR RPS16 RPS18 EIF3L RPS19 RPL5 RPL3 RPL37A RPL9 RPS9 RPL4 RPS27A RPS6 SMARCB1 RPL36A RPSA RPS3A RPS26 ATG16L1 RPL11 RPL10A RPLP0 RPL22 RPL13A RPL17 NUP160 RPS5 RPL6 RPL23A RPL27 RPL30 RPL7 RPS4Y1 RPS27 NUP107 NUP210 RPLP2 AAAS RPS14 RPS25 RPS11 RPS20 RPS15A RPL35A
GO_MONOVALENT_INORGANIC_CATION_HOMEOSTASIS	0.0272666283304581	0.1344925372281	0.384092772294959	1.49198240692657	1137	44	RAB7A SLC9A6 CLIC4 ATP6V0D1 ATP6V1F BCL2 SLC9A1 ATP6V0E1 ATP6V1E1 SLC9A8 ATP5B ATP6V0A2 ATP6V0C ATP6V0B SGK1
GO_REGULATION_OF_BMP_SIGNALING_PATHWAY	0.634257362647367	0.835275495410875	0.272986760602519	0.881757684264273	27867	21	HES1 C10orf54 PPM1A SMAD4 SMURF1 ILK
GO_HEART_PROCESS	0.307683470428749	0.604591284607335	0.32494141878808	1.10114270669395	13390	25	PIK3CA NUP155 PDE4D SLC9A1 CDC42
GO_MUSCLE_SYSTEM_PROCESS	0.498147584246853	0.752852193219631	0.219813318547395	0.978099207124408	19630	85	IL15 TPCN2 PIK3CA NDUFS6 EMD NUP155 RPS6KB1 CAMTA2 PDE4D SLC9A1 MYL12B SCO2 FXYD1 KDM4A
GO_MESENCHYME_DEVELOPMENT	0.116795229757229	0.34792818254687	0.341639816189837	1.28294393840149	4935	38	HES1 BASP1 WNT10A TGFB1 TGFBR1 TRIM28 STAT1 BCL2 SMAD4 HNRNPAB HIF1A SEMA4A
GO_TRANSCRIPTION_FROM_RNA_POLYMERASE_III_PROMOTER	0.622823145771179	0.83049148733965	-0.252837431840297	-0.900501370762398	35906	37	BRF1 NARG2 POLR3A POLR2E POLR2F SNAPC4 POLR2L GTF3C3 TBP
GO_POSITIVE_REGULATION_OF_PROTEOLYSIS	0.235640916550173	0.521764453700243	0.206663133440996	1.07810315836383	7753	247	PSMC4 BBC3 PSMD12 PSME2 XBP1 PSMD3 BCL10 PSMD10 TRIB1 NFE2L2 PSEN1 PSMD11 PSMD2 PSMC6 ADRM1 RIPK1 FAS RNF40 ANAPC2 PSMB6 EP300 SLC11A2 PAWR TRADD PMAIP1 ADAM8 TRAF2 PTK2 CSNK1D UBE2D1 SMURF1 PSMB3 FZR1 PSMA1 SKP1 PSMC3 FBXO5 PSME3 BTRC PSMC2 STAT3 HTRA2 BID UBB IST1 PSMD6 CRADD PSMB5 PSMB7 SENP1 CDC27 PSMA4 PSMC1 LCK PRELID1 AKT1 PSMD13 MAD2L1 SNX9 PML FBXW7 ANAPC7 RCHY1 PSMD8 PSMA7 PSME4 FMR1 EIF2AK3 UBE2E1 SUMO1 CASP7 HMGB1 DIABLO VCP PSMB10 RNF138 PSME1 PICALM RHBDD1 NDUFA13
GO_REGULATION_OF_CILIUM_ASSEMBLY	0.272942912867008	0.564945080519195	-0.332481492649952	-1.13485104688265	15533	31	TBC1D10A VDAC3 USP6NL BBS4 TBC1D22A TBC1D7 ODF2 TBC1D1 TBC1D14 TBC1D17 TBC1D10C MAP4 TBC1D9B SGSM3 EVI5
GO_REGULATION_OF_PROTEIN_KINASE_B_SIGNALING	0.0173503110419907	0.0977263023945708	0.376042099003626	1.52149010167589	713	53	CCR7 C19orf10 IL6 PLEKHA1 INPP5K TGFB1 RICTOR TGFBR1 CIB1 OSBPL8 ADAM8 PTK2 PARK7 ILK LMBRD1 GCNT2
GO_REGULATION_OF_DNA_TEMPLATED_TRANSCRIPTION_IN_RESPONSE_TO_STRESS	0.0175277421850446	0.0983431534739467	0.382716360781138	1.52978065954435	724	50	RBX1 XBP1 ATF3 TMBIM6 NFE2L2 UBE2D3 SIN3A EP300 CEBPB UBE2D1 TCEB1 BACH1 UBB ATF4 HIF1A
GO_ESTABLISHMENT_OF_ENDOTHELIAL_BARRIER	0.00327891094930125	0.0282768697161727	0.600018452252281	1.85849902776428	144	18	ICAM1 RAP1B RAP2C PDE4D RAB1B RAPGEF6 PPP1R16B RAPGEF1 RAP1A CTNNB1
GO_REGULATION_OF_HUMORAL_IMMUNE_RESPONSE	0.405173569226645	0.689314739585663	0.3504196565442	1.03157630969381	18137	15	CCR7 LTA CFP
GO_REGULATION_OF_MAP_KINASE_ACTIVITY	0.0324162580001662	0.152017735278392	0.26733872220225	1.31006258560628	1169	155	CD40 KRAS PPP2R1A DUSP10 CD74 EZH2 SHC1 TSG101 TRIB1 INPP5K IRAK2 PSEN1 TGFB1 PAK1 PDCD10 TGFBR1 RIPK1 MAPKAPK2 LYN DNAJA1 PEA15 MAP3K2 PTPN11 TAB2 DTNBP1 ADAM8 TRAF2 MAP3K1 PRKCD BRAF
GO_NLS_BEARING_PROTEIN_IMPORT_INTO_NUCLEUS	0.304667360137488	0.601762867555002	0.359938546314051	1.1148747773815	13472	18	TNPO2 KPNA4 TNPO1 RANBP2 DAG1 TRPS1 KPNA3
GO_VACUOLE_FUSION	0.55698621330095	0.788598127140821	-0.30479730720039	-0.931250309138935	31188	20	UVRAG VPS39 SNX14 EEA1
GO_CELLULAR_RESPONSE_TO_ESTROGEN_STIMULUS	0.180814978969744	0.45053185085086	0.402253658693433	1.24594173860847	7995	18	RARA FAS KAT5 SFR1 PAWR SERPINB9 NRIP1 H2AFZ HNRNPD ESR2
GO_LYTIC_VACUOLE_ORGANIZATION	0.300258136533296	0.596717941168638	-0.315128987651522	-1.10751071807954	17214	35	HOOK2 CLN8 HPS1 ABCA1 LAMTOR1 HOOK1 TFEB PPT1 HEXB
GO_REGULATION_OF_CHEMOTAXIS	0.0149524463182665	0.0883093728044987	0.370874643577808	1.52406611964002	609	57	CCR7 AKT2 CALR CD74 IL6 PTPN2 PTPRO TGFB1 LYN TIRAP PRKD2 S1PR1 STX3 RAC1 SEMA4A SWAP70 USP14 SEMA7A
GO_MEIOTIC_CELL_CYCLE_PROCESS	0.0997599583704027	0.313759548748554	-0.321000608026787	-1.28536738110057	5942	65	RAD50 HSF1 MSH3 TERF1 STAG3 MLH3 TUBGCP4 CDC25B UBR2 NCAPD3 SMC2 ATM MRE11A C11orf80 RAD51D TOP3A STRA13 FANCD2 TUBGCP3 MSH2 MYH9 SGOL1 ERCC4 SMC3 CKS2
GO_NEGATIVE_REGULATION_OF_ACTIN_FILAMENT_POLYMERIZATION	0.496946210443603	0.752852193219631	-0.317840079418396	-0.97110002359872	27826	20	SPTBN1 SPTAN1 BBS4 CAPG ADD1 MKKS
GO_DEVELOPMENTAL_CELL_GROWTH	0.10784838111539	0.328989915985006	-0.424046662943274	-1.34173448756281	6048	23	CAMK2D ITGB1 SPG11 ALCAM IQGAP1 IMPACT APP TGFBR2 PRKCZ
GO_SPINDLE_ASSEMBLY	0.944340392834846	0.979503712096331	0.17863066572332	0.701214497779146	39327	46	HAUS8 CHD4 TUBGCP6 KIF2A BIRC3 CSNK1D FBXO5 RHOA BIRC2 FAM175B CLASP1 HAUS5 MAP9
GO_REGULATION_OF_SODIUM_ION_TRANSMEMBRANE_TRANSPORTER_ACTIVITY	0.661181850789096	0.851941187121312	0.285611968362011	0.856383864427282	29493	16	STOM SLC9A1 FXYD1 FXYD5 TESC
GO_NEGATIVE_REGULATION_OF_ANTIGEN_RECEPTOR_MEDIATED_SIGNALING_PATHWAY	0.311970454051705	0.606694420545032	-0.396774705298545	-1.11958284034042	17231	15	PLCL2 DUSP22 PTPN6 FCRL5 PHPT1 ELF1
GO_SPHINGOLIPID_BIOSYNTHETIC_PROCESS	0.971692222299313	0.99199271342016	-0.175133138197904	-0.623751118911647	56019	37	CLN8 ST3GAL5 ST6GALNAC6 ST3GAL2 ACER3 VAPB UGCG LARGE PPAP2A VAPA SMPD2 AGK CERS6 KDSR SGMS1 ST6GALNAC3
GO_REGULATION_OF_PHOSPHOPROTEIN_PHOSPHATASE_ACTIVITY	0.104060128915634	0.321175761348646	0.339310538378758	1.29707044091156	4374	41	HSP90B1 PPP2R1A PPP2R5C PPP2R5A TIPRL PAWR CALM3 CALM2 PPP6R3 PPP1R11
GO_REGULATION_OF_MULTI_ORGANISM_PROCESS	6.16503806911008e-05	0.00104705673584561	0.306093952864494	1.61060491393603	1	266	PPP2R1A IL15 SQSTM1 LTA CHMP4B STAU1 AP2A2 CHD1 TSG101 RAB7A TNFAIP3 ADAR TRIB1 INPP5K ACIN1 PPID FOXP1 CHMP2A STOM CHMP3 SLC35B3 SIN3A AP1S3 TRIM28 HLA-A STAT1 IFITM3 ZC3H12A DERL1 CIB1 TRAF3 BCL2 TAP1 B2M EP300 SUPT5H TIRAP MX1 TMEM39A SNRPB CD8B RBM18 TRAF3IP2 APOBEC3G IL12RB1 BIRC3 ZNF639 GTF2F1 SMURF1 PRDX4 CCNK SEC14L1 TAF11 ILF3 RAC1 IST1 BIRC2 MICB TSPAN32 PTPLAD1 PPIB TRIM11 ALKBH5 PPIA ISG15 B4GALT1 TRIM21 OAS1 TNIP1 PLSCR1 RNF216 LCK SNRPB2 PML FCER2 ISG20 IL8 AP1G1 DDB1 ZNF681 PUM2 TRIM5 CTDP1 SUPT4H1 IFITM1
GO_POSITIVE_REGULATION_OF_CELL_CYCLE_ARREST	0.500012102727955	0.754149884580211	0.242473811060136	0.973430466335166	20656	51	PPP2R5C CDKN1A TGFB1 CNOT6L RQCD1 EP300 CRLF3 UBB CRADD CNOT4 PLAGL1 CASP2 PML CNOT8
GO_CONNECTIVE_TISSUE_DEVELOPMENT	0.823711995307459	0.933659123108238	0.198992295453731	0.811407683594849	33702	55	ZEB1 XBP1 PIK3CA RARA TGFB1 ZNF516 DYRK1B CHST11 HIF1A ATP7A SLC25A25 ACAT1 NAMPT EIF2AK3 ATF2 MEX3C PAXIP1 PKD1 MEF2D EGR1
GO_CYTOPLASMIC_PATTERN_RECOGNITION_RECEPTOR_SIGNALING_PATHWAY	0.0680952823179792	0.245925720739185	0.393651611804374	1.396435730221	2932	30	NFKBIA TNFAIP3 IRAK2 RELA CYLD TAB2 UBE2N LSM14A TAB1 TAB3 IRF7
GO_REGULATION_OF_STEROID_BIOSYNTHETIC_PROCESS	0.473133554307876	0.736621117894525	0.322202283880308	0.982095508060038	20982	17	INSIG1 NFKB1 ATP1A1 SREBF1 ABCG1
GO_NUCLEAR_ENVELOPE_ORGANIZATION	0.160157312820005	0.420045306244121	0.282720342382218	1.19393678527755	6474	65	PPP2R1A CHMP4B CHMP2A EMD NUP155 TMEM170A PAFAH1B1 OSBPL8 LMNA RAE1 UBXN2B ZMPSTE24 NUP88 NUP153 TOR1A SEH1L BANF1 RANBP2 NUP62 NUP37 SUMO1 NUPL1 PARP11 NUP85 SYNE2
GO_REGULATION_OF_GLIAL_CELL_DIFFERENTIATION	0.0908097774136283	0.295672871122922	0.426920207667838	1.37896860949579	3989	21	DUSP10 HES1 MECP2 RELA IL6ST
GO_CELLULAR_RESPONSE_TO_ENDOGENOUS_STIMULUS	0.0393717805554555	0.173988937419467	0.213548210855536	1.18726237266284	1092	447	HSP90B1 ZEB1 AKT2 ICAM1 CALR KLF10 XBP1 PIK3CA USP15 SHC1 KDM3A IL6 THRAP3 RAP1B NR1D2 INPP5K MICALL1 NFKB1 WNT10A PMEPA1 UBE2D3 RARA PTPN2 PDE3B TGFB1 ASNS SIN3A RNF4 PAK1 CDC5L C10orf54 ATP6V0D1 TGFBR1 RELA RPS6KB1 FAS LYN RANGAP1 KAT5 HMGCS1 PRKAR1A PPM1A DNAJA1 ATP6V1F CIB1 SKIL EP300 PDE4D SMAD4 SLC9A1 RORA ATP6V0E1 SFR1 KLF3 PAWR ATP6V1E1 UBE2M PTPN11 RAB35 CEBPB DDX54 PARD6A ITPR3 UBE3A ACSL1 PTK2 CSNK1D PRKCD GTF2F1 UBE2D1 NR4A1 SMURF1 FCER1G MED16 NR1H2 PTBP1 GNB4 RHOA GNG2 STAT3 ABHD2 ADIPOR2 UBB ADCY7 ATP6V0A2 ATP6V0C ATP6V0B HIF1A GCNT2 SGK1 SERPINB9 HNRNPH1
GO_POSITIVE_REGULATION_OF_HISTONE_METHYLATION	0.225056792367106	0.507427071457908	0.378866553671246	1.19073614615929	9906	19	XBP1 PHF1 SMAD4 MTF2 AUTS2 PAXIP1 CTNNB1 WDR61 JARID2 PAF1
GO_RNA_POLYADENYLATION	0.932441507033293	0.974874866771532	-0.202321724349359	-0.661579661897313	52764	26	PCF11 SSU72 CPSF6
GO_ASPARTATE_FAMILY_AMINO_ACID_METABOLIC_PROCESS	0.871103370628387	0.953021084537458	-0.218487979353483	-0.728294547682241	49516	28	EIF2B4 MRI1 MTHFD1 SMS ADI1 GOT2 MTHFR NIT2 AHCY MTAP EIF2B2
GO_POSITIVE_REGULATION_OF_MUSCLE_TISSUE_DEVELOPMENT	0.566007869386278	0.794991830850106	0.297669322383513	0.922001888722595	25029	18	TGFB1 RPS6KB1 BCL2 ARNTL DDX39B HMGCR CTNNB1 MKL2 ADRB2
GO_PROTEIN_TRANSMEMBRANE_TRANSPORT	0.149874591831906	0.400771036200722	0.329713806828926	1.23815875618959	6333	38	AKT2 SRP54 RAB8B SAMM50 TIMM17B TOMM20 PEX26 TIMM44 TIMM17A PAM16 HSP90AA1 TOMM22 NDUFA13 PEX14 SEC61G TIMM50 MCL1 PEX10 PEX16 TIMM9 PEX7
GO_INTRINSIC_APOPTOTIC_SIGNALING_PATHWAY_BY_P53_CLASS_MEDIATOR	0.0407429175972728	0.177059816169614	0.394025737212578	1.46173420156556	1732	36	BCL3 TP53BP2 PPP2R5C CDKN1A EP300 ZNF346 HIPK1 PMAIP1 ZMAT1
GO_RESPONSE_TO_RETINOIC_ACID	0.388903256142001	0.675231906410707	0.27951105188888	1.03691415477542	16541	36	CDKN2D RARA LYN EP300 SCAMP3 HTRA2 MICB CLK2 TESC GDAP1 RNF2
GO_ODONTOGENESIS_OF_DENTIN_CONTAINING_TOOTH	0.217652237974593	0.498442661600707	-0.413943037400333	-1.21076255203402	12112	17	HDAC1 NFIC STIM1 NF2 BSG ROGDI BAX CTNNA1 TRAF6
GO_REGULATION_OF_TRANSLATIONAL_INITIATION	0.961736479056283	0.986863493531954	0.166068432765129	0.713545042324321	38480	71	PPP1R15B DNAJC3 RARA YTHDF1 RPS6KB1 EIF4A1 EIF3C EIF2S1 ATF4 GLE1 EIF3F EIF3D NCK1 FMR1 EIF2AK3 EIF3M EIF4G1 UHMK1 KHDRBS1 EIF3B EIF2AK4 EIF3H EIF1 EIF4H PAIP2 NCBP1
GO_MYELOID_CELL_ACTIVATION_INVOLVED_IN_IMMUNE_RESPONSE	0.754687428018612	0.899956900740568	0.238498647525713	0.816779980556743	32763	26	TICAM1 SLAMF1 LYN FCER1G LAT2 STXBP3 RASGRP1 HMGB1 VAMP7 VAMP8
GO_POSITIVE_REGULATION_OF_SYNAPTIC_TRANSMISSION	0.840475813961661	0.940168864193171	-0.22211292805971	-0.758132691614557	47833	31	CLSTN1 FLOT1 ARRB2 HNRNPK PARK2 RGS14 PRKCZ GLUL
GO_CELL_RECOGNITION	0.307201889020071	0.604400961365725	0.292636260248973	1.09186068849514	13009	37	CCR7 JMJD6 CCT7 DYNLL2 CCT2 CNTNAP2 CD5 CCT5 VCAN CCT3 B4GALT1
GO_PROTEIN_K63_LINKED_UBIQUITINATION	0.332675520059435	0.625159380398771	0.30407199977602	1.07866192418387	14328	30	RNF4 RNF8 UBE2B UBE2F ZFP91 TRAF2 WWP2 UBE2N TRIM56
GO_NEGATIVE_REGULATION_OF_PHOSPHORYLATION	0.0447814030326273	0.185869442970297	0.242568073261034	1.24545615381354	1517	217	PPP2R1A DUSP10 SOCS3 ATF3 PPP1R15B CDKN2D IL6 TNFAIP3 ADAR PSMD10 TRIB1 DNAJC3 INPP5K PMEPA1 CDKN1A PSEN1 PTPN2 STRAP TGFB1 LYN PRKAR1A DNAJA1 ZC3H12A PPP2R5A CIB1 MVP PPIF PAFAH1B1 PDE4D UBE2B DNAJC15 C12orf5 PARD6A PRKCD MYADM PARK7 SNX25 FBP1 SNX6 PER1 RASSF2 STAT3 ILK DUSP2 FBXO7 CHORDC1 CALM3 SAMSN1 SPRY1 TESC PDCD4 TNIP1 CALM2 AKT1 NCK1 RANBP2 DAG1 NUP62 MIDN
GO_NEGATIVE_REGULATION_OF_NUCLEAR_DIVISION	0.286040129726647	0.580205350291237	-0.362148177426329	-1.13415674779653	16051	22	ATRX TERF1 TOM1L2 MAD2L2 ATM TPR
GO_REGULATION_OF_GENERATION_OF_PRECURSOR_METABOLITES_AND_ENERGY	0.0260586319218241	0.130584085324356	0.374160511284002	1.48286913372655	1079	48	AKT2 PIK3CA INPP5K PPP1CB PPIF DNAJC15 C12orf5 PRKAG1 PARK7 CISD1 FBP1 STAT3 HIF1A PASK ATP7A PRELID1 AKT1
GO_LIPID_CATABOLIC_PROCESS	0.0405976233132263	0.17695516486342	-0.323441367231746	-1.37126791920926	2469	89	PLD3 HSD17B4 ECHS1 SIRT2 ACOT8 PEX13 PLCG1 HADHA MUT DAGLB LIPA SCP2 PAFAH1B2 ABCD1 PPT1 PEX2 HEXB ACOX3 ECH1 PCCA ABHD12 GM2A INPP5F
GO_POSITIVE_REGULATION_OF_LIPID_METABOLIC_PROCESS	0.243122712620277	0.529744495875804	0.280075481753874	1.12907402255669	10030	52	CCR7 AKT2 XBP1 TGFB1 LYN CDC42 PTK2 PRKCD NR1H2 RAC1
GO_RESPIRATORY_SYSTEM_DEVELOPMENT	0.612564829889726	0.824273531269173	-0.229662265678932	-0.917333049897484	36495	64	BMPR2 NUMA1 HSPB11 AIMP2 MAP2K2 MAP2K1 THRA LIPA TIMELESS CTSZ HNRNPK SAV1 LTA4H EIF4EBP1 TGFBR2 THRB NPHP3 CREB1 SMAD2
GO_ION_HOMEOSTASIS	0.0175788591089138	0.098377314054099	0.263650238795217	1.33533193424169	607	195	CCR7 CD40 HSP90B1 BBC3 CALR TPCN2 XBP1 CCDC47 STIM2 TMBIM6 RAB7A PSEN1 SLC9A6 TGFB1 CLIC4 ATP6V0D1 ATP6V1F BCL2 B2M SMAD4 SLC9A1 ATP6V0E1 SLC11A2 ATP6V1E1 SLC9A8 NPTN SCO2 ATP5B ITPR3 ISCU CHERP S1PR1 SLC39A8 GPCPD1 COMMD1 TTC7A ATP6V0A2 NUBP1 SLC39A7 ATP6V0C ATP6V0B HIF1A SLC30A7 SWAP70 SGK1 MCOLN1 BDH2 ATP2B1 FTH1 ATP7A
GO_NEUROEPITHELIAL_CELL_DIFFERENTIATION	0.299737687124056	0.596060641103661	0.361411404949835	1.11943681431947	13254	18	HES1 BCL2 PAFAH1B1 RAC1 WDPCP HPS4 BCCIP
GO_NUCLEOSIDE_MONOPHOSPHATE_METABOLIC_PROCESS	0.888838673482109	0.96030368950384	-0.175596118770953	-0.816329366908111	57034	164	NT5E DHTKD1 NDUFS7 UQCRC1 NDUFS8 NDUFA3 ATP5I GMPR2 SDHAF2 TPI1 IMPDH1 SURF1 DUT CHCHD10 LHPP GMPS ATP5D NDUFV1 CMPK1 GPI UCKL1 COX15 AK3 PFKFB2 AK2 DTYMK NDUFB10 MSH2 AMPD3 FXN NDUFC1 NDUFA11 NADK NDUFA2 ATP6V1A COX10 PFKL CARD11 NDUFB6 DLG1 NDUFB11 NDUFB1 PAICS NDUFS5 NDUFS2 ATP5A1 CYCS ATP5H COX7A2L NDUFB7
GO_REGULATION_OF_GLUCOSE_TRANSPORT	0.013481713893519	0.0819333560027787	0.373551695300353	1.53506715166393	549	57	AKT2 MARCKS NFE2L2 INPP5K NUP155 RPS6KB1 PEA15 OSBPL8 PTPN11 RAE1 ADIPOR2 LMBRD1 NUP88 NUP153 SEH1L AKT1 RANBP2 NUP62 NUP37 RHOQ NUPL1 RAP1A NUP85
GO_NEGATIVE_REGULATION_OF_TRANSFORMING_GROWTH_FACTOR_BETA_RECEPTOR_SIGNALING_PATHWAY	0.0759896789790558	0.262373155332081	0.380562523265561	1.37330185939701	3268	32	PMEPA1 STRAP TGFB1 TGFBR1 PPM1A SKIL SNX25 SMURF1 SNX6 UBB CHST11
GO_ADHERENS_JUNCTION_ORGANIZATION	0.252301522194877	0.538108931499066	0.352590052511888	1.15431706883177	11071	22	WHAMM RAB8B BCL2 HIPK1 CDC42 PIP5K1A VCL TESK2 RCC2
GO_POSITIVE_REGULATION_OF_OSTEOBLAST_DIFFERENTIATION	0.480945360318099	0.743882045031348	0.331608653920003	0.976199893712814	21529	15	IL6 IL6ST CEBPB LMNA ILK IFITM1 CTNNB1 CLIC1
GO_MYD88_INDEPENDENT_TOLL_LIKE_RECEPTOR_SIGNALING_PATHWAY	0.0126143100041358	0.0772595751130503	0.49249323146567	1.66893260929053	548	25	TICAM1 TANK UBE2D3 RIPK1 TRAF3 BIRC3 UBE2D1 UBB BIRC2
GO_NEGATIVE_REGULATION_OF_SIGNAL_TRANSDUCTION_BY_P53_CLASS_MEDIATOR	0.125163945547465	0.360345800730464	0.427931856966322	1.32547747012767	5534	18	CD74 PSMD10 RFFL SENP2 DYRK1A
GO_POSITIVE_REGULATION_OF_LIPASE_ACTIVITY	0.715073945095202	0.876431859395394	0.266632478904997	0.825868272809329	31621	18	MARCKS PRKCD NR1H2 RHOA ARL1 ABHD5 ARF4
GO_POSITIVE_REGULATION_OF_ERK1_AND_ERK2_CASCADE	0.126151391340087	0.361979608758495	0.312682133318724	1.2498422569648	5217	50	CCR7 ICAM1 CD74 IL6 SLAMF1 CIB1 TIRAP PRKD2 PTPN11 NPTN BRAF DNAJC27 GCNT2 SEMA7A HRAS FBXW7 RASGRP1 HMGCR HMGB1 RAP1A ESR2 PTEN JUN LGALS9
GO_MITOCHONDRIAL_ATP_SYNTHESIS_COUPLED_PROTON_TRANSPORT	0.507980631276901	0.75931262772218	0.319643075840603	0.958423325519885	22659	16	ATP5L ATP5B ATP5G1 ATP5G3 ATP5F1 ATP5G2 ATP5S
GO_PURINE_NUCLEOSIDE_MONOPHOSPHATE_BIOSYNTHETIC_PROCESS	0.628740790515731	0.831312171258706	0.232089169615965	0.906401525467649	26198	45	ATP5L TGFB1 GBAS PRPS1 ATP5B HPRT1 ADSS AMPD2 ATP6V0A2 ATP5G1
GO_POSITIVE_REGULATION_OF_PEPTIDE_SECRETION	0.821894249162031	0.933567890456285	-0.224801583138052	-0.773007827577699	46833	32	TARDBP SRI PFKFB2 PHPT1 GLUL CD38 STX4 S100A9 JAK2 SOX4 PRKCE BAD PLA2G6 BLK IRS2 S100A8 PPP3CB
GO_STEROL_TRANSPORT	0.503856180751684	0.75674766726663	-0.342129788054703	-0.96539077405939	27830	15	ABCA7 ABCA1 SCP2
GO_REGULATION_OF_CHROMOSOME_ORGANIZATION	0.537670289300475	0.778506935014789	-0.204093137454011	-0.968627354142584	35125	192	CTBP1 NSD1 RAD50 ATRX NEK6 PARP1 FAM178A TERF1 RUVBL2 DUSP1 MAD2L2 PAX5 CAMK2D AKAP8 KAT2B MYC CDC26 ANAPC11 ATM AKAP8L OBFC1 CTC1 LCMT1 TERF2IP MRE11A TLK1 CENPV GORASP1 TPR ANAPC4 TADA3 WBP2 OGT RB1 ANKRD32 HDAC8 RTF1 C6orf89 PHF2 HMBOX1 CCT6A RPS6KA4 TAF7 ERCC1 SENP6 KAT2A MTHFR
GO_REGULATION_OF_CELL_MATRIX_ADHESION	0.21755798351543	0.498442661600707	0.298135851814911	1.15808856054268	9079	44	CCR7 NINJ1 CIB1 BCL2 SLC9A1 DAPK3 PTK2 CASK ILK RAC1 CLASP1 WDPCP PLEKHA2 RCC2 SLK PTEN BCL6 GSK3B ITGB1BP1
GO_VISUAL_BEHAVIOR	0.366039527836823	0.654473669941974	0.342583242073141	1.06111840382797	16186	18	KRAS MECP2 NPTN BRAF HIF1A SGK1 DEAF1 HMGCR
GO_LIPOSACCHARIDE_METABOLIC_PROCESS	0.375683358845397	0.663144445782156	-0.264728644517904	-1.04476813116447	22333	60	GPAA1 CTSA PLAUR ST3GAL5 HEXA ST6GALNAC6 PIGQ PIGP ASAH1 HEXB ST3GAL2 PIGF GLTP GM2A UGCG LARGE GLA BAX ALG1
GO_REGULATION_OF_CELL_ADHESION	3.16345575907121e-05	0.000663184000844283	0.314303048084036	1.67377416044389	0	295	NFKBID CCR7 PPP2R1A ZEB1 IL15 ICAM1 CALR XBP1 IRF1 PIK3CA NINJ1 CD74 HES1 BCL10 IL6 HLA-DPB1 HLA-DRA CD83 SASH3 RARA PTPN2 PDE3B PTPRO TGFB1 RICTOR PPP1CB PAK1 C10orf54 IL6ST SLAMF1 LYN GTPBP4 HLA-A PRKAR1A CYLD CIB1 BCL2 SLC9A1 ARPC2 PRKD2 CYTH1 PAWR DAPK3 HLA-DRB1 HLA-DPA1 PTPN11 CDC42 SIPA1 CEBPB CD3D SPOCK2 ATP5B ADAM8 HLA-DRB5 TRAF2 TNFRSF14 IL12RB1 PTK2 PRKCD BRAF CD5 MYADM NKAP RREB1 S1PR1 AP3D1 CASK FXYD5 HLA-DQB1 ILK IRF4 STX3 RAC1 SART1 SWAP70 GCNT2 BTN2A2 TFE3 RC3H1 MALT1 MARCH7 LPXN CLASP1 TESC WDPCP LCK PRELID1 ARHGDIA PIEZO1 AKT1 NCK1 CD47
GO_NEGATIVE_REGULATION_OF_TELOMERE_MAINTENANCE	0.366188641552511	0.654473669941974	-0.345021702957539	-1.06741527505332	20529	21	RAD50 PARP1 TERF1 ATM TERF2IP
GO_POSITIVE_REGULATION_OF_TRANSCRIPTION_FROM_RNA_POLYMERASE_II_PROMOTER	0.00108777194298575	0.0114761892813732	0.241792644054073	1.35740112543419	28	498	PSMC4 CD40 NFKB2 RELB NFKBIA ZEB1 AKT2 SQSTM1 ZNF268 BUD31 CRTC2 XBP1 IRF1 ATF3 BCL3 C19orf10 KDM6B HES1 STAT6 INSIG1 KDM3A IL6 THRAP3 NFE2L2 MTF1 NFKB1 CEBPG SS18 CCPG1 RARA CKAP2 USP16 TGFB1 SIN3A REL ATAD2B PSMC6 RNF4 MNAT1 RIPK1 RELA CHCHD2 CAMTA2 TRIM28 KAT5 STAT1 ZC3H12A CAMTA1 BATF EP300 SUPT5H SMAD4 IRF2BPL CBFB SLC9A1 RORA SENP2 E2F5 PRKD2 FOXJ2 AHI1 TBL1X CRLF3 CSRNP1 CEBPB ZNF564 LMNA ELL CD3D ARID4B NRF1 PLAGL2 UBE3A WWP2 ZNF639 PARK7 GTF2F1 YBX1 NR4A1 TNIP2 ATF1 TET3 ARNTL TCEB1 SUB1 PER1 MORF4L2 NR1H2 S1PR1 CASK PSMC3 CCNK RFX3 FOXK2 PSMC2 PCGF5 STAT3 IRF4 BACH1 ATAD2 UBB CCNT2 ATF4 HIF1A TFE3 CHD8 TAF2 CEBPD KLF6 ZNF292 PLAGL1 NRL SENP1 ATF6 GTF2A2 TNIP1 NRIP1 DHX36 PLSCR1 PSMC1 HRAS MED14 AKT1 NCK1 DDX41 HMGA1 NFAT5 MTF2 FOSB ZNF746 ELK3 SREBF2 CCNC GABPA ASH2L BLOC1S2 ZNF567 H2AFZ KAT6B GABPB1 ZNF350 NR3C1 ARF4 SUPT4H1 MED1 LMO4 NAMPT STK16 TRPS1 AUTS2 ZMIZ2 SP3
