pathway	pval	padj	ES	NES	nMoreExtreme	size	leadingEdge
GO_NEUROLOGICAL_SYSTEM_PROCESS	0.62266783813117	0.989539519198471	0.177503338462208	0.952490420028894	12047	211	HTT PDE6D TBL1X ARF4 UBR3 EYA3 HEXB CREB1 KCNAB2 PLK2 AAAS RPL38 HMGCR C5AR1 DEAF1 SLC9A3R1 RABGGTB PPP3CB TRPV2 OPA3 NRL AMFR MTOR PRNP NTAN1 PSEN1 JUN MECP2 WDR36 KRAS PBX3 UNC119 RPS6KB1 OPA1 GPX1 DNAJC19 EIF4A3 CBR3 SYNJ1
GO_DIGESTION	0.861557320530173	0.998729039889192	0.233708410771076	0.710533652117449	33735	15	ZNF830 EZR ACO1 LDLR VSIG1 P2RX7
GO_POSITIVE_REGULATION_OF_MITOTIC_NUCLEAR_DIVISION	0.919800377663879	0.998729039889192	0.19704189882224	0.677621069640568	34096	23	CUL3 ANKRD32 TERF1 RANBP1 PTEN PHIP
GO_HINDBRAIN_DEVELOPMENT	0.375574320129144	0.925622907425817	0.245900282581316	1.03787274987332	12097	53	ATP7A C5AR1 ARL13B NR2C2 MECP2 MAP2K1 OGDH HNRNPD EZH2 CLP1 SEC24B NOG ATF5
GO_OLIGOSACCHARIDE_METABOLIC_PROCESS	0.874068776446749	0.998729039889192	0.191063844995021	0.765293457560777	29331	42	ST6GALNAC4 MAN2B2 MAN2C1 HEXB MGAT4B MAN2A1 MGAT2 MANBA GLA IDUA ST3GAL5 ST6GAL1 ST8SIA4
GO_CHROMOSOME_SEGREGATION	0.121506626365961	0.66279969259068	0.221532107043941	1.1570680676409	2612	173	CHMP2A CKAP5 NUP98 MMS19 TOP2B STAG2 POGZ PPP2R1A PAPD7 CLIP1 RCC2 ITGB3BP CUL3 MAD1L1 CLASP1 ERCC4 RECQL5 AHCTF1 RANGAP1 CTCF TERF1 MIS12 CENPK BUB3 SEC13 PHF13 MCMBP CENPN RANBP2 UBE2B MAPRE1 DDX3X CEP57 RIOK3 SMC4 RNF212 SLC25A5 NEK3 NIPBL WAPAL ACTR3
GO_NEGATIVE_REGULATION_OF_CYCLIN_DEPENDENT_PROTEIN_KINASE_ACTIVITY	0.0629714315750743	0.546316158470174	0.445038127144497	1.4502507749303	2395	19	HEXIM1 PRKRIP1 DNAJC3 CUL3 APC C2orf40 PTEN CDKN1A FBXO31 FBXO7
GO_HEMATOPOIETIC_PROGENITOR_CELL_DIFFERENTIATION	0.898749961033698	0.998729039889192	0.180549269344273	0.765385265659087	28830	54	VPS33B KCNAB2 ZBTB24 REST PAPD4 PSEN1 AGPAT5 CHD2 SIN3A MED1 C12orf29 TMEM91 DHTKD1 BRAF EEF2 RRS1
GO_ANTEROGRADE_AXONAL_TRANSPORT	0.796662080712788	0.998729039889192	-0.265388255354071	-0.759095762709387	48640	16	AP3S1 AP3B1 KIF1B BLOC1S1 SPG7 DTNBP1
GO_NEGATIVE_REGULATION_OF_ERK1_AND_ERK2_CASCADE	0.672943921339888	0.998445603703041	0.241038986701177	0.873437510566129	24227	28	EZR SLC9A3R1 ATF3 PTPN2 NDRG2
GO_STEROID_BIOSYNTHETIC_PROCESS	0.454085433999752	0.950438971909412	0.235923323368634	0.995762940219013	14626	53	HMGCR C14orf1 INSIG1 HSD17B7 CYB5R3 HSD17B12 FDFT1 TM7SF2 GGPS1 MED1 ARV1 NSDHL PMVK CYP2R1 ACBD3 FDPS ACLY FDX1
GO_ALDITOL_PHOSPHATE_METABOLIC_PROCESS	0.479625262054507	0.968076511189587	-0.345247336751573	-0.987518419250198	29283	16	PLSCR1 LPCAT4 ABHD12 PLA2G16 PTDSS1
GO_REGULATION_OF_PROTEIN_TYROSINE_KINASE_ACTIVITY	0.956327442616291	0.998729039889192	-0.189178625502455	-0.624541249289838	61203	28	RAP2B ZGPAT CCL5 FBXW7 SH3BP5 ABI1 APP
GO_REGULATION_OF_INTERFERON_BETA_PRODUCTION	0.766153403367391	0.998729039889192	0.215149474717509	0.825376771222825	26619	35	TRAF3 IRF3 TICAM1 NLRX1 ZC3HAV1 DDX3X
GO_DNA_TEMPLATED_TRANSCRIPTION_ELONGATION	0.0342048082988715	0.433676441898102	0.297381252167025	1.37697840652712	975	83	TAF2 ENY2 CCNT1 IKBKAP TAF10 CTDP1 ERCC3 ELP2 POLR1E ELL2 ELP3 TAF5 GTF2E2 TAF4 MNAT1 POLR2K POLR2A ZNRD1 TAF6 POLR2G TAF12 SUPT16H CCNK CCNH UBTF TAF13 PAF1 TCEB1 GTF2F1
GO_N_GLYCAN_PROCESSING	0.217865566037736	0.813298871401299	-0.424388637971386	-1.21388799363516	13301	16	GNPTG MAN1A2 MGAT4A
GO_ENDOPLASMIC_RETICULUM_TO_CYTOSOL_TRANSPORT	0.291377805166127	0.879577279943733	0.362978405908783	1.12509198112463	11347	16	VCP SEC61B DERL1 HERPUD1 SYVN1 HSP90B1 SEL1L TMEM129 DERL2 CCL3
GO_NEGATIVE_REGULATION_OF_REPRODUCTIVE_PROCESS	0.793940567849822	0.998729039889192	-0.256044385657959	-0.766919649832369	49186	19	RPS6KA2 CDKN1B PRKACA OSM
GO_REGULATION_OF_LYASE_ACTIVITY	0.0877556927827094	0.600580196911711	-0.457301482235842	-1.38809113436259	5456	20	CRHR1 NOS3 ADRB2 CALM3 PHPT1 NF1 TIMP2
GO_RESPONSE_TO_NITROGEN_COMPOUND	0.448839716312057	0.948549705908357	-0.202317456040157	-1.00880128830049	39553	405	BAIAP2 CRHR1 PTK2B MAPK3 DHFR CPEB4 RALB HLCS JAK2 PRKCQ MBD1 OGG1 PPARGC1B BAX STAT6 PDK2 FAS AIFM1 TSPO PTPRA PIK3R1 OGT FLOT1 AKT1 EGLN1 SCAP PSMB9 INPPL1 GSK3B ADRB2 GSN CAPN2 ATP6V1E2 CALM3 STXBP3 TSC1 ATRX SLC38A9 UROS TRIM16 MAP3K5 MGMT CDKN1B ASPH AKT2 KAT2B DROSHA GSTM3 PRKACA STXBP4 HNRNPK LAMTOR1 DNMT1 RRAGC LAMTOR2 NOD1 DICER1 PPAT IL1B AP3S1 KHK ATP6V0E2 FER SMAD3 GNG10 PELI1 EIF4EBP1 TRAF2 DNMT3A DPYSL2 RRAGD MUL1 AKAP7 MAPK9 CCL5 RAPGEF1 MEN1 APPL1 ANXA5 STAT1 MAPK1 PDPK1 PXN GSTP1 NME1 RHOQ AKAP1 TRDMT1 CASP3 RFTN1 HNRNPA2B1 CDC5L CAT EIF2AK2 MEF2C BSG SELL GFPT1 CALM2
GO_NEGATIVE_REGULATION_OF_TRANSMEMBRANE_TRANSPORT	0.0877021815022028	0.600580196911711	-0.386360844044791	-1.35331832580449	5752	36	CRHR1 GRK6 AKT1 CALM3 FKBP1A COMMD1 AKT2 PPIF THBS1
GO_REGULATION_OF_DNA_RECOMBINATION	0.884273310683277	0.998729039889192	-0.202922703233867	-0.727582820715243	58560	40	RAD50 STAT6 SIRT6 MSH3 IFNG SMARCAD1 PAXIP1
GO_REGULATION_OF_LEUKOCYTE_PROLIFERATION	0.865789894894094	0.998729039889192	-0.183424309966529	-0.80257577839155	64909	123	CD86 PRKCQ HLA-E CD3E HLA-DRB5 TCF3 GPR183 MNDA TNFRSF4 FADD NFATC2 CD74 IFNG MZB1 SLC39A10 CD300A IL1B LST1 PELI1 CD81 BST1 IL12RB1 CCL5 CD4 GSTP1 LGALS9 CASP3 MEF2C HLA-DPB1 VAV3 HLA-DPA1 SPN HLA-DMB CD55
GO_RESPONSE_TO_ETHANOL	0.276392812418091	0.873200769085876	-0.289113409215261	-1.11978714186889	18980	59	PTK2B OGG1 FECH TP53INP1 GSN MGMT CD14 S100A8 DNMT1 IL1B EIF4EBP1 DNMT3A SETD7 G6PD CCL5 SDF4 GSTP1
GO_SULFUR_COMPOUND_METABOLIC_PROCESS	0.14169354535072	0.70149919173635	-0.254448920711537	-1.18015984245738	11289	192	GSTM4 ACOT9 HLCS GLB1 ACSF3 ACOT2 SLC35B3 MTHFD2L ACACA GCLM PAPSS1 ALDH5A1 ELOVL1 OXSM VNN2 HMGCL GNS SLC5A6 PPT1 GLRX2 CHPF2 CHST7 TPK1 TXN VCAN SMS SLC35D2 MAT2A SLC26A2 GSTM3 DNMT1 GGT7 B4GALT3 DNMT3A ARSG G6PD B4GALT1 GSTK1 XYLT1 ACSL6 EXT2 ACSL1 GDAP1 AGPAT6 GSTP1 FAR1 HPSE CSGALNACT2 TPST2 CSAD SQRDL ENOPH1 XYLT2 CSGALNACT1 MPST SLC25A1 MCEE ST3GAL1 MLYCD MTHFD1 DSE GCLC SUCLG2 AGK ICMT
GO_REGULATION_OF_CELL_CYCLE_CHECKPOINT	0.892194193241314	0.998729039889192	0.211409178262986	0.698748122742682	33740	20	BRD4 RPA2 RINT1 LCMT1
GO_POSITIVE_REGULATION_OF_DNA_REPLICATION	0.391966379389104	0.929863721591279	0.249290901551747	1.03026736229307	12870	48	CCT2 ATR CCT3 CCT4 TCP1 DKC1 TNFAIP1 HNRNPA1 JUN MAP3K4
GO_NEGATIVE_REGULATION_OF_NEURON_APOPTOTIC_PROCESS	0.0512916188289323	0.508809887916542	-0.346822282128304	-1.37914819698346	3573	68	PTK2B CPEB4 JAK2 GCLM LGMN BAX PPT1 OXR1 F2R HIPK2 SOD2 VEGFB LIG4 PINK1
GO_NUCLEOTIDE_PHOSPHORYLATION	0.843758098693538	0.998729039889192	-0.216140819913263	-0.757083273451789	55347	36	RAD50 PFKP AK5 PNKP TPI1 NME2
GO_POSITIVE_REGULATION_OF_GENE_EXPRESSION_EPIGENETIC	0.988809984936518	0.998729039889192	0.149111673823578	0.624179449403047	32164	51	POLR1E HIST4H4 BAZ1B ARID1A POLR2K ZNRD1 WBP2 HIST1H3D HIST1H3H DDX21 PHF2 SMARCA5 ATAD2B HMGA1 POLR1D POLR1A POLR1C TAF1A EP300 DEK ATAD2 HIST1H4F
GO_REGULATION_OF_MRNA_METABOLIC_PROCESS	0.0849855242423132	0.600580196911711	0.26280264847344	1.24712828056534	2318	95	CCNT1 SUPT6H SRSF2 MBNL2 PRPF19 SYNCRIP CWC22 YTHDC1 RNF40 CDK11A RBM42 RBM25 RNF20 CTR9 DYRK1A CDK11B ZC3HAV1 MAGOH PTCD2 SECISBP2 JMJD6 POLR2G SAP18 SFSWAP DHX34 SAFB RBM15B HSPA8
GO_POSITIVE_REGULATION_OF_PROTEIN_BINDING	0.267645179980093	0.873200769085876	-0.301364584875796	-1.12973733015399	18015	50	RALB ADD1 PACS1 ZNF268 FLOT1 B2M GSK3B HIPK2 PLCL2 FKBP1A RAN DACT1 TRAF2 ARRB1 MEN1
GO_SENSORY_PERCEPTION	0.879996733493937	0.998729039889192	-0.183621759028654	-0.783759915325471	64655	104	BBS2 MAPK3 RPGR CYP4V2 PPT1 MKKS HPS1 CDKN1B PRR4 IFNG CCDC50 DRAM2 CD36 COL18A1 KPTN NIPSNAP1 CDKN2D NDUFB9 ALOX5 RAB3A RABGGTA LXN MAPK1 CHD7 CASP3 LRIG1 CRYBB2 LEF1
GO_HEPATICOBILIARY_SYSTEM_DEVELOPMENT	0.203152826330717	0.795545342173089	0.257409466640719	1.14602940502329	6159	68	RARA JARID2 FPGS AACS CEBPG RHBDD3 CUL3 JUN HNRNPD UROD ALDH9A1 PTCD2 MAN2A1 ANXA1 SRSF5 MED1 NIPBL RB1CC1 DBP
GO_FATTY_ACID_CATABOLIC_PROCESS	0.724723410532527	0.998729039889192	-0.223849773119735	-0.848799380606621	49128	53	CPT2 ALDH3A2 PPARD PEX2 LPIN2 ABCD1 SLC25A17 ETFA ABCD2 DECR1 IVD PHYH
GO_REGULATION_OF_VESICLE_FUSION	0.161481183958475	0.729239197056977	-0.367434501217426	-1.25248090823996	10452	32	ANKRD27 RUNDC1 VPS41 VPS18 AKT2 EVI5 SGSM3 TBC1D5 RAB3A SGSM2 RABGAP1L VPS11
GO_MITOCHONDRIAL_RESPIRATORY_CHAIN_COMPLEX_I_BIOGENESIS	0.682433464723317	0.998729039889192	0.212851827608918	0.88363767013945	22333	49	NDUFS8 NDUFV1 OXA1L NDUFV3 NDUFAB1 NDUFS3 NDUFA8 NDUFS2 NDUFA2 FOXRED1 NDUFB6 NDUFAF3 NDUFS6
GO_REGULATION_OF_LIPID_STORAGE	0.5349265874277	0.975219757727151	-0.301339552607604	-0.948313889946181	33663	23	MEST ABHD5 ITGAV FTO CD36
GO_CARBOHYDRATE_TRANSPORT	0.101378604539161	0.621711798132443	-0.363855408411834	-1.31786424069161	6735	42	SLC35A5 SLC5A2 SLC2A6 AKT1 PPARD RAB4B SLC2A13 STXBP3 TSC1 SLC35D2 AKT2 STXBP4
GO_REGULATION_OF_CELLULAR_RESPONSE_TO_GROWTH_FACTOR_STIMULUS	0.69129743554296	0.998729039889192	-0.211289805054459	-0.883708839546804	50004	91	PTP4A3 NEO1 TOB1 MTMR4 GREM2 FAM89B HIPK2 VEGFB PDCD6 THBS1 TWSG1 IL1B SMAD3 FBXL15 BMPR2 CASK MEN1 STUB1 PDPK1 CITED2 FKBP8 ITGA5 GLG1 BCL9 TRIM33 DUSP6 MYO1C
GO_EMBRYO_DEVELOPMENT_ENDING_IN_BIRTH_OR_EGG_HATCHING	0.292313887930043	0.879577279943733	0.191560606732783	1.04977554424467	5080	250	ATP7A RARA ZFAND5 SMAD4 GABPA UBR3 CHD8 ZNF830 AXIN2 EIF2S2 WDTC1 SRSF1 CNOT2 EPN1 PRPF19 GLMN DEAF1 CUL3 NASP INPP5B TPM1 ARL13B PSEN1 KIDINS220 ALKBH1 PHACTR4 CASP8 SKI PSMC4 MAP2K1 PYGO2 INPP5K EPB41L5 NCAPG2 CTR9 ARID1A XAB2 SEC24B SBDS EIF4A3 COL4A3BP TAB1 UBE2B TCTN1 NOG KDM6A SIN3A MAN2A1 MAPK8IP3 GNA13 MED1 ACVR1 NIPBL FXN IFT57 RCN1 NSDHL SKIL ZFP36L1 RARG ZNF259 DVL3 IFT172 ZNF335 UBE2A PHGDH GNAS NDEL1
GO_ANTIGEN_PROCESSING_AND_PRESENTATION_OF_PEPTIDE_OR_POLYSACCHARIDE_ANTIGEN_VIA_MHC_CLASS_II	0.658546441147607	0.995935079751018	-0.226572041774021	-0.891198826561667	45631	64	AP1M1 LGMN CANX HLA-DRB5 AP1S1 AP2A1 CD74 CTSD SEC24D HLA-DMA DCTN4 HLA-DQB1 HLA-DPB1 ACTR1B DCTN5 AP2M1 HLA-DPA1 HLA-DMB
GO_RESPONSE_TO_IONIZING_RADIATION	0.339136257114161	0.896440484753441	0.219732156209617	1.05034879901266	9116	99	BRE RNF8 POLG FIGNL1 RNF168 EYA3 ATR RHOB PML RAD1 TOPBP1 TMEM109 RAD51D MECP2 HUS1 GPX1 TP53 RRM1 ANXA1 PMAIP1 NIPBL CDKN1A BAK1 CYP2R1 XRRA1 MAPK14 H2AFX
GO_PROTEIN_EXPORT_FROM_NUCLEUS	0.476036584409269	0.966031480395596	-0.304856498322051	-0.988573886829815	30343	26	NUPL2 NUTF2 STRADB GSK3B XPO4 RAN XPO1
GO_EPITHELIUM_DEVELOPMENT	0.841189082691082	0.998729039889192	-0.17484000150361	-0.860267160307274	72581	344	TSC2 ZEB2 APAF1 PSAP JAK2 C5orf42 ALDH3A2 ITPK1 WAS BAX STAT6 FLOT2 BMPR1A RAP2B EPHA4 IQGAP1 STX2 AKT1 C1orf172 YIPF6 KLHL3 TSC1 ATRX MKKS USP13 CSTA MGMT IFT122 CDK6 TMEM79 RILPL2 TOLLIP AKT2 GSTM3 SIPA1L3 ARHGAP12 PRKACA AIMP2 VCL KLF5 NF1 COL18A1 ANXA4 C12orf5 MKS1 RAD51B PTER DACT1 FMN1 CBR1 SMAD3 TCF7 TIMELESS KDM2B ARHGAP35 UGCG BMPR2 FZD3 CNN3 PFN1 RDX B4GALT1 GSTK1 FABP5 RAPGEF1 MEN1 CXCR4 FZR1 AGPAT6 ID2 STAT1 MAPK1 CHD7 CASP6 PDPK1 CITED2 ATP6AP2 CASP3 FKBP8 RAB27A C2CD3 HBEGF CAT MEF2C TXNIP SEMA4C ESR1 LEF1 ITGA5 ABI1 TPP1 CCM2 RAPGEF2 PCNA KAT2A
GO_PROTEIN_LOCALIZATION_TO_CYTOSKELETON	0.70628540598867	0.998729039889192	0.245599320694811	0.844608559839103	26181	23	PCM1 AZI1 CRIPT DCTN2 MAPRE1
GO_NUCLEAR_ENVELOPE_REASSEMBLY	0.115493247060032	0.648164019701069	0.434386399630665	1.34642900783712	4497	16	CHMP2A PPP2R1A LMNA PPP2R2A EMD CHMP7 VRK1 REEP4
GO_INTRINSIC_APOPTOTIC_SIGNALING_PATHWAY_IN_RESPONSE_TO_DNA_DAMAGE_BY_P53_CLASS_MEDIATOR	0.574199490708132	0.982540819187032	0.265498928580676	0.923751944604398	21195	24	DYRK2 PML TMEM109 TP53 HIPK1 PMAIP1 CDKN1A
GO_REGULATION_OF_AUTOPHAGY	0.0072792078213833	0.206861390569966	-0.310799887198874	-1.44152132729312	579	192	MAPK3 RALB WDR6 SNX5 VPS13C PSAP ULK2 PIP4K2B LRSAM1 SNRNP70 HTRA2 CTSA TSPO CAPNS1 CAPN1 EIF2AK4 AKT1 TP53INP1 TRIM65 TRIM13 ADRB2 ATP6V1E2 DAP TSC1 USP13 DAPK3 DNM1L PINK1 IFNG GBA DRAM2 C12orf5 CSNK2A2 RRAGC TBC1D5 NOD1 EXOC7 UVRAG HAX1 ATP6V0E2 ATG7 ZKSCAN4 RRAGD TMEM59
GO_PHOSPHOLIPID_METABOLIC_PROCESS	0.845359162615339	0.998729039889192	-0.178928910764567	-0.838212703582418	68162	210	PIP5K1C CD86 ALDH5A1 PIP4K2B PIGF PIGP TMEM150A MTMR4 PIK3R1 ABHD5 DPM3 PPARD PLA2G6 SLC44A1 INPPL1 ABHD6 PIGW PLSCR1 FAM126A NRG2 LPCAT4 SH3YL1 ABHD12 PLA2G16 CHPT1 LPCAT1 CPNE3 LPIN2 PLEK DOLK PIGK PTDSS1 IMPA1 PIGV PLD2 MTMR2 PNPLA6 FABP5 PIGM GPAA1 IP6K1 AGPAT6 PGAP2 ABHD3 GPD1L TMEM55A FAR1 DBI PPAP2A HBEGF GPCPD1
GO_AMMONIUM_ION_METABOLIC_PROCESS	0.497356896869376	0.970153724101699	-0.242236417392837	-0.980082538342449	35093	75	AKR7A2 COMT PLA2G6 SLC44A1 LPCAT4 PLA2G16 SMS SARDH CHPT1 LPCAT1 LPIN2 GBA DNMT1 DNMT3A PNPLA6 FABP5 ADC AGPAT6 ABHD3 DBI BTBD9 ACER3 SRD5A1 HPRT1
GO_REGULATION_OF_INTERLEUKIN_4_PRODUCTION	0.164582899771079	0.732901331152178	-0.412304300541211	-1.26781782117961	10280	21	CD86 PRKCQ HLA-E CD3E HLA-DRB5
GO_NCRNA_CATABOLIC_PROCESS	0.989318543624506	0.998729039889192	0.16702107080689	0.517700404169233	38529	16	ZCCHC11 DIS3 EXOSC10 EXOSC8 XRN1 EXOSC9
GO_REGULATION_OF_FAT_CELL_DIFFERENTIATION	0.925305520438264	0.998729039889192	-0.190758045282315	-0.690915129169251	61480	42	CREBL2 AKT1 PPARD FTO TRIB2 KLF5 SMAD3
GO_REGULATION_OF_RNA_STABILITY	0.0142692016421539	0.311857156942338	0.283884512780179	1.40540513330694	357	122	ZC3H12D QKI PSMD2 METTL3 ANGEL2 TNFRSF1B AXIN2 PUM2 PSMA6 DKC1 SYNCRIP PSMA3 MTOR NUP214 RBM38 PSMC4 HNRNPD HNRNPU SLC11A1 DIS3 PSMC6 RNASEL MAPKAPK2 HNRNPC EXOSC1 ZFP36L1 PRKCA DHX9 PSMD11 PAIP1 HSPA8 EXOSC8 PSME3 PARN MAPK14 PSMB5 TNPO1 UBA52 ANP32A THRAP3 SERBP1 XRN1 PSMB3 EIF4G1
GO_NEGATIVE_REGULATION_OF_CELL_DEVELOPMENT	0.442640372353305	0.948549705908357	-0.233191832502158	-1.00974328705471	32904	114	SEMA4F MBD1 ULK2 GAK SORL1 TRIM62 BMPR1A TSPO CTDSP1 EPHA4 EIF2AK4 DYNLT1 B2M GSK3B HOOK3 KANK1 GORASP1 KATNA1 NF1 TRIM11 DICER1 IL1B ITGB1BP1 RAP1GAP2 ZHX2 ID2 STAT1 LGALS1 RNF6 SYNGAP1 MAD2L2 SEMA4C CDK5RAP2 RAPGEF2 APP ITM2C FAM101B
GO_CELLULAR_PROTEIN_COMPLEX_DISASSEMBLY	0.0202043047231332	0.344198463026915	0.28970521754905	1.39704992538316	535	104	MRPS26 MRPS28 MRPL34 MRPS14 MRPL32 MRPL4 MRPL38 MRPL21 MRPL43 MICAL3 MRPS18A MRPL3 MRPS36 MRPS33 MRPL55 MRPS30 TRMT112 PTCD3 MRPS5 MRPL44 SYNJ1 NAPB MRPL11
GO_BODY_MORPHOGENESIS	0.764582804970834	0.998729039889192	-0.250811982010739	-0.797217304197242	48235	24	RRAS GREM2 IFT122 ASPH
GO_SOMATIC_STEM_CELL_POPULATION_MAINTENANCE	0.672637184269727	0.998445603703041	0.231519224423803	0.875559036361363	23620	33	SMAD4 BCL9L SKI POLR2K POLR2A NOG POLR2G BRAF KLF4
GO_CYTOPLASMIC_MICROTUBULE_ORGANIZATION	0.0308368802322632	0.40920366641384	0.407479242596141	1.51571270137615	1093	31	FIGNL1 TUBGCP5 PCM1 EZR CRIPT CLASP1 SLK TUBGCP6 CIB1 PLK3 TUBGCP3 IFT172 SLAIN2
GO_POSITIVE_REGULATION_OF_PHOSPHOLIPASE_ACTIVITY	0.523771978238587	0.974572409392375	0.291457034719234	0.949774333207225	19928	19	ARL1 ARF4 C5AR1 LPAR2 GNA13
GO_NEGATIVE_REGULATION_OF_PEPTIDYL_TYROSINE_PHOSPHORYLATION	0.0881597639602229	0.600580196911711	0.38736874795544	1.36218150464672	3226	25	PPP2R1A SAMSN1 PTPN2 PSEN1 SEMA4D GNB2L1
GO_NUCLEOSIDE_DIPHOSPHATE_METABOLIC_PROCESS	0.984260198592026	0.998729039889192	0.152829932050686	0.639744028040133	32016	51	ALDOC DLG3 BPGM HK1 PGK1 OGDH ENTPD4
GO_MICROTUBULE_POLYMERIZATION_OR_DEPOLYMERIZATION	0.128810358780685	0.679219066459423	0.377116793978074	1.29689313208141	4774	23	TUBGCP5 MAP7D3 CLASP1 TUBGCP6 AKAP9 TUBGCP3 BLOC1S2 SLAIN2 NDEL1
GO_RESPONSE_TO_AMMONIUM_ION	0.448973691818445	0.948549705908357	0.306806284038504	0.999793105447478	17082	19	AIF1 GNAI2 HNRNPD SIN3A PPP1R9B ADRBK1
GO_REGULATION_OF_GLUCOSE_IMPORT	0.168343393695506	0.738753968106304	-0.374797428663775	-1.24751611122146	10792	29	CREBL2 PIK3R1 AKT1 SIRT6 AKT2 MZB1 NFE2L2 APPL1 RHOQ ESR1 MARCKS LMBRD1
GO_NEGATIVE_REGULATION_OF_PROTEOLYSIS	0.23432081226758	0.840619587854106	0.21655010610443	1.09622708512506	5607	139	HTT SPINT2 PIH1D1 BIRC2 PML FNIP1 USP47 IDE NR1H2 MAD1L1 MDM2 SERPINB8 DNAJB2 CD44 USP14 SENP1 PSEN1 NGFRAP1 TERF1 CASP8 BUB3 APC PRDX3 CARD16 USP19 GPX1 DDX3X SUSD4 ARL6IP1 NAIP TNFAIP8
GO_REGULATION_OF_EPITHELIAL_CELL_APOPTOTIC_PROCESS	0.219723019653617	0.817205090380562	-0.373059382439136	-1.19813995874892	13929	25	GSN PIAS4 TNIP2 THBS1 NFE2L2 COL18A1
GO_PHOSPHATIDYLCHOLINE_METABOLIC_PROCESS	0.175627127684609	0.754645307031295	-0.384210769078657	-1.24590007246202	11194	26	PLA2G6 SLC44A1 LPCAT4 PLA2G16 CHPT1 LPCAT1 LPIN2 PNPLA6 FABP5 AGPAT6 ABHD3 DBI
GO_METENCEPHALON_DEVELOPMENT	0.238860763241259	0.846846804148839	0.288936745442573	1.14271999617466	8067	40	ATP7A NR2C2 MECP2 MAP2K1 OGDH HNRNPD EZH2 CLP1 SEC24B
GO_ACTIN_FILAMENT_BUNDLE_ORGANIZATION	0.160754906421097	0.727558309442623	-0.389453025762561	-1.26289940852436	10246	26	BAIAP2 PTK2B ADD1 KCTD13 NEDD9 ZYX KIAA1598 ARRB1 LIMA1 FAM101B PHACTR1
GO_CELLULAR_RESPONSE_TO_VIRUS	0.765847645656997	0.998729039889192	-0.277887459983743	-0.781026242612545	46597	15	BCL2L11 PSMB9 IRF7 LGALS9
GO_RESPIRATORY_GASEOUS_EXCHANGE	0.278813900442775	0.873200769085876	0.33161804696539	1.12612639510653	10389	22	ZFAND5 BPGM MECP2 COX5B KDM6A MAN2A1 MAPK8IP3 TRAF4 ADH5 STK40
GO_NEGATIVE_REGULATION_OF_PROTEIN_MODIFICATION_BY_SMALL_PROTEIN_CONJUGATION_OR_REMOVAL	0.957755775577558	0.998729039889192	0.156031924470535	0.761087950001817	24666	112	CDC16 PSMD2 PML DNAJA1 PSMA6 GLMN DNAJB2 UBR5 PSMA3 MTOR CCDC23 PSEN1 PSMC4 BUB3
GO_AMINO_ACID_ACTIVATION	0.297652038858605	0.879577279943733	0.263679175858441	1.08973110254847	9773	48	MARS SARS IARS GARS TARS EPRS AARS2 SARS2 HARS NARS
GO_DENDRITIC_CELL_DIFFERENTIATION	0.644985963308742	0.995935079751018	-0.299645783918496	-0.870687483128442	39516	17	CD86 AZI2 LTBR LGALS9
GO_REGULATION_OF_PROTEASOMAL_UBIQUITIN_DEPENDENT_PROTEIN_CATABOLIC_PROCESS	0.269998070615474	0.873200769085876	0.22262701963777	1.08284041972321	6996	110	ARIH1 PLK2 VCP GLMN RCHY1 CUL3 MAD1L1 MDM2 NUB1 DNAJB2 RNF14 SENP1 PSEN1 TERF1 CSNK1A1 RNF114 BUB3 ARAF APC GNB2L1 RNF138
GO_NEGATIVE_REGULATION_OF_NEURON_DIFFERENTIATION	0.801759863752484	0.998729039889192	-0.202210187961459	-0.816295419819893	56491	74	SEMA4F ULK2 GAK CTDSP1 EPHA4 EIF2AK4 B2M GSK3B KANK1 GORASP1 KATNA1 IL1B RAP1GAP2 ZHX2 ID2 LGALS1 RNF6 SYNGAP1 SEMA4C CDK5RAP2 RAPGEF2 APP ITM2C
GO_REGULATION_OF_SKELETAL_MUSCLE_TISSUE_DEVELOPMENT	0.90075954690005	0.998729039889192	0.211338656804796	0.688691669566481	34272	19	HMGCR RPS6KB1 USP19 HDAC4 ARNTL MTM1 NACA PRKAA1 TGFB1
GO_MUSCLE_TISSUE_DEVELOPMENT	0.32971674069759	0.893659365588066	0.223270934721371	1.05551425830556	9055	93	RARA ZFAND5 FLNB KDM6B ZNF689 BCL9L ATF3 CBY1 LMNA MTOR NPRL3 TPM1 SLC9A1 SKI ARID1A GPX1 PTCD2 MED1 ACVR1 PTEN PLAGL1 SKIL MAPK14 FOXN2 TAZ SIK1 SGCB EMD EEF2 CALR NDUFV2 EGR1 CDC42 S1PR1
GO_POSITIVE_REGULATION_OF_ADAPTIVE_IMMUNE_RESPONSE	0.198672061417159	0.788516831574437	-0.316024415667331	-1.18946816783881	13404	51	NCR3 PRKCQ HLA-E STAT6 MAP3K7 EIF2AK4 B2M FADD IFNG PAXIP1 IL1B TRAF2 IL12RB1 STX7 CD4
GO_REGULATION_OF_OSTEOCLAST_DIFFERENTIATION	0.663281808851429	0.996837574450825	-0.259138554995214	-0.869370152608991	42652	30	PPARGC1B PIK3R1 TYROBP MAFB IFNG NF1 CCL5 ESRRA
GO_REGULATION_OF_PROTEIN_BINDING	0.0632483714895802	0.546316158470174	-0.306165276503399	-1.31537174869206	4679	108	MAPK3 RALB ADD1 PACS1 BAX ZNF268 SORL1 ADAM15 GREM2 FLOT1 B2M ITGA4 GSK3B HIPK2 PCBD1 ADRB2 PLCL2 FKBP1A HOPX RUVBL2 PRKACA HNRNPK RAN DACT1 TRAF2 GTPBP4 ITGB1BP1 ARRB1 MEN1 STUB1
GO_CARDIAC_SEPTUM_DEVELOPMENT	0.292792664521457	0.879577279943733	0.292329875586042	1.10553266064517	10281	33	RARA SMAD4 MDM2 NPRL3 NOTCH2 RBM15 TAB1 WHSC1 ACVR1
GO_REGULATION_OF_HISTONE_METHYLATION	0.315279112431205	0.890626906515734	0.279406670255276	1.08516547573335	10826	37	JARID2 SMAD4 PIH1D1 SUPT6H CTCF MECP2 PYGO2 RNF20 MTF2
GO_INTERMEDIATE_FILAMENT_BASED_PROCESS	0.155451132619966	0.723038896802986	0.422298900614134	1.2838972253868	6086	15	TOR1A KRT18 AGFG1 CSNK1A1 NDEL1 ATXN3 SOD1 MTM1
GO_COGNITION	0.223549115269788	0.82240327898808	0.236153285356398	1.11641562369256	6139	93	HTT ARF4 CREB1 PLK2 AAAS HMGCR DEAF1 PPP3CB AMFR MTOR PRNP NTAN1 PSEN1 JUN MECP2 KRAS RPS6KB1 EIF4A3 CBR3 SYNJ1 RP9 NIPBL PTEN
GO_RESPONSE_TO_ZINC_ION	0.564514078688108	0.982540819187032	-0.295151408139301	-0.928839833847324	35525	23	D2HGDH TSPO SLC30A4 S100A8 KHK MT1X
GO_AXIS_SPECIFICATION	0.164190884234856	0.732137070373413	0.330357385105913	1.22884022608907	5824	31	SMAD4 AXIN2 ETS2 ARL13B SKI EPB41L5 KDM6A IFT172 DDIT3 AHI1 SMAD2 SENP2
GO_PHOSPHATIDYLINOSITOL_METABOLIC_PROCESS	0.561728227902946	0.982540819187032	-0.221433079926528	-0.949837619377977	41486	107	PIP5K1C CD86 PIP4K2B PIGF PIGP TMEM150A MTMR4 PIK3R1 DPM3 INPPL1 PIGW FAM126A NRG2 SH3YL1 PLA2G16 PLEK PIGK IMPA1 PIGV MTMR2 PIGM GPAA1 IP6K1 PGAP2
GO_CELL_PART_MORPHOGENESIS	0.0403478636893251	0.472034176343649	-0.266532820888449	-1.27954775377952	3358	264	BAIAP2 BBS2 MAPK3 SSX2IP ANKRD27 ZEB2 RPGR TMEM231 RFX2 C5orf42 SEMA4F PRKCQ ULK2 BAX TTC30B NEO1 LLGL1 SPG11 FOPNL EPHA4 PTPRA EIF2AK4 IQGAP1 FLOT1 TTLL5 ZNF280C DYNLT1 AFG3L2 NUBPL SPON2 GSK3B ARL3 SLC11A2 GSN MKKS DBNL TMEM237 IFT122 KIAA1377 C21orf59 DNM1L NEK1 WDR35 VCL PLEKHO1 DICER1 MKS1 ROBO3 TRIM59 FMN1 FIS1 SNX10 FZD3 ACTR2 PNPT1 DPYSL2 PLXNC1
GO_RESPONSE_TO_ORGANOPHOSPHORUS	0.849183660504415	0.998729039889192	0.186923113660224	0.804112775890534	26733	58	SREBF1 PDE4D SSH1 BIRC2 EZR JUN AKAP9 INPP5K
GO_AXO_DENDRITIC_TRANSPORT	0.588998517621181	0.982584886378682	-0.292999177401397	-0.912037714627537	36951	22	SPG11 AP3S1 AP3B1 KIF1B BLOC1S1 SPG7 WDR81 APP DTNBP1
GO_SINGLE_ORGANISM_MEMBRANE_FUSION	0.538759579903491	0.975219757727151	-0.237222440151396	-0.957635188049931	37960	74	BAX EEA1 VAMP5 VAMP1 VPS41 STX2 AFG3L2 VTI1B NSF STX16 UVRAG SNAP47 FIS1 SYTL2 VCPIP1 STX7 GDAP1 VPS4A STX11 TGFBRAP1 VPS11 VAMP3 SEC22A VAV3
GO_REGULATION_OF_PROTEIN_UBIQUITINATION_INVOLVED_IN_UBIQUITIN_DEPENDENT_PROTEIN_CATABOLIC_PROCESS	0.973575440703713	0.998729039889192	0.1534464091942	0.713558895091182	27558	85	CDC16 PTK2 PSMD2 PML PSMA6 PSMA3 PSEN1 PSMC4 BUB3 PSMC6 SMURF1 SKP1 ANAPC7 CDC27 PTEN PSMD11 PSME3 PSMB5 UBA52 UBE2D1 CUL1 PSMB3
GO_POLYSACCHARIDE_BIOSYNTHETIC_PROCESS	0.940194781388973	0.998729039889192	-0.202870978369568	-0.631489771122993	58984	22	AKT1 AKT2 EXT2 CSGALNACT2 CSGALNACT1 UGP2 PGM1 GBE1 UBB
GO_REGULATION_OF_TYROSINE_PHOSPHORYLATION_OF_STAT_PROTEIN	0.820257896732947	0.998729039889192	0.221696289224492	0.771349170324332	30278	24	PPP2R1A IL23A PTPN2
GO_ORGAN_REGENERATION	0.94118274165791	0.998729039889192	-0.188624406325955	-0.66460792102673	61798	37	FAS ADRB2 PRMT5 PPAT GSTP1 LEF1 UPF2 ATIC
GO_GLAND_MORPHOGENESIS	0.336674545092121	0.893659365588066	0.283543589535642	1.07230469797109	11822	33	EDAR PML EZR SLC9A3R1 CUL3 NOG MED1 EDA RARG
GO_NEGATIVE_REGULATION_OF_ADAPTIVE_IMMUNE_RESPONSE	0.167184035476718	0.738305913812352	0.392012412493053	1.25847589806766	6408	18	SAMSN1 PPP3CB SLAMF1 TRIM27 NDFIP1 SUSD4
GO_RIBOSOME_BIOGENESIS	6.33834062242505e-05	0.00513722991655481	0.324723651032194	1.80688739459142	0	287	SART1 UTP11L EIF2A POP4 RPL28 RPL26 METTL16 FTSJ3 RPL24 RPS29 NHP2L1 SURF6 RIOK2 RCL1 EBNA1BP2 FASTKD2 RPL38 SENP3 IMP4 DKC1 RPL27A RPS26 NOP10 PA2G4 RPP21 RPL8 RPL12 RPL36A ZNF622 RPS15 RPS2 PIN4 WDR36 FAU DDX51 FCF1 RPL7A RPS23 RPL27 RPL23A RPL10 TRMT112 ABT1 NOC4L RRP1 DDX31 UTP3 ERAL1 RPS5 FBL RPSA GAR1 RPL10A HEATR1 SBDS EIF4A3 LSG1 RPS14 PWP2 RPS25 DIS3 RPL3 RNASEL DDX3X RPL9 RPL13A MRPL11 RPS28 ORAOV1 RIOK3 NMD3 RPS21 RPL15 GEMIN4 RPL18 RPL41 NUP88 RPL31 RPLP2 RPL35A EXOSC10 EXOSC1 NSA2 RRP36 RPL36 RPL7 RPS12 RPS18 C7orf60 RPL34 ISG20L2 EXOSC8 RPS27 DDX56 NOC2L BMS1 RPS9 RPLP0 RPL23 RPF2 RPS3 NOP14 DDX21 NOL11 RPL14 UBA52 RPL37A TFB2M RRS1 RPL30 RPS15A MRTO4 RPS11 RPL4 DDX28 RPL11 RIOK1 RRP1B DIEXF RPLP1 SKIV2L2 NGDN RPS16 RPS8 RPL32 UTP20 UTP23 SUV39H1 EXOSC9 XRN2 RRNAD1 MRPS7 UTP6 RPL39 NLE1 NSUN4 KRR1 RPL22 RPL13 PNO1 RSL24D1 RPP14 RPL37 UTP15 RPL29 GNL2 NPM1 RPL7L1 NAT10 DCAF13 RPL17 MTG1 GNL3 RPP30 DDX27 RPS27A PPAN
GO_B_CELL_HOMEOSTASIS	0.445165094339623	0.948549705908357	-0.354208301140618	-1.01314965936834	27179	16	BAX BCL2L11 RC3H2 CASP3 MEF2C
GO_IRE1_MEDIATED_UNFOLDED_PROTEIN_RESPONSE	0.113005299015897	0.647765100114032	0.307748679817293	1.26575439444226	3731	47	GOSR2 HDGF SEC61A2 DNAJC3 ARFGAP1 LMNA SEC61B SRPRB
GO_SINGLE_ORGANISM_BEHAVIOR	0.793244354817311	0.998729039889192	-0.191958045105364	-0.845294880970128	59789	129	BBS2 HTRA2 TSPO PPT1 COMT EPHA4 EIF2AK4 OXR1 PLA2G6 HIPK2 SLC11A2 ADRB2 TSC1 ABHD12 KAT2B THBS1 NF1 NQO2 NRGN IL1B ATP8A1 OSM CSTB ID2 CHD7 SYNGAP1 CASP3 GM2A MEF2C ITGA5 ADNP CNP RGS14 BTBD9 APP ZNF385A OXT SRD5A1 HPRT1 SGK1 APRT HRH2 FYN C12orf10 NCOA2 UBA6 IFT20 HDAC2 DLG4 STRBP RIC8A EIF4EBP2 PARK7
GO_POSITIVE_REGULATION_OF_ENDOCYTOSIS	0.292535820412486	0.879577279943733	-0.290579803374427	-1.10940870058183	19885	55	PPT1 FLOT1 B2M ITGAV CD14 CD36 HNRNPK CBLL1 TBC1D5 BICD1 IL1B VPS28 PICK1 ARRB1 BCR CAMK1D RAB27A
GO_MRNA_SPLICE_SITE_SELECTION	0.279726284717563	0.873200769085876	0.331386221357841	1.12533914924306	10423	22	SRSF1 YTHDC1 PRPF39 SRSF5 SFSWAP SRSF6 SETX SRSF10 SF1 CELF1 PTBP2 SF3A3
GO_REGULATION_OF_TRANSLATION_IN_RESPONSE_TO_STRESS	0.537941828616147	0.975219757727151	0.292729974220011	0.939749878977055	20621	18	PML DNAJC3 EIF2B5
GO_POSITIVE_REGULATION_OF_ERYTHROCYTE_DIFFERENTIATION	0.939742861568648	0.998729039889192	0.199914913995621	0.631014751525963	36399	17	ANKRD54 INPP5D MED1 MAPK14
GO_LYSOSOMAL_TRANSPORT	0.391502142131531	0.929863721591279	-0.273728536608451	-1.04183536474137	26591	54	GNPTG VPS54 HOOK2 SORL1 VPS41 VPS18 HOOK3 ADRB2 HGS
GO_POSITIVE_REGULATION_OF_DNA_BIOSYNTHETIC_PROCESS	0.445105111449829	0.948549705908357	-0.27983216795047	-1.00862713688886	29493	41	PTK2B MAPK3 PRKCQ HMBOX1 PNKP GSK3B CCT5 WRAP53
GO_REGULATION_OF_CALCIUM_MEDIATED_SIGNALING	0.536320258548409	0.975219757727151	-0.271382044318256	-0.950578454134456	35180	36	PTK2B CCL4 CD3E CALM3 FKBP1A ASPH PLEK PRKACA
GO_REGULATION_OF_ALPHA_BETA_T_CELL_ACTIVATION	0.791092464577392	0.998729039889192	-0.217238601871644	-0.804378207900001	52984	47	CD86 PRKCQ HLA-E CD3E IFNG IL4R CD300A AP3B1 IL12RB1
