pathway	pval	padj	ES	NES	nMoreExtreme	size	leadingEdge
GO_REGULATION_OF_DEFENSE_RESPONSE_TO_VIRUS_BY_VIRUS	0.0167861569113471	0.335925381081296	-0.496514023187919	-1.61007162540411	1069	26	AP1M1 PACS1 B2M AP1S1 AP2A1 ELMO1 HCK CD4 EIF2AK2 AP2M1 CD247 CD8B HLA-A FYN DOCK2
GO_REGULATION_OF_RECEPTOR_INTERNALIZATION	0.185869265571537	0.767361386846487	-0.422042124783544	-1.2463772035107	11461	18	FLOT1 TBC1D5 ATXN2 PICK1 MTMR2 ARRB1 SDCBP DLG4 ATAD1 ARRB2 ARF1
GO_REGULATION_OF_CALCIUM_ION_TRANSMEMBRANE_TRANSPORT	0.0277832274421623	0.392244674212694	-0.416677360431322	-1.50187198325477	1840	41	CRHR1 PTK2B STIM2 BAX F2R PLA2G6 ATP1B1 CALM3 FKBP1A ASPH PRKACA EFCAB4B
GO_RESPONSE_TO_BACTERIUM	0.340455734952847	0.897341646273159	-0.224696726484358	-1.05609347538809	27580	216	BAIAP2 MAPK3 GNLY CD86 JAK2 HLA-E FAS TSPO COMT FGR HLA-DRB5 OGT AKT1 PPARD HIST1H2BC F2R PLA2G6 B2M NOS3 SPON2 HIST1H2BF TNFRSF4 FUCA2 CD14 IFNG DROSHA TNIP2 S100A8 CD36 DNMT1 NOD1 RPS6KA3 HCK LY96 IL1B FER PELI1 S100A9 MAPKAPK3 IRAK1 CDC73 MAPK9 CCL5 BCR HNRNPA0 TMF1 CD4 MAPK1 LTBR PPM1D GSTP1
GO_POSITIVE_REGULATION_OF_LEUKOCYTE_MIGRATION	0.0848107331097269	0.600580196911711	-0.364788691780232	-1.34011395710275	5663	45	PTK2B CCL4 GPSM3 ITGA4 FADD VEGFB CD74 THBS1 ZNF580 SWAP70 IL1B ADAM10 CCL5 CAMK1D LGALS9
GO_CALCIUM_ION_IMPORT	0.395939227286615	0.929863721591279	0.28518717945789	1.03341448402239	14254	28	RASA3 CHERP MCOLN1 ITPR1 BBC3 ATP2A2
GO_CELL_MATURATION	0.719028718892897	0.998729039889192	-0.234273449779324	-0.844415281597719	47644	41	PTK2B RPS6KA2 FARP2 L3MBTL3 TMEM79 PRKACA G6PD REC8 AGPAT6 ID2 POU2F2
GO_REGULATION_OF_SECRETION	0.59653111756583	0.983714414475984	-0.196853579486912	-0.950860170899955	50110	281	CRHR1 RALB JAK2 PRKCQ HLA-E GOLPH3 POMC LLGL1 COMT FGR ARFIP1 HLA-DRB5 ARL2 CD58 PPARD F2R PLA2G6 TNFRSF4 HGS PFN2 STXBP3 PRAM1 TRIM16 NSF CD14 DNM1L PINK1 HMGN3 CD74 IFNG PHPT1 IL4R S100A8 MCU POFUT2 CHMP3 STXBP4 CD300A NF1 ANXA4 RAB11FIP5 IL1B FER S100A9 TRAF2 PNKD RAB27B SYTL2 OSM DPYSL2 B4GALT1 STXBP2 UNC13D MAPK9 RAB3A ARRB1 CCL5 BCR TMF1 ANXA5 VPS4A CHD7 PDPK1 LAMP1 KCNN4 LGALS9 RAB27A LEPRE1 MEF2C
GO_CELLULAR_RESPONSE_TO_TOXIC_SUBSTANCE	0.475503328128852	0.966031480395596	-0.351860739942693	-0.988934411277099	28931	15	OGT CDKN1B PINK1 IL1B
GO_MODULATION_OF_TRANSCRIPTION_IN_OTHER_ORGANISM_INVOLVED_IN_SYMBIOTIC_INTERACTION	0.370225892798851	0.925600075170536	-0.368246352311098	-1.07002169518991	22682	17	CCL4 SP1 SMARCA4 TFAP4 CCL5 LEF1 ZNF639
GO_APOPTOTIC_SIGNALING_PATHWAY	0.264453534194643	0.873200769085876	-0.23512507298851	-1.09653854881506	21205	202	UBE4B APAF1 JAK2 BAX KIAA0141 PDK2 ZMAT1 FAS HTRA2 CD3E AIFM1 BCL2L11 PIK3R1 MOAP1 PPARD GSK3B ITGAV TNFRSF4 HIPK2 FADD PDK1 PARP2 DAP TIMM50 AEN SOD2 DAPK3 IFI6 PPP2R5C MAP3K5 CD14 PDCD6 DNM1L APOPT1 ANXA6 IFNG DNAJC10 NF1 TRADD LY96 IL1B TNFSF10 FIS1 SMAD3 FNIP2 TRAF2
GO_NEURAL_NUCLEUS_DEVELOPMENT	0.945012387162913	0.998729039889192	0.178760329546596	0.676035531247941	33185	33	RAD1 CALM1 NDRG2 NDUFS3 SEC24B ZNF148 SEC16A
GO_LYMPHOCYTE_MEDIATED_IMMUNITY	0.918297933409874	0.998729039889192	-0.183220755200491	-0.728582294753555	63986	68	BTN3A2 FAS GZMB HLA-DRB5 LIG4 CD74 IL4R SWAP70 DENND1B UNC13D IRF7 KLRD1 POU2F2 HLA-DQB1 RFTN1 RAB27A CTSC MYO1G CD55 BTN3A3 EXOSC3 CLU CD8A FOXP3 EXOSC6 FCER1G MSH2 PRKCD
GO_FC_EPSILON_RECEPTOR_SIGNALING_PATHWAY	0.888697570556109	0.998729039889192	-0.180747581825184	-0.782654587174113	66063	114	MAPK3 PRKCQ TEC MAP3K7 PIK3R1 PSMB9 PSMC5 NFATC2 CALM3 PSMA1 PSMC3 PSMB7 FER PSMF1 PSMD5 MAP3K1 MAPK9 PSMD4 LAT2 MAPK1 PDPK1 UBE2N CALM2 PSMB8 PSME2 VAV3 NRAS
GO_HIPPOCAMPUS_DEVELOPMENT	0.0954457887030901	0.607415536535757	-0.39152967979491	-1.3430623576913	6192	33	BBS2 ZEB2 GSK3B TSC1 MKKS CDK6 HNRNPK RAN NCOA1 NME1 CASP3 LEF1 EZH1 SRD5A1
GO_REGULATION_OF_PROTEIN_LOCALIZATION_TO_CELL_SURFACE	0.794762185534591	0.998729039889192	-0.265896187502514	-0.760548612011677	48524	16	COMMD1 TAX1BP3 HNRNPK GPD1L LEPROT GBF1 RAB11B
GO_RIBONUCLEOSIDE_TRIPHOSPHATE_BIOSYNTHETIC_PROCESS	0.882060888503069	0.998729039889192	-0.206215095855754	-0.726587766718721	57916	37	SURF1 ATP5I SLC25A13
GO_REGULATION_OF_CHROMOSOME_SEGREGATION	0.261460154883837	0.873200769085876	0.260820456668177	1.1104057236574	8372	55	AXIN2 RCC2 PUM2 CUL3 MAD1L1 ANKRD32 CTCF TERF1 BUB3 APC LCMT1 SFPQ CDC27 WAPAL PTEN RNF4
GO_PROTEIN_K11_LINKED_UBIQUITINATION	0.66717234653519	0.996837574450825	0.250125860663318	0.870264341249044	24627	24	CDC16 ANAPC13 UBE2B ANAPC7 CDC27 RNF4 UBE2H UBE2A
GO_SPHINGOLIPID_METABOLIC_PROCESS	0.0967942732648615	0.611042480226365	-0.317196044513036	-1.28656545916592	6841	76	GLB1 GLTP PSAP ALDH3A2 GALC BAX ALDH5A1 ELOVL1 HTRA2 CTSA PPT1 CERS5 ORMDL3 VAPA GBA NSMAF SPTSSA UGCG ARSG
GO_PROTEIN_ACETYLATION	0.473736849903689	0.965401749044119	0.207793241642883	0.991908742322912	12788	98	KAT8 USP22 KAT7 NAA30 TAF10 NAA16 MORF4L2 CREBBP CRTC2 YEATS2 ELP3 SUPT7L MECP2 NAA10 TAF5 ING4 HCFC1
GO_REGULATION_OF_NUCLEOCYTOPLASMIC_TRANSPORT	0.0281238435919576	0.392244674212694	0.264577151477763	1.32910230793273	683	133	EDAR SMAD4 NUP153 CHERP NFKBIL1 SUPT6H DYRK2 AXIN2 AAAS HSP90AA1 IL23A KHDRBS1 RANBP3 SLC9A3R1 PPP3CB MDM2 PPM1A UBR5 MTOR RANGAP1 PPP1R12A SLC9A1 NFKBIE MXI1 MX2 KPNA1 PPP3R1 TP53 PKIA NUP62 NFKBIA NUP54 MED1 EDA NLRP3 CDKN1A PRDX1 CTDSPL2 ZNF259 NFKBIB MAPK14 TRIM28 DNAJC27 EMD TCF7L2
GO_CELLULAR_HORMONE_METABOLIC_PROCESS	0.919487564552462	0.998729039889192	-0.197777914458834	-0.687794898773667	60002	35	COMT RDH14 FDXR IL1B HSD17B11 ESR1 SCPEP1 SRD5A1 RETSAT RDH11 AKR1C3 FDX1L ECE1 SCP2
GO_PTERIDINE_CONTAINING_COMPOUND_METABOLIC_PROCESS	0.855034004957732	0.998729039889192	-0.230917385657439	-0.726695723658158	53808	23	DHFR MTHFD2L PCBD1 SARDH GART
GO_BONE_REMODELING	0.549691839921111	0.975219757727151	-0.332354662363833	-0.934110928128859	33445	15	PTK2B ADRB2
GO_FORMATION_OF_TRANSLATION_PREINITIATION_COMPLEX	0.601439992216258	0.985534714956107	-0.305109444648489	-0.90105094741603	37088	18	EIF3B
GO_POSITIVE_REGULATION_OF_INTERFERON_BETA_PRODUCTION	0.900664679535202	0.998729039889192	-0.218699824064038	-0.680761255024119	56504	22	ZBTB20 FLOT1 POLR3F RNF135 IRF7
GO_REGULATION_OF_PROTEIN_SECRETION	0.941437535071163	0.998729039889192	-0.166917080756382	-0.763883844259701	73819	172	JAK2 PRKCQ HLA-E GOLPH3 LLGL1 FGR ARFIP1 HLA-DRB5 ARL2 CD58 PPARD F2R PLA2G6 TNFRSF4 TRIM16 CD14 DNM1L HMGN3 IFNG PHPT1 IL4R MCU STXBP4 ANXA4 RAB11FIP5 IL1B
GO_REGULATION_OF_PEPTIDYL_TYROSINE_PHOSPHORYLATION	0.655036290099175	0.995935079751018	-0.215963933974131	-0.901726228236007	47290	90	PTK2B JAK2 ITGB2 MLST8 RAP2B CD3E TEC ZGPAT VEGFB CD74 CD36 CD300A HAX1 CD81 OSM CCL5 CD4 FBXW7 SH3BP5 ITGA5 ABI1 ADNP
GO_RESPONSE_TO_INSULIN	0.480319621189701	0.968076511189587	-0.228830467503184	-0.990858152944926	35705	114	BAIAP2 PRKCQ PDK2 PTPRA PIK3R1 OGT AKT1 SCAP INPPL1 GSK3B ATP6V1E2 STXBP3 TSC1 AKT2 KAT2B STXBP4 HNRNPK PPAT AP3S1 KHK ATP6V0E2 FER EIF4EBP1
GO_REGULATION_OF_MUSCLE_CELL_APOPTOTIC_PROCESS	0.123233067059407	0.665635925154047	-0.431079670369978	-1.32555126814318	7697	21	PTK2B JAK2 GSK3B APOPT1 IFNG C12orf5 ARRB1 PDPK1
GO_POSITIVE_REGULATION_OF_NIK_NF_KAPPAB_SIGNALING	0.529159767668007	0.974572409392375	0.290449974857039	0.946492615852084	20133	19	TNFRSF10A COPS8 CREBBP
GO_REGULATION_OF_CARBOHYDRATE_METABOLIC_PROCESS	0.712297500417525	0.998729039889192	-0.21023101608417	-0.871586818063426	51179	86	PTK2B PDK2 POMC WDR5 OGT AKT1 GSK3B AP2A1 PDK1 SIRT6 AKT2 KAT2B PLEK C12orf5 DUSP12
GO_NEGATIVE_REGULATION_OF_SYNAPTIC_TRANSMISSION	0.332223413962572	0.893659365588066	-0.357198555273139	-1.09837004726956	20752	21	PTK2B PLA2G6 ABHD6 NF1 PNKD PICK1 MTMR2
GO_B_CELL_ACTIVATION	0.795919771562253	0.998729039889192	0.185602249452479	0.848819202572902	23134	78	CD79A RNF8 RNF168 FNIP1 CEBPG TPD52 HSPD1 MFNG PTPN2 TXLNA CASP8
GO_REGULATION_OF_NEURON_DIFFERENTIATION	0.276229111615617	0.873200769085876	-0.232559747676907	-1.08897585307995	22265	209	BAIAP2 PTK2B ANKRD27 ZEB2 SEMA4F MACF1 ULK2 ZMYND8 GAK CCDC88A CTDSP1 EPHA4 EIF2AK4 AKT1 B2M TCF3 GSK3B KANK1 GORASP1 CUX1 ATF1 KATNA1 IFNG KAT2B ENC1 KATNB1 HNRNPK TIMP2 IL1B PREX1 ARHGAP35 BMPR2 DPYSL2 PLXNC1 PDLIM5 MUL1 KIAA1598 RAP1GAP2 MMD CCL5 NCOA1 RAPGEF1 ZHX2 ANAPC2 CYB5D2 ID2 LGALS1 TMEM30A TNIK NME1 CAMK1D RNF6 SYNGAP1 MEF2C SEMA4C MOB2 CFL1 ADNP CDK5RAP2 RAPGEF2 MARCKS APP ITM2C
GO_NEGATIVE_REGULATION_OF_NF_KAPPAB_TRANSCRIPTION_FACTOR_ACTIVITY	0.851311691423095	0.998729039889192	-0.207195956799488	-0.761169958989664	56853	45	COMMD7 DAP COMMD1 PIAS4 ANXA4 RWDD3 PELI1 PRMT2 IRAK1 ARRB1 CAT RBCK1 IRAK3 CYLD TAX1BP1 FOXP3 DNAJA3 SIRT1
GO_PROTEIN_POLYUBIQUITINATION	0.791151997519252	0.998729039889192	0.168034446790027	0.901679946917912	15307	211	CDC16 RNF8 RNF41 RNF168 PSMD2 UBE4A ARIH1 BIRC2 MARCH1 PSMA6 PRPF19 CUL3 UBR5 RNF14 PSMA3 AMFR ITCH RNF114 PSMC4 RNF31 UBE2D2 RNF138 RNF181 RNF20 UNKL RUSC1 ANAPC13 TRIM27 UBE2B PSMC6 LONRF1 SMURF1 C18orf25 SKP1 ANAPC7 CDC27 MARCH5 UBE2R2 RNF4 UBE3C TPP2 PSMD11 UBE2H SYVN1 PSME3 RNF146 UBE2A RNF144A UBE2O FBXO31 UBE2G1
GO_RIBONUCLEOPROTEIN_COMPLEX_LOCALIZATION	0.0410642879114119	0.472034176343649	0.271702795203988	1.31729942679633	1067	108	ENY2 U2AF1 NUP98 NUP153 SRSF2 NUP50 SHFM1 SRSF1 AAAS SRSF11 AGFG1 CPSF3 NUP214 EIF4E RPS15 CDC40 NUP93 RANBP2 RPSA EIF4A3 NXF1 MAGOH RPS28 NUP62 SRSF5 NMD3 NUP54 NUP88
GO_REGULATION_OF_MRNA_3_END_PROCESSING	0.74434852980847	0.998729039889192	0.238607023345226	0.820562262896212	27592	23	CCNT1 RNF40 RNF20 CTR9 POLR2G PAF1 CDK9 CNOT7 PABPC1 NCBP1 BTG2 ZFP36
GO_REGULATION_OF_PEPTIDE_TRANSPORT	0.804941482444733	0.998729039889192	0.177837077368179	0.8611391868502	21045	107	SREBF1 ENY2 EDAR AACS ACVR1C IL23A HMGCR CPT1A REST PPP3CB PPM1A ITPR1 GLUL OXCT1 CDK16 NFKBIA SLC25A5 EDA NLRP3 PRDX1 ARNTL SLC25A6 PRKCA NCOA6 NFKBIB NR1D1 GNAS
GO_POSITIVE_REGULATION_OF_ION_TRANSPORT	0.0249357290364272	0.378248821274024	-0.351937914324726	-1.44356831244431	1774	81	STIM2 BAX SGK3 CCL4 TSPO AKT1 F2R PLA2G6 ATP1B1 B2M ADRB2 CALM3 ASPH PINK1 EFCAB4B IL1B ATP8A1 TRIAP1 DPYSL2 AKAP7 CASK MAPK9 CCL5 ATP1B3 CD4 PDPK1 GPD1L
GO_ATP_BIOSYNTHETIC_PROCESS	0.541102204721949	0.975219757727151	-0.286300865724064	-0.945173905757912	34629	28	SURF1 ATP5I SLC25A13
GO_CANONICAL_WNT_SIGNALING_PATHWAY	0.0389318175089558	0.460254440443954	0.365366312640529	1.44499236586687	1314	40	TBL1X CHD8 BCL9L PSEN1 CSNK1A1 APC PYGO2 FAM105B UBE2B KDM6A PTEN SCYL2 RARG DVL3 KLF4 TCF7L2
GO_ACUTE_INFLAMMATORY_RESPONSE	0.0629438244991123	0.546316158470174	-0.451302649787754	-1.4344860199919	3970	24	OGG1 PLSCR1 S100A8 HNRNPK IL1B CD163 ALOX5 B4GALT1
GO_NUCLEOBASE_METABOLIC_PROCESS	0.833896660720433	0.998729039889192	-0.229274420639511	-0.750258156271701	53290	27	ALDH6A1 PPAT GART IL1B MAPK1 ADAL CECR1 HPRT1 APRT
GO_HUMORAL_IMMUNE_RESPONSE	0.402775095449616	0.931119601310803	-0.27620463319923	-1.03541922490748	27111	50	HLA-E HLA-DRB5 HIST1H2BC PLA2G6 B2M GPR183 SPON2 HIST1H2BF IFNG BST1 POU2F2 YTHDF2 HLA-DQB1 MEF2C HIST1H2BK APP CD55 HLA-A CLU NOTCH1 LY86
GO_PHAGOSOME_MATURATION	0.862938476669217	0.998729039889192	0.211090867423698	0.742300655182101	31586	25	ATP6V1D ATP6V1E1 ATP6V1H ATP6V1A ATP6V0B
GO_CHROMATIN_MODIFICATION	0.433580929348765	0.945937104552083	0.174033005673503	1.00661420177293	5019	414	PCGF1 BRE ENY2 RNF8 HMG20A KAT8 USP22 KAT7 JARID2 RNF168 PIH1D1 BRD4 SUPT6H TAF10 TTF1 TBL1X EYA3 CHD8 KDM6B BMI1 C17orf49 SUV420H2 ITGB3BP MORF4L2 BAZ2A TLK1 DAXX CREBBP CRTC2 REST NASP YEATS2 DPY30 RNF40 CTCF SPTY2D1 ELP3 WDR82 ARID4A JMJD1C SUPT7L GATAD2B MECP2 HIST4H4 RCBTB1 TAF5 TDG CENPK BAZ1B ING4 HCFC1 EZH2 RNF20 PHF13 ARID2 ASH2L CTR9 ARID1A SETD6 UTP3 CENPN FBL TRIM37 CHD2 ANP32E SFPQ MTF2 WHSC1 UBE2B KDM6A SIN3A TNRC18 USP15 HNRNPC PHF21A MED24 ARID4B KAT6A JMJD6 KDM5A UBN1 SKP1 ZBTB1 HDAC4
GO_MYELOID_LEUKOCYTE_ACTIVATION	0.770266050462153	0.998729039889192	0.198469664730845	0.844956160666	24666	55	AIF1 TICAM1 RASGRP1 LAT PSEN1 JUN SLAMF1 SLC11A1 PIK3CG JMJD6 TLR1 VAMP2
GO_ANTERIOR_POSTERIOR_PATTERN_SPECIFICATION	0.942417751063081	0.998729039889192	0.168412923769923	0.730375771328141	29475	60	SMAD4 AXIN2 ETS2 PSEN1 CRKL SKI PBX3 EPB41L5 NOG KDM6A HIPK1
GO_POSITIVE_REGULATION_OF_CELL_DIVISION	0.616554863440345	0.989539519198471	-0.246813007625263	-0.906710004356132	41175	45	GORASP1 VEGFB ZNF16 IL1B OSM ANAPC11 SMC5 ITGB1BP1 CENPV YBX1 CAT NSMCE2 H2AFY CDC25B FAM178A RB1
GO_PIGMENT_BIOSYNTHETIC_PROCESS	0.0862766369624177	0.600580196911711	-0.403853945260587	-1.36579611731453	5566	31	PPOX FECH TSPO DDT SLC11A2 UROS SLC25A38 PPAT COX15 ADAL CECR1 HPRT1 IBA57 APRT
GO_ERBB_SIGNALING_PATHWAY	0.635629877369008	0.995081268906618	-0.240460753161437	-0.897856694936207	42761	49	PTK2B PAG1 MATK IQGAP1 PIK3R1 AKT1 NRG2 CPNE3 DGKD STUB1 MAPK1 PDPK1 PXN CDC37 HBEGF
GO_EMBRYONIC_ORGAN_MORPHOGENESIS	0.683757433273406	0.998729039889192	0.19601603578185	0.901938044994643	19776	80	RPL38 PRKRA SLC9A3R1 INSIG1 ARL13B PSEN1 PHACTR4 ZEB1 ARID1A SEC24B EIF4A3 NOG KDM6A HIPK1 WDPCP ACVR1 NIPBL IFT57 RARG DVL3 IFT172 GNAS RAC1 AHI1 TSHZ1
GO_REPRODUCTIVE_SYSTEM_DEVELOPMENT	0.844094898757278	0.998729039889192	0.168521486158634	0.864070495766402	19425	152	RARA SMAD4 PTK2 ZNF830 FNDC3A BIRC2 EIF2S2 NASP EIF2B5 ARID4A MAP3K4 ALKBH1 CASP8 MAP2K1 PRDX3 TAF4 ARID1A RBM15 DNAJC19 NOG RRM1 ANXA1 ARID4B KDM5A MED1 EIF2B2 NIPBL PTEN SGPL1 NSDHL ZFP36L1 NDUFS6 BAK1 RARG NCOA6
GO_CYTOSOLIC_CALCIUM_ION_TRANSPORT	0.103236978819768	0.625159189759922	0.401696341745902	1.34575264422693	3874	21	RASA3 CHERP MCOLN1 ITPR1 BBC3 ATP2A2 DDIT3
GO_POSITIVE_REGULATION_OF_CATABOLIC_PROCESS	0.221454437518552	0.819662784242596	-0.229506399948288	-1.11069666683121	18651	287	PTK2B MAPK3 RALB SH3D19 BAX ZNF268 PIP4K2B LRSAM1 SORL1 TOB1 EIF2AK4 ABHD5 NRD1 AKT1 PSMB9 TP53INP1 TRIM65 GSK3B TRIM13 PSMC5 ADRB2 USP13 GORASP1 TRIB2 PSMA1 NSF CDC26 PSMC3 CDKN1B SUMO2 SGTA PINK1 AKT2 IFNG ENDOG LPCAT1 GBA USP5 NFE2L2 CNOT1 ANKIB1 PSMB7 OSBPL7 TBC1D5 NOD1 IL1B UVRAG DACT1 PSMF1 CD81 ATG7 FBXL5 PNPT1 PSMD5 MYLIP VPS28 ANAPC11 RDX TMEM59 ABCD2 SMC5
GO_GLIOGENESIS	0.035054551752006	0.437328652767489	-0.363531852999263	-1.42991676410748	2428	64	PTK2B MAPK3 TSPO EPHA4 AKT1 HDAC11 GSN VCAN HDAC10 CDK6 AKT2 S100A8 NF1 DICER1 S100A9 TSPAN2 PICK1 ID2 MAPK1 GSTP1 CDKN2C LEF1 CNP
GO_PEPTIDYL_THREONINE_MODIFICATION	0.706172203102021	0.998729039889192	-0.239706045382208	-0.849812431834858	46576	38	AKT1 GSK3B HIPK2 PRKACA GALNT1 MAPK1 PDPK1 VPRBP
GO_MATURATION_OF_5_8S_RRNA_FROM_TRICISTRONIC_RRNA_TRANSCRIPT_SSU_RRNA_5_8S_RRNA_LSU_RRNA_	0.95040532865183	0.998729039889192	0.194731776645734	0.614654610796115	36812	17	FTSJ3 ABT1 RPSA RPS21 NOP14 RRS1 UTP20 EXOSC9
GO_ANTIGEN_PROCESSING_AND_PRESENTATION	0.151694794328633	0.719489151838563	-0.262808260645319	-1.18421121337695	11693	153	AP1M1 RAB5B CTSF LGMN HLA-E CANX ERAP2 RAB4A HLA-DRB5 HLA-C NCF4 PSMB9 B2M AP1S1 PSMC5 ITGAV AP2A1 PSMA1 PSMC3 CD74 IFNG HLA-F CD36 PSMB7 CTSD PSMF1 AP3B1 SEC24D RAB6A PSMD5 PSMD4 HLA-DMA DCTN4 HLA-DQB1 RFTN1 RAB27A BCAP31 HLA-DPB1 PSMB8 ACTR1B PSME2 DCTN5 AP2M1 HLA-DPA1 ABCB9 HLA-DMB
GO_CELLULAR_AMINO_ACID_CATABOLIC_PROCESS	0.469238201412115	0.961764290534301	-0.266428370536306	-0.994817212629982	31567	49	HIBADH ALDH5A1 HMGCL HIBCH ALDH6A1 PCBD1 BCKDHB ABHD12 HSD17B10 BCKDHA PPAT GCSH IVD BCKDK MTHFS ENOSF1 GLUD1
GO_MAINTENANCE_OF_LOCATION	0.332154985247453	0.893659365588066	-0.258735430020522	-1.07267897179154	23865	86	VPS13C GOLPH3 OS9 SORL1 TSPO SYNE2 ARL2 AKT1 SUN2 GSN ARHGAP21 PINK1 S100A8 CD36 IL1B UVRAG C2orf43 S100A9 NRIP1 GPAA1 CD4 YWHAB GM2A FAF1 TWF1
GO_NEPHRON_EPITHELIUM_DEVELOPMENT	0.954624781849913	0.998729039889192	0.187322769216621	0.619137893692817	36101	20	SMAD4 ILK NOG AHI1 GZF1 GATA3
GO_KERATINOCYTE_DIFFERENTIATION	0.100774980004964	0.619952747363873	0.375663743906949	1.33440553108279	3653	26	EXPH5 FLNB KRT10 IFT74 MAP2K1 TSG101 PPHLN1 ANXA1 MED1 FOSL2
GO_POSITIVE_REGULATION_OF_CALCIUM_ION_TRANSMEMBRANE_TRANSPORT	0.108947574590324	0.636070022476376	-0.467633694740081	-1.35881372791163	6674	17	STIM2 BAX F2R ATP1B1 CALM3 ASPH EFCAB4B
GO_NEGATIVE_REGULATION_OF_EPITHELIAL_CELL_MIGRATION	0.894296188387469	0.998729039889192	-0.222990876490547	-0.68568726254874	55863	21	PFN2 THBS1 EVL ITGB1BP1 PTPN23
GO_CELL_REDOX_HOMEOSTASIS	0.144355473682647	0.703981830467677	-0.332897327940421	-1.24794537034871	9716	50	TMX4 GLRX3 AIFM1 GLRX5 GLRX2 NCF4 NOS3 TXN P4HB DNAJC10 NFE2L2 ERO1LB TXNDC9 PDIA4
GO_POSITIVE_REGULATION_OF_PROTEIN_SECRETION	0.225723161891612	0.825808400831053	-0.273299482218894	-1.14480376103545	16347	92	JAK2 PRKCQ HLA-E GOLPH3 FGR HLA-DRB5 CD58 PPARD F2R PLA2G6 TNFRSF4 TRIM16 CD14 DNM1L IFNG PHPT1 IL4R MCU
GO_POSITIVE_REGULATION_OF_CYTOSKELETON_ORGANIZATION	0.0502605341976778	0.508809887916542	-0.318052123109633	-1.3478332542182	3674	99	BAIAP2 PTK2B ACTR3B PRKCQ WAS MLST8 ARL2 ACTR3C BAG4 GSN PFN2 CDKN1B PLEK KATNB1 SWAP70 HCK ABI2 HAX1 FMN1 FER SMAD3 ACTR2 PFN1 EVL ITGB1BP1
GO_RESPONSE_TO_KETONE	0.248682838869636	0.862208963156155	-0.277166920344917	-1.13190073922228	17652	79	ACACA BAX FAS FECH AIFM1 TSPO AKT1 ADRB2 CALM3 GBA THBS1 HNRNPK FBXO32 DNMT1 TFAP4 IL1B SMYD3 CATSPER2 CCL5 NCOA1 NME1 CDC5L TXNIP CALM2
GO_NEGATIVE_REGULATION_OF_PROTEIN_KINASE_B_SIGNALING	0.931932060127748	0.998729039889192	-0.20863585741645	-0.641546202216303	58214	21	TSC2 LEMD2 PDCD6 MUL1 RAPGEF1
GO_REGULATION_OF_ENDOTHELIAL_CELL_MIGRATION	0.831862921618053	0.998729039889192	-0.211876816918831	-0.774819505254793	55441	44	PTK2B AKT1 PDCD6 THBS1 ZNF580 NF1 BMPR2 ITGB1BP1 PDPK1
GO_INNER_MITOCHONDRIAL_MEMBRANE_ORGANIZATION	0.464164046121593	0.96012015019672	-0.349242918852103	-0.998947069090122	28339	16	BAX AFG3L2 LETM1
GO_CILIUM_MORPHOGENESIS	0.486995011968601	0.968076511189587	-0.226381877649626	-0.987048079844288	36416	120	BBS2 SSX2IP RPGR TMEM231 RFX2 C5orf42 TTC30B FOPNL TTLL5 ARL3 GSN MKKS TMEM237 IFT122 KIAA1377 NEK1 WDR35 MKS1 TRIM59 SNX10 ACTR2 TTLL1 KIAA0586 CEP164 ABCC4 C2CD3 PTPN23 TCTN3 GALNT11 FLNA TTC30A HSPB11 OFD1 TTLL3 TMEM216 TMEM107 ICK TRAF3IP1 CEP290 CEP89 KIF27 NOTCH1 IFT20 IFT52
GO_ENERGY_COUPLED_PROTON_TRANSPORT_DOWN_ELECTROCHEMICAL_GRADIENT	0.873952835213791	0.998729039889192	-0.233667792979782	-0.69989592432833	54143	19	ATP5I ATP5S ATP5J2 ATP6V0A2 ATP5H ATP5E ATP5G3 ATP5A1
GO_CELLULAR_MODIFIED_AMINO_ACID_BIOSYNTHETIC_PROCESS	0.0537644471480043	0.508809887916542	-0.434775165693937	-1.44715246819031	3446	29	DHFR MTHFD2L GCLM PLSCR1 ALDH18A1 MAT2A PTDSS1 GGT7 GART
GO_PROTEIN_LOCALIZATION_TO_VACUOLE	0.0272155465192428	0.391385478514825	-0.429847338763103	-1.51454391156861	1786	37	GNPTG VPS13C SORL1 VPS41 VPS36 VTI1B HGS TOLLIP ACAP2 CD81 AP3B1 MICALL1 ZFYVE16 VPS28
GO_CELLULAR_RESPONSE_TO_HYDROGEN_PEROXIDE	0.668917296843116	0.997892231881855	-0.23965320026083	-0.876395901916727	44581	44	STAT6 FAS AIFM1 GSK3B MAP3K5 PPIF NFE2L2 ZNF580
GO_REGULATION_OF_ORGAN_GROWTH	0.234920985134725	0.84091449940036	0.326533220587138	1.15988764606914	8517	26	SASH3 PTK2 CTDP1 MTOR NOG FXN PTEN MAPK14
GO_POSITIVE_REGULATION_OF_CELL_GROWTH	0.642649622312609	0.995935079751018	-0.223296379725098	-0.903451615570853	45345	75	PTK2B MACF1 HIST1H1B AKT1 S100A8 HNRNPK RPS6KA3 ADAM10 TAF9 KDM2B S100A9 BMPR2 MUL1 KIAA1598 ANAPC2 RPS6KA1 HBEGF ADNP2 LEF1 ADNP ZNF639
GO_REGULATION_OF_TRANSMEMBRANE_RECEPTOR_PROTEIN_SERINE_THREONINE_KINASE_SIGNALING_PATHWAY	0.626842656254421	0.991133414601231	-0.224816046223968	-0.911866855660359	44308	76	NEO1 BMPR1A TOB1 MTMR4 GREM2 FAM89B HIPK2 FKBP1A THBS1 TWSG1 DACT1 SMAD3 FBXL15 BMPR2 MEN1 STUB1 PDPK1 CITED2 FKBP8
GO_OVULATION_CYCLE_PROCESS	0.989587839090403	0.998729039889192	-0.159373437044768	-0.543259238089445	64057	32	BAX NOS3 HNRNPK NRIP1 IMMP2L ARRB1 ESR1 CASP2 CTNNA1 SIRT1 FOXO3 ARRB2 BCL2
GO_POSITIVE_REGULATION_OF_CELL_ADHESION	0.145954152873535	0.706516356793439	-0.251414842556891	-1.17401476224502	11727	204	PTK2B MAP3K8 CD86 JAK2 PRKCQ HLA-E LIMS1 MLST8 FLOT2 CD3E HLA-DRB5 ARL2 MAPKAP1 MAP3K7 PIK3R1 FLOT1 AKT1 SIRPG ITGA4 GSK3B BAG4 ITGAV FADD TSC1 CD3G ITGA6 CDK6 CD74 IFNG APBB1IP IL4R CD36 IL1B FMN1 SMAD3 PREX1 AP3B1 TRAF2 UNC13D ITGB1BP1 IL12RB1 CCL5 CD4 ARPC2 PDPK1 LGALS1 CITED2 LGALS9 HLA-DQB1 HLA-DPB1 TRIOBP PTPN23 UTRN LEF1 ITGA5 BTLA ADAM8 VAV3 HLA-DPA1 CCL28 SPN HLA-DMB CD55 RSU1
GO_CEREBRAL_CORTEX_DEVELOPMENT	0.053383300222744	0.508809887916542	-0.390309600016938	-1.41367986504894	3546	42	BBS2 BAX GSK3B TSC1 MKKS HNRNPK NF1 GART NCOA1 TRAPPC9 CCDC141 FBXO45
GO_REGULATION_OF_INTERLEUKIN_8_PRODUCTION	0.172351801627276	0.748434882360538	-0.367416353932272	-1.24256760526323	11120	31	CD58 F2R FADD ZNF580 HSPA1A ANXA4 IL1B ARRB1 LGALS9 IL6R RIPK1 TLR2 PARK7 HSPA1B
GO_RNA_PHOSPHODIESTER_BOND_HYDROLYSIS	0.699716948567484	0.998729039889192	-0.210164202598137	-0.880341110111074	50676	92	CSTF3 CPSF1 CSTF2T BOP1 REXO2 CSTF1 RNASEH2C HRSP12 DROSHA PCF11 CNOT1 DIS3L CNOT6 TSEN15 DICER1 ERI3 RPP38 PPP1R8 KIAA0391 PNPT1 ENDOV
GO_ORGANIC_ACID_METABOLIC_PROCESS	0.595402247888448	0.983714414475984	-0.190244299737212	-0.961651154553482	53715	493	MAPK3 CPT2 DHFR D2HGDH LYPLA1 LIPA HLCS GLB1 ACSF3 ACOT2 SLC35B3 PRKAB2 LIPT1 MTHFD2L ACACA ALDH3A2 WARS2 HIBADH GCLM P4HA1 UGDH PAPSS1 ALDH5A1 PFKP ELOVL1 OXSM VNN2 HMGCL GNS SLC5A6 CYP4V2 PADI4 PDXDC1 ABHD5 AARSD1 PRKAB1 PPARD HIBCH CHPF2 ALDH6A1 CHST7 NOS3 CYB5A PCBD1 BCKDHB UROS VCAN ABHD12 PEX2 P4HB TPI1 SMS SLC35D2 ALDH18A1 SARDH CD74 SLC26A2 LPIN2 HSD17B10 AIMP2 CRYL1 DNMT1 BCKDHA FARS2 PPAT GGT7 GART ERO1LB PPA2 CBR1 ECHDC2 B4GALT3 DNMT3A PNKD ABCD1 SLC25A17 GCSH ETFA MARS2 ALOX5 PGD NIT2 B4GALT1 ABCD2 DECR1 IVD XYLT1 ACSL6 CARS2 IDH3A EXT2 ACSL1 PHYH EPHX2 NMNAT1 ABCC1 ADC ERO1L AGPAT6 PEPD TARSL2 BCKDK HPSE MDH2 CSGALNACT2 NARS2 ACAA2 SLC7A6 SLC7A7 FARSB MTHFS BSG CSAD GFPT1 GATC ENOSF1 GLUD1 ENOPH1 XYLT2 ATIC CSGALNACT1 EGLN2 SLC7A5 ACAA1 PEX7 MPST LYPLA2 QDPR TBXAS1 UGP2 MCEE SCPEP1 ST3GAL1
GO_POSITIVE_REGULATION_OF_PHOSPHOLIPID_METABOLIC_PROCESS	0.672814519814585	0.998445603703041	-0.29279454965321	-0.850779697873611	41221	17	PTK2B FGR
GO_REGULATION_OF_SYMBIOSIS_ENCOMPASSING_MUTUALISM_THROUGH_PARASITISM	0.884062301087281	0.998729039889192	-0.177898974690466	-0.800366671678377	68055	151	TRIM62 CCL4 OSBP BCL2L11 EIF2AK4 DYNLT1 TRIM13 ITGAV GSN PLSCR1 FUCA2 POLR2J OAS3 P4HB FAM111A VAPA SP1 IFNG CHMP3 CD36 IFITM2 IFITM3 TRIM11 SMARCA4 EXOC7 TFAP4 PFN1 POLR2D CCL5 SRPK2 STAT1 VPS4A LGALS1 TRIM25 SUPT4H1 LGALS9 EIF2AK2 EXOC2 LEF1 CFL1
GO_RESPONSE_TO_GROWTH_HORMONE	0.107049266247379	0.633014512152081	-0.477720798402832	-1.36643512480204	6535	16	MAPK3 JAK2 PIK3R1 AKT1 TRIM16 MAPK1 PXN SOCS2 SRD5A1
GO_G1_DNA_DAMAGE_CHECKPOINT	0.364786932260981	0.922728852156595	0.246339486103876	1.04428344517097	11701	54	PML CNOT2 PIDD PLK2 MDM2 E2F4 TFDP2 RBM38 RPA2 CNOT4 TP53 PLK3 CDKN1A PLAGL1 FBXO31 TFDP1 CNOT10 RQCD1 UBA52
GO_RESPONSE_TO_OXYGEN_LEVELS	0.217010422168687	0.813298871401299	-0.249391194799783	-1.13217917694482	16844	162	PTK2B CPEB4 APAF1 PRKCQ FAS AIFM1 ALKBH5 AKT1 PPARD EGLN1 SCAP ATP1B1 HIPK2 TCEB2 APOLD1 PDK1 SLC11A2 ADRB2 CAPN2 TSC1 P4HB CDKN1B PINK1 ENDOG HP1BP3 THBS1 NF1 C12orf5 IL1B XRCC1 SMAD3 EIF4EBP1 ATG7 DNMT3A SUV39H2 ALOX5 PICK1 NARFL IRAK1 CXCR4 ERO1L VHL NPEPPS CITED2 CASP3 ACAA2 CAT
GO_REGULATION_OF_RECEPTOR_MEDIATED_ENDOCYTOSIS	0.790787937595706	0.998729039889192	-0.224532722356384	-0.796019551813699	52157	38	PPT1 FLOT1 B2M HNRNPK TBC1D5 BICD1 ATXN2 PICK1 MTMR2 ARRB1 SMAP1
GO_POSITIVE_REGULATION_OF_LYMPHOCYTE_MEDIATED_IMMUNITY	0.610224405392896	0.988861207178147	-0.246154340406896	-0.911445689197978	40870	47	NCR3 HLA-E STAT6 MAP3K7 B2M LAG3 FADD IFNG PAXIP1 IL1B TRAF2 IL12RB1 STX7
GO_RESPONSE_TO_TRANSFORMING_GROWTH_FACTOR_BETA	0.831467453241268	0.998729039889192	0.183838648470626	0.825824318908745	24805	71	WWOX SMAD4 PTK2 PML CREB1 CBL PPM1A JUN SKI EPB41L5 YES1 TAB1 USP15 SMURF1
GO_TRANSCRIPTION_ELONGATION_FROM_RNA_POLYMERASE_II_PROMOTER	0.0246884864595448	0.377808525088347	0.320893197059373	1.43868844480708	742	70	TAF2 ENY2 CCNT1 IKBKAP TAF10 CTDP1 ERCC3 ELP2 ELL2 ELP3 TAF5 GTF2E2 TAF4 MNAT1 POLR2K POLR2A TAF6 POLR2G TAF12 SUPT16H CCNK CCNH TAF13 PAF1 TCEB1 GTF2F1
GO_OXIDATIVE_PHOSPHORYLATION	0.0350729422863111	0.437328652767489	0.307242943387202	1.38831235767418	1040	73	NDUFS8 CHCHD10 UQCRH NDUFV1 UQCRB COX7B NDUFV3 DLD NDUFAB1 NDUFS3 MECP2 COX5B NDUFA8 NDUFS2 NDUFA2 COQ9 NDUFA4 COX6A1 FXN GBAS NDUFB6 NDUFS6 CYCS ATP5D TAZ
GO_APOPTOTIC_NUCLEAR_CHANGES	0.887706469935366	0.998729039889192	-0.234612308792675	-0.681718254074317	54387	17	BLCAP ENDOG DICER1 CASP3 DFFB H1F0 DFFA KPNB1 HMGB1 SHARPIN
GO_REGULATION_OF_DNA_BINDING	0.936604987932422	0.998729039889192	-0.181615209970627	-0.69867882857556	64030	57	JAK2 HIPK2 CALM3 TXN NSD1 TFAP4 GZMA PINX1 ID2 NME1 MAD2L2 LEF1 CALM2 KAT2A
GO_IMMUNOGLOBULIN_PRODUCTION	0.796563150188796	0.998729039889192	-0.229506750469176	-0.787275890687678	51684	33	FAS HLA-DRB5 CTNNBL1 TCF3 MSH3 SWAP70 POU2F2 HLA-DQB1 PMS2 PRKDC EXOSC3 EXOSC6 MSH2 HLA-DRB1 IL7R PTPRC UNG
GO_TISSUE_MIGRATION	0.0348050423283693	0.437328652767489	-0.440578587988014	-1.5018085351429	2252	32	PTK2B ZEB2 ITGB2 PTP4A3 PPARD PLEKHG5 NOS3 MYH9 PAXIP1
GO_RESPONSE_TO_ISCHEMIA	0.0683227786119997	0.552999522708128	-0.496231413815922	-1.44191076241599	4185	17	CPEB4 AIFM1 MAP3K5 PPIF C12orf5 EIF4EBP1
GO_ENSHEATHMENT_OF_NEURONS	0.363225308875346	0.921095019911373	-0.298441051503861	-1.06432104738134	24018	39	AKT1 PPARD AFG3L2 FAM126A TSC1 AKT2 NF1 DICER1 TSPAN2 MAL MTMR2 CXCR4
