pathway	pval	padj	ES	NES	nMoreExtreme	size	leadingEdge
GO_REGULATION_OF_MRNA_SPLICING_VIA_SPLICEOSOME	0.274720589578829	0.873200769085876	0.267785069650816	1.1066999062272	9020	48	SRSF2 MBNL2 PRPF19 CWC22 YTHDC1 RBM42 RBM25 DYRK1A MAGOH JMJD6 SAP18 SFSWAP RBM15B HSPA8 SRSF6 THRAP3 DAZAP1 SRSF10 SRSF7
GO_REGULATION_OF_ANATOMICAL_STRUCTURE_MORPHOGENESIS	0.328317159339922	0.893659365588066	-0.209001055669132	-1.05112725584552	29365	457	BAIAP2 PTK2B PDZD8 ANKRD27 ZEB2 SH3D19 RRAS CELA1 ITGB2 INF2 SEMA4F MACF1 ULK2 BAX LIMS1 TRIM62 BMPR1A ODF2 FGR EPHA4 FLOT1 EGLN1 PSMB9 NOS3 GSK3B PSMC5 HIPK2 NFATC2 AP2A1 ADRB2 GSN TBC1D17 KANK1 GORASP1 DAPK3 CFLAR CUX1 PSMA1 VEGFB PSMC3 FAM195B PDCD6 GTF2I DNM1L PARVB PINK1 IFNG EVI5 MYH9 IL4R THBS1 SGSM3 POFUT2 CD36 HNRNPK NF1 PSMB7 PLEKHO1 TBC1D5 HCK MKS1 IL1B LST1 DACT1 FIS1 SMAD3 PSMF1 PREX1 ARHGAP35 DAAM1 BMPR2 FZD3 CDC7 DPYSL2 PLXNC1 PSMD5 PFN1 PDLIM5 RDX MUL1 B4GALT1 ZMYM2 UNC13D ITGB1BP1 KIAA1598 MAPK9 AKAP13 CCL5 BCR PSMD4 ANAPC2 ARPC2 STAT1 VAT1 TNIK QRICH1 RHOQ CITED2 RNF6 SYNGAP1 MAD2L2 FBXW7 MEF2C TBC1D10C TRIOBP FGD3 SEMA4C ESR1 LEF1 CFL1 PSMB8 ITGA5 ADNP CAMSAP1 PSME2 RAPGEF2 AP2M1 ZRANB1 MARCKS CST3 GLIPR2
GO_FEMALE_GAMETE_GENERATION	0.122763772740333	0.665635925154047	-0.362072206617376	-1.29124685840913	8117	39	PTK2B ZMIZ1 RPS6KA2 NOS3 IL4R TAF4B IL1B DIAPH2 NRIP1 IMMP2L REC8 DDX20 MCM8
GO_EXTRACELLULAR_MATRIX_DISASSEMBLY	0.00106532371313738	0.0495850498537226	-0.635568881378768	-1.90369440321373	65	19	CAPNS1 ADAM15 CAPN1 FLOT1 CAPG GSN CAPN2 KIF9 TIMP2 ADAM10
GO_PROTEIN_HOMOOLIGOMERIZATION	0.628569919590161	0.991422175465847	-0.208561309903582	-0.923239639807181	47605	134	NACC1 APAF1 ACACA BAX ALDH5A1 FAS OGT FLOT1 PRF1 KCNA3 RNF213 KCTD13 PCBD1 SOD2 DNM1L ANXA6 ATL3 HSD17B10 SMARCAD1 PPAT APOA1BP FIS1 IGHMBP2 DGKD TRAF2 SAMHD1 PNPT1 GBP5 EVL DECR1
GO_REGULATION_OF_OXIDATIVE_STRESS_INDUCED_CELL_DEATH	0.0212888377445339	0.35353393503538	-0.466576555462738	-1.56529286517751	1368	30	PSAP HTRA2 AKT1 TXN SOD2 P4HB PINK1 ENDOG NFE2L2
GO_TRANSCRIPTION_FROM_RNA_POLYMERASE_I_PROMOTER	0.85265078845164	0.998729039889192	-0.222194409208987	-0.739575792448159	54665	29	MAPK3 GTF2H3 POLR2E POLR1B
GO_REGULATION_OF_PEPTIDYL_THREONINE_PHOSPHORYLATION	0.48053250061632	0.968076511189587	-0.350509869920676	-0.985137676665125	29237	15	OGT GSK3B CALM3 MAPK1 CALM2
GO_NONMOTILE_PRIMARY_CILIUM_ASSEMBLY	0.477577961215933	0.967386577536176	-0.345816554047796	-0.98914656378526	29158	16	BBS2 MKKS KIAA1377 MKS1
GO_BODY_FLUID_SECRETION	0.817231583882622	0.998729039889192	0.219451139811985	0.779518437744342	29631	26	ATP7A CREB1 C11orf63 MED1 VAMP2 PAM
GO_POSITIVE_REGULATION_OF_CHROMOSOME_ORGANIZATION	0.163308095515434	0.729239197056977	0.236129680750344	1.15178643900402	4205	112	SREBF1 CCT2 JARID2 SMAD4 PIH1D1 ATR CCT3 PML CCT4 TCP1 DAXX CUL3 DKC1 ANKRD32 HNRNPA1 RNF40 MAP3K4 RNF20 CTR9 WBP2 MAP2K7 SFPQ MTF2 TP53 SIN3A CCT6A NIPBL PTEN RTEL1 RPS6KA5 CTBP1
GO_RESPONSE_TO_VITAMIN	0.059807191483529	0.533112320584054	-0.399460450291776	-1.40747734915091	3926	37	HLCS OGG1 TSPO PPARD GSN MGMT DNMT1 IL1B CDKN2D DNMT3A CCL5 CD4 GSTP1 CAT EIF2AK2
GO_REGULATION_OF_ATPASE_ACTIVITY	0.255621086465424	0.873200769085876	-0.323908032398249	-1.14832762045821	16859	38	SNRNP70 RAB4A ATP1B1 ADRB2 PLSCR1 PFN2 PPIF DNAJC10 CNN3 PFN1 RAB3A ATP1B3 PAM16 AHSA2
GO_NEGATIVE_REGULATION_OF_STRESS_ACTIVATED_PROTEIN_KINASE_SIGNALING_CASCADE	0.445569462022844	0.948549705908357	-0.305710508994135	-1.00925156159225	28515	28	TAOK3 ZMYND11 AKT1 PINK1 DUSP3 DACT1 FKTN MEN1 GSTP1
GO_POSITIVE_REGULATION_OF_CYTOKINE_BIOSYNTHETIC_PROCESS	0.58717481307545	0.982584886378682	-0.269334987636868	-0.918087247709508	38008	32	CD86 PRKCQ CD3E IFNG THBS1 IL1B
GO_REGULATION_OF_CYSTEINE_TYPE_ENDOPEPTIDASE_ACTIVITY	0.184069726169662	0.766952181435649	-0.261035164950527	-1.16098099517563	14001	139	APAF1 JAK2 BAX KIAA0141 FAS HTRA2 AIFM1 BCL2L11 AKT1 F2R PSMB9 FADD SLC11A2 GSN DAP IFI6 MAP3K5 MGMT CDKN1B ASPH PDCD6 APOPT1 AKT2 S100A8 THBS1 TRADD NOD1 TFAP4 RPS6KA3 TRIAP1 TNFSF10 FIS1 SMAD3 CDKN2D S100A9 TRAF2 PRDX5 MUL1 MAPK9 ARRB1 PDCD5 LGALS9 CASP3 RPS6KA1 NDUFA13 BCAP31 LEF1
GO_REGULATION_OF_CELLULAR_RESPONSE_TO_STRESS	0.616326530612245	0.989539519198471	-0.188960919493604	-0.954825784858796	55567	490	PTK2B MAPK3 DHFR RALB SNX5 VPS13C RAD9A TAOK3 ZEB2 NUPL2 PSAP OGG1 BAX PIP4K2B LRSAM1 POLH HTRA2 NSMCE1 MLST8 OS9 BMPR1A TSPO BCL2L11 CAPNS1 ZMYND11 CAPN1 MAP3K7 EPHA4 NSMCE4A NUP37 EIF2AK4 PIK3R1 DUSP22 OGT SMYD2 AKT1 MAP4K4 TRIM13 BAG4 HIPK2 THOC5 ADRB2 ATP6V1E2 TSC1 SIRT6 TXN USP13 SOD2 NUP210 P4HB DBNL MAP3K5 MGMT CDK6 PIAS4 SGTA DNM1L PINK1 CD74 ENDOG GBA DUSP3 NFE2L2 NUP160 FAM175A HSPA1A CD36 MAP4K2 HNRNPK RWDD3 C12orf5 CSNK2A2 RAD52 NOD1 EXOC7 IL1B TRIAP1 HAX1 ATP6V0E2 DACT1 MAP4K1 TAF9 CDKN2D ATG7 TRAF2
GO_POSITIVE_REGULATION_OF_EPITHELIAL_CELL_MIGRATION	0.846846034822059	0.998729039889192	-0.209475616333348	-0.762422748472788	56371	43	PTK2B AKT1 PDCD6 IFNG THBS1 ZNF580 BMPR2 PFN1 ITGB1BP1 HBEGF HDAC6 GLIPR2
GO_MISMATCH_REPAIR	0.696287639873853	0.998729039889192	-0.27310589487321	-0.839788767992371	43494	21	PMS1 POLD2 MSH3 POLD4 RPA1 PCNA PMS2 POLD1 MSH2 SETD2
GO_REGULATION_OF_ESTABLISHMENT_OR_MAINTENANCE_OF_CELL_POLARITY	0.192388149253247	0.782824114679612	-0.419472879115301	-1.23878969258923	11863	18	PTK2B LLGL1 FLOT2 GSN KANK1
GO_HOMOTYPIC_CELL_CELL_ADHESION	0.071203839064387	0.559194216009205	-0.450467009362879	-1.41761716390945	4480	23	RAP2B MYL12A STXBP3 HBB FERMT3 MYH9 PLEK VCL
GO_ERROR_PRONE_TRANSLESION_SYNTHESIS	0.967585036234249	0.998729039889192	-0.195646217573719	-0.568493607803258	59281	17	REV3L MAD2L2 RPA1 RFC3 PCNA POLI RFC2 UBB
GO_NEGATIVE_REGULATION_OF_MITOTIC_NUCLEAR_DIVISION	0.676813971439599	0.998729039889192	-0.280610908334663	-0.851765255954054	42086	20	TOM1L2 ATRX PTTG1 MAD2L1 MAD2L2 ZNF207 NME6 ZW10
GO_HOMEOSTASIS_OF_NUMBER_OF_CELLS_WITHIN_A_TISSUE	0.0974570738395247	0.61200831624745	-0.474806263774228	-1.37965522282019	5970	17	LIPA ADD1 VPS54 BAX F2R
GO_POSITIVE_REGULATION_OF_IMMUNE_EFFECTOR_PROCESS	0.424663904046828	0.94295740748899	-0.240360638462342	-1.01859424284676	31050	99	NCR3 CD86 HLA-E STAT6 FGR MAP3K7 B2M SPON2 TNFRSF4 LAG3 FADD CD74 IFNG IL4R MZB1 CD36 CD300A PAXIP1 IL1B FER TRAF2 STXBP2 UNC13D IL12RB1 STX7 PDPK1 LAMP1 LGALS9
GO_UROGENITAL_SYSTEM_DEVELOPMENT	0.494511563686572	0.970153724101699	-0.234398237357549	-0.981853245854592	35814	92	PSAP GCNT4 C5orf42 BAX BCL2L11 EPHA4 IQGAP1 KLHL3 ARL3 TSC1 HRSP12 ITGA6 HNRNPK NF1 PPAT PCSK5 FMN1 SMAD3 ID2 STAT1 CAT MEF2C ESR1 LEF1 MPST SRD5A1 PTPRO SMARCC1 FKBP4 WDR77 RRM2B TMED10 TRAF3IP1 CEP290 NOTCH1 ARID5B IFT20
GO_NEGATIVE_REGULATION_OF_CELL_ACTIVATION	0.726666479079321	0.998729039889192	-0.210357026550643	-0.86094452135909	51649	80	PAG1 FAS HLA-DRB5 DUSP22 MNDA NOS3 LAG3 ADRB2 CD74 IL4R DUSP3 CD300A LST1 FER PELI1
GO_CELLULAR_RESPONSE_TO_ALCOHOL	0.372857887292489	0.925622907425817	-0.283817888001801	-1.05538600021608	25042	48	FECH AIFM1 TP53INP1 RUVBL2 HNRNPK FBXO32 OSBPL7 TFAP4 SMYD3 DNMT3A NRIP1 CCL5 ESR1 SSTR3 SRD5A1 ROCK2 HMGCS1 CTNNA1 MSN
GO_PEPTIDYL_TYROSINE_AUTOPHOSPHORYLATION	0.0926008115647984	0.602824961367031	-0.430799798070552	-1.36931677232157	5841	24	PTK2B JAK2 MATK TEC FGR HCK FER TYK2 TXK
GO_CELL_JUNCTION_ASSEMBLY	0.492718232369296	0.970153724101699	-0.256812252330284	-0.980487094569725	33493	55	PTK2B PIP5K1C INADL LIMS1 ARL2
GO_INTERACTION_WITH_SYMBIONT	0.823888329256008	0.998729039889192	0.205742653425085	0.789289433356882	28625	35	YTHDC2 REST JUN CASP8 INPP5K GPX1 TUSC2
GO_REGULATION_OF_POLYSACCHARIDE_METABOLIC_PROCESS	0.496202250047671	0.970153724101699	-0.309504733937145	-0.974009670011322	31226	23	POMC AKT1 GSK3B AP2A1 AKT2
GO_SMOOTHENED_SIGNALING_PATHWAY	0.927333201792711	0.998729039889192	0.186377478072335	0.693273868295366	32898	31	DYRK2 ARL13B GPC2 HIPK1 WDPCP SEPT2 IFT57 NSDHL IFT172
GO_EYE_DEVELOPMENT	0.722596190621892	0.998729039889192	0.185193689502992	0.896762056307445	18892	107	RARA NINJ1 NRL ATP2B1 PSEN1 JUN TGIF2 PHACTR4 SKI RAB11FIP4 SOS1 PYGO2 ZEB1 ARID1A RAB3GAP1 MAN2A1 RRM1 HIPK1 JMJD6 WDPCP MED1 NIPBL RCN1 SKIL BAK1 RARG
GO_DEVELOPMENTAL_PROCESS_INVOLVED_IN_REPRODUCTION	0.410178035178035	0.937770226835485	0.187575436900975	1.01273987370677	7648	223	HOOK1 RNF8 RARA QKI SMAD4 PTK2 PABPC1L ZNF830 FNDC3A BIRC2 EIF2S2 HEXB AGFG1 DEAF1 NASP TBPL1 EIF2B5 MTOR DLD CIB1 ARID4A MAP3K4 ABHD2 ALKBH1 CASP8 IRF2BPL MAP2K1 PYGO2 PRDX3 TAF4 RPS6KB1 ARID1A PANK2 RBM15 DNAJC19 UBE2B NOG KIAA0196 CEP57 RRM1 ANXA1 ARID4B KDM5A MED1 ACVR1 EIF2B2 NIPBL PTEN SGPL1 NSDHL ZFP36L1 BAK1 RARG NCOA6 POMZP3
GO_PROTEIN_DEPHOSPHORYLATION	0.108110267678785	0.634527048107642	0.241322860876017	1.19660461452225	2705	123	PTPN7 SSH1 DUSP5 MTMR6 CTDP1 PPM1K PPP1R3B EYA3 PPP2R1A STYXL1 PPM1G DUSP10 PTPMT1 PTPN2 PPP3CB PPM1N PPM1A PPP1R12A RPAP2 PPP2R2A CTDNEP1 DAPP1 PPP3R1 TAB1 MTMR1
GO_REGULATION_OF_CELLULAR_PROTEIN_CATABOLIC_PROCESS	0.739608738519018	0.998729039889192	0.170989056072103	0.918155930406562	14252	212	CDC16 PTK2 PSMD2 ARIH1 PML PLK2 VCP PSMA6 GLMN RCHY1 EZR CUL3 MAD1L1 MDM2 NUB1 DNAJB2 RNF14 PSMA3 RNF40 USP14 SENP1 PSEN1 TERF1 CSNK1A1 RNF114 PSMC4 BUB3 ARAF APC GNB2L1 RNF138 USP19 LCMT1 GPX1
GO_REGULATION_OF_PROTEIN_AUTOPHOSPHORYLATION	0.567708333333333	0.982540819187032	-0.322647053597174	-0.922874340876617	34661	16	RAD50 RAP2B CALM3
GO_REGULATION_OF_NEURON_DEATH	0.131228604031951	0.686521925345106	-0.270677235760724	-1.20665405059734	10004	141	PTK2B CPEB4 JAK2 GCLM LGMN BAX HTRA2 SORL1 AIFM1 PPT1 BCL2L11 OXR1 AKT1 F2R GSK3B HIPK2 TSC1 SOD2 VEGFB MAP3K5 LIG4 PINK1 AIMP2 NF1 C12orf5 KDM2B TRAF2 G6PD ZNF746 SET STAMBP CCL5 SRPK2 SYNGAP1 CASP3 FBXW7 BTBD10 MEF2C ESR1 ADNP EGLN2 ADAM8
GO_RESPONSE_TO_GAMMA_RADIATION	0.820628185778968	0.998729039889192	0.20819820163409	0.787363629299419	28817	33	POLG ATR PML TMEM109 GPX1 TP53 BAK1 H2AFX EGR1 FANCD2 GATA3 POLB SOCS3
GO_REGULATION_OF_CYCLIN_DEPENDENT_PROTEIN_KINASE_ACTIVITY	0.27900949288034	0.873200769085876	0.257800756452121	1.09754978265311	8934	55	HEXIM1 PRKRIP1 CCNT1 CNPPD1 DNAJC3 CUL3 APC MNAT1 C2orf40 CCNL1 CKS2 PTEN CDKN1A CCNK CCNH FBXO31
GO_POSITIVE_REGULATION_OF_PROTEIN_IMPORT	0.687977577813837	0.998729039889192	-0.229412902330608	-0.86989379836106	46637	53	JAK2 PRKCQ ZNF268 NUTF2 BMPR1A PIK3R1 IL18R1 KANK1 IL1B DACT1 SMAD3
GO_MULTI_ORGANISM_METABOLIC_PROCESS	4.1211621677313e-05	0.00491234088865755	0.412333786442453	2.07448596477935	0	134	NUP98 NUP153 RPL28 NUP50 RPL26 RPL24 RPS29 AAAS RPL38 RPL27A RPS26 RPL8 NUP214 RPL12 RPL36A RPS15 RPS2 NUP93 FAU MAP2K1 RPL7A ATG16L1 RPS23 RPL27 RPL23A RPL10 RPS5 RANBP2 RPSA RPL10A MAP2K7 RPS14 RPS25 RPL3 RPL9 RPL13A RPS28 NUP62 RPS21 NUP54 RPL15 RPL18 RPL41 NUP88 RPL31 RPLP2 RPL35A RPL36 RPL7 RPS12 RPS18 RPL34 RPS27 RPS9 RPLP0 RPL23 EIF3F RPS3 RPL14 UBA52 MON1B POM121C RPL37A RPL30 RPS15A RPS11 RPL4 RPL11 RPLP1 RPS16 RPS8 RPL32
GO_MONOVALENT_INORGANIC_CATION_HOMEOSTASIS	0.621509592074941	0.989539519198471	-0.245345972770725	-0.90464766327072	41532	46	PDK2 SGK3 PPT1 ATP1B1 ATP6V1E2 TMEM165 SLC26A2 ATP6V0E2 SLC9A9 ATP1B3
GO_REGULATION_OF_BMP_SIGNALING_PATHWAY	0.769308002447328	0.998729039889192	-0.245214737323945	-0.795170473053846	49037	26	NEO1 TOB1 GREM2 HIPK2 TWSG1 FBXL15 BMPR2
GO_HEART_PROCESS	0.75274282698664	0.998729039889192	0.227734747240506	0.825227791659081	27100	28	PDE4D SRSF1 MTOR TPM1 SLC9A1 GPX1
GO_MUSCLE_SYSTEM_PROCESS	0.448921914635491	0.948549705908357	-0.239796334868724	-1.00613557519412	32562	93	BBS2 MYL12A PLA2G6 PSMB9 ATP1B1 NOS3 ADRB2 GSN CALM3 VIPR1 MKKS CFLAR VEGFB ASPH MAP2K3 SCO2 VCL IL1B TPM3 PDLIM5 TLN1 CXCR4 PXN GPD1L MEF2C UTRN CALM2
GO_MESENCHYME_DEVELOPMENT	0.25877430618265	0.873200769085876	-0.315974027272649	-1.1444405164884	17193	42	MAPK3 ZEB2 SEMA4F LIMS1 BMPR1A ADAM15 GSK3B
GO_TRANSCRIPTION_FROM_RNA_POLYMERASE_III_PROMOTER	0.986718619706779	0.998729039889192	-0.161346502334404	-0.572010035450803	65080	38	POLR3GL POLR2E POLR3F GTF3A ELL
GO_POSITIVE_REGULATION_OF_PROTEOLYSIS	0.232825764070858	0.840619587854106	-0.231465493304979	-1.1072059119953	19280	255	PTK2B SH3D19 APAF1 JAK2 BAX FAS HTRA2 AIFM1 BCL2L11 OGT NRD1 AKT1 F2R PSMB9 GSK3B PSMC5 FADD SLC11A2 GSN DAP GORASP1 TRIB2 PSMA1 CDC26 MAP3K5 PSMC3 CDKN1B ASPH SUMO2 SGTA PDCD6 APOPT1 PINK1 IFNG MYH9 GBA S100A8 USP5 NFE2L2 ANKIB1 PSMB7 OSBPL7 TRADD NOD1 TFAP4 IL1B TNFSF10 FIS1 SMAD3 PSMF1 S100A9 TRAF2 PSMD5 ANAPC11 MUL1 SMC5 MAPK9 ARRB1 MAD2L1 PSMD4 ANAPC2 FZR1 STUB1 PDCD5 LGALS9 CASP3 FBXW7 NDUFA13 RFWD2 NSMCE2 BCAP31
GO_REGULATION_OF_CILIUM_ASSEMBLY	0.85292847891783	0.998729039889192	0.200323546129117	0.768500141220664	29634	35	HTT ATG3 TBC1D13 TBC1D15 TBC1D2B TCHP USP6NL
GO_ANTERIOR_POSTERIOR_AXIS_SPECIFICATION	0.0160890773041857	0.331877891095215	0.559087308255483	1.69976915112567	629	15	SMAD4 ETS2 SKI EPB41L5 KDM6A DDIT3
GO_REGULATION_OF_PROTEIN_KINASE_B_SIGNALING	0.93457984721717	0.998729039889192	-0.181065338912228	-0.70345003225438	64228	60	TSC2 RRAS BAG4 TXN LEMD2 VEGFB PDCD6 PINK1 THBS1 HAX1 MUL1 ITGB1BP1 RAPGEF1 HPSE HBEGF
GO_HOMOLOGOUS_CHROMOSOME_SEGREGATION	0.921982111379513	0.998729039889192	-0.220978409675394	-0.642101927248637	56487	17	PTTG1 SYCE1L REC8 LEPREL4
GO_REGULATION_OF_DNA_TEMPLATED_TRANSCRIPTION_IN_RESPONSE_TO_STRESS	0.439515509237911	0.947482492983997	0.239765821190025	1.00365648388553	14296	51	CREBBP ATF3 CUL2 JUN UBE2D2 TP53 SIN3A HMOX1 NCK1 MBTPS2 DDIT3 UBA52 TCEB1 UBE2D1 CHD6 UBE2D3 EGR1 MAPK7 PPP1R15A XBP1 GCN1L1 EP300 RPS27A SIRT2 RBPJ
GO_ENDODERM_FORMATION	0.761947232717661	0.998729039889192	-0.267084315973931	-0.788754921125203	46986	18	ITGB2 ITGA4 ITGAV
GO_ESTABLISHMENT_OF_ENDOTHELIAL_BARRIER	0.198586033798523	0.788516831574437	0.373052446566664	1.21567022401946	7555	19	PDE4D EZR RAP2C RAPGEF6
GO_REGULATION_OF_HUMORAL_IMMUNE_RESPONSE	0.193452000919376	0.784015343417529	0.405625681243472	1.23320635203353	7574	15	LTA C5AR1 SUSD4
GO_REGULATION_OF_MAP_KINASE_ACTIVITY	0.249270913277053	0.862581222819135	-0.243045055328284	-1.10987656901209	19487	169	PTK2B MAPK3 TAOK3 ZEB2 MAP3K8 JAK2 MAP3K13 SORL1 DUSP18 MAP3K7 EPHA4 DUSP22 F2R GSK3B HGS TRIB2 GPS1 DBNL MAP3K5 MAP2K3 CD74 GBA THBS1 DUSP3 MAP4K2 CD300A NF1 LAMTOR2 NOD1 IL1B MAP4K1 CD81 TRAF2 MUL1 IRAK1 MAP3K1 ARRB1 MBIP RAPGEF1 CXCR4 MAPK1 GSTP1 TNIK
GO_NLS_BEARING_PROTEIN_IMPORT_INTO_NUCLEUS	0.760352213231794	0.998729039889192	0.243076606274837	0.803415082130054	28754	20	KPNA1 RANBP2 NUP54 KPNA3 TNPO1 TNPO2 KPNA4
GO_VACUOLE_FUSION	0.325726875080407	0.893659365588066	-0.364064612207801	-1.10508030297654	20254	20	EEA1 SNX14 VPS41 VTI1B CHMP3 UVRAG
GO_CELLULAR_RESPONSE_TO_ESTROGEN_STIMULUS	0.787584931973341	0.998729039889192	-0.260560566011897	-0.769488945629858	48567	18	FAS AIFM1 RUVBL2 KAT5 NRIP1 ESR1 SRD5A1
GO_LYTIC_VACUOLE_ORGANIZATION	0.753005746167958	0.998729039889192	-0.231512656092237	-0.820765003905463	49665	38	HOOK2 PPT1 VPS18 HOOK3 HPS1 TMEM165 LAMTOR1
GO_REGULATION_OF_CHEMOTAXIS	0.120572829761611	0.661211502975192	-0.325420763888227	-1.26869937360743	8309	61	PTK2B SEMA4F CCL4 GPSM3 MPP1 VEGFB AKT2 CD74 THBS1 ZNF580 SWAP70 IL1B ADAM10 SMAD3 BMPR2 PLXNC1 CCL5 CXCR4 CAMK1D LGALS9 SEMA4C JAM3
GO_MEIOTIC_CELL_CYCLE_PROCESS	0.648503002594127	0.995935079751018	-0.225400087781231	-0.898466890333337	45247	69	MASTL RAD50 BCL2L11 RAD51C STRA13 KLHDC3 MSH3 SMC2 FANCM MYH9 PTTG1 RAD51B NCAPD2 SYCE1L ACTR2 REC8
GO_NEGATIVE_REGULATION_OF_ACTIN_FILAMENT_POLYMERIZATION	0.0103981739792037	0.257781596708317	-0.524018130532543	-1.66561548624796	655	24	ADD1 CAPG GSN PFN2 MKKS KANK1 PFN1 RDX TRIOBP TWF1
GO_DEVELOPMENTAL_CELL_GROWTH	0.0493380903201577	0.508809887916542	-0.44778855486145	-1.46530526446362	3152	27	ZEB2 ULK2 SPG11 EIF2AK4 IQGAP1 SIRT6 VCL PRMT2 PDLIM5
GO_SPINDLE_ASSEMBLY	0.273520417341248	0.873200769085876	0.274351024445368	1.11104232315392	9122	44	TUBGCP5 BIRC2 CLASP1 TUBB HAUS8 TUBGCP6 HAUS2 KIAA0196 TUBGCP3 HAUS5 HAUS6 RPS3 KIF2A CEP192
GO_REGULATION_OF_SODIUM_ION_TRANSMEMBRANE_TRANSPORTER_ACTIVITY	0.926102809017614	0.998729039889192	0.208825955160891	0.647279297549326	36067	16	SLC9A3R1 SLC9A1 ANK3 GLRX YWHAH RANGRF FXYD5
GO_NEGATIVE_REGULATION_OF_ANTIGEN_RECEPTOR_MEDIATED_SIGNALING_PATHWAY	0.261497641509434	0.873200769085876	-0.4083738227171	-1.16808047143006	15965	16	DUSP22 PLCL2 PHPT1 DUSP3 CD300A
GO_SPHINGOLIPID_BIOSYNTHETIC_PROCESS	0.819185226738633	0.998729039889192	-0.219005084131457	-0.776422817510489	54030	38	ALDH3A2 ELOVL1 CERS5 VAPA GBA UGCG PPAP2A CERS4 CERS6 ACER3 ST3GAL1 AGK ST6GALNAC3 ST6GALNAC6
GO_REGULATION_OF_PHOSPHOPROTEIN_PHOSPHATASE_ACTIVITY	0.409668292095599	0.937770226835485	-0.285111829591635	-1.032659337007	27219	42	PPP2R2B JAK2 PPP2R4 CALM3 TSC1 FKBP1A PPP2R5C SLC39A10 CD300A PPP2R5E
GO_REGULATION_OF_MULTI_ORGANISM_PROCESS	0.870938756207141	0.998729039889192	-0.172988306125611	-0.839657165838526	73663	296	MAPK3 STAT2 AP1M1 SLC35B3 DAK PACS1 LRSAM1 TRIM62 CCL4 OSBP BCL2L11 ALKBH5 EIF2AK4 DYNLT1 ATP1B1 B2M POLR2E TRIM13 AP1S1 ITGAV AP2A1 GSN PLSCR1 FUCA2 POLR2J OAS3 P4HB FAM111A VAPA ELMO1 SP1 IFNG CHMP3 CD36 IFITM2 IFITM3 TRIM11 SMARCA4 NOD1 EXOC7 TFAP4 CHAF1B HCK LY96 ZCCHC17 PFN1 MUL1 B4GALT1 IL12RB1 POLR2D CCL5 PPM1B SRPK2 NTHL1 CD4 ANXA5 STAT1 VPS4A LGALS1 TNIK TRIM25 SUPT4H1 LGALS9 SNRPB2 EIF2AK2 EXOC2 LEF1 CFL1 SUPT3H DDX60 AP2M1 ZNF639 SPN CD55 OXT VPS25 MX1 CD247 CD8B HLA-A CHMP4B ZNF189 RSF1 SLC37A4 SNRPB FYN DOCK2 APOBEC3A YIPF1 HERC5 TRAF3IP1 TBK1 POLR2L MIF C19orf66 APOBEC3C NOTCH1 LY86 RAD23A SRPK1 TRAF6 APOBEC3D ISG20 ALPK1 SNRPD1 LSM4
GO_POSITIVE_REGULATION_OF_CELL_CYCLE_ARREST	0.769530513481239	0.998729039889192	0.198148597747769	0.84666592924053	24487	56	PML CNOT2 PIDD PLK2 MDM2 E2F4 TFDP2 RBM38 CNOT4 TP53 PLK3 CDKN1A PLAGL1 TFDP1 CNOT10 RQCD1 UBA52 MED25
GO_CONNECTIVE_TISSUE_DEVELOPMENT	0.816134381082835	0.998729039889192	-0.203452184669645	-0.802475454734431	56602	65	BBS2 MAPK3 BMPR1A PPARD ARRDC3 FTO MKKS DYRK1B PAXIP1 BMPR2 RUNX3
GO_CYTOPLASMIC_PATTERN_RECOGNITION_RECEPTOR_SIGNALING_PATHWAY	0.445764231286419	0.948549705908357	0.271390787823319	1.00129559373264	15911	30	IRF3 LSM14A ITCH CASP8 FAM105B TAB1 NFKBIA
GO_REGULATION_OF_STEROID_BIOSYNTHETIC_PROCESS	0.811653848598487	0.998729039889192	-0.242153677351639	-0.762056270897613	51078	23	ERLIN2 TSPO SCAP IFNG IL1B DDX20
GO_NUCLEAR_ENVELOPE_ORGANIZATION	0.274083588578204	0.873200769085876	0.246320394317449	1.09358029929375	8321	67	CHMP2A NUP98 NUP153 TOR1A NUP50 PPP2R1A AAAS LMNA NUP214 NUP93 CTDNEP1 RANBP2 NUP62 NUP54 NUP88 PRKCA NDEL1 EMD TOR1AIP1 POM121C OSBPL8
GO_REGULATION_OF_GLIAL_CELL_DIFFERENTIATION	0.711672916799085	0.998729039889192	-0.26437243280043	-0.831978570267464	44786	23	MBD1 EPHA4 NF1 PRMT5 DICER1 IL1B CXCR4 ID2
GO_BIOMINERAL_TISSUE_DEVELOPMENT	0.573716066092908	0.982540819187032	0.300316042041513	0.913037975129742	22464	15	AXIN2 TFIP11 SBDS
GO_CELLULAR_RESPONSE_TO_ENDOGENOUS_STIMULUS	0.965913890062015	0.998729039889192	-0.158098429034757	-0.797861683298722	86910	481	BAIAP2 CRHR1 BBS2 MAPK3 CPEB4 SLC33A1 APAF1 JAK2 ITGB2 ACACA PPARGC1B PDK2 FAS LIMS1 BMPR1A FECH AIFM1 MAP3K7 MTMR4 PTPRA IQGAP1 PIK3R1 GREM2 DUSP22 OGT AKT1 PPARD POLR2E GSK3B BAG4 HIPK2 CAPN2 ATP6V1E2 MKKS POLR2J DDX54 FKBP1A SLC38A9 UROS RUVBL2 AKT2 KAT2B PRKACA STXBP4 CD36 ACAP2 HNRNPK LAMTOR1 FBXO32 DNMT1 RRAGC LAMTOR2 NOD1 TFAP4 PPAT TWSG1 IL1B RAN AP3S1 ATP6V0E2 FER SMAD3 SMYD3 GNG10 CD81 EIF4EBP1 DNMT3A MICALL1 BMPR2 UBE2L3 KAT5 TADA3 ZFYVE16 RRAGD NRIP1 RDX AKAP7 ZYX ITGB1BP1 ACSL1 POLR2D CCL5 NCOA1 RAPGEF1 MEN1 APPL1 ESRRA ANXA5 MAPK1 PDPK1 PXN GSTP1
GO_POSITIVE_REGULATION_OF_HISTONE_METHYLATION	0.676009058212335	0.998729039889192	0.256438461927313	0.859113470439489	25373	21	JARID2 SMAD4 RNF20 CTR9 MTF2 EED PAF1
GO_NEGATIVE_REGULATION_OF_T_CELL_DIFFERENTIATION	0.51704924767627	0.973004554933765	0.307540523803704	0.953256093392427	20136	16	KIAA0922 PTPN2 ZC3H8 ANXA1
GO_RNA_POLYADENYLATION	0.720141819493905	0.998729039889192	-0.255433535668868	-0.828307497372413	45903	26	CSTF3 SSU72 CPSF1 CSTF1 PCF11 NUDT21 PNPT1 CDC73
GO_ASPARTATE_FAMILY_AMINO_ACID_METABOLIC_PROCESS	0.633966543804933	0.994381609906342	0.238719623887687	0.895249154874059	22359	32	GOT1 MTR DLD OGDH APIP AHCYL2 EIF2B2 PHGDH ASNS
GO_POSITIVE_REGULATION_OF_MUSCLE_TISSUE_DEVELOPMENT	0.810849168177876	0.998729039889192	0.234920236013458	0.765537228262488	30851	19	HMGCR MTOR RPS6KB1 ARNTL MAPK14 MTM1 NACA PRKAA1 TGFB1 RBPJ DDX39B
GO_PROTEIN_TRANSMEMBRANE_TRANSPORT	0.269939483573035	0.873200769085876	-0.314872071454576	-1.13492497393547	17886	41	ZFAND2B CHCHD4 AFG3L2 SEC61G TIMM50 PEX2 AKT2 TOMM40 SRP9 PEX26 PEX6 PAM16 NDUFA13
GO_INTRINSIC_APOPTOTIC_SIGNALING_PATHWAY_BY_P53_CLASS_MEDIATOR	0.391019481086748	0.929863721591279	0.266498645281964	1.03503301809322	13427	37	ZNF346 WWOX DYRK2 PML TMEM109 TP53BP2 TP53 HIPK1 PMAIP1 CDKN1A
GO_RESPONSE_TO_RETINOIC_ACID	0.86725556813892	0.998729039889192	-0.207027404935986	-0.74230029882404	57433	40	PTK2B HTRA2 OGT TRIM16 GDAP2 CDKN2D NCOA1 GDAP1 OVCA2 NDUFA13 ADNP2
GO_ODONTOGENESIS_OF_DENTIN_CONTAINING_TOOTH	0.493359411968832	0.970153724101699	-0.303994506305849	-0.976327047087769	31277	25	BAX BMPR1A BCL2L11 ITGA6
GO_REGULATION_OF_TRANSLATIONAL_INITIATION	0.278401829555391	0.873200769085876	0.242074102056234	1.09045180880641	8277	72	EIF4A2 RARA METTL3 DNAJC3 MTIF2 KHDRBS1 EIF2B5 EIF1 RPS6KB1 DDX3X RPL13A BANK1 EIF2B2 POLR2G NCK1 EIF1B EIF3F PPP1R15B GLE1 EIF4G1 EIF4EBP3 EIF4G3 PPP1R15A EIF3J EIF3C EIF3L NPM1 EIF3H TPR
GO_MYELOID_CELL_ACTIVATION_INVOLVED_IN_IMMUNE_RESPONSE	0.866498600991772	0.998729039889192	0.207340638434744	0.743782343109149	31277	27	TICAM1 RASGRP1 LAT SLAMF1 PIK3CG
GO_POSITIVE_REGULATION_OF_SYNAPTIC_TRANSMISSION	0.426559602801232	0.943429427766773	-0.293760242406952	-1.02158421855577	27835	35	PTK2B FLOT1 GSK3B PINK1 IFNG HNRNPK CLSTN1 SNAP47 MAPK1 CLSTN3 RGS14 DTNBP1 OXT
GO_CELL_RECOGNITION	0.804735325891249	0.998729039889192	-0.217037899257509	-0.793693241996673	53633	44	NCR3 EPHA4 PRF1 DOCK8 CCT5 VCAN CD36 ROBO3 CATSPER2 B4GALT1 CXCR4
GO_PROTEIN_K63_LINKED_UBIQUITINATION	0.670887494397131	0.997892231881855	0.236735561072176	0.873435226311784	23947	30	RNF8 RNF168 PRPF19 ITCH TRIM27 UBE2B RNF4 UBE2O UBE2G1
GO_NEGATIVE_REGULATION_OF_PHOSPHORYLATION	0.41537157389093	0.941281352137837	0.185055024946465	1.00975795246985	7349	242	HEXIM1 NPRL2 PRKRIP1 DNAJC15 PDE4D DUSP5 PPP2R1A DNAJA1 ILK DNAJC3 DUSP10 SAMSN1 HMGCR ATG14 EZR SLC9A3R1 CUL3 ATF3 PTPN2 CHORDC1 GPS2 CALM1 MTOR PRNP NDRG2 CIB1 PSEN1 JUN ITCH SEMA4D APC CISH INPP5K GNB2L1 PRDX3 RANBP2 C2orf40 TRIM27 STK38 UBE2B TAF7 NOG PKIA NUP62
GO_NEGATIVE_REGULATION_OF_NUCLEAR_DIVISION	0.385643080223351	0.929863721591279	-0.327971742209974	-1.05333378057146	24448	25	TOM1L2 RPS6KA2 ATRX CSNK2A2 PTTG1 OSM MAD2L1 MAD2L2 ZNF207 NME6 ZW10
GO_REGULATION_OF_GENERATION_OF_PRECURSOR_METABOLITES_AND_ENERGY	0.533620125315627	0.975219757727151	0.225814136125985	0.957272290251154	17117	54	ATP7A DNAJC15 DYRK2 PPP1R3B VCP ECD MTOR
GO_LIPID_CATABOLIC_PROCESS	0.444550566332159	0.948549705908357	-0.232989028694315	-1.00886512686633	33046	114	CPT2 LIPA ALDH3A2 GALC PPT1 PPARD PLA2G6 ABHD6 ABHD12 PEX2 PLA2G16 LPIN2 GBA C2orf43 ABCD1 SLC25A17 ETFA ABCD2 DECR1 PLD2 IVD TRERF1 PNPLA6 PHYH FABP5 HSD17B11 GM2A PAFAH1B3 GPCPD1 ACAA1 PEX7 PRDX6 MCEE PLBD2
GO_POSITIVE_REGULATION_OF_LIPID_METABOLIC_PROCESS	0.564535054268114	0.982540819187032	-0.245104221519028	-0.939223241766181	38489	56	PTK2B CREBL2 FGR ABHD5 PLA2G6 ABHD6 ADRB2 AKT2 IFNG NSMAF IL1B CD81 ABCD2 MAPK9
GO_RESPIRATORY_SYSTEM_DEVELOPMENT	0.819092699933391	0.998729039889192	-0.199304307897074	-0.806380287855619	57795	75	MAPK3 LIPA BMPR1A PHF14 MAN1A2 NOS3 HOPX HRSP12 AIMP2 HNRNPK TIMELESS EIF4EBP1 RC3H2 ATXN1L BMPR2 RAB3A MAPK1 CHD7 CIC SEPN1 LEF1
GO_ION_HOMEOSTASIS	0.599465660081377	0.984391953925029	-0.200111257389933	-0.946370131824452	48913	228	PTK2B STIM2 JAK2 NUBP1 TMTC2 BAX SLC39A4 NEO1 PDK2 SGK3 RAP1GDS1 PPT1 S1PR4 F2R PLA2G6 ATP1B1 B2M KLHL3 ATOX1 SLC30A4 SLC11A2 SLC25A37 ATP6V1E2 SLC22A17 COMMD1 GTF2I ANXA6 CUTC TMEM165 SLC26A2 SCO2 S100A8 MCU SLC39A10 PRKACA SWAP70 CD36
GO_NEUROEPITHELIAL_CELL_DIFFERENTIATION	0.602895526281466	0.98563924129283	0.279983494118748	0.898829904299155	23111	18	HPS4 SLC9A3R1 SEC24B MYO5A WDPCP RAC1 SOD1 PAFAH1B1 SLC4A7
GO_NUCLEOSIDE_MONOPHOSPHATE_METABOLIC_PROCESS	0.58119095737181	0.982584886378682	0.183322212379332	0.960539251560876	12365	177	NDUFS8 FIGNL1 UCKL1 CHCHD10 ALDOC UQCRH NDUFV1 DLG3 UQCRB VCP BPGM HK1 COX7B NDUFV3 DLD NDUFAB1 PGK1 NDUFS3 MECP2 COX5B NDUFA8 OGDH NDUFS2 NDUFA2 COQ9 NDUFA4 COX6A1 FXN GBAS NDUFB6 ATP6V1A NDUFS6 DTYMK HSPA8 UPP1 ATP5L CYCS ATP5D DHTKD1 TAZ ALDOA
GO_REGULATION_OF_GLUCOSE_TRANSPORT	0.64837298252731	0.995935079751018	-0.229089873232275	-0.895775976892464	44751	62	CREBL2 NUPL2 NUP37 PIK3R1 AKT1 SIRT6 NUP210 AKT2 MZB1 NFE2L2 NUP160 IL1B NUP35 APPL1 NUP205 RHOQ ESR1 NUP107 MARCKS
GO_NEGATIVE_REGULATION_OF_TRANSFORMING_GROWTH_FACTOR_BETA_RECEPTOR_SIGNALING_PATHWAY	0.828430674602045	0.998729039889192	0.206802255068343	0.782084440787281	29091	33	LEMD3 BCL9L PPM1A SKI SMURF1 SKIL UBA52 ADAM17 SMAD2
GO_ADHERENS_JUNCTION_ORGANIZATION	0.420912131738068	0.941990991122426	-0.339071221525583	-1.02921546244721	26173	20	PTK2B PIP5K1C
GO_POSITIVE_REGULATION_OF_OSTEOBLAST_DIFFERENTIATION	0.988021577026813	0.998729039889192	0.160157516234411	0.529351491413081	37364	20	ILK LMNA ACVR1 GNAS
GO_MYD88_INDEPENDENT_TOLL_LIKE_RECEPTOR_SIGNALING_PATHWAY	0.073106764288056	0.568760353547826	0.397212788834691	1.39679805667235	2675	25	TRAF3 IRF3 BIRC2 TANK TICAM1 UBE2D2
GO_NEGATIVE_REGULATION_OF_SIGNAL_TRANSDUCTION_BY_P53_CLASS_MEDIATOR	0.977841239621344	0.998729039889192	0.171152528304549	0.565692127645935	36979	20	MDM2 CD44 DYRK1A
GO_POSITIVE_REGULATION_OF_LIPASE_ACTIVITY	0.445955464051579	0.948549705908357	0.288320877706888	1.00315648306224	16461	24	ARL1 ARF4 C5AR1 NR1H2 LPAR2
GO_POSITIVE_REGULATION_OF_ERK1_AND_ERK2_CASCADE	0.290453852642171	0.879577279943733	-0.294515539946477	-1.1123950669588	19627	52	PTK2B MAPK3 CCL4 F2R GPR183 VEGFB CD74 CD36 NOD1 IL1B ARRB1 CCL5 LGALS9 FBXW7 ESR1 RAPGEF2 GLIPR2
