pathway	pval	padj	ES	NES	nMoreExtreme	size	leadingEdge
GO_REGULATION_OF_ACTIN_FILAMENT_LENGTH	0.120762002831767	0.524710902304029	-0.294044660011255	-1.23902259131822	4690	65	HAX1 ABI2 EVL ARPC5 VASP BAG4 WDR1 CORO1A WHAMM MTOR NCK2 ACTR2 CAPZB GMFG LIMA1 PREX1 CAPZA1 SH3BGRL3 MYADM CORO1B MLST8 NCK1 MKKS PYCARD ARPC2 ARPC1B IQGAP2 BRK1 GRB2 CDC42EP3 PTK2B
GO_REGULATION_OF_TRANSPORTER_ACTIVITY	0.90771907518319	0.988863629445347	0.194291071254604	0.728528646674076	54257	50	DNM2 RANGRF YWHAE ACTN4 GSTO1 CALM3 CAB39 HTT PARK7 MYO5A FXYD1 CAMK2D GNB5 OXSR1 KLHL24 FAM115C
GO_CELL_JUNCTION_ORGANIZATION	0.804814651218103	0.971420767425976	0.221595270012197	0.792955233804531	47372	40	LIMS2 CTNNB1 ACTN4 SMAD7 APC MTDH PLEC PDPK1 HIPK1 VMP1 FLNA CDC42 DLG1 CCM2
GO_PROTEIN_DESTABILIZATION	0.997611391823611	0.999972508968949	-0.143167840096782	-0.45597915747804	43435	20	CCDC88C TRIM21 CDC73 SIRT6 SENP2 FBXL3 PRKDC MYLIP XBP1
GO_EAR_DEVELOPMENT	0.568151100329232	0.889927729885924	0.276855655171189	0.927875041510077	32787	30	RBPJ PAFAH1B1 AHI1 SEC24B MAF MAPKAPK2 CCM2 LRP10 PTPN11 SLC4A7 ANP32B BCL2 TGFB1 SLC9A3R1 INSIG1
GO_POSITIVE_REGULATION_OF_SMOOTH_MUSCLE_CELL_PROLIFERATION	0.0144144979258882	0.237246493376502	-0.492814371300033	-1.65245617574615	621	24	IL6R TNF AKR1B1 NR4A3 STAT1 TGFBR2 MTOR CCL5
GO_MEMBRANE_BUDDING	0.432848408180477	0.834187164361035	0.251137472707622	1.01216300618205	26688	72	PPP6R1 TFG SEC24B CHMP2A AREG TRAPPC10 CHMP4B STX5 GOLGA2 ANKRD28 CTSC ANXA2 LMAN1 AP2S1 SEC23A SCFD1 GOLPH3
GO_REGULATION_OF_SYNAPTIC_PLASTICITY	0.502970297029703	0.861243233729788	-0.275573707269524	-0.968050115976253	21335	29	PTEN EIF2AK4 CD38 RAB11A CDK5 STAU1 RGS14 PTK2B PPP3CB GSK3B YWHAH EIF4EBP2
GO_NCRNA_TRANSCRIPTION	0.949529712481414	0.998503782470517	0.181159591732477	0.68466183223288	56835	52	POLR2H ELL2 POLR2I TAF6 POLR2C POLR2D POLR2B CCNK NCBP2 SIRT7 POLR2L INTS12 POLR2F GTF2F1 CCNT1 PHAX NCBP1
GO_REGULATION_OF_INTERLEUKIN_1_BETA_PRODUCTION	0.434617683571658	0.83525876254034	-0.313133863560347	-1.01125225311721	18904	21	TNFAIP3 ZC3H12A CASP1 GSTP1 ACP5 ARRB2 PYCARD SMAD3
GO_NEGATIVE_REGULATION_OF_INTRINSIC_APOPTOTIC_SIGNALING_PATHWAY	0.931047876382673	0.994349575222347	0.190432221905617	0.692237166070393	55131	43	HERPUD1 TRIAP1 HSPA1A NDUFS3 CDKN2D USP47 PARL PARK7 NONO DDX3X MCL1
GO_CD4_POSITIVE_ALPHA_BETA_T_CELL_ACTIVATION	0.426112234006313	0.832022321853566	-0.335517899593912	-1.01950478084711	18762	17	GATA3 STAT6 RELB BATF RC3H2 LEF1
GO_LYMPHOCYTE_ACTIVATION	0.0199842786310316	0.263126335308582	-0.273910844222225	-1.34943351517051	660	161	PRKCB IRF1 CD3G AMICA1 GATA3 STAT6 TCF7 ITGB2 IKZF3 BTN3A1 BAK1 EIF2AK4 NBN KLF6 ZFP36L2 LAT SLAMF1 RELB CMTM7 CD3E HLA-E DOCK8 RNF168 JAK3 CD2 BATF ITPKB CORO1A PIK3R1 LCP1 CD151 NCK2 IMPDH1 AZI2 ADAM17 RC3H2 IGBP1 LEF1 IL2RB PTPN22 FKBP1A EXOSC6 PREX1 ERCC1 DDOST ITGB1 ZAP70 ADA NCK1 LAX1 NCSTN PTGER4 CD74 DCLRE1C SMAD3
GO_PROTEIN_TRIMERIZATION	0.637592226021234	0.918587164181571	0.310457490703757	0.871164839979015	35430	15	SKI ALOX5AP PNPT1
GO_REGULATION_OF_PEPTIDYL_SERINE_PHOSPHORYLATION	0.436731494635771	0.836685249668638	-0.262600272981198	-1.00794187991757	17829	42	HAX1 RASSF2 OGT BAK1 TNF AKT2 BAG4 GNB2L1 NCK2 INPP5K
GO_NITROGEN_COMPOUND_TRANSPORT	0.593513610101852	0.899488876815001	0.205001799661025	0.943300176529337	39857	168	SHFM1 SERINC3 THOC7 SLC25A32 SLC7A5 NUP50 SUPT6H ENY2 KHSRP THOC2 EIF4E CD320 GLS POLDIP3 HNRNPA1 AQP3 GLE1 SRSF11 DDX39A G3BP2 PNPT1 HTT POLR2D C14orf166 SMG1 SLC25A13 UPF3A SRSF10 ABCC1 PARK7 SLC25A6 SEC14L1 SERINC5 NCBP2 RAB11FIP2 MYO5A SRSF2
GO_DEFENSE_RESPONSE_TO_OTHER_ORGANISM	0.733786088081378	0.947019966152551	-0.185986822240469	-0.899109073092268	24958	142	IRF1 TICAM1 EIF2AK4 IL6R OAS1 DNAAF2 TNF MB21D1 IL4R IFITM1 HLA-E APP IFITM3 BATF RAB14 CRNKL1 NLRC5 ZC3H12A GBP1 LYST STAT1 PLAC8 OPTN PMAIP1 RPL39 HLA-A ADAM17 HIST1H3D AIMP1 HIST1H2BC MTSS1 POLR3E HIST1H2BK ACP5 MX2 IFIT5 IL27RA BECN1 BNIP3L LGALS8 PYCARD FAM13B B2M APOBEC3G
GO_LEUKOCYTE_PROLIFERATION	0.815090439276486	0.971702450653475	0.227826788726295	0.775655023120838	47315	32	IMPDH2 HSPD1 HELLS PLCL2 CD79A MALT1 TBK1 RC3H1 PSMB10
GO_CELLULAR_RESPONSE_TO_INTERFERON_GAMMA	0.433614292918378	0.834267499363993	-0.272022523261674	-1.00788665350694	18056	36	IRF1 OAS1 CAMK2G GBP1 IRF2 STAT1 RPL13A CCL5 JAK1 TRIM26 TRIM21
GO_IN_UTERO_EMBRYONIC_DEVELOPMENT	0.61095268418284	0.904513240670945	-0.201964074452482	-0.937299018798093	22066	109	SOCS3 JUNB GATA3 ZFAND5 PLCG1 APBA3 GPI NBN MED21 CAPN2 CTR9 RIC8A KIDINS220 NDEL1 WDR74 FUT8 BIRC6 TGFBR2 DAD1 BTF3 KLF2 LEF1 COL4A3BP INPP5K CUL3
GO_ER_NUCLEUS_SIGNALING_PATHWAY	0.079611065849598	0.44053446104013	0.465141193145414	1.40971568143989	4494	20	HSP90B1 HSPA5 CALR HERPUD1 CCDC47 EIF2S1 ATF4
GO_VESICLE_CYTOSKELETAL_TRAFFICKING	0.0863943891466827	0.455353638101116	0.460100607177202	1.39443904460843	4877	20	AP3D1 PAFAH1B1 BLOC1S2 ACTN4 AP3B1 HTT MYO5A NDE1
GO_REGULATION_OF_TRANSCRIPTION_FACTOR_IMPORT_INTO_NUCLEUS	0.166662631642658	0.600306655683266	-0.322329704698289	-1.21698547401545	6883	39	DMAP1 NFKBIA TNF LITAF CD27 TBC1D10C ZC3H12A SRI CREB3 PIK3R1 CYLD MTOR
GO_MESENCHYMAL_CELL_DIFFERENTIATION	0.435759080919795	0.83592636052826	0.348853230026926	1.01442082165311	24388	17	RBPJ CTNNB1
GO_REGULATION_OF_SMALL_GTPASE_MEDIATED_SIGNAL_TRANSDUCTION	0.836317880794702	0.973339605014191	-0.187485087526791	-0.825558343805326	31570	81	OGT FLOT1 ARHGAP9 ARHGEF1 RHOG ARHGAP1 RAC2 ITPKB ARHGDIB ARHGAP30 MYO9B STMN3 RHOT2 RALBP1 CUL3 ARHGAP4 PREX1 ARHGAP15 ITGB1
GO_RNA_MODIFICATION	0.349332485696122	0.788998846754051	0.284108287374207	1.06531414322374	20880	50	ADAT2 NHP2 GAR1 RPUSD4 KIAA1429 DNAJB11 HSD17B10 CDKAL1 TRMT112 FBL DUS3L
GO_CELLULAR_COMPONENT_ASSEMBLY_INVOLVED_IN_MORPHOGENESIS	0.610700304480209	0.904513240670945	0.243596677275233	0.913408714480089	36503	50	FOPNL TMF1 PAFAH1B1 AHI1 NEK1 PIBF1 IFT20 DICER1 SEPT2 IFT57 CDC14A FLNA UBE2B PCNT TBPL1 TTN
GO_ORGANELLE_FISSION	0.192121520459336	0.642953535093053	0.239147991953188	1.12966904873155	13216	206	CDK11B NUDC MKI67 NUSAP1 PTTG1 USP9X PAFAH1B1 BRE ANAPC11 HAUS6 CDK11A KLHDC3 NCAPD2 ZNF207 SMC1A WAPAL CHMP2A HELLS NEK1 PIBF1 SNX9 CLTC SLC25A46 CHMP4B CCNB1IP1 MLH1 GOLGA2 CENPN CCNG1 MAD2L2 KPNB1 PAPD5 LATS1 MAU2 SMC3 CTDP1 DIS3L2 CSNK1A1 SSSCA1 KIF22 SEPT2 CCNK PPP2R1A PDS5B MFF SMC4 SIRT7 KIF2A AKAP8L CDC27 AKAP8 RRS1 CDC14A FLNA BUB3 NDE1 UBE2B BABAM1 NCAPD3 STAG1 DYNLT3 SMC2 TUBGCP3 TUBGCP2 TTN STAG2 CKAP5 TERF1 BAG6 USP16 HAUS4 RAD51C CHFR TPR CHMP5
GO_MUSCLE_STRUCTURE_DEVELOPMENT	0.144445043975611	0.565545566026419	-0.261943642294973	-1.1851176749269	5353	94	UBE4B FLNB AFG3L2 SIK1 HMG20B UTRN BTG2 TCF12 GPCPD1 MEF2A ACTG1 EEF2 CAPN2 VAMP5 FOS MYL6B ARID1A WDR1 FRG1 SRI MTOR TGFBR3 KDM6B LEF1 RB1 SERP1 FKBP1A LMNA FOXN2 IFRD1 ITGB1 FAM65B GPX1 SIRT6 ATF3 CDK5
GO_NEGATIVE_REGULATION_OF_CELL_CYCLE_PROCESS	0.409001895135818	0.820508047462775	0.240332494957537	1.02249048449068	25897	99	PTTG1 PCNA TRIAP1 DGKZ ZNF207 SMC1A WAPAL CHMP2A RPA2 PML FBXW7 APC CSNK2A1 ZNF655 CDK5RAP2 MAD2L2 TFDP1 CTDSP1 SMC3 USP47 EP300 CAST CCNK CDKN1A SYF2 AURKAIP1 EZH2
GO_RIBOSOMAL_LARGE_SUBUNIT_ASSEMBLY	0.98396657052665	0.999972508968949	-0.176170852806638	-0.535312801193806	43326	17	MDN1 RPL6 RPL38 MRTO4 RPL24
GO_MAINTENANCE_OF_LOCATION_IN_CELL	0.818114924075189	0.971702450653475	0.212643442576305	0.791498366869934	48919	48	HSPA5 PML GPAA1 POLR2M PDIA3 GET4 LATS1 G3BP2 GOLPH3 YWHAB SUFU FLNA TOPORS KEAP1 TSPO SYNE1
GO_REGULATION_OF_MICROTUBULE_POLYMERIZATION	0.423906193734246	0.830736428514033	-0.348106465898177	-1.02109609875213	18834	15	CDKN1B SGK1 TBCD MAPRE1
GO_CELLULAR_RESPONSE_TO_OXYGEN_LEVELS	0.326474966962747	0.770739480235229	0.28703133210574	1.0805795948556	19516	51	RBPJ GNB1 RBX1 FAM162A TCEB1 DAXX CUL2 FOXO1 RORA EP300 PDK1 BBC3 P4HB PRKAA1 ADAM8
GO_CELLULAR_RESPONSE_TO_HORMONE_STIMULUS	0.385804481859142	0.811305170038577	0.222242902806624	1.03113371728006	26030	179	SAFB DDX54 ATP6V0A2 ATP6V0B GNB1 NR1H2 HNRNPD USF1 CTNNB1 CALR H2AFZ RAB10 UBR5 PLOD3 PELP1 DAXX MED1 ATP6V0E1 MED4 CBX3 PDE3B FBXO32 CTSB ATP6V1F FOXO1 LATS1 PDPK1 PIK3CA REST RORA NCOA2 EP300 ADIPOR2 PHIP SERPINB9 SHC1 JAK2 PXN YWHAG PIAS2 GNB2 MYO5A HNRNPU UBE3A PRKAA1 KAT5 UBE2L3 CALCOCO1 GNG5 MED16
GO_DNA_REPAIR	0.0096736747065652	0.206573870876398	0.290188882929344	1.38892360060254	674	231	KIAA0101 POLR2H TREX1 KIN SHFM1 PTTG1 PCNA RBX1 RAD23B BRE NUDT1 FAM175A CIB1 PPIE HSPA1A BARD1 HMGB2 VCP LIG1 UBR5 SMC1A RPA2 CHD1L POLR2I OTUB1 HIST1H4C AQR SMC6 JMY DTX3L APTX EPC2 MLH1 ASF1A RNF111 POLR2C CDKN2D POLK MAD2L2 USP7 ERCC5 SMC3 USP47 WHSC1 PSME4 SETD2 POLR2D EP300 SMG1 KIF22 TRRAP CUL4A POLR2B RIF1 ISG15 ZSWIM7 NSMCE4A RPA3
GO_PROTEIN_POLYMERIZATION	0.437299930410578	0.837034448296899	0.306791443279504	1.01152503180695	25135	28	BLOC1S2 ZNF207 CHMP2A TTC17 GOLGA2 JAK2 NDE1 CORO7 TUBGCP3 TUBGCP2 WAS
GO_CELLULAR_RESPONSE_TO_CORTICOSTEROID_STIMULUS	0.494345083885723	0.856109124655037	0.334262819157678	0.971993762625747	27667	17	CBX3 FBXO32 FOXO1 REST EP300 HNRNPU UBE2L3
GO_SIGNAL_TRANSDUCTION_IN_RESPONSE_TO_DNA_DAMAGE	0.463862161557395	0.844105224240116	-0.247376116331756	-0.991489540420423	18656	51	GADD45A CDKN1B RBL2 NBN USP10 BTG2 BATF CNOT7 CNOT6L PLK3
GO_MUSCLE_CONTRACTION	0.473427341045343	0.84710025950941	0.271718220731192	0.987718618238218	28033	43	TPM4 ADRBK1 VIM CALM3 HSBP1 PIK3CA ALDOA TPM3 PXN FXYD1 SRSF1 SLMAP DLG1 CAMK2D TTN
GO_TRANSITION_METAL_ION_HOMEOSTASIS	0.203473276833391	0.65326949840474	-0.305955770138273	-1.17435382158526	8306	42	SLC39A7 TTC7A HMOX2 EIF2AK1 APP SLC25A37 SRI MYC SFXN1 TMC8 FBXL5 B2M SLC30A5
GO_ENZYME_LINKED_RECEPTOR_PROTEIN_SIGNALING_PATHWAY	0.883115947250847	0.983859284023474	0.174724270890852	0.832055816788053	61274	221	POLR2H SKI PTPRE ATP6V0A2 ATP6V0B USP9X ARPC1A AHI1 SUB1 SMAD7 MAPK13 AREG PML ATP6V0E1 POLR2I SHOC2 RNF41 HNRNPM VIM KRAS RNF111 POLR2C ELMO2 ATP6V1F CASP3 FOXO1 HNRNPA1 PDPK1 TIAM1 PIK3CA POLR2D NCKAP1L PSENEN PHIP POLR2B SHC1 AP2S1 PIK3CB JAK2 SS18 NCBP2 MAPKAPK2 PILRB PXN LNPEP
GO_REGULATION_OF_DEFENSE_RESPONSE_TO_VIRUS_BY_VIRUS	0.0215290491529744	0.267137875202391	-0.47551562621377	-1.59445174280917	928	24	ELMO1 AP2M1 AP1G1 PACS1 AP1S2 PAK2 HLA-A ATP6V1H B2M CD28 EIF2AK2
GO_REGULATION_OF_CALCIUM_ION_TRANSMEMBRANE_TRANSPORT	0.993399339933993	0.999972508968949	-0.149668724561172	-0.525764332181932	42139	29	PLCG1 AHNAK CORO1A STIM1 FKBP1A
GO_RESPONSE_TO_BACTERIUM	0.00497701788798782	0.154701351606009	-0.306899870688846	-1.48079940847659	169	140	PPM1D ERBB2IP GCH1 SOCS3 JUNB TNFAIP3 NFKBIA TICAM1 SOCS1 OGT IL6R SIRT2 TNF CNP NCL MAPK8 HLA-E APP HNRNPA0 CTR9 ERAP1 LITAF FOS CD27 RAB14 ZC3H12A HLA-DRB5 CASP1 LYST PLAC8 OPTN RPL39 HLA-A CCL5 TNFRSF25 PAF1 ADAM17 GSTP1 HIST1H2BC
GO_POSITIVE_REGULATION_OF_LEUKOCYTE_MIGRATION	0.349104196133899	0.788998846754051	-0.303930730572462	-1.06766419008058	14808	29	ZNF580 IL6R TNF GPSM3 RAC2 CREB3 CCL5 ADAM17 PTGER4 CD74 PYCARD
GO_CALCIUM_ION_IMPORT	0.956000180050414	0.999972508968949	-0.203080439361731	-0.595693170565203	42476	15	IBTK ITPR2 ERO1L CDK5 ORAI1 DDIT3
GO_CELL_MATURATION	0.204745968968664	0.655036704842089	-0.346154593001322	-1.19478197538515	8748	27	GATA3 CDC25B G6PD KIAA0196 APP KLF2 DLD RB1 NR4A2
GO_REGULATION_OF_SECRETION	0.518648018648019	0.866859623402583	-0.195990070863983	-0.978346877052419	16909	176	GATA3 ZNF384 PIM3 SOCS1 UCP2 STAM SLAMF1 TNF SGK1 IL4R NCL P2RX4 HLA-E LAMP1 RAC2 ARNTL AP1G1 CD2 GLUD1 ZC3H12A CD38 SNX6 B4GALT1 ARL2BP GBP1 HLA-DRB5 CASP1 POFUT2 SRI CCL5 WNK1 SERGEF EZR SERP1 PTPN22 TSG101 STXBP3 ZAP70 ADA ITPR2 PIK3C3 VPS4A PTGER4 CD74 NAPA TC2N PYCARD CDK5 PRKCA DNM1L CLASP2 ANXA4 ANXA1
GO_APOPTOTIC_SIGNALING_PATHWAY	0.612254805285435	0.904513240670945	0.20778075338135	0.933846746533942	40357	141	DIDO1 TP53BP2 CASP8 BAG3 UBE2K BLOC1S2 CIB1 DAXX CUL2 PML RNF41 SNW1 MKNK2 MLH1 GGCT CASP3 ZMAT3 PDPK1 DEDD2 FHIT EP300 PDCD10 HIPK1 CUL4A ATF4 TIMM50 MOAP1 JAK2 PDK1 CDKN1A MFF ZNF622 RRP8 BBC3 SART1 TNFRSF18 ARL6IP5 TOPORS DDX3X MCL1 LY96 FASTK DNAJC10 TNFRSF1B TNFRSF4 APPL1
GO_NEURAL_NUCLEUS_DEVELOPMENT	0.339767804539941	0.782574016261278	0.322625337762579	1.08127102725626	19607	30	SUDS3 HSPA5 YWHAE SEC24B NDUFS3 CALM3
GO_LYMPHOCYTE_MEDIATED_IMMUNITY	0.0124086139155518	0.224435538977707	-0.396342499634933	-1.57389980133863	498	49	GATA3 NBN SLAMF1 GNL1 IL4R RFTN1 RNF168 INPP5D BATF CD27 KDM5D BTN3A2 HLA-DRB5 CORO1A CD46 LYST
GO_FC_EPSILON_RECEPTOR_SIGNALING_PATHWAY	0.590894619547915	0.898752784808293	0.221886516433849	0.93385378805051	37119	93	PSMF1 PSMB3 PSMB2 PSMA3 PSMD8 PSMB6 CALM3 KRAS NFATC2 PSMA1 PSMC6 MALT1 PDPK1 FBXW11 PIK3CA PSMA7 PSME4 PSMD7 SHC1 PIK3CB PSMB10 LCP2 PPP3CA PSMC3 PSMB1
GO_HIPPOCAMPUS_DEVELOPMENT	0.54981608264841	0.882599363729022	0.298363463250906	0.937375159912532	31239	23	PAFAH1B1 YWHAE UBA6 OGDH CDK6 CASP3
GO_RIBONUCLEOSIDE_TRIPHOSPHATE_BIOSYNTHETIC_PROCESS	0.243857217120083	0.696315186234454	0.346898100355779	1.16262060483597	14072	30	ATP6V0A2 ATP5S STOML2 SLC25A13 ALDOA UCK1 ATP5G1 ATP5G3
GO_REGULATION_OF_CHROMOSOME_SEGREGATION	0.241530314345848	0.695102053102216	0.320673484859006	1.15383350428175	14229	41	PTTG1 CTCF ANAPC11 CTNNB1 ZNF207 WAPAL APC SMC6 CSNK2A1 GOLGA2 MAD2L2 LCMT1 HDAC8 CDC27 BUB3 CDC42 H2AFY
GO_SPHINGOLIPID_METABOLIC_PROCESS	0.982192694312035	0.999972508968949	-0.160536212213831	-0.628781335834256	39767	46	ST6GALNAC6 CERS2 ASAH1 SGMS1 SMPD1 GLTP COL4A3BP CTSA AGK ORMDL1 NSMAF
GO_PROTEIN_ACETYLATION	0.409152459417571	0.820508047462775	0.257155484841884	1.02530192748991	25078	68	HCFC1 NAA20 ING4 BRD1 NAA30 ESCO1 NAA16 USP22 EP400 FOXO1 NCOA2 EP300 KAT7 TRRAP ATF2 PHF20 KAT8 KAT5 KAT6A SUPT3H WDR5 TAF12 ASL MORF4L2 RUVBL2 POR BAG6 MDH2
GO_REGULATION_OF_NUCLEOCYTOPLASMIC_TRANSPORT	0.368900538622597	0.805540778974535	0.250401508532047	1.04669327627075	23080	89	IL18R1 CTDSPL2 SUPT6H BARD1 UBR5 MED1 KPNA1 NUDT4 PRDX1 TMEM173 TXN MDFIC FBXW11 SETD2 G3BP2 EP300 HDAC3 PARK7 JAK2 CDKN1A PPP1CC NCBP2 CHERP SUFU IPO5 AKAP8L PPP3CA FLNA
GO_PTERIDINE_CONTAINING_COMPOUND_METABOLIC_PROCESS	0.750531169476968	0.956321974010975	-0.266801321371422	-0.797316248952567	33204	16	GCH1 SHMT2
GO_FORMATION_OF_TRANSLATION_PREINITIATION_COMPLEX	0.903844843639997	0.988782426018812	-0.222069103001924	-0.674779236705134	39798	17	EIF3E EIF3F EIF2S3 EIF3H EIF3K
GO_REGULATION_OF_PROTEIN_SECRETION	0.36219164428694	0.7996491435823	-0.22381251278063	-1.03869586307725	13081	109	GATA3 ZNF384 PIM3 SOCS1 UCP2 SLAMF1 TNF IL4R NCL HLA-E ARNTL CD2 GLUD1 ZC3H12A CD38 ARL2BP GBP1 HLA-DRB5 CASP1 SRI CCL5 SERGEF EZR SERP1 PTPN22
GO_REGULATION_OF_PEPTIDYL_TYROSINE_PHOSPHORYLATION	0.00439409717812603	0.154701351606009	-0.404460747261051	-1.67122176870826	172	59	HAX1 SOCS3 ITGB2 SOCS1 IL6R CD3E APP SNX6 ARL2BP GNB2L1 IBTK PAK2 MTOR NCK2 CCL5 ADAM17 ITGB1 ARRB2 MLST8 PDCL3 SEMA4D PTGER4 CD74
GO_RESPONSE_TO_INSULIN	0.625393603455903	0.91236772479549	-0.215042443991206	-0.918739088377378	24031	70	SOCS3 OGT UCP2 PTPRA DENND4C AKT2 SMARCC1 APRT ATP6V0E2 SCAP PIK3R1 MTOR GFPT1 CCL5 GSTP1 ATP6V1H INPP5K
GO_REGULATION_OF_CATABOLIC_PROCESS	0.959620239565988	0.999972508968949	0.161087552840164	0.811565421410192	71460	382	ATP6V0A2 ATP6V0B PSMF1 TMF1 UBE2K PSMB3 PSMB2 RAD23B ANAPC11 EXOC1 TRIM13 WBP11 HERPUD1 TIMP1 BARD1 VCP PSMA3 ZNF207 SMAD7 NUB1 PSMD8 PML ATP6V0E1 FBXW7 APC GAPDH VPS26A SNX9 ARIH2 PDE3B PSMB6 CSNK2A1 MTDH CHMP4B ITCH WAC STX5 GOLGA2 PLEKHF1 PSMA1 PSMC6 SNRNP70 MAD2L2 CTSC CASP3 UBE2E1 FOXO1 IFT20 SLIRP ANXA2 FHIT PARL PSMA7 TBK1 NBAS PSME4 CD81 PNPT1 CSNK1A1 EP300 PSMD7 SCFD1 RAB7A PARK7 LCMT1 PIK3CB NRBF2 SUPT5H SNX5 RC3H1 KAT8 TRIM8 PSMB10 SUFU UBE3A VMP1 SNX3 PRKAA1 ADAM8 CISD2 CDC27 PSMC3 FLNA TBC1D14 TRIB2 PSMB1 BUB3 KEAP1 CDC42 HMGB1 PSMA5 TSPO GGA3 RAD23A OAZ1 AMBRA1 U2AF1 CAPNS1
GO_REGULATION_OF_CARBOHYDRATE_METABOLIC_PROCESS	0.943507061617298	0.997050226848924	-0.176631750627334	-0.713540902403777	37744	53	SIK1 OGT AKT2 C12orf5 PMAIP1 MTOR GFPT1 INPP5K ECD PGAM1 COX11 SIRT6 PTGER4 NFKB1
GO_B_CELL_ACTIVATION	0.381947921882824	0.811305170038577	-0.255379976054701	-1.03636574235067	15254	54	PRKCB IKZF3 BAK1 NBN KLF6 CMTM7 RNF168 JAK3 BATF PIK3R1 ADAM17 IGBP1 LEF1 EXOSC6 ERCC1 ITGB1 ZAP70 ADA LAX1 DCLRE1C
GO_REGULATION_OF_NEURON_DIFFERENTIATION	0.432607215793056	0.834187164361035	-0.212608600677058	-1.00741938158283	15251	124	PTEN GATA3 ILK EIF2AK4 HMG20B ARHGEF1 ENC1 RAB7L1 SGK1 TCF12 APP CUX1 MBP PQBP1 KIDINS220 CERS2 FAM134C SNAPIN NDEL1 MAP2K2 STK25 CPNE1 MTOR CCL5 GOLGA4 ARHGAP4 MACF1 PREX1 IFRD1 ITGB1 RTN4 RAB11A SEMA4D MOB2 CDK5 B2M CLASP2 CDK5RAP3 KATNA1
GO_NEGATIVE_REGULATION_OF_NF_KAPPAB_TRANSCRIPTION_FACTOR_ACTIVITY	0.00440980167810831	0.154701351606009	-0.48872050610616	-1.75731405546952	184	32	ERBB2IP TNFAIP3 NFKBIA PARP10 DAP RWDD3 ZC3H12A RBCK1 COMMD6 CYLD PRMT2 TRIM21 ARRB2 PYCARD TRIM37 CDK5RAP3 ANXA4
GO_PROTEIN_POLYUBIQUITINATION	0.0421555129893452	0.341691051829412	0.287529869703949	1.31411724086283	2816	159	PSMF1 UBE2E3 UBE2K PSMB3 PSMB2 RBX1 RLIM ANAPC11 TRIM38 BLMH BARD1 PSMA3 UBR5 PSMD8 RNF20 FBXW7 ARIH2 PSMB6 DTX3L RNF41 UBE2J2 ITCH RNF111 RNF145 PSMA1 PSMC6 UBE2E1 FBXW11 PSMA7 PSME4 PSMD7 BFAR MARCH6 LNPEP CBLB PSMB10 UBE3A TRIP12 RNF216 SHARPIN CDC27 UBE2L3 PSMC3 PRPF19 PSMB1 TOPORS UBE2B PSMA5 RNF6 RNF34 PSMD1
GO_RIBONUCLEOPROTEIN_COMPLEX_LOCALIZATION	0.712520606264304	0.941827215706157	0.210383942747044	0.874554540060341	44518	86	SHFM1 THOC7 NUP50 ENY2 MAGOH THOC2 EIF4E POLDIP3 GLE1 SRSF11 DDX39A PRPF31 POLR2D SMG1 SRSF10 NCBP2 SRSF2 RRS1 SRSF1 UPF3B SMG7 U2AF1
GO_REGULATION_OF_MRNA_3_END_PROCESSING	0.739067524115756	0.951951104431707	-0.256182917721537	-0.815923959626448	32178	20	BTG2 TOB1 CTR9 CNOT7 TNRC6B PAF1 CDK9 CDC73
GO_REGULATION_OF_PEPTIDE_TRANSPORT	0.419148271553519	0.8290740090592	-0.236624219802261	-1.01449518282332	16101	71	NFKBIA PIM3 UCP2 TNF LITAF ARNTL CD27 GLUD1 ZC3H12A CD38 ARL2BP HLA-DRB5 SRI RBCK1 CYLD CCL5
GO_POSITIVE_REGULATION_OF_ION_TRANSPORT	0.31990156110172	0.763721034608228	-0.269930672775494	-1.07711574232607	12868	50	HBP1 PLCG1 BAK1 ATP8A1 GLRX SGK1 P2RX4 JAK3 SRI CREB3 CCL5 WNK1 STIM1
GO_ATP_BIOSYNTHETIC_PROCESS	0.251559687538228	0.71052665808468	0.358564533699178	1.16112938549645	14394	26	ATP6V0A2 ATP5S STOML2 SLC25A13 ALDOA ATP5G1 ATP5G3
GO_CANONICAL_WNT_SIGNALING_PATHWAY	0.74600367478181	0.954893598232492	-0.254704399076414	-0.811214985280934	32480	20	PTEN TCF7
GO_ACUTE_INFLAMMATORY_RESPONSE	0.0327241627655744	0.307175002528805	-0.536414922507285	-1.57345880741219	1453	15	GATA3 IL6R SIGIRR EIF2AK1 B4GALT1
GO_NUCLEOBASE_METABOLIC_PROCESS	0.598119592124089	0.900287399923498	-0.296486171647749	-0.900902961707206	26336	17	CMPK1 CECR1 APRT MTOR GMPR2 ADA
GO_HUMORAL_IMMUNE_RESPONSE	0.52164829623226	0.866859623402583	-0.258536285486129	-0.95791800055493	21722	36	GATA3 GPI TNF HLA-E APP CD83 HLA-DRB5 CD46 RPL39 HLA-A HIST1H2BC
GO_PHAGOSOME_MATURATION	0.464427371806325	0.844105224240116	0.337372020844265	0.994133136311348	25993	18	ATP6V0A2 ATP6V0B ATP6V0E1 ATP6V1F RAB7A
GO_CHROMATIN_MODIFICATION	0.154418565542756	0.582589291418185	0.234003607807641	1.14330099418229	11018	278	CENPM NASP SUDS3 RERE HCFC1 VPRBP HIST1H1C MTA2 CTCF BRE CTNNB1 GATAD2B KDM5C ING4 FAM175A SUPT6H BRD1 ENY2 ANP32E DAXX RNF20 HELLS CHD1L WDR61 HIST1H4C CBX3 SUZ12 DTX3L BAZ1A EPC2 CENPK TBL1XR1 WAC CENPN JARID2 RYBP USP22 EP400 UBE2E1 SUPT4H1 MYSM1 WHSC1 REST PSME4 SETD2 PHF19 NCOA2 EP300 EED KAT7 TRRAP HDAC3 KDM5A PRDM2 ARID2 JAK2 SIN3A HDAC8 ATF2 DNAJC2 BRMS1 SUPT5H PHF20 HIST1H1E DNMT1 EZH2 RRP8 TOP1 FBL KAT8 SIRT7
GO_MYELOID_LEUKOCYTE_ACTIVATION	0.0506568853087841	0.370213089035327	-0.391585186557786	-1.43022158901527	2112	34	TICAM1 SNAP23 CAMK4 LAT SLAMF1 RELB NR4A3 BATF TGFBR2 CCL5 PREX1 ZAP70 PYCARD VAMP7 RHOH ADAM10
GO_ANTERIOR_POSTERIOR_PATTERN_SPECIFICATION	0.0933715464061654	0.467216164070774	0.421218523634427	1.36402002858903	5342	26	SKI RBPJ CTNNB1 CRKL GRSF1 EP300 HIPK1
GO_POSITIVE_REGULATION_OF_CELL_DIVISION	0.912632126147981	0.990447879677528	0.205930661250338	0.690171637410498	52667	30	NUSAP1 ANAPC11 YBX1 PHB2 GOLGA2 PHIP SH2B1 CDC42 H2AFY UBE2B
GO_PIGMENT_BIOSYNTHETIC_PROCESS	0.929563246077008	0.993999746727957	0.21276775679185	0.644840851927064	52484	20	AP3D1 MYO5A SLC25A38 TSPO PRPS1 SLC25A39 GMPS PAICS
GO_ERBB_SIGNALING_PATHWAY	0.231550440081246	0.681741479965585	-0.307164077710975	-1.15257831014287	9575	38	RASSF2 ERBB2IP PLCG1 CSK ARF4 PIK3R1 PAG1 NCK2 ADAM17 STUB1 CPNE3
GO_EMBRYONIC_ORGAN_MORPHOGENESIS	0.941721626988992	0.996779651465815	-0.180862560537929	-0.69801563786449	38409	43	GATA3 TCF7 NR4A3 IFT52 ARID1A TGFBR2
GO_REPRODUCTIVE_SYSTEM_DEVELOPMENT	0.725326238439123	0.943575600604189	0.205841625269735	0.87266424741699	45799	97	NASP CASP8 PLCD1 RBPJ TMF1 CTNNB1 STK4 HMGB2 MED1 EIF2S2 EIF2B2
GO_POSITIVE_REGULATION_OF_CATABOLIC_PROCESS	0.793030347030638	0.966618593716842	0.184311536231632	0.871962779526841	54615	209	PSMF1 PSMB3 PSMB2 ANAPC11 TRIM13 HERPUD1 BARD1 VCP PSMA3 SMAD7 NUB1 PSMD8 FBXW7 APC SNX9 ARIH2 PSMB6 CSNK2A1 MTDH ITCH WAC STX5 GOLGA2 PLEKHF1 PSMA1 PSMC6 CTSC UBE2E1 FOXO1 PSMA7 TBK1 PSME4 CD81 PNPT1 CSNK1A1 PSMD7 RAB7A PARK7 PIK3CB SUPT5H RC3H1 TRIM8 PSMB10 PRKAA1 ADAM8 CDC27 PSMC3 TRIB2 PSMB1 BUB3 KEAP1 HMGB1 PSMA5 GGA3 OAZ1 AMBRA1 PSMD1 TNFRSF1B PSMD9 EDEM1 PSMC4 BAG6 CHFR CNOT8 PTPN1 IRS2 ABHD5
GO_GLIOGENESIS	0.353104950974458	0.792129977369429	-0.280818267559394	-1.06025522152189	14584	39	PTEN NAB1 ILK SIRT2 EIF2B1 CNP EEF2 AKT2 CSK
GO_PEPTIDYL_THREONINE_MODIFICATION	0.640471831475516	0.919443868203013	-0.263370269609519	-0.883107015276585	27636	24	PRKCB MAPK8 TGFBR2 MTOR PKN1 WNK1 GALNT2
GO_ANTIGEN_PROCESSING_AND_PRESENTATION	0.317489616982003	0.763721034608228	0.241607941698438	1.06951084537722	20639	127	AP3D1 PSMF1 PSMB3 PSMB2 CLTA DNM2 CALR RAB10 PSMA3 SEC24B PSMD8 AP3B1 CLTC PSMB6 HLA-DRA PDIA3 PSMA1 PSMC6 HLA-DRB1 PSMA7 PSME4 KIF22 PSMD7 AP2S1 SEC23A RAB7A HLA-B LNPEP PSMB10 KIF2A PSMC3 PSMB1 RAB5B
GO_CELLULAR_AMINO_ACID_CATABOLIC_PROCESS	0.446501819193066	0.8380347319196	-0.298938143940773	-1.00236967687835	19266	24	GCDH DTD1 PPM1K GLUD1 BCKDHA GOT2 DLD
GO_MAINTENANCE_OF_LOCATION	0.394257933118718	0.815813042307364	0.26498839153681	1.03475208659591	24003	61	PLIN2 HSP90B1 HSPA5 CALR PML GPAA1 POLR2M PDIA3 GET4 LATS1 G3BP2 GOLPH3 SLC30A7 YWHAB SUFU S100A9 FLNA TOPORS KEAP1 TSPO SYNE1
GO_KERATINOCYTE_DIFFERENTIATION	0.166068866571019	0.599816357661097	0.446940213104616	1.27781532181035	9259	16	RBPJ STK4 PPHLN1 MED1 CASP3 LATS1 SHARPIN KRT10 CDC42
GO_CELL_REDOX_HOMEOSTASIS	0.780976881271615	0.964929722272614	0.226896520433372	0.807303108317272	45840	39	PDIA6 TXN2 TXNDC9 PDIA3 GSR TXN P4HB GLRX5 PTGES2 DNAJC10 ERO1LB TXNL1
GO_POSITIVE_REGULATION_OF_PROTEIN_SECRETION	0.277414409810935	0.734232859266099	-0.263178185321411	-1.09885269548722	10857	62	GATA3 ZNF384 SLAMF1 TNF IL4R NCL HLA-E CD2 GLUD1 CD38 HLA-DRB5 CASP1 SRI EZR SERP1 PTPN22
GO_POSITIVE_REGULATION_OF_CYTOSKELETON_ORGANIZATION	0.0849114546012898	0.451763596215434	-0.309160856306718	-1.29509147035475	3317	63	HAX1 ABI2 CDKN1B EVL SIRT2 ARPC5 VASP BAG4 WDR1 WHAMM MTOR NCK2 ACTR2 MLST8 NCK1 BECN1 PYCARD CDK5 SMAD3 ARPC2 ITGB1BP1 ARPC1B IQGAP2 BRK1 GRB2 ARPC4 CDC42EP3 PTK2B
GO_RESPONSE_TO_KETONE	0.376502937132858	0.807854445426239	-0.257451865551626	-1.04003066163811	15061	53	SOCS3 JUNB DUSP1 FOSB SOCS1 KLF6 AKR1B1 MBP FOS CD38 ELK1 KLF2 CCL5 TGFBR3 TXNIP
GO_REGULATION_OF_ENDOTHELIAL_CELL_MIGRATION	0.444899111048399	0.837807533375864	-0.288215828574204	-1.00367667787733	18917	28	GATA3 PLCG1 ZNF580 HDAC7 ZC3H12A
GO_CILIUM_MORPHOGENESIS	0.826393456446581	0.972644578309813	0.214631020132769	0.784168468448163	49000	44	FOPNL DNM2 AHI1 NEK1 PIBF1 IFT20 SEPT2 IFT57 CDC14A FLNA UBE2B
GO_ENERGY_COUPLED_PROTON_TRANSPORT_DOWN_ELECTROCHEMICAL_GRADIENT	0.275933535822762	0.733503118337542	0.390048539075962	1.14935487683562	15443	18	ATP6V0A2 ATP5S STOML2 ATP5G1 ATP5G3 ATP5L ATP5J ATP5I ATP5F1
GO_CELLULAR_MODIFIED_AMINO_ACID_BIOSYNTHETIC_PROCESS	0.113481855764814	0.513623607602205	-0.420000500497856	-1.3376710455917	4940	20	GCH1 MAT2B GGT1 PTDSS1 GSS FPGS MTHFD2 CNDP2 SEPHS2 ATIC HAGH MTHFD2L
GO_PROTEIN_LOCALIZATION_TO_VACUOLE	0.911834040546912	0.990447879677528	-0.19957846514996	-0.701089948852851	38679	29	TNFAIP3 GNPTG HSPA8 NAGPA VPS13C VPS28 BECN1
GO_CELLULAR_RESPONSE_TO_HYDROGEN_PEROXIDE	0.211042385884158	0.666893939393939	-0.321770320853304	-1.17523051276317	8802	34	TNFAIP3 STAT6 ZNF580 KLF6 AKR1B1 STK25 NFE2L2 KDM6B
GO_REGULATION_OF_ORGAN_GROWTH	0.682256613280547	0.931141931373202	0.299208454042869	0.839599277813369	37912	15	RBPJ STK4 LATS1 CTDP1
GO_POSITIVE_REGULATION_OF_CELL_GROWTH	0.692834071459492	0.934412014637814	0.228616313021371	0.870746235792982	41612	54	CDKN2AIP ACSL4 PAFAH1B1 CIB1 ADNP2 CSNK2A1 MTPN IST1 USP47 EP300
GO_REGULATION_OF_TRANSMEMBRANE_RECEPTOR_PROTEIN_SERINE_THREONINE_KINASE_SIGNALING_PATHWAY	0.308214596294067	0.753766841030611	0.2943624985879	1.09567186308353	18429	48	SKI CTDSPL2 RBPJ HSPA5 DNM2 SMAD7 SNW1 RNF111 CD109 PDPK1
GO_POSITIVE_REGULATION_OF_CELL_ADHESION	0.0880450904776031	0.457238149153608	-0.249351470681484	-1.21419605729914	2967	149	CD3G GATA3 SKAP1 ILK FLOT1 UTRN FLOT2 SLAMF1 TNF IL4R CD3E NINJ1 HLA-E CD83 JAK3 NR4A3 ITPKB CSK BAG4 HLA-DRB5 HLA-DPA1 CORO1A CD46 TGFBR2 PIK3R1 PAK2 CITED2 MTOR HLA-A NCK2 CCL5 ICOS LEF1 CCDC88B PREX1 MYADM ITGB1 ZAP70 MLST8 ADA NCK1 KIFAP3 PTGER4 CD74 PYCARD SMAD3 PRKCA ARPC2 ITGB1BP1 CD28 PIEZO1 HSPH1 ANXA1
GO_CEREBRAL_CORTEX_DEVELOPMENT	0.215379511445583	0.667686692873923	0.365913428358724	1.19539100146038	12334	27	PAFAH1B1 CTNNB1 YWHAE ARHGAP11B TACC1 GART
GO_REGULATION_OF_INTERLEUKIN_8_PRODUCTION	0.0779122887163088	0.437741373877177	-0.450259823020371	-1.41521955384564	3410	19	ZNF580 IL6R TNF CD2 PTPN22 PTGER4 PYCARD ANXA4 ANXA1 DDIT3
GO_RNA_PHOSPHODIESTER_BOND_HYDROLYSIS	0.337486714087156	0.779298373450146	0.268984568010474	1.06940552947049	20638	67	POP4 EXOSC7 RNASEH1 CSTF2 BOP1 DCPS PAN3 NOP14 RNASEH2C PDE12 DICER1 DIS3L2 PNPT1 MOV10 NOL9 ABT1 NCBP2
