pathway	pval	padj	ES	NES	nMoreExtreme	size	leadingEdge
GO_POSITIVE_REGULATION_OF_PROTEOLYSIS	0.431572153606947	0.834187164361035	0.215736365253172	1.00999724431987	29421	191	CASP8 PSMF1 PSMB3 PSMB2 ANAPC11 HERPUD1 FAM162A VCP PSMA3 SMAD7 NUB1 PSMD8 HSPD1 PML FBXW7 SNX9 ARIH2 PSMB6 GOLGA2 PSMA1 PSMC6 IST1 HSPE1 CTSC CASP3 UBE2E1 FBXW11 PSMA7 NLRP1 REST PSME4 CSNK1A1 EP300 PSMD7 MTCH1 JAK2 AURKAIP1 IFT57 BBC3 PSMB10 ADAM8 S100A9 CDC27 PSMC3 ARL6IP5 TRIB2 PSMB1 BUB3 KEAP1 DDX3X HMGB1 PSMA5 PSMD1 TNFRSF1B SART3 PSMD9 PRELID1 PSMC4 CTSH TNFRSF10A IFI16 CHFR
GO_REGULATION_OF_CILIUM_ASSEMBLY	0.725287092328893	0.943575600604189	-0.258994095381393	-0.824877356003708	31578	20	TBC1D5 TBC1D22A TBC1D10C CYLD SEPT9
GO_REGULATION_OF_PROTEIN_KINASE_B_SIGNALING	0.1168391527227	0.518909150167087	-0.341834701580958	-1.28267363043376	4831	38	HAX1 PTEN GATA3 MTM1 ILK TNF BAG4 GNB2L1 CPNE1 MTOR LMBRD1 INPP5K
GO_REGULATION_OF_DNA_TEMPLATED_TRANSCRIPTION_IN_RESPONSE_TO_STRESS	0.502715730871071	0.861243233729788	0.269828481925509	0.970885207400367	29617	41	RBPJ RBX1 HSPA5 TCEB1 CUL2 EP300 ATF4 SIN3A RPS6KA3
GO_REGULATION_OF_MAP_KINASE_ACTIVITY	0.853504069331408	0.977444213036948	-0.179227210500945	-0.835609874312963	30726	112	GADD45A DUSP1 PLCG1 ILK PTPLAD1 TNF DUSP5 KIDINS220 MBIP CSK PDCD4 SMPD1 MAP2K2 PKN1 TAB2 GSTP1 INPP5K GPS1 PTPN22 TRAF7 MAP4K2 TSG101
GO_LYTIC_VACUOLE_ORGANIZATION	0.27152781015432	0.730519092953881	-0.335015667954855	-1.13421097447839	11647	25	TPP1 RAB14 CORO1A LYST NAGPA BECN1 HEXB CLN5 TMEM175
GO_REGULATION_OF_CHEMOTAXIS	0.0660011490950876	0.407736956613492	-0.376952452427758	-1.38775166887978	2756	35	IL16 ZNF580 IL6R GPSM3 RAC2 AKT2 CREB3 CCL5 ADAM17 CORO1B SEMA4D CD74 SMAD3
GO_NEGATIVE_REGULATION_OF_RESPONSE_TO_STIMULUS	0.951659826484493	0.999122405207907	0.161784016432483	0.830924583461516	73273	479	SKI PTPRE CASP8 CTDSPL2 PSMF1 NR1H2 PSMB3 PSMB2 RBX1 PAFAH1B1 BRAP HSPA5 TRIM38 CLTA DNM2 CTNNB1 RASA2 TFIP11 CALR CIB1 HERPUD1 IL2RA TRIAP1 HIPK3 HSPA1A STK4 HMGB2 ENY2 DUSP4 PSMA3 UBR5 SMAD7 LGALS3 PSMD8 DNAJC3 ADRBK1 FBXW7 APC PIBF1 OTUB1 GSTO1 PDE3B PSMB6 PHB2 NDUFS3 PLCL2 CALM3 CHMP4B NDUFAF2 CDK6 ITCH HMGXB4 CDKN2D PSMA1 CD109 PSMC6 EPN1 MAD2L2 TXN FOXO1 HELB LATS1 PDPK1 FBXW11 USP47 DUSP16 ANXA2 PARL PSMA7 PSME4 G3BP2 HTT CSNK1A1 RORA PSMD7 KIAA0922 HDAC3 PHIP SERPINB9 BFAR ATF4 AP2S1 SCFD1 RAB7A PPP2R1A PARK7 NENF SEC14L1
GO_MEIOTIC_CELL_CYCLE_PROCESS	0.227472805464204	0.678581724490818	0.318656045002409	1.1642306998155	13487	44	MKI67 PTTG1 KLHDC3 NCAPD2 SMC1A CCNB1IP1 MLH1 GOLGA2 SMC3 PPP2R1A SMC4 UBE2B NCAPD3 SMC2 TUBGCP3 TUBGCP2 TERF1 BAG6 RAD51C
GO_DEVELOPMENTAL_CELL_GROWTH	0.403788068039879	0.818559910536982	-0.341123286760239	-1.03653731181337	17779	17	EIF2AK4 APP NDEL1 TGFBR2 CPNE1 PRMT2 ITGB1 SIRT6 CDK5
GO_SPINDLE_ASSEMBLY	0.490838908903757	0.856109124655037	0.283151310849605	0.977240859838063	28610	34	HAUS6 ZNF207 PIBF1 MLH1 GOLGA2 KPNB1 HDAC3 KIF2A CDC14A FLNA TUBGCP3 TUBGCP2 TUBB HAUS4
GO_SPHINGOLIPID_BIOSYNTHETIC_PROCESS	0.213458090027128	0.667686692873923	-0.370603354307512	-1.19684748495444	9284	21	ST6GALNAC6 CERS2 SGMS1 SMPD1 COL4A3BP AGK
GO_REGULATION_OF_PHOSPHOPROTEIN_PHOSPHATASE_ACTIVITY	0.414204837879568	0.825819278664987	0.297605100278788	1.02712526110504	24143	34	PPP2R5A HSP90B1 PPP6R1 CALM3 HTT NCKAP1L PPP2R1A JAK2 PPP2R5E
GO_REGULATION_OF_MULTI_ORGANISM_PROCESS	0.313641556638563	0.763387876745067	0.223880489257824	1.06216345569024	21687	214	POLR2H PPIH PPID TRAF3IP2 TRIM38 SRPK2 TRIM13 CIB1 IL2RA PPIE TIMP1 CHMP2A PML GMIP POLR2I SNW1 SNRPD1 CHMP4B TMEM173 ITCH POLR2C IST1 FAM111A LSM4 MDFIC SUPT4H1 C19orf66 CTDP1 TMEM39A REST TBK1 POLR2D PPP2R3C ILF3 EP300 TRIM14 PPIB POLR2B ISG15 AP2S1 CCNK MDH1 RAB7A PPP2R1A SEC14L1 SIN3A SUPT5H CFL1 ACIN1 TRIM8 SNRPB COX8A P4HB SNX3 RNF216 PPIA VAPB LGALS1 OASL SUPT3H SRPK1 DDX3X LY96 POLR2L RAD23A
GO_POSITIVE_REGULATION_OF_CELL_CYCLE_ARREST	0.444595085340758	0.837807533375864	-0.265565765966512	-1.00266799760062	18363	39	GADD45A CDKN1B RBL2 BTG2 CNOT7 CNOT6L PLK3 NPM1 TFDP2 UBB RQCD1 RBM38 CNOT4
GO_CONNECTIVE_TISSUE_DEVELOPMENT	0.640097082292958	0.919412172748067	0.26986235960944	0.881604804056918	36658	27	TIMP1 OXCT1 TBL1XR1 PIK3CA ATF2
GO_CYTOPLASMIC_PATTERN_RECOGNITION_RECEPTOR_SIGNALING_PATHWAY	0.477249885792599	0.849500745982221	-0.311994304423341	-0.98063477515382	20893	19	TNFAIP3 NFKBIA UBE2V1 CYLD TAB2
GO_NUCLEAR_ENVELOPE_ORGANIZATION	0.908070398501021	0.988863629445347	0.194208705956135	0.728219803457356	54278	50	PAFAH1B1 NUP50 NSFL1C CHMP2A BANF1 CHMP4B TOR1AIP1
GO_REGULATION_OF_GLIAL_CELL_DIFFERENTIATION	0.793835983562623	0.966618593716842	0.260097700093111	0.766429123831503	44430	18	CTNNB1 RHEB DICER1
GO_CELLULAR_RESPONSE_TO_ENDOGENOUS_STIMULUS	0.778326417704011	0.964929722272614	0.180552088214165	0.891593328744	56272	311	POLR2H SKI SAFB DDX54 ATP6V0A2 ATP6V0B HSP90B1 GNB1 NR1H2 HNRNPD USP9X USF1 DNM2 CTNNB1 CALR H2AFZ CIB1 RAB10 UBR5 PLOD3 SMAD7 PELP1 DAXX MED1 PML ATP6V0E1 POLR2I APC MED4 SHOC2 CBX3 PDE3B HNRNPM FBXO32 LAMTOR2 CTSB POLR2C RAP1B ATP6V1F FOXO1 HNRNPA1 LATS1 PDPK1 PIK3CA REST CD81 RORA NCOA2 POLR2D EP300 ADIPOR2 PHIP POLR2B SERPINB9 SHC1
GO_POSITIVE_REGULATION_OF_HISTONE_METHYLATION	0.214526542324247	0.667686692873923	0.426129482246134	1.21831682521207	11961	16	CTNNB1 RNF20 WDR61 SNW1 JARID2 PHF19 EED DNMT1
GO_RNA_POLYADENYLATION	0.3890298374129	0.813071622872606	0.356910869179802	1.05170820293101	21773	18	PAPD4 CSTF2 PAPOLA GRSF1 PNPT1
GO_ASPARTATE_FAMILY_AMINO_ACID_METABOLIC_PROCESS	0.669203181755483	0.926507007348138	-0.266725652920103	-0.861378946412263	29108	21	GCDH EIF2B1 ADSS GOT2 DLD ASNSD1 ADI1 DLST SMS MTHFD2L
GO_MRNA_METABOLIC_PROCESS	0.00689139166732299	0.176547789800454	0.262020069804692	1.33672729421048	524	440	POLR2H KIN POP4 PPIH EXOSC7 HNRNPD PAPD4 THOC7 SYNCRIP HNRNPL DHX9 TFIP11 PLRG1 DDX23 SRPK2 SPEN KIAA1429 CSTF2 WBP11 RPL26L1 PPIE PAPOLA SUPT6H HTATSF1 YBX1 LSM3 RBM5 SNRPC PRPF38A NSRP1 LGALS3 RPS2 MAGOH USP39 KHSRP LSM7 ZMAT5 THOC2 POLR2I TRA2A DNAJB11 EIF4E AQR DCPS CIR1 HNRNPM SNW1 SNRPD1 DHX16 MLH1 PAN3 CEBPG RBM22 POLR2C GRSF1 SNRNP70 USP4 RBM27 PDE12 SF3A2 POLDIP3 PRPF4B LSM4 LSM10 ZNF326 PAPD5 HELB HNRNPA1 SRSF11 SNRPG DDX39A RPS26 DIS3L2 PPP4R2 NBAS PRPF31 CELF1 SRRM2 PNPT1 CELF2 DHX15 POLR2D SMG1 MOV10 ZFP36L1 POLR2B UPF3A SRSF10 PRPF40A SCAF11 YTHDC1 EFTUD2 PPP2R1A PPWD1 SYF2 NCBP2 ZRSR2 SUPT5H ACIN1 RC3H1 SNRPB HNRNPU SRSF2 SART1 AKAP8L SNRPE ERCC3 WDR77 CD2BP2 SRSF1 SF3A3 PRPF19 CSTF2T NONO RBM25 UPF3B SON SREK1IP1 SRPK1 SCNM1 PPP2R2A SF3B1 XAB2 SMG7 SNRPF POLR2L U2AF1 PPP2CA SF3B4 LUC7L3
GO_PROTEIN_TRANSMEMBRANE_TRANSPORT	0.822094013052114	0.972525951081592	-0.219666292610566	-0.777893814388069	34767	30	AFG3L2 LONP2 AKT2 SRP9 TIMM17B TOMM7 HSPA8
GO_INTRINSIC_APOPTOTIC_SIGNALING_PATHWAY_BY_P53_CLASS_MEDIATOR	0.0597159400904627	0.389663835413987	0.461968301764178	1.45137613708605	3392	23	TP53BP2 PML SNW1 ZMAT3 FHIT EP300 HIPK1 CDKN1A RRP8 TOPORS
GO_RESPONSE_TO_RETINOIC_ACID	0.373101495401465	0.807682406137631	-0.304536703363434	-1.05113429484512	15942	27	TMEM161A DUSP1 OGT DNAAF2
GO_ODONTOGENESIS_OF_DENTIN_CONTAINING_TOOTH	0.843185078909613	0.975370076271968	0.252283705385584	0.721286594342161	47015	16	CTNNB1 FOXO1 ATF2 ITGA6 ANKRD11
GO_REGULATION_OF_TRANSLATIONAL_INITIATION	0.440578090472683	0.837807533375864	-0.242917975799346	-1.00373104662339	17345	59	EIF3E EIF2AK4 RPS6KB2 TNF EIF2B1 EIF2AK1 EIF4A2 EIF3F RPL13A NCK2 CCL5 PPP1R15A NPM1 RBM4 NCK1 EIF3H EIF2AK2 EIF3K DDX1 EIF1B EIF5
GO_MYELOID_CELL_ACTIVATION_INVOLVED_IN_IMMUNE_RESPONSE	0.0465559920968365	0.35697491587192	-0.496696242097912	-1.50926133616271	2049	17	TICAM1 SNAP23 LAT SLAMF1 NR4A3 STXBP3 ZAP70 PYCARD VAMP7
GO_POSITIVE_REGULATION_OF_SYNAPTIC_TRANSMISSION	0.445557320807718	0.8380347319196	-0.30671871146738	-1.00409468510079	19350	22	PTEN FLOT1
GO_CELL_RECOGNITION	0.672677982083923	0.92839968237029	-0.247606793519184	-0.869806439655436	28534	29	ST6GALNAC6 APP DOCK8 B4GALT1 CORO1A NCK2 TIGIT RTN4 TCP1 UBAP2L CCT7
GO_PROTEIN_K63_LINKED_UBIQUITINATION	0.740602435225825	0.952377376625717	0.264317380651633	0.811120535909656	41846	21	UBE2E3 ARIH2 ITCH BFAR PRPF19 UBE2B
GO_NEGATIVE_REGULATION_OF_PHOSPHORYLATION	0.0156673880574268	0.241685684412495	-0.274381934662215	-1.36150462502456	513	169	GADD45A RASSF2 PTEN SOCS3 CDKN1B TNFAIP3 DUSP1 SOCS1 OGT ILK BAK1 SIRT2 DUSP5 TAF7 MBIP CSK TBC1D10C ZC3H12A SNX6 PDCD4 SMPD1 GBP1 PRKAR1B C12orf5 GNB2L1 IBTK CHORDC1 MYC PAK2 MTOR NCK2 PKN1 WNK1 IGBP1 GSTP1 PRPSAP1 INPP5K RB1 PPP1R15A CUL3 EZR GPS1 GMFG PTPN22 NPM1 MYADM NCK1 COX11 PRKAR2A LAX1 SEMA4D SIRT6 ATF3 PYCARD SMAD3 DUSP2 ITGB1BP1 HSPH1 CDK5RAP3
GO_NEGATIVE_REGULATION_OF_NUCLEAR_DIVISION	0.0483354327874753	0.365247748628835	0.537414885257744	1.50802272947779	2685	15	PTTG1 ZNF207 CSNK2A1 MAD2L2 AURKAIP1 BUB3 TERF1 TPR
GO_REGULATION_OF_GENERATION_OF_PRECURSOR_METABOLITES_AND_ENERGY	0.984726611127071	0.999972508968949	-0.161444007798216	-0.594356635192743	41133	35	OGT AKT2 C12orf5 MTOR GFPT1 INPP5K ECD PGAM1 SIRT6 SLC25A33 CISD1
GO_LIPID_CATABOLIC_PROCESS	0.465673283664183	0.84482272130308	0.261835359829733	0.993830336035825	27938	53	GALC PLCD1 FABP5 PAFAH1B1 DECR1 ECH1 PLCB2 TBL1XR1
GO_POSITIVE_REGULATION_OF_LIPID_METABOLIC_PROCESS	0.931087909992372	0.994349575222347	-0.192018965641574	-0.690451133158219	39060	32	TNF LDLRAP1 NR4A3 AKT2 GNB2L1 MTOR MID1IP1 PNPLA2 NSMAF
GO_RESPIRATORY_SYSTEM_DEVELOPMENT	0.23128739955548	0.681741479965585	0.331793197321456	1.16646125147689	13527	37	SKI RBPJ CTNNB1 PLOD3 SEC24B EIF4E KRAS
GO_ION_HOMEOSTASIS	0.89342623625566	0.985872022207744	-0.17113058240319	-0.827290113722868	30388	142	PRKCB SLC39A7 TTC7A HMOX2 BAK1 CD52 SGK1 EIF2AK1 GPCPD1 TRPM7 APP JAK3 FIS1 EPHX2 GRINA SLC25A37 CD38 PDE6B ATP6V0E2 SRI IBTK MYC ATP2A3 CCL5 ANXA6 GTF2I ATP6V1H
GO_NUCLEOSIDE_MONOPHOSPHATE_METABOLIC_PROCESS	0.604301336943131	0.902526360516232	0.208784979385886	0.935614286009976	39730	138	ATP6V0A2 ATP5S PGK1 DUT IMPDH2 NDUFA11 COX7B HSPA1A UQCRH NDUFB3 VCP NDUFC1 OGDH GAPDH NDUFV2 GART NDUFS3 STOML2 NDUFA2 UPP1 DGUOK NDUFA12 COX6A1 SLC25A13 ALDOA NDUFA4 COX5B UCK1
GO_REGULATION_OF_GLUCOSE_TRANSPORT	0.0346646752746194	0.317090555933097	-0.396790999998058	-1.48037986889494	1438	37	PRKCB TNF NR4A3 POM121 AKT2 NUPL2 NUP107 PIK3R1 RAE1 NFE2L2 LMBRD1 INPP5K
GO_NEGATIVE_REGULATION_OF_TRANSFORMING_GROWTH_FACTOR_BETA_RECEPTOR_SIGNALING_PATHWAY	0.375931972551553	0.807854445426239	0.3232654428917	1.05606564713718	21529	27	SKI HSPA5 DNM2 SMAD7 CD109 PDPK1
GO_MYD88_INDEPENDENT_TOLL_LIKE_RECEPTOR_SIGNALING_PATHWAY	0.85337256885374	0.977444213036948	-0.227452320058481	-0.73454741854053	37119	21	TICAM1
GO_POSITIVE_REGULATION_OF_ERK1_AND_ERK2_CASCADE	0.731871758604432	0.946893138799878	-0.23770145565044	-0.835010436917617	31045	29	PTEN SLAMF1 TNF CCL5 PTPN22 ARRB2 CD74 PYCARD PRKCA
GO_MEMBRANE_ORGANIZATION	0.133483681545466	0.547603391269973	-0.198821258492099	-1.10346346577878	3136	452	PRKCB RPS4Y1 PTEN RER1 CHMP1B TTC7A ITGB2 SNAP23 SKAP1 AFG3L2 FLOT1 TMEM170A BAK1 ZFYVE20 LRMP FLOT2 RAB7L1 UVRAG ATP8A1 TNF FYB BET1L ELMO1 CNP MAPK8 RFTN1 TRAPPC1 VAMP5 BIN2 MBP CHCHD3 RPS7 RPL37 CD2 TRAPPC6A FIS1 DENND4C POM121 BCL2A1 AKT2 STX11 RAB14 NUPL2 BAG4 OXA1L PACS1 SNAPIN RPL6 NDEL1 RPS20 RPL14 UBXN2A SRP9 NUP107 SRP68 SEC31A WHAMM TOMM7 VTA1 FAM73A OPTN RAPGEF6 PMAIP1 RPL13 SRP14 RHOT2 RPL13A RPL39 RPS24 STX16 RAE1 RPS29 VCPIP1 GOLGA7 RPS15A RPLP1 RPS10 INPP5K GOLGA4 CUL3 MTSS1 EZR RPL18A SERP1 MACF1 TSG101 LMNA STX17 MYADM ITGB1 RAB11B MTCH2 RPL29 MCFD2 NDUFA13 NUP214 FAM126A VPS28 NCF1 RAB11A SEC13 ATP11B SEC23IP ALKBH7 RPL17 BECN1 VPS4A RPSA CHMP1A RAB3GAP2 BNIP3L RPS27 NAPA TC2N RPL27 SRP19 RPL23 CDK5 RPL38 PRKCA DNM1L RPS28 SEC24D CLASP2 ITGB1BP1 NUP210 RPL35A RPL9 TMEM175 RPL7 CHMP4A RPS8 CHMP7 ZFAND2B VAMP7 VPS8 PPP6C RPL4 SEC62 ATG4B YWHAQ BNIP3 VAMP4 SEC61A1 BBIP1 CHMP2B NUP85 SSR1 RPS6 ATP9B RPL24 RPS11 TOMM20 GOSR1 TMED2 SYTL1
GO_MITOCHONDRIAL_ATP_SYNTHESIS_COUPLED_PROTON_TRANSPORT	0.625071736011478	0.91236772479549	0.308031533912153	0.880671289118398	34853	16	ATP5S STOML2 ATP5G1 ATP5G3 ATP5L ATP5J ATP5I ATP5F1
GO_PURINE_NUCLEOSIDE_MONOPHOSPHATE_BIOSYNTHETIC_PROCESS	0.773847511711589	0.963129208577116	0.226197345881758	0.813893535266044	45591	41	ATP6V0A2 ATP5S IMPDH2 GART STOML2 SLC25A13 ALDOA ATP5G1
GO_POSITIVE_REGULATION_OF_PEPTIDE_SECRETION	0.973751467845548	0.999972508968949	-0.178237468513927	-0.583489980003023	42290	22	GLUD1 CD38 HLA-DRB5 SRI SERP1
GO_ORGANONITROGEN_COMPOUND_BIOSYNTHETIC_PROCESS	0.956588066076799	0.999972508968949	-0.15501285576523	-0.865553752448623	21946	482	RPS4Y1 DDX3Y EIF1AY GCH1 GATA3 GSTK1 PPA2 MRPS5 ODC1 EIF3E UCP2 SLC25A11 EIF2AK4 LRRC47 MRPS9 RPS6KB2 SHMT2 CMPK1 OAS1 MRPL40 MRPS21 LARS ALDH9A1 MAT2B EIF2B1 SLC25A16 ST6GALNAC6 CECR1 PPCS EEF2 EIF4A2 MRPS34 MRPL9 ABTB1 RPS7 RPL37 GGT1 CERS2 ADSS FTSJ1 EIF3F RPL6 RPS20 RPL14 GLUD1 MRP63 SGMS1 SLC25A37 MRPS22 TPK1 B4GALT1 SMPD1 PTDSS1 ADSL APRT GFM1 WARS MRPL49 SLC25A1 EEFSEC GOT2 GSS RPL13 SLC35B2 RPL13A RPL39 RPS24 MTOR IMPDH1 RPS29 RPS15A MRPS15 RPLP1 GSTP1 COX10 AIMP1 DALRD3 RPS10 COL4A3BP ATP5H RPL18A ICT1 MRPL52 TARSL2 MRPS28 FPGS MTHFD2 RBM4 MRPL13 MRPL32 EEF1D CHST12
GO_REGULATION_OF_CHROMOSOME_ORGANIZATION	0.319756278254033	0.763721034608228	0.235966138296026	1.06658789188177	21148	147	SKI GNL3 PTTG1 CTCF ANAPC11 CTNNB1 CCT3 SUPT6H CCT2 UBR5 ZNF207 WAPAL DAXX RNF20 PML APC WDR61 OTUB1 CSNK2A1 SNW1 ASF1A GOLGA2 JARID2 MAD2L2 HNRNPA1 USP7 PHF19 EP300 EED CCT6A KDM5A LCMT1 SIN3A HDAC8 DNMT1 CCT5 HNRNPU TRIP12 AKAP8L CDC27 AKAP8 BUB3 H2AFY UBE2B TEN1 CTC1 HMGA1 CAMK2D RUVBL2 SART3
GO_REGULATION_OF_CELL_MATRIX_ADHESION	0.236819540682719	0.691364549339136	-0.348258281167741	-1.16774505977223	10218	24	PTEN ILK UTRN NINJ1 PIK3R1 MACF1 SMAD3 CLASP2 ITGB1BP1 MINK1 PTK2B LIMS1 GSK3B
GO_LIPOSACCHARIDE_METABOLIC_PROCESS	0.482311523269792	0.852045319678766	0.283237039884897	0.983401518267118	28084	35	GALC DPM2 ALG5 DPM1 GPAA1
GO_REGULATION_OF_CELL_ADHESION	0.156297220944747	0.587166714064975	-0.217922871645364	-1.12395635848928	4757	226	IRF1 CD3G PTEN GATA3 CAMK4 SKAP1 ILK FLOT1 UTRN FLOT2 LAT SLAMF1 TNF IL4R CD3E NINJ1 HLA-E ATXN3 TBCD CD83 RAC2 JAK3 CD2 NR4A3 ITPKB CSK BAG4 C10orf54 ARHGDIB GBP1 HLA-DRB5 HLA-DPA1 CORO1A CD46 TGFBR2 PIK3R1 CYLD PAK2 CITED2 PAG1 MTOR HLA-A NCK2 CCL5 ICOS TIGIT LEF1 CCDC88B PTPN22 MACF1 PREX1 PPP1R12A MYADM ITGB1 ACP5 ZAP70 MLST8 ADA NCK1 KIFAP3 LAX1 SEMA4D PTGER4 CD74 PYCARD SIPA1 SMAD3 PRKCA ARPC2 CLASP2 ITGB1BP1 CD28 PIEZO1
GO_NEGATIVE_REGULATION_OF_TELOMERE_MAINTENANCE	0.601321735970749	0.902501880066634	-0.295783966441027	-0.89876924077531	26477	17	NBN TNKS2 RAD50 ERCC1 PARP1
GO_POSITIVE_REGULATION_OF_TRANSCRIPTION_FROM_RNA_POLYMERASE_II_PROMOTER	0.344013880855986	0.788998846754051	-0.189651955552159	-1.03057199576883	8921	363	HAX1 IRF1 NFATC3 PRPF6 JUNB GATA3 STAT6 NFKBIA ZNF384 FOSB IKZF3 SKAP1 OGT RLF PSIP1 NFATC1 KLF6 SIRT2 ETV6 WBP2 MED21 TNF ABHD14B RELB KAT6B MED13 TCF12 MEF2A NCL GMEB1 DDX17 APP FLI1 REL CTR9 ARNTL TAF7 FOS NR4A3 BATF EAPP AKT2 RPRD1B ARF4 NLRC5 SMARCC1 ZC3H12A RBM15 GTF2H1 NFYC IRF2 CCNC TFAM STAT1 RBCK1 RFXANK PLAC8 MYC CHD6 SCAP CREB3 PIK3R1 CNOT7 ELK1 CITED2 NFIC NCK2 KLF2 PAF1 WWP2 NFE2L2 IGBP1 KDM6B LEF1 RB1 AKNA
GO_REGULATION_OF_ACTIN_FILAMENT_DEPOLYMERIZATION	0.451880511067123	0.840145455971144	0.357882104871559	1.00424153372832	25110	15	DSTN FAM21C MTPN
GO_ENDOCRINE_SYSTEM_DEVELOPMENT	0.714824120603015	0.941827215706157	-0.263817733057688	-0.82921014797622	31294	19	GATA3 BAK1 IL6R
GO_REGULATION_OF_MYELOID_LEUKOCYTE_DIFFERENTIATION	0.000556833313158213	0.0659847476092483	-0.504821491486554	-1.9060000153725	22	39	HAX1 RASSF2 CAMK4 OGT TOB2 TNF INPP5D FOS MYC PIK3R1 KLF10 MTOR CCL5 LEF1 RB1
GO_RESPONSE_TO_DSRNA	0.125511499929448	0.531026327823569	-0.370838792298172	-1.29140113130894	5336	28	NFKBIA TICAM1 FLOT1 MB21D1 RFTN1 PMAIP1 NPM1 ZCCHC11 SMAD3 NFKB1 EIF2AK2 HNRNPA2B1 DDX1 MRPL44 ADAR SMAD2
GO_POSITIVE_REGULATION_OF_ACTIN_FILAMENT_POLYMERIZATION	0.263785041183033	0.725200573727757	-0.317171379694478	-1.13230772016465	11112	31	EVL ARPC5 VASP BAG4 MTOR NCK2 ACTR2 MLST8 NCK1 PYCARD ARPC2 ARPC1B IQGAP2 GRB2 ARPC4 CDC42EP3 PTK2B
GO_REGULATION_OF_STEROID_METABOLIC_PROCESS	0.718056002574831	0.941827215706157	-0.257622864817691	-0.831981886402371	31233	21	TNF LDLRAP1 EPHX2 SCAP STUB1 ACADVL NFKB1 STAT5B ATP1A1
GO_STEROL_BIOSYNTHETIC_PROCESS	0.924353455942514	0.991918061895442	0.217579152437949	0.650464451090059	51968	19	PMVK CNBP CYP51A1 PRKAA1 ACAA2 C14orf1 IDI1 FDFT1 INSIG1 CYB5R3 LBR
GO_REGULATION_OF_PHAGOCYTOSIS	0.666214974735875	0.925606800406074	-0.270741376383176	-0.862291591562682	29006	20	PTEN TNF CSK GNB2L1
GO_DNA_INTEGRITY_CHECKPOINT	0.807903205045695	0.971661913895313	-0.196981899603027	-0.83002705670488	31382	65	GADD45A FOXN3 CDKN1B RBL2 NBN BTG2 XPC CNOT7 CNOT6L PLK3 H2AFX UIMC1 NPM1
GO_MEMBRANE_PROTEIN_PROTEOLYSIS	0.64906199749866	0.920622757061484	0.294418238405855	0.867561352601865	36327	18	PARL PSENEN ADAM19 SPPL2A APH1A HM13 CTSH RELA
GO_TUBE_MORPHOGENESIS	0.148121117760586	0.568706559649262	0.302328266183877	1.2184780051153	9132	72	SKI RBPJ CTNNB1 LUZP1 AHI1 STK4 SEC24B MED1 LMO4 AREG PML PHB2 DEAF1 KRAS PRKX
GO_REGULATION_OF_EMBRYONIC_DEVELOPMENT	0.419921386457031	0.829344738252635	0.34870994601685	1.02754256689448	23502	18	PAFAH1B1 CTNNB1 STK4 SEC24B
GO_SENSORY_ORGAN_DEVELOPMENT	0.349962388566124	0.788998846754051	0.254570568255598	1.05823592488406	21865	86	SKI RBPJ GNB1 RAB11FIP4 PAFAH1B1 IMPDH2 CTNNB1 AHI1 SEC24B MED1
GO_POSITIVE_REGULATION_OF_MAP_KINASE_ACTIVITY	0.961486641911209	0.999972508968949	0.173686509116273	0.679992243763101	58517	62	DAXX KRAS SPAG9 MAP3K2 MDFIC TIAM1 CD81 PDCD10 SHC1 PIK3CB MAPKAPK2 EZH2 PRKAA1 ADAM8
GO_CELL_PROJECTION_ORGANIZATION	0.193575518390321	0.644216401052417	-0.215962359357691	-1.1044513014356	5983	212	PTEN TMEM138 GATA3 EVL UBE4B AFG3L2 ILK FLOT1 CCDC64 PTPRA EIF2AK4 DNAAF2 SGK1 BTG2 MEF2A CNP OFD1 APP ZNF280D RAC2 PQBP1 VASP NR4A3 KIDINS220 IFT52 DYNLT1 BAG4 ARF4 SNAPIN NDEL1 SNX2 CORO1A WHAMM C16orf80 STMN3 RAPGEF6 CPNE1 PAK2 MTOR NCK2 ACTR2 NUBP2 INPP5K RB1 CUL3 MTSS1 EZR
GO_NEGATIVE_REGULATION_OF_PROTEIN_METABOLIC_PROCESS	0.930055944787201	0.994118838893084	0.164599476521227	0.841881663864796	71152	455	SKI CASP8 PSMF1 NR1H2 PTTG1 PSMB3 PSMB2 HNRNPD PAFAH1B1 ANAPC11 SYNCRIP CTNNB1 CALR CIB1 HERPUD1 TRIAP1 TIMP1 SUPT6H YWHAE HIPK3 GMFB HSPA1A FAM129A DUSP4 PSMA3 UBR5 ZNF207 SMAD7 PSMD8 DNAJC3 PML APC PIBF1 GAPDH EIF4E OTUB1 PSMB6 CSNK2A1 DNAJC1 PDCL CALM3 AATF ITCH WAC CDKN2D PSMA1 CD109 PSMC6 SNRNP70 JARID2 EIF2S1 USP4 MAD2L2 CASP3 TNFAIP8 UBE2E1 FOXO1 LATS1 CTDSP1 PDPK1 GTPBP4 CNST DICER1 USP47 DUSP16 ANXA2 FHIT PSMA7 CELF1 HTT CAPRIN1 ILF3 NCKAP1L EP300 MOV10 PSMD7 HDAC3 SERPINB9 CAST KDM5A ISG15 ATF4 SNIP1 PPP2R1A PARK7 CDKN1A SIN3A HDAC8
GO_RETROGRADE_TRANSPORT_ENDOSOME_TO_GOLGI	0.555408160758592	0.885049910344078	-0.243112808016432	-0.942855412204399	22608	44	ZFYVE20 TBC1D5 BET1L ERC1 TBC1D10C SNX2 VPS53 SNX6 VPS26B VPS29 STX16
GO_CYTOPLASMIC_SEQUESTERING_OF_PROTEIN	0.386434745717771	0.811305170038577	0.338298596924517	1.04973730725663	21860	22	HSPA5 GPAA1 PDIA3 GET4 LATS1 G3BP2 YWHAB SUFU FLNA KEAP1 TSPO
GO_REGULATION_OF_INFLAMMATORY_RESPONSE	0.170300049964499	0.602445992337623	-0.268336809863906	-1.17303806498908	6475	78	ZYX SOCS3 GATA3 TNFAIP3 TNF NR1D2 GPSM3 GGT1 ZC3H12A SNX6 CASP1 CD46 CCL5 GSTP1 PSMB4 ACP5 CASP4 ADA GPX1 PTGER4 BIRC2 SMAD3 NFKB1 CD28 ANXA1 VAMP7
GO_RESPONSE_TO_INTERFERON_GAMMA	0.219494175881006	0.672399293840243	-0.296367473228134	-1.15505047104117	8912	45	IRF1 GCH1 OAS1 IFITM1 CAMK2G IFITM3 GBP1 IRF2 STAT1 RPL13A CCL5 JAK1 TRIM26
GO_PROTEIN_LOCALIZATION_TO_MITOCHONDRION	0.923578111987459	0.991918061895442	-0.186725807258131	-0.716711978476744	37705	42	AFG3L2 DNAJC19 FIS1 TIMM17B TOMM7 TIMM13 PMAIP1 AIP MTCH2 NDUFA13 MARCH5 PMPCA DNM1L
GO_MICROTUBULE_BASED_MOVEMENT	0.444857742730083	0.837807533375864	0.260024104858218	1.00488422784338	26908	58	AP3D1 PAFAH1B1 CLTA BLOC1S2 AP3B1 KIF13B KPNB1 KTN1 HTT KIF22 AP2S1 IFT57 KIF2A NDE1 CDC42 SSNA1
GO_SENSORY_ORGAN_MORPHOGENESIS	0.496204705478276	0.856692494822427	0.280677455090459	0.974514617125917	28893	35	SKI CTNNB1 AHI1 SEC24B
GO_PROTEIN_DNA_COMPLEX_SUBUNIT_ORGANIZATION	0.195079420436892	0.645361092735641	0.274451438067374	1.16150331895299	12305	96	CENPM NASP HIST1H1C CTCF RBX1 RAD23B HMGB2 ANP32E DAXX HELLS RPA2 CHD1L HIST1H4C CENPK ASF1A CENPN ERCC5 PSME4 SETD2 EP300 CUL4A ARID2 RPA3 HIST1H1E RPA1
GO_CHROMATIN_SILENCING	0.403394625176803	0.818559910536982	-0.293233536755868	-1.03008651325002	17111	29	DPY30 SIRT2 MBD1 MBD2 ARID1A HIST1H3D H2AFX H3F3B
GO_LOCOMOTORY_BEHAVIOR	0.525612816722247	0.866859623402583	0.278765836483112	0.955434561940804	30576	33	C12orf10 PAFAH1B1 OXR1 GMFB UBA6
GO_REGULATION_OF_PROTEIN_LOCALIZATION_TO_NUCLEUS	0.439957747155135	0.837807533375864	0.242474252070595	1.0079522002829	27488	86	IL18R1 CCT3 CCT2 UBR5 MED1 KPNA1 PRDX1 HNRNPM TMEM173 TXN MDFIC FBXW11 G3BP2 EP300 KAT7 CCT6A HDAC3 PARK7 JAK2 CDKN1A SIN3A CHERP CCT5 TRIM8 SUFU IPO5 PPP3CA FLNA
GO_NUCLEUS_ORGANIZATION	0.717755900461775	0.941827215706157	0.210331717994862	0.870757325082695	44764	84	TMF1 PAFAH1B1 SRPK2 NUP50 NSFL1C HMGB2 DAXX CHMP2A PML BANF1
GO_REGULATION_OF_SEQUENCE_SPECIFIC_DNA_BINDING_TRANSCRIPTION_FACTOR_ACTIVITY	0.061923971614499	0.394727733485647	-0.258367854112421	-1.2533472089881	2102	145	PRKCB PTEN TRAF1 ERBB2IP TNFAIP3 NFKBIA TICAM1 ITGB2 SIK1 PARP10 EIF2AK4 IL6R SIGIRR TNF DAP ERC1 SGK1 MED13 MAPK8 RWDD3 PRKCH FOS UBE2V1 NLRC5 ZC3H12A RBCK1 COMMD6 CYLD TAB2 PRMT2 WWP2 TRIM26 RB1 NPM1 TRIM21 TRADD SMARCA4
GO_STEM_CELL_DIFFERENTIATION	0.717295434969854	0.941827215706157	0.246763842874667	0.840127780057872	41638	32	RBPJ CTNNB1 CDK6 JARID2 REST SETD2 MSI2
GO_ENDOPLASMIC_RETICULUM_ORGANIZATION	0.945035991481723	0.997856958198806	0.20042986188579	0.62969497601804	53695	23	RAB10 CCDC47 GET4 JAGN1 LMAN1 VMP1 VAPB BAG6 UBL4A SEC16A
GO_POSITIVE_REGULATION_OF_INTRINSIC_APOPTOTIC_SIGNALING_PATHWAY	0.900333482311686	0.988281847741711	0.207001029042437	0.709469782953255	52375	33	SERINC3 FBXW7 PLAGL2 PLEKHF1 PARK7 BBC3 S100A9 MCL1
GO_NEGATIVE_REGULATION_OF_MULTI_ORGANISM_PROCESS	0.60445378805575	0.902526360516232	-0.21777503089611	-0.928205477269108	23288	69	TNFAIP3 PARP10 EIF2AK4 SIGIRR OAS1 SIRT2 TNF IFITM1 ISG20 IFITM3 ARHGDIB ZC3H12A STAT1 CCL5 TRIM26 INPP5K
GO_NEURON_DIFFERENTIATION	0.443779498411327	0.837807533375864	-0.199841937803006	-1.00207657806783	14385	182	PTEN GATA3 EVL UBE4B AFG3L2 ILK FLOT1 CCDC64 PTPRA EIF2AK4 SMARCC2 SGK1 BTG2 MEF2A CNP PHLDA1 APP ZNF280D PQBP1 MBD1 VASP NR4A3 KIDINS220 NGRN HDAC7 DYNLT1 ARF4 SNAPIN NDEL1
GO_PROTEASOMAL_PROTEIN_CATABOLIC_PROCESS	0.00527222502747498	0.158791945453116	0.319396923240889	1.4754362590287	354	173	PSMF1 HSP90B1 UBE2K PTTG1 PSMB3 PSMB2 RBX1 RAD23B RLIM ANAPC11 HSPA5 TRIM38 CTNNB1 TRIM13 NSFL1C VCP PSMA3 KIAA0368 PSMD8 UBXN4 PML FBXW7 APC PSMB6 RNF41 KCTD10 UBE2J2 TBL1XR1 RNF111 RNF145 CCDC47 PSMA1 PSMC6 UBE2E1 FBXW11 PSMA7 ANKZF1 PSME4 CSNK1A1 PCNP PSMD7 CUL4A BFAR MARCH6 CRBN PSMB10 KAT5 RNF216 CDC27 PSMC3 PRPF19 PSMB1 TOPORS BUB3 KEAP1 UBE2B PSMA5 RNF6 RAD23A RNF34 DNAJC10 PSMD1
GO_FERTILIZATION	0.938700082718809	0.996413320703556	0.203754202215079	0.640139130318364	53335	23	CCT3 CCT2 SLIRP CAST PARK7 CCT5
GO_POSITIVE_REGULATION_OF_INTERLEUKIN_2_PRODUCTION	0.525473531937978	0.866859623402583	-0.317305487324073	-0.948244257655298	23247	16	CD3E CD83 CD28 ANXA1 STAT5B
GO_ACTIVATION_OF_INNATE_IMMUNE_RESPONSE	0.165708498870453	0.599816357661097	0.270863847436677	1.17856979145082	10635	114	CASP8 PSMF1 HSP90B1 PSMB3 PSMB2 PSMA3 PSMD8 HSPD1 PSMB6 KRAS TMEM173 ITCH CTSB PSMA1 PSMC6 MALT1 PDPK1 FBXW11 PSMA7 TBK1 PSME4 MYD88 EP300 PSMD7 TNIP2 SIN3A MAPKAPK2 RPS6KA3 LSM14A PSMB10 FAM105B ADAM8 PSMC3 PSMB1 HMGB1 PSMA5 LY96 PSMD1 PSMD9 IRF3
GO_REGULATION_OF_CELL_PROJECTION_ASSEMBLY	0.16587076555738	0.599816357661097	-0.305018792656595	-1.20513310611698	6668	48	SH3YL1 EVL MIEN1 TBC1D5 RHOG TBC1D22A RAC2 TBC1D10C CYLD MTOR CAPZB SEPT9
GO_SPERMATID_DIFFERENTIATION	0.161464857341684	0.597076429914568	0.381436957289466	1.25763947726227	9280	28	TMF1 PAFAH1B1 CIB1 HMGB2 CCNB1IP1 SLIRP CELF1 PSME4
GO_GOLGI_VESICLE_TRANSPORT	0.612219909391453	0.904513240670945	-0.190281989294288	-0.947424422653541	19999	173	RER1 TRIP11 SNAP23 TAPBP ZFYVE20 RAB7L1 UVRAG ATP8A1 BET1L KLHL20 CUX1 TRAPPC1 LAMP1 VAMP5 AP1G1 TRAPPC6A ARCN1 RAB14 ARF4 PACS1 NRBP1 SNX2 CTAGE5 SEC31A WHAMM TGOLN2 OPTN KDELR2 GOLGA7 GABARAPL2 GOLGA4 CUL3 ATL2 DYNC1H1 MACF1 CNIH4 VPS13C STX17 COG3 SCAMP1 MCFD2 KDELR1 SEC13 SEC23IP KIFAP3 MON2 NAPA
GO_GLIAL_CELL_DIFFERENTIATION	0.227158800718812	0.678581724490818	-0.329750608413413	-1.16773017620072	9606	30	PTEN NAB1 ILK SIRT2 EIF2B1 CNP AKT2 CSK
GO_NEURAL_TUBE_FORMATION	0.200417536534447	0.647596325972806	0.367228693147574	1.21079327228205	11519	28	SKI LUZP1 STK4 SEC24B LMO4 DEAF1 SETD2 IFT57 SUFU
GO_REGULATION_OF_CELL_CYCLE_PHASE_TRANSITION	0.44775012606413	0.838867713390196	0.216668432361813	1.00373621202812	30189	177	PSMF1 PCNA PSMB3 PSMB2 ANAPC11 PLRG1 TRIAP1 PSMA3 DGKZ ZNF207 PSMD8 RPA2 PML FBXW7 APC PSMB6 CSNK2A1 ZNF655 PHB2 GOLGA2 PSMA1 PSMC6 MAD2L2 LSM10 UBE2E1 TFDP1 CTDSP1 USP47 PSMA7 PSME4 EP300 PSMD7 CUL4A LCMT1 CDKN1A SIN3A SYF2 EZH2 PSMB10 ERCC3 CDC27 PSMC3 CDC14A PRPF19 PSMB1 CDK4 BUB3 DDX3X H2AFY PSMA5 CTC1
GO_ATP_HYDROLYSIS_COUPLED_TRANSMEMBRANE_TRANSPORT	0.288356870975775	0.74582612339518	0.379750594583514	1.13528460465593	16211	19	ATP6V0A2 ATP6V0B ATP6V0E1 ATP6V1F ATP5G1 ATP5G3 ATP6V0C ATP6V1B2
GO_REGULATION_OF_REACTIVE_OXYGEN_SPECIES_BIOSYNTHETIC_PROCESS	0.112150614825278	0.51223491072828	-0.401544372102094	-1.32949266611129	4842	23	TICAM1 OGT TNF P2RX4 AKT2 ZC3H12A MTOR KLF2
GO_REGULATION_OF_PEPTIDE_SECRETION	0.799675040619923	0.968557535543756	-0.203961546926767	-0.823945331079531	31990	53	PIM3 UCP2 TNF ARNTL GLUD1 CD38 ARL2BP HLA-DRB5 SRI CCL5 SERP1 ITPR2 PTGER4 CD74 PRKCA
