pathway	pval	padj	ES	NES	nMoreExtreme	size	leadingEdge
"reactome_snRNP Assembly"	0.891197243755383	0.985654302413531	0.210200469398437	0.715644770585476	51733	32	NUP50 SNRPD1 SNRPG NCBP2 SNRPB SNRPE WDR77 SNRPF NUP133 TPR PHAX NCBP1 TGS1 NUP37
"reactome_tRNA Aminoacylation"	0.259907610017019	0.721299336299146	0.34559420989654	1.14910794907767	14965	29	HARS TARS CARS MARS FARSB SARS FARSA GARS IARS
"reactome_tRNA modification in the nucleus and cytosol"	0.456025824964132	0.8417402858234	0.349589066630746	0.999485507413013	25427	16	ADAT2 THADA CDKAL1 TRMT112 TYW1 TYW3
"reactome_tRNA processing"	0.400281668101088	0.818559910536982	-0.238001516681662	-1.02380347873369	15347	72	ELAC2 MT-ND3 RPP38 RPP14 MT-ATP8 MT-ND4 POM121 MT-ATP6 NUPL2 MT-ND4L FTSJ1 POP7 NUP107 RAN RAE1 TPRKB TRDMT1 TRMT61B
"reactome_tRNA processing in the mitochondrion"	0.162900551858833	0.599816357661097	-0.417865859705143	-1.26972731481033	7172	17	MT-ND3 MT-ATP8 MT-ND4 MT-ATP6 MT-ND4L
"reactome_tRNA processing in the nucleus"	0.497566880522939	0.857340950114542	-0.257672682317415	-0.972866933639944	20551	39	ELAC2 RPP38 RPP14 POM121 NUPL2 POP7 NUP107 RAN RAE1 NUP214 SEC13 ZBTB8OS
"reactome_trans-Golgi Network Vesicle Budding"	0.360624205526193	0.798402044792234	0.283110256738547	1.05779249547967	21560	49	CLTA DNM2 CPD CHMP2A AP3B1 SNX9 AP4E1 CLTC
GO_POSITIVE_REGULATION_OF_VIRAL_TRANSCRIPTION	0.0551724137931035	0.383558620689655	0.429126585171212	1.43820738565955	3183	30	POLR2H POLR2I SNW1 MDFIC SUPT4H1 CTDP1 POLR2D EP300 POLR2B SUPT5H POLR2L POLR2F GTF2F1 CCNT1
GO_CARDIAC_CHAMBER_DEVELOPMENT	0.316690841095364	0.763721034608228	0.340945212848592	1.10407323724597	18121	26	RBPJ DNM2 LUZP1 SMAD7 MED1 LMO4
GO_CIRCADIAN_RHYTHM	0.637837024152004	0.918587164181571	0.240345114908086	0.898007941512909	38134	49	HNRNPD SYNCRIP PML RORA NCOA2 EP300 HDAC3 KDM5A ATF4 PPP1CC TOP1 HNRNPU NONO CDK4
GO_POSITIVE_REGULATION_OF_KINASE_ACTIVITY	0.781818725159131	0.964929722272614	0.189146206021057	0.86562743530787	52323	161	HSPA5 CIB1 STK4 DAXX CRKL LMO4 FBXW7 PIBF1 SNX9 CALM3 KRAS LAMTOR2 SPAG9 MAP3K2 CAB39 GNAI2 MALT1 TXN PDPK1 MDFIC TIAM1 PIK3CA CD81 PPP2R3C NCKAP1L OSBPL8 PDCD10 SHC1 CCNK PARK7 BRAF PIK3CB JAK2 CDKN1A MAPKAPK2 PILRB EZH2 ZNF622 PRKAA1 ADAM8 MAP3K8 LCP2 VAPB CCNL2 CDC42 HMGB1 AMBRA1 DLG1 PPP2CA HSP90AB1 PTPN11 GADD45B TNFRSF10A MAP2K1 ABI1 COPS8 PTPN1
GO_NEGATIVE_REGULATION_OF_TRANSCRIPTION_FACTOR_IMPORT_INTO_NUCLEUS	0.041150954965594	0.33842441512714	-0.503130152633474	-1.5288114184638	1811	17	NFKBIA LITAF TBC1D10C ZC3H12A SRI CREB3 CYLD MTOR
GO_REGULATION_OF_T_CELL_RECEPTOR_SIGNALING_PATHWAY	0.971913525102734	0.999972508968949	0.192254837025046	0.566516759820348	54397	18	LGALS3 MALT1 RC3H1
GO_NEGATIVE_REGULATION_OF_EPITHELIAL_CELL_PROLIFERATION	0.628332027819317	0.914096873060803	-0.251356528444731	-0.897347478028798	26470	31	PTEN CDKN1B GATA3 IFT52 STAT1 TGFBR3 AIMP1 RB1 MTSS1
GO_MOVEMENT_IN_ENVIRONMENT_OF_OTHER_ORGANISM_INVOLVED_IN_SYMBIOTIC_INTERACTION	0.843069306930693	0.975370076271968	-0.216751675248308	-0.761416923411172	35762	29	UVRAG SLAMF1 LAMP1 DYNLT1 KPNA3 CD46 WWP2 ITGB1 RPSA
GO_REGULATION_OF_PROTEIN_TARGETING_TO_MITOCHONDRION	0.701878971152866	0.936916783305439	0.239190004369143	0.8559161295627	41313	40	WBP11 PSMD8 FBXW7 ARIH2 UBE2J2 PLAGL2 SAE1 NKAP PARL SNIP1
GO_REGULATION_OF_ESTABLISHMENT_OF_PLANAR_POLARITY	0.00934054125543487	0.203124463887459	0.411075939827155	1.58863628663752	564	58	PSMF1 PSMB3 PSMB2 PSMA3 SEC24B PSMD8 CLTC PSMB6 PSMA1 PSMC6 TIAM1 PSMA7 PSME4 PSMD7 AP2S1 PSMB10 PSMC3 PSMB1 CDC42 PSMA5 PSMD1 PSMD9 PSMC4
GO_NEGATIVE_REGULATION_OF_RESPONSE_TO_ENDOPLASMIC_RETICULUM_STRESS	0.615244202101519	0.906181714620712	-0.260741973766183	-0.899973066314311	26289	27	DERL2 USP25 GRINA GNB2L1 CREB3 NCK2 PPP1R15A TXNDC12 NCK1 SVIP SYVN1 ERLEC1
GO_CYTOPLASMIC_TRANSLATION	0.526260899299025	0.867224751264415	0.271965534069496	0.956129480020443	30780	37	RPL26L1 RPL7L1 MRPL2 CDC123 EIF3M EIF2D EIF4H RPL22L1 EIF3J
GO_MEIOTIC_CHROMOSOME_SEGREGATION	0.0559764159371092	0.386099784382101	0.499319712863353	1.47134392155201	3132	18	PTTG1 CCNB1IP1 MLH1 PPP2R1A SMC4 UBE2B SMC2 TERF1 BAG6 RAD51C TOP2B STRA13
GO_POSITIVE_REGULATION_OF_CALCIUM_ION_TRANSPORT	0.304233297589631	0.752671123957112	-0.326319154456332	-1.10476852747304	13050	25	PLCG1 BAK1 P2RX4 JAK3 SRI CREB3 CCL5 STIM1
GO_REGULATION_OF_DOUBLE_STRAND_BREAK_REPAIR	0.00737908485054227	0.181755553533594	0.601893358316374	1.75022933009312	412	17	TFIP11 UBR5 RPA2 PML OTUB1 HELB WHSC1 PPP4R2 RIF1 PPP4C TRIP12
GO_REGULATION_OF_G_PROTEIN_COUPLED_RECEPTOR_PROTEIN_SIGNALING_PATHWAY	0.948466470282447	0.998503782470517	0.192312448097262	0.64453052494382	54735	30	DNM2 ADRBK1 PDCL CALM3 YWHAB NMT1 GRK5 ATP2B4 METAP2 PHB METAP1 CRY1
GO_DENDRITE_DEVELOPMENT	0.328636227579379	0.771920307860902	-0.332617796033612	-1.08887964340189	14272	22	PTEN MEF2A APP KIDINS220 ARF4 PAK2 NCK2 ITGB1 TMEM106B CDK5 MINK1
GO_MEMORY	0.0636121200974757	0.400571973657293	-0.445371317809701	-1.4383073854995	2766	21	PTEN CAMK4 EIF2AK4 SGK1 MTOR NQO2
GO_NEURON_DEVELOPMENT	0.274173158900485	0.732345722595866	-0.221893280391346	-1.07540881336651	9325	144	PTEN GATA3 EVL UBE4B AFG3L2 ILK FLOT1 CCDC64 PTPRA EIF2AK4 SGK1 BTG2 MEF2A CNP APP ZNF280D PQBP1 VASP NR4A3 KIDINS220 DYNLT1 ARF4 SNAPIN NDEL1
GO_ENDOTHELIAL_CELL_DEVELOPMENT	0.552313739503305	0.882599363729022	0.316248682663752	0.931889058150366	30912	18	CTNNB1 PLOD3 RAP1B CCM2 MSN RAB1B RDX
GO_REGULATION_OF_CELL_ACTIVATION	0.0626244115137919	0.397230756244417	-0.241410628450891	-1.22266944258076	1981	196	IRF1 CD3G GATA3 TNFAIP3 STAT6 TICAM1 IKZF3 CAMK4 FLOT2 LAT SLAMF1 IL4R CD3E HLA-E CD83 LAMP1 RAC2 AP1G1 INPP5D JAK3 CD2 NR4A3 CD27 ITPKB CSK TBC1D10C C10orf54 ZC3H12A CD38 SNX6 HLA-DRB5 HLA-DPA1 CORO1A CD46 TGFBR2 PIK3R1 CYLD PAK2 PAG1 MTOR HLA-A NCK2 PKN1 CCL5
GO_ATP_DEPENDENT_CHROMATIN_REMODELING	0.11336421341568	0.513623607602205	0.379375133654749	1.30933839119984	6607	34	CENPM NASP MTA2 GATAD2B ANP32E HIST1H4C CENPK CENPN
GO_ANATOMICAL_STRUCTURE_FORMATION_INVOLVED_IN_MORPHOGENESIS	0.329258095210634	0.771920732206945	0.221451970441518	1.05403581948627	22837	220	SKI FOPNL PLCD1 RBPJ TMF1 PAFAH1B1 CTNNB1 PRCP SRPK2 CIB1 PLEKHO1 LUZP1 AHI1 C19orf10 STK4 DUSP4 RPL7L1 SEC24B MED1 LMO4 NEK1 PIBF1 PDE3B UNC13D MTPN DEAF1 CCNB1IP1 HSBP1 PRKX CD109 CASP3 FOXO1 LATS1 IFT20 DICER1 PIK3CA ANXA2 SETD2 HTATIP2 RORA EP300 PDCD10 ADIPOR2 HIPK1 SHC1 CAST SEPT2 AGGF1
GO_ION_TRANSPORT	0.656033150723416	0.922956125303703	0.190788553001069	0.930561068686539	46702	273	PLIN2 ATP6V0A2 SLCO3A1 ATP6V0B ATP5S LRRC8C ACSL4 ABCG1 SERINC3 MAGT1 GAR1 DNM2 SLC25A32 SLC7A5 COX7B TRIAP1 YWHAE UQCRH ATP13A1 ATP2C1 ATP6V0E1 CLTC KCNAB2 TRAPPC10 CALM3 ARMC1 COX7A2 PITPNB COMMD3 ATP6V1F STOML2 GLS AQP3 SLC25A3 REST NCOA2 OSBPL8 COX6A1 SLC25A13 SLC39A1 NDUFA4 COX5B SLC16A7 ABCC1 PARK7 SLC25A6 SEC14L1 SLC30A7 SERINC5 SLC37A3 RASA3 ATP5G1 CHERP BBC3 COX8A NIPA2 SLC39A4 PPP3CA FXYD1 ARL6IP5 SLC38A5 ATP5G3
GO_LIPID_MODIFICATION	0.823344252226431	0.972525951081592	-0.195511910513895	-0.819009918280538	32172	63	PTEN MTM1 GCDH INPP5D HADHB EPHX2 PIK3R1 IP6K2 INPP5K ECHS1 ACADVL FAM126A AGK PIK3C3 TMEM55B CD28 PI4KA GRB2 ETFB PI4KB SOAT1 PIP4K2A
GO_NEGATIVE_REGULATION_OF_PROTEIN_COMPLEX_ASSEMBLY	0.864128589856745	0.980323426351843	0.208964392779479	0.751886666578826	50910	41	STMN1 TFIP11 LMO4 ADD1 PARK7 LCMT1 CRBN DNAJC15 ARFGEF1 DDX3X CDC42 HMGB1
GO_SINGLE_FERTILIZATION	0.702923686818632	0.937351433010831	0.272312203671505	0.835654545426526	39717	21	CCT3 CCT2 SLIRP CAST PARK7 CCT5 UBE3A
GO_LEUKOCYTE_ACTIVATION	0.00529915583215232	0.158791945453116	-0.286503480611342	-1.43391026824552	171	180	PRKCB IRF1 CD3G AMICA1 GATA3 STAT6 TCF7 TICAM1 ITGB2 SNAP23 IKZF3 CAMK4 BTN3A1 BAK1 EIF2AK4 NBN KLF6 ZFP36L2 LAT SLAMF1 RELB CMTM7 CD3E HLA-E DOCK8 RNF168 JAK3 CD2 NR4A3 BATF ITPKB CORO1A TGFBR2 PIK3R1 LCP1 CD151 NCK2 IMPDH1 CCL5 AZI2 ADAM17 RC3H2 IGBP1 IL2RB PTPN22 FKBP1A EXOSC6 PREX1 ERCC1 DDOST ITGB1 STXBP3 ZAP70 ADA NCK1 LAX1 NCSTN PTGER4 CD74 PYCARD DCLRE1C SMAD3
GO_CHROMOSOME_ORGANIZATION	0.00852257963934937	0.193747220835228	0.256687640774195	1.31759766842249	655	475	SAFB CENPM NASP NUDC SUDS3 RERE HCFC1 VPRBP HMGB3 HIST1H1C NHP2 MTA2 NUSAP1 PTTG1 PCNA CTCF RBX1 PAFAH1B1 RAD23B BRE GAR1 CTNNB1 GATAD2B DHX9 TFIP11 KDM5C ITPA H2AFZ ING4 FAM175A SUPT6H HSPA1A BRD1 HMGB2 NCAPD2 ENY2 ANP32E LIG1 ZNF207 SMC1A WAPAL DAXX CHMP2A RNF20 HELLS RPA2 CHD1L FBXW7 PIBF1 WDR61 HIST1H4C CBX3 SMC6 SUZ12 DTX3L PHB2 BAZ1A EPC2 CENPK ESCO1 CHMP4B CCNB1IP1 MLH1 ASF1A TBL1XR1 WAC CENPN JARID2 RYBP KPNB1 USP22 EP400 UBE2E1 HELB LATS1 SUPT4H1 MYSM1 MAU2 SMC3 WHSC1 DIS3L2 REST PSME4 SETD2 PHF19 NCOA2 EP300 SMG1 KIF22 EED PTGES3 KAT7 MCM3 TRRAP HDAC3 CUL4A KDM5A NCAPH2 PRDM2 SMCHD1 ARID2 PPP2R1A PDS5B JAK2 RPA3 PPP1CC SIN3A HDAC8 ATF2 DNAJC2 BRMS1 SUPT5H PHF20 HIST1H1E DNMT1 G3BP1 EZH2 RPA1 ACIN1 RRP8 PRIM2 SMC4 TOP1 FBL KAT8 SIRT7 PRKAA1 KIF2A JMJD1C KAT5 AKAP8L ERCC3 AKAP8 RRS1 CDC14A KAT6A MCM6 BUB3 SUPT3H SRPK1 NDE1 WDR5 DDX3X H2AFY UBE2B HMGB1 TAF12 COPS4 CTC1
GO_NEGATIVE_REGULATION_OF_MAP_KINASE_ACTIVITY	0.432932578972183	0.834187164361035	-0.287703503786997	-1.01066031649884	18364	29	DUSP1 DUSP5 MBIP PDCD4 SMPD1 GSTP1 INPP5K GPS1 PTPN22 LAX1 DUSP2 CDK5RAP3 RGS14 SORL1 DUSP10 PTPN6
GO_SYNAPTIC_VESICLE_LOCALIZATION	0.176322461880449	0.615417210154201	0.372478885501627	1.23850005566252	10152	29	AP3D1 DNM2 CTNNB1 AP3B1 SYT11 SYTL3 SNAP47 GRN SYNJ1
GO_REGULATION_OF_ANTIGEN_RECEPTOR_MEDIATED_SIGNALING_PATHWAY	0.765979765956455	0.960514309691428	-0.238517524265875	-0.807512064373734	32858	25	PRKCB GBP1 EZR PTPN22 ADA
GO_CARBOHYDRATE_CATABOLIC_PROCESS	0.246687300512622	0.701323655873943	-0.303723929924046	-1.13966977034079	10201	38	GALT GPI MAN2B1 GYG1 PFKP ADPGK
GO_LABYRINTHINE_LAYER_DEVELOPMENT	0.291956091416232	0.74840661781919	0.405855498442969	1.13885813981873	16223	15	CASP8 PLCD1 RBPJ
GO_NEUROLOGICAL_SYSTEM_PROCESS	0.0548275470841843	0.382180254675049	-0.270693895077395	-1.28264931667246	1932	124	PTEN GCH1 CDKN1B TPP1 GPI CAMK4 EIF2AK4 NBN SLC1A4 ATP8A1 DNAJC19 SGK1 BTG2 P2RX4 APP RIC8A FOS NR4A3 DGCR2 ARF4 WDR1 PRKAR1B CCDC66 PDE6B TIMM13 MTOR NQO2 LEF1 RP9 ITGB1 ARRB2 NIPBL FAM107B FAM65B GPX1 MKKS PGAP1 CDK5 RPL38 HEXB
GO_POSITIVE_REGULATION_OF_MITOTIC_NUCLEAR_DIVISION	0.770356799829248	0.962226672548206	0.262765993115141	0.785552915165062	43310	19	NUSAP1 ANAPC11 PHB2 GOLGA2 PHIP SH2B1 H2AFY TERF1
GO_HINDBRAIN_DEVELOPMENT	0.00934980271058501	0.203124463887459	0.481581487915379	1.66208344902379	544	34	RERE HNRNPD HSPA5 CTNNB1 AHI1 OGDH SEC24B MTPN GART RORA NCOA2
GO_OLIGOSACCHARIDE_METABOLIC_PROCESS	0.386340988621353	0.811305170038577	-0.311110987488812	-1.04318644617078	16670	24	MAN2B1 MAN1B1 GNPTG FUT8 B4GALT1 KIAA2018 MAN2C1 HEXB
GO_CHROMOSOME_SEGREGATION	0.00567321069717112	0.162528135027749	0.346632484430646	1.5248575949403	366	122	CENPM NUDC NUSAP1 PTTG1 CTCF USP9X PAFAH1B1 NCAPD2 ZNF207 SMC1A WAPAL CHMP2A FBXW7 PIBF1 PHB2 CENPK ESCO1 CHMP4B CCNB1IP1 MLH1 CENPN CDK5RAP2 KPNB1 LATS1 MAU2 SMC3 DIS3L2 PPP1R7 KIF22 FAM96B PPP2R1A PDS5B PPP1CC HDAC8 FAM96A SMC4 TOP1 ARL8B KIF2A AKAP8L AKAP8 RRS1 CDC14A BUB3 SRPK1 NDE1 DDX3X UBE2B NCAPD3 STAG1 SMC2 TTN STAG2 CKAP5 TERF1 BAG6 NUP133 RAD51C
GO_HEMATOPOIETIC_PROGENITOR_CELL_DIFFERENTIATION	0.781928534792272	0.964929722272614	0.229017031013565	0.805138546426518	45734	37	PAPD4 ARMC6 MED1 KCNAB2 CDK6 PRRC2C REST EP300 BRAF SIN3A RRS1 PTPN11 ABI1 FAM115C CHD2 ARHGEF7 TET2 BCL2 WDR7 TGFB1
GO_NEGATIVE_REGULATION_OF_ERK1_AND_ERK2_CASCADE	0.0527181361352216	0.375508690995963	-0.472000690100414	-1.48355365481614	2307	19	PTEN DUSP1 TBC1D10C GBP1 GSTP1 EZR ATF3 ITGB1BP1 RGS14 VRK3
GO_STEROID_BIOSYNTHETIC_PROCESS	0.59338069658638	0.899488876815001	0.272207892893214	0.912298178491195	34243	30	PMVK MED1 HSD17B8 CNBP FDX1 CYP51A1
GO_REGULATION_OF_PROTEIN_TYROSINE_KINASE_ACTIVITY	0.0764173065428296	0.434030322782476	-0.435913335408859	-1.40776324088337	3323	21	APP SNX6 IBTK PAK2 NCK2 CCL5 ADAM17
GO_REGULATION_OF_INTERFERON_BETA_PRODUCTION	0.215939366100138	0.667798253170889	-0.376129156619467	-1.19794400629591	9401	20	IRF1 TICAM1 FLOT1 RELB REL
GO_DNA_TEMPLATED_TRANSCRIPTION_ELONGATION	0.0629987056182721	0.397669795512919	0.343506627193583	1.35365009486377	3844	64	POLR2H THOC7 ELL2 TCEB1 ENY2 POLR2I TAF6 POLR2C TWISTNB SUPT4H1 CTDP1 SETD2 POLR2D POLR2B CCNK NCBP2 SUPT5H SSRP1 ERCC3 TAF12 POLR2L
GO_RESPONSE_TO_NITROGEN_COMPOUND	0.00504396428327994	0.154701351606009	-0.263572595224111	-1.38322142602056	147	260	PTEN ERBB2IP SOCS3 JUNB CDKN1B TNFAIP3 STAT6 NFKBIA TICAM1 DUSP1 FOSB SOCS1 OGT UCP2 FLOT1 PTPRA KLF6 SIRT2 TNF MB21D1 EIF2B1 AGTRAP BTG2 AKR1B1 EEF2 UBR1 CAPN2 P2RX4 RFTN1 APP JAK3 MBD1 FOS NR4A3 DENND4C ADSS AKT2 CSK SMARCC1 SMPD1 PRKAR1B CASP1 APRT ATP6V0E2 STAT1 PMAIP1 SCAP PIK3R1 GSS SELL KLF10 MTOR GFPT1 KLF2 CCL5 PRKACB GSTP1 ATP6V1H INPP5K PPP1R15A TRDMT1 EZR UQCRC1 MGMT PTPN22 NPM1 ZCCHC11 AKAP9 STXBP3 CASP4 NR4A2 ADA ITPR2 PRKAR2A PARP1 PIK3C3 PTGER4 ATP6V0D1 BIRC2 SLC25A33 CDK5 SMAD3 NFKB1
GO_NEGATIVE_REGULATION_OF_TRANSMEMBRANE_TRANSPORT	0.800440013270242	0.968557535543756	0.238078617082442	0.777771501245579	45841	27	GSTO1 CALM3 CAB39 CRBN OAZ1 CAMK2D GNB5 OXSR1 COMMD1 IRS2 FAM115C PPIF TRIM27 TGFB1 SLC9A3R1
GO_REGULATION_OF_DNA_RECOMBINATION	0.452846865001503	0.840264610006347	0.323243375301131	1.00302109870371	25617	22	SUPT6H RPA2 KPNA1 MLH1 HELB WHSC1 PPP4R2 PPP4C KPNA2
GO_REGULATION_OF_LEUKOCYTE_PROLIFERATION	0.115406147530058	0.516948155688764	-0.274140642320868	-1.22338221901181	4328	87	IRF1 TNFAIP3 TICAM1 IKZF3 SLAMF1 CD3E HLA-E RAC2 INPP5D JAK3 C10orf54 CD38 HLA-DRB5 HLA-DPA1 CORO1A CD46 HLA-A NCK2 PKN1 CCL5 GSTP1 CCDC88B PTPN22 ZAP70 ADA NCK1 CD74 PYCARD
GO_RESPONSE_TO_ETHANOL	0.0722168206125425	0.424029845353375	-0.357658272313712	-1.35857526988327	2970	40	PTEN DMAP1 GATA3 G6PD BAK1 EEF2 CD27 GOT2 CCL5 GSTP1 MGMT
GO_SULFUR_COMPOUND_METABOLIC_PROCESS	0.760435514577466	0.960383971200733	0.20053174236082	0.857467365498685	48330	102	ACSL5 PDHB ACSL4 FAR1 TXN2 PMVK OGDH ACSS1 EIF2B2 GSTO1 SPOCK2 GSR SUCLA2 CHST7 GGCT TXN
GO_POSITIVE_REGULATION_OF_DNA_REPLICATION	0.0866018951661269	0.455353638101116	0.386989293455388	1.35218080117941	5053	36	PCNA CTNNB1 CCT3 CALR CCT2 AREG STOML2 HNRNPA1 CCT6A SHC1 CCT5
GO_NEGATIVE_REGULATION_OF_NEURON_APOPTOTIC_PROCESS	0.906346804985232	0.988863629445347	-0.195236897190591	-0.723383713197944	37742	36	GPI ILK BTG2 NR4A3 CORO1A
GO_NUCLEOTIDE_PHOSPHORYLATION	0.62156063641178	0.91236772479549	-0.272550959263337	-0.892240868860537	26994	22	GPI CMPK1 PFKP ADPGK RAD50
GO_POSITIVE_REGULATION_OF_GENE_EXPRESSION_EPIGENETIC	0.549846992445252	0.882599363729022	-0.25979177808635	-0.94170487713751	22998	33	ARID1B WBP2 TBP POLR1D BAZ1B ARID1A ACTB HIST1H3D H3F3B ATAD2B TAF1B SMARCA5
GO_REGULATION_OF_MRNA_METABOLIC_PROCESS	0.0278508209338122	0.288315917749888	0.343211571995817	1.42086982038441	1736	84	SAFB CDK11B SYNCRIP HNRNPL SRPK2 CDK11A PAPOLA SUPT6H HSPA1A BARD1 RBM5 NSRP1 MAGOH RNF20 SNW1 SNRNP70 NBAS PNPT1 RBM42 SRSF10 YTHDC1 ZC3H14 NCBP2 SUPT5H ACIN1 RC3H1 SRSF2 PRPF19 RBM25 SRPK1 DAZAP1 SF3B4 TRA2B SRSF4 JMJD6
GO_POSITIVE_REGULATION_OF_PROTEIN_BINDING	0.467480386662931	0.84495592358302	0.309153399455759	0.991629274488201	26694	25	MFNG HERPUD1 STK4 PLCL2 ADD1 TMEM173 TIAM1 EP300 PARK7 CRBN
GO_SENSORY_PERCEPTION	0.512102816794087	0.863477605404593	-0.234236494636581	-0.967859381938762	20161	59	CDKN1B DNAJC19 P2RX4 WDR1 CCDC66 PDE6B TIMM13 LEF1 ARRB2 NIPBL FAM107B FAM65B GPX1 MKKS PGAP1 CDK5 RPL38 HEXB RABGGTA
GO_HEPATICOBILIARY_SYSTEM_DEVELOPMENT	0.415395678640712	0.826691198960996	0.274991770286681	1.02357041650357	24838	48	MKI67 HNRNPD CTNNB1 MED1 CEBPG JARID2 SEC63 PIK3CA EP300 CAST MPST
GO_FATTY_ACID_CATABOLIC_PROCESS	0.877867053659918	0.983315477079671	0.229048651062416	0.702890079120427	49602	21	DECR1 ECH1
GO_REGULATION_OF_VESICLE_FUSION	0.206071154106957	0.656757333443566	-0.408295169650359	-1.22016027303659	9116	16	TBC1D5 SLAMF1 TBC1D22A AKT2 CORO1A
GO_MITOCHONDRIAL_RESPIRATORY_CHAIN_COMPLEX_I_BIOGENESIS	0.6373385122013	0.918587164181571	0.246254825606806	0.8951570322679	37739	43	NDUFA11 NDUFB3 NDUFC1 NDUFAF3 NDUFV2 NDUFS3 NDUFAF2 NDUFA2 NDUFA12 ECSIT TIMMDC1 NDUFS2
GO_CARBOHYDRATE_TRANSPORT	0.471108321377331	0.846185190509975	0.34587734549345	0.988873586622583	26268	16	FABP5 SLC50A1 AQP3 BRAF SLC37A3 SLC35E1
GO_REGULATION_OF_CELLULAR_RESPONSE_TO_GROWTH_FACTOR_STIMULUS	0.432269987679398	0.834187164361035	0.265888023839077	1.01270549262453	25962	54	SKI CTDSPL2 RBPJ HSPA5 DNM2 CTNNB1 SMAD7 SNW1 RNF111 CD109 PDPK1
GO_EMBRYO_DEVELOPMENT_ENDING_IN_BIRTH_OR_EGG_HATCHING	0.807510250844187	0.971661913895313	0.187617485504092	0.853836269181179	53566	155	SKI NASP CASP8 PLCD1 RBPJ ACSL4 CTNNB1 LUZP1 STK4 PLOD3 RPL7L1 SEC24B MED1 LMO4 EIF2S2 DEAF1 MAFF ADD1 CCNB1IP1 GABPA EPN1 LATS1 ITPK1 SETD2 EP300 SLC39A1 ZFP36L1 CUL4A
GO_ANTIGEN_PROCESSING_AND_PRESENTATION_OF_PEPTIDE_OR_POLYSACCHARIDE_ANTIGEN_VIA_MHC_CLASS_II	0.696475468794433	0.935224688570352	0.230351502384961	0.867198473753461	41635	51	CLTA DNM2 SEC24B CLTC HLA-DRA HLA-DRB1 KIF22 AP2S1 SEC23A RAB7A
GO_RESPONSE_TO_IONIZING_RADIATION	0.228109089075969	0.678581724490818	-0.279097674790288	-1.14037664337481	9049	56	GADD45A SOCS3 GATA3 BAK1 RNF168 C12orf5 MYC PMAIP1 POLG ELK1 H2AFX MGMT UIMC1 EEF1D ERCC1 ITGB1 NIPBL GPX1 LZIC DCLRE1C
GO_PROTEIN_EXPORT_FROM_NUCLEUS	0.560670731707317	0.887473343995735	0.323603016862015	0.925190620593243	31262	16	CALR HSPA9 STYX DUSP16
GO_EPITHELIUM_DEVELOPMENT	0.459601488942413	0.842744745678756	0.212185716236604	0.999675805331344	31484	202	SKI RBPJ FABP5 PGK1 PCNA PAFAH1B1 CTNNB1 LUZP1 RAB10 AHI1 STK4 PLOD3 SMAD7 LGALS3 SEC24B PPHLN1 MED1 LMO4 AREG PML ATP2C1 PHB2 VIM DEAF1 KRAS CDK6 PRKX CTSB RAP1B GRSF1 CD109 CASP3 LATS1 PDPK1 ITPK1 SETD2 EP300 PDCD10 ZFP36L1
GO_INTRINSIC_APOPTOTIC_SIGNALING_PATHWAY_IN_RESPONSE_TO_DNA_DAMAGE_BY_P53_CLASS_MEDIATOR	0.27661406025825	0.733503118337542	0.403055591615221	1.15234788771784	15423	16	PML SNW1 EP300 HIPK1 CDKN1A TOPORS IFI16 RPS27L SHISA5
GO_REGULATION_OF_AUTOPHAGY	0.917209188060435	0.991918061895442	0.175860277063059	0.780889021404315	59735	130	ATP6V0A2 ATP6V0B EXOC1 TRIM13 WBP11 ATP6V0E1 FBXW7 GAPDH VPS26A MTDH CHMP4B WAC GOLGA2 PLEKHF1 SNRNP70 CASP3 FOXO1 IFT20 PARL TBK1 EP300 SCFD1 RAB7A PARK7 PIK3CB NRBF2 SUPT5H SNX5 KAT8 TRIM8 VMP1 PRKAA1 CISD2 TBC1D14 HMGB1 TSPO AMBRA1 U2AF1 CAPNS1
GO_PHOSPHOLIPID_METABOLIC_PROCESS	0.90291517656712	0.988782426018812	0.179110889678904	0.786777160168108	58321	121	PLCD1 FABP5 FAR1 SERINC3 PAFAH1B1 PGS1 DPM2 ALG5 PMVK DPM1 GPAA1 IP6K1 ETNK1 PLCB2 PISD PIK3CA DGKE GDE1 SMG1 PIK3CB SERINC5 MTMR14 SAMD8 IMPA1 SYNJ1
GO_AMMONIUM_ION_METABOLIC_PROCESS	0.0977808259442512	0.479296917685777	-0.339883602798147	-1.30457944185782	3991	42	GCH1 ODC1 SAT2 ALDH9A1 AKR1B1 AKR7A2 SGMS1 SMPD1
GO_REGULATION_OF_INTERLEUKIN_4_PRODUCTION	0.0223712639539071	0.267137875202391	-0.556095544491786	-1.63118771594464	993	15	GATA3 CD3E HLA-E CD83 HLA-DRB5 LEF1
GO_REGULATION_OF_FAT_CELL_DIFFERENTIATION	0.154244663949713	0.582589291418185	-0.387580362765612	-1.26880874153573	6698	22	GATA3 SIRT2 ARNTL WDFY2 ZC3H12A MTOR CCRN4L ASXL1 TAF8 SMAD3
GO_REGULATION_OF_RNA_STABILITY	0.0504397999341476	0.370213089035327	0.310852100951113	1.3357342397328	3216	105	PSMF1 EXOSC7 PSMB3 PSMB2 HNRNPD SYNCRIP DHX9 HSPA1A YBX1 PSMA3 PSMD8 KHSRP YTHDF2 SERBP1 PSMB6 PSMA1 PSMC6 PSMA7 PSME4 MYD88 PSMD7 ZFP36L1 ZC3H14 MAPKAPK2 RC3H1 YWHAB PSMB10 HNRNPU
GO_NEGATIVE_REGULATION_OF_CELL_DEVELOPMENT	0.120438015324057	0.524710902304029	0.309107865370991	1.24907461596879	7434	73	SKI PAFAH1B1 CTNNB1 CALR GDI1 CIB1 ACTN4 ARHGDIA SMAD7 MED1 EIF4E VIM ZNF706 CDK5RAP2 MAD2L2 CTDSP1 CTDP1 DICER1 REST DGUOK
GO_CELLULAR_PROTEIN_COMPLEX_DISASSEMBLY	0.757682514772527	0.958994093323684	0.20518028664796	0.851253711423371	47314	85	STMN1 MRPL14 GADD45GIP1 MRPS23 MRPL11 MRPS25 MRPL23 MRPS35 MRPL27 MRPL2 MRPL51
GO_SOMATIC_STEM_CELL_POPULATION_MAINTENANCE	0.00885612769793711	0.197332691525829	0.549308281341168	1.70449833771408	500	22	POLR2H SKI RBPJ POLR2I POLR2C POLR2D CUL4A POLR2B BRAF BCL9L
GO_CYTOPLASMIC_MICROTUBULE_ORGANIZATION	0.7728915022493	0.963129208577116	0.259092622615243	0.785238844524164	43638	20	PAFAH1B1 CIB1 KPNB1 ATAD1 DLG1 TUBGCP3 TUBGCP2
GO_NEGATIVE_REGULATION_OF_PEPTIDYL_TYROSINE_PHOSPHORYLATION	0.29031237285837	0.7471579148489	-0.37907415830763	-1.13283541634313	12843	16	SOCS1 SNX6 GNB2L1 IBTK
GO_NUCLEOSIDE_DIPHOSPHATE_METABOLIC_PROCESS	0.687206009688517	0.932624769562003	-0.24872529150239	-0.858496466948042	29364	27	GPI CMPK1 PFKP ADPGK
GO_MICROTUBULE_POLYMERIZATION_OR_DEPOLYMERIZATION	0.193431707755983	0.644216401052417	0.444065604716583	1.24607829753494	10748	15	STMN1 BLOC1S2 ZNF207 GOLGA2
GO_REGULATION_OF_GLUCOSE_IMPORT	0.523032412639573	0.866859623402583	-0.31787398212587	-0.94994316282034	23139	16	TNF AKT2 PIK3R1 NFE2L2 LMBRD1 SIRT6
GO_NEGATIVE_REGULATION_OF_PROTEOLYSIS	0.150966848655538	0.577082953731652	0.280113190120503	1.19775511022034	9594	102	CASP8 PSMF1 NR1H2 PTTG1 HERPUD1 TRIAP1 TIMP1 YWHAE ZNF207 PML APC CSNK2A1 DNAJC1 WAC CDKN2D CD109 MAD2L2 TNFAIP8 USP47 FHIT HTT EP300 SERPINB9 CAST PARK7
GO_PHOSPHATIDYLCHOLINE_METABOLIC_PROCESS	0.124455641533201	0.531026327823569	0.478850429858805	1.34368688336751	6915	15	FABP5 SLC44A2 PNPLA6 LPIN1 PNPLA8 PCYT1A LPIN2 AGPAT6 MECP2 PEMT ABHD3 DBI LPCAT4
GO_METENCEPHALON_DEVELOPMENT	0.0178799043145746	0.254403281034325	0.492333698303019	1.60838938135435	1023	27	RERE HNRNPD HSPA5 OGDH SEC24B MTPN GART RORA NCOA2 EZH2 AGTPBP1 PTPN11 MAP2K1
GO_ACTIN_FILAMENT_BUNDLE_ORGANIZATION	0.432462366077483	0.834187164361035	-0.339581579211017	-1.01481473014518	19132	16	ZYX NEDD9 LCP1 CUL3 EZR LIMA1 ITGB1 CORO1B
GO_NEGATIVE_REGULATION_OF_PROTEIN_MODIFICATION_BY_SMALL_PROTEIN_CONJUGATION_OR_REMOVAL	0.0286428878658022	0.290069907788479	0.336392596061398	1.41165379559288	1797	91	PSMF1 PSMB3 PSMB2 ANAPC11 CTNNB1 HSPA1A PSMA3 UBR5 SMAD7 PSMD8 PML OTUB1 PSMB6 PSMA1 PSMC6 USP4 MAD2L2 UBE2E1 GTPBP4 PSMA7 PSMD7 ISG15 PARK7 HDAC8 PSMB10 SUFU TRIP12 CDC27 PSMC3 PSMB1 BUB3 PSMA5 TSPO
GO_AMINO_ACID_ACTIVATION	0.459678952188413	0.842744745678756	0.294966646692429	0.995908086844351	26602	31	HARS TARS CARS MARS FARSB SARS FARSA GARS
GO_REGULATION_OF_PROTEASOMAL_UBIQUITIN_DEPENDENT_PROTEIN_CATABOLIC_PROCESS	0.531712405713369	0.869619975969104	0.232474867917831	0.960252445196024	33130	83	UBE2K RAD23B ANAPC11 HERPUD1 VCP ZNF207 SMAD7 NUB1 APC ARIH2 CSNK2A1 WAC GOLGA2 MAD2L2 FHIT CSNK1A1 PARK7 LCMT1
GO_NEGATIVE_REGULATION_OF_NEURON_DIFFERENTIATION	0.528472770655151	0.868133908694378	0.259698917252266	0.957435455894733	31450	46	PAFAH1B1 CALR GDI1 CIB1 ARHGDIA MED1 EIF4E VIM CDK5RAP2 CTDSP1 REST DGUOK
GO_MUSCLE_TISSUE_DEVELOPMENT	0.0396982216633735	0.334929656557976	-0.332302717920061	-1.39637003311432	1546	64	PTEN UBE4B ZFAND5 FLNB SIK1 HMG20B BTG2 GPCPD1 MEF2A EEF2 VAMP5 FOS MYL6B ARID1A MTOR TGFBR3 KDM6B RB1 FKBP1A LMNA FOXN2 IFRD1 ITGB1 FAM65B GPX1 SIRT6 ATF3 CDK5
GO_POSITIVE_REGULATION_OF_ADAPTIVE_IMMUNE_RESPONSE	0.0562659248696791	0.386099784382101	-0.420757983845662	-1.43819948625146	2406	26	GATA3 STAT6 EIF2AK4 TNF HLA-E HLA-A IL27RA ADA PYCARD B2M CD28 ANXA1
GO_REGULATION_OF_OSTEOCLAST_DIFFERENTIATION	0.000204396802325581	0.0333039039789244	-0.671081009730582	-2.07768207051109	8	18	RASSF2 CAMK4 TOB2 TNF INPP5D FOS PIK3R1 KLF10 MTOR CCL5
GO_REGULATION_OF_PROTEIN_BINDING	0.764122112319674	0.960514309691428	0.213813410618708	0.837091271930193	46505	62	HSPA5 TFIP11 MFNG HERPUD1 STK4 PLCL2 ADD1 TMEM173 GOLGA2 SPAG9 GTPBP4 TIAM1 ANXA2 EP300
GO_CARDIAC_SEPTUM_DEVELOPMENT	0.613903208956919	0.905229448954008	-0.29313763635125	-0.890728101445657	27031	17	TRIP11 GATA3
GO_REGULATION_OF_HISTONE_METHYLATION	0.263987473903967	0.725200573727757	0.347805620459029	1.14675327165801	15173	28	CTCF CTNNB1 SUPT6H RNF20 WDR61 SNW1 JARID2 PHF19 EED DNMT1
GO_COGNITION	0.126248471259682	0.531464973933387	-0.298161767851616	-1.23649481504789	4954	60	PTEN GPI CAMK4 EIF2AK4 SLC1A4 ATP8A1 SGK1 BTG2 APP RIC8A FOS DGCR2 ARF4 PRKAR1B
GO_PHOSPHATIDYLINOSITOL_METABOLIC_PROCESS	0.511014770378585	0.863477605404593	-0.236851414977669	-0.967760916653135	20273	56	PTEN SH3YL1 MTM1 DPM3 CDIPT INPP5D PIGS INPP4B PIK3R1 IP6K2 INPP5K FAM126A PIK3C3 PGAP1 TMEM55B CD28 MPPE1 PI4KA GRB2 PIGC
GO_CELL_PART_MORPHOGENESIS	0.0379365716579687	0.329007511144397	-0.274817398456756	-1.31154424566413	1322	130	PTEN TMEM138 GATA3 EVL MTM1 AFG3L2 ILK FLOT1 PTPRA EIF2AK4 DNAAF2 SGK1 MEF2A CNP OFD1 APP ZNF280D PQBP1 FIS1 VASP NR4A3 KIDINS220 IFT52 DYNLT1 NDEL1 SNX2
GO_RESPONSE_TO_ORGANOPHOSPHORUS	0.0251422808155032	0.286943549607593	-0.412393489524195	-1.52798337836444	1046	36	PTEN JUNB DUSP1 FOSB P2RX4 APP FOS CASP1 STAT1 SELL INPP5K EZR AKAP9 ITPR2 BIRC2
GO_AXO_DENDRITIC_TRANSPORT	0.0580529062443765	0.38912216888912	0.526912212250117	1.47855151449985	3225	15	AP3D1 PAFAH1B1 BLOC1S2 AP3B1
GO_SINGLE_ORGANISM_MEMBRANE_FUSION	0.0578901482127289	0.38912216888912	-0.339140668734711	-1.36507874674414	2323	52	SNAP23 AFG3L2 BAK1 ZFYVE20 LRMP UVRAG VAMP5 CHCHD3 FIS1 BCL2A1 STX11 SNAPIN FAM73A STX16 VCPIP1
GO_REGULATION_OF_PROTEIN_UBIQUITINATION_INVOLVED_IN_UBIQUITIN_DEPENDENT_PROTEIN_CATABOLIC_PROCESS	0.0407863610408679	0.33648747858716	0.351420463285437	1.40114483106397	2499	68	PSMF1 PSMB3 PSMB2 ANAPC11 PSMA3 PSMD8 PML FBXW7 PSMB6 GOLGA2 PSMC6 UBE2E1 PSMA7 PSME4 PSMD7 PSMB10 SUFU UBE3A CDC27 PSMC3 PSMB1 BUB3 PSMA5 PSMD1 PSMD9 PSMC4
GO_REGULATION_OF_TYROSINE_PHOSPHORYLATION_OF_STAT_PROTEIN	0.183907523902528	0.628370792678754	-0.408335047262806	-1.24076698553407	8097	17	SOCS3 SOCS1 IL6R ARL2BP CCL5
GO_ORGAN_REGENERATION	0.0652369242409912	0.403973067687088	-0.395572739567527	-1.4008229646578	2758	30	SOCS3 SOCS1 UCP2 BAK1 NCL NR4A3 TGFBR2 LCP1 TGFBR3 GSTP1 LEF1 FPGS
GO_GLAND_MORPHOGENESIS	0.463205529334818	0.844105224240116	0.320683906518958	0.995079091577963	26203	22	MKI67 MED1 AREG PML PHB2
