pathway	pval	padj	ES	NES	nMoreExtreme	size	leadingEdge
GO_NEGATIVE_REGULATION_OF_DEVELOPMENTAL_PROCESS	0.0206701217307461	0.268569301702653	0.279657998539043	1.34477949386539	1028	190	TOB1 ANXA1 RAP1GAP2 CTDP1 FOXO1 DUSP10 ID1 SKI TNF PTGER4 ITGB1 HDAC3 HIST1H4C NOTCH1 C3orf17 IFNG PHB2 PAF1 ABCG1 TGFB1 TIMP1 PAFAH1B1 ARHGDIB DDX6 RORA ARHGEF2 LGALS1 CCL3 EZH2 REST RBPJ STRAP ARHGAP4 HOPX MECP2 GPR56 PTK2B CUL4A CERS2 HMGB1 GNAS SIRT2 FBXW7 AXIN1 IRF1 GABPA IL4R THBS1 HDAC1 ZBTB16 YWHAH PRPF19 BCOR ATF5 KLF13 INSIG1 RNF10 NFKBID RARA PHF14 CIB1 ID2 INPP5D CD74 HNRNPK CXCR3 PDE3B LEO1 DICER1
GO_REGULATION_OF_HOMOTYPIC_CELL_CELL_ADHESION	0.244003043530495	0.665003615738127	0.246186628387134	1.10799294191876	12185	121	CCL5 ANXA1 CD3E HLA-DRB5 ZBTB1 HLA-DQB1 LCK HLA-DRA HLA-DMB NR4A3 IFNG LGALS3 RDX SPN CCDC88B TGFB1 ITCH GLMN LGALS1 C10orf54 PRNP AP3D1 RAC1 LAT HMGB1 DHPS RASGRP1 IRF1 NCK1 IL4R CORO1A CD247 ZBTB16 FYN SART1 VAV1
GO_ORGANIC_HYDROXY_COMPOUND_BIOSYNTHETIC_PROCESS	0.640462216445645	0.900561772454944	-0.245406095553614	-0.892135832002751	31536	41	SLC44A1 SPTLC2 CNBP CHKA MVD FDPS DDT SAMD8 SLC44A2 NR4A2
GO_REGULATION_OF_TYPE_I_INTERFERON_MEDIATED_SIGNALING_PATHWAY	0.0893772594514001	0.468848658019631	-0.49146803826589	-1.41070657646511	4375	16	STAT1 IRF7 JAK1 ADAR MUL1 PTPN2
GO_RHYTHMIC_PROCESS	0.188812721693037	0.606721507534564	0.274218646023211	1.1627590932615	9474	85	ANXA1 CREM ID1 CSNK1D PPP1CA HDAC3 EP300 NAMPT CRY2 NR1D2 TOP1 RORA NCOR1 PER1 EZH2 CREBBP
GO_STEROID_HORMONE_MEDIATED_SIGNALING_PATHWAY	0.334946443396035	0.743592809686228	-0.291049087134856	-1.07526437930064	16541	44	JAK2 LEF1 SAFB NCOA3 NRIP1 MED30 TAF7 MED17 NCOA4 CALR
GO_REGULATION_OF_RESPONSE_TO_BIOTIC_STIMULUS	0.0948236096347847	0.480975127383051	-0.298270440721814	-1.26711833014792	4727	89	EIF2AK2 HERC5 MBD5 C1QBP HSPD1 ANKRD17 MRPS10 NCR3 MUL1 PML HLA-A TRAF3 AP1M1 CD55 CD226 TMEM39A TRIM38 ZC3HAV1 FOXP1 SNRPD1 HAVCR2 B2M TSPAN32 PCBP2 BIRC2 AP1S2 SEC14L1 BIRC3
GO_PEPTIDYL_PROLINE_MODIFICATION	0.218217668821401	0.634744522460355	-0.389009044016598	-1.2030559968753	10734	21	FKBP5 RANBP2 FKBP3 PPP2R4 PPIH CRTAP
GO_PHOSPHOLIPID_TRANSPORT	0.495660351482142	0.838625887586946	0.337432411825421	0.971405755269573	25298	16	PITPNB ABCG1 PITPNC1 SCP2 OSBPL5
GO_REGULATION_OF_DNA_BIOSYNTHETIC_PROCESS	0.796247029914096	0.950755815267188	-0.220473364513759	-0.801496751909151	39207	41	ACD TEN1 MAPKAPK5 PRKD2 ATM PML TNKS2 HNRNPC
GO_FIBROBLAST_GROWTH_FACTOR_RECEPTOR_SIGNALING_PATHWAY	0.970994223168136	0.996630035227854	-0.175927413004487	-0.621155026388983	47903	36	SETX POLR2F POLR2G PTBP1 RAB14 FIBP IQGAP1
GO_REGULATION_OF_CELL_CYCLE_ARREST	0.291573644176627	0.702360865686361	0.296926715460696	1.10375399330658	14757	44	UBC CAST CDKN1A EP300 TGFB1 CNOT1 PPP2R5C RRP8 UHRF2 CCNK BTG2 RBL2 MDM2 SLC25A33 CNOT6L CNOT8 ID2 BAX E2F4 MDM4
GO_REGULATION_OF_MRNA_SPLICING_VIA_SPLICEOSOME	0.761118245579374	0.940422511067348	0.222817141613364	0.828269391157099	38523	44	HSPA8 MBNL2 SFSWAP RBM5 SNRNP70 SF3A1 MAGOH DAZAP1 PRPF19 SRSF4 SRPK2 RBM25 HNRNPK DYRK1A SNW1 SAP18 ACIN1
GO_REGULATION_OF_ANATOMICAL_STRUCTURE_MORPHOGENESIS	0.0320982160915821	0.325624464896008	0.250866954289488	1.26484308745481	1586	281	CCL5 ANXA1 RAB11A ODF2 MYH9 FMNL1 ID1 TNF PTGER4 ZEB2 DDHD2 AKAP13 CSNK1D ATG3 ANXA7 UBC PSMD1 NOTCH1 S100A10 CSNK1G2 IFNG EP300 PHB2 RDX AHI1 FLNA TGFB1 PRPF40A DNM1L FRS2 CDC42SE2 PSMB1 PSMD12 AP2S1 PAFAH1B1 HIPK1 C21orf2 ARPC2 TMBIM1 PSMD13 PFN1 CCL3 TNFAIP3 TBC1D22A EZH2 PSMB3 RBPJ CAPZB TRPV2 STRAP UNC13D ARHGAP4 PSMB4 MTDH PSMA7 GOLGA4 ITGB2 CFL1 PSME4 CITED2 PTK2B RAC1 HMGB1 ZC3H12A FBXW7 PSME3 PSMD8 IL4R VDAC3 AGGF1 PSMA4 PSMB6 CORO1A THBS1 TBC1D5 YWHAH BCOR FYN OPA1 SEPT9
GO_FEMALE_GAMETE_GENERATION	0.900185445578855	0.975267108956792	-0.225769607327359	-0.670265254739777	44172	18	NRIP1 ATM KIAA0430 IMMP2L
GO_EXTRACELLULAR_MATRIX_DISASSEMBLY	0.278650354363677	0.699475071536634	-0.400596172568414	-1.14986857974124	13642	16	CAPG GSN FLOT1 ADAM10
GO_PROTEIN_HOMOOLIGOMERIZATION	0.461607249314415	0.820156928332199	0.238757461470976	0.994344963982913	23228	77	ZBTB1 CAT SKI NUP54 BRK1 ATL3 DNM1L DERL1 P2RX4 USP16 PRNP ANXA6 DHPS GCH1 ALOX5AP KCTD10 SMARCAD1 SPAG9 SOD2 CRTC2 KCTD5 TAF10 BAX GOLGA2
GO_REGULATION_OF_OXIDATIVE_STRESS_INDUCED_CELL_DEATH	0.827356994755458	0.95990615412318	-0.240794523414722	-0.744685245406403	40700	21	ATF4 BAG5 HIF1A GPX1 UBQLN1
GO_TRANSCRIPTION_FROM_RNA_POLYMERASE_I_PROMOTER	0.451724559188826	0.81726322618577	-0.342498031405659	-1.00079470779961	22185	17	TAF1D POLR2F ERCC3 POLR1D
GO_BODY_FLUID_SECRETION	0.766862141330143	0.941491562062879	0.276302303105207	0.781007361197782	39099	15	AGPAT6 NCOR1 ANXA2
GO_POSITIVE_REGULATION_OF_CHROMOSOME_ORGANIZATION	0.940546536250882	0.988036690841214	-0.176903482747547	-0.726485033089108	46636	74	ACD GNL3 SMC5 DNMT1 MAPKAPK5 PRKD2 ATM PML RAB1A ATRX TNKS2
GO_RESPONSE_TO_VITAMIN	0.50254715682225	0.840301146774142	0.304052588037909	0.966915207228951	25549	23	CCL5 CAT ITGB1 ATP2B1 TGFB1 PEMT MDM2
GO_REGULATION_OF_ATPASE_ACTIVITY	0.324716081831199	0.735708278935647	0.336967353628371	1.09561193637662	16554	25	DNAJB6 ATP1B3 GABARAPL2 SNRNP70 DNAJB11 PFN1 AHSA1 DNAJC2 ATP1B1
GO_NEGATIVE_REGULATION_OF_STRESS_ACTIVATED_PROTEIN_KINASE_SIGNALING_CASCADE	0.00444112560918095	0.123616108571861	0.611691344034381	1.78951685781266	225	17	FOXO1 DUSP10 HDAC3 ITCH NCOR1 PER1 DNAJA1
GO_POSITIVE_REGULATION_OF_CYTOKINE_BIOSYNTHETIC_PROCESS	0.0769321533923304	0.441913897292245	0.469756400970211	1.41820656638712	3911	19	CD3E TNF BCL3 IFNG SPN GLMN CEBPG IRF1 THBS1 MAPKAPK2 CARD11 PRKCQ TBK1
GO_REGULATION_OF_CYSTEINE_TYPE_ENDOPEPTIDASE_ACTIVITY	0.0791338109914742	0.444914818638466	-0.302387697612468	-1.28952068600049	3953	91	IFI6 PSMB9 JAK2 LEF1 GSN HSPD1 PDCD2 TNFSF10 TRIAP1 IFI16 PYCARD PDCD6 MICAL1 MUL1 PML BID NDUFA13 GPX1 S100A8 BIRC2 TNFSF14 BIRC3 DAP FAM162A BCL10 ASPH BCAP31
GO_REGULATION_OF_CELLULAR_RESPONSE_TO_STRESS	0.855447038272193	0.964076107822353	-0.172408602103622	-0.871622226806361	43093	305	EIF2AK2 SPTLC2 ATF4 NUP155 CALCOCO2 SVIP RNF5 RANBP2 RPL28 BAG5 TNFRSF11A TRIAP1 APEX1 DTNBP1 PTTG1IP RAE1 DDIT3 NUPL2 ATP6V0E1 QSOX1 PYCARD RAB7A PPP1R15B TXNDC12 RAB3GAP1 UBE2G2 HYOU1 HIF1A NSMCE4A PRMT1 MUL1 EPHA4 ATM PTPN2 TMBIM6 ARNTL MLST8 PML HSF1 HELB MAP4K5 PIKFYVE MTMR3 ATP6V0C HAX1 UIMC1 UBAC2
GO_POSITIVE_REGULATION_OF_EPITHELIAL_CELL_MIGRATION	0.792132513312243	0.950551419899164	0.237317142770596	0.786094346158366	40313	27	RAB11A IFNG TGFB1 PFN1 PTK2B ZC3H12A AAMP THBS1
GO_HOMOTYPIC_CELL_CELL_ADHESION	0.727767944936087	0.932987104343652	0.270879998420089	0.817793630206784	37006	19	RAP2B MYH9 PLEK ACTG1 ACTB GNAS CLIC1
GO_POSITIVE_REGULATION_OF_IMMUNE_EFFECTOR_PROCESS	0.601083616367459	0.888970872887734	-0.232792801007758	-0.921658079247725	29731	61	FCER1G HLA-E HSPD1 ANKRD17 HLA-B XCL1 NCR3 HLA-A MALT1 CD226 TNFRSF14 ZC3HAV1 B2M
GO_UROGENITAL_SYSTEM_DEVELOPMENT	0.33814652621612	0.745035837587809	0.275779727361003	1.06723391855083	17141	53	ANXA1 CAT TET2 EGR1 NOTCH1 MPST TIPARP AHI1 TGFB1 FRS2
GO_NEGATIVE_REGULATION_OF_CELL_ACTIVATION	0.0954467404819705	0.482008447404001	0.342763149344213	1.31005724105304	4835	50	ANXA1 HLA-DRB5 SAMSN1 LGALS3 SPN TGFB1 ITCH GLMN TNFAIP3 C10orf54 PRNP PRDM1 HMGB1 ZC3H12A IRF1 IL4R PIBF1 SLA2 NFKBID PTPN6 ID2 INPP5D CD74
GO_CELLULAR_RESPONSE_TO_ALCOHOL	0.0514019609769516	0.405761460445068	0.440808443920659	1.46014325581132	2615	27	CCL5 FOXO1 ITGB1 ATP2B1 EP300 KLF6 TGFB1 RORA
GO_PEPTIDYL_TYROSINE_AUTOPHOSPHORYLATION	0.264963012777404	0.689426142020546	-0.390591372316783	-1.15958843514958	13001	18	JAK1 TEC JAK2 TXK ITK
GO_CELL_JUNCTION_ASSEMBLY	0.0581624217612093	0.411494943584348	0.430948968969993	1.44007814419966	2954	28	VMP1 ITGB1 FLNA HIPK1 TBCD ACTG1 MTDH PTK2B ACTB
GO_MACROMOLECULE_CATABOLIC_PROCESS	0.99948732105533	1	-0.140657075374007	-0.742797686594709	50687	467	ISG15 ISG20 USP10 PSMB9 HERC5 CLPP CD2AP UBE2L6 STT3B RNF5 RPL28 USP46 CTSW RPL12 DNAJB9 DDIT3 FBXL5 USP15 RPL36 TCIRG1 ABCE1 SKP1 RAB7A UBE2E1 UBE2G2 RPS12 PSMB10 PSME2 PABPC4 RPS29 RPL32 CRBN MARCH6 PCNP ATM POLR2G ARNTL RNASEH1 CUL5 PSMD3 RPS15 PSMC2 RAD23A PSMC1 PML RPLP1 USP4 RPL38 TRIM38 CTBS RPL41 PSMD6 PSMB2 FBXO6 CALM3 PSMC6 USP14 UBQLN2 UBXN2A RPL18A PSMA1 UBE4A RPL8 PCBP2 RNF145 RPL9 BIRC2 SUPV3L1 PDCD6IP RPL30 UBQLN1 UBE2D3 RPS20 RNF213 DCP1A LSM7 NDFIP1 DERL2 C18orf25 VPS28 VPS36 CNOT7 RPS24 RNF115 SKIV2L2 UBR4 FBXL12 NUB1 EDEM2 AUP1 RPL13 USP38 CTSS LNPEP
GO_INTERACTION_WITH_SYMBIONT	0.0294297372415289	0.316885986526111	0.446418642740048	1.52895329179735	1492	31	CCL5 SMARCA4 CCL4 EP300 TUSC2 CCL3 REST INPP5K CCNK YTHDC2 TAF11 CFL1 ZC3H12A
GO_REGULATION_OF_POLYSACCHARIDE_METABOLIC_PROCESS	0.0121470974314767	0.198807494628501	0.587137067608518	1.69025946121055	619	16	PTGER4 PPP1CA TGFB1 INPP5K HMGB1 NFKB1 PPP1CB DYRK2 GSK3B
GO_EYE_DEVELOPMENT	0.0700300015790305	0.441913897292245	0.346170458372712	1.34986362473296	3547	55	ATP2B4 SMARCA4 SKI GNB1 ATP2B1 AHI1 TGFB1 FRS2 HIPK1 AGTPBP1 PRDM1 HMGB1 FKBP8 AXIN1 HDAC1 RARA HNRNPK BAX RING1 VIM MAN2A1 MED1 ARID1A MTERFD2 KDM2B TBC1D20
GO_DEVELOPMENTAL_PROCESS_INVOLVED_IN_REPRODUCTION	0.188175473579262	0.606721507534564	0.249378789548359	1.14117101450572	9436	134	ANXA1 DNAJB6 ODF2 SMARCA4 HMGB2 NOTCH1 DLD UBE2B TIPARP PHB2 NASP TGFB1 FRS2 PAFAH1B1 DIAPH2 KIAA0196 TMF1 ARID4A ZFP36L1 RBPJ SETD2 DAZAP1 WDR48 PSME4 CITED2 PTK2B ABHD2 PRDM1
GO_PROTEIN_DEPHOSPHORYLATION	0.534345079655159	0.84852339621825	0.236254907152086	0.957710219813199	26899	67	CTDP1 CDC14A DUSP10 PPP1CA LCK PPP3CC TIMM50 PPP2R1A PTPRA PTPN18 NCK1 MTMR6 PPM1D PTP4A2 PTPRE PPM1A PPP6C PPP1CC PPP1CB MTMR14 PTPN6 PPP3R1 PTPN1
GO_REGULATION_OF_CELLULAR_PROTEIN_CATABOLIC_PROCESS	0.600235214383958	0.888970872887734	0.202086564998904	0.943042587711447	30111	153	CD81 ARIH1 CSNK1D UBC PSMD1 GABARAPL2 MYLIP RDX HERPUD1 WAC UBE2K PSMB1 PSMD12 GLMN TMF1 PARK7 UBE2D1 PSMD13 TNFAIP3 PSMB3 ANAPC5 CDC16 PSMB4 PSMA7 ANAPC11 PSME4 PTK2B MDM2 SIRT2 FBXW7 ANXA2 PSME3 AXIN1 PSMD8 TAF9 PSMA4 PSMB6 SGTA RFWD2
GO_REGULATION_OF_NEURON_DEATH	0.685644449743651	0.917306334670661	0.213580308941602	0.88949054531564	34502	77	CCL5 F2R PRDX2 NR4A3 PICALM PARK7 CCL3 REL RRAS2 BTBD10 MECP2 BTG2 PTK2B MCL1 FBXW7 CORO1A OXR1 FYN PMAIP1 SRPK2 SOD2
GO_RESPONSE_TO_GAMMA_RADIATION	0.932881022615536	0.98434603133859	0.21206997079461	0.640244655513514	47436	19	EGR1 POLG XRCC6 PRKAA1 BAX PRKDC CYBA GATA3
GO_REGULATION_OF_CYCLIN_DEPENDENT_PROTEIN_KINASE_ACTIVITY	0.707327455153542	0.923960572209614	-0.240635827014371	-0.849624006438576	34895	36	CCND3 HERC5 PIM1 LATS1 CDK5RAP3
GO_POSITIVE_REGULATION_OF_PROTEIN_IMPORT	0.479382053508011	0.830997198530453	0.285096321102495	0.983831540623905	24296	32	TNF HDAC3 EP300 FLNA TGFB1 PARP1 DMAP1 ZC3H12A KPNA1 TPR HSP90AA1 PPP3R1 UBR5 PIK3R1 PRKCQ MED1
GO_MULTI_ORGANISM_METABOLIC_PROCESS	0.280325177205558	0.700345001929413	-0.245290772086821	-1.08751547304	13999	115	NUP155 RANBP2 RPL28 RPL12 RAE1 RPL36 NUPL2 RPS12 RPS29 RPL32 USF2 RPS15 PTBP1 RPLP1 RPL38 RPL41 RPL18A RPL8 PCBP2 RPL9 POM121C RPL30 RPS20 RPS24 RPL13 NUP50 RPL11 RPL35 RPL29 RPS18 RPL13A UBA52 RPSA RPL39 NUP133
GO_MONOVALENT_INORGANIC_CATION_HOMEOSTASIS	0.806553121189474	0.955799884945703	0.244219426111347	0.767291695779645	41009	22	ATP5B ATP1B3 ATP6V1H ATP6V1E1 ATP1B1
GO_REGULATION_OF_BMP_SIGNALING_PATHWAY	0.00419714829270206	0.122666655459328	0.637464316141871	1.80188264018249	213	15	TOB1 SKI NOTCH1 C10orf54 RBPJ FKBP8 TRIM33 PPM1A LEMD3
GO_HEART_PROCESS	0.468574237954769	0.823039346182322	0.328040371975934	0.990362257151752	23826	19	CXCR4 AKAP13 TAZ DNM1L ATP1B1 PDE4D MAP2K3 CAMK2D ATP1A1 TTN
GO_MUSCLE_SYSTEM_PROCESS	0.412042670560558	0.790284965801695	-0.265671928933803	-1.02133943750459	20316	53	PSMB9 NUP155 TMOD3 UTRN GSN SMAD5
GO_MESENCHYME_DEVELOPMENT	0.184693456068921	0.604563246198934	0.388099571986881	1.23419234973384	9389	23	S100A4 TGFBR3 ZEB2 NOTCH1 TGFB1 HNRNPAB ZFP36L1 RBPJ CITED2 MDM2
GO_TRANSCRIPTION_FROM_RNA_POLYMERASE_III_PROMOTER	0.84768198894593	0.96308600140943	0.231662667853588	0.736708600115372	43096	23	GTF3C5 POLR2E GTF3C1 POLR3GL ELL TROVE2 GTF3C2 POLR1C IVNS1ABP POLR2L
GO_POSITIVE_REGULATION_OF_PROTEOLYSIS	0.875788374241755	0.971743470249628	0.17597495218389	0.837172342554039	43601	176	F2R MYH9 ARIH1 TNF CSNK1D LCK UBC PSMD1 IFNG EP300 PICALM NLRP1 HERPUD1 PSMB1 PSMD12 UBE2D1 PSMD13 TNFRSF1B REST PSMB3 ANAPC5 CDC16 PSMB4 PSMA7 ANAPC11 PSME4 PTK2B AURKAIP1 HMGB1 MDM2 RPS27L SIRT2 FBXW7 PSME3 AXIN1 PSMD8
GO_REGULATION_OF_CILIUM_ASSEMBLY	0.437384464110128	0.808755682664609	0.335069253412238	1.01158262963999	22240	19	ODF2 ATG3 TBC1D22A VDAC3 TBC1D5 SEPT9
GO_REGULATION_OF_PROTEIN_KINASE_B_SIGNALING	0.763599771117381	0.941083051251592	0.231543378355523	0.81682968763877	38699	35	TNF ARFGEF1 BAG4 TGFB1 PARK7 CCL3 INPP5K MTDH TXN
GO_REGULATION_OF_DNA_TEMPLATED_TRANSCRIPTION_IN_RESPONSE_TO_STRESS	0.464604743083004	0.820578880768903	0.274142745284273	0.991352772357391	23508	39	EGR1 UBC EP300 BACH1 UBE2D1 RBPJ CREBBP TCEB2 CITED2 SIRT2 NCK1
GO_REGULATION_OF_MAP_KINASE_ACTIVITY	0.8020535767794	0.953531007745001	0.191539363767577	0.84812061109565	40149	109	F2R DUSP10 CD81 CXCR4 TNF ZEB2 GNAI2 UBC TGFB1 FRS2 EZH2 INPP5K PTK2B MBIP PTPLAD1 TRAF7 DNAJA1 PPP2R1A AXIN1 RASGRP1 THBS1 MAP2K3 GPS1 PDE6G SPAG9 MAP2K2 MAPKAPK2 PTPN6 TAB2 CD74 PIK3R5 MADD PRKAA1 PTPN1 MAPK8IP3
GO_LYTIC_VACUOLE_ORGANIZATION	0.319944570112694	0.729940449505538	-0.372928322508718	-1.10715033810351	15699	18	RAB7A LYST HOOK3 ATP6V0C RAB14
GO_REGULATION_OF_CHEMOTAXIS	0.469378481962938	0.823039346182322	0.276730454139208	0.988852312131528	23758	37	CCL5 CXCR4 CCL4 NOTCH1 TGFB1 CCL3 PTK2B RAC1 HMGB1
GO_NEGATIVE_REGULATION_OF_RESPONSE_TO_STIMULUS	0.200560954412578	0.614703050041048	-0.207663761733561	-1.08863615433585	10153	433	IFI6 EIF2AK2 BST2 STAT1 IGFBP4 ITPR1 PSMB9 SOCS1 ATF4 STK38 DHRS3 LEF1 SVIP TAP1 C1QBP PLCL2 ADAR HLA-E BAG5 TNFSF10 IL7R PLEKHA1 TRIAP1 G3BP2 PTTG1IP DDIT3 HLA-B RUNX2 IFI16 CUEDC2 CLASP1 QSOX1 PYCARD RAB7A PPP1R15B TXNDC12 NUMB UBE2G2 GPR97 HYOU1 LATS1 PSMB10 XCL1 PSME2 KIAA0922 MAPKAPK5 HIF1A PDCD6 CPNE1 BRAP CDK5RAP3 MUL1 HGS EPHA4 ATM PTPN2 TMBIM6 ARNTL G3BP1 PSMD3 PSMC2 GRK6 ELF1 PSMC1 HLA-A PIK3IP1 HELB CD55 CALR RASA2 CTDSPL2 TRIM38 NDUFA13 TLE1 FOXP1 PSMD6 UBAC2 IRAK3 HAVCR2 ERBB2IP PSMB2
GO_MEIOTIC_CELL_CYCLE_PROCESS	0.233129680725266	0.648138795148011	0.335228505471854	1.16610025036196	11828	33	MYH9 TOP2B UBR2 UBE2B ACTR2 KIAA0196 PSMD13 CKS2 PPP2R1A MEI1
GO_SPINDLE_ASSEMBLY	0.0245017839191027	0.29058878995844	0.453327039924422	1.55261407923951	1242	31	KIF3B RAB11A CDC14A CSNK1D HDAC3 FLNA KIAA0196 NCOR1 TUBB
GO_SPHINGOLIPID_BIOSYNTHETIC_PROCESS	0.139084184141346	0.541986781058738	-0.442581966618588	-1.31393821387442	6824	18	SPTSSB SPTLC2 CERS4 AGK SMPD2 ST6GALNAC6 VAPA SAMD8 SMPD4 DEGS1
GO_REGULATION_OF_PHOSPHOPROTEIN_PHOSPHATASE_ACTIVITY	0.373594251146929	0.77189513347588	-0.304548004997249	-1.05329667897494	18403	33	EIF2AK2 JAK2 PPP2R4 PPP1R11 SLC39A10 ANKLE2 CALM3 PPP2R5E
GO_REGULATION_OF_MULTI_ORGANISM_PROCESS	0.000795023155049391	0.0433729299032501	-0.331028019996324	-1.5879381738246	39	196	PLSCR1 MX1 IFITM3 EIF2AK2 BST2 ISG15 IFITM1 STAT1 ISG20 HERC5 SP100 MBD5 LEF1 TAP1 C1QBP GSN ADAR OASL TARDBP SUPT4H1 ANKRD17 IFI16 RAB7A RSF1 POLR2F MRPS10 C19orf66 MUL1 POLR2G ZNF639 RAD23A PML HLA-A TRAF3 AP1M1 CD55 TMEM39A PPIH TRIM38 ZC3HAV1 FOXP1 IRF8 TRIM11 IFITM2 SNRPD1 HAVCR2 B2M
GO_POSITIVE_REGULATION_OF_CELL_CYCLE_ARREST	0.394951349004283	0.785105718061145	0.291609204946477	1.03580546925995	20010	36	UBC CDKN1A EP300 TGFB1 CNOT1 PPP2R5C RRP8 UHRF2 BTG2 RBL2 MDM2 CNOT6L CNOT8 ID2 BAX E2F4 MDM4
GO_CONNECTIVE_TISSUE_DEVELOPMENT	0.507076096031277	0.841698320322371	-0.292658857086022	-0.963527597247199	24901	27	SNX19 SMAD5 ARID5B RUNX2 HIF1A
GO_CYTOPLASMIC_PATTERN_RECOGNITION_RECEPTOR_SIGNALING_PATHWAY	0.869943551180942	0.971743470249628	-0.235910007039538	-0.700370093370212	42688	18	IRF7
GO_NUCLEAR_ENVELOPE_ORGANIZATION	0.689958896065766	0.918931890029357	-0.234710787182235	-0.867125718823278	34074	44	NUP155 BANF1 RANBP2 TARDBP RAE1 NUPL2 TOR1AIP1 ANKLE2 NEK9 UBXN2A POM121C
GO_REGULATION_OF_GLIAL_CELL_DIFFERENTIATION	0.0251642859953567	0.291349443185688	0.51662586052817	1.58149639608818	1278	20	DUSP10 CXCR4 NOTCH1 RHEB MECP2 WDR1 SIRT2 PRPF19 ATF5 ID2 DICER1
GO_CELLULAR_RESPONSE_TO_ENDOGENOUS_STIMULUS	0.0134207870837538	0.212501568639902	0.260282045909167	1.32160960726388	664	299	ATP2B4 CCL5 ANXA1 KLF3 PDE4B FOXO1 USF1 CD81 ID1 UBR2 EIF4A3 SKI GNB1 TNF PTGER4 TGFBR3 EGR1 ZYX CSNK1D ITGB1 GNG10 UBC GNG2 NOTCH1 GNB2 ATP2B1 NR4A3 ATP6V1H BAG4 EP300 POLR2E SERPINB9 HNRNPH1 RDX GSTM2 KLF6 TGFB1 NEDD8 NAMPT CDC5L FRS2 MED4 NR1D2 ATP6V1E1 LAMTOR3 RORA UBE2D1 ARHGEF2 P2RX4 REST INPP5K C10orf54 PARP1
GO_MRNA_METABOLIC_PROCESS	0.968596119999209	0.996335403608601	-0.158099865172259	-0.823761872474889	48978	407	RNPC3 CTNNBL1 C1QBP ADAR TARDBP RPL28 SETX LSM10 RPL12 RBMX RPL36 ZRANB2 SNRNP40 AQR PSPC1 SNRNP35 POLR2F ZCRB1 RPS12 DDX23 RBM17 TRA2B THOC2 ZNF326 SUGP2 SREK1 ERCC3 RPS29 RPL32 LUC7L3 ATM POLR2G FAM103A1 TXNL4A ZC3H11A RPS15 SCAF11 PTBP1 RPLP1 USP4 SNRNP25 HELB SON RPL38 QKI PPIH HNRNPA2B1 SRSF2 PSIP1 RPL41 SNRPD1 SF1 PTBP2 CDC73 HNRNPC CCAR1 SNRNP27 RPL18A SRSF7 GRSF1 RPL8 PUF60 PCBP2 PRPF3 RPL9 SNRPE SUPV3L1 DDX5 CPSF7 FUS RPL30 RPS20 DCP1A LSM7 CNOT7 RPS24 NSRP1 RNF113A CWC15 SKIV2L2
GO_PROTEIN_TRANSMEMBRANE_TRANSPORT	0.45520290851921	0.819385476675821	0.304306886244843	0.998756574650424	23162	26	RAB8B HSPA8 TOMM20 TOMM70A MCL1 ZFAND2B TIMM50 HSP90AA1 TOMM7 SRP9 PEX16 LONP2 SRP54 TOMM40
GO_INTRINSIC_APOPTOTIC_SIGNALING_PATHWAY_BY_P53_CLASS_MEDIATOR	0.483872871022303	0.834791214588723	0.311996557572519	0.980234748517029	24602	22	CDKN1A BCL3 EP300 PPP2R5C RRP8 HIPK1 RPS27L PMAIP1 BAG6 BAX DYRK2 SNW1
GO_RESPONSE_TO_RETINOIC_ACID	0.773577592362145	0.944000895941513	-0.245871241469949	-0.794254979675751	37919	25	SP100 SETX CD38 SCAMP3 NDUFA13 OVCA2
GO_REGULATION_OF_TRANSLATIONAL_INITIATION	0.528871002742104	0.8448042715455	0.248288720850983	0.957010054672351	26808	52	CCL5 TNF EIF3F PPP1CA EIF3K EIF3L EIF3D EIF1 EIF4B NCK1 EIF4H EIF4A1 POLR2D DDX3X TPR EIF3J RARA
GO_MYELOID_CELL_ACTIVATION_INVOLVED_IN_IMMUNE_RESPONSE	0.789501653282948	0.950551419899164	0.250892940256731	0.778001977786683	40112	21	NR4A3 DOCK2 CCL3 LAT HMGB1 RASGRP1 SNAP23 LAT2
GO_POSITIVE_REGULATION_OF_SYNAPTIC_TRANSMISSION	0.437815194403774	0.808755682664609	-0.330924239896981	-1.01057449488442	21529	20	PLK2 DTNBP1 RAB3GAP1 FLOT1
GO_CELL_RECOGNITION	0.746346452666155	0.93781295005952	0.255098674046364	0.811237256262452	37944	23	CXCR4 CCT5 DOCK2 CCT2 FCN1 CORO1A
GO_PROTEIN_K63_LINKED_UBIQUITINATION	0.254500078603993	0.677654764612585	0.399897069111561	1.16990791768469	12950	17	UBE2B UBE2S ITCH PRPF19 UBE2E3 ARIH2 UBE2N RNF168 WWP2 RNF4
GO_NEGATIVE_REGULATION_OF_PHOSPHORYLATION	0.895810462865013	0.973717248692039	0.175874405596225	0.814299344671299	44880	145	FOXO1 MIDN DUSP10 SAMSN1 HDAC3 CDKN1A UBE2B PRKRIP1 TGFB1 WNK1 PAFAH1B1 ITCH PARK7 NCOR1 TNFAIP3 PER1 INPP5K STRAP PRNP MBIP CALM1 SIRT2 ZC3H12A DNAJA1 PPP2R1A HEXIM1 NCK1
GO_REGULATION_OF_GENERATION_OF_PRECURSOR_METABOLITES_AND_ENERGY	0.421431805208354	0.800166343222358	0.299979412513058	1.01983245175127	21409	30	PPP1CA PARK7 NCOR1 INPP5K PRKAG1 HMGB1 SLC25A33 PGAM1 PPP1CB PRKAA1 DYRK2 GSK3B
GO_LIPID_CATABOLIC_PROCESS	0.26951698545232	0.689952241173562	0.29978646307927	1.12009669376665	13653	45	PLA2G16 GDE1 DDHD2 ACADVL PAFAH1B1 NEU1 SCP2 ABHD2 SIRT2 HSD17B11
GO_POSITIVE_REGULATION_OF_LIPID_METABOLIC_PROCESS	0.0147418210484825	0.22203172192653	0.463517335927947	1.61235596809374	747	33	ANXA1 CD81 TNF NR4A3 IFNG ABCG1 TGFB1 SPTLC1 SCP2 PTK2B RAC1
GO_RESPIRATORY_SYSTEM_DEVELOPMENT	0.212201905438192	0.627232971248448	0.323503141573587	1.17712095204729	10757	40	ID1 SKI PPP1CA NOTCH1 EP300 RBPJ HOPX HMGB1 AXIN1 RARA MAP2K2 PHF14 HNRNPK BAG6 MAPK8IP3
GO_ION_HOMEOSTASIS	0.0394907768251494	0.361753198155753	0.299939016291677	1.3412431781594	1975	116	ATP2B4 CCL5 CD52 ATP2A3 F2R CXCR4 GNB1 LCK ITGB1 ATP5B ATP1B3 ANXA7 ATP2B1 ATP6V1H PICALM ABCG1 HERPUD1 CUTC TGFB1 ATP6V1E1 STIM2 CCL3 SFXN1 PRNP ATP1B1 PTK2B IREB2 ANXA6
GO_NUCLEOSIDE_MONOPHOSPHATE_METABOLIC_PROCESS	0.106915723371065	0.496819709259371	0.271537621724697	1.22086474574166	5345	120	HSPA8 GAPDH ATP5B NDUFB3 DLD UPP1 AK3 TAZ PRPS1 TGFB1 NDUFB9 ATP5F1 LDHA ATP5E NDUFA12 COX6C MECP2 ATP5A1 NDUFB4 NDUFS1 ATP1B1 GMPS NDUFV2 DCK UQCRB ATP5G3 NDUFA4 UQCRQ NDUFB5 COX5A PGAM1 NDUFB1 COX8A NDUFS7 NDUFA11 NDUFB2 COX7B ATP5O COX6B1 UQCRC2 CARD11 NDUFA3 GBAS PGM1 NDUFS4 UQCR10 COX7C NDUFA1 NDUFC1 NDUFB10 ENO1 ATP5S
GO_REGULATION_OF_GLUCOSE_TRANSPORT	0.736591039009679	0.93402162734117	0.242054962615228	0.82902167708516	37367	31	TNF NUP210 NR4A3 NUP54 ARPP19 NUP98 INPP5K NUP107 TPR PRKCB POM121 PRKAA1 LMBRD1 PIK3R1 NUPL1 NFE2L2
GO_NEGATIVE_REGULATION_OF_TRANSFORMING_GROWTH_FACTOR_BETA_RECEPTOR_SIGNALING_PATHWAY	0.0534607895202691	0.41091667565852	0.461083217381264	1.46628705764679	2717	23	SKI TGFBR3 UBC TGFB1 GLG1 STRAP PPM1A LEMD3 ZNF451 ADAM17
GO_MYD88_INDEPENDENT_TOLL_LIKE_RECEPTOR_SIGNALING_PATHWAY	0.168505924990838	0.584584203666331	-0.436474981320094	-1.27539959747887	8275	17	IRF7 IKBKG TRAF3 BIRC2 UBE2D3 BIRC3 UBB UBA52 TICAM1
GO_POSITIVE_REGULATION_OF_ERK1_AND_ERK2_CASCADE	0.474271299343726	0.827530945194632	0.28151895152909	0.986606423358815	24064	34	CCL5 F2R CCL4 TNF PHB2 CCL3 PTK2B HMGB1 FBXW7 RASGRP1 CAMK2D CIB1 CD74 ICAM1
GO_MEMBRANE_ORGANIZATION	0.638717507838576	0.900561772454944	0.18143598346183	0.951622996853028	31574	407	RPS26 RAB8B SYNE2 RAB11A MYH9 SUN2 CXCR4 SSR2 TNF SYTL2 CLIP1 ANKRD28 CSNK1D ITGB1 NUP210 ATP1B3 ATG3 ANXA7 PLEKHF1 S100A10 SKAP1 SCLT1 PACSIN2 VAMP4 ZFYVE27 NUP54 BAG4 DOCK2 TAZ PICALM BLOC1S2 TOMM20 TFG RDX FLNA RABIF TMEM43 DNM1L GBF1 AP2S1 PAFAH1B1 ITGA4 NSF SAR1B BBIP1 NUP98 MITD1 INPP5K SCP2 SRP14 YWHAQ ELMO1 PACSIN1 NAPG RPS9 VPS37B ATP1B1 GOLGA4 ITGB2 RAB8A PPP3CC AP3D1 VCPIP1 TRAPPC4 RAC1 BIN2 VPS4A RPL3 SEC16A ZFAND2B EPS15 TIMM50 ANXA2 PPP2R1A ATG9A SNAP23 HEBP2 ITGAL SLC25A5 VPS4B MTSS1 SRP19 FNTA SRPR THBS1 STX12 ARF1 ZMPSTE24 YWHAH TRAPPC2L STX11 OPA1 NUP107 PPP6C
GO_MITOCHONDRIAL_ATP_SYNTHESIS_COUPLED_PROTON_TRANSPORT	0.403890989596599	0.786358324800181	0.361625371914102	1.0410528307832	20614	16	ATP5B ATP5F1 ATP5E ATP5A1 ATP5G3 ATP5O ATP5S ATP5C1 STOML2 ATP5J ATP5L ATP5G2
GO_PURINE_NUCLEOSIDE_MONOPHOSPHATE_BIOSYNTHETIC_PROCESS	0.737650755042059	0.93402162734117	-0.235646036864203	-0.832006324353273	36391	36	CHCHD10 IMPDH2 TCIRG1 ADK AK2 ATP5H
GO_POSITIVE_REGULATION_OF_PEPTIDE_SECRETION	0.432215802750427	0.805277749550199	-0.324025223688316	-1.01388625455143	21245	22	JAK2 TARDBP CD38 SOX4 HIF1A GLUD1 S100A8 SERP1
GO_ORGANONITROGEN_COMPOUND_BIOSYNTHETIC_PROCESS	0.0076532125694623	0.151056933587967	-0.255140195438758	-1.32937978732141	386	407	PLSCR1 EIF2AK2 SPTSSB SLC44A1 CNDP2 TYMP SLC35D1 SPTLC2 ABTB1 TMEM14C WARS MRPS21 TARSL2 B4GALT4 RPL28 MRPL41 MTRF1L RPL12 LARS CHCHD10 CERS4 RPL36 IMPDH2 TCIRG1 ADK PPCS GADD45GIP1 AK2 RPS12 MRPS35 MRPS10 GGCT GARS MRPS18A PABPC4 CHKA ATP5H OAZ1 SLC25A26 MARS RPS29 RPL32 MRPL33 MAT2A DGUOK MRPS26 RPS15 PTBP1 RPLP1 AKR1A1 AGK RPL38 SLC25A39 CDKAL1 GLUD1 MRPL51 RPL41 EIF6 EIF2B5 ATP5G1 RPL7L1 SMPD2 RPL22L1 ST6GALNAC6 RPL18A VAPA MRPL2 CMPK1 PPCDC SAMD8 RPL8 PCBP2 SLC44A2 RPL9 NR4A2 B4GALT1 MRPS7 RPL30 ADCY7 RPS20 EIF1AX PTS DARS MRPS18B RPS24 SMPD4 EIF4E2 COPS5 AMPD2 RPL13 METTL17 NOA1 MRPL27 EIF5 B3GAT3 RPL11 DEGS1 B3GNT7 RPL35 SMS MRPS30 GSPT1 RPL29 RPS18 RPL13A UBA52 COASY EIF2B1 RPSA MRPS11 RPL39 MTHFD2L SLC25A36 SLC25A16 EIF2D ATP5D MRPL14 EPRS EIF3M MRPS23 MRPL55 EEF1A1 DENR MRPL40
GO_REGULATION_OF_CHROMOSOME_ORGANIZATION	0.574327295989765	0.873591295220446	0.208565392150015	0.950437453751713	28728	131	SKI CCT5 CTCF TERF2IP UBE2B EP300 PAF1 USP7 TGFB1 OTUB1 CTBP1 DKC1 UHRF2 PHF8 CCT2 WAPAL PARP1 MECP2 ANAPC11 SMG5 ZNF335 SMG6 XRCC5 MCRS1 BCOR NSMCE2 CHTOP TPR KDM3A CAMK2D UBE2N SUPT6H RTF1 EID1 ZNF451 RNF40 TNKS GOLGA2 UBR5 ANAPC10 SNW1 WBP2 RNF4
GO_REGULATION_OF_CELL_MATRIX_ADHESION	0.880698114358943	0.973048546692712	-0.222537297659834	-0.704206729452909	43295	23	UTRN CLASP1 LIMS1 NINJ1
GO_LIPOSACCHARIDE_METABOLIC_PROCESS	0.628514726976205	0.896053225741338	0.268411739635906	0.889092749503894	31986	27	CREM ST8SIA4 GLTP NEU1 GPAA1 MPPE1 DPM3 ALG5 DPM1 BAX
GO_REGULATION_OF_CELL_ADHESION	0.0733099386899	0.441913897292245	0.251258225677953	1.22167241653858	3634	208	CCL5 ANXA1 CD3E HLA-DRB5 ZBTB1 TNF PTGER4 HLA-DQB1 LCK ITGB1 ATP5B HLA-DRA NOTCH1 S100A10 SKAP1 LPXN HLA-DMB NR4A3 BAG4 IFNG LGALS3 RDX SPN CYTIP FLNA CCDC88B TGFB1 GTPBP4 ITGA4 ARHGDIB SLK ITCH GLMN RSU1 TBCD CYTH1 ARPC2 LGALS1 C10orf54 UNC13D PRNP GPR56 CITED2 PTK2B AP3D1 RAC1 LAT HMGB1 PRKX PPP2R1A DHPS RASGRP1 IRF1 NCK1 IL4R CORO1A THBS1 CD247 ZBTB16 FYN SART1 VAV1 PPP1CB SIPA1 SPOCK2 NFKBID RARA SASH3 CIB1 PTPN6
GO_NEGATIVE_REGULATION_OF_TELOMERE_MAINTENANCE	0.49341312473193	0.836718980429703	-0.338061719368815	-0.970370102697659	24157	16	ACD ATM PML TNKS2 HNRNPC
GO_POSITIVE_REGULATION_OF_TRANSCRIPTION_FROM_RNA_POLYMERASE_II_PROMOTER	0.543530065930574	0.852694152069512	-0.190292511077365	-0.97248654241161	27369	337	PLSCR1 STAT1 IRF7 LMO4 FLI1 ATF4 GNL3 LEF1 IRF2BPL CNBP SAFB TARDBP SMAD5 SETX TFAM SUPT4H1 TRIAP1 TXK RBMX DDIT3 RUNX2 IFI16 ZNF148 KPNA6 SOX4 DDX17 MAFF PPP3CA NCOA3 HIF1A ERCC3 PRKD2 NRIP1 CDK5RAP3 MORF4L2 IKBKG HMGN3 ARNTL USF2 ZNF639 CSRNP1 TAF7 SMARCA2 PSMC2 MEF2A ELF1 PSMC1 MED17 HSF1
GO_REGULATION_OF_ACTIN_FILAMENT_DEPOLYMERIZATION	0.391506838547398	0.782694860451028	0.358187524084567	1.0478857006214	19922	17	DSTN SH3BGRL3 RDX PLEK CAPZB WDR1 TWF1 MTPN CAPZA1
GO_ENDOCRINE_SYSTEM_DEVELOPMENT	0.285191740412979	0.700345001929413	0.376622764166903	1.13703373937898	14501	19	ANXA1 FOXO1 RBPJ CITED2
GO_REGULATION_OF_MYELOID_LEUKOCYTE_DIFFERENTIATION	0.965895417874825	0.995648929091542	0.177041009784333	0.644193688429275	48967	40	CCL5 TNF IFNG CCL3 CUL4A GNAS ZBTB7A RARA ID2 INPP5D RASSF2 CASP8 ACIN1 PIK3R1 TFE3 TESC
