pathway	pval	padj	ES	NES	nMoreExtreme	size	leadingEdge
GO_ORGANELLE_FISSION	0.0221879259199872	0.274953296744934	0.287043487579448	1.35355714712352	1106	165	NAA50 CTDP1 KIF3B RAB11A PBRM1 CDC14A TOP2B SMARCA4 UBR2 CLIP1 PDS5A DCTN2 UBE2B FLNA MAPRE2 ACTR2 FBXW5 DNM1L UBE2S DCTN1 PAFAH1B1 KIAA0196 ARHGEF2 PSMD13 ARPP19 CCNK WAPAL ANAPC5 CKS2 CDC16 USP16 UBE2I ANAPC11 VCPIP1 VPS4A INO80 SIRT2 KIF22 PPP2R1A CDK11A MEI1 VPS4B
GO_MUSCLE_STRUCTURE_DEVELOPMENT	0.0183314030113024	0.251416728451102	0.336410848451071	1.4522050056299	917	94	SYNE1 MYH9 GTF3C5 SKI TGFBR3 EGR1 AKAP13 FRG1 ITGB1 KDM6B NOTCH1 CAST EP300 TAZ GLMN RORA NCOR1 LGALS1 MKL1 REST COPS2 RBPJ WDR1 BTG2 ACTG1 UNC45A
GO_NEGATIVE_REGULATION_OF_CELL_CYCLE_PROCESS	0.504039255580157	0.840301146774142	0.229342623297735	0.974599208018446	25268	86	SMARCA4 UBC CAST CDKN1A EP300 CNOT1 PPP2R5C CDC5L ZNF655 EZH2 CCNK WAPAL BTG2 AURKAIP1 VPS4A RBL2 MDM2 RPS27L FBXW7 PRPF19 CNOT6L ATF5 TPR STAG2 CNOT8 BRD4 BAX TNKS E2F4 MDM4
GO_RIBOSOMAL_LARGE_SUBUNIT_ASSEMBLY	0.874283382637968	0.971743470249628	-0.243135926693978	-0.685560022408805	42852	15	RPL12 RPL38 RPL11 BRIX1 FASTKD2 RPL23A
GO_MAINTENANCE_OF_LOCATION_IN_CELL	0.595094324729655	0.888194547003396	0.249447343062299	0.917710570336333	30156	42	SYNE2 SYNE1 SUN2 VPS13A FLNA NFKBIB
GO_REGULATION_OF_MICROTUBULE_POLYMERIZATION	0.217741777315786	0.634744522460355	0.430172967088526	1.21594445688172	11101	15	CLIP1 EML2 TBCD STMN1
GO_CELLULAR_RESPONSE_TO_OXYGEN_LEVELS	0.00729032895386743	0.151056933587967	0.446274772504036	1.65891964789715	368	44	FOXO1 GNB1 EGR1 UBC NOTCH1 EP300 RORA BACH1 UBE2D1 RBPJ CREBBP TCEB2 CITED2 HP1BP3 MDM2 SIRT2
GO_CELLULAR_RESPONSE_TO_HORMONE_STIMULUS	0.233862899675857	0.648138795148011	0.234013371517178	1.10163330616714	11687	163	ANXA1 FOXO1 USF1 GNB1 PTGER4 GNG10 GNG2 NOTCH1 GNB2 ATP2B1 NR4A3 ATP6V1H EP300 SERPINB9 RDX TGFB1 NAMPT CDC5L MED4 NR1D2 ATP6V1E1 RORA REST INPP5K PARP1 RAB8A ABHD2 CALCOCO1 GNAS MDM2 DNAJA1 PTPRA NFKB1 KAT5 SLC25A33 YWHAH FYN AP3S1 KDM3A FOSB RARA AGTRAP ATP1A1 HNRNPK POR PDE3B NR4A1 PRKAA1 PTPN1 MED13 UBR5 CTSB ATP6V0D1 CDK7 WBP2 RNF4 ATP6V0E2 PIK3R1 PRKDC H2AFZ MED1 ARID1A
GO_DNA_REPAIR	0.890745936051255	0.973254963988744	-0.174145754968264	-0.828903348294027	44767	185	ISG15 PARP9 USP10 UBE2L6 SETX APEX1 TREX1 BAZ1B AQR POLR2F SMC5 SHPRH COPS6 ERCC3 NSMCE4A MORF4L2 ATM POLR2G SMC1A RPAIN SSRP1 RAD23A PMS2 BCCIP UIMC1 ATRX MPG KIAA0430 RFC1 FBXO6
GO_PROTEIN_POLYMERIZATION	0.200488131323072	0.614703050041048	0.36141773833484	1.20772950715265	10185	28	CSNK1D ARPC4 CORO7 BLOC1S2 DNM1L UBE2S
GO_CELLULAR_RESPONSE_TO_CORTICOSTEROID_STIMULUS	0.00149057602918391	0.07318728303293	0.669764376938249	1.89318330965067	75	15	ANXA1 FOXO1 ATP2B1 EP300 TGFB1 REST
GO_SIGNAL_TRANSDUCTION_IN_RESPONSE_TO_DNA_DAMAGE	0.42031981516386	0.799291360361949	-0.274403130628284	-1.01885314202	20738	45	USP10 SP100 PLK2 TRIAP1 SOX4 PRMT1 ATM SMC1A PML BID ATRX
GO_MUSCLE_CONTRACTION	0.769785341483723	0.94302545575975	-0.225005608683064	-0.817973023265416	37904	41	NUP155 TMOD3 UTRN SMAD5
GO_TRANSITION_METAL_ION_HOMEOSTASIS	0.881592432006307	0.973249545851034	0.209499857475939	0.728750187605984	44731	33	LCK PICALM CUTC SFXN1 PRNP IREB2 SLC39A7 ARF1 HMOX2
GO_ENZYME_LINKED_RECEPTOR_PROTEIN_SIGNALING_PATHWAY	0.161377366089408	0.568784550319861	0.231921844592063	1.13605607059154	8013	220	TOB1 CD3E FOXO1 TYK2 ID1 IGF2R SKI TGFBR3 EGR1 ZYX ARPC1A LCK ITGB1 ARPC4 UBC ZFYVE27 ATP6V1H ELMO2 BRK1 POLR2E TIPARP ABI1 HNRNPH1 AHI1 DOK2 TGFB1 NEDD8 ACTR2 NAMPT FRS2 AP2S1 ATP6V1E1 ARPC2 UBE2D1 NRAS SUB1 C10orf54 ELMO1 PARP1 ACTG1 CITED2 PTK2B RAC1 LCP2 ACTB SIRT2 EPS15 PTPRA NCK1 MTSS1 FNTA ARPC1B PTPRE WASF2 POLR2D FYN CD8A AP3S1 VAV1 POLR2A
GO_REGULATION_OF_DEFENSE_RESPONSE_TO_VIRUS_BY_VIRUS	0.752449533703223	0.938555869889148	0.262190830378703	0.802619235721894	38243	20	ATP6V1H DOCK2 AP2S1 ELMO1 RAC1 AP1G1 CD247 ARF1 FYN
GO_REGULATION_OF_CALCIUM_ION_TRANSMEMBRANE_TRANSPORT	0.120575482853764	0.519490595915316	0.373446063397697	1.29904092556743	6117	33	F2R PDE4B GSTM2 TGFB1 STIM2 ATP1B1 PTK2B AHNAK CALM1 CORO1A PDE4D CAMK2D PTPN6 CXCR3 BAX
GO_RESPONSE_TO_BACTERIUM	0.102045313407721	0.48929930549991	-0.270528122979837	-1.22657544068465	5093	132	EIF2AK2 ISG15 FCER1G TNFRSF18 SOCS1 JAK2 RNF5 HLA-E TNFRSF11A ANKRD17 HLA-B IL12RB2 GNLY PYCARD LYST DNMT1 ADH5 HIF1A HLA-A HSF1 RAB1A MALT1 TNFRSF14 FOXP1 IRF8 RAB14 COMT IRAK3 HAVCR2 B2M ERBB2IP OTUD5 GPX1 CDC73
GO_POSITIVE_REGULATION_OF_LEUKOCYTE_MIGRATION	0.351520766395301	0.755677304291124	0.312499865997782	1.07029064886469	17832	31	CCL5 CCL4 TNF PTGER4 LGALS3 ITGA4 CCL3 PTK2B RAC1 HMGB1
GO_CALCIUM_ION_IMPORT	0.310726263557377	0.72169628858407	0.39661329157036	1.12108330905728	15842	15	ATP2B4 F2R LCK CCL3
GO_CELL_MATURATION	0.0730978634746546	0.441913897292245	0.439722393354087	1.41362016488563	3718	24	SCLT1 DLD CDKN1A AGPAT6 TUSC2 KIAA0196 MECP2 PTK2B ABHD2
GO_REGULATION_OF_SECRETION	0.560380463137617	0.86437927087433	0.203051608527629	0.959919094510556	27925	168	CCL5 ANXA1 RAB8B F2R HLA-DRB5 MIDN TNF SYTL2 PTGER4 RHBDF2 NOTCH1 IFNG EP300 NLRP1 TGFB1 DNM1L WNK1 NSF GLMN TMF1 DPH3 CCL3 P2RX4 REST RAB2B IFNAR1 UNC13D VPS4A HMGB1 GNAS ZC3H12A AP1G1 RASGRP1 SLC25A5 VPS4B CRY1 IL4R FCN1 APBB1
GO_MODULATION_OF_TRANSCRIPTION_IN_OTHER_ORGANISM_INVOLVED_IN_SYMBIOTIC_INTERACTION	0.0567007276364564	0.41091667565852	0.52484957158671	1.48356120931298	2890	15	CCL5 SMARCA4 CCL4 EP300 CCL3 REST INPP5K TAF11
GO_APOPTOTIC_SIGNALING_PATHWAY	0.107328794553464	0.496819709259371	-0.278376994680446	-1.23067674918533	5359	113	IFI6 ITPR1 SHISA5 TNFRSF18 ATF4 JAK2 TNFSF10 TNFRSF11A DDIT3 IFI16 PYCARD CD38 GGCT PDCD6 ATM TMBIM6 CUL5 PML BID TNFRSF14 NDUFA13 TM2D1 SRGN GPX1
GO_NEURAL_NUCLEUS_DEVELOPMENT	0.651119000451131	0.900561772454944	0.26862308835057	0.873398146183071	33195	25	ATP5F1 LDHA YWHAQ ACTB CALM1 SEC16A SIRT2 YWHAH
GO_LYMPHOCYTE_MEDIATED_IMMUNITY	0.227035025133777	0.64360984210683	-0.316473432591714	-1.16367200924037	11200	43	IRF7 FCER1G KLRD1 BTN3A2 C1QBP HSPD1 BTN3A3 LYST GZMB
GO_FC_EPSILON_RECEPTOR_SIGNALING_PATHWAY	0.739437747787433	0.93402162734117	-0.203686074306913	-0.867117675579606	36928	90	FCER1G PSMB9 TEC SKP1 PSMB10 PPP3CA PSME2 IKBKG ITK PSMD3 PSMC2 PSMC1 MALT1 PSMD6 PSMB2 CALM3 PSMC6 VAV3 PSMA1
GO_HIPPOCAMPUS_DEVELOPMENT	0.0361429189784756	0.341272561892914	0.500731864316334	1.53284165452577	1836	20	ATP2B4 ZEB2 KDM6B NR4A3 PAFAH1B1 EZH2 BTG2 UQCRQ RARA HNRNPK
GO_RIBONUCLEOSIDE_TRIPHOSPHATE_BIOSYNTHETIC_PROCESS	0.846772453562952	0.96308600140943	0.228310804384299	0.742327230794751	43170	25	ATP5B TGFB1 ATP5F1 ATP5E ATP5A1 ATP5G3 ATP5O GBAS ATP5S ATP5C1 STOML2 ATP5J ATP5L ATP5G2
GO_REGULATION_OF_CHROMOSOME_SEGREGATION	0.984333379372941	0.999260380004157	0.164644935232385	0.580827972591282	49886	35	CTCF WAPAL ANAPC11 SIRT2 PUM2 NSMCE2 TPR TNKS GOLGA2 ANAPC10 RNF4
GO_PROTEIN_K11_LINKED_UBIQUITINATION	0.00829623237295781	0.153375771716579	0.613140001809721	1.73312654102589	422	15	UBE2A UBE2B UBE2S ANAPC5 CDC16 ANAPC11 UBE2E3 ANAPC10 UBE2H RNF4
GO_SPHINGOLIPID_METABOLIC_PROCESS	0.651646903820817	0.900609262549467	-0.249636722539223	-0.881403883160352	32148	36	SPTSSB SPTLC2 CERS4 AGK SMPD2 ST6GALNAC6 VAPA SAMD8 NSMAF SMPD4 DEGS1 SERINC3
GO_PROTEIN_ACETYLATION	0.284641975308642	0.700345001929413	0.282035364992085	1.10372645926512	14409	56	NAA50 FOXO1 DR1 EP300 PER1 CREBBP MECP2 NAA30 MBIP TAF9 KAT5 MCRS1 APBB1 SUPT7L SRCAP CRTC2 POR BAG6 TAF10
GO_REGULATION_OF_NUCLEOCYTOPLASMIC_TRANSPORT	0.222619686400763	0.639988073800283	0.275385809458296	1.14092548248794	11201	75	TNF HDAC3 NUP54 PRDX1 CDKN1A BCL3 EP300 FLNA TGFB1 NFKBIB NUDT4 PARK7 PARP1 LITAF SETD2 TXN MDM2 DMAP1 ZC3H12A AXIN1 PPM1A KPNA1 TPR PPP1CC SUPT6H HSP90AA1 PPP3R1 DYRK2 UBR5 ANP32B GSK3B PIK3R1 PRKCQ MED1
GO_FORMATION_OF_TRANSLATION_PREINITIATION_COMPLEX	0.090966086087655	0.470979314929871	0.486577971846297	1.40076834848762	4642	16	EIF3F EIF3K EIF3L EIF3D EIF4B EIF4H EIF3J EIF3G EIF2S3
GO_REGULATION_OF_PROTEIN_SECRETION	0.457144573247643	0.819385476675821	0.227863466916479	0.997222857658857	22832	102	CCL5 ANXA1 F2R HLA-DRB5 MIDN TNF PTGER4 RHBDF2 IFNG EP300 NLRP1 TGFB1 DNM1L GLMN DPH3 CCL3 REST IFNAR1 HMGB1 GNAS ZC3H12A RASGRP1 SLC25A5 IL4R FCN1 APBB1
GO_REGULATION_OF_PEPTIDYL_TYROSINE_PHOSPHORYLATION	0.297443412479949	0.707898600495526	0.271526115005253	1.09155452029972	15019	64	CCL5 CD3E RAP2B CD81 SAMSN1 PTGER4 ITGB1 ABI1 TGFB1 ARHGEF2 IFNAR1 ITGB2 PTK2B FBXW7 PPP2R1A UNC119 PIBF1 FYN ARL2BP PTPN6 CD74 ICAM1 PTPN1 ADAM17
GO_RESPONSE_TO_INSULIN	0.171574548983108	0.588289829264707	0.296929688150371	1.19367871228686	8663	64	CCL5 FOXO1 USF1 CAT EGR1 ATP6V1H NAMPT ATP6V1E1 INPP5K PARP1 RAB8A PTPRA CRY1 SLC25A33 AP3S1 HNRNPK PDE3B PTPN1 ATP6V0D1 GSK3B ATP6V0E2 PIK3R1 PRKDC PRKCQ
GO_REGULATION_OF_CATABOLIC_PROCESS	0.272752916523947	0.693939883364169	0.205497682277575	1.06132626255409	13536	349	TOB1 ATP2B4 HERC1 FOXO1 VMP1 VPS26B CD81 ARIH1 TNF ERLEC1 GAPDH CSNK1D PPP1CA ITGB1 USP36 UBC PLEKHF1 PSMD1 ATP6V1H IFNG EP300 TIPARP GABARAPL2 MYLIP RDX HERPUD1 FLNA BANP WAC CNOT1 UBE2K DNM1L SQSTM1 TIMP1 PSMB1 PSMD12 ATP6V1E1 ITCH NSF NRBF2 GLMN SF3B3 TMF1 SNRNP70 PARK7 UBE2D1 NCOR1 CAPNS1 PSMD13 TNFAIP3 TNFRSF1B PSMB3 SPTLC1 PRKAG1 ANAPC5 CDC16 GTPBP1 SECISBP2 PSMB4 BTG2 MTDH PSMA7 ANAPC11 PSME4 PTK2B
GO_REGULATION_OF_CARBOHYDRATE_METABOLIC_PROCESS	0.305608102782376	0.717273319627851	0.283988037571422	1.09060758137222	15508	51	FOXO1 MIDN PTGER4 PPP1CA ARFGEF1 TGFB1 PLEK RORA NCOR1 ARPP19 INPP5K PRKAG1 PTK2B HMGB1
GO_B_CELL_ACTIVATION	0.195961971174312	0.614703050041048	-0.318357892280726	-1.18736159373795	9666	46	BST2 LEF1 PLCL2 HSPD1 TPD52 IL7R GPR183 GPR97 ATM PTPN2 MALT1
GO_REGULATION_OF_NEURON_DIFFERENTIATION	0.0226027123254791	0.274953296744934	0.312407202363889	1.3984853505093	1129	117	CCL5 RAP1GAP2 ENC1 RAB11A ID1 ZEB2 ITGB1 NOTCH1 C3orf17 IFNG EP300 S1PR5 PAFAH1B1 DDX6 NEU1 LGALS1 EZH2 REST PACSIN1 TRPV2 ARHGAP4 GOLGA4 CFL1 PTK2B CERS2 RAC1 APBB1 ARF1 YWHAH PRPF19 FYN OPA1 SPAG9 RAB21 RARA MAP2K2 CIB1 ID2 HNRNPK
GO_NEGATIVE_REGULATION_OF_NF_KAPPAB_TRANSCRIPTION_FACTOR_ACTIVITY	0.657492479063339	0.902940508457456	-0.262100688291471	-0.87087658791284	32345	28	PYCARD UFL1 CDK5RAP3 PRMT2 TRAF3 COMMD1 IRAK3 HAVCR2 ERBB2IP
GO_PROTEIN_POLYUBIQUITINATION	0.707372491180515	0.923960572209614	0.194933057120027	0.900865982107803	35490	143	ARIH1 UBR2 UBE2A MIB2 UBC PSMD1 UNKL KLHL20 UBE2B MYLIP UBE2K UBE2S PSMB1 PSMD12 ITCH TTC3 UBE2D1 PSMD13 TNFAIP3 PSMB3 ANAPC5 CDC16 PSMB4 PSMA7 ANAPC11 PSME4
GO_RIBONUCLEOPROTEIN_COMPLEX_LOCALIZATION	0.905402451866717	0.97597787452731	0.184003953621636	0.764248231660806	45567	76	TGS1 EIF4A3 NUP210 NUP54 NUP98 MAGOH CPSF1 SMG5 SLBP NOP58 SMG6 CASC3 POLR2D CHTOP NUP107 TPR SRSF4 U2AF1 POM121 UPF3B SHFM1 PABPN1 RBMX2 SMG1
GO_REGULATION_OF_MRNA_3_END_PROCESSING	0.300799120378551	0.708931667267949	0.377442964380259	1.12282286166123	15319	18	TOB1 PAF1 CNOT1 BTG2
GO_REGULATION_OF_PEPTIDE_TRANSPORT	0.388023050874309	0.781457415829721	0.257317394537002	1.03443444161228	19593	64	CCL5 RAB8B HLA-DRB5 MIDN TNF PTGER4 PRDX1 BCL3 IFNG
GO_POSITIVE_REGULATION_OF_ION_TRANSPORT	0.0324101471574545	0.327435848854119	0.376818895882006	1.45824318083294	1642	53	CCL5 F2R GLRX CCL4 ATP1B3 LGALS3 GSTM2 WNK1 STIM2 PARK7 CCL3 P2RX4 TRPV2 ATP1B1
GO_ATP_BIOSYNTHETIC_PROCESS	0.847947009454174	0.96308600140943	0.229854442205222	0.738936382137339	43140	24	ATP5B TGFB1 ATP5F1 ATP5E ATP5A1 ATP5G3 ATP5O GBAS ATP5S ATP5C1 STOML2 ATP5J ATP5L ATP5G2
GO_CANONICAL_WNT_SIGNALING_PATHWAY	0.973218668394495	0.997599929398115	0.189545900218139	0.563863921661741	49566	18	PPP1CA UBE2B AXIN1 FAM105B SCYL2 CSNK1A1 GSK3B
GO_HUMORAL_IMMUNE_RESPONSE	0.383758577857419	0.775098011792666	-0.319377263340484	-1.05149323080761	18845	27	BST2 C1QBP HLA-E GPR183 PSMB10 HLA-A CD55 B2M CD83 YTHDF2
GO_CHROMATIN_MODIFICATION	0.118025059425487	0.519490595915316	0.237092841296623	1.16690734686254	5858	229	NAA50 ZBTB1 PBRM1 SMARCA4 RCOR1 UBR2 DR1 UBE2A TET2 KDM6B HDAC3 HIST1H4C CTCF SMYD2 UBE2B EP300 PAF1 NASP BANP ARID2 WAC RRP8 CTBP1 SMARCD1 ARID4A TOP1 NCOR1 PHF8 PER1 EZH2 REST DNAJC2 BRMS1 USP16 CREBBP SETD2 HOPX MECP2 PSME4 MBIP ZNF335 CHRAC1 BAZ1A ACTB RBL2 INO80 DMAP1 SIRT2 TAF9 KAT5 MCRS1 USP3 APBB1 HDAC1 BCOR RBBP4 SMARCAD1 CHD3 KDM3A PRKCB SUPT7L DPY30 SRCAP UBE2N SUPT6H RTF1 CRTC2 BRD4 RNF168 WBSCR22 LEO1 PRKAA1 BAG6 RNF40 TAF10
GO_MYELOID_LEUKOCYTE_ACTIVATION	0.502042749718752	0.840301146774142	0.272743620519511	0.968794294033767	25436	36	CCL5 NR4A3 DOCK2 TGFB1 CCL3 RBPJ LAT LCP2 HMGB1 RELB RASGRP1 SNAP23
GO_ANTERIOR_POSTERIOR_PATTERN_SPECIFICATION	0.188336313441927	0.606721507534564	0.36873802919921	1.22141568275696	9584	27	SKI ZEB2 NOTCH1 EP300 ABI1 FRS2 HIPK1 RBPJ BTG2 AXIN1 ZBTB16
GO_POSITIVE_REGULATION_OF_CELL_DIVISION	0.152992040876486	0.560590239331005	0.386437511896474	1.26831505675365	7784	26	KIF3B CAT UBE2B PHB2 TGFB1 ANAPC11 SIRT2
GO_ERBB_SIGNALING_PATHWAY	0.926051917547483	0.982904218581526	-0.193450761105247	-0.691981213456428	45733	38	CPNE3 MVP CUL5 ERBB2IP PIK3C2A IQGAP1 UBB FES UBA52
GO_EMBRYONIC_ORGAN_MORPHOGENESIS	0.170004538189854	0.585359244398446	0.348554321418684	1.22961632291816	8615	35	EIF4A3 NOTCH1 NR4A3 AHI1 FRS2 HIPK1 SETD2 RAC1 GNAS AXIN1
GO_REPRODUCTIVE_SYSTEM_DEVELOPMENT	0.705593288054335	0.923960572209614	0.206610114067984	0.885018274762453	35321	90	ANXA1 DNAJB6 HMGB2 NOTCH1 TIPARP NASP FRS2 TMF1 ARID4A ZFP36L1 RBPJ SETD2 DAZAP1 WDR48 PRDM1
GO_POSITIVE_REGULATION_OF_CATABOLIC_PROCESS	0.33499537576903	0.743592809686228	0.217120541514008	1.04766930220015	16661	195	TOB1 FOXO1 CD81 ARIH1 TNF CSNK1D UBC PLEKHF1 PSMD1 IFNG TIPARP MYLIP RDX HERPUD1 WAC CNOT1 SQSTM1 PSMB1 PSMD12 ITCH NSF PARK7 UBE2D1 PSMD13 TNFAIP3 TNFRSF1B PSMB3 SPTLC1 ANAPC5 CDC16 GTPBP1 PSMB4 BTG2 MTDH PSMA7 ANAPC11 PSME4 PTK2B HMGB1 MDM2 SIRT2 ZC3H12A FBXW7 PSME3 AXIN1 PSMD8
GO_GLIOGENESIS	0.208592224391976	0.622888727257172	0.324361582448038	1.18024453450925	10574	40	ANXA1 DUSP10 SKI NOTCH1 TGFB1 PAFAH1B1 CCL3 GPR56 PTK2B SIRT2
GO_PEPTIDYL_THREONINE_MODIFICATION	0.178078148978869	0.594800521664115	0.408261430797873	1.24977092863402	9050	20	WNK1 GALNT2 PRKCB CAMK2D DYRK1A TNKS GSK3B GALNT1 GALNT11 MAPK1 VRK1 TGFBR2 CLK1 GALNT3 PKN1
GO_ANTIGEN_PROCESSING_AND_PRESENTATION	0.447253670440453	0.814048865619546	0.223885554062653	1.00221974774634	22359	117	RAB8B HLA-DRB5 KIF3B HLA-DQB1 HLA-DRA PSMD1 DCTN2 HLA-DMA HLA-DMB IFNG CLTA DCTN1 PSMB1 PSMD12 AP2S1 SAR1B PSMD13 ERAP2 PSMB3 PSMB4 PSMA7 PSME4 AP3D1 KIF22 RELB AP1G1 PSME3 PSMD8 ACTR1A PSMA4 DYNC1H1 PSMB6 RAB35 ARF1 DCTN3 CD8A
GO_MAINTENANCE_OF_LOCATION	0.429755000591786	0.805277749550199	0.261304351933591	1.01121598065626	21785	53	SYNE2 SYNE1 SUN2 TNF BCL3 VPS13A FLNA NFKBIB
GO_KERATINOCYTE_DIFFERENTIATION	0.693581983964785	0.91957729501367	0.286531912524629	0.838255588810993	35294	17	ANXA1 NOTCH1 RBPJ FOSL2
GO_POSITIVE_REGULATION_OF_CALCIUM_ION_TRANSMEMBRANE_TRANSPORT	0.382596061337889	0.775065373543316	0.354000114277788	1.05308472763409	19485	18	F2R GSTM2 STIM2 ATP1B1 CALM1 CXCR3 BAX
GO_CELL_REDOX_HOMEOSTASIS	0.461387022792312	0.820156928332199	-0.291283063422964	-0.99262701894898	22732	31	APEX1 ERP44 DDIT3 QSOX1 TXNDC12 TXNL1 PDIA4 KRIT1 TXNDC11 GPX1
GO_POSITIVE_REGULATION_OF_PROTEIN_SECRETION	0.490380809120418	0.836718980429703	0.244872735826347	0.978182422451509	24775	62	F2R HLA-DRB5 TNF PTGER4 IFNG EP300 NLRP1 TGFB1 DNM1L GLMN CCL3 IFNAR1 HMGB1 RASGRP1 IL4R FCN1 APBB1 ARF1
GO_POSITIVE_REGULATION_OF_CYTOSKELETON_ORGANIZATION	0.00291106402360536	0.10393432735413	0.421122712972715	1.69294360852677	146	64	DSTN ID1 CLIP1 ARPC1A ARPC4 S100A10 PFDN2 BAG4 BRK1 EP300 ACTR2 PLEK ARPC2 PFN1 WDR1 IQGAP2 PTK2B RAC1 SIRT2 NCK1 VPS4B ARPC1B
GO_RESPONSE_TO_KETONE	0.0286600300229122	0.316336024568816	0.389645661390298	1.48219300710729	1450	49	CCL5 FOXO1 GNB1 PTGER4 TGFBR3 GNG2 ATP2B1 CDKN1A EP300 NASP KLF6 TGFB1 CDC5L DCPS ABHD2 GNAS CALM1
GO_REGULATION_OF_ENDOTHELIAL_CELL_MIGRATION	0.863466981612332	0.968314947438768	-0.22150226174913	-0.729257074851581	42403	27	SP100 PDCD6 RHOB PRKD2 KRIT1 FOXP1
GO_CILIUM_MORPHOGENESIS	0.0573108878845888	0.41091667565852	0.371444410665189	1.39449400797654	2903	46	RAB8B CDC14A CSNK1D NOTCH1 SCLT1 UBE2B AHI1 FLNA ACTR2 TMEM216 C21orf2 BBIP1 RAB8A ABLIM1
GO_ENERGY_COUPLED_PROTON_TRANSPORT_DOWN_ELECTROCHEMICAL_GRADIENT	0.966043074988209	0.995648929091542	0.196734458288527	0.57555110604961	49159	17	ATP5F1 ATP5E ATP5A1 ATP5G3 ATP5O ATP5S ATP5C1 STOML2 ATP5J ATP5L ATP5G2
GO_CELLULAR_MODIFIED_AMINO_ACID_BIOSYNTHETIC_PROCESS	0.0252779761297562	0.291349443185688	-0.575707697359012	-1.62329848685476	1238	15	PLSCR1 CNDP2 GGCT MAT2A
GO_PROTEIN_LOCALIZATION_TO_VACUOLE	0.447643979057592	0.814048865619546	0.300033372513217	1.00260479406526	22742	28	CD81 HSPA8 PACSIN2 VPS13A TNFAIP3 TOLLIP VPS25 RAB35 GNPTAB GNPTG
GO_CELLULAR_RESPONSE_TO_HYDROGEN_PEROXIDE	0.285202535133646	0.700345001929413	0.336671046595793	1.12503486699648	14489	28	ANXA1 FOXO1 KDM6B EP300 KLF6 PARK7 TNFAIP3 EZH2
GO_REGULATION_OF_ORGAN_GROWTH	0.521878125796772	0.844377869769753	0.336557558539181	0.951327324208975	26608	15	CTDP1 NOTCH1 RBPJ SASH3 POR
GO_POSITIVE_REGULATION_OF_CELL_GROWTH	0.937909225436338	0.986225076243032	-0.185943686706656	-0.693503750171964	46267	46	H3F3B LEF1 CD38 ADAM10 MUL1 ZNF639 ITSN2 NOL8 S100A8 SUPV3L1 DERL2 SDCBP
GO_REGULATION_OF_TRANSMEMBRANE_RECEPTOR_PROTEIN_SERINE_THREONINE_KINASE_SIGNALING_PATHWAY	0.00202911684166979	0.0854958437474049	0.486818494658754	1.78179852021958	102	41	TOB1 SKI TGFBR3 UBC NOTCH1 TGFB1 GLG1 C10orf54 PARP1 RBPJ STRAP CITED2 FKBP8 THBS1 TRIM33 PPM1A LEMD3
GO_POSITIVE_REGULATION_OF_CELL_ADHESION	0.178413306210363	0.594800521664115	0.250290937687886	1.14769456165917	8945	136	CCL5 ANXA1 CD3E HLA-DRB5 ZBTB1 TNF PTGER4 HLA-DQB1 LCK ITGB1 HLA-DRA S100A10 SKAP1 HLA-DMB NR4A3 BAG4 IFNG SPN FLNA CCDC88B TGFB1 ITGA4 RSU1 ARPC2 LGALS1 UNC13D GPR56 CITED2 PTK2B AP3D1 RAC1 HMGB1 DHPS RASGRP1 NCK1 IL4R CORO1A CD247 ZBTB16 FYN SART1 VAV1
GO_CEREBRAL_CORTEX_DEVELOPMENT	0.794674098787534	0.950551419899164	-0.247129264755149	-0.773276110361289	39062	22	MCPH1 TRA2B HIF1A
GO_REGULATION_OF_INTERLEUKIN_8_PRODUCTION	0.110517214274485	0.504311823501601	0.464073843161764	1.35765852125776	5623	17	ANXA1 F2R TNF PTGER4 BCL3 PARK7
GO_RNA_PHOSPHODIESTER_BOND_HYDROLYSIS	0.433522132975469	0.805277749550199	0.269127513240506	1.01037111831465	21966	46	PAN3 NOL9 CNOT1 DCPS TSEN15 CPSF1 RNASEK TSEN54 ZC3H12A SMG6 CNOT6L RPP14 ABT1 WDR33 FEN1 CNOT8 PDE12 XRN2 DICER1
GO_ORGANIC_ACID_METABOLIC_PROCESS	0.995990313231966	0.999283966851472	-0.146895371103479	-0.710475329199828	50175	209	THEM4 CNDP2 SLC35D1 ATF4 WARS TARSL2 B4GALT4 SUCLG1 LARS PTPLAD2 GARS DNMT1 HIF1A MARS ME2 ECH1 AKR1A1 QKI ACAA1 ABCC1 GLUD1 CYB5A CRTAP ALKBH7 GPX1 UGP2 TPI1 PNKD GPX4 B4GALT1 LTA4H GRHPR HSD17B10 PTS DARS SLC7A6 ETFB PEPD ADIPOR1 PNPLA8 OGDH B3GAT3 DEGS1 PEX2 B3GNT7 SMS SYK EIF2B1 MTHFD2L
GO_REGULATION_OF_SYMBIOSIS_ENCOMPASSING_MUTUALISM_THROUGH_PARASITISM	8.00961153384061e-05	0.00642075145022675	-0.420338039389965	-1.85827227738123	3	113	PLSCR1 MX1 IFITM3 EIF2AK2 BST2 ISG15 IFITM1 STAT1 ISG20 SP100 LEF1 TAP1 GSN ADAR OASL TARDBP SUPT4H1 IFI16 RAB7A RSF1 POLR2F C19orf66 POLR2G ZNF639 RAD23A PML PPIH TRIM38 ZC3HAV1 IRF8 TRIM11 IFITM2
GO_G1_DNA_DAMAGE_CHECKPOINT	0.574042276037658	0.873591295220446	0.261125180523849	0.927525213745359	29084	36	UBC CDKN1A EP300 WAC CNOT1 PPP2R5C BTG2 RBL2 MDM2 RPS27L CNOT6L CNOT8 BAX E2F4 MDM4 DGKZ TFDP2 PRKDC
GO_RESPONSE_TO_OXYGEN_LEVELS	0.00802747713566836	0.151595818215891	0.354447242302757	1.53006379512949	401	94	FOXO1 USF1 CAT CXCR4 GNB1 TGFBR3 EGR1 UBC NOTCH1 CDKN1A EP300 TGFB1 LDHA RORA BACH1 UBE2D1 POLG RBPJ CREBBP MECP2 ATP1B1 TCEB2 CITED2 PTK2B HP1BP3 MDM2 SIRT2 THBS1 HMOX2 KDM3A PMAIP1 PRKCB CAMK2D P4HB AGTRAP ICAM1 CYB5R4 CAPN2 PRKAA1 ADAM17 MDM4 ITPR2
GO_POSITIVE_REGULATION_OF_IMMUNE_SYSTEM_PROCESS	0.171122886905362	0.588289829264707	0.214631153033633	1.108497560421	8492	349	CCL5 ANXA1 CD3E LIME1 HLA-DRB5 ZBTB1 PDE4B ICAM3 FCGR3A CD81 ITGAM CCL4 TNF HMGB2 PTGER4 HLA-DQB1 ARPC1A LCK MYO1G ARPC4 UBC HLA-DRA PSMD1 MB21D1 SKAP1 HLA-DMB NR4A3 ELMO2 CDKN1A IFNG BRK1 EP300 NLRC5 LGALS3 ABI1 SPN CCDC88B TGFB1 ACTR2 UBE2K PSMB1 PSMD12 ITGA4 ITCH ARPC2 UBE2D1 NRAS PSMD13 LGALS1 CCL3 TNFAIP3 PSMB3 ELMO1 CREBBP UNC13D PSMB4 ACTG1 PSMA7 ITGB2 PSME4 PTK2B AP3D1 RAC1 PRDM1 ZNF335 LAT LCP2 ACTB HMGB1 GNAS PRKCH RELB AP1G1 PSME3 FAM105B DHPS RASGRP1 PSMD8 NCK1 NFKB1 CMTM3 IL4R PSMA4 FCN1 PSMB6 CORO1A THBS1 ARPC1B PUM2 CD247 IL27RA WASF2 ZBTB16 LAT2 PDE4D FYN SART1
GO_REGULATION_OF_RECEPTOR_MEDIATED_ENDOCYTOSIS	0.584363271962745	0.881462749005509	0.276360173763893	0.915421311595436	29739	27	PICALM AHI1 RAC1 ATAD1 ANXA2 UNC119 TBC1D5 ARF1 RAB21 HNRNPK SCYL2 ARRB2 PPT1 PLCG2
GO_POSITIVE_REGULATION_OF_LYMPHOCYTE_MEDIATED_IMMUNITY	0.146588757456685	0.551956134288592	-0.392762177488761	-1.28142721830409	7199	26	FCER1G HLA-E HSPD1 HLA-B XCL1 NCR3 HLA-A MALT1 CD226 B2M
GO_RESPONSE_TO_TRANSFORMING_GROWTH_FACTOR_BETA	0.0492898091054156	0.402014888218589	0.390285721181179	1.42848007644187	2501	41	CCL5 ID1 SKI TGFBR3 ZYX ITGB1 UBC TGFB1 NEDD8
GO_TRANSCRIPTION_ELONGATION_FROM_RNA_POLYMERASE_II_PROMOTER	0.349274848269883	0.752687187699164	0.276135706982392	1.06045204614239	17724	51	CTDP1 TAF13 POLR2E TAF2 PAF1 CCNK SETD2 TCEB2 TAF11 TAF9 ELL2 POLR2D POLR2A ELL POLR2J RTF1 LEO1 TAF10 CDK7 TAF3 POLR2I ADRM1 POLR2L GTF2B
GO_OXIDATIVE_PHOSPHORYLATION	0.174293405114401	0.592582215367214	0.298576978495778	1.19271241499246	8805	62	NDUFB3 DLD TAZ NDUFB9 NDUFA12 COX6C MECP2 NDUFB4 NDUFS1 NDUFV2 UQCRB NDUFA4 UQCRQ NDUFB5 NDUFB1 COX8A NDUFS7 NDUFA11 NDUFB2 COX7B COX6B1 UQCRC2 NDUFA3 GBAS NDUFS4 UQCR10 COX7C NDUFA1 NDUFC1 NDUFB10 ATP5C1 CYC1 NDUFB11 UQCRC1 COX4I1 NDUFA6 NDUFS6 NDUFB6 NDUFC2
GO_CELLULAR_AMIDE_METABOLIC_PROCESS	0.304974966224271	0.71647228907233	-0.205133814611635	-1.04925310208843	15349	340	EIF2AK2 CNDP2 SPTLC2 ABTB1 WARS MRPS21 TARSL2 RPL28 MRPL41 MTRF1L RPL12 LARS CERS4 RPL36 GADD45GIP1 RPS12 MRPS35 MRPS10 GGCT GARS MRPS18A PABPC4 SLC25A26 MARS RPS29 RPL32 MRPL33 ECE1 MRPS26 RPS15 PTBP1 RPLP1 AGK RPL38 SLC25A39 CDKAL1 MRPL51 RPL41 EIF6 IMMP2L GPX1 EIF2B5 RPL7L1 SMPD2 RPL22L1 ST6GALNAC6 RPL18A MRPL2 SAMD8 RPL8 PCBP2 RPL9 LTA4H MRPS7 RPL30 RPS20 EIF1AX DARS NSMAF MRPS18B RPS24 SMPD4 EIF4E2 COPS5 RPL13 METTL17 LNPEP NOA1 MRPL27 EIF5 ERAP1 RPL11 DEGS1 RPL35 MRPS30 GSPT1 RPL29 RPS18 RPL13A UBA52 EIF2B1 RPSA MRPS11 RPL39 MTHFD2L SLC25A36 SLC25A16 TAPBP EIF2D MRPL14 EPRS DNPEP EIF3M MRPS23 MRPL55 EEF1A1 DENR MRPL40 CPD APOA1BP SLC25A38 GLA RPS27 GSTP1 ATPIF1 MRPL42 EIF3E
GO_REGULATION_OF_DNA_BINDING	0.340197626857814	0.745035837587809	-0.300349527463269	-1.07436243356015	16800	38	SP100 ACD JAK2 LEF1 DDIT3 IFI16 EDF1 RSF1 CPNE1
GO_IMMUNOGLOBULIN_PRODUCTION	0.131206470456077	0.528919351345927	-0.464863881530935	-1.33434218255714	6423	16	TMIGD2 CTNNBL1 HSPD1 IL7R
GO_TISSUE_MIGRATION	0.107458763998666	0.496819709259371	0.484782162366126	1.37030503593434	5478	15	MYH9 ID1 ZEB2 ITGB1 ITGB2 PTK2B HMGB1 PRKX
GO_ENSHEATHMENT_OF_NEURONS	0.607235497563276	0.893403411930281	0.306079134005587	0.895441427232151	30900	17	CXCR4 SKI TGFB1 SIRT2
GO_POSITIVE_REGULATION_OF_PHOSPHORUS_METABOLIC_PROCESS	0.506775668002336	0.841698320322371	0.195886321694147	0.982826722958773	25167	268	ATP2B4 CCL5 CD3E RAP2B F2R CD81 CXCR4 CCL4 TNF PTGER4 ZEB2 CSNK1D GNAI2 ITGB1 HDAC3 UBC TERF2IP BAG4 CDKN1A IFNG EP300 PHB2 ABI1 SPN TGFB1 UBE2K SQSTM1 FRS2 PLEK CDK10 GLMN PARK7 ARHGEF2 CCL3 EZH2 TNFRSF1B CCNK PRKAG1 BTBD10 PTK2B RAC1 TXN LAT LCP2 HMGB1 PTPLAD1 TRAF7 GNAS CALM1 TRAF4 ZC3H12A FBXW7 ANXA2 AXIN1 RASGRP1 UNC119
GO_RESPONSE_TO_CAMP	0.766720466086683	0.941491562062879	0.240898620849384	0.80499749119296	38953	28	CREM EP300 LDHA PER1 INPP5K PTK2B PDE4D AKAP7 FOSB
GO_NEGATIVE_REGULATION_OF_HEMOPOIESIS	0.135688502278241	0.536417509006574	0.347503908959863	1.26445180768651	6878	40	ANXA1 HIST1H4C NOTCH1 PAF1 CCL3 PTK2B CUL4A HMGB1 IRF1 GABPA IL4R ZBTB16 KLF13 NFKBID RARA CIB1 ID2 INPP5D CD74 LEO1
GO_REGULATION_OF_MUSCLE_CELL_DIFFERENTIATION	0.261957917613356	0.687079794594859	0.303057642524447	1.12654424718719	13258	44	CTDP1 TNF AKAP13 HDAC3 NOTCH1 EP300 TGFB1 EZH2 RBPJ HOPX
GO_REGULATION_OF_ENDOPLASMIC_RETICULUM_STRESS_INDUCED_INTRINSIC_APOPTOTIC_SIGNALING_PATHWAY	0.400680050494767	0.786358324800181	-0.35610662727139	-1.04055963919823	19678	17	DDIT3 TXNDC12 HYOU1 PTPN2 TMBIM6
GO_RIBOSOMAL_SMALL_SUBUNIT_BIOGENESIS	0.125268882665693	0.519490595915316	-0.389564868652277	-1.3056911665343	6172	29	TSR2 UTP23 RPS15 RPL38 MRPS7 RPS24 RPSA MRPS11 RPS27 NGDN
GO_REGULATION_OF_CALCIUM_ION_IMPORT	0.0700685752461046	0.441913897292245	0.426131333642455	1.41152648387086	3565	27	F2R LGALS3 GSTM2 TGFB1 CCL3 TRPV2 PTK2B CALM1 CORO1A PDE4D CAMK2D PTPN6 CXCR3 BAX
GO_REGULATION_OF_METAL_ION_TRANSPORT	0.00418718720714613	0.122666655459328	0.37998320652573	1.60755016026406	209	84	ATP2B4 CCL5 F2R PDE4B GLRX CXCR4 CCL4 KCNAB2 GNAI2 ATP1B3 LGALS3 GSTM2 TGFB1 STIM2 CCL3 PER1 P2RX4 INPP5K TRPV2 PRNP ATP1B1 PTK2B AHNAK CALM1 CORO1A ARF1 PDE4D YWHAH AKAP7 CAMK2D PTPN6 ATP1A1 ICAM1 CXCR3
GO_MODIFICATION_BY_SYMBIONT_OF_HOST_MORPHOLOGY_OR_PHYSIOLOGY	0.449955244527626	0.815834656805999	-0.319853649427149	-1.000833252828	22117	22	EIF2AK2 RRAGA
GO_SISTER_CHROMATID_SEGREGATION	0.145018515951443	0.548386089365162	0.303802468102404	1.22130778223293	7322	64	NAA50 RAB11A CDC14A TOP2B CLIP1 PDS5A PHB2 AHCTF1 PAFAH1B1 NUP98 WAPAL VPS4A INO80 KIF22 FBXW7 PPP2R1A VPS4B PIBF1 NUP107 PPP1CC STAG2
GO_MONOSACCHARIDE_BIOSYNTHETIC_PROCESS	0.700932291560415	0.922674946799367	-0.260345988375737	-0.841013761795755	34358	25	ATF4 TKT AKR1A1 TPI1
GO_ORGANELLE_MEMBRANE_FUSION	0.931854167512484	0.98434603133859	-0.195771511855845	-0.677086961306896	45904	33	SNAP29 RAB7A VAMP5
GO_REGULATION_OF_ERK1_AND_ERK2_CASCADE	0.847299483173551	0.96308600140943	0.202577369692818	0.783949720074886	42952	53	CCL5 F2R CCL4 TNF PHB2 FRS2 CCL3 PTK2B HMGB1 FBXW7 RASGRP1
