pathway	pval	padj	ES	NES	nMoreExtreme	size	leadingEdge
GO_AMINO_ACID_ACTIVATION	0.0706861129757328	0.441913897292245	-0.450990452933472	-1.42713385672647	3474	23	WARS TARSL2 LARS GARS MARS
GO_REGULATION_OF_PROTEASOMAL_UBIQUITIN_DEPENDENT_PROTEIN_CATABOLIC_PROCESS	0.960529182262888	0.993720666858571	0.170711469092093	0.700508226384922	48499	71	ARIH1 CSNK1D HERPUD1 WAC UBE2K GLMN PARK7 ANAPC11 MDM2 SIRT2 TAF9 SGTA RFWD2 NSMCE2 TPR RNF166 ARIH2 ARAF RNF19A BAG6 GOLGA2 ANAPC10 CSNK1A1 GSK3B CHFR
GO_NEGATIVE_REGULATION_OF_NEURON_DIFFERENTIATION	0.281359280845599	0.700345001929413	0.298930746721584	1.11120349984048	14240	44	RAP1GAP2 ID1 ITGB1 NOTCH1 C3orf17 PAFAH1B1 DDX6 LGALS1 REST ARHGAP4 CERS2
GO_MUSCLE_TISSUE_DEVELOPMENT	0.0512597912515045	0.405761460445068	0.351139547365466	1.38527910764325	2597	58	GTF3C5 SKI TGFBR3 EGR1 AKAP13 ITGB1 KDM6B NOTCH1 EP300 TIPARP TAZ NCOR1 COPS2 RBPJ BTG2
GO_POSITIVE_REGULATION_OF_ADAPTIVE_IMMUNE_RESPONSE	0.140320511515201	0.544400840330774	-0.391496388935072	-1.2889327140736	6890	27	FCER1G HLA-E HSPD1 HLA-B PYCARD XCL1 NCR3 HLA-A MALT1 CD226 B2M
GO_REGULATION_OF_OSTEOCLAST_DIFFERENTIATION	0.117636642663204	0.519490595915316	0.436523346014605	1.33628637525939	5978	20	CCL5 TNF IFNG CCL3 GNAS ZBTB7A INPP5D RASSF2 PIK3R1 TFE3 TYROBP NF1
GO_REGULATION_OF_PROTEIN_BINDING	0.453662963912949	0.818326654229457	0.252988050134278	0.998062060977883	22992	58	ID1 TGFBR3 PPP1CA AES EP300 HERPUD1 GTPBP4 ADD1 ITGA4 DERL1 PARK7 MITD1 HOPX TRAF4 ANXA2
GO_CARDIAC_SEPTUM_DEVELOPMENT	0.622750708157568	0.894158836637741	-0.297587887793611	-0.883479507187351	30558	18	LMO4 DHRS3 SOX4
GO_REGULATION_OF_HISTONE_METHYLATION	0.187137606384024	0.606721507534564	0.382383601701652	1.22928733732188	9520	24	CTCF PAF1 MECP2 ZNF335 BCOR CHTOP KDM3A SUPT6H RTF1 SNW1
GO_COGNITION	0.20653783138238	0.620416134612703	0.311334612702309	1.17360709954812	10462	47	EIF4A3 ITGB1 HLA-DRA EP300 PAFAH1B1 PRNP MECP2 BTG2 GNAS ATAD1
GO_AXIS_SPECIFICATION	0.137897895542001	0.539075371903841	0.467404024375407	1.32118328218083	7030	15	SKI NOTCH1 AHI1 FRS2 CITED2 AXIN1 BCOR
GO_PHOSPHATIDYLINOSITOL_METABOLIC_PROCESS	0.208678991862211	0.622888727257172	0.308010400687212	1.17165647472103	10564	49	PLA2G16 SYNJ2 LCK IP6K2 FRS2 PLEK INPP5K CDIPT GPAA1 IP6K1 MPPE1 MTMR6 ARF3 DPM3 ARF1 FYN VAV1 PIP4K2C MTMR14 INPP5D SMG1 PIK3R5 ALG5 DPM1
GO_CELL_PART_MORPHOGENESIS	0.0290788368465261	0.316336024568816	0.304881644825256	1.37078335380085	1453	120	RAB8B CDC14A TOP2B S100A6 ZEB2 CSNK1D ITGB1 NOTCH1 SCLT1 PACSIN2 NR4A3 UBE2B ABI1 AHI1 FLNA ACTR2 DNM1L TMEM216 PAFAH1B1 C21orf2 SNX2 NRAS BBIP1 PACSIN1 RAB8A STMN1 ABLIM1 RAC1 ZNF335
GO_RESPONSE_TO_ORGANOPHOSPHORUS	0.728939141731964	0.933186793462709	-0.241004471129708	-0.833527735837001	35908	33	STAT1 SELL APEX1
GO_AXO_DENDRITIC_TRANSPORT	0.0731755153274364	0.441913897292245	0.509742973167499	1.44086028197554	3730	15	KIF3B BLOC1S2 PAFAH1B1 AP3D1 AP3M2 OPA1 AP3S1 RAB21
GO_SINGLE_ORGANISM_MEMBRANE_FUSION	0.953874393084119	0.993397335393256	0.181500761548605	0.671135883267512	48328	43	SYTL2 VAMP4 NSF RAB8A VCPIP1 VPS4A SNAP23 STX12 STX11 OPA1
GO_REGULATION_OF_PROTEIN_UBIQUITINATION_INVOLVED_IN_UBIQUITIN_DEPENDENT_PROTEIN_CATABOLIC_PROCESS	0.465808911126996	0.820933867061575	0.245528264221208	0.992477238999902	23459	66	UBC PSMD1 PSMB1 PSMD12 UBE2D1 PSMD13 PSMB3 ANAPC5 CDC16 PSMB4 PSMA7 ANAPC11 PSME4 PTK2B FBXW7 PSME3 AXIN1 PSMD8 PSMA4 PSMB6
GO_REGULATION_OF_TYROSINE_PHOSPHORYLATION_OF_STAT_PROTEIN	0.513692220052083	0.843870037146604	-0.31727560728309	-0.955981835501366	25248	19	TNFRSF18 SOCS1 JAK2
GO_ORGAN_REGENERATION	0.0306263039798449	0.320332874389385	0.458501038197838	1.53214735791034	1555	28	IGF2R TGFBR3 NOTCH1 CAST NR4A3 CDKN1A PRPS1 TGFB1
GO_GLAND_MORPHOGENESIS	0.0193741271808186	0.260423173185031	0.506094157926023	1.6094259902415	984	23	TNF TET2 NOTCH1 PHB2 TGFB1 FRS2
GO_RIBOSOME_BIOGENESIS	0.54245893479343	0.852694152069512	-0.202738072801653	-0.965569510431606	27244	186	ISG20 TSR2 GNL3 C1QBP RPL28 RPL12 NOLC1 RPL36 TSR1 UTP23 RPS12 RPS29 RPL32 RPS15 RPLP1 IMP3 RPL38 NMD3 PA2G4 NOL8 ERI3 RPL41 EIF6 MTG1 RPL7L1 SDAD1 RPL18A RPL8 RPL9 MRPS7 RPL30 RPS20 PNO1 XPO1 RPS24 SKIV2L2 RPL13 NOC2L NOA1 WDR43 RPL11 RPL35 RPP38 RPL29 RPS18 RRP1B RPL13A UBA52 RPSA MRPS11 RPL39
GO_IRE1_MEDIATED_UNFOLDED_PROTEIN_RESPONSE	0.988438165890616	0.999260380004157	0.160389189605874	0.553482917279166	50097	32	ACADVL DCTN1 ADD1 DNAJB11 SRPR SEC61B SEC61A1 PTPN1 ATP6V0D1 DNAJC3 TLN1 LMNA
GO_SINGLE_ORGANISM_BEHAVIOR	0.6809711468008	0.914042736684508	0.220224330960525	0.885317656960145	34386	64	EIF4A3 ITGB1 NR4A3 EP300 PAFAH1B1 CSTB PARK7 PRNP MECP2 BTG2 ATAD1 THBS1 OXR1 FYN
GO_POSITIVE_REGULATION_OF_ENDOCYTOSIS	0.944520101841435	0.990515527561181	0.188181337030896	0.668426286972077	47855	36	TNF ITGB1 DOCK2 AHI1 ATAD1 TBC1D5 ARF1 RAB21 HNRNPK SCYL2 TSG101 ARRB2 CYBA PPT1 PLCG2 LMAN2 ACTN4 DNM2
GO_MRNA_SPLICE_SITE_SELECTION	0.544310232633805	0.852694152069512	-0.306560017586536	-0.936171176281061	26766	20	SETX LUC7L3 PSIP1 SF1 PTBP2
GO_LYSOSOMAL_TRANSPORT	0.807520817639514	0.956325908010133	-0.236473894535799	-0.771520533911939	39662	26	RAB7A LYST RHOB HOOK3 HGS
GO_POSITIVE_REGULATION_OF_DNA_BIOSYNTHETIC_PROCESS	0.836348483616554	0.96308600140943	-0.226818312713043	-0.753644561329869	41144	28	ACD MAPKAPK5 PRKD2 ATM
GO_REGULATION_OF_CALCIUM_MEDIATED_SIGNALING	0.022891163814277	0.275479446882598	0.474694987757959	1.57238976362934	1164	27	ATP2B4 CD3E CCL4 GSTM2 PLEK CCL3 P2RX4 PRNP PTK2B CALM1 PDE4D NFAT5 CAMK2D SLA2 CIB1
GO_REGULATION_OF_ALPHA_BETA_T_CELL_ACTIVATION	0.358770201024833	0.763374721358106	0.305414758953941	1.06239243103487	18203	33	ANXA1 CD3E IFNG ITCH C10orf54 AP3D1 HMGB1 IRF1 IL4R ZBTB16 RARA SASH3
GO_MUSCLE_ORGAN_DEVELOPMENT	0.19289420212661	0.611828509329235	0.30714128982556	1.18385282086378	9777	52	GTF3C5 SKI TGFBR3 EGR1 FRG1 NOTCH1 EP300 TAZ NCOR1 COPS2 RBPJ BTG2 UNC45A
GO_POSITIVE_REGULATION_OF_HEMOPOIESIS	0.503044849542777	0.840301146774142	0.241351667176701	0.972813450113581	25359	65	CCL5 ANXA1 ZBTB1 TNF HMGB2 IFNG LGALS3 TGFB1 LGALS1 AP3D1 PRDM1 HMGB1 GNAS RASGRP1 IL4R ZBTB16 SART1 RARA SASH3 ID2 INPP5D CD74
GO_LEUKOCYTE_DEGRANULATION	0.0488555906407516	0.401138712451656	0.533714765130037	1.5086199270217	2490	15	NR4A3 CCL3 UNC13D LAT RASGRP1 SNAP23 CORO1A LAT2
GO_MYELOID_CELL_HOMEOSTASIS	0.232087626327299	0.646736802081178	0.316214508560592	1.15737292154476	11780	41	ANXA1 PDE4B TGFBR3 PRDX1 IFNG ADD1 ARID4A SFXN1 CEBPG HMGB1
GO_REGULATION_OF_BLOOD_PRESSURE	0.747744560410402	0.938030798964043	0.252309461547648	0.811124809711436	38042	24	F2R WNK1 ERAP2 P2RX4 MECP2 GCH1 PDE4D SOD2 AGTRAP ID2 ATP1A1
GO_REGULATION_OF_CYTOKINE_PRODUCTION	0.00284057049779508	0.10393432735413	-0.304420828614816	-1.48225162702286	142	220	EIF2AK2 BST2 ISG15 IRF7 TMIGD2 FCER1G IL18R1 TNFSF9 HERC5 SOCS1 ATF4 CD2AP UBE2L6 JAK2 LEF1 LTB C1QBP HLA-E HSPD1 TXK ANKRD17 DDIT3 TREX1 HLA-B IL12RB2 IFI16 CUEDC2 PYCARD GSDMD CD2 POLR2F FLOT1 XCL1 HIF1A PRKD2 ZBTB20 MUL1 POLR1D ELF1 PML HLA-A TRAF3 HSF1 MALT1 TNFRSF14 TRIM38 ZC3HAV1 FOXP1 IRF8 IRAK3 HAVCR2 B2M ERBB2IP SRGN OTUD5
GO_REGULATION_OF_ERBB_SIGNALING_PATHWAY	0.546247336437535	0.852694152069512	0.273430194652275	0.943573205776763	27685	32	EPN1 RHBDF2 UBC CLTA AP2S1 RBPJ EPS15 FBXW7 PDE6G ARAP1
GO_CHEMICAL_HOMEOSTASIS	0.0254116322550813	0.291521295262732	0.275021896015081	1.32521957906004	1263	193	ATP2B4 CCL5 CD52 ATP2A3 F2R RAB11A FOXO1 USF1 CXCR4 GNB1 PTGER4 LCK ITGB1 ATP5B ATP1B3 ANXA7 ATP2B1 ATP6V1H EP300 MYLIP PICALM ABCG1 HERPUD1 CUTC TGFB1 ACADVL CRY2 NR1D2 ATP6V1E1 STIM2 RORA DERL1 LGALS1 CCL3 POLG INPP5K SFXN1 PRNP ATP1B1 PTK2B IREB2 ANXA6 HMGB1 PTPLAD1 GNAS FBXW7 ERO1LB SLC39A7 DHPS
GO_REGULATION_OF_MICROTUBULE_BASED_PROCESS	0.0435086737548965	0.377299495882934	0.316340950929467	1.35750714082081	2176	91	KIF3B RAB11A CDC14A MYH9 SUN2 CLIP1 CSNK1D HDAC3 DCTN2 FLNA EML2 PAFAH1B1 KIAA0196 TBCD ARHGEF2 NCOR1 TUBB STMN1 INO80 SIRT2 PPP2R1A DYNC1H1 PIBF1 ATF5 TPR CHD3
GO_NEGATIVE_REGULATION_OF_TRANSPORTER_ACTIVITY	0.992984593617356	0.999260380004157	0.164288071516735	0.480628467909471	50530	17	GSTM2 FAM115C CALM1 CAMK2D WWP2 FKBP1A
GO_ENDOSOME_ORGANIZATION	0.890341174321609	0.973254963988744	-0.209554393256848	-0.714114134346916	43867	31	VTA1 HOOK3 HGS KIAA1033 RAB22A PDCD6IP VPS28 VPS36 STAM CHMP4A CHMP2B
GO_REGULATION_OF_WOUND_HEALING	0.499157719551054	0.840301146774142	-0.284486165964715	-0.969464724571822	24593	31	FCER1G TEC GSN TXK CLASP1 FAM46A
GO_REGULATION_OF_MAPK_CASCADE	0.337570905579917	0.744758132837869	0.219756134500845	1.04705540487331	16781	178	CCL5 F2R FOXO1 DUSP10 CD81 ID1 CXCR4 CCL4 TNF ZEB2 GNAI2 ITGB1 HDAC3 UBC PRDX1 PHB2 TGFB1 FRS2 CDK10 PAFAH1B1 ITCH NCOR1 CCL3 PER1 EZH2 TNFRSF1B INPP5K PTK2B MBIP HMGB1 PTPLAD1 TRAF7 TRAF4 ZC3H12A FBXW7 DNAJA1 PPP2R1A AXIN1 RASGRP1
GO_MYELOID_LEUKOCYTE_MIGRATION	0.154725819785065	0.563578468208211	0.378099189156135	1.2634729813712	7860	28	CCL5 ANXA1 PDE4B CCL4 IFNG LGALS3 GBF1 CCL3 ITGB2 RAC1
GO_POSITIVE_REGULATION_OF_NEURON_DEATH	0.924913980902742	0.982245826951918	-0.203322903188119	-0.663361996604979	45428	26	ATF4 DDIT3 ATM
GO_RESPONSE_TO_ESTRADIOL	0.291451171280803	0.702360865686361	-0.307082584490345	-1.11073657037596	14369	40	TXNIP SOCS1 CD38 DNMT1 NCOA3 HIF1A NRIP1 BID CALR
GO_CARTILAGE_DEVELOPMENT	0.268121701208453	0.689426142020546	-0.389538019325166	-1.15646123871418	13156	18	SNX19 SMAD5 RUNX2 HIF1A
GO_REGULATION_OF_TUMOR_NECROSIS_FACTOR_SUPERFAMILY_CYTOKINE_PRODUCTION	0.491106378663422	0.836718980429703	-0.269513102370752	-0.974845445877399	24213	40	FCER1G JAK2 HLA-E PYCARD CD2 ZBTB20 HSF1 FOXP1 IRAK3 HAVCR2
GO_REGULATION_OF_PHOSPHATIDYLINOSITOL_3_KINASE_SIGNALING	0.0971995033602018	0.482008447404001	0.38153528291087	1.3371219195486	4931	34	CCL5 F2R CAT LCK PPP2R5C FRS2 IER3 RASGRP1 FYN VAV1 PIP4K2C PTPN6 PPP1R16B
GO_CELLULAR_RESPONSE_TO_INTERLEUKIN_1	0.336896924437457	0.744758132837869	0.330451275960056	1.08456429803294	17142	26	CCL5 CCL4 PTGER4 EGR1 HSPA9 OTUB1 RORA CCL3
GO_CIRCULATORY_SYSTEM_PROCESS	0.195329603502797	0.614678391052376	-0.299180283061536	-1.17595075535749	9635	59	HBB STAT1 XCL2 FLI1 NUP155 SMAD5 CD38 ADH5 HIF1A ECE1
GO_CELL_CHEMOTAXIS	0.0562310030395137	0.41091667565852	0.380568162518363	1.40722797918871	2848	43	CCL5 ANXA1 PDE4B CXCR4 CCL4 HMGB2 RHOG ELMO2 IFNG LGALS3 GBF1 CCL3 ITGB2 RAC1 BIN2 HMGB1
GO_DNA_TEMPLATED_TRANSCRIPTION_TERMINATION	0.964225835774164	0.995648929091542	-0.171097425886442	-0.68403615648881	47733	64	SETX LSM10 TAF1D POLR2F THOC2 ERCC3 POLR1D ZC3H11A SRSF2 SRSF7 SNRPE CPSF7
GO_PROTEIN_HOMOTETRAMERIZATION	0.793895080291684	0.950551419899164	0.242657161577706	0.780094582274172	40390	24	CAT DNM1L USP16 DHPS SOD2 CRTC2 GOLGA2 DECR1
GO_VESICLE_LOCALIZATION	0.0819190991494629	0.45295357750435	0.301291370299959	1.28301720443033	4102	87	KIF3B RAB11A SYTL2 ANKRD28 CSNK1D DCTN2 BLOC1S2 TFG GBF1 DCTN1 PAFAH1B1 ITGA4 NSF SAR1B PACSIN1 AP3D1 TRAPPC4 SEC16A RASGRP1 SNAP23 AP3M2 ARF1 TRAPPC2L STX11 PPP6C AP3S1
GO_POSITIVE_REGULATION_OF_TYPE_I_INTERFERON_PRODUCTION	0.748132099540365	0.938030798964043	-0.225865359755645	-0.834446787839054	36947	44	IRF7 HSPD1 IFI16 POLR2F FLOT1 ZBTB20 POLR1D
GO_REGULATION_OF_STRESS_ACTIVATED_PROTEIN_KINASE_SIGNALING_CASCADE	0.391035671136287	0.782694860451028	0.252927572213109	1.03214662014672	19742	69	FOXO1 DUSP10 TNF ZEB2 HDAC3 PRDX1 PAFAH1B1 ITCH NCOR1 PER1 PTK2B HMGB1 PTPLAD1 TRAF4 ZC3H12A DNAJA1 AXIN1 RASGRP1
GO_MYELOID_CELL_DEVELOPMENT	0.805030335159333	0.955413250460813	0.255339080144049	0.759586437468865	41000	18	EP300 ABI1 PAFAH1B1 ARID4A ANXA2 WASF2 PTPN6
GO_NEGATIVE_REGULATION_OF_KINASE_ACTIVITY	0.401565636290646	0.786358324800181	-0.24327840110697	-1.02475680113696	20005	85	SOCS1 STK38 RANBP2 ADAR MVP PYCARD IBTK SH3BP5 LATS1 CDK5RAP3 PTPN2 TAF7 PIK3IP1 IRAK3 CHORDC1 SNX6 SMYD3 DUSP2 UBASH3B ITGB1BP1 HIPK3
GO_INTRACELLULAR_PROTEIN_TRANSPORT	0.954147012976497	0.993397335393256	0.16020498676592	0.841105793397909	47131	412	TOB1 RPS26 RAB8B F2R RAB11A VPS29 VPS26B PAN3 HSPA8 AIP SSR2 TNF SYTL2 GGA2 CLIP1 ITGB1 ATG3 SURF4 VAMP4 RHOG NUP54 BCL3 IFNG HSPA9 CLTA PHB2 VPS13A SPCS2 TOMM20 KPNA2 HERPUD1 TGFB1 COPB1 KPNA4 AP2S1 NSF ZDHHC3 DERL1 RHOF SNX2 SAR1B ARHGEF2 TBC1D22A RAB2B NUP98 INPP5K RRAS2 SRP14 YWHAQ BCAP29 NAPG RPS9 ATP1B1 GOLGA4 TOMM70A RAB8A AP3D1 RPL3 ZFAND6 NOP58 ZFAND2B COPB2 TIMM50 VPS25 AP1G1 ANXA2
GO_REGULATION_OF_PHOSPHATASE_ACTIVITY	0.575037528640278	0.873867254237591	0.24496088125204	0.93181919159861	29112	49	TNF SYTL2 PPP2R2B TIPRL BAG4 IFNG CRY2 PLEK WNK1 ARPP19
GO_CELL_DIVISION	0.218193128913148	0.634744522460355	0.235214037017433	1.11085183256857	10872	167	CTDP1 RAB11A CDC14A MYH9 PPP1CA GNAI2 PDS5A NOTCH1 ANXA11 MAPRE2 ACTR2 PRPF40A UBE2S AHCTF1 PAFAH1B1 DIAPH2 KIAA0196 SENP5 TOP1 ARHGEF2 ARPP19 MITD1 TUBB CCNK WAPAL ANAPC5 CKS2 CDC16 USP16 UBE2I ANAPC11 STMN1 VPS4A INO80 SIRT2 ARL8B VPS4B RAB35 AATF ZBTB16 SEPT9 NSMCE2 DCTN3 TPR PPP1CC
GO_REGULATION_OF_MRNA_CATABOLIC_PROCESS	0.2031308164025	0.61795062486758	0.426889893535472	1.22893736616303	10367	16	TOB1 CNOT1 GTPBP1 SECISBP2 BTG2 ZC3H12A
GO_REGULATION_OF_INTERLEUKIN_10_PRODUCTION	0.620197898602469	0.894158836637741	-0.312095359006171	-0.880001998154942	30398	15	FCER1G HSPD1 PYCARD XCL1
GO_NEGATIVE_REGULATION_OF_CELL_DIVISION	0.292400285626849	0.702360865686361	-0.403894783177532	-1.13884492666729	14331	15	TXNIP ATM ATRX
GO_CELLULAR_RESPONSE_TO_UV	0.129704235039796	0.527191882487911	0.397150616879553	1.30347621977827	6599	26	ZBTB1 YY1 CDKN1A EP300 CREBBP MDM2 INO80 FBXW7 HIST3H2A
GO_REGULATION_OF_NUCLEAR_DIVISION	0.811843248795133	0.956695605906783	0.210968987742477	0.802515693958112	41101	49	CDC14A UBE2B PHB2 TGFB1 CDC16 ANAPC11 AURKAIP1 SIRT2 VPS4B NSMCE2 TPR TNKS GOLGA2 ANAPC10
GO_RESPONSE_TO_ACID_CHEMICAL	0.0383404407955044	0.355191630765899	0.325752893089456	1.38127783828363	1923	85	ATP2B4 CCL5 FOXO1 CAT UBR2 IGF2R GNB1 TNF PTGER4 TGFBR3 EGR1 GNG2 SLC10A3 EP300 SMARCD1 LAMTOR3 PTK2B PEMT UBR1 GNAS GDAP2 ZC3H12A
GO_RESPONSE_TO_STEROID_HORMONE	0.20193344784884	0.616600266752365	0.249629814481383	1.13338965306304	10109	128	CCL5 ANXA1 FOXO1 CAT TNF HMGB2 PTGER4 NOTCH1 ATP2B1 NR4A3 CDKN1A EP300 SERPINB9 NASP TGFB1 MED4 NR1D2 LDHA RORA EZH2 REST MECP2 CITED2 ABHD2 CALCOCO1 HMGB1 MDM2 CALM1
GO_POSITIVE_REGULATION_OF_RNA_SPLICING	0.769475098749847	0.94302545575975	-0.266428652071188	-0.778516547685543	37791	17	SETX RBMX TRA2B
GO_RESPONSE_TO_INTERLEUKIN_4	0.243091440125814	0.66383702503768	-0.413328497513479	-1.18641536027466	11901	16	LEF1 IMPDH2 XCL1 PML JAK3
GO_CARDIAC_CHAMBER_MORPHOGENESIS	0.776351988681025	0.94429421099792	0.26627777542956	0.779001652776813	39506	17	TGFBR3 NOTCH1 RBPJ CITED2 MDM2 RARA ID2 MED1 FKBP1A GATA3
GO_REGULATION_OF_DEFENSE_RESPONSE_TO_VIRUS	0.283261629198732	0.700345001929413	-0.269417721675395	-1.09760586912173	14023	71	EIF2AK2 HERC5 MBD5 ANKRD17 MRPS10 MUL1 PML HLA-A TRAF3 AP1M1 TMEM39A TRIM38 ZC3HAV1 SNRPD1 B2M TSPAN32 PCBP2 BIRC2 AP1S2 SEC14L1 BIRC3 IL12RB1 AP2B1 STOM
GO_RESPONSE_TO_PEPTIDE	0.020682213296565	0.268569301702653	0.306814374774568	1.3911432078713	1034	127	CCL5 ANXA1 KLF3 FOXO1 USF1 CAT ID1 GNB1 EGR1 GNG10 GNG2 NOTCH1 GNB2 NR4A3 ATP6V1H NLRP1 KLF6 NAMPT CDC5L TIMP1 ATP6V1E1 ARHGEF2 TNFAIP3 INPP5K PARP1 BTG2 CASP4 RAB8A
GO_DNA_DEPENDENT_DNA_REPLICATION	0.795288234815839	0.950551419899164	-0.235579390458466	-0.782754814885894	39124	28	TFAM RNASEH1 RPAIN HELB ATRX RFC1 HMGA1
GO_POSITIVE_REGULATION_OF_CELLULAR_PROTEIN_CATABOLIC_PROCESS	0.511594000279614	0.843870037146604	0.21913764439345	0.973323253558458	25614	111	CD81 ARIH1 CSNK1D UBC PSMD1 RDX HERPUD1 PSMB1 PSMD12 UBE2D1 PSMD13 TNFAIP3 PSMB3 ANAPC5 CDC16 PSMB4 PSMA7 ANAPC11 PSME4 PTK2B MDM2 SIRT2 FBXW7 PSME3 AXIN1 PSMD8 PSMA4 PSMB6 SGTA RFWD2 NSMCE2
GO_REGULATION_OF_LEUKOCYTE_APOPTOTIC_PROCESS	0.421892122245221	0.800421298386412	-0.304466114084691	-1.02046859883622	20789	29	IRF7 FCER1G HSH2D HIF1A ZC3H8 FOXP1 SLC39A10 JAK3 BCL10 ADAM8 NOC2L
GO_CELLULAR_RESPONSE_TO_LIPID	0.026448362720403	0.296487353783513	0.299392491364502	1.36433870562853	1322	131	CCL5 ANXA1 PDE4B FOXO1 GNB1 TNF HMGB2 PTGER4 ITGB1 GNG2 ATP2B1 NR4A3 IFNG EP300 SERPINB9 PAF1 TGFB1 NFKBIB SMARCD1 MED4 NR1D2 RORA TNFAIP3 TNFRSF1B REST LITAF MTDH PTK2B ABHD2 CALCOCO1 GNAS MDM2 ZC3H12A DNAJA1 NFKB1 KAT5
GO_SECRETION_BY_CELL	0.0227354457186239	0.274953296744934	0.310449975367815	1.39404605989847	1137	119	CCL5 ANXA1 RAB8B RAB11A VMP1 HSPA8 SYTL2 MYO1G NOTCH1 ARFGEF1 VAMP4 NR4A3 FLNA TGFB1 TIMP1 PLEK PAFAH1B1 NSF TMF1 CCL3 APLP2 RBPJ UNC13D MECP2 WDR1 RAB8A LAMP2 LAT LCP2 HMGB1 GNAS CALM1 RASGRP1 SNAP23 CORO1A THBS1 LAT2 STX11
GO_LIPOPROTEIN_METABOLIC_PROCESS	0.709341742215215	0.923960572209614	0.243756031060129	0.847911094094949	35991	33	WDR45 ABCG1 LYPLA2 ZDHHC3 GPAA1 MPPE1 ATG12 DPM3 PPM1A P4HB WIPI2 ALG5 DPM1 GOLGA7
GO_REGULATION_OF_COAGULATION	0.42724093053522	0.803121351044385	-0.333609098200533	-1.01877349935986	21009	20	FCER1G TEC TXK FAM46A
GO_FORMATION_OF_PRIMARY_GERM_LAYER	0.344777439323966	0.75026933314288	0.328567709978283	1.07838230218231	17543	26	ITGB1 KDM6B NR4A3 PAF1 ITGA4 ITGB2 AXIN1
GO_ENERGY_RESERVE_METABOLIC_PROCESS	0.768261023482673	0.942098308016964	0.2530330781961	0.794982539877519	39062	22	PPP1CA UBC GNAS CALM1 PPP1CC PPP1CB PGM1 GSK3B
GO_EPITHELIAL_CELL_DEVELOPMENT	0.138694914585553	0.54132911813598	0.321195962794796	1.24298921199336	7030	53	RAP2B ID1 CXCR4 NOTCH1 CDKN1A AGPAT6 RDX FRS2 PAFAH1B1 ARID4A FOSL2 RAC1 PRDM1
GO_AMIDE_TRANSPORT	0.36855864872041	0.77189513347588	-0.37205948160071	-1.06795705247136	18044	16	SNX19 TAP1 CDK16 RAB1A
GO_REGULATION_OF_INTERFERON_GAMMA_PRODUCTION	0.109518686181767	0.501620101821337	-0.378894669403127	-1.31968474509821	5394	34	ISG15 IL18R1 TNFSF9 C1QBP HSPD1 TXK IL12RB2 PYCARD CD2 XCL1 HLA-A IRF8 HAVCR2
GO_NEGATIVE_REGULATION_OF_LIPID_METABOLIC_PROCESS	0.127885939036382	0.524140200892014	0.437968712417824	1.32223872317699	6502	19	TNF ACADVL REST FBXW7 NFKB1 PIBF1 INSIG1 ATP1A1 PDE3B PRKAA1
GO_ALPHA_AMINO_ACID_BIOSYNTHETIC_PROCESS	0.979947423121599	0.999260380004157	-0.181377712239309	-0.538474509201426	48086	18	GLUD1 EIF2B1 MTHFD2L ATPIF1 AASDHPPT MTHFD2 AHCY ASNSD1 GLUL OAT ATIC SEPHS2 SHMT2 GLS ENOPH1 ASL FPGS DHPS
GO_REGULATION_OF_MONOOXYGENASE_ACTIVITY	0.251976556661291	0.674593725848931	0.369824054738079	1.16191791381374	12811	22	ATP2B4 TNF IFNG PARK7 PTK2B CALM1 NFKB1 GCH1 HSP90AA1 POR NOSIP GSK3B
GO_SENSORY_PERCEPTION_OF_MECHANICAL_STIMULUS	0.91222998147281	0.978385585196919	-0.208207323919749	-0.679297924323831	44805	26	FAM65B TIMM10
GO_REGULATION_OF_CANONICAL_WNT_SIGNALING_PATHWAY	0.669423299190945	0.90597254658973	0.212159282281095	0.89961108870509	33592	85	FOXO1 EGR1 CSNK1D PPP1CA UBC PSMD1 NOTCH1 AES PSMB1 PSMD12 PSMD13 PSMB3 RBPJ PSMB4 PSMA7 PSME4 PSME3 AXIN1 PSMD8 NFKB1 PSMA4 PSMB6 HDAC1
GO_T_CELL_ACTIVATION_INVOLVED_IN_IMMUNE_RESPONSE	0.292866438913291	0.702360865686361	-0.370328848428434	-1.13090805635211	14401	20	FCER1G IL18R1 LEF1
GO_NEGATIVE_REGULATION_OF_LEUKOCYTE_PROLIFERATION	0.239050557051068	0.656453151633525	0.352986061303034	1.16923852960447	12165	27	HLA-DRB5 SPN TGFB1 ITCH GLMN TNFAIP3 C10orf54 PRNP PRDM1
GO_NEGATIVE_REGULATION_OF_GLIOGENESIS	0.00760978288583364	0.151056933587967	0.616959053485629	1.74392162828415	387	15	DUSP10 SKI NOTCH1 MECP2 CERS2 SIRT2 ATF5 RNF10 ID2 DICER1
GO_REGULATION_OF_DEVELOPMENTAL_GROWTH	0.2775486849634	0.698908059478131	0.280969976926536	1.10845343918562	14066	58	CTDP1 RAB11A PTGER4 NOTCH1 EP300 AGPAT6 PAFAH1B1 RBPJ TRPV2 ARHGAP4 HOPX GOLGA4 GNAS
GO_MEMBRANE_DISASSEMBLY	0.282849507333891	0.700345001929413	-0.350618224930282	-1.13262644891304	13864	25	NUP155 BANF1 RANBP2 RAE1 NUPL2
GO_CELLULAR_RESPONSE_TO_EXTERNAL_STIMULUS	0.338636998046018	0.745035837587809	0.251074078716857	1.05990063672177	16983	83	CCL5 FOXO1 USF1 HSPA8 PTGER4 ITGB1 ATP2B1 CNN2 UPP1 CDKN1A GABARAPL2 RRP8 RAC1 MDM2 SIRT2 ZC3H12A NUDT1 IRF1 NFKB1 MTPN PPM1D
GO_POSITIVE_REGULATION_OF_MRNA_PROCESSING	0.176566682412219	0.593682903634116	0.402508553520145	1.24815170324956	8970	21	TOB1 HSPA8 PAF1 CNOT1 SNRNP70 BTG2 DAZAP1
GO_ACTIN_FILAMENT_BASED_PROCESS	1.99956009677871e-05	0.00199963346840701	0.419563396082986	1.90954309650812	0	130	ANXA1 SYNE2 DSTN DNAJB6 MYH9 SUN2 FMNL1 TNF ZYX ARPC1A FLII IQSEC1 ITGB1 ARPC4 PACSIN2 CNN2 RHOG CORO7 BRK1 DOCK2 ABI1 FLNA ACTR2 PLEK ADD1 PAFAH1B1 DIAPH2 ARPC2 RHOF ARHGEF2 PFN1 TPM4 ELMO1 PACSIN1 CAPZB WDR1 ACTG1 IQGAP2 CFL1 PTK2B RAC1
GO_TRANSITION_METAL_ION_TRANSPORT	0.729891175774781	0.933186793462709	0.246378789073467	0.8305470996129	37022	29	ATP6V1H PICALM CUTC ATP6V1E1 SFXN1 IREB2 SLC39A7 RAB11B FTH1 SLC30A5 ATP6V0D1 FTL ATP6V0E2 ATP6V1F DNM2 SLC39A6
GO_POSITIVE_REGULATION_OF_MUSCLE_CELL_DIFFERENTIATION	0.912688578116087	0.978449982216155	0.211832539274425	0.673646966572864	46401	23	EP300 TGFB1 RBPJ HOPX IL4R SPAG9
GO_REGULATION_OF_ADAPTIVE_IMMUNE_RESPONSE	0.418053556587136	0.797941925888054	-0.273708025378534	-1.02083348681599	20622	46	IRF7 FCER1G HLA-E HSPD1 HLA-B PYCARD XCL1 NCR3 HLA-A MALT1 CD226 HAVCR2 B2M
GO_PHOSPHATIDYLINOSITOL_BIOSYNTHETIC_PROCESS	0.916679841897233	0.979943953333935	0.196057729045042	0.708982369857544	46383	39	SYNJ2 FRS2 INPP5K CDIPT GPAA1 MPPE1 MTMR6 ARF3 DPM3 ARF1 PIP4K2C MTMR14 INPP5D PIK3R5 ALG5 DPM1 PI4KB PIK3R1
GO_POSITIVE_REGULATION_OF_CELL_COMMUNICATION	0.503228688624457	0.840301146774142	0.185217804783696	0.98789175635748	24781	491	TOB1 CCL5 CD3E S100A4 RAB8B F2R HLA-DRB5 CAT CD81 SMARCA4 CXCR4 CCL4 SKI TNF PTGER4 TGFBR3 ZEB2 AKAP13 CSNK1D PPP1CA LCK GNAI2 ITGB1 HDAC3 MIB2 UBC PLEKHF1 SLC35C2 PSMD1 NOTCH1 SKAP1 C3orf17 ARFGEF1 TERF2IP BAG4 IFNG NLRC5 PHB2 TFG GSTM2 FLNA TGFB1 WAC UBE2K DNM1L SQSTM1 RHEB FRS2 PSMB1 PSMD12 CDK10 PAFAH1B1 LAMTOR3 TMF1 PARK7 PSMD13 LGALS1 CCL3 P2RX4 EZH2 TNFRSF1B PSMB3 SPTLC1 REL C10orf54 YWHAQ PARP1 RBPJ LITAF CREBBP ARHGAP4 UBE2I MECP2 PSMB4 MTDH GPR56 PSMA7 CANT1 PPP3CC PSME4 CITED2 PTK2B MCL1 RAC1 TXN LAT HMGB1 PTPLAD1 TRAF7 GNAS PRKCH CALM1 FKBP8 TRAF4 ZC3H12A FBXW7 PPP2R1A PSME3 AXIN1 HEXIM1 RASGRP1 PSMD8
GO_RESPONSE_TO_CORTICOSTEROID	0.00520084316699829	0.131493454992075	0.464615189717752	1.70053247071257	263	41	CCL5 ANXA1 FOXO1 TNF NOTCH1 ATP2B1 CDKN1A EP300 TGFB1 REST HMGB1 CALM1
GO_PROTEIN_UBIQUITINATION_INVOLVED_IN_UBIQUITIN_DEPENDENT_PROTEIN_CATABOLIC_PROCESS	0.391323227538291	0.782694860451028	0.264785247998377	1.03250859798694	19825	55	ARIH1 UBC KLHL20 MYLIP ITCH UBE2D1 ANAPC5 CDC16 ANAPC11 CUL4A MDM2
GO_CELL_PROJECTION_ASSEMBLY	0.0312022692559459	0.320524393616375	0.357053376159179	1.43917102707151	1572	65	RAB8B RAP2B CDC14A CSNK1D SCLT1 BAG4 UBE2B RDX AHI1 FLNA ACTR2 TMEM216 EMP3 BBIP1 INPP5K RAB8A ABLIM1 RAC1 ARHGEF6 NCK1 MTSS1 WASF2 PIBF1
GO_PROTEIN_MATURATION	0.492228186844003	0.836718980429703	-0.228614616306961	-0.980177353693966	24573	94	JAK2 PSENEN HSPD1 PDCD2 TNFSF10 IFI16 PYCARD PDCD6 GZMB ADAM10 MUL1 ECE1 PML BID CALR SRGN IMMP2L S100A8 ISCA2 RCE1 PMPCA DAP FAM162A ASPH TSPAN14 CTSS CARD8
GO_PROTEIN_N_LINKED_GLYCOSYLATION	0.842625479490978	0.96308600140943	-0.221429817144657	-0.754582901991651	41516	31	STT3B UBE2G2 MCFD2 ST6GALNAC6 MAGT1 B4GALT1 FUT8 EDEM2 TMEM165 DAD1
GO_ANAPHASE_PROMOTING_COMPLEX_DEPENDENT_CATABOLIC_PROCESS	0.228880467393021	0.64360984210683	0.294655203870782	1.14898406817604	11595	55	UBC PSMD1 UBE2S PSMB1 PSMD12 UBE2D1 PSMD13 PSMB3 ANAPC5 CDC16 PSMB4 PSMA7 ANAPC11 PSME4 PSME3 PSMD8 PSMA4 PSMB6
GO_VESICLE_ORGANIZATION	0.388795484568272	0.782371241487793	0.228408577324463	1.02926672318033	19424	122	F2R SYTL2 ANKRD28 CSNK1D PLEKHF1 S100A10 VAMP4 PICALM BLOC1S2 GBF1 AP2S1 PAFAH1B1 NSF TMF1 SNX2 SAR1B MITD1 VPS37B RAB8A AP3D1 TRAPPC4 VPS4A SEC16A EPS15 AP1G1 ANXA2 SNAP23 VPS4B CORO1A STX12 ARF1 TRAPPC2L STX11 PPP6C
GO_POSITIVE_REGULATION_OF_BINDING	0.225113010521329	0.642619117244026	0.306741693374843	1.15629362873426	11403	47	SKI HMGB2 S100A10 EP300 HERPUD1 TGFB1 ADD1 DERL1 DPH3 PARK7 PARP1 CEBPG TXN HMGB1 CALM1 TRAF4 SIRT2 ANXA2
GO_REGULATION_OF_HYDROLASE_ACTIVITY	0.144634368362496	0.548386089365162	0.21297582469735	1.11704794544449	7149	407	CCL5 ANXA1 RAP1GAP2 HERC1 F2R DNAJB6 SH3BGRL3 AIP CCL4 TNF SYTL2 HMGB2 PPP2R2B AKAP13 IQSEC1 LCK ITGB1 RASGRP2 ATP1B3 FNBP1 SERPINB1 TIPRL S100A10 ARFGEF1 RHOG CAST BAG4 IFNG EP300 DENND3 DOCK2 GABARAPL2 SERPINB9 PICALM RDX NLRP1 HERPUD1 RGS1 GZMA RABIF PPP2R5C CRY2 GBF1 TIMP1 FRS2 PLEK WNK1 PAFAH1B1 ARHGDIB LAMTOR3 RSU1 TBCD CYTH1 SNRNP70 DNAJB11 CSTB PARK7 ARHGEF2 PFN1 CCL3 MKL1 ARPP19 AHSA1 TBC1D22A EZH2 REST APLP2 ELMO1 DNAJC2 ARHGAP4 ATP1B1 IQGAP2 PSME4 PTK2B PRDX5 TRAPPC4 LAT HMGB1 PTPLAD1 GNAS RALGAPA1 MDM2 CALM1 RPS27L ARHGEF6 FAM13B PPP2R1A PSME3 PTPRA AXIN1
GO_NEGATIVE_REGULATION_OF_ERBB_SIGNALING_PATHWAY	0.729628498727735	0.933186793462709	-0.25662257987808	-0.820637749769795	35842	24	RAB7A HGS PTPN2 SNX6 RNF115 AP2B1 UBB CDC42 UBA52 STAM EPS15L1 SH3KBP1
GO_POSITIVE_REGULATION_OF_CELLULAR_AMIDE_METABOLIC_PROCESS	0.134473507712944	0.534194921416308	0.322598904380694	1.24841842486751	6816	53	CCL5 EIF4A3 TNF BCL3 PICALM TGFB1 NCOR1 USP16 RPS9 PTK2B RPS27L ZC3H12A NCK1 THBS1 POLR2D DDX3X UPF3B RBM3
GO_CELLULAR_RESPONSE_TO_BIOTIC_STIMULUS	0.165419767464814	0.579323151392465	0.31160643604491	1.21024862995484	8379	54	CCL5 PDE4B TNF HMGB2 IFNG PAF1 TGFB1 NFKBIB CCL3 TNFAIP3 TNFRSF1B LITAF MTDH SIRT2 ZC3H12A NFKB1
GO_RNA_STABILIZATION	0.994653819571493	0.999260380004157	-0.153800519799475	-0.475646107753222	48930	21	TARDBP HNRNPC RBM38 CIRBP ANGEL2 ELAVL1
GO_REGULATION_OF_CELL_MORPHOGENESIS_INVOLVED_IN_DIFFERENTIATION	0.234966813719646	0.648138795148011	0.271375935924161	1.13018999938203	11823	77	RAB11A ID1 ZEB2 NOTCH1 S100A10 EP300 FLNA TGFB1 PAFAH1B1 ARPC2 EZH2 TRPV2 STRAP UNC13D ARHGAP4 GOLGA4 CFL1 RAC1
GO_POSITIVE_REGULATION_OF_REACTIVE_OXYGEN_SPECIES_BIOSYNTHETIC_PROCESS	0.43304443359375	0.805277749550199	-0.336575550230514	-1.01413441471143	21284	19	HBB JAK2
GO_ALPHA_AMINO_ACID_METABOLIC_PROCESS	0.384203982554124	0.775098011792666	0.27720129424982	1.04068208522095	19467	46	EIF4A3 MPST DLD DLST MECP2 GMPS PEMT ERO1LB DHPS GCH1 ODC1 P4HB AZIN1 C9orf41 FPGS ASL ENOPH1 NIT2 ABHD12
