pathway	pval	padj	ES	NES	nMoreExtreme	size	leadingEdge
GO_DNA_REPAIR	0.333333333333333	0.689398174026458	0.251047386657277	1.58542106432005	0	394	FEN1 MORF4L1 CHAF1A PCNA CDCA5 HMGA1 POLD3 BAZ1B TRIM28 RFC4 SMC1A POLR2D BABAM1 XRCC6 ASCC1 USP1 COPS4 SMARCAD1 XAB2 RFC3 CSNK1D FTO UBB RAD17 APEX1 ERCC3 NPM1 MLH1 EXO1 ASCC3 CDC45 RNF138 CLSPN DDB1 BLM SMC5 CHEK1 RPA1 FANCL POLR2E ISY1 POLE2 SUMO3 POLQ TDG NSMCE2 TP73 TOP3A PARP9 PAPD7 RNF8 POLR2I RAD51AP1 PPIE NUDT1 CSNK1E UBE2T TOPBP1 PSMD14 RNF168 BRCA1 SMARCA5 ISG15 FANCM APEX2 POLR2G RAD51C COPS6 NONO POLD1 RNF111 KDM2A HMGB1 PRKDC BRCC3 HIST1H4C TRIM25 HMGB2 DDX1 LIG1 COPS3 CHAF1B POLR2A RPS3 WDR33 USP45 ASCC2 REC8 UBE2V2 JMY NSMCE4A BRIP1 H2AFX FANCG GINS2 SMARCB1 TP53BP1 ERCC8 CDK1 FBXO6 SSRP1 DTL UBC RMI1 RBBP8 KIF22 CIB1 RFC5 POLR2L TTC5 POLR2K GTF2H3 RIF1 TRIP13 ATR
GO_T_CELL_DIFFERENTIATION_INVOLVED_IN_IMMUNE_RESPONSE	0.668249792143597	0.947671986447812	-0.29707196878017	-0.872457278640647	58672	23	PTGER4 FOXP1 CLEC4E CLEC4D LEF1 RORA STAT6 IL18R1 FCER1G LY9 EOMES IRF4
GO_PROTEIN_HETEROTETRAMERIZATION	0.351313583007267	0.70636553614145	0.273753256061205	1.05908978728738	5027	19	XRCC6 RRM2 RRM1 PDSS2 HIST1H4C
GO_SULFUR_COMPOUND_CATABOLIC_PROCESS	0.0603454312055082	0.243753379323559	-0.504621476331799	-1.42246652424485	5170	19	GALNS IDUA MLYCD MTRR HPSE IDS NUDT7 GNS ADO
GO_CHLORIDE_TRANSPORT	0.672052498069924	0.948908867899903	-0.28126165819869	-0.875582753201051	60934	31	TTYH2 GABRR2 CLIC1 SLC12A7 SLC26A5 CLCN3 ANO6 ANO8 SLC4A1 GABRA3 SLC26A2 CLIC3 ANO9 SLC1A4 SLC26A11
GO_PROTEIN_POLYMERIZATION	0.434345789440217	0.786627225124231	-0.311352198182522	-1.03649486618555	40983	47	AIF1 WASF1 AKAP9 ARHGAP6 CORO7 GOLGA2 ARPC4 CTTN MID1IP1 ARL6 TTC17 CLASP1
GO_CELLULAR_RESPONSE_TO_CORTICOSTEROID_STIMULUS	0.877368479100033	1	-0.225224494639464	-0.701136032432222	79550	31	HEY1 DNMT3B FOXO1 SERPINF1 TGFB1 EP300 UCN2 AKR1C3 REST ASS1 FBXO32 ATP2B1 ACVR1 NR3C1
GO_SIGNAL_TRANSDUCTION_IN_RESPONSE_TO_DNA_DAMAGE	0.00256147540983607	0.0230271346776201	0.269722772021992	1.51906667928692	4	87	PRMT1 PCNA RBM38 SMC1A BCL3 UBB CDKN1A NPM1 CENPJ TFDP2 TP73 TRIAP1 BRCA1 CNOT10 PRKDC PGAP2 E2F1 ZNF385A HIPK2 CEP63 CDK1 UBC MIF BAX
GO_MUSCLE_CONTRACTION	0.223660582941899	0.559797282215144	-0.316943643643293	-1.14737081476562	22045	99	KCNMA1 SSPN MYL12A VIM DMD DTNA TPM3 PTGER3 CCDC78 MYL9 SMTN GNAO1 MYL12B RCSD1 VIPR1 PIK3C2A TPM4 DLG1 FKBP1B MYL6B ARG2 MYBPC1 TPM2 DYSF PLA2G6 CACNA1C PXN TNNI2 KCNIP2 MYOM1 HOMER1 ANK2 ATP1A3
GO_TRANSITION_METAL_ION_HOMEOSTASIS	0.264693145261074	0.617662094204558	-0.324578462859591	-1.13549361439105	25670	70	LTF ACO1 FBXL5 TMC8 ABCB7 SLC30A7 XIAP IREB2 HMOX1 EPB42 CCDC22 SLC31A1 SLC39A6 SLC30A1 FLVCR1 SLC31A2 ATP2C1 STEAP4 ATP7B MYC SFXN5 TFRC SLC11A2 SFXN3 PRNP ALAS2 SLC46A1 SLC39A4
GO_REGULATION_OF_ADHERENS_JUNCTION_ORGANIZATION	0.806928437267302	1	-0.249573410849938	-0.767181941240094	72604	29	S100A10 ARHGAP6 PTEN BCAS3 CLASP1 SRC PTPRJ
GO_ENZYME_LINKED_RECEPTOR_PROTEIN_SIGNALING_PATHWAY	0.6069960699607	0.914448476732325	-0.249558392454794	-0.971616947212103	60698	402	NCK1 RHOQ MTSS1 ABL2 CBL MYL12A LTBP4 CYBB PILRA VIM ITGB1 SMURF2 PPM1L ACVR2A TIA1 EPHB6 ATP6V1G1 PDGFC LYN ACTR2 CD4 JAK1 EPHA5 SPRED1 CYFIP1 GCNT2 BTK FUT8 CDK5R1 PLCB1 BMPR1A EPS8 SIRT2 ACVR1B KLF10 PIK3R1 PTPRF PAK2 BAIAP2L1 EPS15 RASGRP4 RUNX2 STAT5B GRIN2B FOXO1 TXK WASL PTEN TGFBRAP1 MAPK11 USP9Y LTK PRKD1 TRAT1 SOCS2 FOXO4 SETX PIK3C2A ARPC4 TGFB1 NRG1 SGPL1 NCBP1 DUSP22 NCKAP1L IRS2 HCK NLK MET TIAM1 EIF2AK3 AP2A1 SLC33A1 RNF41 USP15 ACVR2B CAMLG SRC F11R EPHB1 GUCA1B TAB1 ZFYVE27 DOK1 LEF1 RASSF2 AHI1 PLEKHA1 GPLD1 SYK PXN PTPRJ EPHB2 ACVR1C BMPR2 NRAS ALK CASP3 GREM2 PLCG1 SKI DOK2 EPHA6 PTPN2 ATP6V1G2 PDK4 ROR2 SH2D2A DNM1 ABI1 IGF2R CSF1 IRS1 ZFYVE16 EGR1 FGFR1 ID1 MYO1E MATK HSPB1 BLK TGFBR1 USP9X NCF2 TGFBR2 GIGYF2 ADAM10 UBE2D3 ITSN1 TXNIP FRS3 XBP1 FYN LNPEP MMP9 SMAD2 FGFRL1 FRS2 SULF2 NCF4 IGF1R STAP1 FLT1 ATP6V1C2 BMP8B FER PRKCZ DGKD PTPRK PDK2 CSK RGS14 BMX MAPK14 VEGFA PDPK1 DDR2 MST1 EIF4EBP2 SDC2 SS18 FGF12 ELMO2 CRK ZNF8 RGMB PTPRD ACVR1 SMAD4 PIK3R3 UBA52 APPL1 ATP6V1E2 ZFYVE9 UBE2D1 MAPK3 NCF1 POLR2H PARD3 PHIP
GO_REGULATION_OF_DEFENSE_RESPONSE_TO_VIRUS_BY_VIRUS	0.659424676576759	0.945361756316519	-0.290647690013441	-0.881006731429352	58821	27	PACS1 CD4 PAK2 AP1S3 HCK AP2A1
GO_REGULATION_OF_RECEPTOR_INTERNALIZATION	0.85770801727156	1	-0.250059985973632	-0.704888665631716	73496	19	SCYL2 TBC1D5 DLG4 AHI1 SYK
GO_REGULATION_OF_CALCIUM_ION_TRANSMEMBRANE_TRANSPORT	0.520518156279263	0.860937495857521	-0.286603984689532	-0.984762257517085	50026	60	PTPN6 HTT DMD RGN KCNE3 LYN PTGER3 UBASH3B PRKD1 TGFB1 FKBP1B NOS1AP PLA2G6 CACNA1C SUMO1 ANK2 PLCG1 CACNB3
GO_RESPONSE_TO_BACTERIUM	0.416294118235371	0.771687493722881	-0.26681492839944	-1.0277209366323	41623	291	LTF CAMP HLA-DRB5 IGHG2 ABR ELANE SRR CD86 MEF2C COCH CX3CR1 DEFA3 NLRP1 LTBR IL12A PTGER4 IGHE TNFRSF1A LYN CD4 LILRB1 RPS6KA3 TIRAP LITAF IGKC RARA IL6R LY96 LYZ PTGS2 PTGER3 SIRT2 BAIAP2L1 THBD HAVCR2 HIST1H2BF SPN LILRB2 NOD1 NLRC4 STAT5B WASL MAVS FOXP1 ANXA3 HIST2H2BE CD6 TGFB1 CD36 RELT OGT HLA-DRB1 CFP NOD2 SERPINB9 CLEC4E PPARD CCL5 HCK HIST1H2BE MAPK8 IGLL1 CDK19 MALT1 IRF5 CLEC4D TLR2 IGHV3-23 CD40 SRC MGST2 SNX3 HIST1H2BG IGLL5 RIPK2 PLA2G6 SYK AKIRIN2 LIAS HLA-E HDAC5 GNG12 TLR6 CPEB1 CASP3 P2RX7 TREM1 NOS3
GO_REGULATION_OF_ANTIGEN_PROCESSING_AND_PRESENTATION	0.0783392981529076	0.28956583732843	-0.522043002068515	-1.3952680860165	6522	15	HLA-DOB CD74 ABCB1 LILRB2 NOD1 NOD2
GO_POSITIVE_REGULATION_OF_LEUKOCYTE_MIGRATION	0.722522956432513	0.979425551605492	-0.252837667411196	-0.859381994272372	69005	55	CD74 AIF1 IL12A PTGER4 TIRAP IL6R PTGER3 CAMK1D NCKAP1L CCL5 CCR1 ADAM8 ANO6 IL1B CSF1 CXCL3 TNFRSF18 ADAM10 ITGA4 CCL4 FADD VEGFA PYCARD CXCL10 PTK2B TMEM102 ZNF580 PPBP CCL2 CXCL2
GO_CALCIUM_ION_IMPORT	0.119455820843499	0.380714408363837	-0.407837555573413	-1.29657713197542	10966	35	IBTK ITPR1 ATP2B4 ORAI1 PTPRC FKBP1B CHERP NOL3 SLC30A1 TRPM2 DDIT3 RYR3 P2RX7 MCOLN1 F2R TPCN2 CCR5 BBC3
GO_CELL_MATURATION	0.984712239542819	1	-0.164497764246798	-0.569586164999692	94942	64	CDKN1C ABHD2 CEBPA BTK RUNX2 EPB42 L3MBTL3 PABPC1L RND1 FARP2 FLVCR1 KCNIP2 CATSPERB PLD6 FGFR1 FAM20C XBP1 GNAQ RPS6KA2 CNTNAP2 VEGFA INSL3 CBFB PTK2B ANG FOXO3
GO_REGULATION_OF_SECRETION	0.0688420652619579	0.266717949182455	-0.302543976025148	-1.17185023802676	6883	342	CAMP RAB27B HLA-DRB5 BANK1 RALB SLAMF1 CD74 MEF2C TLR10 CASP5 LRRK2 TC2N ITPR1 ANXA4 GABBR1 SYTL2 CACNA2D2 NLRP1 PTGER4 LYN KCNMB4 POMC C2CD2L SERGEF LILRB1 CORIN KCNA2 RAPGEF4 EPHA5 UNC13D GPAM CD84 PLCB1 ICA1 SLC25A4 PTGER3 HMOX1 TCF7L2 WNK1 CD2 CHD7 NMB HAVCR2 NF1 STXBP3 SIRT4 MAPK11 BTN2A2 PPP3CA FOXP1 CLOCK TGFB1 NRG1 FKBP1B HLA-DRB1 PFKL ANXA5 NOD2 CLEC5A CLEC4E RAB5A IRS2 PPARD PFKFB2 CCL5 TIAM1 TLR2 SLC30A1 CLASP1 GLMN PRKCQ CD40 POFUT2 SRC RAB2B NSF TRAF2 RAB8B IL17RC EP300 TRPM2 RETN SCIN UCN2 CD40LG ADAM8 ARL2BP RPH3A KCNN4 PDCD6IP VPS35 RAB33B PLA2G6 IL4R CACNA1C NLGN2 HGS GPLD1 SYK CD244 NAPA NLGN1 GHRL ACVR1C HLA-E TLR6 CPLX4 P2RX7 AACS AIM2 NRXN1 NR1H2 GOLPH3 TRIM9 REST SYTL3 IL1B RAB11FIP3 IRS1 ZP3 F2R KISS1R
GO_CELLULAR_RESPONSE_TO_TOXIC_SUBSTANCE	0.935756071618507	1	-0.220871384836864	-0.607508533255665	79178	17	MEF2C ABTB2 OGT EP300
GO_MODULATION_OF_TRANSCRIPTION_IN_OTHER_ORGANISM_INVOLVED_IN_SYMBIOTIC_INTERACTION	0.933167878035809	1	-0.222494002092271	-0.611971555161358	78959	17	SNW1 INPP5K CCL5 EP300 LEF1 REST
GO_APOPTOTIC_SIGNALING_PATHWAY	0.853693437668861	1	-0.223439924853054	-0.851702564070433	85312	226	ZMAT1 ZMAT3 CASP4 FNIP2 ITPR1 GSK3B PPP1R13B BID IL12A CYP1B1 TNFRSF1A BTK PDCD10 IL6R LY96 STK25 PPP2R5C HMOX1 TP63 ACVR1B ARL6IP5 MLLT11 PIK3R1 CHAC1 BNIP3L CASP8AP2 NF1 SPN BAK1 RHOT1 PMAIP1 TGFB1 RELT SNW1 SGPL1 NOL3 PPARD BCL2A1 UBE4B SGPP1 CUL3 PDK1 RNF41 CUL1 CD40 TRAF2 EP300 AEN BCL2
GO_NEURAL_NUCLEUS_DEVELOPMENT	0.0111326860841424	0.0679967388296267	0.336722484953139	1.58246206684153	85	37	LDHA ATP5F1 CALM3 MAPKAP1 RHOA ATP5J YWHAE HSPA5 BASP1 NDUFS3 SCRIB CALM1 COX6B1 ZNF148 SEC24B
GO_LYMPHOCYTE_MEDIATED_IMMUNITY	0.378675236710161	0.735706591461497	-0.294704942144623	-1.06166068887605	37233	94	IGKV4-1 HLA-DRB5 PTPN6 IGHG2 CR1 SLAMF1 CD74 GAPT SLAMF7 IGHE IGLV7-43 UNC13D IGKC SLA2 BTN3A2 DLG1 HLA-DRB1 CD46 CD55 HLA-DQB1 CR2 KDM5D RFTN1 IGLL1
GO_FC_EPSILON_RECEPTOR_SIGNALING_PATHWAY	0.00134048257372654	0.0150418558513981	0.317775292958463	1.91351096034822	0	126	PSMD2 IGLC2 PSMD13 PSMD4 PSMC5 PSMA4 PSMA1 PSMC3 MAP2K7 CALM3 PSMB6 UBB PSMD3 PSMA7 PSME2 PSMB2 RELA PSME1 NFKBIA PSMD11 PSMD6 FOS PSMD14 PSMD1 PLCG2 ITK PSMB4 PSMA5 PSMB5 PSMB1 CHUK PSMF1 PSME3 GAB2 PSMA8 MAPK9 IGKV3-20 MAP3K7 UBC NFKB1 GRAP2 CALM1 PAK1 PSMC2 SOS1 PSMB7 PSME4 BCL10
GO_HIPPOCAMPUS_DEVELOPMENT	0.622094346370168	0.922175112808342	-0.285099361405645	-0.914836154962868	57404	37	GSK3B EPHA5 ATP2B4 RARA CDK5R1 PTEN ANXA3 CDK6 EZH1 LEF1 PTPRS CASP3
GO_REGULATION_OF_PROTEIN_LOCALIZATION_TO_CELL_SURFACE	0.572416238255629	0.898478663543357	-0.340644048689146	-0.93694421545038	48434	17	ASTN2 NRG1 RANGRF STX4
GO_RIBONUCLEOSIDE_TRIPHOSPHATE_BIOSYNTHETIC_PROCESS	0.000141823854772373	0.00820339088270703	0.451535880980865	2.1566786748767	0	40	NME1 UCK2 ATP5G3 ATP5F1 ATP5H ALDOA ATP5B ATP5G1 ATP5J CHCHD10 ATP5I ATP5J2 ATP5O
GO_REGULATION_OF_CHROMOSOME_SEGREGATION	0.172566371681416	0.481464204663978	0.212991532046636	1.15093687953149	506	71	CDCA5 BUB1 CDC6 KIF2C SMC5 NSMCE2 DLGAP5 BECN1 RCC2 MAD2L1 FBXO5 TTK SPAG5 PLK1 ANAPC11 ESPL1 RAB1A CTCF PUM1 BUB3 GORASP1 SFPQ CSNK2A1 BUB1B UBE2C CSNK2A2 CCNB1 MAD2L2
GO_PROTEIN_K11_LINKED_UBIQUITINATION	0.0780629796242392	0.288859428467832	0.323572829751105	1.36012492988269	884	25	ANAPC5 ANAPC13 UBE2D4 UBE2T UBE2L3 ANAPC11 ANAPC1
GO_SPHINGOLIPID_METABOLIC_PROCESS	0.42208486502449	0.776199801486388	-0.289718774463945	-1.03998642390206	41449	90	SERINC1 SGMS1 ARSG ST8SIA1 PPM1L UGCG ALDH5A1 SGPP2 SERINC5 GLTP CERK PRKD1 ST3GAL3 ALDH3B1 SGPL1 NSMAF DEGS1 SGPP1
GO_PROTEIN_ACETYLATION	0.88913362701909	1	0.145096189955091	0.839210384252015	1210	102	DR1 MORF4L1 CDYL SUPT7L TAF5L HCFC1 BRD8 POLE3 NAA30 WDR5 CRTC2 NAA16 MECP2 YEATS4 TAF12 KAT6B MAP3K7 MDH2 TAF9 ESCO1 BRCA2 RUVBL2 NAA10 TADA3 MED24
GO_REGULATION_OF_NUCLEOCYTOPLASMIC_TRANSPORT	0.0967741935483871	0.335895418507535	0.18882663824094	1.1572897879681	41	148	GAS6 HSP90AA1 PARK7 TRIM28 ANP32B NUTF2 SUPT6H NFKBIB BCL3 RHOA CD27 CDK5 CDKN1A IFI27 PARP10 XPO1 TXN PTPN11 PRDX1 NFKBIA XPO4 MBTPS1 KEAP1 MX2 BRCA1
GO_CELLULAR_HORMONE_METABOLIC_PROCESS	0.18680554068809	0.504143326437588	-0.371542763359607	-1.21640096789716	17450	42	SULT1A1 CYP1B1 STARD5 BCO2 HSD17B11 STAT5B RDH14 HSD17B8 DHRS4 SGPL1 PLEKHA1 AKR1C3 HSD17B7 ESR1 IL1B DHRS9 RDH13 ALDH1A2 ADM HSD17B4 HSD17B6 MED1 CRABP2 SCP2 RETSAT
GO_PTERIDINE_CONTAINING_COMPOUND_METABOLIC_PROCESS	0.014537037037037	0.0840422453703704	0.37644460720099	1.62358411156986	156	27	GGH QDPR ATPIF1 TYMS ALDH1L2 GCH1 GART ATIC MTHFD1
GO_BONE_REMODELING	0.7656786089392	0.9916033787452	-0.280049374033812	-0.789425100561697	65610	19	NCDN TGFB1 SRC RASSF2 TRAF6 NOTCH2 PTK2B
GO_FORMATION_OF_TRANSLATION_PREINITIATION_COMPLEX	0.901280301553259	1	0.186424846267611	0.696430256144774	13867	17	EIF3B EIF4H EIF3G EIF3I EIF3D MCTS1 DENR
GO_CHEMOKINE_MEDIATED_SIGNALING_PATHWAY	0.672116952488052	0.948908867899903	-0.289416373928096	-0.871040821975738	59767	26	CX3CR1 CCL5 CCR1 CXCR1 XCL2 CXCL3 XCR1 CCL4 CCR5 CXCR2 CXCL10 PTK2B CCRL2 PPBP CCL2 CXCL2 CCR9
GO_POSITIVE_REGULATION_OF_INTERFERON_BETA_PRODUCTION	0.115903678221752	0.375848912726101	0.305100280855214	1.28247633901953	1313	25	POLR3G DDX3X IFIH1 IRF7 FLOT1 POLR3A IRF3 IRF1 HMGB1 HMGB2 TLR7
GO_REGULATION_OF_PROTEIN_SECRETION	0.0575904699934932	0.236498045478274	-0.322065780893177	-1.22375145894659	5752	211	CAMP HLA-DRB5 BANK1 SLAMF1 TLR10 CASP5 ITPR1 ANXA4 CACNA2D2 NLRP1 PTGER4 LYN C2CD2L SERGEF LILRB1 RAPGEF4 EPHA5 GPAM ICA1 SLC25A4 PTGER3 TCF7L2 CD2 HAVCR2 SIRT4 MAPK11 BTN2A2 PPP3CA FOXP1 CLOCK TGFB1 FKBP1B HLA-DRB1 PFKL ANXA5 NOD2 CLEC5A CLEC4E IRS2 PPARD PFKFB2 CCL5 TIAM1 TLR2 GLMN PRKCQ CD40 SRC TRAF2 IL17RC EP300 TRPM2 CD40LG ADAM8 ARL2BP KCNN4 VPS35 PLA2G6 IL4R CACNA1C NLGN2 GPLD1 SYK CD244 GHRL ACVR1C HLA-E TLR6 P2RX7 AACS AIM2 NRXN1 NR1H2 GOLPH3 REST IL1B RAB11FIP3 IRS1 F2R
GO_REGULATION_OF_PEPTIDYL_TYROSINE_PHOSPHORYLATION	0.202137880120951	0.528927052760966	-0.31700784612882	-1.15688388801146	19987	109	PTPN6 IBTK CD74 ITGB1 IL12A PTGER4 PDGFC TNFRSF1A LYN CD4 ZFYVE28 INPP5F ITGA5 PIBF1 IL6R RAP2B PAK2 PSEN1 TGFB1 CD36 NRG1 PDCL3 SOCS4 CCL5 CD40 SRC ITGB2 RIPK2 ARL2BP PPP2R5B UNC119 SYK GHRL ADNP
GO_REGULATION_OF_NATURAL_KILLER_CELL_ACTIVATION	0.524319170490436	0.864401539950308	-0.358187320287122	-0.971569404181691	43992	16	IL12A PIBF1 HAVCR2 STAT5B
GO_RESPONSE_TO_INSULIN	0.836617735773175	1	-0.22393639743708	-0.831607442573334	83209	140	RHOQ RAB31 GFPT1 GSK3B PPARA ATP6V1G1 LYN GPAM LPIN1 PIK3R1 GCNT1 BAIAP2L1 STXBP3 FOXO1 FOXO4 PIK3C2A INPP5K OGT MAX IRS2 CCL5 PRKCQ RXRA SRC KAT2B EGR2 RETN UCP3 GPLD1 KHK ACVR1C HDAC5 CPEB1 PTPN2 ATP6V1G2 PDK4 IRS1 EGR1 SRSF5 XBP1 GOT1 EEF2K HDAC9 IGF1R ATP6V1C2 PPAT CAPN10 SLC27A1 FER PRKCZ PDK2 ADM PDPK1 EIF4EBP2 TBC1D4 PIK3R3 APPL1 ATP6V1E2 PHIP MTOR ATP6V1C1 SORT1 WDTC1 VAMP2 PRKCI CCL2 DENND4C RAB10 PTPRA TSC1 RAB13
GO_REGULATION_OF_MUSCLE_CELL_APOPTOTIC_PROCESS	0.0173687475328484	0.0966381441677277	-0.520189319275486	-1.5545619612096	1539	25	PDCD4 GSK3B IL12A HMOX1 SIRT4 LTK SIRT5 NRG1 NOL3
GO_POSITIVE_REGULATION_OF_NIK_NF_KAPPAB_SIGNALING	0.31695247259356	0.675875401501815	-0.386806731915011	-1.12539622741494	27668	22	CHI3L1 CREBBP HAVCR2 NOD1 ZFP91 NOD2 MALT1 TRAF2 TLR6
GO_REGULATION_OF_CARBOHYDRATE_METABOLIC_PROCESS	0.844532091812877	1	-0.221553502155945	-0.798903725621998	83079	95	GFPT1 GSK3B PPARA CBFA2T3 RGN PTGER4 POMC MLYCD FOXO1 PMAIP1 GOLGA2 TGFB1 INPP5K OGT IRS2 PFKFB2 AP2A1 PDK1 SRC KAT2B GPLD1 CD244 ADNP ARNT RORA P2RX7 PTPN2 PDK4 IRS1 KAT2A FKTN SIRT6 MIDN ENTPD5
GO_NEGATIVE_REGULATION_OF_SYNAPTIC_TRANSMISSION	0.389755159651911	0.745419898146993	-0.347760785748539	-1.06900728642989	35068	29	LRRK2 GABBR1 ABHD6 PTGS2 NF1 PTEN SLC30A1 GRIK2 PLK2 PLA2G6 ADNP GNAI2 NLGN3 SYT11 PPP1R9A CNIH2 S1PR2 SNCA
GO_B_CELL_ACTIVATION	0.396025557279334	0.748793866975558	-0.294855835405375	-1.05381934391377	38800	86	MS4A1 BANK1 CD79A ITFG2 CD86 MEF2C ITGB1 GAPT HHEX BTK PIK3R1 ATP11C BAK1 PRKCB PTPRC CR2 LAX1 MALT1 CD40 EP300 BCL2 CD40LG LEF1
GO_CELL_DEATH_IN_RESPONSE_TO_OXIDATIVE_STRESS	0.127783248865083	0.393004484847996	-0.49315428045191	-1.31805699199216	10639	15	CYP1B1 PDCD10 STK25 ARL6IP5 PDK1 BCL2
GO_REGULATION_OF_NEURON_DIFFERENTIATION	0.164597981656882	0.466865772708816	-0.292912246013127	-1.12584253618113	16456	276	ABL2 FIG4 MEF2C TCF4 VIM ITGB1 PTPRO DMD LRRK2 BCL11A OMG ROBO1 NEDD4 RAP2A ANKRD27 GSK3B TNIK CAPRIN2 TRIM32 FBXO38 TIMP2 ECT2 LYN INPP5F RARA CDK5R1 SDK1 ULK2 STK25 PTGER3 DNMT3B PTPRF UST HMG20A CAMK1D LRRC4C ASAP1 EPOR PSEN1 PTEN LTK PPP3CA MIB1 PRKD1 DISC1 SETX SERPINF1 NRG1 CTTN FKBP1B SS18L1 BIN1 CCL5 CUL7 TIAM1 EYA1 MBP PLXNB2 CAMK2B KAT2B SEMA7A LRP1 DSCAM EP300 KANK1 SNX3 BCL2 EIF4ENIF1 RTN4 PLK2 PPP2R5B LRRC7 EPHB2 NLGN1 ADNP BMPR2 MUL1 DAB1 CPEB1
GO_NEGATIVE_REGULATION_OF_NF_KAPPAB_TRANSCRIPTION_FACTOR_ACTIVITY	0.938646594190589	1	-0.194828217931412	-0.646496872650133	88412	46	COMMD6 ANXA4 CYP1B1 HAVCR2 PSMD10 MAP2K5 NLRC3 TRIM37 AIM2
GO_PROTEIN_POLYUBIQUITINATION	0.0144927536231884	0.0839173527477263	0.252647206971061	1.65839093924771	0	225	PSMD2 PSMD13 PSMD4 PSMC5 PSMA4 PSMA1 C18orf25 RNF213 PSMC3 RNF20 ANAPC5 PSMB6 UBB PSMD3 RNF138 ANAPC13 PSMA7 TOPORS UBE2G2 PSME2 PSMB2 KLHL20 RUSC1 PSME1 CDC34 RNF8 TRIM21 PSMD11 UBE2D4 PSMD6 ARIH1 UBE2T RNF167 MIB2 PSMD14 RNF168 BRCA1 PSMD1 HERC6 RNF14 PSMB4 RNF216 RNF111 PSMA5 PSMB5 UBE2L3 PSMB1 UNKL ANAPC11 PPIL2 PSMF1 RBCK1 PSME3 ANAPC1 UBE2V2 PSMA8 BIRC2 ERCC8 FBXO6 DTL UBE3C UBC
GO_RIBONUCLEOPROTEIN_COMPLEX_LOCALIZATION	0.000823723228995058	0.0104375888605538	0.341075824199389	1.98705685467336	0	106	POLDIP3 DDX39A POLR2D NUP188 U2AF2 CPSF3 EIF5A RBM8A POM121 SRRM1 XPO1 PABPN1 NOL6 CPSF1 FIP1L1 NUP50 PRPF31 RPS28 AGFG1 NMD3 SLU7 NUP133 MAGOH SMG7 NOP58 RAE1 THOC7 SRSF6 NUP155 RAN THOC5 SRSF2 DHX38 CPSF2 NXT1 EIF4E SRSF10 SLBP RPS15 NUP93 EIF4A3
GO_REGULATION_OF_MRNA_3_END_PROCESSING	0.285437064479139	0.644760157858861	0.263513455943714	1.10766785043195	3235	25	RNF20 PAF1 RNF40 CTR9 POLR2G ZFP36
GO_REGULATION_OF_PEPTIDE_TRANSPORT	0.20290249159063	0.529196252815911	-0.31043186084957	-1.14677777505607	20146	129	HLA-DRB5 CD74 ITPR1 GABBR1 CACNA2D2 PTGER4 C2CD2L RAPGEF4 EPHA5 LITAF PTGS2 ICA1 SLC25A4 PTGER3 TCF7L2 CHD7 SIRT4 PPP3CA CLOCK FKBP1B CCDC22 HLA-DRB1 PFKL PSMD10 ANXA5 IRS2 NOL3 PPARD PFKFB2 CCL5 TIAM1 EDA TLR2 PRKCQ RAB8B TRPM2 ARL2BP PLA2G6 CACNA1C NLGN2 GPLD1 GHRL ACVR1C
GO_POSITIVE_REGULATION_OF_ION_TRANSPORT	0.856329293502493	1	-0.218948937615442	-0.79517128018471	84505	103	HTT DMD GABBR1 AKAP9 RGN KCNE3 AHCYL1 CD4 CTSS ARL6IP1 ORAI1 WNK1 BAK1 DLG1 TRPV3 CCL5 HBP1 CCR1 NOS1AP AKAP7 PLA2G6 SUMO1 HOMER1 ANK2 P2RX7 PLCG1 ANO6 IL1B NLGN3 ZP3 F2R
GO_ATP_BIOSYNTHETIC_PROCESS	0.000191589232685123	0.00820339088270703	0.517196255915403	2.25206805730497	1	28	ATP5G3 ATP5F1 ATP5H ALDOA ATP5B ATP5G1 ATP5J CHCHD10 ATP5I ATP5J2 ATP5O
GO_CANONICAL_WNT_SIGNALING_PATHWAY	0.0773061493769752	0.287470103210863	-0.404914017830161	-1.33919449273425	7264	45	SCYL2 LRRK2 GSK3B UBE2B TCF7L2 FRAT1 APC PSEN1 PTEN DISC1 TMEM64 FZD3 RAB5A
GO_ACUTE_INFLAMMATORY_RESPONSE	0.384081628136032	0.740690851254071	-0.346478333083872	-1.0721798068313	34705	30	ALOX5 ELANE SERPINF2 IL6R STAT5B CD6 F12 OGG1 CTNNBIP1 CD163 ANO6 TFRC IL1B F8 ASS1
GO_NUCLEOBASE_METABOLIC_PROCESS	0.0311221945137157	0.151715572728258	0.337678964374647	1.48691073713305	311	29	PAICS UCK2 TYMS RRM1 ADA GART ADAL PRPS1
GO_HUMORAL_IMMUNE_RESPONSE	0.0777027027027027	0.288365095285858	-0.359319347676058	-1.28421293986914	7612	86	IGKV4-1 LTF MS4A1 CAMP HLA-DRB5 IGHG2 CR1 CFD MEF2C DEFA3 IGHE IGLV7-43 IGKC TFEB HIST1H2BF HIST2H2BE BST1 HLA-DRB1 CD46 CFP CD55 HLA-DQB1 CR2 HIST1H2BE IGLL1 IGHV3-23 LY86 HIST1H2BG IGLL5 CFH PLA2G6
GO_PHAGOSOME_MATURATION	0.909389274234478	1	-0.219793153279306	-0.65684177425675	80630	25	RAB31 ATP6V1G1
GO_CHROMATIN_MODIFICATION	0.333333333333333	0.689398174026458	0.163510089344359	1.05209270831876	0	428	DR1 MORF4L1 USP16 PRMT1 HMGA1 BAZ1B PHB TRIM28 SUPT6H CBX4 BABAM1 CDYL RBL1 ARID5B RNF20 SMARCAD1 SUV39H1 SUPT7L CENPV CBX6 CABIN1 KDM2B PIH1D1 PAF1 NPM1 DNMT1 TAF5L SAP18 DNMT3A HCFC1 RNF40 HDAC7 BRD8 EHMT1 DDB1 BRD2 CHEK1 CXXC1 HJURP MTA2 LRWD1 HDAC1 TDG NASP POLE3 HIST1H1C CBX3 CTR9 RNF8 ATAD2 MIS18A OIP5 WDR5 CRTC2 PHF19 CENPN RNF168 PHF21A SMARCA5 TDRD3 HDAC10 HNRNPC CHD9 JMJD1C SUPT4H1 KDM2A DPY30 CENPM BRCC3 HIST1H4C MECP2 TET3 CHD4 YEATS4 TAF12 CHD1 TSPYL2 BCOR CTCF RBBP5 SMARCB1 KAT6B CDK1 CHD2 KDM5C MAP3K7 USP34 SMARCC1
GO_MYELOID_LEUKOCYTE_ACTIVATION	0.105545339972315	0.350942041481986	-0.364185557058716	-1.26976124613318	10216	68	SLAMF1 CD86 AIF1 CX3CR1 LTBR LYN TNFSF9 CD93 PI4K2A HAVCR2 TYROBP PSEN1 FOXP1 ANXA3 TGFB1 CCL5 SYK CD244 BATF3 NDRG1 CSF1 TGFBR2 ADAM10 FCER1G TRAF6 CAMK4 AZU1 HYAL2 SPACA3 SNCA IRF4 TICAM1 PYCARD CXCR2 MILR1 RASGRP1 VAMP2 PPBP SLC11A1 PRKCE S100A13
GO_ANTERIOR_POSTERIOR_PATTERN_SPECIFICATION	0.0309886967879954	0.151463907682408	-0.394499944006352	-1.38827295579138	3012	74	MLLT3 ZBTB16 ACVR2A HHEX TSHZ1 BMPR1A CELSR1 SCMH1 ETS2 PSEN1 HOXB3 MIB1 ACVR2B GATA4 EP300 CTNNBIP1 LEF1 DDIT3 HOXB4 BMPR2 SKI PLD6 ROR2 ABI1 TGFBR1 PCSK5 MED12 KAT2A AURKA SMAD2 FRS2 RGS19 AXIN1 HOXB2 ALDH1A2 PBX1 EPB41L5 NLE1 RARG LFNG
GO_POSITIVE_REGULATION_OF_CELL_DIVISION	0.0766773162939297	0.287091906087006	0.235823639195231	1.2561275848241	263	66	CDCA5 CDC6 CENPV RANBP1 RHOA NUSAP1 SMC5 KIF20B NSMCE2 MACC1 DLGAP5 BECN1 FBXO5 PLK1 BIRC5 ANAPC11 YBX1 ESPL1 RAB1A KIF3B CDC25B VEGFB GORASP1
GO_PIGMENT_BIOSYNTHETIC_PROCESS	0.0670839730719263	0.262935063947169	0.293534082136807	1.34850014083864	567	34	PAICS ATPIF1 SLC25A39 ADA HMBS NFE2L1 ADAL PRPS1 DDT UROS MYO5A FECH GMPS ALAS1
GO_ERBB_SIGNALING_PATHWAY	0.912655352974576	1	-0.204391075506944	-0.689848972816981	86798	52	CBL EPS8 PIK3R1 EPS15 PIK3C2A TGFB1 NRG1 RNF41 CAMLG SRC RASSF2 PXN NRAS PLCG1
GO_EMBRYONIC_ORGAN_MORPHOGENESIS	0.547021959442358	0.877321738160695	-0.268636740807206	-0.977447994645615	54030	105	ABR WDR19 MEF2C FZD6 IFT52 TSHZ1 SATB2 CELSR1 CHD7 SETD2 RUNX2 PSEN1 HOXB3 NIPBL MIB1 MICAL2 DLG1 FZD3 EYA1 FLVCR1 GATA4 AHI1 EPHB2 HOXB4 SETDB2 ROR2 PAX5 FGFR1 TGFBR1 PAX8 MED12 TGFBR2 SMAD2 FRS2 MAFB AXIN1 HOXB2 ITGA8 RARG HLX ACVR1 ARL13B NPHP3 MAPK3 HOXC4 BBS7 BBS4 DVL3 SMAD3
GO_REPRODUCTIVE_SYSTEM_DEVELOPMENT	0.955088801233406	1	-0.196760024721129	-0.746585683550369	95399	205	PLEKHA5 CDKN1C WDR19 ACVR2A HEY1 ESR2 CEBPA RARA TFEB PTGS2 TP63 CHD7 ACSBG1 FANCF SETD2 BAK1 EPOR STAT5B VDR NSDHL PTEN NIPBL WDR77 DLG1 SGPL1 HS6ST1 PPARD CUL7 PATZ1 RXRA GATA4 SRC BCL2 LEF1 PLEKHA1 EIF2B2 RPS6 AKR1C3 IMMP2L GHRL BMPR2 ARNT ARID4A NOS3 HMGCS1 ESR1 TAF4 ROR2 ROBO2 BCL2L2 ZFP36L1 COL9A3 TGFBR1 FBXW8 MAP3K4 ST14 ASB1 FRS2 CYP27B1 NUP210L ZFPM2 DEDD FANCA RARG LFNG ADM MAPK14 EOMES VEGFA HSD17B4 ITGB8
GO_CYTOSOLIC_CALCIUM_ION_TRANSPORT	0.0291741222756927	0.143925669893417	-0.483570864688837	-1.48648381025733	2624	29	IBTK ITPR1 ATP2B4 PTPRC FKBP1B CHERP NOL3 TRPM2 CACNA1C DDIT3 RYR3 P2RX7 MCOLN1 CACNB3 F2R TPCN2 CCR5 BBC3
GO_REGULATION_OF_SPINDLE_ORGANIZATION	0.899803349025684	1	-0.241604381953929	-0.655342643716425	75497	16	PARP3 TPR CHMP4B PDCD6IP BORA
GO_POSITIVE_REGULATION_OF_CATABOLIC_PROCESS	0.1	0.339449541284404	0.181070548786855	1.24380452665312	0	320	PSMD2 PSMD13 PSMD4 PARK7 PSMC5 AKT1 PSMA4 PSMA1 ATPIF1 PNPT1 PIM2 PSMC3 ZFAND2A CSNK1D SUPV3L1 ANAPC5 PSMB6 UBB PSMD3 SGTA RNF40 RNF138 PSMA7 SMC5 PSME2 PSMB2 BAD RDX PSME1 NSMCE2 NDFIP1 DLGAP5 BECN1 AKT2 TRIM21 HSPBP1 PSMD11 CSNK1E PSMD6 ARIH1 KEAP1 LARP1 MAD2L1 PSMD14 FBXO5 PSMD1 RNF14 POLR2G PSMB4 LPCAT1 PSMA5 CDC20 PSMB5 PSMB1 HMGB1 NDUFA13 PLK1 SNF8 ANAPC11 SVIP ZFP36 ESPL1 PSMF1 TRIB1 PSME3 FLCN ANAPC1 UBE2V2 PSMA8 RAB1A PTPN1 GTPBP1
GO_GLIOGENESIS	0.848399603097476	1	-0.221103800691518	-0.787255255245394	82936	83	CD9 VIM LYN CDK5R1 SIRT2 PRDM8 NF1 PTEN NAB2 CDK6 DISC1 TGFB1 NRG1 LAMA2 SOX6 EGR2 LEF1 RTN4 EIF2B2 DAB1 SKI NLGN3 GSN NDRG1 DNER MED12 KLF15
GO_PEPTIDYL_THREONINE_MODIFICATION	0.438538348509712	0.789198389827789	-0.31706069841717	-1.03415068990702	40887	41	GALNT11 GALNT1 LRRK2 GSK3B CDK5R1 ACVR1B WNK1 PRKCB OXSR1 NLK MAPK8 CLK1
GO_MATURATION_OF_5_8S_RRNA_FROM_TRICISTRONIC_RRNA_TRANSCRIPT_SSU_RRNA_5_8S_RRNA_LSU_RRNA_	0.0767671306933369	0.287091906087006	0.368240123293485	1.40016615233101	1135	18	NOP14 WDR12 EXOSC7 NOL9 EXOSC3 ABT1 EXOSC9 BOP1 EXOSC2 FTSJ3 PES1
GO_REGULATION_OF_CARDIAC_MUSCLE_CONTRACTION_BY_CALCIUM_ION_SIGNALING	0.878708062689947	1	-0.250477855512406	-0.679411601297952	73727	16	DMD FKBP1B CACNA1C ANK2 CALM2 HDAC4 ATP2A2
GO_ANTIGEN_PROCESSING_AND_PRESENTATION	0.00374531835205993	0.0302569386520125	0.218096499475478	1.3522276157297	0	166	PSMD2 PSMD13 CALR PSMD4 PSMC5 PSMA4 PSMA1 KLC1 AP3B1 PSMC3 PSMB6 TAP1 KIF2C PSMD3 RAB27A PSMA7 HLA-C PSME2 CTSH PSMB2 SEC13 PSME1 ABCB9 AP2S1 KIF11 PSMD11 PSMD6 PSMD14 PSMD1 DYNLL2 PSMB4 ARF1 PSMA5 PSMB5 PSMB1 DCTN1 DNM2 B2M PSMF1 PSME3 PSMA8 KIF3B
GO_CELLULAR_AMINO_ACID_CATABOLIC_PROCESS	0.340059712710874	0.695918659861854	-0.319978482803081	-1.0927402132034	32574	57	IDO2 CARNS1 HIBADH ALDH5A1 ENOSF1 KMO BCAT1 SHMT1 ACAD8 AFMID MTRR ASRGL1 ALDH6A1 KYNU OGDH GCDH ADO BCKDHB GOT1 OAT AMDHD1 ACADSB GLDC PPAT MCCC1 ACAT1 HMGCL MTHFS ASL
GO_MAINTENANCE_OF_LOCATION	0.295	0.655949519230769	0.18478687664407	1.06312030021957	412	100	CALR AKT1 HSP90B1 NFKBIB BCL3 HK2 SUPT7L KDELR1 TOPORS S100A9 GPAA1 ASPM SYNE2 NFKBIA HSPA5 KEAP1
GO_NEPHRON_EPITHELIUM_DEVELOPMENT	0.120997262803812	0.382640916559065	-0.415329273876961	-1.29986189226366	11006	32	MTSS1 MEF2C PTPRO FOXD1 DLG1 PTCH1 EYA1 BCL2 AHI1 KIF26B MYC KLHL3 MYO1E PAX8 KLF15 PBX1 ACAT1 SMAD4 LAMA5
GO_NEGATIVE_REGULATION_OF_RECEPTOR_ACTIVITY	0.271827636730478	0.627424988086569	-0.437052528028725	-1.16811343482252	22633	15	MED13 ZFYVE28 PSEN1 SOCS4 FKBP1B
GO_KERATINOCYTE_DIFFERENTIATION	0.950398955301513	1	-0.194814037944596	-0.602853505188448	85878	30	CSTA TP63 SAV1 FLNB AKR1C3 CDH3 CASP3 LATS2 TXNIP ST14
GO_POSITIVE_REGULATION_OF_CALCIUM_ION_TRANSMEMBRANE_TRANSPORT	0.787302975269613	1	-0.257983521377985	-0.781995614420132	70228	27	HTT RGN KCNE3
GO_NEGATIVE_REGULATION_OF_EPITHELIAL_CELL_MIGRATION	0.741092877685671	0.986669487039551	-0.273509173120406	-0.817369639897782	65708	25	KRIT1 PDCD10 SERPINF1 PTPRM MAP2K5 HDAC5
GO_CELL_REDOX_HOMEOSTASIS	0.539009105629508	0.872042873100115	-0.288710000822795	-0.974437347695388	51262	52	LTF CAMP CYBB TMX4 KRIT1
GO_POSITIVE_REGULATION_OF_PROTEIN_SECRETION	0.199402810422572	0.524636240411691	-0.314186605458409	-1.15425866843442	19766	119	CAMP HLA-DRB5 SLAMF1 CASP5 NLRP1 PTGER4 C2CD2L TCF7L2 CD2 HAVCR2 MAPK11 TGFB1 HLA-DRB1 NOD2 CLEC5A CLEC4E IRS2 PPARD PFKFB2 GLMN PRKCQ SRC IL17RC EP300 TRPM2 ADAM8 KCNN4 VPS35 PLA2G6 IL4R NLGN2 GPLD1 SYK CD244 GHRL HLA-E P2RX7 AACS AIM2 NR1H2 GOLPH3 IL1B F2R BLK STX4 XBP1 PFKM CAPN10 PRKCZ APBB1 MYO18A ZNF384 MAPK14 HYAL2 EXOC1 ATP13A2 PPID
GO_POSITIVE_REGULATION_OF_CYTOSKELETON_ORGANIZATION	0.957601245476051	1	-0.185855974044451	-0.678775153822086	94723	110	NCK1 S100A10 TERF1 WASF1 ACTR2 SERPINF2 SPAST CYFIP1 SIRT2 BAIAP2L1 WASL CDC42EP4 ARPC4 DLG1 CTTN BCAS3 NCKAP1L HCK CLASP1 PRKCQ EP300 SCIN
GO_RESPONSE_TO_KETONE	0.000671591672263264	0.00970659838817999	0.301705186764886	1.7302390388259	0	98	GAS6 CALR NME1 AKT1 SOCS3 ROCK2 TYMS CALM3 CDKN1A DNMT1 DCPS HNRNPU CD38 HMBS TK1 RELA NASP KLF2 CBX3 BCL2L1 ELK1
GO_NEGATIVE_REGULATION_OF_PROTEIN_KINASE_B_SIGNALING	0.285822738912684	0.644826985100777	-0.388044106101323	-1.14991633847307	25224	24	BANK1 PTEN LMBRD1 DLG1 INPP5K PLEKHA1 DDIT3 PTPRJ MUL1
GO_REGULATION_OF_POSTSYNAPTIC_MEMBRANE_POTENTIAL	0.606098209537316	0.91372062214828	-0.331763382651011	-0.912517871570907	51284	17	MEF2C LRRK2 PPP3CA GRIK2 GHRL HCN3 NLGN3
