pathway	pval	padj	ES	NES	nMoreExtreme	size	leadingEdge
GO_RESPONSE_TO_IONIZING_RADIATION	0.0323974082073434	0.156488786380118	0.21232328912202	1.26143489383247	29	117	NET1 SOCS3 RHOB BABAM1 XRCC6 CDKN1A DNMT1 DNMT3A CLK2 RRM1 BLM TP73 BCL2L1 RNF8 ELK1 RAD51AP1 TOPBP1 RNF168 BRCA1 RAD51C PRKDC BRCC3 MECP2 DNM2 H2AFX TP53BP1 ERCC8 BAX HIF1A ATR CCR2 XRCC2 BRCA2 GADD45A ERCC1 HUS1 DMC1 RAD9A ICAM1
GO_PROTEIN_EXPORT_FROM_NUCLEUS	0.113703703703704	0.37033776734481	0.297120249792222	1.28146268417855	1227	27	CALR NUTF2 HSPA9 EIF5A XPO1 CSE1L XPO4
GO_EPITHELIUM_DEVELOPMENT	0.9919999199992	1	-0.18912139344784	-0.737645955770686	99198	426	MTSS1 WDR19 ARHGAP12 MEF2C VIM PTPRO FZD6 UGCG ANXA4 CNN3 HEY1 RAP2A PPARA ESR2 IFT140 TAGLN HHEX IFT52 ITGA5 CSTA FOXD1 RARA PDCD10 BMPR1A KLF5 TP63 CELSR1 RAP2B ORAI1 SHROOM3 ACVR1B RHOC CHD7 LMO4 SETD2 NF1 BAK1 VDR CRYGS PSEN1 NSDHL SLC4A7 MIB1 WDR77 AGPAT2 CDK6 MICAL2 SAV1 C5orf42 NUMB TGFB1 HRH2 NRG1 MKS1 DLG1 PTCH1 FZD3 MET ARG2 FLNB EDA FRMD6 EYA1 ACVR2B GLMN RXRA GATA4 PLXNB2 SRC F11R TOLLIP PRICKLE1 USH2A EP300 CTNNBIP1 BCL2 COL18A1 LEF1 AHI1 ATP2C1 AKR1C3 HOXB4 LIAS CDH3 BMPR2 PTPRS GSTK1 CCM2 SETDB2 ARID4A CASP3 LATS2 VSIG1 KIF26B SKI MYC KLHL3 THRA ESR1 GSTM3 ROR2 ROBO2 ABI1 CBFA2T2 CSF1 DLG5 FGFR1 DHRS9 ID1 MYO1E ZFP36L1 FAM20C AARS MITF PAX8 MAF STAT6 GPSM2 MED12 KLF15 TGFBR2 SULT1B1
GO_PROTEIN_LOCALIZATION_TO_CYTOSKELETON	0.388888888888889	0.745152195178089	-0.361201801499793	-1.07037279139106	34320	24	SNX10 HOOK3 GSK3B PIBF1 DISC1 CRIPT
GO_NUCLEAR_ENVELOPE_REASSEMBLY	0.227495806672051	0.564543584632185	0.319027526894513	1.16977790666272	3661	16	CHMP7 NSFL1C PPP2R2A PPP2R1A PPP2CA ANKLE2 VRK1 LMNA CHMP2A
GO_INTRINSIC_APOPTOTIC_SIGNALING_PATHWAY_IN_RESPONSE_TO_DNA_DAMAGE_BY_P53_CLASS_MEDIATOR	0.305768709939514	0.665069723862773	0.256849315654056	1.09248331761427	3386	26	DDIT4 BCL3 CDKN1A TOPORS TP73 PGAP2 HIPK2 SHISA5 BRCA2
GO_REGULATION_OF_AUTOPHAGY	0.671571424281553	0.948908867899903	-0.24655157111594	-0.937097528478078	67091	212	TBC1D12 ABL2 MEFV RALB PIKFYVE WDFY3 WDR6 LRRK2 ITPR1 NEDD4 ATP6V1G1 PLEKHF1 RAB33A UVRAG NRBP2 TFEB CDK5R1 ULK2 RB1CC1 SIRT2 ULK1 PHF23 TBC1D5 TAB2 BNIP3L RRAGB NOD1 FOXO1 NPC1 WAC TBC1D14 GOLGA2 CTTN RAB5A MET HDAC6 MAPK8 GATA4 SCOC KAT8 EP300 SH3BP4 BCL2 RIPK2 CHMP4B VPS35 PLK2 RAB33B MTMR3
GO_PHOSPHOLIPID_METABOLIC_PROCESS	0.608196672103099	0.915769565015758	-0.252452635940021	-0.963321673354017	60784	231	SERINC1 FAM126A NAPEPLD FIG4 PIKFYVE CD86 PIK3C2B SGMS1 ALDH5A1 LCAT ABHD6 INPP5F INPP4B PLA2G12A GPAM PLA2G16 LPIN1 PLCB1 MTMR14 PIK3R1 MVD PI4K2A SERINC5 CD19 PTDSS1 ABHD4 MVK PTEN TRAT1 PLCB2 AGPAT2 PIK3C2A NRG1 SLC44A1 INPP5K BPNT1 DOLPP1 IRS2 PPARD SGPP1 CHKA LPCAT2 RARRES3 INPP4A DBI PLA2G6 LCLAT1 MTMR3 GPLD1 INPP1 DDHD1 ENPP7 GPAT2 PLCG1 PLD6 IRS1 FGFR1 CD28 PIGZ GPCPD1 LPIN2 CHKB HADHB LPCAT4 FYN GGPS1 FRS2 TTC7B PLD2 MTM1 SLC27A1 FITM1 SYNJ1 ETNK1 PLA2G15 DDHD2 AGPAT4 HEXB DOLK SNCA PIK3R3 PIGV SPHK2 FADS1 PIP5K1B ACP6 PIK3R4 SMPDL3B PIP4K2B ATM
GO_AMMONIUM_ION_METABOLIC_PROCESS	0.199503564934932	0.524636240411691	-0.328085969699834	-1.17098516502382	19530	85	DMGDH CBR4 SGMS1 AKR7A2 SGPP2 AGMAT LCAT PLA2G12A PLA2G16 LPIN1 DNMT3B SHMT1 CROT SLC44A1 DHPS SGPP1 CHKA LPCAT2 DBI PLA2G6 GPLD1 AKR1C3 AZIN1 CRAT ENPP7 SLC22A4 TMLHE SMS LPIN2 CHKB POR LPCAT4 GBA
GO_REGULATION_OF_INTERLEUKIN_4_PRODUCTION	0.167233696461505	0.471260226129146	-0.432840622664196	-1.25932969523718	14598	22	HLA-DRB5 CD86 RARA HAVCR2 HLA-DRB1 PRKCQ CD40LG LEF1 HLA-E ZP3 CD28
GO_NCRNA_CATABOLIC_PROCESS	0.019172028335608	0.104012470442448	0.449420016032463	1.67890548469479	294	17	EXOSC6 EXOSC7 ZCCHC11 EXOSC5 EXOSC4 EXOSC10 EXOSC9 DIS3L2 EXOSC2 DIS3 DIS3L
GO_REGULATION_OF_FAT_CELL_DIFFERENTIATION	0.321561299482211	0.682602873255412	-0.323331708470749	-1.10419162236976	30802	57	JDP2 ZBTB16 CEBPA PTGS2 KLF5 SIRT2 FOXO1 MEX3C SAV1 TGFB1 TRIB2 TMEM64 PPARD HDAC6
GO_REGULATION_OF_RNA_STABILITY	0.00125	0.0142746913580247	0.449758117279558	2.69010276009121	0	123	PSMD2 PSMD13 HNRNPA0 PSMD4 PSMC5 AKT1 MAPKAPK2 PSMA4 RBM38 PSMA1 EXOSC6 KHSRP MYD88 YTHDF2 PSMB6 UBB APEX1 PSMD3 HNRNPU CIRBP PSMA7 THRAP3 EXOSC7 XPO1 SET PSME2 PSMB2 PSME1 SERBP1 PSMD11 PSMD6 PSMD14 PSMD1 HNRNPC EXOSC5 PSMB4 PSMA5 EXOSC4 PSMB5 PSMB1 EXOSC3 CARHSP1 E2F1 ZFP36 YBX1 PSMF1 YWHAZ PSME3 PSMA8 TARDBP DKC1 UBC EXOSC9 PUM1 PSMC2 HNRNPR PSMB7 CPEB3 PSME4
GO_NEGATIVE_REGULATION_OF_CELL_DEVELOPMENT	0.172806611836152	0.481464204663978	-0.313042492632842	-1.16152547533928	17186	138	LTF TRIM62 VIM ITGB1 PTPRO HOOK3 BCL11A OMG GSK3B AP1AR LILRB1 INPP5F CDK5R1 ULK2 BMPR1A PTGER3 SIRT2 HMG20A ZNF706 NF1 ASAP1 PSEN1 PTEN CTDP1 PPP3CA MIB1 TGFB1 NRG1 MBP SEMA7A LRP1 TRIM11 KANK1 BCL2 EIF4ENIF1 RTN4 PLK2 EPHB2 NLGN1 DAB1 SKI SORL1 REST SEMA4B IL1B NLGN3 CBFA2T2 ID1
GO_MAMMARY_GLAND_MORPHOGENESIS	0.240986338669546	0.58050094601388	-0.428278269291245	-1.19346998666098	20532	18	VDR TGFB1 PTCH1 SRC ESR1 CSF1 STAT6 TGFBR2
GO_CELLULAR_PROTEIN_COMPLEX_DISASSEMBLY	0.000949667616334283	0.0117181314330958	0.374670533420306	2.2108564588669	0	112	PEX14 MRPL36 MRPL24 MRPS27 MRPL27 AURKAIP1 CFL1 MRPS34 MRPS25 MRPL49 MRPL55 KIF2C MRPL37 MRPL34 MRPS33 GADD45GIP1 MRPL51 MRPL47 MRPS22 STMN1 MRPL30 MRPL3 MRPL54 VPS4A MRPL43 MRPL28 MRPS18C MRPL17 MRPS16 MRPS35 MRPL15 MRPL44 MRPS36 MRRF MRPL52 MRPL12 MRPS23 MRPS12 TRMT112 MRPL32 MRPS9 MRPS26 MRPL11 MRPL21 MRPL22
GO_BODY_MORPHOGENESIS	0.593094930541392	0.908915606838995	-0.312608457221377	-0.926372973720311	52342	24	NIPBL TGFB1 SGPL1 FLVCR1 ZNF281 LEF1 PLEKHA1 GREM2 SKI RRAS
GO_SOMATIC_STEM_CELL_POPULATION_MAINTENANCE	0.423366834170854	0.777012542873096	0.222553156573183	1.01530966977224	3706	33	POLR2D POLR2E POLR2I POLR2G POLR2A POLR2L POLR2K RAF1 SPI1 STAT3 POLR2J BCL9 LIG4
GO_CYTOPLASMIC_MICROTUBULE_ORGANIZATION	0.974243973221647	1	-0.177291157332205	-0.554870638181226	88625	32	HOOK3 SPAST DLG1 CRIPT CLASP1 TUBG2 KATNAL2 AXIN1 SLAIN2 CEP120 STMN3 TUBGCP6 KATNA1 KATNAL1
GO_PROTEIN_ACTIVATION_CASCADE	0.10561933796026	0.350942041481986	-0.406303481463084	-1.30931338726043	9769	38	IGKV4-1 CR1 CFD IGHE IGLV7-43 IGKC CD46 CFP CD55 F12 CR2 IGLL1 IGHV3-23 IGLL5 CFH
GO_POSITIVE_REGULATION_OF_PHOSPHOLIPASE_ACTIVITY	0.138476244025865	0.416216168071242	-0.42762375954723	-1.28699612242711	12313	26	ABL2 ARHGAP6 RASGRP4 TXK PLCB2 CCL5 CAMK2B S1PR4 ESR1 FGFR1 GNAQ FLT1 PRKCZ GNA15 PDPK1 ANG ARL1 PRKCE ARF4 PTAFR
GO_NEGATIVE_REGULATION_OF_PEPTIDYL_TYROSINE_PHOSPHORYLATION	0.335068878268204	0.689902531770926	-0.368644448848167	-1.10948927796766	29795	26	PTPN6 IBTK ZFYVE28 INPP5F PIBF1 PSEN1 SOCS4
GO_NUCLEOSIDE_DIPHOSPHATE_METABOLIC_PROCESS	0.0381521489312802	0.177340390760976	0.264915088056195	1.35897378061917	165	56	NME1 LDHA GPI RRM2 HK2 ALDOA ENO1 GAPDH TPI1 PGM1 BAD GUK1 BPGM
GO_MICROTUBULE_POLYMERIZATION_OR_DEPOLYMERIZATION	0.157206982543641	0.453010775242579	0.277481859597818	1.22184322958856	1575	29	CSNK1D KIF2C CENPJ TUBGCP2 STMN1 FBXO5 TUBGCP3
GO_RESPONSE_TO_AMMONIUM_ION	0.135261941013929	0.408213035686408	-0.432658361095266	-1.2929797007266	11992	25	AIF1 LRRK2 GSK3B CDK5R1 PLCB1 GNA11 RGS10 CCL5 HCN3 GNAI2 ID1 ASS1 GNAQ
GO_REGULATION_OF_GLUCOSE_IMPORT	0.979609620076682	1	-0.171695034769325	-0.545844424363119	89935	35	RHOQ PIK3R1 LMBRD1 RNASEL OSBPL8 IRS2 ESR1 IRS1 SIRT6 CAPN10 PRKCZ MAPK14 PIK3R3 APPL1
GO_NEGATIVE_REGULATION_OF_PROTEOLYSIS	0.614786070250379	0.917725665917497	-0.254653297294753	-0.955371219445521	61311	165	HTT PEBP1 CR1 TNFAIP8 SPINT2 TERF1 LRRK2 TIMP2 UMODL1 SERPINF2 MAD1L1 RPS6KA3 ARL6IP1 CSTA GABARAPL2 XIAP KLHL22 CD59 CHAC1 PAK2 APC HERPUD1 NLRC4 PSEN1 SIRT4 WAC TPR SERPINF1 PDCL3 SERPINB6 CD46 CD55 SERPINB9 NOL3 HDAC6 UBXN1 SRC LXN EP300 LEF1 COL6A3 MAP2K5
GO_REGULATION_OF_EPITHELIAL_CELL_APOPTOTIC_PROCESS	0.89219906818207	1	-0.220961456065199	-0.683766887160009	80619	30	TIA1 KRIT1 TCF7L2 CD40 CD40LG COL18A1 AKR1C3 ANO6 GSN XBP1 MAPK7 CAPN10
GO_PHOSPHATIDYLCHOLINE_METABOLIC_PROCESS	0.151926576823018	0.441231031589614	-0.415661448423003	-1.26867271940214	13606	28	LCAT PLA2G12A PLA2G16 LPIN1 SLC44A1 CHKA LPCAT2 DBI PLA2G6 GPLD1 LPIN2 CHKB LPCAT4 SLC27A1
GO_METENCEPHALON_DEVELOPMENT	0.794196959402072	1	-0.240437017757716	-0.797840177876136	74806	46	ESR2 MYH10 CDK5R1 NR2C2 C5orf42 MTPN BCL2 PTPRS DAB1 AGTPBP1 RORA NRXN1 OGDH AARS KAT2A
GO_ACTIN_FILAMENT_BUNDLE_ORGANIZATION	0.651622160938096	0.940328391369327	-0.292552673417919	-0.88678108732576	58125	27	AIF1 ITGB1 PDCD10 EPS8 KCTD13 BAIAP2L1 ADD1 CUL3 SRC TNFAIP1
GO_CELLULAR_RESPONSE_TO_VIRUS	0.424124260739585	0.777631201554245	0.270553362102247	1.01071048758823	6525	17	IFIH1 IRF7 BAD BCL2L1 IRF3 LGALS9 BCL2L11 ZC3H12A
GO_RESPIRATORY_GASEOUS_EXCHANGE	0.853771597134429	1	-0.24363384598749	-0.715517263805838	74961	23	CSF2RB FUT8 COX15
GO_NEGATIVE_REGULATION_OF_PROTEIN_MODIFICATION_BY_SMALL_PROTEIN_CONJUGATION_OR_REMOVAL	0.00125	0.0142746913580247	0.388599996034716	2.32430251226493	0	123	PSMD2 PSMD13 PSMD4 PARK7 PSMC5 PSMA4 PSMA1 PSMC3 ANAPC5 PSMB6 UBB CDK5 PSMD3 PARP10 PIAS3 PSMA7 PSME2 PSMB2 GTPBP4 PSME1 TRIM21 PSMD11 PSMD6 MAD2L1 PSMD14 FBXO5 ISG15 PSMB4 PSMA5 CDC20 PSMB5 PSMB1 ANAPC11 RPS3 PSMF1 PSME3 ANAPC1 LIMK1 CDK1 UBC BUB3 TNFAIP3 PSMC2 PSMB7
GO_AMINO_ACID_ACTIVATION	0.075240429945314	0.284411345213777	0.25877378425095	1.28914724836459	398	49	AIMP2 GARS KARS DARS2 MARS VARS CARS2 HARS2 EARS2 YARS
GO_DENDRITIC_CELL_DIFFERENTIATION	0.121956592310903	0.383218554423484	-0.46182732296841	-1.31678825638341	10518	20	CD86 LTBR LYN LILRB1 TNFSF9 AZI2 PSEN1 TGFB1
GO_REGULATION_OF_PROTEASOMAL_UBIQUITIN_DEPENDENT_PROTEIN_CATABOLIC_PROCESS	0.832653595561061	1	-0.224524621240103	-0.82981406135858	82684	130	TERF1 LRRK2 GSK3B CBFA2T3 MAD1L1 CEBPA PIAS1 SIRT2 KLHL22 APC HERPUD1 GEN1 PSEN1 PTEN RNF144B WAC RNF144A TPR RNF166 GOLGA2 SOCS4 TRIB2 PSMD10 CUL3 BCAP31 UBXN1 CHFR GLMN PRICKLE1 ANKIB1 PLK2 RCHY1 SUMO1 TLK2
GO_NEGATIVE_REGULATION_OF_NEURON_DIFFERENTIATION	0.325621416860992	0.684934191236879	-0.304001257391616	-1.09125541180894	31976	90	VIM ITGB1 PTPRO BCL11A OMG GSK3B INPP5F CDK5R1 ULK2 PTGER3 HMG20A ASAP1 PSEN1 PTEN PPP3CA MIB1 MBP SEMA7A LRP1 KANK1 EIF4ENIF1 RTN4 PLK2 EPHB2 NLGN1 DAB1 REST SEMA4B IL1B NLGN3 CBFA2T2 ID1
GO_REGULATION_OF_SKELETAL_MUSCLE_TISSUE_DEVELOPMENT	0.554217422871697	0.883119924472557	-0.330570695350112	-0.952396906048036	48089	21	DDX17 MEF2C TGFB1 BCL2 HDAC9 NR1D2 NACA MTM1 HDAC4 ARNTL
GO_MUSCLE_TISSUE_DEVELOPMENT	0.484455958549223	0.835231639517746	-0.273690216503143	-1.00765465004835	48058	123	HIVEP3 MEF2C ITGB1 CBY1 MYH10 RARA KLF5 TP63 NF1 SIN3B PTEN COL19A1 PPP3CA NRG1 DLG1 MYL6B BIN3 UBE4B VAMP5 FLNB EYA1 RXRA GATA4 SOX6 EGR2 FHL2 EP300 ASB2 SORBS2 PTCD2 HOMER1 SKI NEXN AKAP13 ATF3 EGR1 PAX5 DNER GPCPD1 KAT2A SVIL SIRT6 ALDH1A2 ITGA8 MEF2A EMD ZFPM2 MAPK14 HLX EOMES VEGFA S1PR1 EEF2 ACVR1 HMG20B STAC3 MTOR MED1 PRKAR1A
GO_ACID_SECRETION	0.337499420303297	0.69297883192131	-0.389422235054407	-1.11034276317449	29109	20	ABCC4 NMB NF1 AQP9 HRH2
GO_POSITIVE_REGULATION_OF_ADAPTIVE_IMMUNE_RESPONSE	0.502865148418902	0.848040587579734	-0.295680301015796	-0.995343831666321	47738	51	NCR3 STX7 TNFRSF13C IL12A CD4 TGFB1 IL12RB1 FCER2 MALT1 PRKCQ CD40 TRAF2 RIPK2 HLA-E P2RX7 IL1B ZP3 CD28 STAT6 FCER1G TRAF6 FADD PRKCZ
GO_REGULATION_OF_OSTEOCLAST_DIFFERENTIATION	0.188129219632194	0.505136511349143	-0.380089540434378	-1.21964374805402	17359	37	LTF LILRB1 KLF10 PIK3R1 UBASH3B TYROBP NF1 TMEM64 CCL5 CCR1 RASSF2 TOB2 CSF1 MITF TRAF6 MAFB
GO_REGULATION_OF_PROTEIN_BINDING	0.599705547208245	0.911631275542525	-0.259803472296701	-0.955472503615058	59470	121	RALB PACS1 MEF2C LRRK2 GSK3B PPARA CAPRIN2 KRIT1 TIRAP TMC8 EPB41 ICA1 TCF7L2 PTPRF GNL3L TFIP11 HERPUD1 BAK1 CRBN PSEN1 PLCL1 ADD1 GOLGA2 NRG1 MAPK8 TIAM1 SRC TRAF2 EP300 CTNNBIP1 BCL2 LEF1 PLK2 ADNP HDAC5 GREM2 SORL1 ID1 SMARCD3 TGFBR1 USP33 RFNG MMP9 BTBD1 AURKA
GO_CARDIAC_SEPTUM_DEVELOPMENT	0.654188700250487	0.941543790356563	-0.273926492449365	-0.896813189241371	61112	42	TRIP11 HEY1 MYH10 RARA LMO4 SAV1 C5orf42 GATA4 TAB1 ANK2 PCSK5 FGFRL1 FRS2 ZFPM2 ACVR1 SMAD4 NPHP3 NOTCH2 CITED2 DVL3 HEG1
GO_REGULATION_OF_HISTONE_METHYLATION	0.439870340356564	0.789675040911833	0.20715976969148	1.00828137882232	2713	44	SUPT6H RNF20 PIH1D1 PAF1 DNMT1 PHF19 BRCA1 MECP2 BCOR CTCF SMARCB1 HIST1H1B
GO_ANTIMICROBIAL_HUMORAL_RESPONSE	0.580104889189646	0.901770535501992	-0.313007023697118	-0.93540715774151	51434	25	LTF CAMP DEFA3 HIST1H2BF HIST2H2BE HIST1H2BG PLA2G6 HLA-E
GO_INTERMEDIATE_FILAMENT_BASED_PROCESS	0.386818425600381	0.743495155699434	-0.39623078812681	-1.07476085538209	32455	16	VPS54 VIM
GO_COGNITION	0.284326091563153	0.643822851152794	-0.301096852400965	-1.1054478871859	28176	118	DOPEY2 HTT NTAN1 MEF2C ITGB1 CX3CR1 CHL1 ESR2 ITGA5 CYFIP1 PTGS2 HLA-DRA PLCB1 CHD7 NF1 GRIN2B PSEN1 PTEN NIPBL SERPINF1 HRH2 CTNS DLG4 KAT2B EGR2 PRKAR1B EP300 TUSC3 PLK2 PLA2G6 EPHB2 ADNP CASP3 ATP1A3 GMFB NRXN1 THRA NLGN3 TMOD2 SLC11A2 PRNP JAKMIP1 FYN SYNGAP1 PRKCZ ITGA8 SYNJ1 CAMK4 RGS14 CNTNAP2 EPM2A EIF4EBP2 OXT TTC8 SLC1A4 NRXN3 EIF2AK4 MTOR
GO_RESPONSE_TO_ZINC_ION	0.845487770593197	1	-0.241758010786333	-0.727606021651231	75184	26	SLC30A7 PTEN MT1E SLC30A1 HVCN1 KHK ATP7B P2RX7
GO_AXIS_SPECIFICATION	0.596963227605437	0.910990009664348	-0.292751062997703	-0.93069980549153	54805	35	HHEX BMPR1A ETS2 PTCH1 AHI1 DDIT3 SETDB2 SKI PLD6 AURKA SMAD2 FRS2 AXIN1 EPB41L5 SMAD4 ARL13B TTC8 CITED2 MNS1 LRP5L SENP2
GO_PHOSPHATIDYLINOSITOL_METABOLIC_PROCESS	0.328011215782785	0.686827988255562	-0.294371499838165	-1.08200921216197	32520	120	FAM126A FIG4 PIKFYVE CD86 PIK3C2B EFR3A INPP5F INPP4B PLA2G12A PLA2G16 PLCB1 MTMR14 PIK3R1 PI4K2A CD19 PTEN TRAT1 PIK3C2A NRG1 INPP5K BPNT1 IRS2
GO_CELL_PART_MORPHOGENESIS	0.0518346651198608	0.221720532882642	-0.308507704855448	-1.19248010806091	5182	323	TMEM231 RSPH1 GALNT11 SNX10 ZNF280C WDR19 CNTNAP1 SPG11 ITGB1 PTPRO B9D2 DMD LRRK2 OMG BBS9 ROBO1 UNC5D ABCC4 WASF1 ANKRD27 GSK3B MAP6 LINGO2 KIF27 CHL1 TMEM106B TTC21B ACTR2 UBE2B IFT140 MYH10 IFT52 S100A6 SPAST EPHA5 CYFIP1 PIBF1 FOXD1 APBB2 CDK5R1 TMEM216 DYNC2LI1 ULK2 ULK1 LRFN4 EPB41L3 ASAP1 SPAG16 ZSWIM6 RAPH1 PTEN SEPT7 TTBK2 DISC1 POLG2 C5orf42 NUMB C21orf2 MKS1 PTPRM CTTN TMEM237 ALCAM DOCK7 RPGR LAMA2 FZD3 ARL6 TIAM1 SIAH1 ABLIM1 PRKCQ KIAA0586 DLG4 PLXNB2 CAMK2B EGR2 SEMA7A RFX2 RAB8B DSCAM EPHB1 ZNF280D ICK BCL2 WDR35
GO_PIGMENT_GRANULE_LOCALIZATION	0.291579507179578	0.651389571250755	-0.417917831895451	-1.14948638214822	24671	17	RAB27B ASIP
GO_RESPONSE_TO_ORGANOPHOSPHORUS	0.0186471663619744	0.10161195219338	0.253685947610581	1.38745064507581	50	75	NME1 LDHA NDUFS4 HSP90B1 SOD1 TYMS STAT1 RFC3 APEX1 APP RAP1B RELA BSG FOS P2RX1 FOSB SELL BIRC2
GO_AXO_DENDRITIC_TRANSPORT	0.219915139478198	0.555796459063752	0.272163442586511	1.15762045124818	2435	26	UCHL1 AP3B1 SOD1 APP RAB21 DTNBP1 KIF3B SNAPIN
GO_SINGLE_ORGANISM_MEMBRANE_FUSION	0.395878914876789	0.748793866975558	-0.298884136604569	-1.05470094781192	38539	76	STX7 CD9 LRMP TC2N SYTL2 UVRAG BAK1 USO1 TGFBRAP1 STX17 BCL2A1 VPS41 VAMP5 NSF RPH3A DYSF STX8 GOSR2 PLD6 SYTL3 VTI1A STX4 SEC22B OPA1 USP30 VTI1B SNAP47 SYT11
GO_REGULATION_OF_PROTEIN_UBIQUITINATION_INVOLVED_IN_UBIQUITIN_DEPENDENT_PROTEIN_CATABOLIC_PROCESS	0.000597014925373134	0.00912791414826693	0.414130750932641	2.36646161076776	0	94	PSMD2 PSMD13 PSMD4 PSMC5 PSMA4 PSMC3 ANAPC5 PSMB6 UBB PSMD3 PSMA7 PSME2 PSMB2 PSME1 PSMD11 PSMD6 MAD2L1 PSMD14 FBXO5 PSMD1 PSMB4 PSMA5 CDC20 PSMB5 PSMB1 PLK1 ANAPC11 PSMF1 PSME3 ANAPC1 PSMA8 RAB1A CDK1 UBC CLU BUB3 GORASP1 PSMC2 PSMB7 PSME4 PSMB3 PSMB8 SMURF1 BUB1B UBE2C CCNB1
GO_POLYSACCHARIDE_BIOSYNTHETIC_PROCESS	0.0443679985886919	0.197547045461083	0.344094662187683	1.44638759886307	502	25	AKT1 UBB ALG1 PGM1 GYG1 AKT2 UBC NANS
GO_REGULATION_OF_TYROSINE_PHOSPHORYLATION_OF_STAT_PROTEIN	0.299554330551141	0.660308212006961	-0.369333543018234	-1.13532136108914	26952	29	IL12A PTGER4 TNFRSF1A LYN INPP5F PIBF1 IL6R
GO_ORGAN_REGENERATION	0.0396002262870074	0.181495598774017	0.275666157554077	1.37330089099539	209	49	GAS6 NCL SOCS3 TYMS CDKN1A CCNA2 MKI67 GSTP1 HMBS ATIC
GO_GLAND_MORPHOGENESIS	0.678461981997373	0.954278964600433	-0.267861444524712	-0.880282887350452	63539	43	TP63 VDR TGFB1 PTCH1 CUL3 EDA SRC BCL2 ESR1 CSF1 FGFR1 STAT6 TGFBR2 FRS2 RARG POLB LAMA5 MED1
GO_NEGATIVE_REGULATION_OF_ADAPTIVE_IMMUNE_RESPONSE	0.00177221726679499	0.0178585218935825	-0.637218326163046	-1.77571686857821	150	18	PTPN6 CR1 SLAMF1 LILRB1 HAVCR2 SPN PTPRC
GO_RIBOSOME_BIOGENESIS	0.0526315789473684	0.223578463955526	0.321584976035884	2.27962453090039	0	283	SKIV2L2 MRPL36 PA2G4 RPL39 NHP2 NOP14 UTP14A EXOSC6 SART1 WDR12 RPL21 RRP1B DCAF13 SUV39H1 RCL1 TSR1 RPL18 CSNK1D RPL7L1 DDX3X NPM1 IMP4 RPL35 SENP3 RBFA RPS14 MPHOSPH6 RPS27 DDX56 WBP11 RPL29 RPS10 EXOSC7 XPO1 SRFBP1 RPL28 RPL27A GTPBP4 LAS1L RPL41 PDCD11 NOL6 ISG20L2 NPM3 C1QBP WDR43 RPL26L1 RPL7 RPS28 NMD3 CSNK1E ERAL1 NOL9 AATF EXOSC5 RPL18A EXOSC4 RPS9 EXOSC3 FRG1 RPS19 NOP56 RPS20 PAPD5 NOP58 NOM1 EXOSC10 RPS3 GAR1 METTL15 ABT1 TBL3 NOLC1 BMS1 NVL DKC1 TSR2 MPV17L2 PNO1 RAN RRP36 EXOSC9 RPL11 WDR18 RPL12 RPL15 RPL37 NOP10
GO_B_CELL_HOMEOSTASIS	0.164827942350124	0.466970433916892	-0.45555421276331	-1.26947902617084	14043	18	TNFRSF13C MEF2C GAPT LYN BAK1 NCKAP1L BCL2 CASP3
GO_IRE1_MEDIATED_UNFOLDED_PROTEIN_RESPONSE	0.000394632991318074	0.00836470096194061	0.425491236175081	2.1364198070688	1	51	SEC61A1 YIF1A SRPRB TPP1 ARFGAP1 WFS1 PDIA6 ACADVL DDX11 CXXC1 HDGF HSPA5 ASNA1 KLHDC3 ERN1 DCTN1 DNAJB9 TLN1 EXTL3 TSPYL2 SSR1 PTPN1 ATP6V0D1
GO_SINGLE_ORGANISM_BEHAVIOR	0.469835796058303	0.820770748543778	-0.270130857668541	-1.01503319577796	46867	170	HTT NTAN1 MEF2C ITGB1 ASIP CX3CR1 LRRK2 PPARA CHL1 ESR2 ITGA5 MAFG PTGS2 SDK1 PLCB1 EPS8 CHD7 NF1 GRIN2B NPC1 PSEN1 PTEN SERPINF1 HRH2 CTNS GRIK2 DLG4 KAT2B EGR2 PRKAR1B EP300 BCL2 PLK2 PLA2G6 NLGN2 EPHB2 GHRL ADNP DAB1 HOMER1 CASP3 ATP1A3 NPHP1 GMFB NRXN1 THRA DNM1 IL1B NLGN3 PAX5 TMOD2 SLC11A2 PRNP GIGYF2 NPHP4 LSAMP FYN SYNGAP1 UNC79 DYNLRB1 PRKCZ ITGA8 SYNJ1 CAMK4 RGS14 CNTNAP2 EPM2A EIF4EBP2 OXT FGF12 SNCA
GO_POSITIVE_REGULATION_OF_ENDOCYTOSIS	0.84741980474198	1	0.157943152872891	0.834181241001591	3037	64	GAS6 CALR ACTN4 HIP1 LMAN2 RAB27A RAB21 FLOT1 PLCG2 ARF1 DNM2 B2M LDLRAP1
GO_MRNA_SPLICE_SITE_SELECTION	0.0374531835205993	0.174807976576637	0.358054323604014	1.48863857947675	439	24	SNRPC SF3A2 ISY1 SFSWAP SF1 SLU7 SF3A3 SRSF6 CELF1 LUC7L SRSF10
GO_REGULATION_OF_TRANSLATION_IN_RESPONSE_TO_STRESS	0.255102040816327	0.603502270473407	0.299024143051299	1.13698496536871	3774	18	PPP1CA PPP1R15A EIF2S1 EIF2B3 NCK2 ATF4 EIF2B5
GO_POSITIVE_REGULATION_OF_ERYTHROCYTE_DIFFERENTIATION	0.465658889254026	0.816171430715251	-0.364196960492016	-1.01489655849149	39675	18	ACVR2A ETS1 ACVR1B MAPK11 NCKAP1L ANKRD54
GO_DENDRITIC_CELL_MIGRATION	0.593603631734441	0.908915606838995	-0.343880759994746	-0.91909258033268	49426	15	EPS8 CCL5 CCR1 CXCR1 DOCK8 ANO6
GO_LYSOSOMAL_TRANSPORT	0.372015680060051	0.72751480772843	-0.313399636394147	-1.07263795733772	35682	58	HGSNAT VPS54 SCYL2 HOOK3 NEDD4 VPS52 SNX27 KIF13A HOOK2 NPC1 TGFBRAP1
GO_POSITIVE_REGULATION_OF_DNA_BIOSYNTHETIC_PROCESS	0.0175559380378657	0.0972409741618312	0.302270434481043	1.48736214081114	101	46	CCT7 RFC4 CCT2 MAP2K7 WRAP53 RFC3 PRKD2 HNRNPA1 TCP1 CCT6A NVL DKC1 CCT4 RFC5 ATR
GO_REGULATION_OF_CALCIUM_MEDIATED_SIGNALING	0.0877932978655758	0.314134713908213	-0.396218343622988	-1.31901519067811	8283	47	HTT DMD LRRK2 ITPR1 RGN CD4 ATP2B4 LMCD1 SLA2 TRAT1 NRG1 FKBP1B
GO_REGULATION_OF_ALPHA_BETA_T_CELL_ACTIVATION	0.737048125852967	0.986669487039551	-0.252428167688253	-0.842866123929271	69667	48	CD86 ZBTB16 IL12A LILRB1 RARA IL12RB1 NCKAP1L PRKCQ RIPK2 IL4R SYK CD244 HLA-E
GO_MUSCLE_ORGAN_DEVELOPMENT	0.393238002908386	0.74690996445638	-0.286624309099775	-1.05038321908969	38939	115	HIVEP3 MEF2C POU6F1 DMD TAGLN KLF5 SMTN NF1 SIN3B COL19A1 PPP3CA MKL2 FOXO4 NRG1 MYL6B LAMA2 BIN3 UBE4B SAP30 VAMP5 FLNB RXRA SOX6 EGR2 EP300 EGR3 ASB2 COL6A3 PTCD2 HOMER1 SKI ATF3 EGR1 PAX5 DNER GPCPD1 FKTN SVIL XBP1 SIRT6 ASS1 TCF12 FGFRL1 CENPF ID3 MEF2A EMD ZFPM2 MAPK14 HLX EOMES S1PR1 EEF2 HMG20B LAMA5 STAC3 MED1 FHL3 CXCL10 FOXK1 HEG1 TPM1 UTRN BVES
GO_POSITIVE_REGULATION_OF_HEMOPOIESIS	0.664257263592066	0.946533640317217	-0.252212790705908	-0.921120651017413	65706	110	CD74 CD86 ZBTB16 ACVR2A IL12A TNFSF9 RARA BTK ETS1 ACVR1B KLF10 ATP11C LILRB2 STAT5B MAPK11 TGFB1 OGT IL12RB1 CD46 TMEM64 NCKAP1L CCL5 ANKRD54 ZBTB46 CCR1 CTNNBIP1 SCIN RIPK2 ADAM8 EGR3 LEF1 IL4R SYK
GO_REGULATION_OF_PHOSPHATIDYLINOSITOL_3_KINASE_ACTIVITY	0.646106756944767	0.936386604267778	-0.31075780537763	-0.88605027972486	55727	20	LYN PIK3R1 TGFB1 NOD2 SRC IRS1 FLT1 PIK3R3 PTK2B ATG14
GO_LEUKOCYTE_DEGRANULATION	0.324833702882483	0.684514469646078	-0.39791207773033	-1.12166571719976	27834	19	LYN UNC13D PI4K2A STXBP3 ANXA3 HCK
GO_MYELOID_CELL_HOMEOSTASIS	0.180195258019526	0.493137910260537	0.216838944103568	1.14524103260974	645	64	ATPIF1 SRF GPI ACIN1 SOD1 MAEA RPS14 SFXN1 NFE2L1 PRDX1 KLF2 PDE4B MTHFD1 HMGB1 RPS19 DNASE2 HIPK2 BAX NCSTN
GO_REGULATION_OF_BLOOD_PRESSURE	0.536884137844976	0.872042873100115	-0.283415048154797	-0.975750638221116	51629	61	NAV2 PTPRO PPARA POMC SERPINF2 CORIN PTGS2 HMOX1 WNK1 NISCH EPHX2 NRG1 ADM2 F11R GNB3 NOX1 PLCB3 BMPR2 NOS3 F2R RENBP PCSK5
GO_REGULATION_OF_MORPHOGENESIS_OF_A_BRANCHING_STRUCTURE	0.472927715869138	0.823366551014155	-0.372085497158457	-1.00926767728435	39680	16	LRRK2 TGFB1 RXRA RTN4 ESR1 IL1B FGFR1 PAX8
GO_RESPONSE_TO_ELECTRICAL_STIMULUS	0.362889485354184	0.718016628775658	-0.387287808117295	-1.09171719424162	31095	19	AIF1 DISC1 SRC BRD1 P2RX7 NRF1 REST
GO_REGULATION_OF_CYTOKINE_PRODUCTION	0.170471704717047	0.476753822715854	-0.285012913988383	-1.10695057483639	17046	372	LTF CAMP HLA-DRB5 BANK1 TNFRSF13C ELANE MEFV SLAMF1 CD74 CD86 TLR10 CASP5 TIA1 ANXA4 NLRP1 IL12A HLA-DPB1 PTGER4 TRIM32 OTUD7B CYP1B1 RNF135 LYN DTX4 POMC SERPINF2 CD4 LILRB1 TNFSF9 TIRAP LITAF GPAM PIBF1 RARA BTK IL6R LY96 CD84 PTGS2 REL RPS6KA4 PLCB1 HMOX1 POLR3C CREBBP PIK3R1 CD2 HAVCR2 SPN LILRB2 NOD1 STAT5B HLA-DPA1 TXK ZBTB20 MAPK11 MAVS BTN2A2 FOXP1 AGPAT2 CD6 TGFB1 CD36 TRIB2 HLA-DRB1 IL12RB1 CD46 NOD2 NCKAP1L CLEC5A CLEC4E EIF2AK3 HPSE MALT1 IRF5 NLRX1 TLR2 MAST2 GLMN PRKCQ GATA4 CD40 SRC ARFGEF2 F11R SEMA7A TRAF2 IL17RC EP300 IGF2BP3 RIPK2 CD40LG ADAM8 LEF1 HSPA1B IL4R MAP2K5 NOX1 SYK DDIT3 NDRG2 CD244 NLRC3 GHRL AKIRIN2 CDH3 HLA-E MUL1 TLR6 ARNT UBE2J1 POLR3D GPNMB HSPA1A
GO_REGULATION_OF_ERBB_SIGNALING_PATHWAY	0.97666800092696	1	-0.171760018085384	-0.578192980529497	92718	51	CBL ESR2 ZFYVE28 EPS15 PSEN1 NUP62 SOCS4 AP2A1 DOK1 HGS PTPRJ PTPN2 ESR1
GO_NEGATIVE_REGULATION_OF_SMOOTH_MUSCLE_CELL_PROLIFERATION	0.181016699127589	0.494654199979378	-0.432766748472909	-1.24683076293117	15706	21	AIF1 IGFBP3 ESR2 IL12A HMOX1 PPARD CTNNBIP1 NDRG2 ESR1
GO_CHEMICAL_HOMEOSTASIS	0.69759697596976	0.965983836485071	-0.242601490911311	-0.947071853920966	69758	439	LTF KCNMA1 ACO1 IBTK MED13 ABL2 ELANE CNNM4 HK3 ITGB1 FAM20A LRRK2 ITPR1 LCAT RGN ATP6V1G1 PTGER4 ADCY4 RAP1GDS1 POMC MAFG ATP2B4 GPAM ADCY9 CEBPA RIC3 FBXL5 TMC8 CIB2 ABCB7 SLC30A7 XIAP IREB2 PROK2 PTGER3 HMOX1 TP63 TCF7L2 TPT1 PIK3R1 SLC35G1 NMB CYB5R4 HERPUD1 RAB11FIP2 BAK1 EPOR FOXO1 NPC1 VDR PSEN1 EIF5A2 PRKCB PTPRC SLC4A7 EPB42 PPP3CA AQP9 SLC9A8 DISC1 SERPINF1 EPHX2 TGFB1 CD36 SLC9A7 PTCH1 FKBP1B ACAD8 DHPS CCDC22 INPP5K OGT CHERP CD55 TMEM64 SLC31A1 IRS2 NOL3 SOAT1 CCL5 BCAP31 CCL28 CLDN4 SLC39A6 PRKAR2A SLC30A1 GRIK2 FLVCR1 GATA4 DLG4 CD40 SLC31A2 CCR1 PRKAR1B EP300 TRPM2 BCL2 LAMTOR1 CDH23 S1PR4 PLA2G6 ATP2C1 CACNA1C NOX1 SLC26A5 RPS6 STEAP4 DDIT3 RYR3 SLC4A8 CLCN3 NCOA5 GHRL ADNP HOMER1 ATP7B ANK2 RORA P2RX7 MCOLN1 ATP1A3 MYC AACS KLHL3 NR1H2 PTPN2 ATP6V1G2 ESR1 CACNB3 PDK4 SFXN5 TFRC IL1B CNNM2 IRS1 GK F2R GPCPD1 SLC11A2 GCDH SFXN3 PRNP SLC4A1 ALAS2 ZNF236 HK1 SLC46A1 SLC39A4 TPCN2 XCR1 XBP1 GOT1 SIRT6
GO_SYNAPSE_ORGANIZATION	0.473324501083002	0.823366551014155	-0.300219370186734	-1.01328310753981	45015	52	LRRK2 NEDD4 CACNA2D2 NFIA SDK1 PTEN NRG1 DLG4 DSCAM CDH1 NLGN2 NLGN1 ZC4H2 NRXN1 CACNB3 NLGN3 DNER F2R IL1RAPL1
GO_METANEPHROS_DEVELOPMENT	0.378388376942221	0.735706591461497	-0.355566418647069	-1.07778736615388	33752	27	FOXD1 NF1 NIPBL PTCH1 EYA1 BCL2 KIF26B ROBO2 DLG5 EGR1 PAX8 ID3 ITGA8 ACAT1 SMAD4
GO_REGULATION_OF_MICROTUBULE_BASED_PROCESS	0.00510204081632653	0.0374554583738257	0.228246154077456	1.42646809619184	0	180	KPNB1 SMC1A ROCK2 CHMP3 TUBB CSNK1D RANBP1 RHOA SKA3 NPM1 MLH1 SPC25 CEP76 CENPJ CHEK1 TPX2 XPO1 STIL PPP2R1A EML2 ASPM SKA1 SKA2 TUBGCP2 BECN1 RCC2 KIF11 STMN1 BRCA1 FBXO5 CHMP1B TUBGCP3 TTK NUBP1 MYBL2 KATNB1 SPAG5 PLK1 HAUS4 CDK5RAP2 CHORDC1 BIRC5 CHD4 RPS3 ESPL1 PLK4 RGS2 KIF3B BIRC2 CEP63
GO_NEGATIVE_REGULATION_OF_TRANSPORTER_ACTIVITY	0.986955809253291	1	-0.163767791149188	-0.5180260772953	90340	34	NEDD4 KCNE3 CAB39 OXSR1 FKBP1B SUMO1 MMP9 CALM2 GNB5 FGF12 SNCA ANO9 ANK3 NDFIP2 KCNQ1 SLC9A3R1
GO_ENDOSOME_ORGANIZATION	0.944319211241494	1	-0.191216646497255	-0.643689515159124	89647	51	SNX10 HOOK3 PLEKHF1 DNAJC13 HOOK2 ARFGEF2 LAMTOR1 CHMP4B PDCD6IP HGS CLCN3 VPS37C
GO_REGULATION_OF_WOUND_HEALING	0.143044660436916	0.423751195849951	-0.361326827509146	-1.23906320254147	13730	59	TC2N PTGER4 LYN SERPINF2 PTGER3 UBASH3B THBD TXK CD36 ANXA5 F12 PPARD HPSE CLASP1 PRKCQ KANK1 SYK FAM46A NOS3 SERPINB2 ANO6 GSN F2R ENPP4 TGFBR2
