pathway	pval	padj	ES	NES	nMoreExtreme	size	leadingEdge
GO_REGULATION_OF_BONE_RESORPTION	0.208822499708251	0.538427351164131	-0.433693357837538	-1.22252879087851	17893	19	PTGER4 UBASH3B NF1 TMEM64 SRC ADAM8 SYK P2RX7 PDK4 TFRC
GO_SPINDLE_ASSEMBLY	0.0211917227624034	0.111376952018313	0.272852254709147	1.41590186589664	84	59	KPNB1 TUBB CSNK1D RHOA MLH1 TPX2 ASPM TUBGCP2 KIF11 FBXO5 TUBGCP3 MYBL2 HAUS4 BIRC5 CHD4 RPS3 KIF3B BIRC2
GO_REGULATION_OF_SODIUM_ION_TRANSMEMBRANE_TRANSPORTER_ACTIVITY	0.840776296228003	1	-0.251566164109417	-0.724779418545941	72954	21	DMD NEDD4
GO_NEGATIVE_REGULATION_OF_ANTIGEN_RECEPTOR_MEDIATED_SIGNALING_PATHWAY	0.885989481770372	1	-0.244720590392189	-0.673105966336141	74967	17	PTPN6
GO_SPHINGOLIPID_BIOSYNTHETIC_PROCESS	0.264926957703414	0.617662094204558	-0.346226426935148	-1.1488803039876	24953	46	SGMS1 ST8SIA1 PPM1L UGCG SGPP2 PRKD1 ST3GAL3 ALDH3B1 SGPL1 DEGS1 SGPP1
GO_REGULATION_OF_PHOSPHOPROTEIN_PHOSPHATASE_ACTIVITY	0.0674230145867099	0.263705236755631	0.270086212776431	1.31455494194016	415	44	HSP90B1 ROCK2 CALM3 PPP2R5D PPP2R2A CD300A SET PPP1R15A PPP2R1A EIF2AK2 PAWR FKBP1A ARPP19 CALM1 ANKLE2 PPP1R2 PPP1R11 CRY2 PPP2R1B
GO_REGULATION_OF_MULTI_ORGANISM_PROCESS	0.2	0.524822695035461	0.159247728529407	1.09389984694453	1	320	B4GALT1 VPS37B P4HB MRPS2 TRIM28 COX8A CFL1 POLR2D TAF11 ACIN1 YTHDC2 CHMP3 STAT1 DDX3X TAP1 PPIA PRDM1 ILF3 MX1 LSM4 PPP2R3C PARP10 PLSCR1 IFIT1 RSAD2 OAS3 DDB1 ADA APOBEC3C FANCL POLR2E SNRPD1 PPP2R1A BAD HDAC1 MB21D1 PFN1 POLR2I AP2S1 PPIH C1QBP TRIM21 PPIE EIF2AK2 DDX5 VPS25 LARP1 ISG15 POLR2G VPS4A ARF1 SUPT4H1 RNF216 TRIM25 SNF8 NOTCH1 CHAF1B SRPK1 POLR2A B2M PEX13 CHD1 TRIB1 SNRPB PPIB TARDBP LGALS1 BIRC2 IFITM3 SMARCB1 TARBP2 C19orf66 SLC37A4 MIF TRIM26 YIPF1 IL15 CIB1 PUM1 SIN3A TNFAIP3 LGALS9 BCL2L11 POLR2L POLR2K BST2 CCR2 TRIM14 SLC35B3 DERL1 OASL AP2M1 SLC35C1 HERC5 RAD23A ELMO1 AP1M1 ZC3H12A PKN2 NUP93 EXOC7 TAP2 GTF2F1 SMURF1 FUCA2 AP2B1 IGF1
GO_POSITIVE_REGULATION_OF_CELL_CYCLE_ARREST	0.00442477876106195	0.0338257880494405	0.276950422422508	1.49654989522351	12	71	PRMT1 PCNA RBM38 MED25 UBB CDKN1A NPM1 UHRF2 CENPJ TFDP2 TP73 TRIAP1 BRCA1 CNOT10 E2F1 ZNF385A CDK1 UBC BAX PRKACA CARM1 RRP8 GADD45A TFDP1
GO_CONNECTIVE_TISSUE_DEVELOPMENT	0.348425176713688	0.703515979105894	-0.303166776926433	-1.07944611356605	34060	83	CHI3L1 MEF2C ZBTB16 CSGALNACT1 UMODL1 FOXD1 SATB2 RARA BMPR1A RUNX2 HOXB3 FBXW4 MEX3C TGFB1 PPARD EIF2AK3 SOX6 SNX19 GPLD1 GHRL BMPR2 AACS THRA ROR2 CSF1 EGR1 FGFR1 TGFBR2 XBP1 SULF2 TGFBI BMP8B CREB3L2 RARG MAPK14 ACAT1 ITGB8 THBS3 ZNF516 MAPK3 HOXC4 CHSY1 BBS4 TIMP1 PAXIP1
GO_CYTOPLASMIC_PATTERN_RECOGNITION_RECEPTOR_SIGNALING_PATHWAY	0.791820448877806	1	0.184870496238694	0.814045157789128	7937	29	IFIH1 IRF7 RELA NFKBIA IRF3 CHUK MAP3K7 UBC TNFAIP3
GO_REGULATION_OF_STEROID_BIOSYNTHETIC_PROCESS	0.992083758937692	1	0.131938269192291	0.548543571969961	11654	24	SOD1 SF1 SCAP NFKB1 ATP1A1 ERLIN2
GO_NUCLEAR_ENVELOPE_ORGANIZATION	0.250260326275599	0.594328117599304	0.202342493678168	1.0950871359336	720	72	CHMP7 NUP188 NSFL1C TOR1AIP1 POM121 PPP2R1A SYNE2 NUP50 PPP2CA NUP133 CCNB2 PLK1 RAE1 TARDBP CDK1 NUP155 TOR1B ANKLE2 VRK1 LEMD2 LMNA NUP93 ZMPSTE24 NUP85 CCNB1 NUP37 CHMP2A NUP153 NUP214
GO_REGULATION_OF_GLIAL_CELL_DIFFERENTIATION	0.738737925431073	0.986669487039551	0.197902353046188	0.841758206242495	8182	26	WDR1 RELA TP73 CXCR4 MECP2 NOTCH1 CDK1
GO_BIOMINERAL_TISSUE_DEVELOPMENT	0.031759995488637	0.154013084283037	-0.497779983318789	-1.48759268682549	2815	25	CNNM4 FAM20A PPARA PTGS2 KLF10 TFIP11 ENAM FOXO1 TUFT1
GO_SCHWANN_CELL_DEVELOPMENT	0.429258464937935	0.782174789618474	0.269561644885275	1.00700571384553	6604	17	AKT1 SOD1 CDK5 AKT2
GO_POSITIVE_REGULATION_OF_HISTONE_METHYLATION	0.672836660106832	0.949464394506208	-0.289255000176794	-0.870555144116287	59831	26	MTF2 DNMT3B RTF1 CHTOP TET1 SNW1 OGT
GO_NEGATIVE_REGULATION_OF_T_CELL_DIFFERENTIATION	0.449544127286813	0.800824877689555	-0.378534522350667	-1.02676041141722	37718	16	CD74 ZC3H8
GO_RNA_POLYADENYLATION	0.120185185185185	0.381590665025276	0.294801466320077	1.27146190336903	1297	27	PNPT1 PAF1 CPSF3 CPSF1 CPSF6 NUDT21 WDR33 CPSF2 SYMPK
GO_ASPARTATE_FAMILY_AMINO_ACID_METABOLIC_PROCESS	0.555714098989195	0.884211477682734	-0.301258826944051	-0.957747270901063	51018	35	ASNS AHCYL1 THNSL1 MTHFR MTRR ENOPH1 MTR ASRGL1 NMNAT1 EIF2B2 APIP SMS OGDH GCDH GOT1 ASS1
GO_POSITIVE_REGULATION_OF_MUSCLE_TISSUE_DEVELOPMENT	0.761266955957222	0.99057701742863	-0.272108465608847	-0.799143091066435	66839	23	MEF2C MKL2 TGFB1 NRG1 BCL2 FGFR1 NACA MTM1 MAPK14 ARNTL MTOR
GO_PROTEIN_TRANSMEMBRANE_TRANSPORT	0.0246353322528363	0.125035294013024	0.297431032926854	1.4476467724919	151	44	PEX14 HSP90AA1 TIMM44 PEX16 TOMM40 MCL1 AKT2 PEX19 NDUFA13 TIMM22 PEX13
GO_INTRINSIC_APOPTOTIC_SIGNALING_PATHWAY_BY_P53_CLASS_MEDIATOR	0.777655810384517	1	-0.245462476331113	-0.809300241340658	72968	44	ZMAT1 ZMAT3 PPP1R13B PPP2R5C TP63 PMAIP1 SNW1 EP300 AEN
GO_RESPONSE_TO_RETINOIC_ACID	0.726121711950496	0.982321877227362	-0.254530817298107	-0.852337273754712	68762	49	LYN RARA SLC10A3 LTK SETX SERPINF1 PTCH1 SNW1 OGT RXRA EP300 DNAAF2 TFRC IGF2R
GO_ODONTOGENESIS_OF_DENTIN_CONTAINING_TOOTH	0.221806983319817	0.558448762551614	-0.379478574679784	-1.19403497757705	20238	33	CNNM4 FAM20A PPARA BMPR1A TP63 RUNX2 ENAM FOXO1 EDA ACVR2B LEF1
GO_REGULATION_OF_TRANSLATIONAL_INITIATION	0.142614023144997	0.423534798534799	0.217811607110873	1.1769829955448	418	71	PPP1CA POLR2D YTHDF2 EIF5B DDX3X NPM1 EIF3B PPP1R15A EIF2B1 EIF2S1 EIF2AK2 POLR2G EIF2B3 EIF4H EIF3G NCK2 ATF4 DDX1
GO_MYELOID_CELL_ACTIVATION_INVOLVED_IN_IMMUNE_RESPONSE	0.12773264278649	0.393004484847996	-0.421320423262912	-1.29512763039204	11492	29	SLAMF1 CX3CR1 LYN PI4K2A HAVCR2 TYROBP STXBP3 ANXA3
GO_POSITIVE_REGULATION_OF_SYNAPTIC_TRANSMISSION	0.554145239126073	0.883119924472557	-0.287841821312968	-0.963884514475687	52476	49	GSK3B PTGER4 PTGS2 PTEN LAMA2 GRIK2 DLG4 RETN PLK2 NLGN2 NLGN1 NRXN1 DNM1 NLGN3 CLSTN2 KISS1R STX4 SNAP47 PRKCZ SYNJ1 RGS14 OXT SNCA PTK2B CA2 VAMP2 CCL2 RIMS2 PRKCE
GO_CELL_RECOGNITION	0.784817287023419	1	-0.235756139525885	-0.829642380533	76306	74	IGHG2 NCR3 CSGALNACT1 ROBO1 IGHE CADM2 IGKC CDK5R1 HSPA1L SMAGP CD6 CD36 DLG1 IGLL1 IGHV3-23 DSCAM EPHB1 IGLL5 RTN4 HVCN1 EPHB2 CATSPERB DOCK8 ROBO2 ZP3 CATSPERG
GO_PROTEIN_K63_LINKED_UBIQUITINATION	0.972089728975996	1	-0.180515133788267	-0.558605438766005	87838	30	NEDD4 UBE2B ZFP91 TRAF2
GO_NEGATIVE_REGULATION_OF_PHOSPHORYLATION	0.761679485512537	0.99057701742863	-0.236681906949695	-0.909568184174971	76154	275	PTPN6 CDKN1C NCK1 PDCD4 IBTK PMEPA1 DMD LRRK2 IGFBP3 GSK3B PPARA CBFA2T3 RGN LYN UBE2B HHEX ZFYVE28 INPP5F SPRED1 PIBF1 CEBPA PRR5L GMFG SIRT2 WNK1 PAK2 UBASH3B APC CHAD LRRC4C NF1 BAK1 FOXO1 TAF7 STK38 PSEN1 PTPRC PTEN SOCS2 DUSP7 NUP62 DEPTOR TGFB1 DLG1 SOCS4 TRIB2 INPP5K OGT PSMD10 DUSP22 IRS2 LAX1 CUL3 PRKAR2A KAT2B PRKAR1B TAOK3 RASSF2 NDRG2 PTPRJ HDAC3 PKIG DUSP18 CASP3 LATS2 P2RX7 MYC GMFB PTPN2 SORL1 ZMYND11 IL1B ATF3 SH3BP5 HSPB1 PRNP FKTN SIRT6 NPRL2 GNAQ GBA MIDN MAPK7 RNF149 IGF1R STAP1 CALM2 DUSP6 SNX25 PRKCZ CDK5RAP1 ADARB1 SH3BP5L CTDSP2 ASH1L CSK HDAC4 RGS14 SOCS1 PKIA MBIP PDPK1 NF2 HYAL2
GO_NEGATIVE_REGULATION_OF_NUCLEAR_DIVISION	0.737950156719199	0.986669487039551	-0.263144313625854	-0.827987495433462	67334	33	TERF1 FBXO43 TOM1L2 MAD1L1 KLHL22 TPR
GO_REGULATION_OF_GENERATION_OF_PRECURSOR_METABOLITES_AND_ENERGY	0.160332541567696	0.458627539959955	0.228149236142905	1.17401842001644	674	57	PPIF PARK7 AKT1 PPP1CA DDIT4 PNPT1 PRELID1 GADD45GIP1 EPM2AIP1 AKT2
GO_LIPID_CATABOLIC_PROCESS	0.22617957976685	0.563165844641551	-0.305142927589813	-1.13058609120645	22486	135	TRERF1 NAPEPLD CYP4F3 ABHD2 ECI1 CYP1B1 ABHD6 INPP5F PLA2G12A BCO2 PLA2G16 HSD17B11 LPIN1 PLCB1 SIRT2 PHYH ABHD4 CROT PLCB2 PEX7 ACAD8 SGPL1 PPARD PNPLA1 NUDT19 PAFAH2 GBA3 RARRES3 HRASLS2 PLA2G6 AKR1C3 PLCB3 AMACR CRAT DDHD1 ENPP7 PLCG1 PLD6 SLC27A4 ACAA1 NCEH1 GPCPD1 GCDH LPIN2 PNPLA2 MUT LIPE HADHB GBA PLD2 ACADSB CYP27B1 PLA2G15 DDHD2 PCCA HSD17B4 ECI2 ACADM HEXB ABCD3 MMAA HSD17B6
GO_POSITIVE_REGULATION_OF_LIPID_METABOLIC_PROCESS	0.0844891247013559	0.307092484075876	-0.372701580029819	-1.29738278563381	8168	67	NT5E PPARA RGN TNFRSF1A ABHD6 LYN GPAM PTGS2 MLYCD CTDNEP1 SIRT4 TGFB1 NSMAF MID1IP1 NOD2 IRS2 SRC PLA2G6 GPLD1 NR1H2 IL1B CD81 IRS1 ZP3 PNPLA2 POR XBP1 ABCG1 FLT1
GO_RESPIRATORY_SYSTEM_DEVELOPMENT	0.930855713908146	1	-0.196995073060122	-0.710348048058091	91571	95	CHI3L1 TNS3 HHEX CEBPA RARA BMPR1A CELSR1 CHD7 SAV1 NUMB HS6ST1 EDA EYA1 ACVR2B EP300 TAB1 LEF1 BMPR2 NOS3 SKI THRA DLG5 FGFR1 ID1 MAN1A2 GPSM2 TGFBR2 ASS1 STK40 SMAD2 FGFRL1 AXIN1 ALDH1A2 ZFPM2 RARG VEGFA NPHP3 LAMA5 MAPK3 SLC23A1 RPGRIP1L CRISPLD2 HEG1 TULP3 MAPK8IP3 BAG6 CREB1 SP3 DNAAF1
GO_ION_HOMEOSTASIS	0.111982396479296	0.366992796256328	-0.29997318788327	-1.15407416215235	11195	282	LTF KCNMA1 ACO1 IBTK ABL2 ELANE CNNM4 ITGB1 FAM20A LRRK2 ITPR1 RGN ATP6V1G1 RAP1GDS1 MAFG ATP2B4 GPAM RIC3 FBXL5 TMC8 CIB2 ABCB7 SLC30A7 XIAP IREB2 PROK2 PTGER3 HMOX1 TPT1 SLC35G1 NMB HERPUD1 BAK1 EPOR VDR PSEN1 PRKCB PTPRC SLC4A7 EPB42 SLC9A8 DISC1 EPHX2 TGFB1 CD36 SLC9A7 FKBP1B CCDC22 CHERP CD55 TMEM64 SLC31A1 NOL3 CCL5 BCAP31 CCL28 SLC39A6 SLC30A1 GRIK2 FLVCR1 DLG4 CD40 SLC31A2 CCR1 TRPM2 BCL2 CDH23 S1PR4 PLA2G6 ATP2C1 CACNA1C NOX1 SLC26A5 STEAP4 DDIT3 RYR3 SLC4A8 CLCN3 GHRL ATP7B ANK2 P2RX7 MCOLN1 ATP1A3 MYC KLHL3 ATP6V1G2 ESR1 CACNB3 PDK4 SFXN5 TFRC IL1B CNNM2 F2R GPCPD1 SLC11A2 SFXN3 PRNP SLC4A1 ALAS2 SLC46A1 SLC39A4 TPCN2 XCR1 XBP1 GOT1
GO_NEGATIVE_REGULATION_OF_STAT_CASCADE	0.363402964173182	0.718648299006293	-0.387105225371986	-1.09120251570476	31139	19	INPP5F PIBF1 CHAD LRRC4C SOCS2 SOCS4 HGS DAB1 PTPN2
GO_NEUROEPITHELIAL_CELL_DIFFERENTIATION	0.970617250734288	1	-0.184111290022448	-0.558075262302677	86580	27	MEF2C SLC4A7 BCL2 LEF1 FGFR1 FAM20C MITF
GO_NUCLEOSIDE_MONOPHOSPHATE_METABOLIC_PROCESS	0.00671140939597315	0.0466770954231216	0.376095174444317	2.3841727780371	0	192	PAICS NDUFB7 IMPDH1 UCK2 NDUFS8 ATP5G3 COX8A LDHA NDUFS4 ATP5F1 NDUFS7 NDUFC1 GPI ATP5H HK2 NDUFA10 TYMS DUT ALDOA NDUFB10 NDUFS5 UQCR11 IMPDH2 ATP5B ATP5G1 ENO1 ATP5J UQCRC2 UQCRQ GAPDH ATP6V1B2 ADA CYCS TPI1 PGM1 CHCHD10 BAD TK1 ATP5I NADK GUK1 CYC1 COX6C GART ATIC NDUFB2 ATP5J2 UPP1 BPGM UQCRFS1 UQCRC1 ATP5O NDUFV3 NDUFB3 UQCRHL NDUFA13 PMPCB COX7C COX6A1 MECP2
GO_REGULATION_OF_GLUCOSE_TRANSPORT	0.904443799012489	1	0.149117746422835	0.794283878018945	3113	66	AKT1 MZB1 NUP188 HK2 POM121 PTPN11 NUP50 AKT2 NUP133 ASPSCR1 RAE1 ARPP19 NUP155
GO_NEGATIVE_REGULATION_OF_TRANSFORMING_GROWTH_FACTOR_BETA_RECEPTOR_SIGNALING_PATHWAY	0.986130029620981	1	-0.16359560747724	-0.52718701349945	91218	38	PMEPA1 SMURF2
GO_ADHERENS_JUNCTION_ORGANIZATION	0.163068577901708	0.463761520550591	-0.392164954107921	-1.24675156691643	14970	35	TESK2 TAOK2 JUP CADM2 ARHGAP6 NUMB CTTN SRC RAB8B BCL2 CDH1 CDH3 DLG5 CDH4 PTPRK CSK CTNND1 PDPK1 TBCD LAMA5 ACTN1 PTK2B ANG
GO_EPITHELIAL_CELL_MORPHOGENESIS	0.58331401010991	0.904585717843429	-0.326812879362302	-0.931827417254312	50311	20	HRH2 MET FLNB FRMD6 COL18A1 VSIG1 ID1 PAX8 ST14 EPB41L5
GO_POSITIVE_REGULATION_OF_OSTEOBLAST_DIFFERENTIATION	0.00370574611227528	0.030068553981181	-0.535187299494106	-1.66606700739229	335	31	LTF MEF2C ACVR2A PTGER4 CEBPA IL6R CLIC1 BMPR1A TP63 RUNX2 PRKD1
GO_MYD88_INDEPENDENT_TOLL_LIKE_RECEPTOR_SIGNALING_PATHWAY	0.587368792449502	0.905980522187275	0.220048761009549	0.924965813319698	6658	25	UBB IRF7 IRF3 CHUK BIRC2 UBC RIPK1 RPS27A BIRC3 IKBKB CD14 PRKCE TRAF3 IKBKE TANK UBE2D2 UBE2D1 TICAM1 UBA52 TNIP3 FADD TRAF6 TBK1 UBE2D3
GO_NEGATIVE_REGULATION_OF_SIGNAL_TRANSDUCTION_BY_P53_CLASS_MEDIATOR	0.990191531790567	1	-0.167972758631996	-0.478933456204509	85405	20	CD74
GO_POSITIVE_REGULATION_OF_LIPASE_ACTIVITY	0.179654607613583	0.492386702348338	-0.394608886345507	-1.23501300286645	16342	32	ABL2 ARHGAP6 RHOC RASGRP4 TXK PLCB2 CCL5 CAMK2B S1PR4 NR1H2 ESR1 FGFR1 GNAQ FLT1 PRKCZ NR1H3 GNA15 PDPK1 LMF1 ANG ARL1 PRKCE ARF4 PTAFR
GO_POSITIVE_REGULATION_OF_ERK1_AND_ERK2_CASCADE	0.459422325985	0.807919489612406	-0.292771113723939	-1.02076923971473	44472	68	CHI3L1 SLAMF1 CD74 ESR2 PDGFC SERPINF2 TIRAP GCNT2 HAVCR2 NOD1 EPOR PTEN CD36 NOD2 CCL5 SRC CCR1 SEMA7A RIPK2
GO_MITOCHONDRIAL_ATP_SYNTHESIS_COUPLED_PROTON_TRANSPORT	0.000248493508107101	0.00820339088270703	0.646709325828009	2.37128842376189	3	16	ATP5G3 ATP5F1 ATP5H ATP5B ATP5G1 ATP5J ATP5I ATP5J2 ATP5O STOML2
GO_PURINE_NUCLEOSIDE_MONOPHOSPHATE_BIOSYNTHETIC_PROCESS	0.000182515057492243	0.00820339088270703	0.462666652689704	2.29582511039852	0	48	PAICS IMPDH1 ATP5G3 ATP5F1 ATP5H ALDOA IMPDH2 ATP5B ATP5G1 ATP5J ADA CHCHD10 ATP5I GART ATIC ATP5O
GO_POSITIVE_REGULATION_OF_PEPTIDE_SECRETION	0.234333123338281	0.572696239131863	-0.357530051601042	-1.17496411884274	21945	43	HLA-DRB5 GABBR1 PTGER4 C2CD2L TCF7L2 HLA-DRB1 IRS2 PPARD PFKFB2 RAB8B TRPM2 PLA2G6 NLGN2 GPLD1 GHRL AACS BLK STX4 PFKM
GO_RESPONSE_TO_DEXAMETHASONE	0.686649550706033	0.959155866337092	-0.302918885998868	-0.853891471340414	58838	19	ESR2 DNMT3B FOXO1 SERPINF1 TGFB1 EP300
GO_STEROL_TRANSPORT	0.41801346226125	0.772552352830482	-0.357232922959645	-1.04914127403535	36701	23	MSR1 LCAT NPC1 CD36 SOAT1
GO_REGULATION_OF_CHROMOSOME_ORGANIZATION	0.0147058823529412	0.0844903178662769	0.192179686075464	1.2687969381942	0	226	CDCA5 HMGA1 CCT7 TRIM28 BUB1 SUPT6H CCT2 RNF20 MAP2K7 CDC6 CENPV WRAP53 PIH1D1 PAF1 DNMT1 PRKD2 CDC45 UHRF2 RNF40 PARP10 HNRNPU SMC5 CHEK1 TERF2 HNRNPA1 SET TCP1 NSMCE2 CTR9 ATAD2 DLGAP5 BECN1 PHF19 CCT6A MAD2L1 BRCA1 FBXO5 HNRNPC TTK PLK1 MECP2 ANAPC11 ESPL1 FLCN RAB1A BCOR DKC1 CTCF SMARCB1 CCT4 HIST1H1B MIER1 BUB3 SIN3A GORASP1 NSD1 ATR SPTY2D1 SFPQ AKAP8 RUVBL2 TADA3 TINF2 ERCC1 SPI1 CSNK2A1 BUB1B CCT3 UBE2C CSNK2A2 CCNB1 MAD2L2 CAMK2D MAPKAPK5 PHF1 CCT8
GO_REGULATION_OF_CELL_MATRIX_ADHESION	0.406127291434811	0.760461021411336	-0.311220350851253	-1.05293912391738	38681	53	S100A10 GSK3B ARHGAP6 PIK3R1 NF1 PTEN CDK6 DISC1 CD36 BCAS3 CCL28 CLASP1 SRC BCL2 PTPRJ
GO_VISUAL_BEHAVIOR	0.895865563552387	1	-0.223156917668001	-0.676429758039509	79912	27	ITGB1 NF1 HRH2 CTNS ATP1A3 NPHP1 NLGN3 NPHP4 SYNGAP1 DYNLRB1 RGS14
GO_LIPOSACCHARIDE_METABOLIC_PROCESS	0.98883322576349	1	-0.160459557606413	-0.569896856404758	96520	81	ARSG ST8SIA1 UGCG ALDH5A1 B3GNT5 GLTP CERK ST3GAL3
GO_REGULATION_OF_CELL_ADHESION	0.402054020540205	0.755126840608508	-0.264919908016097	-1.0287333856017	40204	370	HLA-DRB5 PTPN6 NCK1 ABL2 TNFRSF13C S100A10 ARHGDIB HLA-DMB SLAMF1 CD74 CD86 AIF1 SPINT2 ZBTB16 ITGB1 PTPRO ZC3H8 GSK3B PPARA AP1AR IL12A HLA-DPB1 PTGER4 CYP1B1 LYN SERPINF2 CD4 MAD1L1 LILRB1 ITGA5 TNFSF9 ARHGAP6 UNC13D GPAM GCNT2 RARA HLA-DRA BTLA PTGER3 ETS1 CD59 PIK3R1 CD2 PAK2 UBASH3B HAVCR2 NF1 SPN LILRB2 STAT5B HLA-DPA1 PTPRC PTEN BTN2A2 CDK6 DISC1 CD6 TGFB1 CD36 NRG1 DLG1 DHPS HLA-DRB1 IL12RB1 BCAS3 CD46 CD55 NOD2 DUSP22 NCKAP1L LAMA2 HLA-DQB1 HLA-DQA1 CCL5 RND1 LAX1 CCL28 MALT1 CLASP1 GLMN PRKCQ PLXNB2 SRC TRAF2 DSCAM KANK1 PPP1R12A BCL2 CDH1 RIPK2 CD40LG ADAM8 EGR3 LEF1 IL4R CD3G MAP2K5 SYK CD244 PTPRJ CYTH1 HLA-E DAB1
GO_INTRACELLULAR_LIPID_TRANSPORT	0.306330372119028	0.665069723862773	0.298658854239859	1.0950921154666	4930	16	ARV1 VPS4A COL4A3BP LDLRAP1 CPT1A
GO_NEGATIVE_REGULATION_OF_TELOMERE_MAINTENANCE	0.864652027103587	1	-0.237877189325761	-0.704916946952214	76308	24	TERF1 GNL3L ACD SRC TERF2IP SMG6 TNKS2 NAT10 TNKS ERCC4 ATM
GO_REGULATION_OF_ACTIN_FILAMENT_DEPOLYMERIZATION	0.957928252543794	1	-0.195830093032465	-0.580316051711747	84540	24	CAPG EPS8 MTPN SCIN VILL GSN TMOD2
GO_ENDOCRINE_SYSTEM_DEVELOPMENT	0.433137624790691	0.784823316222114	-0.31159029191552	-1.03728748282151	40869	47	CDKN1C HHEX IL6R BMPR1A TBX19 ETS1 NF1 BAK1 FOXO1 HOXB3 CDK6
GO_REGULATION_OF_MYELOID_LEUKOCYTE_DIFFERENTIATION	0.415051287635998	0.769769305390071	-0.302004671912934	-1.04571441243905	40017	64	LTF LYN LILRB1 RARA KLF10 PIK3R1 UBASH3B TYROBP NF1 FOXP1 OGT TMEM64 CCL5 ZBTB46 CCR1 CTNNBIP1 LEF1 RASSF2 MYC PTPN2 TOB2 CSF1 MITF TRAF6 MAFB FADD CAMK4 PRKCA
GO_HYDROGEN_PEROXIDE_METABOLIC_PROCESS	0.00584909339052447	0.0416948388550823	0.501341983308962	1.87287120167871	89	17	PARK7 SOD1 HBA1 HBB HBA2 PRDX1 PRDX2
GO_RESPONSE_TO_DSRNA	0.127885783718104	0.393004484847996	0.2551613379966	1.22936744566319	841	42	SLC3A2 NPM1 IFIT1 MB21D1 FLOT1 NFKBIA EIF2AK2 ZCCHC11 IRF3 DDX1 MRPL44 TARBP2 NFKB1
GO_REGULATION_OF_INTRINSIC_APOPTOTIC_SIGNALING_PATHWAY_BY_P53_CLASS_MEDIATOR	0.101571721438777	0.342584657541911	0.368862332698334	1.35250713814816	1634	16	UBB TRIAP1 TAF9B ZNF385A MIF TAF9 HNRNPK
GO_GLYCEROLIPID_CATABOLIC_PROCESS	0.307844738548747	0.667200045213546	-0.425669781659883	-1.13769068674097	25632	15	ABHD2 ABHD6 INPP5F
GO_POSITIVE_REGULATION_OF_ACTIN_FILAMENT_POLYMERIZATION	0.809158922329269	1	-0.237601750319073	-0.783383092806415	75924	44	NCK1 ACTR2 BAIAP2L1 CDC42EP4 ARPC4 DLG1 CTTN NCKAP1L HCK
GO_REGULATION_OF_STEROID_METABOLIC_PROCESS	0.995015009157211	1	-0.148378303325458	-0.476121152376205	91816	37	STAT5B VDR EPHX2 LAMTOR1 AKR1C3 RORA REST IL1B POR ABCG1 CYP27B1 ERLIN1 LMF1 SCP2
GO_STEROL_BIOSYNTHETIC_PROCESS	0.866524274853089	1	-0.229768442101481	-0.711020171667298	78299	30	MSMO1 MVD MVK NSDHL HSD17B7 CNBP HMGCS1 ACLY LBR GGPS1 TM7SF2
GO__DE_NOVO_PROTEIN_FOLDING	0.185189786916817	0.502347662457641	0.332467975959834	1.21905998750785	2980	16	HSPD1 CCT2 HSPE1 HSPA14 HSPH1 FKBP1A TOR1B
GO_REGULATION_OF_PHAGOCYTOSIS	0.960595276609511	1	-0.185212488299779	-0.599231868035096	89075	39	ABR CAMK1D PTEN TGFB1 CD36 NCKAP1L HCK SNX3 SYK ANO6 IL1B BLK FCER1G STAP1 PLD2 CSK AZU1 SPACA3
GO_DNA_INTEGRITY_CHECKPOINT	0.00125	0.0142746913580247	0.307415984410438	1.83872298550344	0	123	PRMT1 PCNA MAPKAPK2 RBM38 BABAM1 CDC6 UBB RAD17 CDKN1A CDT1 NPM1 CDC45 CLSPN BLM CENPJ CHEK1 CCNA2 TFDP2 FOXN3 TP73 PTPN11 TIPIN TRIAP1 BRCA1 CNOT10 PRKDC BRCC3 PLK1 E2F1 ZNF385A BRIP1 H2AFX CEP63 TP53BP1 CDK1 FBXO6 DTL UBC BAX RBBP8
GO_MEMBRANE_PROTEIN_PROTEOLYSIS	0.825037406483791	1	0.180006538241802	0.792627562577251	8270	29	RBMX CTSH RELA PSENEN MBTPS1 ADAM19 NFKB1 NCSTN MBTPS2 PARL APH1A
GO_TUBE_MORPHOGENESIS	0.737444571520295	0.986669487039551	-0.239690374791259	-0.896925561692219	73506	158	MTSS1 MEF2C FZD6 HHEX IFT52 FOXD1 RARA TP63 CELSR1 SHROOM3 CHD7 LMO4 SETD2 BAK1 VDR PSEN1 NIPBL MIB1 MICAL2 TGFB1 MKS1 DLG1 PTCH1 BCAS3 FZD3 MET EDA EYA1 ACVR2B GLMN GATA4 PLXNB2 SRC PRICKLE1 CTNNBIP1 BCL2 LEF1 AHI1 LIAS CCM2 SETDB2 SKI MYC KLHL3 ESR1 CSF1 DLG5 PAX8 MED12 TGFBR2 KAT2A ST14 SMAD2 TRAF6 PBX1 EPB41L5 RARG ADM HLX PRKACB VEGFA ACVR1 SMAD4 ARL13B NPHP3 VASP LAMA5 TCTN1 MED1 SPINT1 BBS7 BBS4 DVL3 SMAD3
GO_REGULATION_OF_EMBRYONIC_DEVELOPMENT	0.506445147679325	0.850540776683113	-0.295647358538688	-0.99274935089563	48010	50	PLCB1 BMPR1A CELSR1 NR2C2 NIPBL SEPT7 MKS1 LAMA2 FZD3 CLASP1 MAP2K5 NKD1 FGFR1 MAPK7 DUSP6 LFNG PRKACB RBM19 E4F1 NPHP3 KDM1A LAMA5 DVL3 TULP3 STK4 CLASP2 IL1RN MESP1 HES1 KLF4
GO_SENSORY_ORGAN_DEVELOPMENT	0.467650829260476	0.819121300536243	-0.268413241655223	-1.01497059931528	46693	191	CDKN1C ABR WDR19 VIM FZD6 CYP1B1 IFT140 MYH10 TSHZ1 ATP2B4 CEBPA RARA SDK1 MDM1 CELSR1 CHD7 HSF4 MPV17 NF1 BAK1 CRYGS PSEN1 NIPBL SLC4A7 SERPINF1 TGFB1 PKNOX1 MKS1 DLG1 PTPRM MAX RAB11FIP4 FZD3 ARL6 EYA1 CTNS ACVR2B RXRA GPD2 USH2A DSCAM EPHB1 BCL2 CDH23 LEF1 AHI1 CACNA1C SLC26A5 EPHB2 BMPR2 CCM2 AGTPBP1 NKD1 SKI NPHP1 RAB18 ROR2 FGFR1 SMARCD3 TGFBR1 PAX8 MAF TGFBR2 LIN7A NPHP4 RDH13
GO_POSITIVE_REGULATION_OF_MAP_KINASE_ACTIVITY	0.860400096895313	1	-0.217901187807905	-0.799495322126505	85244	117	ELANE CD74 MDFIC LRRK2 PDGFC FGD2 MAP3K9 PDCD10 PROK2 TAB2 NOD1 PSEN1 MAPK11 DUSP7 TGFB1 NOD2 TIAM1 CD40 SRC GRM4 TRAF2 TAOK3 TAB1 RIPK2 CD40LG ADAM8 MAP2K5 SYK GHRL MUL1 TLR6 ALK P2RX7 IL1B CD81 FGFR1 MAP3K4 FRS2 TRAF6 AXIN1 FLT1 IQGAP3 DUSP6 ERCC6 CSK MAPK14 S1PR2 VEGFA
GO_BONE_MORPHOGENESIS	0.0752537045849426	0.284411345213777	-0.443280578474657	-1.37173508303036	6799	30	LTF MEF2C CSGALNACT1 RARA RUNX2 NAB2 PEX7 TGFB1 BMPR2 PAPPA2 SKI
GO_CELL_PROJECTION_ORGANIZATION	0.206157938420616	0.534537051265787	-0.276398509888387	-1.08191863011809	20615	485	NCK1 TMEM231 RSPH1 GALNT11 SNX10 GPRIN1 MTSS1 ZNF280C WDR19 CNTNAP1 SPG11 AIF1 ITGB1 PTPRO B9D2 DMD LRRK2 OMG BBS9 ROBO1 UNC5D ABCC4 WASF1 NEDD4 RAP2A ANKRD27 GSK3B MARK4 MAP6 LINGO2 KIF27 CHL1 TNIK TRIM32 TMEM106B TTC21B LYN ACTR2 UBE2B FGD2 IFT140 DNAH9 MYH10 FGD3 IFT52 S100A6 SPAST EPHA5 CYFIP1 PIBF1 FOXD1 APBB2 CDK5R1 TMEM216 DYNC2LI1 CEP97 ULK2 KLF5 RAP2B ULK1 PTPRF PAK2 LRFN4 CCDC78 NCDN APC GNAO1 EPB41L3 ASAP1 SPAG16 ZSWIM6 RAPH1 PTEN E2F5 SEPT7 TTBK2 DISC1 C5orf42 NUMB C21orf2 MKS1 PTPRM CTTN TMEM237 ALCAM INPP5K FGD4 DOCK7 RPGR LAMA2 FZD3 SS18L1 ARL6 TTC17 UBE4B MTR TIAM1 CUL3 SIAH1 ABLIM1 PRKCQ KIAA0586 RXRA DLG4 PLXNB2 CAMK2B EGR2 SEMA7A RFX2 RAB8B DSCAM EPHB1 ZNF280D ICK JAM3 BCL2 CDH1 WDR35 CDH23 ZFYVE27 AHI1 RTN4 ARHGEF6 PLEKHA1 EPHB2 NLGN1 GHRL PAK4 SPAG6 DAB1 NCAM1 NRAS ZMYND10 P2RX7 KIF26B LST1 NPHP1 DNAAF2 NRXN1
GO_ISOPRENOID_BIOSYNTHETIC_PROCESS	0.615207802696155	0.917725665917497	0.243451744865966	0.892664263973873	9902	16	NUS1 PMVK PDSS2
GO_RETROGRADE_TRANSPORT_ENDOSOME_TO_GOLGI	0.843882431922125	1	-0.225356822398861	-0.76407823250934	80448	54	PIKFYVE VPS54 TBC1D17 VPS29 RGP1 TBC1D5 TBC1D14 SNX8 SGSM2 ARFRP1 VPS35 GOSR2
GO_MITOCHONDRIAL_GENOME_MAINTENANCE	0.720504142840472	0.978533806360223	-0.29344139663216	-0.82717558232192	61739	19	SLC25A4 POLG2 TYMP RRM2B OPA1 MEF2A POLG SLC25A36 PARP1 DNA2
GO_GLUCAN_BIOSYNTHETIC_PROCESS	0.0384543703795738	0.178520916442187	0.423275597636341	1.55202420105951	618	16	AKT1 UBB PGM1 GYG1 AKT2 UBC
GO_MRNA_CIS_SPLICING_VIA_SPLICEOSOME	0.00191204588910134	0.0184714615918406	0.578029855221087	2.07181984469159	31	15	SART1 SNRPC DCPS WBP11 SNRNP200 SFSWAP
GO_CYTOPLASMIC_SEQUESTERING_OF_PROTEIN	0.0105070808588397	0.065448146763816	0.356378490907894	1.62583417592929	91	33	AKT1 NFKBIB HK2 KDELR1 GPAA1 NFKBIA HSPA5 KEAP1 OS9 KDELR2 LATS1 FAF1 ANKRD13C
GO_REGULATION_OF_INFLAMMATORY_RESPONSE	0.053184860605817	0.225411207607701	-0.341846178973494	-1.27075655410197	5291	142	NT5E ABR CR1 CASP4 ELANE MEFV TLR10 CASP5 CX3CR1 PPARA PIK3AP1 NLRP1 PTGER4 TNFRSF1A LYN PTGS2 XIAP PTGER3 ETS1 CD59 BRD4 SPN STAT5B MVK FOXP1 CLOCK SERPINF1 CD6 CD46 CFP CD55 NOD2 F12 PPARD CCL5 HCK CDK19 NLRX1 TLR2 SEMA7A IL17RC ADAM8 CFH METRNL
GO_OLIGODENDROCYTE_DEVELOPMENT	0.396253619334633	0.748793866975558	-0.387809731623492	-1.06667380844682	33528	17	CD9 LYN PRDM8 PTEN TGFB1 EIF2B2 GSN MED12
GO_RESPONSE_TO_INTERFERON_GAMMA	0.954125615763547	1	-0.186114597704689	-0.657772290376223	92969	77	MEFV CD86 AIF1 TRIM62 JAK1 IRF9 IL12RB1 CCL5 HCK IRF5 CAMK2B KYNU IFNGR2 IRF2 MID1 NCAM1 CAMK2G XCL2 CXCL16
GO_PROTEIN_LOCALIZATION_TO_MITOCHONDRION	0.0800685602350637	0.293902453243785	0.243875491845018	1.25958470878386	326	58	HSP90AA1 TIMM44 AKT1 HK2 MTCH2 MOAP1 TOMM40 BAD NDUFA13 FBXO7 TIMM22 COX18 TOMM5 BAX BCL2L11 AIP
GO_NEGATIVE_REGULATION_OF_ENDOTHELIAL_CELL_PROLIFERATION	0.681103629104344	0.955022908126356	-0.315206058949721	-0.854984377009088	57147	16	KRIT1 PDCD10 NF1 PTPRM
GO_POSITIVE_REGULATION_OF_BLOOD_CIRCULATION	0.37952489309545	0.735975945730171	-0.343442268904009	-1.0748761178658	34524	32	ALOX5 ESR2 PTGS2 PTGER3 HMOX1 EPHX2 HRH2 PTPRM PPARD KAT2B NOS1AP PLA2G6 NOS3
GO_MICROTUBULE_BASED_MOVEMENT	0.941807676434173	1	-0.195422041413749	-0.722962016445752	93561	132	HTT WDR19 SPG11 AP3S2 KIF20A KIF27 DNAH11 TTC21B ACTR2 IFT140 KIF2A DNAH9 SPAST KIF13A
GO_SENSORY_ORGAN_MORPHOGENESIS	0.640120171849847	0.933115929668868	-0.260945621219207	-0.923471781209075	62428	78	ABR WDR19 FZD6 TSHZ1 SDK1 CELSR1 CHD7 NF1 BAK1 NIPBL PTPRM FZD3 ARL6 EYA1 DSCAM EPHB1 AHI1 EPHB2 AGTPBP1 NKD1 SKI ROR2 FGFR1 PAX8 RDH13 FRS2 MAFB AXIN1 ITGA8 RARG VEGFA
GO_PROTEIN_DNA_COMPLEX_SUBUNIT_ORGANIZATION	0.0989010989010989	0.339347141077038	0.186509246585443	1.15542887823462	26	165	CHAF1A HMGA1 ANP32B TAF11 CENPV CABIN1 UBB PAF1 ERCC3 NPM1 CDC45 H1FX NAP1L4 DDB1 MCM2 BRD2 RPA1 SET HJURP NASP HIST1H1C RNF8 MIS18A OIP5 CENPN SMARCA5 RAD51C CENPM HIST1H4C HMGB2 CHAF1B TSPYL2 H2AFX CTCF KAT6B SMARCC1 UBC HIST1H1B ARID2 MED6
GO_REGULATION_OF_ACTIN_FILAMENT_BASED_MOVEMENT	0.203156150169337	0.529350532131371	-0.461046440284694	-1.23224213666659	16915	15	JUP PTGER3 GATA4 NOS1AP CACNA1C SUMO1 ANK2
GO_CHROMATIN_SILENCING	0.387984797261827	0.744576633749357	-0.314396538196554	-1.0636849890628	36953	53	HIST1H2AD HIST2H2AB HIST1H4E UBE2B SIRT2 HIST1H2AH MBD3 SIRT4 HIST1H2AG SIRT5 BEND3 H3F3A HIST1H4H BAHD1 MBD2
GO_LOCOMOTORY_BEHAVIOR	0.429561938514794	0.782174789618474	-0.296172771526017	-1.03777034280531	41694	71	NAV2 FIG4 NTAN1 LRRK2 CHL1 ANKH EPS8 CELSR1 CHD7 GNAO1 NPC1 PTEN NRG1 CTNS DLG4 OLFM2 DSCAM CDH23 NLGN2 DAB1 ATP1A3 GMFB DNM1
GO_REGULATION_OF_PROTEIN_LOCALIZATION_TO_NUCLEUS	0.105263157894737	0.350877192982456	0.189610878585934	1.15865931766358	47	146	GAS6 HSP90AA1 PARK7 AKT1 CCT7 TRIM28 NUTF2 CCT2 HNRNPM NFKBIB PIN1 BCL3 RHOA CD27 CDKN1A PARP10 TXN TCP1 PRDX1 NFKBIA MBTPS1 KEAP1 CCT6A BRCA1
GO_NUCLEUS_ORGANIZATION	0.028971028971029	0.14349773385918	0.215823873591	1.27433447534031	28	113	CHMP7 NUP188 CHMP3 NSFL1C TOR1AIP1 PPP2R2A POM121 PPP2R1A SYNE2 NUP50 AGFG1 PPP2CA NUP133 CHMP1B CHMP4A CCNB2 VPS4A RPS19 PLK1 HMGB2 SRPK1 USPL1 CEP55 RAE1 HIPK2 NOLC1 TARDBP CDK1 NUP155 TOR1B ANKLE2 VRK1 PSME4 LEMD2 LMNA CHMP5 NUMA1 NUP93 ZMPSTE24 NUP85 CCNB1 NUP37 CHMP2A PES1 NUP153
GO_REGULATION_OF_SEQUENCE_SPECIFIC_DNA_BINDING_TRANSCRIPTION_FACTOR_ACTIVITY	0.82546193015276	1	-0.228399093010828	-0.873762436466033	82513	246	LTF MED13 TRIM62 FZD6 COMMD6 ANXA4 ESR2 TRIM32 JUP CYP1B1 EPHA5 TIRAP BTK IL6R RPS6KA4 HMOX1 TCF7L2 TAB2 CAMK1D HAVCR2 NOD1 NLRC4 PRKCB PTEN MAPK11 MAVS PPP3CA PRKD1 CLOCK ANXA3 SAV1 TGFB1 PTCH1 PSMD10 NOD2 MTPN HCK MAPK8 EDA MALT1 RNF41 TLR2 PRKCQ CD40 TRAF2 ITGB2 EP300 CTNNBIP1 TAB1 RIPK2 CD40LG ADAM8 HSPA1B PPP2R5B MAP2K5 SYK DDIT3 NLRC3 TRAPPC9 TRIM37 HDAC5 SUMO1 HSPA1A ALK AIM2 PSMA6 THRA ESR1
GO_RETINA_HOMEOSTASIS	0.631399580897761	0.928159892459959	-0.290338085145554	-0.903838161159109	57248	31	LTF IGKC LYZ CIB2 USH2A CDH23 CDH3 SPATA7 HSPB1 NPHP4 BBS12 IQCB1 ERCC6 NPHP3 DRAM2 BBS4 CROCC
